deck_num,pretty_url,deck_name,cover_card,userid,format,main_deck,extra_deck,side_deck,ts_submit_date,submit_date,ts_edit_date,edit_date,comments,deck_excerpt,deck_description
285675,zombie-285675,Zombie,38192988,17793,Non-Meta Decks,"[""45154513"",""39185163"",""39185163"",""36016907"",""36016907"",""76352503"",""76352503"",""66570171"",""66570171"",""66570171"",""52467217"",""52467217"",""52467217"",""92826944"",""92826944"",""92826944"",""94801854"",""94801854"",""94801854"",""49959355"",""49959355"",""49959355"",""14558128"",""14558128"",""14558128"",""18760514"",""92964816"",""92964816"",""1845204"",""63854005"",""63854005"",""81439173"",""83764719"",""24224830"",""4064256"",""4064256"",""4064256"",""10045474"",""10045474"",""10045474""]","[""56907389"",""3544583"",""84815190"",""38192988"",""3040496"",""27548199"",""65187687"",""91575236"",""50091196"",""86066372"",""38342335"",""37129797"",""37129797"",""50588353"",""41999284""]","[""27204311"",""27204311"",""87170768"",""87170768"",""94145021"",""94145021"",""94145021"",""43898403"",""43898403"",""43898403"",""83326048"",""83326048"",""83326048"",""15693423"",""15693423""]",1655231905,9 months ago,,,0,Zombie,Zombie
285679,skystriker-enforcer-285679,SkyStriker Enforcer,26077387,24573,Non-Meta Decks,"[""27204311"",""81866673"",""63362460"",""26077387"",""26077387"",""26077387"",""37351133"",""37351133"",""14558127"",""14558127"",""14558127"",""24508238"",""24508238"",""97268402"",""97268402"",""97268402"",""24010609"",""50005218"",""35726888"",""35726888"",""35726888"",""52947044"",""52947044"",""14532163"",""14532163"",""73594093"",""67169062"",""32807846"",""99550630"",""25955749"",""63166095"",""73628505"",""70368879"",""25789292"",""25789292"",""52340444"",""51227866"",""98338152"",""98338152"",""98338152""]","[""60461804"",""86066372"",""8264361"",""45819647"",""50588353"",""8491308"",""8491308"",""63288573"",""63288573"",""63288573"",""12421694"",""90673288"",""90673288"",""90673288"",""75147529""]","[""27204311"",""27204311"",""87170768"",""87170768"",""94145021"",""94145021"",""94145021"",""43898403"",""43898403"",""43898403"",""83326048"",""83326048"",""83326048"",""15693423"",""15693423""]",1655231905,9 months ago,,,0,Skystriker. Use the force Raye. Engage and destroy. ,"Hello everyone and welcome to my Skystriker Enforcer deck profile.  With Skystriker winning YCS Hartford with a Mystic Mine/D-Barrier variant of the deck, uptake for that particular build is no doubt going to skyrocket. With that in mind I'm opting to play a more grindy Enforcer build. The deck is solid against the rest of the meta, but is also able to laugh in the face of the mine/barrier mirror match.  3 Raye and 2 Roze is still the correct ratio. Once Linkage makes its way into the TCG Roze can be cut to 1, but with 1 Drones, Area Zero and Multirole that's roughly 7 ways to get into your Ace monsters and that's good enough for me.  Handtrap wise 3 Ash and Veiler are used, as well as 2 D.D Crow and 1 Nibiru. The deck has enough in built monster negation with Widow Anchor so I fell adding imperm is somewhat unnecessary but Veiler is due to it being required for the Accesscode Talker package. 2 D.D. Crow is really good against a lot of meta, hitting Tenyi's, Fusion materials in the grave when Albion is summoned in Branded, banishes Eldlich itself and the Golden Land traps, as well as ridding the mirror of Engage/Raye.  1 Engage, 3 Widow Anchor, 1 Multirole, 1 Hornet Drones and 1 Afterburner are fairly standard so no more needs to be said there. Where my build does differ is the inclusion of 1 Jamming Wave over 1 copy of Shark Cannon (which is usually played at 2). My reasoning behind this is I wanted an additional something to force lone backrow such as Dreaming Town or Branded fusion cards to activate prematurely, and also Shark Cannon has no utility against Floowandereeze. Waves is also decent against the mirror too.  The draw engine consists of 3 Foolish Burial Goods, 1 Metalfoes Fusion, 1 Upstart and 1 Avarice. While desires was OK with Engage at 3, it isn't great with it at 1. This build also plays a fair few important 1 of that I cannot afford to be banished. Pot Of Prosperity takes a lot of the grind game away for my liking. You either permanently lose the ability to go into the accescode engine, DPE or you lose ace monsters that could be very important if you do end up in a grind game with a lot of attrition. My view is Striker needs to retain it's extra deck to remain flexible enough for any opportunities to close the game. Goods is amazing as it puts 2 spelks in thd grave, and looping metalfoes with it for additional draws is always great. Avarice is a key card as you can recycle the Striker links, the DPE engine and the handtraps, as well as draw into 2 cards.  Lightning Storm and Forbidden Chalice are additional board breaker cards. The ED is pretty much standard. Skystriker engine links, DPE, Accescode package and Dhrac. Dhrac being a spellcaster means you don't have use up what could be a precious Effect Veiler to go into the Accesscode package, plus bringing back opposing Raye, DPE, or any dark monster with a powerful effect is too good to pass up.  3 Droll in the side mainly for Floowandereeze but does also impact any deck that searches quite often too. 2 Nib for combo, 2 Contact ""C"" is really strong this format. Sunlavon typically struggle to play around it, ABC Therion is forced to play IP early to get rid of it, this makes the unable to use platinum gadget, which at the very least makes it difficult to get ABC on the field. And of course shuts off Branded Despia unless they're playing Sprind in the ED or can poly into Chimera. 3 Twin Twisters and 2 Evenly Matched for backrow and 3 D-Barrier for going 1st against Branded and Swordsoul.  &nbsp;  &nbsp;  &nbsp;  &nbsp;  &nbsp;"
285683,kragen-shark-control-285683,Kragen Shark Control,90809975,105495,Non-Meta Decks,"[""6625096"",""6625096"",""7150545"",""7150545"",""7150545"",""11845050"",""70156946"",""70156946"",""43138260"",""43138260"",""43138260"",""90303176"",""90303176"",""90303176"",""31059809"",""31059809"",""31059809"",""94145021"",""94145021"",""14558127"",""14558127"",""94145021"",""14558127"",""97268402"",""97268402"",""19885332"",""19885332"",""19885332"",""63854005"",""1845204"",""63854005"",""24224830"",""35261759"",""18144507"",""10045474"",""10045474"",""10045474"",""53334471"",""53334471"",""53334471""]","[""440556"",""440556"",""90809975"",""90809975"",""67557908"",""67557908"",""94942656"",""94942656"",""26973555"",""74393852"",""65305468"",""41375811"",""90448279"",""80516007"",""21044178""]","[""48130397"",""48130397"",""48130397"",""41209827"",""49161188"",""15693423"",""15693423"",""15693423"",""58921041"",""58921041"",""58921041"",""78661338"",""78661338"",""25311006"",""25311006""]",1655231905,9 months ago,,,0,Kragen Shark ! Gozen too strong ,https://youtu.be/ufqX_SBN2hw
285687,rose-285687,Rose,81146288,70704,Non-Meta Decks,"[""13903402"",""13903402"",""13903402"",""81146288"",""33491462"",""33491462"",""44451698"",""96385345"",""96385345"",""96385345"",""12213463"",""12213463"",""12213463"",""93708824"",""93708824"",""58062306"",""26118970"",""29177818"",""48686504"",""48686504"",""48686504"",""89252157"",""84335863"",""84335863"",""84335863"",""4031928"",""81439173"",""1845204"",""83764719"",""80196387"",""80196387"",""80196387"",""73628505"",""69167267"",""69167267"",""69167267"",""53503015"",""53503015"",""99092624"",""74003290""]","[""63519819"",""70980824"",""40139997"",""52687916"",""73580471"",""33698022"",""72924435"",""9349094"",""95239444"",""19684740"",""72218246"",""72218246""]","[""10000080"",""10000080"",""10000080"",""59438930"",""59438930"",""59438930"",""24508238"",""24508238"",""24508238"",""54693926"",""54693926"",""54693926""]",1655231905,9 months ago,,,0,....,Write your deck strategy here......
285697,despia-thunderdragon-updated-godlike-version-285697,Despia ThunderDragon - updated GODLIKE version,15291624,109936,Master Duel Decks,"[""27204311"",""48770333"",""99456344"",""55878038"",""25451383"",""90488465"",""29596581"",""29596581"",""81866673"",""83107873"",""31786629"",""31786629"",""31786629"",""56713174"",""56713174"",""56713174"",""55623480"",""61901281"",""53871273"",""62962630"",""62962630"",""62962630"",""68468459"",""68468459"",""15381421"",""15381421"",""99234526"",""63362460"",""14558127"",""14558127"",""14558127"",""23434538"",""23434538"",""23434538"",""36577931"",""36577931"",""36577931"",""99543666"",""1475311"",""1475311"",""1475311"",""34995106"",""99266988"",""99266988"",""99266988"",""81439173"",""52947044"",""52947044"",""75500286"",""11110587"",""11110587"",""11110587"",""95238394"",""95238394"",""82738008"",""36637374"",""36637374"",""36637374"",""24224830"",""24224830""]","[""18666161"",""41685633"",""41685633"",""92892239"",""41209827"",""15291624"",""72272462"",""72272462"",""41373230"",""60461804"",""87746184"",""6855503"",""73539069"",""70369116"",""24361622""]","[""10000080"",""10000080"",""10000080"",""59438930"",""59438930"",""59438930"",""24508238"",""24508238"",""24508238"",""54693926"",""54693926"",""54693926""]",1655231905,9 months ago,,,0,Play this deck if you want to win while playing a non meta deck. Seriously good and consistent. ,"  <strong>Watch here and see how the deck is played and deck analysis </strong>  This deck really feels so good, barely brick, most hands feel very good. Anytime you grass looks greener you feel like you can't lose the game at that point. I really was impressed with how strong the deck ended up being and I think you should give it a try. This is an update to my old Thunderdragon deck I had made, this deck puts that list to shame."
285703,mathmech-deck-285703,Pure Mathmech,36521307,17954,Non-Meta Decks,"[""36521307"",""36521307"",""36521307"",""17946349"",""17946349"",""17946349"",""53577438"",""27182739"",""27182739"",""80965043"",""80965043"",""80965043"",""16360142"",""16360142"",""16360142"",""52354896"",""14558127"",""14558127"",""14558127"",""97268402"",""97268402"",""97268402"",""57160136"",""57160136"",""57160136"",""81439174"",""14025912"",""35261759"",""35261759"",""25311006"",""25311006"",""24224830"",""65681983"",""65681983"",""14393464"",""10045474"",""10045474"",""10045474"",""87804365"",""87804365""]","[""42632209"",""42632209"",""15248594"",""61399402"",""85692042"",""85692042"",""88021907"",""88021907"",""86066372"",""86066372"",""46947713"",""46947713"",""88093706"",""59859086"",""59859086""]","[""10000080"",""10000080"",""10000080"",""59438930"",""59438930"",""59438930"",""24508238"",""24508238"",""24508238"",""54693926"",""54693926"",""54693926""]",1655231905,9 months ago,1668191905,4 months ago,0,"A pure Mathmech deck. No @ignister, no problem","<p>This is a Mathmech deck. &nbsp;If you have any advice on how to improve this deck, feel free to leave a comment!</p>"
285707,exosister-post-pote-06-22-version-285707,Exosister post-POTE 06.22 version,42741437,112205,Non-Meta Decks,"[""37343995"",""37343995"",""37343995"",""16474916"",""16474916"",""16474916"",""79858629"",""43863925"",""43863925"",""43863925"",""5352328"",""5352328"",""77913594"",""77913594"",""77913594"",""4408198"",""197042"",""197042"",""77891946"",""77891946"",""36099130"",""14558127"",""14558127"",""14558127"",""91800273"",""91800273"",""91800273"",""10045474"",""10045474"",""10045474"",""97268402"",""94145021"",""65681983"",""65681983"",""27204311"",""25789292"",""25789292"",""24224830"",""89558743"",""70368879""]","[""59242457"",""59242457"",""42741437"",""42741437"",""42741437"",""78135071"",""78135071"",""41524885"",""5530780"",""8660395"",""90448279"",""82633039"",""9839945"",""45819647"",""86066372""]","[""94145021"",""94145021"",""24508238"",""24508238"",""54693926"",""54693926"",""54693926"",""25789292"",""8267140"",""43898403"",""23002292"",""83326048"",""83326048"",""41420027"",""41420027""]",1655231905,9 months ago,,,0,Exosister post-POTE new version : using Dimension Shifter,"Hi ! New version of the deck after a lot of testing (old version : <a rel=""nofollow"" href=""https://ygoprodeck.com/exosisters-post-pote/"">https://ygoprodeck.com/exosisters-post-pote/</a>)  This version doesn't contain Pot of Prosperity or Forbidden Droplet, too expansive lol  3 Shifter because ""any deck that can play Shifter should play Shifter""  Castel, Droll &amp; Lock and Judgment : for damn Floowandereeze (worst match-up I think)  &nbsp;  &nbsp;"
285715,f-a-deck-2022-285715,F.A deck 2022,39838559,10628,Non-Meta Decks,"[""6764709"",""93449450"",""93449450"",""93449450"",""49655592"",""49655592"",""67045745"",""67045745"",""14558127"",""14558127"",""14558127"",""39271553"",""39271553"",""40450317"",""40450317"",""73628505"",""5318639"",""5318639"",""24224830"",""38459905"",""38459905"",""38459905"",""38532954"",""49936169"",""49936169"",""1061200"",""1061200"",""1061200"",""2144946"",""12931061"",""12931061"",""12931061"",""39838559"",""10045474"",""10045474"",""48636108"",""89208725"",""5641251"",""63881033"",""69452756""]","[""75676192"",""75676192"",""33158448"",""33158448"",""33158448"",""98558751"",""86066372"",""4280259"",""38342335"",""2857636"",""75452921"",""50588353"",""37414347"",""37414347"",""37414347""]","[""75059201"",""84211599"",""84211599"",""84211599"",""38532954"",""38532954"",""43898403"",""43898403"",""43898403"",""49936169"",""66322203"",""66322203"",""66322203"",""32036866"",""63881033""]",1655231905,9 months ago,,,0,F.A deck by YGO Lite,https://youtu.be/jqbjl1MZzRU
285722,swordsoul-tenyi-standard-285722,Swordsoul-Tenyi - Standard,69248256,63827,Non-Meta Decks,"[""87052196"",""87052196"",""87052196"",""23431858"",""23431858"",""23431858"",""93490856"",""93490856"",""93490856"",""56495147"",""56495147"",""20001443"",""20001443"",""20001443"",""55273560"",""55273560"",""14558127"",""14558127"",""14558127"",""97268402"",""97268402"",""97268402"",""98159737"",""98159737"",""98159737"",""18144507"",""35261759"",""35261759"",""56465981"",""56465981"",""56465981"",""65124425"",""65124425"",""65124425"",""24224830"",""25789292"",""25789292"",""10045474"",""10045474"",""14821890""]","[""96633955"",""84815190"",""47710198"",""19048328"",""9464441"",""5041348"",""69248256"",""69248256"",""83755611"",""83755611"",""43202238"",""78917791"",""32519092"",""32519092"",""32519092""]","[""43534808"",""43534808"",""43534808"",""27204311"",""27204311"",""27204311"",""43898403"",""43898403"",""43898403"",""48130397"",""48130397"",""48130397"",""83326048"",""83326048"",""83326048""]",1655231905,9 months ago,,,0,Standard Swordsoul-Tenyi deck as a starting base for newer players to the archetype.,Standard Swordsoul-Tenyi deck as a starting base for newer players to the archetype.
285727,f-a-speeeeeeeeeeeeeeeed-285727,F.A. Speeeeeeeeeeeeeeeed,75676192,116199,Non-Meta Decks,"[""93449450"",""93449450"",""93449450"",""39271553"",""39271553"",""39271553"",""49655592"",""49655592"",""49655592"",""67045745"",""6764709"",""6764709"",""1061200"",""1061200"",""1061200"",""2144946"",""2144946"",""2144946"",""39838559"",""39838559"",""12931061"",""12931061"",""12931061"",""66322203"",""66322203"",""66322203"",""38459905"",""38459905"",""38459905"",""73628505"",""84211599"",""84211599"",""84211599"",""38532954"",""38532954"",""23171610"",""14558127"",""14558127"",""59438931"",""27204311""]","[""33158448"",""33158448"",""75676192"",""75676192"",""82044279"",""82044280"",""92519087"",""66698383"",""3322931"",""37414347"",""37414347"",""90512490"",""41999284"",""58069384"",""10443957""]","[""43534808"",""43534808"",""43534808"",""27204311"",""27204311"",""27204311"",""43898403"",""43898403"",""43898403"",""48130397"",""48130397"",""48130397"",""83326048"",""83326048"",""83326048""]",1655231905,9 months ago,,,0,They go speeeeeeeeeeeeeeeeeeeeeeeeeeeeeeeeeeeeeeeeeeeed,"Combos going first=  Any F.A. Monster + U.A. Hyper Stadium: NS the Monster - acc Stadium, add Navigator - acc the effect to gain a lvl - SS Navigator, add ""City Grand Prix"" - acc Grand Prix, do NOT acc the effect to gain a lvl - synchro into either Motorhome, Shenshen or Stellar Wind  Hang on Mach + U.A. Hyper Stadium: NS Mach - acc Stadium, add Navigator - acc the effect to gain a lvl - SS Navigator, add ""City Grand Prix"" - link Navigator into Linkuriboh - acc Grand Prix - acc the effect to gain a lvl  Combos going second:  ...No more speed...Try using Circuit Grand Prix and Downforce I guess..."
285731,libromancer-dpe-may-banlist-285731,Libromancer DPE - May Banlist,16312943,114738,Fun/Casual Decks,"[""16312943"",""16312943"",""16312943"",""46123974"",""46123974"",""46123974"",""19516687"",""19516687"",""82128978"",""14558127"",""14558127"",""14558127"",""95492061"",""95492061"",""95492061"",""63362460"",""81866673"",""77235086"",""77235086"",""52707042"",""71406430"",""71406430"",""18890039"",""18890039"",""18890039"",""73628505"",""67723438"",""67723438"",""67723438"",""52947044"",""52947044"",""24224830"",""25311006"",""25311006"",""25311006"",""10045474"",""10045474"",""10045474"",""88083109"",""44889144""]","[""50277355"",""48815792"",""65741786"",""2857636"",""38342335"",""4280258"",""86066372"",""90590303"",""21044178"",""6983839"",""41375811"",""74393852"",""90448279"",""60461804"",""41209827""]","[""43534808"",""43534808"",""43534808"",""27204311"",""27204311"",""27204311"",""43898403"",""43898403"",""43898403"",""48130397"",""48130397"",""48130397"",""83326048"",""83326048"",""83326048""]",1655231905,9 months ago,,,0,Libromancer DPE,Libromancer a good rogue deck... i think
285740,shiranui-285740,Shiranui,49959355,98441,Fun/Casual Decks,"[""35818851"",""35818851"",""52467217"",""52467217"",""92826944"",""92826944"",""92826944"",""41562624"",""41562624"",""41562624"",""99423156"",""99423156"",""99423156"",""94801854"",""94801854"",""94801854"",""49959355"",""49959355"",""49959355"",""79783880"",""79783880"",""79783880"",""36630403"",""36630403"",""5177985"",""13965201"",""13965201"",""13965201"",""40364916"",""40364916"",""40364916"",""40005099"",""4333086"",""4333086"",""4333086"",""10045474"",""10045474"",""10045474"",""74798297"",""74798297""]","[""59843383"",""38192988"",""83283063"",""83283063"",""65187687"",""28240337"",""52711246"",""52711246"",""57288064"",""57288064"",""91575236"",""26326541"",""86926989"",""86926989"",""50588353""]","[""82385847"",""97268402"",""97268402"",""4031928"",""14532163"",""14532163"",""14532163"",""18144507"",""37520316"",""8267140"",""83326048"",""83326048"",""83326048"",""23002292"",""40605147""]",1655231905,9 months ago,,,0,"Shiranui deck, just for fun",Non-competitive Shiranui deck
285746,punk-therions-285746,Punk Therions,83610035,35102,Non-Meta Decks,"[""10604644"",""10604644"",""81914447"",""81914447"",""81914447"",""83610035"",""83610035"",""83610035"",""55920742"",""55920742"",""55920742"",""57111330"",""84332527"",""21727231"",""6609736"",""19535693"",""19535693"",""19535693"",""14558127"",""14558127"",""14558127"",""33420078"",""21887075"",""21887075"",""21887075"",""57285770"",""57285770"",""8267140"",""8267140"",""24224830"",""67723438"",""67723438"",""67723438"",""84792926"",""84792926"",""84792926"",""10045474"",""10045474"",""10045474"",""43270827""]","[""62242678"",""60465049"",""44708154"",""40139997"",""3040496"",""50091196"",""90448279"",""73082255"",""63767246"",""64245689"",""86066372"",""4280259"",""38342335"",""45819647"",""50588353""]","[""82385847"",""97268402"",""97268402"",""4031928"",""14532163"",""14532163"",""14532163"",""18144507"",""37520316"",""8267140"",""83326048"",""83326048"",""83326048"",""23002292"",""40605147""]",1655231905,9 months ago,,,0,Punk Therion Deck,Punk Therion Deck
285750,gogiga-gagagigo-gagagigo-gogiga-gagagigo-deck-285750,"gogiga gagagigo,gagagigo,gogiga gagagigo deck",9053187,25969,Non-Meta Decks,"[""39674352"",""39674352"",""39674352"",""43793530"",""43793530"",""43793530"",""49003308"",""49003308"",""49003308"",""23931679"",""23931679"",""43797906"",""43797906"",""43797906"",""95824983"",""95824983"",""95824983"",""69436288"",""57511992"",""57511992"",""57511992"",""22819092"",""22819092"",""22819092"",""58203736"",""58203736"",""58203736"",""295517"",""295517"",""295517"",""34293667"",""34293667"",""34293667"",""62487836"",""62487836"",""95602345"",""95602345"",""95602345"",""19089195"",""19089195""]","[""9053187"",""440556"",""440556"",""48739166"",""67557908"",""67557908"",""94942656"",""94942656"",""21044178"",""31320433"",""68836428"",""90809975"",""79130389"",""73309655"",""65170459""]","[""53776525"",""74426895"",""14532163"",""14532163"",""14532163"",""18144506"",""15693423"",""15693423"",""15693423"",""35035481"",""35035481"",""70342110"",""70342110"",""70342110"",""19089195""]",1655231905,9 months ago,,,0,https://youtu.be/nlvW-I7ktZ8,https://youtu.be/nlvW-I7ktZ8
285755,hero-deck-285755,Hero Deck,58554959,116449,Non-Meta Decks,"[""14124483"",""13650422"",""52077741"",""94820406"",""94820406"",""37742478"",""83764719"",""87819421"",""84536654"",""12071500"",""18807109"",""39537362"",""58554959"",""55144522"",""22020907"",""60306104"",""72989439"",""14315573"",""60417395"",""59616123"",""63060238"",""80908502"",""32807846"",""213326"",""40044918"",""89943723"",""6498706"",""22020907"",""37412656"",""24268052"",""57496978"",""56120475"",""58932615"",""50720316"",""50304345"",""57116033"",""57116034"",""93600443"",""24094653"",""20721928"",""43250041"",""37195861"",""98266377"",""84327329"",""79979666"",""21844576"",""42703248"",""58554959"",""43452193"",""45906428"",""95943058"",""54959865"",""44095762"",""30312361"",""59793705"",""75434695"",""86188410"",""54283059"",""95281259"",""82697428""]","[""86676862"",""86165817"",""40854197"",""21947653"",""23204029"",""29343734"",""59642500"",""50282757"",""22160245"",""1945387"",""95486586"",""60493189"",""50608164"",""3642509"",""13293158""]","[""61204971"",""35809262"",""81197327"",""74711057"",""41436536"",""52031567"",""55615891"",""22093873"",""58481572"",""47737087"",""62624486"",""22061412"",""89870349"",""14225239""]",1655231905,9 months ago,,,0,Just my Hero themed deck,Just my Hero themed deck
285759,speedroid-trinity-starter-deck-285759,Speedroid Trinity Starter Deck,81275020,89708,Trinity Format Decks,"[""21830679"",""20050865"",""52038441"",""59438930"",""1980574"",""72291078"",""67922702"",""34242278"",""14761450"",""71175527"",""19636995"",""96945958"",""59640711"",""53054833"",""50482813"",""17328157"",""96708940"",""16725505"",""53932291"",""81275020"",""81275020"",""81275020"",""86976918"",""8736823"",""86395581"",""24224830"",""67723438"",""81439173"",""27243130"",""34559295"",""88204302"",""36730805"",""29114773"",""12148078"",""43898403"",""29401950"",""78474168"",""10045474"",""38761908"",""85704698"",""93138457"",""58543073"",""35817848"",""23924608"",""67037924""]","[""90036274"",""50954680"",""63261835"",""33158448"",""42110604"",""23361526"",""21516908"",""5772618"",""87188910"",""84664085"",""68431965"",""64880894"",""98506199"",""50588353"",""72813401""]","[""34710660"",""69550259"",""70939418"",""62899696"",""89326990"",""27660735"",""25789292"",""58464739"",""74892653"",""3322931"",""35252119"",""4280258"",""49105782"",""44097050"",""30674956""]",1655231905,9 months ago,,,0,https://trinityygo.wixsite.com/trinityygo/starter-decks,Decklist by LiquidLoan  https://trinityygo.wixsite.com/trinityygo/starter-decks
285763,elemental-hero-285763,Elemental Hero,90050480,33962,Non-Meta Decks,"[""89943723"",""13256226"",""9411399"",""9411399"",""18094166"",""18094166"",""18094166"",""40044919"",""40044919"",""59392529"",""50720316"",""50720316"",""27780618"",""27780618"",""16605586"",""22865492"",""22865492"",""43237273"",""80344569"",""17955766"",""14088859"",""14088859"",""14088859"",""24094653"",""45906428"",""16169772"",""16169772"",""16169772"",""21143940"",""21143940"",""21143940"",""24299458"",""24299458"",""32807846"",""52947044"",""52947044"",""8949584"",""8949584"",""8949584"",""75047173""]","[""90050480"",""32828466"",""40080312"",""56733747"",""60461804"",""40854197"",""55171412"",""22908820"",""58481572"",""35809262"",""89870349"",""63813056"",""1948619"",""19324993"",""58004362""]","[""59438930"",""59438930"",""59438930"",""87188910"",""14532163"",""14532163"",""14532163"",""15693423"",""15693423"",""15693423"",""5851097"",""23002292"",""41420027"",""41420027"",""41420027""]",1655231905,9 months ago,,,0,Fitting deck for pride month,Write your deck strategy here....
