deck_num,pretty_url,deck_name,cover_card,userid,format,main_deck,extra_deck,side_deck,ts_submit_date,submit_date,ts_edit_date,edit_date,comments,deck_excerpt,deck_description
181662,73-win-eldlich-balerdroch-dragoon-f-a-dawn-dragster-181662,"73% Win, Eldlich, Balerdroch, Dragoon, F.A Dawn Dragster",39185163,65493,Meta Decks,"[""36996508"",""74677426"",""95440946"",""95440946"",""39185163"",""39185163"",""82385847"",""66570171"",""66570171"",""92826944"",""92826944"",""52467217"",""94801854"",""94801854"",""18789533"",""49959355"",""49959355"",""14558128"",""14558127"",""92964816"",""92964816"",""1845204"",""2295440"",""18144506"",""58577036"",""73628505"",""81439173"",""83764719"",""84211599"",""6172122"",""48130397"",""94224458"",""31434645"",""31434645"",""4064256"",""4064256"",""20612097"",""20612097"",""93191801"",""20590515"",""20590515""]","[""8198620"",""41209827"",""63519819"",""37818794"",""96334243"",""50091196"",""33158448"",""63410069"",""74997493"",""86066372"",""37129797"",""91420202"",""50588353"",""70369116"",""41999284""]","[""34267821"",""34267821"",""34267821"",""94145021"",""94145021"",""27107590"",""54693926"",""54693926"",""23924608"",""23924608"",""23924608""]",1647023905,1 year ago,,,2,"Featuring Dragoon, Eldlich, Balerdroch, Halqifibrax, Formula Synchron, Desert Locusts and F.A. Dawn Dragster","Main goal is getitng banshee in the graveyard while getting a tuner and another monster on the board to go into halqifibrax, into blossom, into linkuriboh into Balerdroch into Vampire Sucker on the first turn.  Optimally your first turn board will be Halqifibrax, Eldlich with conquistador set, Dragoon, ,Zombie world, with Vampire Sucker and balerdroch in the graveyard.  You go into Desert Locusts with Halqifibrax during your opponents main phase to make them discard a card then, if you get a level one on the board like dotscaper or millennium eyes restrict you can go into a spell/trap effect negate with the level 7 or if you use a Golden land you can go into the level 11 synchro with Halqifibrax which is alright.  Sometimes its better to have more monsters on the field then go into the synchro for Saryuja combos which will help to return the Red-eyes black dragon or dark magician back to the deck.  Extra deck is really tight the synchro set-up is all you can ask for from Halqifibrax, into Formula synchron (can miss the timing) or desert locust into the level 7.  Notes are I made this to be consistent with the banshee uni-zombie  halqifibrax combo. Reasoning is particularly interesting in this deck because you run a lot of different level monsters with graveyard effects and the Eldlich traps get their searches causing you to potentially go plus 5 over all in card advantage.  Deck is very powerful and feels pretty good to play I've gotten 1157 Wins this Banlist with this deck and 415 losses.  &nbsp;"
181666,phantom-knight-6-181666,phantom knight 6,43378048,61461,Non-Meta Decks,"[""57143342"",""57143342"",""30227494"",""88544390"",""88544390"",""36553319"",""20758643"",""20758643"",""10802915"",""10802915"",""10802915"",""63821877"",""90432163"",""90432163"",""3298689"",""25538345"",""25538345"",""25538345"",""3233859"",""36426778"",""36426778"",""36426778"",""14558127"",""14558127"",""14558127"",""59438930"",""59438930"",""19353570"",""19353570"",""19353570"",""98153934"",""81439173"",""81439173"",""81439173"",""11868825"",""69162969"",""83764719"",""35498188"",""53046408"",""67723438"",""48017809"",""5318639"",""88504133"",""3298689"",""25542642"",""25542642"",""25542642"",""61936647"",""98431356"",""34002992"",""98827725"",""83555666""]","[""64276752"",""1621413"",""16195942"",""16195943"",""28781003"",""81330115"",""62709239"",""62709239"",""95992081"",""83531441"",""77205367"",""16259549"",""26973555"",""65305468"",""43490025""]","[""56647086"",""90434926""]",1647023905,1 year ago,,,0,phantom,<span><span>Viết chiến lược bộ bài của bạn ở đây ...</span></span>
181678,starter-deck-bakura-reloaded-unofficial-181678,Starter Deck_ Bakura Reloaded [Unofficial],58206034,63993,Fun/Casual Decks,"[""38999506"",""38277918"",""89494469"",""53375573"",""22026707"",""85605684"",""58206034"",""12817939"",""99747800"",""81755371"",""21672573"",""12958919"",""73648243"",""28933734"",""24140059"",""60741115"",""34334692"",""19665973"",""97642679"",""85562745"",""94772232"",""31893528"",""30170981"",""67287533"",""30606547"",""82003859"",""38992735"",""17589298"",""16625614"",""87910978"",""37812118"",""6850209"",""74519184"",""5318639"",""96420087"",""48539234"",""20374520"",""97077563"",""39131963"",""94212438"",""66395299"",""78474168"",""24268052"",""57069605"",""14057297""]","[""80532587"",""80532587"",""80532587"",""86066372"",""86066372"",""86066372"",""38342335"",""38342335"",""38342335"",""2857636"",""2857636"",""2857636"",""75452921"",""75452921"",""75452921""]","[""56647086"",""90434926""]",1647023905,1 year ago,,,0,Continuing the theme of Starter Deck evolutions based off of Kaiba and Yugi's Official reloaded starter deck. This is the Starter Deck_ Bakura Reloade,"Continuing the theme of Starter Deck evolutions based off of Kaiba and Yugi's Official reloaded starter deck. This is the Starter Deck_ Bakura Reloaded [Unofficial]  So cards TCG released up until 2014 only allowed in this deck (there may be some cards that have been released within 2005).  Lockdown your opponent and devastate them with your monsters, Summon berserk dragon in an emergency.  &nbsp;"
181682,flundereeze-deck-profile-june-2021-this-deck-is-unfair-181682,FLUNDEREEZE DECK PROFILE - June 2021 - This deck is unfair!,18940725,45171,Non-Meta Decks,"[""53212882"",""53212882"",""80611581"",""80611581"",""69327790"",""11366199"",""91800273"",""91800273"",""91800273"",""73356503"",""14558127"",""14558127"",""14558127"",""54334420"",""54334420"",""80433039"",""80433039"",""18940725"",""18940725"",""18940725"",""17827173"",""17827173"",""25311006"",""25311006"",""49238328"",""49238328"",""49238328"",""98645731"",""98645731"",""8843569"",""55521751"",""55521751"",""55521751"",""28126717"",""28126717"",""28126717"",""41215808"",""41215808"",""77610503"",""77610503""]","[""80532587"",""80532587"",""80532587"",""86066372"",""86066372"",""86066372"",""38342335"",""38342335"",""38342335"",""2857636"",""2857636"",""2857636"",""75452921"",""75452921"",""75452921""]","[""50866755"",""73642296"",""73642296"",""73642296"",""14532163"",""14532163"",""14532163"",""54693926"",""54693926"",""54693926"",""84211599"",""84211599"",""84211599"",""100278016"",""30241314""]",1647023905,1 year ago,,,0,https://youtu.be/1uV9Ga-UKnE,https://youtu.be/1uV9Ga-UKnE
181687,ignister-tmt-6-12-2021-181687,@ignister - TMT 6/12/2021,74567889,3734,Non-Meta Decks,"[""16020923"",""16020923"",""16020923"",""88413677"",""88413677"",""88413677"",""15808381"",""15808381"",""15808381"",""41306080"",""41306080"",""42429678"",""82257671"",""66192538"",""94145021"",""94145021"",""94145021"",""14558127"",""14558127"",""14558127"",""38814750"",""38814750"",""38814750"",""49036338"",""6552971"",""6552971"",""6552971"",""57160136"",""57160136"",""57160136"",""22933016"",""22933016"",""22933016"",""59054773"",""59054773"",""59054773"",""24224830"",""24299458"",""24299458"",""24299458""]","[""63533837"",""98506199"",""61399402"",""11738489"",""86066372"",""24882256"",""46947713"",""97383507"",""60292055"",""59859086"",""52698008"",""98978921"",""74567889"",""74567889"",""24842059""]","[""94145021"",""94145021"",""94145021"",""12580477"",""14532163"",""14532163"",""14532163"",""18144507"",""8267140"",""8267140"",""8267140"",""15693423"",""15693423"",""15693423"",""23002292""]",1647023905,1 year ago,,,0,@ignister - TMT 6/12/2021,@ignister - TMT 6/12/2021
181691,kuriboh-deck-june-2021-181691,Kuriboh Deck [JUNE 2021],70914287,60775,Fun/Casual Decks,"[""40640057"",""40640057"",""57116033"",""57116034"",""70914287"",""70914287"",""70914287"",""34419588"",""34419588"",""7021574"",""7021574"",""71036835"",""71036835"",""44632120"",""44632120"",""78355370"",""19636995"",""19636995"",""19636995"",""595626"",""14558127"",""14558127"",""6309986"",""6309986"",""6309986"",""2295440"",""1845204"",""40703222"",""40703222"",""40703222"",""63854005"",""70368879"",""20065322"",""20065322"",""20065322"",""25311006"",""18144507"",""83764719"",""10045474"",""10045474"",""40605147""]","[""96334243"",""90448279"",""48608796"",""72971064"",""72971064"",""98127546"",""29479265"",""66403530"",""86066372"",""4280258"",""38342335"",""2857636"",""75452921"",""65741786"",""41999284""]","[""94145021"",""94145021"",""94145021"",""12580477"",""14532163"",""14532163"",""14532163"",""18144507"",""8267140"",""8267140"",""8267140"",""15693423"",""15693423"",""15693423"",""23002292""]",1647023905,1 year ago,,,0,Combos And Replays: https://www.youtube.com/watch?v=ectBX4hsCuM&t=4s,Combos And Replays:  https://www.youtube.com/watch?v=ectBX4hsCuM&amp;t=4s
181697,unchained-eldlich-dual-avatar-june-2021-181697,Unchained-Eldlich Dual Avatar (June 2021),33026283,50577,Non-Meta Decks,"[""1966438"",""89019964"",""95440946"",""95440946"",""85360035"",""85360035"",""85360035"",""11759079"",""11759079"",""11759079"",""26236560"",""26236560"",""26236560"",""53624265"",""53624265"",""31588572"",""6498706"",""87669904"",""87669904"",""87669904"",""68829754"",""31434645"",""31434645"",""95034141"",""13764602"",""13764602"",""27412542"",""27412542"",""20612097"",""20612097"",""20612097"",""20590515"",""20590515"",""20590515"",""93191801"",""67007102"",""80801743"",""80801743"",""53417695"",""53417695""]","[""74889525"",""33026283"",""33026283"",""284224"",""284224"",""60237530"",""60237530"",""7631534"",""7631534"",""26096328"",""56910167"",""67680512"",""67680512"",""93084621"",""29479265""]","[""94145021"",""94145021"",""94145021"",""12580477"",""14532163"",""14532163"",""14532163"",""18144507"",""8267140"",""8267140"",""8267140"",""15693423"",""15693423"",""15693423"",""23002292""]",1647023905,1 year ago,,,0,Unchained-Eldlich Dual Avatar (June 2021),Tried something new. if something need to be changed please let me know.
181701,otk-second-turn-abyss-actor-deck-181701,OTK/Second-Turn Abyss Actor Deck,77297908,55600,Non-Meta Decks,"[""25629622"",""25629622"",""78310590"",""78310590"",""78310590"",""51028231"",""51028231"",""51391183"",""51391183"",""51391183"",""24907044"",""44179224"",""44179224"",""44179224"",""7279373"",""15308295"",""39024589"",""99634927"",""88412339"",""88412339"",""88412339"",""2295440"",""13662809"",""13662809"",""23784496"",""50179591"",""70368879"",""73628505"",""84211599"",""84211599"",""84211599"",""41803903"",""73468603"",""70564929"",""70564929"",""47355498"",""77297908"",""77297908"",""10813327"",""89208725""]","[""53262004"",""86221741"",""16691074"",""6983839"",""90590303"",""21044178"",""98127546"",""85289965"",""86066372"",""38342335"",""71384012"",""65741786"",""23656668"",""2368215"",""2368215""]","[""82385847"",""34267821"",""14558127"",""82224646"",""80696379"",""90448279"",""84013238"",""62517849"",""48144509"",""8267140"",""94770493"",""76375976"",""10045474"",""35027493"",""23002292""]",1647023905,1 year ago,,,0,"Simple Abyss Actor deck, made for otking and going second.","Inspired in CMDprompt's deck. Link to his deck: <a rel=""nofollow"" href=""https://ygoprodeck.com/abyss-actors-4/"">https://ygoprodeck.com/abyss-actors-4/</a>  Abyss Actors are basically an OTK machine(I mean, if you don't brick). You can use that power to go second and try to otk, or go first and try to control. <ul>  	<li>Combo Starters: 1.  Abyss Actor - Curtain Raiser + Any Pendulum: This is one of the best combo starters, since it's a free special summon. Use them to link summon into Abyss Actor - Hyper Director and start the combo. 2. Abyss Actor - Extras/ Abyss Actor - Mellow Madonna: Put them together since both will end up doing the same thing(Extras will need an extra step of putting him in Pend. Zone, activating effects and setting Mellow). Adding a monster from your deck to hand. That card can depend of how good/bad your hand is. It can be an Abyss Actor - Superstar if you already have a high pend. scale monster, or adding a high pendulum scale monster if you don't have one... It depends of your hand. 3. One for One: Not an Abyss Actor card, but you have Extras, which is a lv1, and a combo starter... So yea, same thing as No2. 4. Abyss Actor - Wild Hope: In case of a really, really bad hand, you can suicide him, to get an Curtain Raiser or Extras. This is very risky and bad, but it's a option to be considered.</li> </ul> &nbsp; <ul>  	<li>Abyss Scripts/Playhouse: Abyss Scripts(I'll use AS to refer to Abyss Scripts) are the Abyss Actors Spells. They're mainly used to interact with your opponent, but there are some who are good for the player. Most of the AS are only used because of their pop effect, since they give advantage to you. The most common way to activate these effects is by playing the field, Abyss Playhouse - Fantastic Theater. The field is very good, since it can add an AS and make your opponent destroy your setted AS, activating their effects. Use them wisely, but don't make it too obvious.</li>  	<li>Going First: Being the first to play is an problem. Since Abyss Actor is ""made"" to be an OTK deck, being the first means no OTK. BUT, that doesn't mean you get to do nothing. Abyss Actor can setup their field, play set rotation(with necrovalley in your side, if you don't have setted cards), make xyzs(if you don't lock your extra), use another pendulum supports, and others... Going first is not as bad as other casual decks and not as good as meta decks, but it's decent enough for you to try to live for a turn and kill turn 3.</li>  	<li>Side Decking: Side Deck can be anything that works well with Abyss Actors. I've put some examples, but there are other cards that are good as well. At the end, the side deck is at your own.</li> </ul> Good Luck and have fun with the deck. Any suggestions you can put in the comments or submit a deck yourself, marking me/the original creator in the description.  Electrumite to 2, plz Konami... Pendulums are dead without it."
181707,raphael-vs-yugi-yami-deck-first-duel-181707,Raphael vs  Yugi/Yami  deck First Duel,34022290,63993,Anime Decks,"[""34022290"",""34022290"",""47150851"",""47150851"",""21672573"",""21672573"",""85489096"",""9633505"",""9633505"",""73544866"",""17052477"",""17052477"",""60519422"",""93671934"",""55569674"",""55569674"",""32022366"",""32022366"",""95515060"",""95515060"",""94793422"",""68427465"",""48179391"",""5556668"",""5556668"",""83764719"",""50213848"",""5758500"",""72302403"",""72302403"",""55713623"",""55713623"",""43641473"",""43641473"",""18807109"",""18807109"",""14315573"",""14315573"",""86871614"",""86871614""]","[""10002346"",""10002346"",""10002346"",""12014404"",""12014404"",""12014404""]","[""5758500"",""7565547"",""68427465"",""85489096"",""93671934""]",1647023905,1 year ago,,,0,cards Rafael uses in his first duel against Yugi/Pharaoh. There are quite a few cards Rafael uses in the anime which have NOT got a TCG/OCG card relea,"Episodes <a rel=""nofollow"" href=""https://yugioh.fandom.com/wiki/Yu-Gi-Oh!_-_Episode_157"">156</a> to 158 (Or season 4 of yugioh). Using cards Rafael uses in his first duel against Yugi/Pharaoh. There are quite a few cards Rafael uses in the anime which have NOT got a TCG/OCG card release.  You'll want few cards in your hands and use emperor sem to equip the spells used to summon the other guardian monsters"
181712,bad-reaction-to-simochi-181712,Bad Reaction to Simochi,40633297,58627,Non-Meta Decks,"[""24140059"",""24140059"",""24140059"",""31305911"",""31305911"",""31305911"",""67316075"",""67316075"",""67316075"",""28933734"",""28933734"",""44656491"",""44656491"",""44656491"",""98645731"",""98645731"",""98645731"",""66719324"",""66719324"",""66719324"",""81510157"",""81510157"",""74117290"",""74117290"",""70368879"",""98444741"",""98444741"",""98444741"",""40633297"",""40633297"",""40633297"",""39526584"",""39526584"",""39526584"",""37576645"",""37576645"",""37576645"",""50470982"",""50470982"",""50470982""]","[""10002346"",""10002346"",""10002346"",""12014404"",""12014404"",""12014404""]","[""59438930"",""59438930"",""73642296"",""96945958"",""26420373"",""69550259"",""89326990"",""50091196"",""70913714"",""21516908"",""98506199"",""40139997"",""21123811"",""44097050"",""29114773""]",1647023905,1 year ago,,,0,Bad Reaction to Simochi,"Here, Gain Some Life Points... OR NOT"
181716,evil-eye-archetype-181716,Evil Eye Archetype,29357687,56908,Fun/Casual Decks,"[""82466274"",""82466274"",""82466274"",""18551923"",""18551923"",""18551923"",""45955628"",""45955628"",""45955628"",""81344637"",""81344637"",""81344637"",""79400597"",""79400597"",""79400597"",""28957126"",""28957126"",""28957126"",""44133040"",""44133040"",""44133040"",""70122149"",""70122149"",""70122149"",""17616743"",""17616743"",""17616743"",""7610394"",""7610394"",""7610394"",""43011492"",""43011492"",""43011492"",""42899204"",""42899204"",""42899204"",""79383919"",""79383919"",""79383919"",""6494106"",""6494106"",""6494106""]","[""17739335"",""17739335"",""29357687"",""29357687"",""29357687""]","[""59438930"",""59438930"",""73642296"",""96945958"",""26420373"",""69550259"",""89326990"",""50091196"",""70913714"",""21516908"",""98506199"",""40139997"",""21123811"",""44097050"",""29114773""]",1647023905,1 year ago,,,0,Evil Eye Archetype,Evil Eye Archetype
181720,jackpot-7-dual-avatar-181720,Jackpot-7 Dual Avatar,81171949,52848,Fun/Casual Decks,"[""27204311"",""27204311"",""27204311"",""40933924"",""40933924"",""40933924"",""70791313"",""70791313"",""70791313"",""7672244"",""7672244"",""7672244"",""24094653"",""24094653"",""32807846"",""43422537"",""43422537"",""43422537"",""70368879"",""74029853"",""74029853"",""74029853"",""74117290"",""74117290"",""74117290"",""81171949"",""81171949"",""81171949"",""85852291"",""85852291"",""87669904"",""87669904"",""87669904"",""89997728"",""89997728"",""89997728"",""15259703"",""15259704"",""41587307"",""41587307"",""41587307""]","[""10817524"",""10817524"",""10817524"",""33026283"",""33026283"",""33026283"",""284224"",""284224"",""284224"",""60237530"",""60237530"",""60237530"",""7631534"",""7631534"",""7631534""]","[""59438930"",""59438930"",""73642296"",""96945958"",""26420373"",""69550259"",""89326990"",""50091196"",""70913714"",""21516908"",""98506199"",""40139997"",""21123811"",""44097050"",""29114773""]",1647023905,1 year ago,,,0,"If you win tith this, thats literally a Jackpot",Just draw into Burglars and Spy with Library and you are good to go
181725,1-181725,1,43230671,65425,Non-Meta Decks,"[""43230671"",""41396436"",""25880422"",""87796900"",""7019529"",""12472242"",""28933734"",""28546905"",""20436034"",""41392891"",""88819587"",""28725004"",""5758500"",""51275027"",""24668830"",""15150365"",""25880422"",""56830749"",""73481154"",""10538007"",""68516705"",""55875323"",""20394040"",""21347810"",""31560081"",""41396436"",""73481154"",""7019529"",""58861941"",""41142615"",""16768387"",""67629977"",""87322377"",""20436034"",""2483611"",""83225447"",""7805359"",""3027001"",""62340868""]","[""25655502"",""15237615"",""51828629"",""56907389"",""51828629"",""25655502""]","[""59438930"",""59438930"",""73642296"",""96945958"",""26420373"",""69550259"",""89326990"",""50091196"",""70913714"",""21516908"",""98506199"",""40139997"",""21123811"",""44097050"",""29114773""]",1647023905,1 year ago,,,0,1,11
181729,121-181729,121,47879985,65425,Non-Meta Decks,"[""47879985"",""64389297"",""91782219"",""15083728"",""20228463"",""18591904"",""2964201"",""97017120"",""91842653"",""59784896"",""2964201"",""82003859"",""91782219"",""56594520"",""7892180"",""29692206"",""70046172"",""3797883"",""82003859"",""90020065"",""14015067"",""82999629"",""42578427"",""18591904"",""55998462"",""60806437"",""19406822"",""16430187"",""93108297"",""17653779"",""14015067"",""79323590"",""2964201"",""90020065"",""81863068"",""93013676"",""47879985"",""21340051"",""96981563"",""14015067"",""19406822"",""79323590"",""81380218"",""22567609"",""99597615""]","[""86154370"",""59765225"",""84815190"",""23361526"",""50954680"",""50954680"",""5772618"",""90036274"",""90036274"",""82044279"",""21516908"",""42110604"",""81846453"",""64880894"",""72813401""]","[""59438930"",""59438930"",""73642296"",""96945958"",""26420373"",""69550259"",""89326990"",""50091196"",""70913714"",""21516908"",""98506199"",""40139997"",""21123811"",""44097050"",""29114773""]",1647023905,1 year ago,,,0,+63622,Write your d2023121eck strategy here...
181733,speedroid-181733,Speedroid,81275020,45863,Non-Meta Decks,"[""86395581"",""86395581"",""86976918"",""86976918"",""96708940"",""96708940"",""96708940"",""53054833"",""53054833"",""53054833"",""81275020"",""59640711"",""59640711"",""53932291"",""53932291"",""53932291"",""96945958"",""96945958"",""16725505"",""16725505"",""8284390"",""50482813"",""50482813"",""14558127"",""14558127"",""14558127"",""12148078"",""12148078"",""12148078"",""29114773"",""29114773"",""88204302"",""88204302"",""81439173"",""83764718"",""99674361"",""58543073"",""58543073"",""10045474"",""10045474""]","[""86154370"",""59765225"",""84815190"",""23361526"",""50954680"",""50954680"",""5772618"",""90036274"",""90036274"",""82044279"",""21516908"",""42110604"",""81846453"",""64880894"",""72813401""]","[""59438930"",""59438930"",""73642296"",""96945958"",""26420373"",""69550259"",""89326990"",""50091196"",""70913714"",""21516908"",""98506199"",""40139997"",""21123811"",""44097050"",""29114773""]",1647023905,1 year ago,,,0,My version of Speedroid,Special summon strong monsters speedroids and active his effects
181737,full-181737,full,596051,65429,Non-Meta Decks,"[""596051"",""2118022"",""2483611"",""3797883"",""7019529"",""7019529"",""7805359"",""8471389"",""12470447"",""12470447"",""16762927"",""16762927"",""20228463"",""20228463"",""20277860"",""20436034"",""21263083"",""24611934"",""25880422"",""30243636"",""30778711"",""30778711"",""31560081"",""34442949"",""34442949"",""35565537"",""38552107"",""43641473"",""46534755"",""46657337"",""51371017"",""55875323"",""55998462"",""56830749"",""58551308"",""58551308"",""67494157"",""69455834"",""70046172"",""71107816"",""73081602"",""76806714"",""79323590"",""81380218"",""81777047"",""82003859"",""82999629"",""82999629"",""87322377"",""88819587"",""90020065"",""91996584"",""95051344"",""95174353"",""96981563"",""97017120"",""98434877""]","[""28593363"",""54752875"",""94905343""]","[""40640057"",""40640057"",""40640057"",""42703248"",""42703248"",""42703248"",""57728570"",""57728570"",""57728570"",""41420027"",""41420027"",""41420027""]",1647023905,1 year ago,,,0,ss,Write your deck ssstrategy here...
181745,budget-elemental-hero-deck-181745,Budget Elemental HERO Deck,22908820,21610,Fun/Casual Decks,"[""89943723"",""89943723"",""20721928"",""20721928"",""20721928"",""84327329"",""84327329"",""84327329"",""58932615"",""58932615"",""58932615"",""21844576"",""21844576"",""21844576"",""59793705"",""59793705"",""14124483"",""14124483"",""14124483"",""86188410"",""86188410"",""45195443"",""45195443"",""11881272"",""11881272"",""11881272"",""22829942"",""22829942"",""22829942"",""17194258"",""17194258"",""17194258"",""18511384"",""18511384"",""26902560"",""26902560"",""26902560"",""45906428"",""14088859"",""14088859"",""14088859"",""24094653"",""24094653"",""24094653""]","[""86346643"",""95486586"",""60493189"",""10526791"",""25366484"",""88820235"",""55615891"",""22908820"",""61204971"",""35809262"",""41436536"",""36841733"",""36841733"",""1948619"",""19324993""]","[""40640057"",""40640057"",""40640057"",""42703248"",""42703248"",""42703248"",""57728570"",""57728570"",""57728570"",""41420027"",""41420027"",""41420027""]",1647023905,1 year ago,,,0,IRL E-HERO Decklist,"This is my IRL E-HERO Deck. I've always been a fan of the GX series so I built this Deck. The problem I have with it right now is knowing what Handtraps I should add so if anyone has some advice for me I would love to hear it.  The Current Strategy aims to draw one of the multiple searchers for polymerization and use the Searchers for the specific fusion materials. Right now the current hand I aim to go for is Elemental HERO Solid Soldier, Any Level 4 or Lower E-HERO monster, Fusion Sage/Fusion Recycling Plant, Honest Neos, Favorite HERO, and Neos Fusion. This is the combo I normally go for with this hand, which makes this Deck want to go second. <ol>  	<li>Normal Summon Solid Soldier</li>  	<li>Activate Solid Soldier to SS the Level 4 or lower E-HERO in your hand</li>  	<li>Link Summon Xtra HERO Infernal Devicer</li>  	<li>Activate Devicer's effect to add Fusion materials based on the current match-up.</li>  	<li>Activate Fusion Sage/Fusion Recycling Plant to add Polymerization</li>  	<li>Fusion Summon Sunrise with the Heros you added from Devicer's effect.</li>  	<li>Add miracle fusion with Sunrise.</li>  	<li>Fusion Summon the monster you revealed with Miracle Fusion.</li>  	<li>Activate the Spell Favorite HERO to equip Sunrise or the monster you fusion summoned with miracle fusion.</li> </ol>"
