deck_num,pretty_url,deck_name,cover_card,userid,format,main_deck,extra_deck,side_deck,ts_submit_date,submit_date,ts_edit_date,edit_date,comments,deck_excerpt,deck_description
97750,adamancipator-97750,Adamancipator,11302671,23189,Fun/Casual Decks,"[""94689206"",""45041488"",""45041488"",""45041488"",""14309486"",""66816282"",""11302671"",""11302671"",""11302671"",""77848740"",""77848740"",""77848740"",""10286023"",""10286023"",""10286023"",""47897376"",""47897376"",""74891384"",""48519867"",""48519867"",""48519867"",""42143067"",""42143067"",""42143067"",""85914562"",""85914562"",""85914562"",""5763020"",""98159737"",""98159737"",""98159737"",""72957245"",""72957245"",""72957245"",""83764719"",""24224830"",""24224830"",""24224830"",""10045474"",""10045474""]","[""9464441"",""47674738"",""73079836""]","[""43898403"",""27204311"",""21887175"",""53582587"",""80352158"",""89132148"",""12524259"",""65681983"",""99249638"",""72529749"",""21044178"",""8267140"",""94145021"",""86852702"",""15693423""]",1615487905,2 years ago,,,0,a,Write your deck strategy here...1
97746,what-is-this-bs-97746,What Is This BS,33396948,28473,Non-Meta Decks,"[""7902349"",""44519536"",""70903634"",""8124921"",""31733941"",""97526666"",""97526666"",""33396948"",""45812361"",""45812361"",""45812361"",""62966332"",""62966332"",""7153114"",""38576155"",""38576155"",""76375976"",""76375976"",""76375976"",""856784"",""856784"",""86541496"",""33782437"",""98645731"",""49238328"",""49238328"",""49238328"",""73628505"",""89997728"",""89997728"",""89997728"",""70368879"",""48934760"",""77538567"",""77538567"",""77538567"",""41420027"",""41420027"",""41420027"",""89208725""]","[""9888196"",""9888196"",""9888196"",""9464441"",""9464441"",""9464441"",""47674738"",""47674738"",""47674738"",""73079836"",""73079836"",""73079836"",""26593852"",""26593852"",""26593852""]","[""43898403"",""27204311"",""21887175"",""53582587"",""80352158"",""89132148"",""12524259"",""65681983"",""99249638"",""72529749"",""21044178"",""8267140"",""94145021"",""86852702"",""15693423""]",1615487905,2 years ago,,,0,A Mystic Mine Exodia draw deck.,This brain dead deck has one goal and one goal only. Use every card to draw and stall till you get all pieces of Exodia.
97742,kozmo-97742,Kozmo++,55885348,24096,Meta Decks,"[""64063868"",""55885348"",""55885348"",""55885348"",""20849090"",""20849090"",""59496924"",""94454495"",""94454495"",""12408276"",""12408276"",""93302695"",""31061682"",""31061682"",""1274455"",""56907986"",""56907986"",""64280356"",""64280356"",""64280356"",""1475311"",""1475311"",""2295440"",""58577036"",""70368879"",""73628505"",""43898403"",""43898403"",""67723438"",""67237709"",""67237709"",""67237709"",""59919307"",""59919307"",""83195035"",""83195035"",""90452877"",""90452877"",""61740673"",""41420027""]","[""9888196"",""9888196"",""9888196"",""9464441"",""9464441"",""9464441"",""47674738"",""47674738"",""47674738"",""73079836"",""73079836"",""73079836"",""26593852"",""26593852"",""26593852""]","[""43898403"",""27204311"",""21887175"",""53582587"",""80352158"",""89132148"",""12524259"",""65681983"",""99249638"",""72529749"",""21044178"",""8267140"",""94145021"",""86852702"",""15693423""]",1615487905,2 years ago,,,0,no extra deck,no extra deck
97738,new-tribrigade-archetype-2020-97738,NEW TRIBRIGADE ARCHETYPE 2020,99726621,28173,Meta Decks,"[""27204311"",""27204311"",""27204311"",""48770333"",""55063751"",""55063751"",""87209160"",""87209160"",""87209160"",""94395649"",""94395649"",""14878871"",""14878871"",""14878871"",""50810455"",""50810455"",""50810455"",""24508238"",""24508238"",""14816857"",""14816857"",""14816857"",""35261759"",""35261759"",""35261759"",""81439174"",""83764719"",""99330325"",""99330325"",""99330325"",""8267140"",""8267140"",""24224830"",""24224830"",""24224830"",""51097887"",""51097887"",""57103969"",""57103969"",""57103969""]","[""66403530"",""85289965"",""99726621"",""99726621"",""86066372"",""4280258"",""52331012"",""52331012"",""38342335"",""2857636"",""75452921"",""26847978"",""26847978"",""65741786"",""41999284""]","[""43898403"",""27204311"",""21887175"",""53582587"",""80352158"",""89132148"",""12524259"",""65681983"",""99249638"",""72529749"",""21044178"",""8267140"",""94145021"",""86852702"",""15693423""]",1615487905,2 years ago,,,0,"Tribrigade"" (トライブリゲード Toraiburigēdo) is an archetype of Beast, Beast-Warrior, and Winged Beast monsters that debuted in Phantom Rage.","<h2><strong><span id=""Playing_style"" class=""mw-headline"">Playing style:</span></strong></h2> <h4><span>Their effects revolve around banishing monsters and <a title=""Link Summon"" rel=""nofollow"" href=""https://yugipedia.com/wiki/Link_Summon"">Link Summoning</a>.</span></h4> <h4><span>""<a title=""Tribrigade Fractaur"" rel=""nofollow"" href=""https://yugipedia.com/wiki/Tribrigade_Fractaur"">Fractaur</a>"" allows you to easily <a title=""Special Summon"" rel=""nofollow"" href=""https://yugipedia.com/wiki/Special_Summon"">Special Summon</a> ""<a title=""Tribrigade Shrike the Wicked Wings"" rel=""nofollow"" href=""https://yugipedia.com/wiki/Tribrigade_Shrike_the_Wicked_Wings"">Shrike</a>"". To do that, you can <a title=""Discard"" rel=""nofollow"" href=""https://yugipedia.com/wiki/Discard"">discard</a> it to <a title=""Send"" rel=""nofollow"" href=""https://yugipedia.com/wiki/Send"">send</a> ""<a title=""Tribrigade Navel"" rel=""nofollow"" href=""https://yugipedia.com/wiki/Tribrigade_Navel"">Navel</a>"" from your <a class=""mw-redirect"" title=""Deck"" rel=""nofollow"" href=""https://yugipedia.com/wiki/Deck"">Deck</a> to the <a title=""Graveyard"" rel=""nofollow"" href=""https://yugipedia.com/wiki/Graveyard"">GY</a>. Then, use the effect of Navel to <a class=""mw-redirect"" title=""Add"" rel=""nofollow"" href=""https://yugipedia.com/wiki/Add"">add</a> ""<a title=""Tribrigade Ceras"" rel=""nofollow"" href=""https://yugipedia.com/wiki/Tribrigade_Ceras"">Ceras</a>"" to your hand. Summon ""Ceras"" and use its first effect to banish ""Fractaur"" and ""Navel"" from your Graveyard to Summon ""<a title=""Tribrigade Felidgette the Fruitless Flower"" rel=""nofollow"" href=""https://yugipedia.com/wiki/Tribrigade_Felidgette_the_Fruitless_Flower"">Felidgette</a>"". Use the effect of ""Felidgette"" to <a title=""Special Summon"" rel=""nofollow"" href=""https://yugipedia.com/wiki/Special_Summon"">Special Summon</a> another monster from your hand, then use it and ""Felidgette"" to <a title=""Link Summon"" rel=""nofollow"" href=""https://yugipedia.com/wiki/Link_Summon"">Link Summon</a> ""<a title=""Tribrigade Lugal the Silver Bullet"" rel=""nofollow"" href=""https://yugipedia.com/wiki/Tribrigade_Lugal_the_Silver_Bullet"">Lugal</a>"", followed by using use it and ""Ceras"" to Link Summon ""Shrike"". Because of the importance of ""Fractaur"", running ""<a title=""Fire Formation - Tenki"" rel=""nofollow"" href=""https://yugipedia.com/wiki/Fire_Formation_-_Tenki"">Fire Formation - Tenki</a>"" to <a title=""Searcher"" rel=""nofollow"" href=""https://yugipedia.com/wiki/Searcher"">search</a> it is required.</span></h4> https://www.youtube.com/watch?v=Ce7gLE_FGGI"
97734,mist-valley-1-card-negate-97734,Mist Valley 1-Card Negate,29587993,26569,Meta Decks,"[""78868119"",""78868119"",""78868119"",""26202165"",""26202165"",""26202165"",""91646304"",""60071928"",""60071928"",""60071928"",""44935634"",""62706865"",""62706865"",""62706865"",""11012154"",""72291078"",""9742784"",""9742784"",""69448290"",""29587993"",""38960450"",""38960450"",""38960450"",""7625614"",""7625614"",""7625614"",""43711255"",""43711255"",""43711255"",""24224830"",""24224830"",""24224830"",""95220856"",""95220856"",""95220856"",""10802915"",""10802915"",""34646691"",""34646691"",""34646691"",""18634367"",""18634367"",""18634367"",""17078030""]","[""60303245"",""50588353"",""85243784"",""37675907"",""72330894"",""83152482"",""50588353"",""85243784"",""28776350"",""81846453"",""34989413"",""65741786"",""21887175"",""81846453"",""41999284""]","[""27204311"",""27204311"",""27204311"",""14532163"",""14532163"",""14532163"",""10045474"",""10045474"",""10045474"",""14558127"",""14558127"",""14558127"",""54693926"",""54693926"",""54693926""]",1615487905,2 years ago,,,2,An infinite negate combo from a single Crystron Halqifibrax.,"This deck uses a single card (anything that can summon <a data-name=""Crystron &lt;a data-name=&quot;Halqifibrax&quot;&gt;Halqifibrax&lt;/a&gt;"">Crystron </a><a data-name=""Halqifibrax"">Halqifibrax</a>, except Jet Synchron) and a card to discard to set up the Mist Valley infinite negate (Apex Avian + Thunderbird) on the first turn.  The combo:  -Special Summon Crystron Halqifibrax (There are many ways to do this). Use its effect to Summon <a data-name=""Mecha Phantom Beast O-Lion"">Mecha Phantom Beast O-Lion</a>.  -Summon <a data-name=""Linkross"">Linkross</a> with Halqifibrax, summoning 2 Link Tokens  -Use O-Lion and 1 of the Tokens to Summon <a data-name=""Martial Metal Marcher"">Martial Metal Marcher</a>. Use O-Lion's effect to Summon a Mecha Phantom Beast Token, and use Marcher's effect to revive O-Lion.  -Use O-Lion and the Mecha Phantom Beast Token to summon <a data-name=""Accel Synchron"">Accel Synchron</a>. Use Accel Synchron's effect to send <a data-name=""Jet Synchron"">Jet Synchron</a> to the GY and increase or decrease its level by 1.  -Discard 1 card to summon Jet Synchron from the GY, then link into <a data-name=""Linkuriboh"">Linkuriboh</a>.  -Use Linkuriboh and Marcher to Summon <a data-name=""Reprodocus"">Reprodocus</a>. Use its effect to make Linkross a Winged Beast.  -Link Summon Simorgh, Bird of Sovereignty with Reprodocus and Linkross  -Tribute the other Link Token to summon Linkuriboh, then use it and Accel Synchron to summon <a data-name=""Union Carrier"">Union Carrier</a>.  -Use Union Carrier's effect to equip <a data-name=""Mist Valley Thunderbird"">Mist Valley Thunderbird</a> to Simorgh.  -Set or activate a card to protect Mist Valley Thunderbird from destruction in battle, if you have one.  -End your turn, and use Simorgh's effect to Summon <a data-name=""Mist Valley Apex Avian"">Mist Valley Apex Avian</a>.  At this point, you will be able to negate anything once per chain, and if you have Raregold Armor or a similar card your Mist Valley Thunderbird will be protected from attacks.  Full Deck Breakdown:  <a data-name=""Deep Sea Diva"">Deep Sea Diva</a> x3, <a data-name=""Tour Guide from the Underworld"">Tour Guide from the Underworld</a> x2, <a data-name=""Sangan"">Sangan</a> x3, <a data-name=""Righty Driver"">Righty Driver</a> x3, <a data-name=""Draconnet"">Draconnet</a> x3: Used to summon Halqifibrax, start the combo.  <a data-name=""Crusadia Arboria"">Crusadia Arboria</a> x1, <a data-name=""Lefty Driver"">Lefty Driver</a> x1, <a data-name=""Guardragon Justicia"">Guardragon Justicia</a> x1: Needed for Snagan, Righty Driver, Draconnet  <a data-name=""Mecha Phantom Beast O-Lion"">Mecha Phantom Beast O-Lion</a> x1, <a data-name=""Jet Synchron"">Jet Synchron</a> x2, <a data-name=""Mist Valley Thunderbird"">Mist Valley Thunderbird</a> x1, <a data-name=""Mist Valley Apex Avian"">Mist Valley Apex Avian</a> x1: Needed for combo, Jet Synchron is at 2 because otherwise drawing it would destroy the combo.  <a data-name=""Raregold Armor"">Raregold Armor</a> x3, Armory Call x3, <a data-name=""Vengeful Bog Spirit"">Vengeful Bog Spirit</a> x3, <a data-name=""Red Screen"">Red Screen</a> x3, <a data-name=""Stumbling"">Stumbling</a> x3, <a data-name=""Wall of Revealing Light"">Wall of Revealing Light</a> x1: These cards are extremely helpful in protecting Mist Valley Thunderbird after it has been Summoned to the field.  <a data-name=""Prohibition"">Prohibition</a> x3: Useful for preventing Ash Blossom or Nibiru from wrecking the strategy.  <a data-name=""Called by the Grave"">Called by the Grave</a> x3: Used to counter Ash Blossom and Effect Veiler.  Extra Deck:  <a data-name=""Akashic Magician"">Akashic Magician</a><a data-name=""Salamangreat Almiraj"">, Salamangreat Almiraj</a> x1: Used with Sangan or Tour Guide to enable link summons with Arboria.  <a data-name=""Crystron Halqifibrax"">Crystron Halqifibrax x2, </a><a data-name=""Linkross"">Linkross x2</a><a data-name=""Crystron Halqifibrax"">, </a><a data-name=""Martial Metal Marcher"">Martial Metal Marcher x2, Accel Synchron x1, Linkuriboh x1: </a>These cards are needed for the combo. Halqifibrax, Linkross, and Marcher are at 2 so you can restart the combo if you run into Ash Blossom or Nibiru. The extras can be replaced if necessary.  I:P Masquerena x1, Mekk-Knight Crusadia Avramax x1: These cards are good to have for later game (turns 2+) summons. Avramax in particular is good for locking down attacks.  Side deck:  <a data-name=""Nibiru the Primal Being"">Nibiru the Primal Being</a> x3: Good for stopping opposing combos, if forced to go second.  Dark Ruler No More: This is one of the best cards for negating opponent's cards that would threaten the combo.  <a data-name=""Lightning Storm"">Lightning Storm</a> x3: To break boards with troublesome cards and/or bait cards like Savage Dragon or Dragoon.  <a data-name=""Infinite Impermanence"">Infinite Impermanence</a> x3: To negate opponent's monsters or bait their negation effects. Also good to stop Spells/Traps.  <a data-name=""Ash Blossom &amp; Joyous Spring"">Ash Blossom &amp; Joyous Spring </a>x3: Good for stopping combo decks before they start."
97730,prank-kids-invoked-new-support-97730,Prank-Kids Invoked new support,25725326,13952,Meta Decks,"[""27204311"",""27204311"",""27204311"",""31440046"",""31440046"",""31440046"",""86120751"",""86120751"",""86120751"",""18236002"",""18236002"",""18236002"",""14558127"",""14558127"",""14558127"",""55725117"",""55725117"",""55725117"",""81119816"",""81119816"",""81119816"",""24094653"",""24094653"",""24094653"",""73628505"",""74063034"",""74063034"",""74063034"",""24224830"",""24224830"",""79059098"",""79059098"",""43664494"",""16269385"",""16269385"",""16269385"",""47679935"",""47679935"",""15447747"",""15447747""]","[""81997228"",""75286621"",""12307878"",""18514525"",""18514525"",""44509529"",""90809975"",""70875686"",""85289965"",""17382973"",""17382973"",""43886072"",""2220237"",""25725326"",""60303245""]","[""27204311"",""27204311"",""27204311"",""14532163"",""14532163"",""14532163"",""10045474"",""10045474"",""10045474"",""14558127"",""14558127"",""14558127"",""54693926"",""54693926"",""54693926""]",1615487905,2 years ago,,,0,Prank-Kids Invoked deck with the new support ! Gameplay of the deck : https://youtu.be/nN_Hj1Gz9H4,"Gameplay of the deck :  &nbsp;  <a class=""style-scope ytcp-video-info"" href=""https://youtu.be/nN_Hj1Gz9H4"" target=""_blank"" rel=""noopener noreferrer nofollow"">https://youtu.be/nN_Hj1Gz9H4</a>"
97726,dinosaur-lockdown-jul-2020-deck-combo-97726,Dinosaur Lockdown Jul/2020 Deck + Combo,18940556,28357,Meta Decks,"[""18940556"",""18940556"",""82385847"",""80280944"",""38572779"",""38572779"",""38572779"",""44335251"",""44335251"",""44335251"",""73356503"",""14558127"",""14558127"",""14558127"",""36042004"",""36042004"",""36042004"",""82946847"",""82946847"",""98022050"",""98022050"",""98022050"",""38179121"",""38179121"",""47325505"",""47325505"",""47325505"",""49238328"",""49238328"",""49238328"",""8267140"",""8267140"",""8267140"",""24224830"",""24224830"",""24224830"",""17228908"",""17228908"",""10045474"",""10045474"",""10045474""]","[""74294676"",""74294676"",""42752141"",""42752141"",""72330894"",""72330894"",""72330894"",""30674956"",""30674956"",""34989413"",""34989413"",""34989413"",""41999284"",""41999284"",""41999284""]","[""27204311"",""27204311"",""27204311"",""14532163"",""14532163"",""14532163"",""10045474"",""10045474"",""10045474"",""14558127"",""14558127"",""14558127"",""54693926"",""54693926"",""54693926""]",1615487905,2 years ago,,,0,Make the combo in first turn and win the duel!,
97720,red-97720,red,74677426,28436,Meta Decks,"[""74677426"",""74677422"",""74677424"",""36996508"",""30079770"",""39357122"",""39357122"",""88264978"",""18491580"",""18491580"",""58257569"",""66574418"",""66574418"",""67300516"",""93969023"",""93969023"",""85651167"",""53485634"",""53485634"",""23431858"",""23431858"",""98159737"",""70333910"",""70333910"",""70333910"",""92353449"",""92353449"",""92353449"",""6172122"",""6172122"",""32566831"",""32566831"",""87571563"",""24224830"",""24224830"",""83764719"",""39387565"",""57135971"",""57135971"",""57135971"",""44397496"",""44397496""]","[""30086349"",""21140872"",""21140872"",""37818794"",""44405066"",""79266769"",""86148577"",""13143275"",""74997493"",""83152482"",""24361622"",""70369116"",""65741786"",""21887175"",""27548199""]","[""45410988"",""19025379""]",1615487905,2 years ago,,,0,ddd,Writed your deck strategy here...
97715,unchainlord-97715,UNCHAINLORD,4837861,27792,Non-Meta Decks,"[""4837861"",""68140974"",""4545683"",""30221870"",""3715284"",""3715284"",""3715284"",""2137678"",""75733063"",""75733063"",""39648965"",""77710579"",""77710579"",""77710579"",""89019964"",""89019964"",""1966438"",""31588572"",""31588572"",""31588572"",""26236560"",""53624265"",""68140974"",""39109382"",""39109382"",""39109382"",""27412542"",""27412542"",""27412542"",""54807656"",""54807656"",""53129443"",""53129443"",""52340444"",""2295440"",""2992036"",""53417695"",""53417695"",""80801743"",""80801743""]","[""67680512"",""67680512"",""93084621"",""29479265"",""22423493"",""22423493"",""75147529"",""90673288"",""12421694"",""63288573"",""8491308"",""49121795"",""8387138"",""84025439"",""28912357""]","[""45410988"",""19025379""]",1615487905,2 years ago,,,0,unchained mechanics merged with the meklord ones,"just a funny deck, i thought that meklord mechanics could merge with the unchained ones and vice versa, somethimes summoning a monster prevents the summoning of a monster with different type: es. special summoning rakea/aruha allows you to special summon only fiend monsters for the rest of this turn (that's why i put three sarama in the deck) same happens with meklord army arsenal of obbligato with machine type monsters"
97707,altergeist-dragma-deck-yes-you-didnt-read-wrong-97707,"Altergeist dragma deck: YES, YOU DIDNT READ WRONG",42790071,27781,Meta Decks,"[""69680031"",""52927340"",""53143898"",""53143898"",""53143898"",""60303688"",""60303688"",""42790071"",""42790071"",""42790071"",""14558127"",""14558127"",""14558127"",""89538537"",""89538537"",""25533642"",""25533642"",""25533642"",""59185998"",""59185998"",""1984618"",""1984618"",""1984618"",""49238328"",""49238328"",""49238328"",""10045474"",""10045474"",""10045474"",""15693423"",""15693423"",""15693423"",""35146019"",""82956214"",""82956214"",""27541563"",""27541563"",""36975314"",""36975314"",""53936268"",""53936268"",""53936268"",""41420027"",""41420027"",""41420027""]","[""41373230"",""41373230"",""80532587"",""80532587"",""74586817"",""86066372"",""38342335"",""2857636"",""1508649"",""1508649"",""1508649"",""85243784"",""85243784"",""41999284"",""41999284""]","[""45410988"",""19025379""]",1615487905,2 years ago,,,0,did you knew that dragma haves a searchable pop 2 card?,replay: https://www.youtube.com/watch?v=a4vXPe3wK74
97693,mathmech-97693,Mathmech,42632209,12343,Non-Meta Decks,"[""8567955"",""8567955"",""8567955"",""89743495"",""17946349"",""17946349"",""17946349"",""27182739"",""27182739"",""27182739"",""53577438"",""53577438"",""53577438"",""16360142"",""16360142"",""16360142"",""80965043"",""52354896"",""52354896"",""52354896"",""14558127"",""14558127"",""14558127"",""14025912"",""14025912"",""57160136"",""57160136"",""57160136"",""70368879"",""81439173"",""24224830"",""24224830"",""24224830"",""41410651"",""41410651"",""41410651"",""10045474"",""10045474"",""10045474"",""87804365""]","[""42632209"",""42632209"",""15248594"",""15248594"",""85692042"",""88021907"",""46772449"",""21887175"",""38342335"",""2857636"",""45462149"",""52698008"",""32995276"",""48068378"",""41999284""]","[""90590304"",""4280258"",""49202162"",""72529749"",""46947713"",""88093706"",""72336818"",""14532163"",""35261759"",""83764719"",""14393464"",""61740673""]",1615487905,2 years ago,,,0,Feel free to check the video version for the animated monsters and intro,https://www.youtube.com/watch?v=Pn1guHWlX2I The video version
97682,prankids-meow-vs-all-meta-july-2020-97682,PRANKIDS MEOW VS ALL META JULY 2020,70369116,8997,Non-Meta Decks,"[""27204311"",""27204311"",""27204311"",""14558127"",""14558127"",""14558127"",""97268402"",""97268402"",""52038441"",""46986414"",""74677422"",""31440046"",""31440046"",""31440046"",""18236002"",""18236002"",""18236002"",""55725117"",""55725117"",""55725117"",""81119816"",""81119816"",""81119816"",""79059098"",""79059098"",""79059098"",""16269385"",""16269385"",""16269385"",""24094653"",""24094653"",""65681983"",""65681983"",""24224830"",""73628505"",""1845204"",""6172122"",""10045474"",""10045474"",""15447747""]","[""81997228"",""37818794"",""18514525"",""18514525"",""44509529"",""90809975"",""70875686"",""86066372"",""38342335"",""17382973"",""17382973"",""43886072"",""70369116"",""25725326"",""25725326""]","[""43664494"",""6983839"",""21044178"",""62517849"",""86120751"",""85289965"",""4280258"",""72529749"",""2857636"",""75452921"",""2295440"",""35261759"",""67169062"",""24299458"",""38053381""]",1615487905,2 years ago,,,0,PRANKIDS MEOW VS ALL META JULY 2020,"youtube link - <a rel=""nofollow"" href=""https://youtu.be/r6nFvj0p_Gs"">https://youtu.be/r6nFvj0p_Gs</a> <div> <div class=""gtx-trans-icon""></div> </div>"
