deck_num,pretty_url,deck_name,cover_card,userid,format,main_deck,extra_deck,side_deck,ts_submit_date,submit_date,ts_edit_date,edit_date,comments,deck_excerpt,deck_description
285241,cubic-trinity-june-2022-285241,Cubic Trinity (June 2022),30270176,50577,Non-Meta Decks,"[""30270176"",""30270176"",""30270176"",""13650422"",""89312388"",""89312388"",""89312388"",""20137754"",""20137754"",""20137754"",""79109599"",""79109599"",""79109599"",""213326"",""213326"",""213326"",""7614732"",""7614732"",""7614732"",""8949584"",""8949584"",""8949584"",""12071500"",""17194258"",""17194258"",""17194258"",""24094653"",""24094653"",""24094653"",""32807846"",""35726888"",""35726888"",""35726888"",""84211599"",""84211599"",""84211599"",""94820406"",""9659580"",""9659580"",""9659580""]","[""72664875"",""72664875"",""72664875"",""86165817"",""86165817"",""86165817"",""86066372"",""38342335"",""38342335"",""2857636"",""2857636"",""2857636"",""75452921"",""75452921"",""75452921""]","[""27204311"",""55063751"",""78661338"",""423585"",""11317977"",""81034083"",""11481610"",""14088859"",""26902560"",""35058588"",""44227727"",""99330325"",""24299458"",""24299458"",""76375976""]",1655231905,9 months ago,,,0,Cubic Trinity (June 2022),Cubic Trinity (June 2022)
285249,agent-of-athena-285249,Agent of Athena,48964966,115632,Fun/Casual Decks,"[""48964966"",""48964966"",""48964966"",""39552864"",""39552864"",""39552864"",""55794644"",""55794644"",""55794644"",""91188343"",""91188343"",""91188343"",""64734921"",""64734921"",""64734921"",""28573958"",""28573958"",""28573958"",""97750534"",""97750534"",""38529357"",""38529357"",""91123920"",""91123920"",""91345518"",""91434602"",""37742478"",""56597272"",""67284107"",""15449853"",""15449853"",""15449853"",""56433456"",""56433456"",""90312154"",""90312154"",""28890974"",""28890974"",""26684111"",""26684111"",""29401950"",""29401950"",""29401950"",""1637760"",""1637760"",""97169186"",""97169186"",""18144507""]","[""52687916"",""37706769"",""63101468"",""63767246"",""63767246"",""90448279"",""59765225"",""7391448"",""44508094"",""3322931""]",,1655231905,9 months ago,,,0,Venus+shine-ball/tokens -> Athena  Agents -> Hyperion,Venus+shine-ball/tokens -&gt; Athena  Agents -&gt; Hyperion
285257,spirits-of-yomi-285257,Spirits of Yomi,75745607,110508,Master Duel Decks,"[""57722593"",""57722593"",""16889337"",""16889337"",""16889337"",""24701235"",""24701235"",""24701235"",""13974207"",""13974207"",""32181268"",""32181268"",""82841979"",""82841979"",""75745607"",""25415052"",""25415052"",""52900000"",""52900000"",""13048472"",""13048472"",""13048472"",""49238328"",""49238328"",""49238328"",""14532163"",""14532163"",""14532163"",""73055622"",""73055622"",""73055622"",""9553721"",""9553721"",""24224830"",""24224830"",""24299458"",""24299458"",""53582587"",""53582587"",""53582587""]","[""1426714"",""1426714"",""1426714"",""53244294"",""53244294"",""53244294"",""80796456"",""80796456"",""80796456"",""32530043"",""32530043"",""32530043"",""75452921"",""75452921"",""75452921""]",,1655231905,9 months ago,,,0,A Spirit deck for Master Duel!,A Spirit deck for Master Duel!
285261,cyberdark-style-2022-285261,cyberdark style 2022,37542782,116174,Master Duel Decks,"[""70095154"",""23893227"",""23893227"",""23893227"",""1142880"",""5370235"",""5370235"",""77625948"",""41230939"",""3019642"",""45078193"",""45078193"",""45078193"",""82562802"",""82562802"",""82562802"",""67159705"",""76218313"",""64753988"",""64753988"",""64753988"",""44352516"",""44352516"",""60600126"",""60600126"",""63031396"",""63031396"",""63031396"",""37630732"",""37630732"",""67169062"",""67169062"",""64014615"",""64014615"",""82428674"",""10045474"",""10045474"",""10045474"",""38761908"",""38761908""]","[""37542782"",""37542782"",""18967507"",""18967507"",""1546123"",""1546123"",""46724542"",""83152482"",""13117073"",""49725936"",""30163008"",""20665527"",""88000953"",""29479265""]","[""24299458"",""24299458"",""24299458"",""63533837"",""40139997"",""80666118"",""43534808"",""43534808"",""43534808"",""10045474"",""10045474"",""14558127"",""14558127"",""27204311"",""27204311""]",1655231905,9 months ago,,,1,"Use the new cyberdark monsters and outplay your opponent with the help of cyberdark end dragon, by stealing your opponent monsters from their gy and l","This deck contains all the important new cyber monsters, including chimera, one of the most important monsters in the deck  &nbsp;"
285269,the-agents-fairy-deck-2022-285269,The Agents fairy deck 2022,60465049,110024,Non-Meta Decks,"[""38529357"",""38529357"",""38529357"",""64734921"",""64734921"",""64734921"",""91188343"",""91188343"",""91188343"",""92919429"",""92919429"",""92919429"",""39552864"",""39552864"",""39552864"",""34022290"",""34022290"",""34022290"",""99054885"",""99054885"",""26866984"",""26866984"",""83991690"",""83991690"",""55794644"",""55794644"",""91434602"",""91434602"",""17266660"",""17266660"",""20292186"",""83764719"",""65681983"",""65681983"",""65681983"",""24224830"",""63854005"",""1845204"",""89558743"",""89558743"",""89558743"",""26684111"",""26684111"",""26684111"",""84211599"",""84211599"",""84211599"",""56433456"",""54693926"",""54693926"",""54693926"",""27204311"",""14558127"",""10045474"",""97268402""]","[""3544583"",""60465049"",""63101468"",""96633955"",""84815190"",""33158448"",""98558751"",""37706769"",""79606837"",""90290572"",""50588353"",""7480763"",""48589580"",""65741786"",""86066372""]","[""24299458"",""24299458"",""24299458"",""63533837"",""40139997"",""80666118"",""43534808"",""43534808"",""43534808"",""10045474"",""10045474"",""14558127"",""14558127"",""27204311"",""27204311""]",1655231905,9 months ago,,,0,The Agents fairy deck with fun strategy's,The agents fairy wannabe meta deck :(
285273,tribi-pure-285273,Tribi Pure,99726621,112793,Master Duel Decks,"[""94145021"",""94145021"",""14816857"",""14816857"",""14816857"",""50810455"",""50810455"",""50810455"",""87209160"",""87209160"",""56196385"",""56196385"",""56196385"",""40975243"",""40975243"",""23434538"",""81866673"",""63362460"",""52947044"",""52947044"",""55063751"",""55063751"",""90807199"",""27204311"",""18144507"",""83764719"",""14532163"",""57103969"",""57103969"",""57103969"",""5318639"",""24224830"",""24224830"",""65681983"",""24299458"",""24299458"",""10045474"",""10045474"",""41420027"",""41420027""]","[""99726621"",""99726621"",""52331012"",""47163170"",""26847978"",""60461804"",""60303245"",""75452921"",""70369116"",""65711558"",""38342335"",""21887175"",""4280258"",""86066372"",""98127546""]","[""14558127"",""14558127"",""23434538"",""97268402"",""97268402"",""12580477"",""75500286"",""35261759"",""35261759"",""31548215"",""31548215"",""40605147"",""40605147"",""38814750"",""38814750""]",1655231905,9 months ago,,,0,link,link
285277,perfect-drytron-285277,Perfect Drytron,44665365,114713,Non-Meta Decks,"[""97148796"",""97148796"",""97148796"",""96026108"",""96026108"",""96026108"",""60037599"",""60037599"",""60037599"",""22420202"",""22420202"",""22420202"",""92919429"",""92919429"",""17266660"",""17266660"",""34267821"",""72634965"",""69815951"",""77235086"",""77235086"",""3629090"",""99427357"",""44665365"",""60600126"",""60600126"",""60600126"",""94187078"",""94187078"",""94187078"",""22398665"",""96729612"",""96729612"",""96729612"",""13048472"",""13048472"",""13048472"",""54693926"",""54693926"",""54693926"",""81439173"",""24224830"",""27383110"",""10045474"",""10045474""]","[""80532587"",""79606837"",""73580471"",""1174075"",""1174075"",""27240101"",""72167543"",""90448279"",""27552504"",""94259633"",""65741786"",""2857636"",""38342335"",""4280258"",""85289965""]","[""102380"",""102380"",""102380"",""66570171"",""76375976"",""76375976"",""76375976"",""43898403"",""43898403"",""43898403"",""4064256"",""15693423"",""15693423"",""15693423"",""23002292""]",1655231905,9 months ago,,,0,Basically Drytron with Herald of Perfection,"LoganJYA YCS Deck but broken down to 45 cards in Main <div id=""gtx-trans""> <div class=""gtx-trans-icon""></div> </div>"
285281,kairyu-shin-fisherman-deck-285281,Kairyu-Shin Fisherman Deck,23931679,116284,Fun/Casual Decks,"[""78060096"",""96546575"",""44968687"",""19801646"",""23931679"",""23931679"",""23931679"",""55151012"",""55151012"",""55151012"",""43797906"",""43797906"",""43797906"",""95824983"",""95824983"",""95824983"",""69436288"",""69436288"",""1845204"",""22819092"",""22819092"",""22819092"",""49238328"",""49238328"",""49238328"",""98804359"",""98804359"",""82685480"",""58203736"",""58203736"",""295517"",""295517"",""295517"",""53582587"",""53582587"",""53582587"",""95602345"",""19089195"",""19089195""]","[""96334243"",""9464441"",""61374414"",""12744567"",""34876719"",""440556"",""37279508"",""48739166"",""67557908"",""94942656"",""94942656"",""21044178"",""90809975"",""5524387"",""79130389""]","[""27204311"",""27204311"",""43534808"",""43534808"",""43534808"",""73642296"",""73642296"",""73642296"",""10045474"",""10045474"",""43898403"",""43898403"",""43898403"",""18144506"",""23002292""]",1655231905,9 months ago,,,0,Easily summon your floodgate Kairyu-Shin while building up multiple negates and board whipes.,Easily summon your floodgate Kairyu-Shin while building up multiple negates and board whipes.
285285,budget-u-a-285285,budget U.A.,82419869,18019,Fun/Casual Decks,"[""47021196"",""47021196"",""71279983"",""34614289"",""17264592"",""9485511"",""56421754"",""82419869"",""82419869"",""11637481"",""11637481"",""11637481"",""72491806"",""72491806"",""86028783"",""86028783"",""86028783"",""97268402"",""97268402"",""97268402"",""35884610"",""12931061"",""12931061"",""12931061"",""19814508"",""19814508"",""19814508"",""35726888"",""35726888"",""49238328"",""49238328"",""49238328"",""32807846"",""73628505"",""43658697"",""43658697"",""43658697"",""49936169"",""70043345"",""70043345""]","[""90448279"",""90590303"",""82633039"",""6983839"",""21044178"",""32530043"",""48739166"",""93568288"",""39317553"",""38342335"",""2857636"",""75452921"",""65741786"",""8802510"",""46935289""]","[""27204311"",""27204311"",""43534808"",""43534808"",""43534808"",""73642296"",""73642296"",""73642296"",""10045474"",""10045474"",""43898403"",""43898403"",""43898403"",""18144506"",""23002292""]",1655231905,9 months ago,,,2,cheap U.A. deck,"Main deck is around 25 dollars. Most expensive cards are Pot of Extravagance and Foolish Burial Goods but they make the deck more consistent. Can add more handtraps, I just included Effect Veilers since they are only 1 dollar each and generally useful against most decks. Pretty much just an outline for the deck. I excluded extra deck since it doesn't matter what's in it, just make sure that there are 15 cards if you want to resolve your Pot all 3 times. Side deck is whatever, make sure you have some sort of spell removal."
285289,megalith-jun22-format-285289,Megalith Jun22 Format,78990927,57469,Non-Meta Decks,"[""78990927"",""78990927"",""63056220"",""90444325"",""90444325"",""36849933"",""99628747"",""99628747"",""63233638"",""96729612"",""82085295"",""82085295"",""82085295"",""80701178"",""80701178"",""53303460"",""65877963"",""65877963"",""77235086"",""96729612"",""76209339"",""86758915"",""84504242"",""69003792"",""69003792"",""69003792"",""95492061"",""95492061"",""95492061"",""27204311"",""94145021"",""94145021"",""94145021"",""14558127"",""14558127"",""14558127"",""38814750"",""38814750"",""38814750"",""49036338""]","[""90448279"",""90590303"",""82633039"",""6983839"",""21044178"",""32530043"",""48739166"",""93568288"",""39317553"",""38342335"",""2857636"",""75452921"",""65741786"",""8802510"",""46935289""]","[""27204311"",""27204311"",""43534808"",""43534808"",""43534808"",""73642296"",""73642296"",""73642296"",""10045474"",""10045474"",""43898403"",""43898403"",""43898403"",""18144506"",""23002292""]",1655231905,9 months ago,,,1,Competitive version of Megalith for TCG format,"Below I demonstrate the final version of the Megalith deck that I use competitively. I've already made a definitive guide on how to use Megalith that I consider a deck that needs a lot of training to know how to use but that is not among the most difficult decks in the game at the DDD level: https://ygoprodeck.com/megalith-master-duel -apr22-format/  The main change I made to what I used before is to <strong>cut </strong><a data-name=""Megalith Ophiel"">Megalith Ophiel</a><strong> to 1 copy in the deck</strong> because it is a necessary card for combos to work but the second copy is not that relevant compared to the second copy of <a data-name=""Megalith Hagith"">Megalith Hagith</a> or of <a data-name=""Megalith Phul"">Megalith Phul</a>, so by decreasing the number of Megalith Ophiel in the deck I was able to put <strong>more tech cards</strong> improving the deck's blind second against meta decks.  The deck has good qualities to be used: - <strong>Consistency</strong>: despite the <strong>high number of hand traps</strong> (11 slots) you have a lot of <strong>combination of 2 card combos</strong> so you can build a Ritual Summon deck that manages to have a balance between engine and tech cards. - The deck <strong>engine is cyclical and manages to generate an advantage every turn</strong>, whether yours or the opponent's turn, which makes the game volume very high and oppressive for the opponent because you are always proposing new moves with each passing turn. No wonder it's common for you to end turn 3 of the game with between 12 and 14 cards in the deck so absurd is the <strong>Megalith's search power</strong>. - The surprise factor also helps a lot because there are starting hands that you open that in themselves are <strong>resilient to 1 Hand Trap/interaction</strong> and depending on the opponent's ignorance about your moves you can combo up 2 Hand Traps and I even managed to make my 1 turn setup up to 3 Hand Traps. - The <strong>end board you make is very good against any match up you face</strong>, whether it's combo decks, control decks, that have several layers of play or that just set 5 traps and pass the turn so it's very difficult for you to lose to random decks and meta decks most of the time will have to open with a very <strong>strong combination of cards</strong> to go over their field and I practically never took OTK when making my turn 1 setup so <strong>resilient is it to Blind Second Cards</strong> like <a data-name=""Lightning Storm"">Lightning Storm</a>, <a data-name=""Dark Ruler No More"">Dark Ruler No More</a>, <a data-name=""Evenly Matched"">Evenly Matched</a> etc.  //////////////////////////////////////////////// /////////// Now I'm going to talk about some cards that most positively surprised me in the use of the deck:  <a data-name=""Megalith Och"">Megalith Och:</a> when using the card in the deck I didn't regret testing it because it really makes the <strong>Megalith engine plays better whether to build field or break</strong>, mainly because it's a <strong>fourth name of low level Megalith Monster</strong> to use the effect of Ritual Summon on your turn allowing you to build moves that aren't possible if you don't use it. And on the opponent's turn it works almost like <a data-name=""Megalith Phul"">Megalith Phul</a> being able to Ritual Summon <a data-name=""Megalith Bethor"">Megalith Bethor</a> to the field, but you'll have to have it in hand first and that's good if your <strong>Megalith Phul eff from Ritual Summon doesn't resolve</strong> because your opponent used <a data-name=""Ash Blossom"">Ash Blossom</a> or <a data-name=""Forbidden Droplet"">Forbidden Droplet</a> type of card to negate it.  <a data-name=""Cyber ​​Angel Benten"">Cyber ​​Angel Benten</a> and <a data-name=""Manju of the Ten Thousand Hands"">Manju of the Ten Thousand Hands</a>: These cards greatly increase your grind game because it's <strong>very simple to loop Benten for Ritual Summon</strong> and add Manju to your hand every turn which allows you to access <strong>XYZ's Toolbox Rank-4</strong> easily to control the game.  <strong>Impcantation Engine</strong>: It's a fantastic engine to <strong>deal with opponent interactions</strong> because you can Ritual Summon saving cards and leaving the rest in your hand as push moves, so for example I've managed to deal with Virtual World <a data-name=""Shenshen"">Shenshen</a> which is a <a data-name=""Macro Cosmo"">Macro Cosmo</a>s field without having any of my Ritual monsters banished because I just used <a data-name=""Impcantation Inception"">Impcantation Inception</a> and Impcantation monsters to Ritual Summon <a data-name=""Megalith Phul"">Megalith Phul</a> who brought <a data-name=""Megalith Hagith"">Megalith Hagith</a> from the deck for example and as I had done NS <a data-name=""Manju"">Manju</a> on the turn I was able to RANK-4 <a data-name=""Castel, the Skyblaster Musketeer"">Castel, the Skyblaster Musketeer</a> to shuffle the Shenshen back to the deck and play cool afterwards. So it's an engine that is not only good against interactions, but also <strong>helps to play around cards that are out of your control like some Floodgates</strong>.  <a data-name=""Herald of Mirage Lights"">Herald of Mirage Lights</a>: This card plays more than one role in the deck because in addition to saying <strong>""No"" to field-breaking cards</strong> like <a data-name=""Lightning Storm"">Lightning Storm</a> it <strong>adds two follow ups to the hand</strong> so it's a card that always leaves you on par with your opponent in card advantage and since you can <strong>always loop Benten back to your hand</strong> in this deck your opponent is short on time to take it out as you will always have the negate spell/trap live effect again to use.  <strong>Extra Deck Monsters</strong>: Among the XYZ monsters, the ones that surprised me the most were <a data-name=""Castel, the Skyblaster Musketeer"">Castel, the Skyblaster Musketeer</a> which is basically a <a data-name=""Knightmare Unicorn"">Knightmare Unicorn</a> for face-up cards on the field, which is important to avoid card effects like <span class=""name_txt selectable""><a data-name=""Mirrorjade the Iceblade Dragon"">Mirrorjade the Iceblade Dragon</a></span> or <span class=""name_txt selectable""><a data-name=""Despian Quaeritis"">Despian Quaeritis</a></span> that don't activate its effects if gets back to the Extra Deck.  Another card that was very useful was <a data-name=""Number 101: Silent Honor ARK"">Number 101: Silent Honor ARK</a> because <strong>LINK monsters can't play around</strong> its effect and after stealing the opponent's LINK monsters you go to the battle phase and <a data-name=""AA-Zeus"">AA-Zeus</a> in Main Phase 2 to deal with even more opponent's cards. Simply <strong>Number 101 and AA-Zeus can take a lot of boring card out of the field</strong> like <span class=""name_txt selectable""><a data-name=""Mekk-Knight Crusadia Avramax"">Mekk-Knight Crusadia Avramax</a></span> because even taking 3k damage with Silent Honor ARK you do AA-Zeus on M2 and take it out of the field.  And finally we have the <a data-name=""Drill Driver Vespenato"">Drill Driver Vespenato</a> that has the utility of being made on top of <a data-name=""Number 80: Rhapsody in Berserk"">Number 80: Rhapsody in Berserk</a>, <a data-name=""Castel, the Skyblaster Musketeer"">Castel, the Skyblaster Musketeer</a> that are out of material and give <strong>piercing damage</strong> to the opponent or simply make it difficult to take it off from the field because if not <strong>you reborn any Level5 or lower monster from GY</strong> like a Megalith Phul for example.  //////////////////////////////////////////////// ////"
285315,2002-custom-pack-pulls-285315,2002 Custom Pack Pulls,70781052,116290,Fun/Casual Decks,"[""70781052"",""48305365"",""48305365"",""48305365"",""80770678"",""66362965"",""78658564"",""78658564"",""78658564"",""93013676"",""83011278"",""83011278"",""97077563"",""97077563"",""31560081"",""31560081"",""85742772"",""85742772"",""23771716"",""23771716"",""23771716"",""66788016"",""66788016"",""60082869"",""60082869"",""60082869"",""28933734"",""28933734"",""28933734"",""40619825"",""40619825"",""82003859"",""56594520"",""3819470"",""70046172"",""70046172"",""70046172"",""65169794"",""65169794"",""65169794"",""40619825""]","[""37818794"",""37818794"",""41721210"",""85059922"",""50237654"",""44405066"",""96471335"",""21887175"",""86066372"",""49202162"",""38342335"",""2857636"",""65741786"",""70369116"",""31226177""]","[""82697428"",""55063751"",""1118137"",""8949584"",""8949584"",""52947044"",""32807846"",""93600443"",""48130397"",""48130397""]",1655231905,9 months ago,,,0,Casual deck,Casual (and bad)
285331,dark-magician-neo-285331,Dark Magician Neo,46986421,116308,Non-Meta Decks,"[""46986414"",""46986414"",""46986414"",""74677422"",""3078380"",""71703785"",""30603688"",""38033121"",""7084129"",""7084129"",""7084129"",""97631303"",""97631303"",""97631303"",""12266229"",""12266229"",""12266229"",""2314238"",""6172122"",""11827244"",""12580477"",""23020408"",""23020408"",""23020408"",""59514116"",""47222536"",""47222536"",""47222536"",""95477924"",""20899496"",""20899496"",""20899496"",""48680970"",""48680970"",""82732705"",""82732705"",""82732705"",""40605147"",""40605147"",""40605147""]","[""37818794"",""37818794"",""41721210"",""85059922"",""50237654"",""44405066"",""96471335"",""21887175"",""86066372"",""49202162"",""38342335"",""2857636"",""65741786"",""70369116"",""31226177""]","[""82697428"",""55063751"",""1118137"",""8949584"",""8949584"",""52947044"",""32807846"",""93600443"",""48130397"",""48130397""]",1655231905,9 months ago,,,0,OG Dark Magician Deck. 99.9% win rate if capable to control the power of dark magician.,This deck is OG
285345,pure-heros-285345,Pure HEROs,40044919,116309,Non-Meta Decks,"[""89943723"",""83965310"",""83965310"",""9411399"",""9411399"",""18094166"",""18094166"",""13650422"",""40044918"",""40044918"",""40044918"",""59392529"",""59392529"",""45195443"",""45195443"",""50720316"",""50720316"",""50720316"",""27780618"",""27780618"",""16605586"",""22865492"",""22865492"",""12071500"",""213326"",""213326"",""213326"",""52947044"",""14532163"",""14532163"",""45906428"",""45906428"",""83764719"",""14088859"",""24094653"",""24094653"",""21143940"",""21143940"",""10045474"",""10045474""]","[""95486586"",""86165817"",""3642509"",""45170821"",""59642500"",""29095552"",""60461804"",""40854197"",""46759931"",""64655485"",""22908820"",""58481572"",""63813056"",""1948619"",""58004362""]","[""82697428"",""55063751"",""1118137"",""8949584"",""8949584"",""52947044"",""32807846"",""93600443"",""48130397"",""48130397""]",1655231905,9 months ago,,,0,Combo-heavy deck that utilises all HEROs to swarm the field with monsters,This deck aims to summon around 3-4 boss monsters during the first turn. Contains numerous ways to complete this if negated.
285349,welshwhale-s-synchro-orcust-285349,WelshWhale's Synchro Orcust,93854893,112848,Non-Meta Decks,"[""93920420"",""4055337"",""4055337"",""55623480"",""69811710"",""57835716"",""57835716"",""21441617"",""21441617"",""4334811"",""4334811"",""4334811"",""14558127"",""14558127"",""14558127"",""72291078"",""23434538"",""23434538"",""23434538"",""94046012"",""94046012"",""94693857"",""9742784"",""9742784"",""9742784"",""24508238"",""24508238"",""97268402"",""97268402"",""2295440"",""26845680"",""26845680"",""26845680"",""96363153"",""96363153"",""96363153"",""24224830"",""24224830"",""90351981"",""703897""]","[""84815190"",""9753964"",""3040496"",""27548199"",""68431965"",""37675907"",""21915012"",""93854893"",""98127546"",""76145142"",""44097050"",""39752820"",""30741503"",""50588353"",""41999284""]","[""36956512"",""36956512"",""59438930"",""59438930"",""59438930"",""24508238"",""24508238"",""95793022"",""54757758"",""18144507"",""43898403"",""43898403"",""23516703"",""23516703"",""23516703""]",1655231905,9 months ago,,,0,Unban Harp Horror,"As Harp Horror is banned in the TCG, Orcust is basically unplayable, however, it is Semi-Limited in the OCG, at the cost of Girsu being Limited, meaning that Orcust is somewhat playable, not a tiered threat, but definitely viable. The archetype revolves around cards with powerful GY effects that banish themselves to gain advantage, as well as cards that return banished cards to gain further advantage.  For the decklist, we have an Orcust package of 1x World Wand, 2x Orcust Knightmare, 1x Girsu(if it were at 3 we would play 3x), 2x Harp Horror(if it were at 3 we would play 3x), 2x Cymbal Skeleton, 2x Brass Bombard, 3x Orcustrated Return, 1x Babel, 1x Crescendo, 2x Dingirsu, 1x Longirsu, and 1x Galatea, for the rest of the Main Deck, we have a Handtrap lineup of 3x Ash Blossom, 3x Maxx C, 2x D.D. Crow, and 2x Veiler, 1x Fairy Tail - Snow, 3x Scrap Recycler, 1x O-Lion, 1x Deskbot 001, 3x Jet Synchron, 1x One for One, and 3x Tuning, for the rest of the Extra Deck, we have 1x Baronne, 1x Chaos Ruler, 1x Borreload Savage, 1x Shooting Riser, 1x Accel Synchron, 1x Cupid Pitch, 1x Underworld Goddess, 1x Auroradon, 1x Lib the World Key Blademaster, 1x Halqifibrax, and 1x Linkuriboh."
