deck_num,pretty_url,deck_name,cover_card,userid,format,main_deck,extra_deck,side_deck,ts_submit_date,submit_date,ts_edit_date,edit_date,comments,deck_excerpt,deck_description
234143,metaphys-link-dragon-234143,Metaphys Link Dragon,28297833,97070,Non-Meta Decks,"[""18743376"",""18743376"",""72355272"",""72355272"",""72355272"",""45960523"",""45960523"",""45960523"",""19476824"",""19476824"",""12196873"",""12196873"",""66719533"",""66719533"",""20720928"",""54199839"",""52714670"",""10000080"",""10000080"",""29726552"",""80280944"",""92998610"",""28297833"",""28297833"",""28297833"",""36584821"",""36584821"",""44440058"",""18964575"",""18964575"",""18144507"",""49238328"",""98645731"",""86541496"",""86541496"",""68073522"",""75500286"",""30241314"",""23068051"",""81674782""]","[""27548199"",""74586817"",""46772449"",""82633039"",""11738489"",""10669138"",""10669138"",""86066372"",""4280258"",""38342335"",""2857636"",""75452921"",""22862454"",""41999284"",""41999284""]","[""27204311"",""27204311"",""27204311"",""20720928"",""20899496"",""20899496"",""20899496"",""23068051"",""73599290"",""73599290"",""73599290"",""84749824"",""40605147"",""40605147"",""40605147""]",1647023905,1 year ago,,,0,This deck focused on using the banish-recycle of the Metaphys Archetype with Necroface and looping it until you can create an extra link out of the Ex,"This deck focused on using the banishment characteristic of the Metaphys Archetype and recycling it with <a data-name=""Necroface"">Necroface</a> and looping it until you can create an extra link out of the Extra Deck.  This deck is most successful when you start as the second-turn player. You need to analyst the opponent's move at the first turn to make your strategy work on them. Make sure you get <a data-name=""Macro Cosmos"">Macro Cosmos</a> / <a data-name=""Dimensional Fissure"">Dimensional Fissure</a> either with <a data-name=""Left Arm Offering"">Left Arm Offering</a> or by drawing them. You can also use <a data-name=""Left Arm Offering"">Left Arm Offering</a> to banish <a data-name=""Necroface"">Necroface</a> in your hand, or when there's none of them in your hand try to get <a data-name=""Gold Sarcophagus"">Gold Sarcophagus</a> and then start banishing your opponent monsters by selecting <a data-name=""Necroface"">Necroface and </a>then activating the banished Metaphys card.  Protect your fragile monster with getting Metaphys Decoy Dragon that will banish itself to summon disruptive monster such as Metaphys Daedalus (can banishing all special summoned monster) or Metaphys Nephthys (can banishing all set spell/trap card) or you can summon Metaphys Ragnarok to enhance your chance of banishing Necroface.  Protect yourself from getting decked out by special summoning <a data-name=""Nemeses Keystone"">Nemeses Keystone</a> from your hand by recovering <a data-name=""Necroface"">Necroface</a> in your Banish Zone.  Getting your flow stuck because of your key card in the Graveyard? Banish them face-down by using <a data-name=""Five-Headed Link Dragon"">Five-Headed Link Dragon</a> and then recycle them using <a data-name=""Necroface"">Necroface</a>. <a data-name=""Five-Headed Link Dragon"">Five-Headed Link Dragon</a> can also become your immune beatstick to pulverize your opponent LP. Another option for your immune beatstick by summoning Link-6 @Ignister to your field.  When they summoned immune boss monsters such as <a data-name=""Dark Dragoon"">Dark Dragoon</a>, <a data-name=""Phoenix Enforcer"">Phoenix Enforcer</a>, etc; use <a data-name=""Sphere Mode"">Sphere Mode</a> or Kaiju to shut them down."
234147,cavaleiros-da-lenda-234147,cavaleiros da lenda,53315891,90379,Non-Meta Decks,"[""80019195"",""85800949"",""84565800"",""77558536"",""77558536"",""77558536"",""16404809"",""16404809"",""16404809"",""56410040"",""56410040"",""56410040"",""14558127"",""14558127"",""14558127"",""89397517"",""89397517"",""89397517"",""1784686"",""1784686"",""11082056"",""11082056"",""46232525"",""46232525"",""35726888"",""35726888"",""35726888"",""98494543"",""98494543"",""98494543"",""58577036"",""81439173"",""83764719"",""24224830"",""24224830"",""24224830"",""83555666"",""57728570"",""57728571"",""44095762"",""53582587""]","[""53315891"",""53315891"",""53315891"",""83743222"",""46354113"",""19747827"",""44373896"",""22804644"",""84687358"",""63767246"",""93854893"",""88177324"",""2857636"",""49725936"",""31833038""]","[""102380"",""102380"",""102380"",""8267140"",""8267140"",""8267140"",""65681983"",""65681983"",""65681983"",""15693423"",""15693423"",""15693423"",""41420027"",""41420027"",""41420027""]",1647023905,1 year ago,,,0,se divirta jogando,se divertir
234151,synchro-eldlich-deck-profile-tcg-2021-234151,Synchro Eldlich Deck Profile - TCG 2021,95440947,45171,Meta Decks,"[""95440946"",""95440946"",""81866673"",""94973028"",""63362460"",""49959355"",""49959355"",""49959355"",""5780210"",""14558127"",""14558127"",""73642296"",""73642296"",""33420078"",""94693857"",""52947044"",""52947044"",""52947044"",""24224830"",""94224458"",""31434645"",""31434645"",""31434645"",""10045474"",""10045474"",""10045474"",""20612097"",""20612097"",""20612097"",""53582587"",""53582587"",""53582587"",""20590515"",""20590515"",""20590515"",""93191801"",""93191801"",""40605147"",""40605147"",""40605147""]","[""60461804"",""84815190"",""27548199"",""33158448"",""79606837"",""21915012"",""90448279"",""73964868"",""2609443"",""86066372"",""44097050"",""50588353"",""50588353"",""70369116"",""98978921""]","[""102380"",""102380"",""102380"",""8267140"",""8267140"",""8267140"",""65681983"",""65681983"",""65681983"",""15693423"",""15693423"",""15693423"",""41420027"",""41420027"",""41420027""]",1647023905,1 year ago,,,0,https://youtu.be/1tmrGq4E07A,https://youtu.be/1tmrGq4E07A
234158,ancient-gear-golem-234158,Ancient Gear Golem,83104731,96823,Non-Meta Decks,"[""83104731"",""83104731"",""83104731"",""50933533"",""50933533"",""50933533"",""39284521"",""5556499"",""5556499"",""5556499"",""42940404"",""42940404"",""42940404"",""78349103"",""78349103"",""78349103"",""1710476"",""1710476"",""1710476"",""37694547"",""37694547"",""37694547"",""83764719"",""5318639"",""5318639"",""5318639"",""86780027"",""86780027"",""86780027"",""73628505"",""70368879"",""10045474"",""10045474"",""10045474"",""82732705"",""73915051"",""12580477"",""4178474"",""67723438"",""67723438""]","[""1546123"",""1546123"",""1546123"",""12652643"",""12652643"",""12652643""]","[""49036338"",""27204311"",""14558127"",""73642296"",""38814750"",""97268402"",""97268402"",""14532163"",""14532163"",""35261759"",""35261759"",""65681983"",""61740673"",""41420027"",""41420027""]",1647023905,1 year ago,,,0,Use cards,Use Cards
234164,code-talker-post-secret-shiny-box-234164,CODE TALKER Post Secret Shiny Box,45462149,10628,Non-Meta Decks,"[""34267821"",""16188701"",""16188701"",""16188701"",""75130221"",""645087"",""645087"",""30114823"",""30114823"",""63528891"",""63528891"",""14558127"",""14558127"",""73642296"",""73642296"",""65100616"",""2347477"",""2347477"",""2347477"",""18789533"",""2295440"",""83764718"",""28827503"",""28827503"",""24224830"",""24299458"",""24299458"",""24299458"",""10045474"",""10045474"",""94192409"",""94192409"",""36975314"",""36975314"",""36975314"",""7403341"",""7403341"",""40605147"",""40605147"",""40605147""]","[""5043010"",""86066372"",""86066372"",""46947713"",""46947713"",""61245672"",""61245672"",""88093706"",""53413628"",""59859086"",""59859086"",""98978921"",""24842059"",""41999284"",""60303245""]","[""49036338"",""27204311"",""14558127"",""73642296"",""38814750"",""97268402"",""97268402"",""14532163"",""14532163"",""35261759"",""35261759"",""65681983"",""61740673"",""41420027"",""41420027""]",1647023905,1 year ago,,,0,Code Talker deck by YGO Lite,https://youtu.be/H9y0cS2sfvQ
234169,predaplant-new-support-234169,Predaplant new support!,35272499,26113,Non-Meta Decks,"[""48686504"",""48686504"",""48686504"",""35272499"",""35272499"",""35272499"",""61677004"",""61677004"",""89181134"",""89181134"",""70427670"",""70427670"",""70427670"",""17825378"",""17825378"",""44932065"",""44932065"",""44932065"",""53819028"",""68468459"",""14558127"",""14558127"",""14558127"",""97268402"",""31643613"",""31643613"",""31643613"",""8148322"",""14463695"",""88069597"",""44362883"",""44362883"",""44362883"",""48130397"",""48130397"",""76647978"",""1845204"",""10045474"",""10045474"",""10045474""]","[""66309175"",""66309175"",""25586143"",""69946549"",""79864860"",""41209828"",""39915560"",""11321089"",""44146295"",""44146295"",""70534340"",""70534340"",""87746184"",""54757758"",""70369116""]","[""61173621"",""61173621"",""34773082"",""34773082"",""27847700"",""27847700"",""81439174"",""101108019"",""89181134""]",1647023905,1 year ago,,,0,Much more powerful and consistent!!!!,"So, I've been watching replay videos and seeing decklists that have come out since the announcement of the new support. Its looked pretty cool, except all of the replay videos had people either opening both pendulums, instand fusion, or scorpio/predapractice. My first hand? Cobra, Chlam, and a few hand traps. Its doable, but not nearly optimal. Because of that, I added lonefire to have 12 ways into my best combos (see earth machine for the statistics on those numbers)..... anyway, here's the deck. Hope Y'all like it!"
234173,into-the-vrains-muskets-234173,Into the Vrains MUSKETS,28827503,17333,Non-Meta Decks,"[""28827503"",""28827503"",""94821366"",""94821366"",""68024506"",""31629407"",""31629407"",""31629407"",""5230799"",""5230799"",""68246154"",""68246154"",""32841045"",""32841045"",""32841045"",""14558127"",""14558127"",""14558127"",""35261759"",""35261759"",""70368879"",""83764718"",""25789292"",""25789292"",""70389815"",""70389815"",""70389815"",""93356623"",""93356623"",""93356623"",""20745268"",""20745268"",""20745268"",""66149377"",""92650018"",""92650018"",""92650018"",""29628180"",""29628180"",""29628180""]","[""90448279"",""56832966"",""84013237"",""46772449"",""21044178"",""31320433"",""86066372"",""72529749"",""38342335"",""2857636"",""75452921"",""71791814"",""71791814"",""71791814"",""41999284""]","[""71278040"",""5230799"",""25311006"",""35261759"",""54693926"",""84211599"",""8267140"",""24224830"",""24299458"",""25789292"",""10045474"",""66149377"",""47810543"",""92534075""]",1647023905,1 year ago,,,0,Into the Vrains MUSKETS,Into the Vrains MUSKETS
234177,cyber-strike-234177,Cyber Strike,37542782,97078,Non-Meta Decks,"[""79875526"",""5370235"",""5373478"",""70095154"",""59281922"",""29975188"",""1142880"",""23893227"",""56364287"",""29719112"",""3657444"",""3370104"",""41230939"",""77625948"",""3019642"",""45078193"",""82562802"",""70298454"",""63941210"",""71197066"",""16229315"",""32768230"",""64753988"",""86686671"",""60600126"",""55704856"",""80033124"",""44352516"",""77565204"",""6498706"",""59432181"",""63995093"",""23171610"",""1157683"",""18597560"",""10045474"",""63031396"",""76403456"",""97077563"",""98414735"",""82428674"",""37630732"",""3659803""]","[""1546123"",""64599569"",""18967507"",""40418351"",""37542782""]",,1647023905,1 year ago,,,0,"A ""Cyberdark"" Deck is a varied Deck primarily focusing on Beatdown and Control. The Deck uses Machine monsters primarily and Dragon monsters secondari","A <b>Cyberdark Deck</b> focuses on the use of machine cards, with dragon cards supporting. Making a proper build of this deck type requires good spell and trap cards that help fill up the graveyard quickly, so you can take advantage of discard cards like Tribute to the Doomed and Monster Reincarnation. Future Fusion and Foolish Burial are also effective for getting level 3 or lower dragons in the graveyard. Fusion monsters are used as auxiliary backup, being formed from, Cyberdark Impact!, Overload Fusion, and Dragon's Mirror they require that there be proper material monsters in the grave, making the use of them late game only, unless used in conjunction with Future Fusion. Virus cards can be used for addition advantage because Cyberdark monsters span the spectrum of their requirements. Synchro support comes in the form of level 7 and 6 monsters specifically Goyo Guardian, Dark Strike Fighter and Black Rose Dragon  Cyberdark Horn, Cyberdark Edge, and Cyberdark Keel in addition to having equipping effects each have a unique addition damage ability that punishes defensive play by an opponent. Cyberdark Horn, Cyberdark Edge, and Cyberdark Keel deliver piercing, direct, and burn damage respectively.  Cyberdarks are by themselves very weak monsters, with only 800 attack points, even a skilled duelist will get nervous using a deck like this, it has a lot of weaknesses, being near completely aggressive, relying on the grave to gain momentum, and weak against anti-monster spell/trap cards. Another looming threat is that the opponent turn this deck's graveyard against the duelist, like by using Monster Reborn on a Blue-Eyes White Dragon. A threat like this can be remedied by using dragons that are difficult to special summon like Yamata Dragon and Tyrant Dragon, or even dragons that cannot be special summoned from the graveyard like Diabolos, King of the Abyss, Light and Darkness Dragon, Armed Dragon LV10, Armed Dragon LV7, Dark Armed Dragon, Rainbow Dragon, or Rainbow Dark Dragon.  Ultimately, the high level dragon monsters used for Cyberdark Dragon in this deck comes down to the duelist's taste. If he or she wants to play it safe, then the aforementioned dragons can be used. If the duelist enjoys the Red-Eyes Black Dragon or Blue-Eyes White Dragon cards, they splash in very well. If the duelist wants to use a lot of Synchro Monster, then this deck can be easily geared towards powerful Synchro Dragons as well. Factors in deciding this depend on whether the deck is Dragon or Machine focused, and Fusion or Synchro focused.  The effects of the Cyberdarks only activate when they are Normal Summoned and cards such as Compulsory Evacuation Device, Pulling the Rug and Solemn Judgment will negate them. If a Cyberdark is in the graveyard, use Monster Reincarnation to discard a low level dragon and get the Cyberdark back in your hand and then re-summon it again and equip it with the dragon that was just discarded. Dark Eruption is a very good card for this deck too.  A nice little trick is to use Dark Armed Dragon or Light and Darkness Dragon to be equiped to Cyberdark Dragon. Both have 2800 attack which brings Cyberdark Dragon to 3800 not including the monsters in the grave. With Light and Darkness Dragon, when he's destroyed while being treated as an equip card, his second effect will still activate, wiping your field and summoning any monster from your grave. This can be useful if you just tributed your dragon for a virus, or if it was killed by a spell or trap such as Mirror Force."
234183,dark-magician-deck-2021-post-battle-of-chaos-new-234183,DARK MAGICIAN DECK 2021 POST BATTLE OF CHAOS NEW,37818794,28173,Non-Meta Decks,"[""46986414"",""46986414"",""74677422"",""3078380"",""38033121"",""7084129"",""7084129"",""7084129"",""14558127"",""14558127"",""14558127"",""97631303"",""97631303"",""97631303"",""12266229"",""12266229"",""12266229"",""1845204"",""6172122"",""6172122"",""6172122"",""11827244"",""96729612"",""96729612"",""23020408"",""23020408"",""23020408"",""59514116"",""47222536"",""47222536"",""10045474"",""10045474"",""10045474"",""48680970"",""48680970"",""61740673"",""82732705"",""40605147"",""40605147"",""40605147""]","[""84433295"",""37818794"",""37818794"",""41721210"",""50237654"",""41578483"",""90448279"",""44405066"",""86066372"",""45819647"",""70369116"",""70369116"",""98978921"",""31226177"",""34755994""]","[""27204311"",""27204311"",""27204311"",""34267821"",""34267821"",""34267821"",""94145021"",""94145021"",""94145021"",""8267140"",""8267140"",""8267140"",""83326048"",""83326048"",""83326048""]",1647023905,1 year ago,,,0,dark magician deck profile 2021,https://youtu.be/UqWTUFfx774
234192,i-broke-fabled-234192,I Broke Fabled!,83039608,97061,Non-Meta Decks,"[""43316238"",""70711847"",""52350806"",""43694650"",""99745551"",""14878871"",""14878871"",""29905795"",""29905795"",""29905795"",""83039608"",""83039608"",""82888408"",""82888408"",""82888408"",""18282103"",""18282103"",""18282103"",""24040093"",""24040093"",""97439806"",""22555834"",""25311006"",""83764719"",""72892473"",""67169062"",""43422537"",""43422537"",""72634965"",""72634965"",""60303688"",""60303688"",""13694209"",""69680031"",""69680031"",""1984618"",""1984618"",""10045474"",""10045474"",""61740673""]","[""41373230"",""80532587"",""84815190"",""9753964"",""3040496"",""50954680"",""33158448"",""64880894"",""47395382"",""90953320"",""71166481"",""66403530"",""38342335"",""2857636"",""50588353""]","[""27204311"",""27204311"",""27204311"",""34267821"",""34267821"",""34267821"",""94145021"",""94145021"",""94145021"",""8267140"",""8267140"",""8267140"",""83326048"",""83326048"",""83326048""]",1647023905,1 year ago,,,0,"(I didn't, but I promise it's worth a look)","<span>Put simply, I love the Fabled cards and decided to try and make them as playable as possible and it's... actually not bad. Previous to this, every Fabled deck I have seen has pretty much been geared towards 'summon Cosmic Blazar Dragon and pass', this deck can do a lot more. By 'making Fableds playable' have I stuck in other archetypes and some floodgates? Absolutely! But theres genuine synergy here I swear and anytime cards are old enough not to include a 'once per turn' clause there's room for abusing that. </span>  <span>The goal of the deck is to climb into some of the biggest baddest synchros in the game (Baronne de Fleur has REALLY helped this, and it's great at summoning it) while drawing into some of your power cards (Dogmatikas, Nadir Servant especially) and floodgates (Vanity's Ruler, Imperial Order).</span>  <span>MAIN DECK</span>  <span>Rescue Cat, the Danger!s and the beast-type Fableds all aim to summon themselves as much as possible with an ideal combo of Hyper librarian -&gt; Fabled Ragin -&gt; Stardust Charge Warrior -&gt; Chaos Ruler -&gt; BdF netting you a tidy 7 draws, a 5 deep pseudo-search for a monster of your choosing and an omni-negate to boot. Grimro and Kushano help facilitate plays along with Double Summon, Monster Reborn, and Card Destruction to trigger some of your Fabled beasts effects. While risky given the number of decks that love to dump hand components into the grave it's necessary to kick off an otherwise dead hand and potentially gives you knowledge on how to adjust your end board. Stairway to a Fabled Realm is an in-archetype Foolish Burial with a second effect to discard in exchange for a Fabled in the grave. It's rare but it does sometimes come up. Pot of Avarice and TTT are for draw power. Double summon works wonders when you just can't reach the next stage of a combo and can be used to bring out Vanity's Ruler.</span>  <span>The Dogmatika cards are great going first or second and are super versatile being able to extend combos, add negates and OTK. I often find myself drawing nadir servant somewhere along my combo going first and can just set it until the end of my turn giving me Ecclesia on field and Fleurdelis in hand to add to whatever synchro threats I've been able to establish. Alternatively both Ecclesia and Fleurdelis can be used as synchro combo extenders with a Fleurdelis (or Ashiyan) + either of my lvl 2 Fabled tuners making BdF straight off the bat. I know Ashiyan doesn't feature in every Dogmatika deck but given all the synchro climbing he often gets a chance to summon and can fetch a Fleurdelis or Ecclesia that's fallen foul of a Danger! or Card Destruction.</span>  <span>Imperm is great going first and second and very few decks like to play through Imperial Order. Side deck is still a work in progress but Royal Decree is devastating against the decks that don't care about IO and as a 3 of, this deck can almost garuntee working its way through to a copy .</span>  <span>EXTRA DECK</span>  <span>Titaniklad and Nt'ss are standard Nadir fodder.</span>  <span>Hyper Librarian, Ragin and Stardust Charge Warrior are draw power early combo. Dawn Dragster, Crystal Wing, Archfiend Abyss and BdF are negates to build a board with. Chaos Ruler is truly an MVP of the deck. The 5 deep dig will almost always pick you up the missing Vanity's Ruler, Ecclesia or Fabled you need to extend the combo with. On top of that you can Synchro it away to make Archfiend Abyss or BdF and then bring it back to make the other should you have another tuner.</span>  <span>Gossip Shadow gives you at least some form of protection on the odd time when you don't draw a tuner and enables Dogmatika plays.</span>  <span>Halqifibrax helps with link plays, the Knightmares deal with problematic threats while also enabling a sometimes essential discard and Zeroboros is a boardwipe. With Fleurdelis you can even trigger this on your opponents turn should you fancy it. </span>  <span>SUMMARY</span>  <span>It's not going to take the meta by storm, but the Fabled monsters form the core of what is a surprisingly versatile and adaptive deck that can be a real headache for a lot of other decks to get round. I've not seen anyone else play anything quite like this. Perhaps because it is DIFFICULT and there are some cards that will fundamentally just stop it in its tracks but the result is far more effective than I had hoped for when I started out. Open to any and all feedback and constructive criticism.</span>  &nbsp;"
234200,swordsoul-tenyi-with-dpe-234200,Swordsoul Tenyi with Dpe,69248256,30882,Non-Meta Decks,"[""6728559"",""87052196"",""87052196"",""87052196"",""23431858"",""23431858"",""98159737"",""93490856"",""93490856"",""93490856"",""56495147"",""56495147"",""20001443"",""20001443"",""20001443"",""63362460"",""81866673"",""55273560"",""55273560"",""55273560"",""14558127"",""14558127"",""14558127"",""97268402"",""97268402"",""97268402"",""35261759"",""35261759"",""35261759"",""52947044"",""52947044"",""52947044"",""56465981"",""56465981"",""56465981"",""93850690"",""51684157"",""51684157"",""10045474"",""10045474"",""10045474"",""14821890"",""61740673""]","[""60461804"",""42632209"",""40139997"",""96633955"",""84815190"",""19048328"",""9464441"",""5041348"",""69248256"",""69248256"",""83755611"",""43202238"",""78917791"",""70369116"",""32519092""]","[""27204311"",""27204311"",""27204311"",""34267821"",""34267821"",""34267821"",""94145021"",""94145021"",""94145021"",""8267140"",""8267140"",""8267140"",""83326048"",""83326048"",""83326048""]",1647023905,1 year ago,,,0,Swordsoul Tenyi with Dpe,Swordsoul Tenyi with Dpe
234204,phantom-knight-raidraptor-time-thief-234204,Phantom Knight Raidraptor Time Thief,86221741,26538,Non-Meta Decks,"[""56308388"",""56308388"",""83236601"",""83236601"",""83236601"",""87321742"",""87321742"",""87321742"",""64730881"",""64730881"",""96345188"",""82496097"",""82496097"",""19891131"",""19891131"",""19891131"",""31314549"",""52159691"",""90432163"",""36426778"",""36426778"",""46589034"",""46589034"",""1475311"",""74117290"",""74117290"",""74117290"",""81439173"",""88504133"",""88504133"",""18678554"",""18678554"",""98827725"",""98827725"",""98827725"",""25542642"",""25542642"",""13486638"",""76587747"",""76587747""]","[""43047672"",""86221741"",""98452268"",""96157835"",""64276752"",""55285840"",""55285840"",""91135480"",""28781003"",""59208943"",""73347079"",""73347079"",""26692769"",""36429703"",""36429703""]","[""27204311"",""27204311"",""94145021"",""94145021"",""54693926"",""54693926"",""54693926"",""18144507"",""14532163"",""14532163"",""14532163"",""23002292"",""10045474"",""10045474"",""10045474""]",1647023905,1 year ago,,,0,"My take on mixing Phantom Knights, Raidraptors, and Time Thief","Use the RR to get up to PK stuff, end on Ultimate Falcon, Redoer, Bardiche, and a fog blade or two."
