deck_num,pretty_url,deck_name,cover_card,userid,format,main_deck,extra_deck,side_deck,ts_submit_date,submit_date,ts_edit_date,edit_date,comments,deck_excerpt,deck_description
234771,witchcrafter-60-cards-234771,WITCHCRAFTER 60 CARDS,9603252,77125,Non-Meta Decks,"[""49036338"",""71074418"",""71074418"",""21522601"",""21522601"",""84523092"",""84523092"",""81866673"",""21744288"",""21744288"",""21744288"",""63362460"",""95245544"",""95245544"",""95245544"",""38814750"",""38814750"",""38814750"",""59851535"",""64756282"",""64756282"",""64756282"",""97631303"",""97631303"",""97631303"",""1845204"",""23314220"",""52947044"",""52947044"",""52947044"",""57916305"",""57916305"",""57916305"",""58577036"",""73594093"",""83301414"",""83301414"",""83301414"",""89739383"",""35098357"",""35098357"",""24224830"",""24299458"",""24299458"",""24299458"",""56894757"",""70226289"",""70226289"",""70226289"",""19673561"",""40252269"",""40252269"",""40252269"",""83289866"",""76375976"",""76375976"",""76375976"",""32723153"",""94553671"",""94553671""]","[""9603252"",""9603252"",""9603252"",""60461804"",""41578483"",""3040496"",""28400508"",""63767246"",""57314798"",""86066372"",""45819647"",""8264361"",""50756327"",""70369116"",""94259633""]","[""102380"",""102380"",""102380"",""85103922"",""34267821"",""34267821"",""34267821"",""8267140"",""8267140"",""58921041"",""58921041"",""58921041"",""84749824"",""84749824"",""84749824""]",1647023905,1 year ago,,,0,New support is amazing,New support is amazing
234775,starry-knight-2021-234775,Starry Knight 2021,90835938,20425,Fun/Casual Decks,"[""90835938"",""90835938"",""90835938"",""20292186"",""20292186"",""23220533"",""23220533"",""23220533"",""44818"",""44818"",""44818"",""85590798"",""85590798"",""85590798"",""58406094"",""18144506"",""35261759"",""35261759"",""35261759"",""12580477"",""22007085"",""22007085"",""22007085"",""24224830"",""43898403"",""43898403"",""21985407"",""21985407"",""21985407"",""12444060"",""12444060"",""12444060"",""58374502"",""58374502"",""58374502"",""53582587"",""53582587"",""53582587"",""80101899"",""80101899""]","[""38694052"",""39317553"",""56832966"",""16195942"",""16195943"",""84013237"",""55285840"",""90590303"",""6983839"",""48739166"",""61344030"",""581014"",""21044178"",""5821478"",""38342335"",""2857636""]","[""102380"",""102380"",""102380"",""85103922"",""34267821"",""34267821"",""34267821"",""8267140"",""8267140"",""58921041"",""58921041"",""58921041"",""84749824"",""84749824"",""84749824""]",1647023905,1 year ago,,,0,Budget Starry Knight deck (~$150),"Scythe lock to win.  Other potential cards: handtraps, pot of extravagance, ice dragon's prison, solemn traps, nibiru, lightning storm, DPE package, Zeus"
234779,zombie-deck-dec-2021-new-support-234779,Zombie Deck Dec. 2021 New Support,38192988,15081,Non-Meta Decks,"[""95440946"",""95440946"",""45154513"",""45154513"",""39185163"",""39185163"",""66570171"",""52467217"",""52467217"",""52467217"",""92826944"",""92826944"",""92826944"",""94801854"",""94801854"",""94801854"",""49959355"",""49959355"",""49959355"",""14558127"",""14558127"",""14558127"",""73642296"",""73642296"",""36630403"",""33420078"",""18760514"",""18760514"",""92964816"",""19942835"",""19942835"",""19942835"",""24224830"",""48130397"",""48130397"",""48130397"",""4064256"",""4064256"",""10045474"",""10045474"",""10045474"",""32335697"",""32335697""]","[""74889525"",""8198620"",""41209827"",""59843383"",""38192988"",""38192988"",""83283063"",""65187687"",""65187687"",""28240337"",""52711246"",""91575236"",""37129797"",""91420202"",""41999284""]",,1647023905,1 year ago,,,0,https://youtu.be/G3Q3pk88vuw,https://youtu.be/G3Q3pk88vuw
234790,new-pendulum-magician-deck-post-dimension-force-2021-234790,New Pendulum Magician deck post dimension force 2021,22125101,28173,Non-Meta Decks,"[""14920218"",""14920218"",""14920218"",""12289247"",""12289247"",""12289247"",""20292186"",""40318957"",""40318957"",""75672051"",""72714461"",""72714461"",""72714461"",""49684352"",""49684352"",""49684352"",""58092907"",""47075569"",""48461764"",""44179224"",""44179224"",""44179224"",""73941492"",""73941492"",""73941492"",""20409757"",""54941203"",""54941203"",""54941203"",""35261759"",""35261759"",""35261759"",""37469904"",""37469904"",""37469904"",""53208660"",""53208660"",""58308221"",""74850403"",""1344018""]","[""84815190"",""27548199"",""98558751"",""90448279"",""47349116"",""6983839"",""86066372"",""4280258"",""45819647"",""45819647"",""7480763"",""50588353"",""50588353"",""22125101"",""34755994""]","[""9464441"",""5041348"",""70771599"",""33158448"",""42160203"",""21044178"",""85289966"",""36111775"",""41620959"",""72490637"",""1344018"",""1344018""]",1647023905,1 year ago,,,0,pendulum magician deck profile 2021,https://youtu.be/VK03h2Rmn1Q
234794,f-a-dpe-metalfoes-234794,F.A. DPE Metalfoes,33158448,87835,Non-Meta Decks,"[""69351984"",""7868571"",""7868571"",""56518311"",""58844135"",""58844135"",""10024317"",""6764709"",""81866673"",""94973028"",""63362460"",""93449450"",""93449450"",""93449450"",""94693857"",""18716735"",""18716735"",""39271553"",""39271553"",""39271553"",""94145021"",""94145021"",""94145021"",""52947044"",""52947044"",""52947044"",""58549532"",""73594093"",""38459905"",""38459905"",""38459905"",""67723438"",""67723438"",""1061200"",""1061200"",""2144946"",""2144946"",""12931061"",""12931061"",""39838559"",""33327029"",""69711728""]","[""60461804"",""4688231"",""77693536"",""40139997"",""84815190"",""75676192"",""27548199"",""33158448"",""76524506"",""39964797"",""79606837"",""21915012"",""44097050"",""50588353"",""70369116""]","[""34267821"",""34267821"",""34267821"",""24299458"",""24299458"",""24299458"",""54693926"",""54693926"",""54693926"",""8267140"",""8267140"",""8267140"",""7811875"",""7811875"",""7811875""]",1647023905,1 year ago,,,0,"F.A. DPE and Metalfoes, real straight forward","With DPE being one of the best boss monsters of this format, it's no surprise that he fits very well into FA Metalfoes a deck that has great synergy with destroying their own cards for searching and card advantage. This deck runs DPE as well as the basic Halifibrax combo that can end on 3 negates quite easily, you could also consider DPE as a backup strategy for when your main combo line gets disrupted. Other options for the deck include the artifact scythe lock with Dagda as any deck running DPE with a decent extra deck spam engine can consider Dagda.  The main combo line will start with trying to get two monsters, one being a tuner, to try and get out Halqifibrax, from here you simply summon the Deskbot 001 from the deck, link 3 into Mecha Phantom Beast Auroradon get 3 tokens, summon the Deckbot 001 from grave with its effect, synchro 4 for a Quandax, use Auroradon's effect to tribute two tokens and summon a Phantom Beast from the deck, get Coltwing, summon the two tokens, and then synchro into Dawn Dragster and Borrel Savage. At this point, there are a bunch of extenders you could try going for, but you'll likely end with a Herald of the Arclight or a Baronne de Fleur/Ruddy Rose. IT may seem like a lot but it's pretty straightforward once you get a hang of it.  This combo is quite fragile and can be disrupted fairly easily by a lot of decks so you'll be a victim of games that feel like you lose at the coin flip but you have many options for going second. The deck works well with droplets as there are quite a good amount of cards that you'd like to be in the graveyard. And Dark Ruler no more is basically an auto-include since you can't really combo into most meta boards. If all that fails trying for a one synchro board plus gravity collapse does work quite well as shutting your opponent out of summons for the rest of the turn on a spell speed 3 is, as expected, really good."
234798,majespecter-new-support-2021-234798,MAJESPECTER New support 2021,31991800,10628,Non-Meta Decks,"[""86395581"",""86395581"",""86395581"",""94784213"",""94784213"",""94784213"",""645794"",""645794"",""645794"",""68395509"",""68395509"",""68395509"",""46999905"",""46999905"",""46999905"",""31991800"",""31991800"",""31991800"",""5506791"",""5506791"",""5506791"",""13972452"",""40450317"",""40450317"",""73628505"",""13611090"",""13611090"",""24224830"",""49366157"",""49366157"",""76473843"",""76473843"",""76473843"",""36183881"",""36183881"",""36183881"",""78949372"",""2572890"",""2572890"",""2572890""]","[""90448279"",""6983839"",""22653490"",""22653490"",""86066372"",""4280259"",""38342335"",""45819647"",""2857636"",""30674956"",""75452921"",""90512490"",""22125101"",""22125101"",""22125101""]","[""27204311"",""27204311"",""14558127"",""14558127"",""14558127"",""73642297"",""73642297"",""94145022"",""94145022"",""14532163"",""14532163"",""14532163"",""10045474"",""10045474"",""10045474""]",1647023905,1 year ago,,,0,Majespecter deck by YGO Lite,https://youtu.be/LEmWx279AG8
234802,meklord-gears-234802,Meklord Gears,4837861,97341,Fun/Casual Decks,"[""4837861"",""4837861"",""4837861"",""3715284"",""3715284"",""3715284"",""75733063"",""75733063"",""75733063"",""2137678"",""2137678"",""2137678"",""68140974"",""68140974"",""4545683"",""77710579"",""29021114"",""29021114"",""29021114"",""55010259"",""55010259"",""55010259"",""66594927"",""66594927"",""39109382"",""39109382"",""39109382"",""2992036"",""2992036"",""2992036"",""77864539"",""77864539"",""77864539"",""49238328"",""49238328"",""49238328"",""14558127"",""14558127"",""10045474"",""10045474""]","[""28912357"",""28912357"",""28912357"",""40216089"",""40216089"",""40216089"",""85289965"",""85289965"",""31833038"",""31833038"",""48739166"",""48739166"",""48739166"",""8387138"",""8387138""]","[""84013237"",""8387138"",""18114794""]",1647023905,1 year ago,,,0,Flood your field with Meklords and Beat Down your opponent,"Using the newest Meklord Army monster to special summon Gear Giant X so you can search more copies of him or Meklord Emperors. Use Meklord assembly to most of the time search out the Meklord Dragon or the newest Meklord Army. With the help of the Gadtets you can always use other Meklord Armies to summon the Gear Gigant. Use Meklord Emperors as comebacks, with Wisels negate effect to prevent deadly spell card effects. By always using your Meklord Armies as material to use first when you search Level 4 Machines to fill your GY with different Meklords. This way you make use of the Meklord Dragon and the power of the newer Trap card to in close cases recycle you Meklords."
234806,tenyi-with-invoked-to-win-234806,Tenyi with Invoked to Win,86120752,9631,Non-Meta Decks,"[""98159737"",""98159737"",""98159737"",""24557335"",""24557335"",""24557335"",""60942444"",""60942444"",""60942444"",""97036149"",""97036149"",""97036149"",""23431858"",""23431858"",""23431858"",""87052196"",""87052196"",""87052196"",""65124425"",""65124425"",""65124425"",""39730727"",""51684157"",""51684157"",""21834870"",""21834870"",""21834870"",""86120752"",""86120752"",""86120752"",""74063034"",""74063034"",""47679935"",""47679935"",""47679935"",""35726888"",""35726888"",""73628505"",""83764719"",""73468603""]","[""5041348"",""32519092"",""32519092"",""32519092"",""78917791"",""23935886"",""5402805"",""5402805"",""38030232"",""49513164"",""85908279"",""12307878"",""75286621"",""75286621"",""11270236""]","[""55063751"",""55063751"",""6983839"",""6511113"",""99590524"",""41420027"",""41420027"",""41420027"",""5318639"",""5318639"",""8267140"",""8267140"",""8267140"",""25789292""]",1647023905,1 year ago,,,0,Tenyi with Invoked to Win,Tenyi with Invoked to Win
234810,utopia-invoked-234810,Utopia Invoked,95134948,95790,Meta Decks,"[""86120751"",""86120751"",""86120751"",""68258355"",""68258355"",""68258355"",""4647954"",""4647954"",""4647954"",""64591429"",""32164201"",""81471108"",""8512558"",""23720856"",""85119159"",""85119159"",""85119159"",""32807846"",""74063034"",""67517351"",""47679935"",""47679935"",""47679935"",""62623659"",""62623659"",""62623659"",""6595475"",""6595475"",""6595475"",""94770493"",""84211599"",""84211599"",""84211599"",""24299458"",""24299458"",""24299458"",""54693926"",""54693926"",""54693926"",""25789292""]","[""48739166"",""75402014"",""56832966"",""34755994"",""75286621"",""75286621"",""21044178"",""90590304"",""90448279"",""95134948"",""73445448"",""68679595"",""56840427"",""84013237"",""62517849""]","[""55063751"",""55063751"",""6983839"",""6511113"",""99590524"",""41420027"",""41420027"",""41420027"",""5318639"",""5318639"",""8267140"",""8267140"",""8267140"",""25789292""]",1647023905,1 year ago,,,2,"Utopia Deck, Invoked deck, Utopia invoked Deck - even 3 negates or nibiro can't stop this deck","I created this deck to be strong and keep playing when the opponent used 2 or 3 negates and/or nibiro. Targets for negate are Invoked and utopia double. If i sp summon Ascended/Armed sage and normal summon Alisteir and the opponent negate the eff of Alisteir then i summon utopia double, the opponent use negate eff again but i chain with utopia double. If i used Ascended sage then i summon number 39, after c39 and then dragner. If i used Armed sage then i summon dragner or directly utopia leo ray (most of the times directly leo ray) if the opponent use negate effect for 3rd time in same turn then i can summon utopia lightning or wait the perfect moment (maybe bp) in his turn (utopia double quick eff) to summon utopia dragonik (5000atk), if the opponent target dragonik with card eff or for attack i can use the quick eff  to equip ZW monster from hand or deck (pegasus/tornado) - until the summoning of dragonik the opponent used 3 cards (negates) so he have 3 cards in his hand, he can't destroy dragonik by batle (almost impossible) so he need to target it by a card eff, with these 3 cards in hand will be very hard for him (absurd), keep in mind also that the summoning of dragonik was done by utopia double which is quick eff so i can chain in case he use something , dragonik is also quick eff. If there is no negates and he use just nibiro against me, after nibiro resolves i can summon Mechaba. So i will have mechaba and token with crazy atk. This strategy can work against the most common cards such as veiller, impermanence, nibiro, etc...  With onomatopaira and Ascended/Armed sage i can end on board: -If he use 1 negate against me then my board will be with ascended sage: dragner ,leo utopia ray, abyss dweller and in his turn i will summon number 22 or 41. -if he use 2 negates then my board is: utopia double + abyss dweller or number 41 and i will chain him in his turn with utopia double to summon dragonik. -if he use 3 negates: my board: utopia double + Zubababancho and i will chain him in his turn with utopia double to summon dragonik (i can use the eff of bancho the next turn if he is still alive also). -if i used armed sage instead ascended sage, for 1 negate: dragner (i prefer to summon directly leo but i mention it because u can summon both dragner and leo), leo utopia ray, abyss dweller . -for 2 negates: utopia double + abyss dweller or number 41 and in his turn i will chain him with utopia double to summon dragonik. -for 3 negates: utopia double + Zubababancho (i can use the eff the next turn) and in his turn i will chain him with utopia double to summon dragonik. -if i want to play safe and avoid nibiro i will just summon Ascended/Armed sage + Utopic Onomatopoeia and then utopia double and then directly utopia leo ray  and the next turn i will have follow ups in my hand.  I have 2 cards in my extra deck for some situations and a backup plan. Number 101: if i am in bad position and i need to clear the field but the opponent is with monster 3000atk+ then i use number 101, i attack and i use the eff to stay alive, then i summon Zeus and i clear the field. Number 101 is helpful in many situations. Utopia the Lightning: i usually summon that card only when i think dragonik is not needed and after 3 or more negates against me, it's helpful in other situations too.  BRICKS SOLUTIONS: -If u draw the spell double or nothing u can go directly with Ascended sage to number 39 ,after c39 ,dragner and etc. With Armed sage instead go to number 41 in defense or go to number 39 - c39 - utopia lightning +tornado. -If u draw pegasus, use Ascended sage for utopia double - number 39 - c39 - dragner - number 22 and in the opponent turn u can summon number 41 in defense after u resolved all your effects. -If u draw tornado or hyper rank up magic, is not big deal because they can be used from the hand, just keep in mind to use Armed Sage for utopia double and (if the opponent use negate eff or not) then add pegasus in hand and chain with utopia double- summon dragonic and equip tornado to him, after use the eff of dragonic to equip pegasus from your hand. -Note: if u are second, in every case try to attack with number 39 (+ double or nothing) and win the duel.  Important note: -in case the opponent try to use negate against u or other, u are able to chain with utopia double because of the activated eff of armed/ascended sage, keep it in mind. -if u use Armed sage, then go directly from utopia double to leo utopia ray (my reccomendation). -if u use armed + ascended sage together for utopia double, be careful which eff u activate first , be smart -Astral Kuriboh is needed in this deck as extra card combo for invoked and onomatopaira, beside Ascended/Armed sage. -You can win a duel with one attack. Combo with utopia double = number 39 = double or nothing. Be smart... -Leo utopia ray eff for negate and halving atk is forever, same goes for Dragonik.  -The deck is good going first/second also. -If u going first u have chance to open Aleister, Meltdown, Onomatopaira, Onomatopickup: 85% + pots = 92%. -If u going first u have chance to open Astral kuriboh, Ascended/Armed sage: 82% +pots = 90% -if u going second and the opponent have a very strong board, u can destroy that board by forbiden dropplet + dark ruler and u can give him a hard time with Forbidden Chalice: 71% chance to open + pots = 85%  This is my updated version, stronger than the previous one (the previous one was with dogmatika which was also good but if the opponent used negate eff then i would end on weak board, that's the reason for this currently update)  P.s. i updated this post few times, last update 31/12/2021."
234814,battlin-boxers-2021-234814,Battlin' Boxers 2021,85121942,73212,Non-Meta Decks,"[""5361647"",""5361647"",""35537251"",""68144350"",""68144350"",""68144350"",""32750341"",""32750341"",""32750341"",""79867938"",""79867938"",""13313278"",""13313278"",""13313278"",""4549095"",""4549095"",""86325573"",""56824871"",""56824871"",""56824871"",""64591429"",""64591429"",""64591429"",""23153227"",""23153227"",""32807846"",""36916401"",""36916401"",""57734012"",""14602126"",""14602126"",""15693423"",""15693423"",""15693423"",""67037924"",""67037924"",""67037924"",""78621186"",""78621186"",""60158866""]","[""52687916"",""26593852"",""26593852"",""90448279"",""90448279"",""85121942"",""85121942"",""59627393"",""59627393"",""71921856"",""71921856"",""23232295"",""23232295"",""6983839"",""41999284""]","[""35537251"",""61679541"",""24184846"",""76589815"",""79371897"",""37478723"",""34149830"",""34149830"",""8316565"",""86049351"",""86049351""]",1647023905,1 year ago,,,0,Battlin' Boxers,<p>Hope you enjoy this deck more on our YouTube channel Jolliescarecrows.</p> <p></p>
234843,blue-eyes-chaos-deck-post-battle-of-chaos-2021-234843,Blue Eyes Chaos Deck Post Battle Of Chaos 2021,43228023,28173,Non-Meta Decks,"[""89631145"",""89631145"",""89631145"",""38517737"",""38517737"",""30576089"",""64202399"",""51786039"",""66961194"",""66961194"",""66961194"",""14558127"",""14558127"",""14558127"",""71039903"",""71039903"",""71039903"",""8240199"",""8240199"",""8240199"",""55410871"",""55410871"",""98287529"",""6853254"",""38120068"",""38120068"",""38120068"",""41620959"",""48800175"",""48800175"",""48800175"",""83764719"",""93437091"",""93437091"",""21082832"",""36350300"",""36350300"",""71143015"",""71143015"",""62089826""]","[""43228023"",""2129638"",""11443677"",""84815190"",""40908371"",""59822133"",""50091196"",""28400508"",""63767246"",""8165596"",""57314798"",""85289965"",""2857636"",""50588353"",""41999284""]","[""97403510""]",1647023905,1 year ago,,,0,THE BEST BLUE EYES DECK 2021 POST BATTLE OF CHAOS YUGIOH! MR5【遊戯王ADS】,https://youtu.be/jBhN9CGagCM
234847,my-constructed-bule-eyes-progression-deck-234847,My constructed Bule-eyes progression deck,2129638,97374,Progression Series,"[""89631139"",""89631139"",""89631139"",""72855441"",""72855441"",""72855441"",""45644898"",""8240199"",""88241506"",""36734924"",""88241506"",""36734924"",""2783661"",""2783661"",""2783661"",""34627841"",""45467446"",""36734924"",""45467446"",""79814787"",""50371210"",""17655904"",""13513663"",""50078509"",""50078509"",""39537362"",""3819470"",""65703851"",""13513663"",""29401950"",""39701395"",""23265313"",""44763025"",""5851097"",""59438930"",""48800175"",""8978197"",""62015408"",""62015408"",""14558127"",""14558127"",""59438930""]","[""2129638"",""2129638"",""39402797"",""40908371""]","[""135598"",""135598"",""135598"",""56343672"",""14878871"",""97926515"",""78082039"",""78082039"",""18144507"",""1689516"",""1689516"",""84749824"",""84749824"",""17078030"",""84749824""]",1647023905,1 year ago,,,0,For my friends progression series,"You cannot use this deck, unless you turn off banlist"
234851,rikka-deck-2022-jan-234851,Rikka deck 2022 (JAN),33779875,40161,Non-Meta Decks,"[""60880471"",""33491462"",""33491462"",""33491462"",""7407724"",""7407724"",""71002019"",""71002019"",""71002019"",""34614910"",""8129306"",""8129306"",""8129306"",""29177818"",""29177818"",""48686504"",""48686504"",""48686504"",""52038441"",""52038441"",""85431040"",""85431040"",""85431040"",""71734607"",""71734607"",""71734607"",""96162588"",""98804359"",""98804359"",""2295440"",""69164989"",""69164989"",""69164989"",""68941332"",""68941332"",""32557233"",""32557233"",""53582587"",""53582587"",""53582587""]","[""40139997"",""72924435"",""90448279"",""9349094"",""33779875"",""33779875"",""33779875"",""10406322"",""95239444"",""6284176"",""3828844"",""21200905"",""21200905"",""72218246"",""41999284""]","[""135598"",""135598"",""135598"",""56343672"",""14878871"",""97926515"",""78082039"",""78082039"",""18144507"",""1689516"",""1689516"",""84749824"",""84749824"",""17078030"",""84749824""]",1647023905,1 year ago,,,1,"more plants, jusk like the amazon  rain florest","This is an overall of my Rikka deck, now experimenting with some neat techs like  Evil thorn,  Crossrose dragon and AA Zeus. I hope you enjoy it."
234857,melffy-stuff-and-things-234857,Melffy Stuff and Things :},53054164,96848,Fun/Casual Decks,"[""20003027"",""20003027"",""20003027"",""93018428"",""93018428"",""93018428"",""57523313"",""57523313"",""56401775"",""56401775"",""63644830"",""63644830"",""63644830"",""82134632"",""97317530"",""97317530"",""97317530"",""73304257"",""73304257"",""22996376"",""22996376"",""14878871"",""14878871"",""12580477"",""72537897"",""72537897"",""72537897"",""78082039"",""53582587"",""53582587"",""68353324"",""68353324"",""68353324"",""17322533"",""17322533"",""17322533"",""56343672"",""56343672"",""97926515"",""97926515""]","[""76833149"",""76833149"",""76833149"",""30439101"",""30439101"",""53054164"",""53054164"",""39972129"",""39972129"",""39972129"",""15240238"",""15240238"",""15240238"",""71095768"",""71095768""]","[""135598"",""135598"",""135598"",""56343672"",""14878871"",""97926515"",""78082039"",""78082039"",""18144507"",""1689516"",""1689516"",""84749824"",""84749824"",""17078030"",""84749824""]",1647023905,1 year ago,,,0,Play Melffy Win Melffy,Play Melffy Win Melffy
234861,branded-despia-with-small-frightfur-engine-234861,Branded Despia (with small Frightfur engine),44362883,35865,Non-Meta Decks,"[""81555617"",""62962630"",""62962630"",""62962630"",""14558127"",""14558127"",""14558127"",""36577931"",""63362460"",""81866673"",""61173621"",""61173621"",""68468459"",""27204311"",""45484331"",""45484331"",""19096726"",""44362883"",""44362883"",""44362883"",""82738008"",""82738008"",""36637374"",""36637374"",""36637374"",""24224830"",""65681983"",""65681983"",""65681983"",""34773082"",""34773082"",""52947044"",""52947044"",""52947044"",""18973184"",""24094653"",""24094653"",""10045474"",""10045474"",""10045474""]","[""87746184"",""87746184"",""34848821"",""72272462"",""60461804"",""60461804"",""11321089"",""11321089"",""70534340"",""70534340"",""6855503"",""44146295"",""44146295"",""69946549"",""1906812""]","[""94145021"",""94145021"",""94145021"",""43534808"",""43534808"",""24299458"",""24299458"",""24299458"",""18144506"",""43898403"",""43898403"",""43898403"",""15693423"",""15693423"",""15693423""]",1647023905,1 year ago,,,8,Best deck??,"Youtube link (w/combo) in the comments!  This might just be new best deckf or the tag post banlist! (and in the ocg for sure)  You can also add a small Shaddoll engine if you want, just 1 beast and 1 winda, but the topping ocg lists didn't run it so I'm not either"
234865,lon1-234865,LON1,31829185,96370,Non-Meta Decks,"[""31829185"",""66989694"",""66989694"",""69140098"",""69140098"",""87303357"",""68049471"",""68049471"",""5434080"",""67105242"",""67105242"",""67105242"",""76305638"",""76305638"",""77527210"",""77527210"",""57579381"",""88472456"",""88472456"",""12953226"",""88240808"",""88240808"",""40133511"",""84080938"",""84080938"",""14644902"",""14644902"",""69954399"",""6343408"",""6343408"",""69832741"",""15866454"",""15866454"",""15866454"",""6343408"",""33550694"",""21598948"",""7565547"",""62279055"",""62279055"",""57882509"",""57882509"",""57882509"",""5616412"",""69122763""]","[""21175632"",""21175632""]","[""45894482"",""45894482"",""33737664"",""14644902"",""69832741"",""69832741""]",1647023905,1 year ago,,,0,Hopefully win,Hopefully win
