deck_num,pretty_url,deck_name,cover_card,userid,format,main_deck,extra_deck,side_deck,ts_submit_date,submit_date,ts_edit_date,edit_date,comments,deck_excerpt,deck_description
277841,lob-draft-277841,Lob draft,38033126,113798,Non-Meta Decks,"[""10202894"",""85639257"",""85639257"",""85639257"",""32452818"",""32452818"",""13039848"",""13039848"",""13039848"",""53129443"",""73134081"",""66788016"",""46130346"",""46130346"",""46130346"",""55144522"",""55144522"",""72302403"",""50045299"",""76184692"",""83887306"",""98252586"",""91595718"",""91595718"",""36607978"",""36607978"",""36607978"",""72842870"",""72842870"",""72842870"",""76184692"",""50913601"",""50913601"",""50913601"",""45042329"",""45042329"",""37820550"",""37820550"",""98252586"",""76184692""]","[""9293977"",""17881964"",""70681994"",""70681994"",""70681994""]","[""27204311"",""27204311"",""27204311"",""18144507"",""43898403"",""43898403"",""43898403"",""83326048"",""83326048"",""43534808"",""43534808"",""43534808"",""24207889"",""24207889"",""24207889""]",1652639905,10 months ago,,,0,Week 1 of progression,Week 1 deck
277837,greek-deck-277837,Greek deck,90448279,32446,Fun/Casual Decks,"[""16956455"",""16956455"",""16956455"",""32296881"",""32296881"",""75292259"",""75292259"",""75292259"",""48964966"",""89810518"",""48964966"",""47826112"",""18551923"",""66733743"",""66733743"",""73702909"",""73702909"",""73702909"",""69526976"",""71395725"",""66337215"",""69526976"",""49922726"",""50491121"",""14214060"",""46986414"",""46986414"",""39111158"",""14258627"",""90876561"",""25652259"",""64788463"",""89494469"",""51534754"",""61854111"",""61854111"",""61854111"",""93087299"",""50078509"",""18807109"",""50078509"",""31423101"",""31423101""]","[""90448279"",""90448279"",""90448279"",""37706769"",""37706769""]","[""83477829""]",1652639905,10 months ago,,,1,"Greek gods,myths, and monsters",Write your deck strategy here...just basically find all ancient Greek related cards.
277833,master-duel-krawlers-277833,Master Duel Krawlers,92781606,46423,Non-Meta Decks,"[""62587693"",""83477829"",""69811710"",""14558127"",""14558127"",""14558127"",""10698416"",""83293307"",""83293307"",""83293307"",""51205763"",""51205763"",""51205763"",""15710054"",""23434538"",""23434538"",""23434538"",""28388927"",""28388927"",""28388927"",""88316955"",""88316955"",""88316955"",""65899613"",""67831115"",""67831115"",""84211599"",""84211599"",""99674361"",""31706048"",""31706048"",""31706048"",""43140791"",""43140791"",""43140791"",""89320376"",""89320376"",""27705190"",""27705190"",""27705190""]","[""29479265"",""86066372"",""39752820"",""92781606"",""92781606"",""66393507"",""66393507"",""66393507"",""39998992"",""39998992"",""39998992"",""98978921"",""70709488"",""4280258"",""60303245""]",,1652639905,10 months ago,,,0,"“They see me Krawlin, they hating”","While everyone else is making swordsouls and punks I made Krawlers and made lots of ragequits which I shouldn’t be able to do.  You know there’s something wrong with the players in this game when Krawlers cause even a single ragequit and here I am getting 5 in a row.  But my god do I love this deck.  The goal of this deck is to set up a legion of x-krawlers as soon as you can but an alternative goal that seems to also come up offer in getting deus flipped up quickly. The deck itself is pretty easy to get as well as most of it is commons.  Oh, did you know that all of the X-krawler link monsters have animations when they hit the field? I was pretty surprised by this fact."
277829,master-duel-p-u-n-k-tenyi-synchro-277829,Master Duel - P.U.N.K. Tenyi Synchro,65536818,27251,Master Duel Decks,"[""19535693"",""19535693"",""19535693"",""55920742"",""55920742"",""81914447"",""72291078"",""72291078"",""72291078"",""94693857"",""98159737"",""98159737"",""98159737"",""23431858"",""23431858"",""23431858"",""87052196"",""87052196"",""56495147"",""93490856"",""61488417"",""5560911"",""67723438"",""67723438"",""81439174"",""57831349"",""14821890"",""65681983"",""65681983"",""24224830"",""23434538"",""23434538"",""23434538"",""14558127"",""14558127"",""14558127"",""27204311"",""97268402"",""10045474"",""24224830""]","[""96633955"",""84815190"",""19048328"",""5041348"",""80321197"",""69248256"",""83755611"",""43202238"",""65536818"",""79606837"",""44097050"",""50588353"",""13117073"",""32519092"",""32519092""]","[""68431965"",""20292186"",""43534808"",""55623480"",""37675907"",""9742784"",""27548199"",""9464441"",""23935886"",""78917791"",""6728559"",""56465981"",""20001443"",""82041999"",""43685562""]",1652639905,10 months ago,,,0,P.U.N.K. Tenyi Combos -> https://youtu.be/m9FRVbbET0I,https://youtu.be/m9FRVbbET0I
277825,branded-dino-277825,Branded Dino,18940556,104824,Non-Meta Decks,"[""46986414"",""74677422"",""18940556"",""18940556"",""18940556"",""82385847"",""80280944"",""38572779"",""44335251"",""44335251"",""44335251"",""68468459"",""68468459"",""14558127"",""14558127"",""59438930"",""59438930"",""59438930"",""36042004"",""36042004"",""36042004"",""97268402"",""97268402"",""97268402"",""98022050"",""98022050"",""6172122"",""38179121"",""38179121"",""38179121"",""44362883"",""44362883"",""44362883"",""47325505"",""47325505"",""47325505"",""48130397"",""48130397"",""48130397"",""41782653""]","[""87746184"",""87746184"",""70534340"",""70534340"",""44146295"",""44146295"",""37818794"",""41209827"",""69946549"",""54757758"",""70369116"",""42752141"",""74294676"",""21044178"",""66011101""]","[""14558127"",""54693926"",""54693926"",""54693926"",""17228908"",""17228908"",""17228908"",""8267140"",""18144507"",""83326048"",""83326048"",""83326048"",""10045474"",""10045474"",""10045474""]",1652639905,10 months ago,,,0,This is a deck combining the strengths of Branded Fusion with the Consistency of Dinos,One of the biggest draw backs of branded fusion is being locked into fusion summoning the whole turn. Obviously decks with strong boss monsters that are not in the extra deck are strong in this type of format.  Ultimate Conductor Tyranno with Double Evolution pill is perfect. Sending Overtex with branded fusion will allow you a quick double evolution pill. Or you can always send dark magician and then go into a Red-Eyes Dark Dragoon.
277821,athena-burn-despia-darklord-277821,Athena Burn Despia Darklord,48964966,113801,Master Duel Decks,"[""39552864"",""39552864"",""39552864"",""52840267"",""52840267"",""52840267"",""99456344"",""99456344"",""11260714"",""11260714"",""48964966"",""48964966"",""48964966"",""62962630"",""62962630"",""62962630"",""82773292"",""82773292"",""82773292"",""64734921"",""64734921"",""64734921"",""92807548"",""36577931"",""36577931"",""15449853"",""1353770"",""1353770"",""99543666"",""99543666"",""99543666"",""87112784"",""87112784"",""87112784"",""14517422"",""14517422"",""83764719"",""36637374"",""36637374"",""36637374""]","[""4167084"",""4167084"",""18666161"",""41209827"",""72272462"",""6855503"",""98127546"",""48589580"",""86066372"",""38342335"",""35306215"",""35306215"",""35306215"",""65741786"",""4280258""]","[""26866984"",""14558127"",""14558127"",""14558127"",""92919429"",""92919429"",""92919429"",""23434538"",""40177746"",""82243738"",""94145021"",""54757758"",""24224830"",""48130397"",""48130397""]",1652639905,10 months ago,,,0,Despia Darklord with very Strong Burn using Athena (up to 10k LP with ideal hand),"<h1><span><strong>Burn deck using Athena.</strong></span></h1> Ideal Combo:  <span><strong><span>Valhalla</span> + <span>Athena</span> + <span>Venus</span></strong></span> (+ Maybe Aluber or Branded Opening) <ol>  	<li>Special Summon Athena with Valhalla</li>  	<li>Normal Summon Venus</li>  	<li>Activate Venus effect x2</li>  	<li>Use two Balls to summon Condemned Darklord</li>  	<li>a. Activate Condemned Darklord Effect, discard any card other than Ball (Darklord Superbia if in Hand), <strong>add Superbia to Hand</strong> b. Summon 3rd Ball.</li>  	<li>Summon Parshath with Ball + Condemned</li>  	<li>Activate Parshath (Discard Superbia, Add Sanctum to Hand)</li>  	<li>Activate and use Sanctum. Add 1 Ball 1 Condemned 1 Fairy back into the deck (<strong>keep 1 Superbia in grave</strong> to keep the combo going)</li>  	<li>Activate Venus and summon 1 Ball.</li>  	<li>If you have Superbia + 1 Fairy in graveyard, Activate Athena, Send 1 Fairy to the grave, Summon Superbia, activate Superbia's <strong>when</strong> effect (can miss timing if used in other chains) Summon 1 other Fairy from grave to the Field (Maybe Aluber).</li>  	<li><strong>If you don't have a Fairy in Hand</strong>, summon Apollousa or Accescode with Parshath and 1 Ball or whatever you deem smart, then continue from 13.</li>  	<li><strong>If you have a Fairy in Hand,</strong> Trigger Parshath effect. Banish 1 Ball, Special summon 1 Fairy from your Hand. (Aluber if you are Lucky)</li>  	<li>If you can summon Aluber or Have Theater in hand: follow 14 a.) Summon Apollousa or Underworld Goddess, maybe with Masquerena or whatever the situation needs. Condemned is good too if you are low on LP and have to pass. b.) If your opponent is somehow still alive ( you have used Athena's effect a total of 10 - 12 Times by now (6000-7200LP Effect Damage) You can summon Condemned Darklord Twice and then Apollousa (keep Athena on the field and deal 3x600 additional damage for game.</li>  	<li> Summon Condemned with Athena + Parshath. (need 3 Dark Fairy)</li>  	<li>Activate Theater (Maybe searched with Aluber or Branded Opening at the end of the combo)</li>  	<li>Activate Theater and Summon The First Darklord (<strong>Don't Chain</strong>) TF Darklord</li>  	<li>Activate TFD Summon Superbia, Activate Superbia, Summon Athena.</li>  	<li>Activate Athena, Send Superbia, Summon (same) Superbia, Activate Superbia, Summon Fairy.</li>  	<li>Keep up and combo if you can, or Pass turn. You have dealt an additional 2x 600 Damage. + 600 If you can summon Another fairy from the Extra Deck using TFD and Superbia. Otherwise Pass Turn with TFD and Athena (Send Superbia + Random Fairy to grave for a Link (so you can chain TFD and Superbia in the next Turn.) (<strong>Branded Opening only allows you to fusion summon from the extra deck for the rest of the turn</strong>)</li>  	<li><em>Make sure to only Summon Superbia with TFD after a chain has already been resolved, that means; If your opponent Summons without triggering an effect, if opponent goes from Main Phase to Battle Phase or End Phase (TFD can only be activated during the Main Phase)</em></li> </ol> &nbsp;  <span><strong>Notes:</strong></span> <ul>  	<li>If you don't have Valhalla, Venus or Athena in Hand, you can usually still do normal Despia or Darklord combos.</li>  	<li>Venus + 1 discard can Link Climb to Link-5</li>  	<li>Venus is immune to Ash blossom (YGO players don't read) but an Imperm or Veiler may hard brick you if you don't have Branded Spells in Hand. Maybe try to bait out the Ash? If you use Ixchel's effect and discard her + a Darklord you won't be able to full combo if you get Ash'd or Called by'd but your Condemned or Parshath won't be Ash'd anymore.</li>  	<li>It's almost impossible to Hard Brick unless you pull 2 Shine Balls, but even pulling 1 Shine ball is super annoying as you lose 1+ search.</li>  	<li>Even if you can't pull of the Athena Combo, you can likely Despia-Darklord OTK, or Defend yourself with Theater and Quaeritis. Since Despia Darklord is very Strong.</li>  	<li>If you can summon TFD early and Have Theater + another Fairy on field, you will be able to overcome Nibiru.</li>  	<li>If you have TFD on Field, your opponent can't target Fairies with card effects (Apollousa is a fairy too)</li>  	<li>Athena's 2nd effect can be used multiple times in the same turn as long as she leaves the field between activations.</li>  	<li>Add Archlord Kristya if you want Stun</li> </ul> <span><strong>If you play Master Duel, You can add: Diviner of the Herald, Eva (Banned in TCG), Trias Hierarchia, Angel O1 and Darklord Morningstar for a 1 card combo if you top deck Diviner.</strong></span> Summon Diviner, Send Trias, Tribute Diviner for Trias, Summon Eva, Summon Condemned Darklord. Add Angel O1 with Eva effect. Activate Condemned, Add Morningstar, Special Summon Angel O1, Tribute Summon Morningstar with graveyard or Field (Field if Opponent has more than 4 effect Monsters. Use Morningstar Effects for OTK if going second.  <span><strong>Decklist</strong></span>  Monster: 3x Mystical Shine Ball 3x Darklord Ixchel 2x Dramaturge of Despia 2x Darklord Superbia 3x Athena 3x Aluber the Jester of Despia 3x Indulged Darklord 3x The Agent of Creation - Venus 1x Darklord Ukoback 2x Despian Tragedy  Spell: 1x The Sanctum of Parshath 2x Valhalla, Hall of the Fallen 3x Despia, Theater of the Branded 3x Banishment of the Darklords 2x Darklord Contact 1x Monster Reborn 3x Branded Opening  Extra: 2x The First Darklord 1x Despian Proskenion 1x Starving Venom Fusion Dragon 1x Despian Quaeritis 1x Masquerade the Blazing Dragon 1x Underworld Goddess of the Closed World 1x Celestial Knightlord Parshath 1x Accesscode Talker 1x Knightmare Unicorn 3x Condemned Darklord 1x I:P Masquerena 1x Apollousa, Bow of the Goddess  Side: 1x Trias Hierarchia 3x Ash Blossom &amp; Joyous Spring 3x Diviner of the Herald 1x Maxx ""C"" 1x Eva 1x Angel O1 1x Droll &amp; Lock Bird 1x Mudragon of the Swamp 1x Called by the Grave 2x Super Polymerization"
277813,budget-branded-tri-277813,budget branded tri,44146295,113808,Non-Meta Decks,"[""87209160"",""87209160"",""87209160"",""19096726"",""50810455"",""50810455"",""56196385"",""56196385"",""14878871"",""14878871"",""14878871"",""56196385"",""14816857"",""14816857"",""14816857"",""40975243"",""97268402"",""97268402"",""97268402"",""24508238"",""59438930"",""59438930"",""59438930"",""10045474"",""25451383"",""81767888"",""44362883"",""44362883"",""44362883"",""2295440"",""67750322"",""67750322"",""68468459"",""57103969"",""81439173"",""49036338"",""38814750"",""38814750"",""38814750"",""24224830""]","[""70369116"",""49105782"",""26847978"",""52331012"",""47163170"",""99726621"",""99726621"",""99726621"",""87746184"",""34848821"",""44146295"",""4280258"",""74586817"",""60303245"",""65711558""]","[""24207889"",""24207889"",""24207889"",""83326048"",""83326048"",""83326048"",""18144507"",""58921041"",""58921041"",""43898403"",""43898403"",""58921041"",""54693926"",""54693926"",""23002292""]",1652639905,10 months ago,,,0,for personal use,for personal use
277809,geargia-ft-other-earth-machines-277809,Geargia Ft Other Earth Machines,47030842,109530,Fun/Casual Decks,"[""87074380"",""69838761"",""10604644"",""5556499"",""62034800"",""62034800"",""62034800"",""42940404"",""42940404"",""85136114"",""85136114"",""47030842"",""47030842"",""47030842"",""923596"",""923596"",""923596"",""60953949"",""47687766"",""47687766"",""47687766"",""4334811"",""63995093"",""63995093"",""63995093"",""64662453"",""64662453"",""67169062"",""67169062"",""86852702"",""86852702"",""24224830"",""25274141"",""25274141"",""25274141"",""10045474"",""10045474"",""10045474"",""59741415"",""59741415""]","[""84815190"",""90448279"",""26096328"",""49202331"",""49032236"",""56910167"",""56910167"",""28912357"",""28912357"",""28912357"",""8387138"",""8387138"",""69073023"",""69073023"",""146746""]","[""46033517"",""23469398"",""23469398"",""34267821"",""34267821"",""14558128"",""14558128"",""94145021"",""94145021"",""51369889"",""51369889"",""53334471"",""53334471"",""90846359"",""90846359""]",1652639905,10 months ago,,,0,Geargia Loop Funny,"1- Machine Dupe <a data-name=""Geargiauger"">Geargiauger </a>  2- Special Summon <a data-name=""Geargiaccelerator"">Geargiaccelerator</a>  3- Overlay <a data-name=""Geargiaccelerator"">Geargiaccelerator</a> and <a data-name=""Geargiauger"">Geargiauger into </a><a data-name=""Gear Giant X"">Gear Giant X</a>  4- Detatch Accelerator and Re-add it to your hand  5- Loop it until you have 3 giants on your field and link them away for <a data-name=""Infinitrack Fortress Megaclops"">Infinitrack Fortress Megaclops</a>  &nbsp;  Cards like <a data-name=""Machina Citadel"">Machina Citadel</a> and <a data-name=""Therions' &quot;King&quot; Regulus"">Therion ""King"" Regulus are here because they offer some disruption during your opponent's turn, Citadel is able to target Megaclops and destroy anything bellow 4k attack and due to fortress's imunity to non xyz monster effects it wont be destroyed by Citadel's effect.</a>"
277805,normal-pendulum-monsters-v2-277805,Normal Pendulum Monsters v2,77994337,112941,Non-Meta Decks,"[""21970285"",""21970285"",""48940337"",""48940337"",""48940337"",""43785278"",""43785278"",""43785278"",""68182934"",""68182934"",""68182934"",""73779005"",""73779005"",""73779005"",""17390179"",""17390179"",""17390179"",""75195825"",""75195825"",""77994337"",""77994337"",""77994337"",""82114013"",""82114013"",""82114013"",""35762283"",""35762283"",""35762283"",""39730727"",""39730727"",""1033312"",""1033312"",""1033312"",""79816536"",""79816536"",""79816536"",""73628505"",""911883"",""911883"",""911883""]","[""3322931"",""5041348"",""18239909"",""33698022"",""63533837"",""55285840"",""6983839"",""4280258"",""50588353"",""31897444"",""23935886"",""31226177"",""98978921"",""21887175"",""29479265""]","[""85138716"",""85138716"",""85138716"",""23995346"",""18144507"",""45141013"",""45141013"",""45141013"",""12580477"",""21834870"",""21834870"",""21834870"",""55271628"",""55271628"",""55271628""]",1652639905,10 months ago,,,0,Screw having effects,...
277801,ancient-warrior-277801,Ancient Warrior,65711558,110907,Non-Meta Decks,"[""33545259"",""82791472"",""82791472"",""82791472"",""76416959"",""76416959"",""76416959"",""2801664"",""60033398"",""60033398"",""79582540"",""40140448"",""40140448"",""40140448"",""40428851"",""40428851"",""40428851"",""32422602"",""32422602"",""14558127"",""14558127"",""14558127"",""97268402"",""97268402"",""11711438"",""11711438"",""11711438"",""62528292"",""62528292"",""62528292"",""65681983"",""65681983"",""65681983"",""35726888"",""35726888"",""57103969"",""24224830"",""4810585"",""4810585"",""10045474""]","[""65711558"",""65711558"",""65711558"",""90448279"",""26096328"",""56910167"",""56832966"",""8387138"",""86532744"",""84013237"",""90590303"",""6983839"",""16195942"",""16195943"",""82633039"",""91135480""]","[""55063751"",""55063751"",""55063751"",""43534808"",""59438930"",""59438930"",""94145021"",""94145021"",""24299458"",""24299458"",""24299458"",""51452091"",""51452091"",""10045474"",""10045474""]",1652639905,10 months ago,,,0,Pure (Meta Centered) Ancient Warriors,This deck likes to go second or at least thats how i built it.  Also the foolish burial goods is in the deck to dump the defense of changban trap card but you could replace the burials with small worlds.  Crossout designator and called by are important pieces of the deck considering it goes second but its great at baiting hand traps and negates.  Lastly you can put whatever you want in the extra deck for the xyz monsters but the link monster is the most important one you absolutely should run everything else is bonus.
277797,kaiba-deck-277797,Kaiba Deck,89631146,104940,Anime Decks,"[""89631139"",""89631139"",""89631139"",""53347303"",""10000000"",""14898066"",""97590747"",""39507162"",""17985575"",""52624755"",""52624755"",""52624755"",""66602787"",""17444133"",""52824910"",""62651957"",""65622692"",""64500000"",""82301904"",""73398797"",""9786492"",""17655904"",""43973174"",""23265313"",""58641905"",""98045062"",""68005187"",""55713623"",""19613556"",""83764719"",""10667321"",""24094653"",""79571449"",""71490127"",""48800175"",""87025064"",""57728570"",""57728571"",""83555666"",""52503575"",""86871614""]","[""91998119"",""25119460"",""99724761"",""2111707"",""23995346""]","[""55063751"",""55063751"",""55063751"",""43534808"",""59438930"",""59438930"",""94145021"",""94145021"",""24299458"",""24299458"",""24299458"",""51452091"",""51452091"",""10045474"",""10045474""]",1652639905,10 months ago,,,0,kaiba deck,kaiba deck
277793,joey-deck-anime-277793,Joey Deck Anime,74677427,104940,Anime Decks,"[""74677422"",""78658564"",""88819587"",""64428736"",""3573512"",""21015833"",""423705"",""57046845"",""36354007"",""36354008"",""30860696"",""90790253"",""77585513"",""42035044"",""71625222"",""49791927"",""48305365"",""2460565"",""50903514"",""44287299"",""34460851"",""24094653"",""42703248"",""74137509"",""75417459"",""32807846"",""76895648"",""83764719"",""52097679"",""55226821"",""73915051"",""31423101"",""69279219"",""80987696"",""126218"",""21598948"",""3280747"",""61705417"",""96008713"",""37390589"",""38299233""]","[""45231177"",""3366982"",""41462083""]","[""55063751"",""55063751"",""55063751"",""43534808"",""59438930"",""59438930"",""94145021"",""94145021"",""24299458"",""24299458"",""24299458"",""51452091"",""51452091"",""10045474"",""10045474""]",1652639905,10 months ago,,,0,joey deck,joey deck
277789,swordsoul-dpe-master-duel-277789,Swordsoul DPE (Master Duel),41436536,17333,Master Duel Decks,"[""27204311"",""23431858"",""23431858"",""81866673"",""93490856"",""93490856"",""93490856"",""56495147"",""56495147"",""56495147"",""20001443"",""20001443"",""20001443"",""63362460"",""55273560"",""55273560"",""55273560"",""14558127"",""14558127"",""14558127"",""23434538"",""23434538"",""23434538"",""18144507"",""52947044"",""52947044"",""56465981"",""56465981"",""56465981"",""84211599"",""84211599"",""84211599"",""24224830"",""24224830"",""24299458"",""24299458"",""65681983"",""65681983"",""10045474"",""14821890""]","[""60461804"",""96633955"",""84815190"",""9464441"",""5041348"",""74586817"",""69248256"",""69248256"",""83755611"",""83755611"",""43202238"",""90448279"",""90590303"",""70369116"",""32519092""]","[""6728559"",""87052196"",""72291078"",""94693857"",""61488417"",""98159737"",""19048328"",""65536818"",""35261759"",""8267140"",""10045474"",""10045474"",""5851097"",""57831349""]",1652639905,10 months ago,,,0,Swordsoul DPE (Master Duel),Swordsoul DPE (Master Duel)
277785,yami-yugi-deck-277785,Yami Yugi Deck,46986421,104940,Non-Meta Decks,"[""46986414"",""46986414"",""40737112"",""38033121"",""5818798"",""77207191"",""52077741"",""40640057"",""72989439"",""78193831"",""25652259"",""90876561"",""64788463"",""16589042"",""87774234"",""65240384"",""15025844"",""10000020"",""39256679"",""11549357"",""99785935"",""83764719"",""5318639"",""72302403"",""24094653"",""1784686"",""69542930"",""99789342"",""2314238"",""63391643"",""60709218"",""55144522"",""72892473"",""67227834"",""44095762"",""81210420"",""62279055"",""18807109"",""59560625"",""9287078""]","[""4796100"",""98502113"",""75380687"",""43892408"",""6150044"",""6150045""]","[""6728559"",""87052196"",""72291078"",""94693857"",""61488417"",""98159737"",""19048328"",""65536818"",""35261759"",""8267140"",""10045474"",""10045474"",""5851097"",""57831349""]",1652639905,10 months ago,,,0,yugi deck,yugi deck
277779,yami-yugi-deck-277779,Yami Yugi Deck,46986421,104940,Anime Decks,"[""46986414"",""40737112"",""38033121"",""29436665"",""5818798"",""77207191"",""52077741"",""40640057"",""72989439"",""25652259"",""90876561"",""64788463"",""16589042"",""87774234"",""65240384"",""15025844"",""10000020"",""39256679"",""11549357"",""99785935"",""83764719"",""5318639"",""72302403"",""24094653"",""1784686"",""69542930"",""99789342"",""2314238"",""63391643"",""60709218"",""55144522"",""72892473"",""67227834"",""44095762"",""81210420"",""62279055"",""18807109"",""59560625"",""9287078""]","[""4796100"",""98502113"",""75380687"",""43892408"",""6150044"",""6150045""]","[""6728559"",""87052196"",""72291078"",""94693857"",""61488417"",""98159737"",""19048328"",""65536818"",""35261759"",""8267140"",""10045474"",""10045474"",""5851097"",""57831349""]",1652639905,10 months ago,,,0,yugi deck,yugi anime deck
277775,zombie-world-competitive-277775,Zombie World Competitive,39185163,109779,Non-Meta Decks,"[""39185163"",""39185163"",""66570171"",""66570171"",""92964816"",""92964816"",""49959355"",""49959355"",""49959355"",""94801854"",""94801854"",""92826944"",""92826944"",""52467217"",""52467217"",""33420078"",""70711847"",""70711847"",""52350806"",""52350806"",""77428945"",""43694650"",""14558127"",""14558127"",""14558127"",""97268402"",""97268402"",""81439173"",""1845204"",""63854005"",""63854005"",""63854005"",""4064256"",""4064256"",""4064256"",""48130397"",""48130397"",""48130397"",""90846359"",""90846359"",""90846359""]","[""37129797"",""50588353"",""70369116"",""85289965"",""8198620"",""41209827"",""58528964"",""96334243"",""28240337"",""3040496"",""34408491"",""59843383"",""50091196"",""73082255"",""95992081""]","[""43898403"",""43898403"",""23002292"",""23002292"",""78765160"",""78765160"",""74798297"",""4333086"",""15693423"",""10045474"",""10045474"",""73642296"",""73642296"",""59438930"",""59438930""]",1652639905,10 months ago,,,0,Zombie World Danger Control,Normal Zombie machine with Dangers to support it and crazy boss monsters and control
