deck_num,pretty_url,deck_name,cover_card,userid,format,main_deck,extra_deck,side_deck,ts_submit_date,submit_date,ts_edit_date,edit_date,comments,deck_excerpt,deck_description
296286,marincess-296286,Marincess,20934852,26364,Tournament Meta Decks,"[""91953000"",""91953000"",""91953000"",""21057444"",""21057444"",""21057444"",""36492575"",""36492575"",""36492575"",""57541158"",""99885917"",""99885917"",""14558127"",""14558127"",""14558127"",""97268402"",""97268402"",""97268402"",""59438930"",""59438930"",""59438930"",""27204311"",""27204311"",""27204311"",""91027843"",""57329501"",""57329501"",""35261759"",""35261759"",""24224830"",""57160136"",""57160136"",""57160136"",""25311006"",""25311006"",""25311006"",""10045474"",""10045474"",""10045474"",""52945066""]","[""47910940"",""20934852"",""84546257"",""79130389"",""79130389"",""5524387"",""30691817"",""30691817"",""43735670"",""43735670"",""73309655"",""59859086"",""67557908"",""440556"",""90809975""]","[""43534808"",""43534808"",""43534808"",""18144507"",""14532163"",""14532163"",""14532163"",""94145021"",""94145021"",""94145021"",""24508238"",""24508238"",""53334471"",""53334471"",""53334471""]",1660415905,7 months ago,,,0,Marincess / North America TCG Championships Top 4,Category: Tournament Meta Deck  Tournament Meta Decks are current-level Meta Decks that are capable of going up against the best of the best. These are curated lists that cannot be uploaded by regular users.  Creator: Elijah Green Tournament: North America TCG Championships - July 17th 2022 Placement: Top 4  &nbsp;
296282,sushiputopia-296282,SushipUtopia,56832966,120202,Fun/Casual Decks,"[""24639891"",""24639891"",""24639891"",""42377643"",""42377643"",""42377643"",""61027400"",""61027400"",""61027400"",""78362751"",""78362751"",""78362751"",""69852487"",""69852487"",""8512558"",""8512558"",""25259669"",""12423762"",""39695323"",""56105047"",""62476815"",""19667590"",""94203886"",""26082117"",""29353756"",""62200831"",""62623659"",""94770493"",""43422537"",""11705261"",""67517351"",""45950291"",""4545854"",""32807846"",""49082032"",""58628539"",""26708437"",""24393683"",""97077563"",""51510279""]","[""62517849"",""56832966"",""68679595"",""95134948"",""84013237"",""65305468"",""43490025"",""66970002"",""21858819"",""21293424"",""75215744"",""94798725""]","[""43534808"",""43534808"",""43534808"",""18144507"",""14532163"",""14532163"",""14532163"",""94145021"",""94145021"",""94145021"",""24508238"",""24508238"",""53334471"",""53334471"",""53334471""]",1660415905,7 months ago,,,0,If you can understand gunkan then you can easily get a hang of this deck,Simple and easy to learn
296278,debugging-again-296278,debugging again,49238328,26364,Fun/Casual Decks,"[""42198835"",""2563463"",""30680659"",""30680659"",""30680659"",""32181268"",""32181268"",""32181268"",""14558127"",""14558127"",""14558127"",""66078354"",""97268402"",""97268402"",""97268402"",""73642297"",""73642297"",""73642297"",""49238328"",""49238328"",""49238328"",""92341815"",""89558743"",""89558743"",""89558743"",""3285551"",""3285551"",""3285551"",""39568067"",""39568067"",""39568067"",""38745520"",""38745520"",""91228233"",""24299458"",""24299458"",""24299458"",""14087893"",""14087893"",""14087893"",""8267140"",""8267140"",""8267140""]","[""38342335"",""38342336"",""8264361"",""9839945"",""73309655"",""97661969"",""86066372"",""50588353"",""2857636"",""48815792"",""43202238"",""7391448"",""50321796"",""8561192"",""73580471""]","[""73304257"",""73304257"",""73304257"",""46502744"",""46502744"",""46502744"",""18144507"",""43898403"",""43898403"",""41420027"",""41420027"",""41420027"",""83326048"",""83326048"",""83326048""]",1660415905,7 months ago,,,0,DEBUG,debug debug
296274,ddd-ftk-296274,DDD FTK,28406301,23221,Non-Meta Decks,"[""49036338"",""27204311"",""74069667"",""74069667"",""41546"",""59123937"",""28406301"",""28406301"",""28406301"",""46796664"",""46796664"",""46796664"",""14558127"",""38814750"",""38814750"",""38814750"",""33334269"",""45206713"",""45206713"",""45206713"",""72291412"",""19580308"",""11609969"",""11609969"",""11609969"",""97268402"",""2295440"",""81439173"",""89558743"",""89558743"",""89558743"",""24224830"",""65681983"",""65681983"",""65681983"",""46372010"",""46372010"",""46372010"",""73360025"",""10045474""]","[""16006416"",""82956492"",""74583607"",""90884403"",""73218989"",""34408491"",""15248594"",""81846453"",""71612253"",""71612253"",""3758046"",""50588353"",""27381364"",""52119435"",""50277355""]","[""73304257"",""73304257"",""73304257"",""46502744"",""46502744"",""46502744"",""18144507"",""43898403"",""43898403"",""41420027"",""41420027"",""41420027"",""83326048"",""83326048"",""83326048""]",1660415905,7 months ago,,,0,youtu.be/hsnsSN8yFfo,Tired of your whole field being negated with Dark ruler no more and droplet?!!! I would like to share with you this awesome DDD FTK combo xD I hope you like this video! I would appreciate your support a lot! take care  you can watch how this combo works in the yt link in the short deck summary  (what appears on the Deck Search Page)
296263,perfection-floowandereeze-296263,Perfection Floowandereeze,69327790,26364,Tournament Meta Decks,"[""80611581"",""80611581"",""54334420"",""54334420"",""54334420"",""18940725"",""18940725"",""18940725"",""17827173"",""80433039"",""73356503"",""52843699"",""52843699"",""52843699"",""94145021"",""94145021"",""94145021"",""91800273"",""91800273"",""91800273"",""29587993"",""69327790"",""28126717"",""28126717"",""28126717"",""69087397"",""69087397"",""69087397"",""55521751"",""92223430"",""84211599"",""84211599"",""84211599"",""49238328"",""49238328"",""49238328"",""98645731"",""98645731"",""98645731"",""41215808""]","[""90448279"",""90448279"",""90448279"",""72167543"",""72167543"",""72167543"",""48608796"",""48608796"",""48608796"",""19369609"",""19369609"",""6983839"",""6983839"",""2857636"",""2857636""]","[""58655504"",""58655504"",""58655504"",""14558127"",""14558127"",""14558127"",""54693926"",""54693926"",""54693926"",""14532163"",""14532163"",""64002884"",""18144507"",""87639778"",""87639778""]",1660415905,7 months ago,,,0,Perfection Floowandereeze / North America TCG Championships Top 4,Category: Tournament Meta Deck  Tournament Meta Decks are current-level Meta Decks that are capable of going up against the best of the best. These are curated lists that cannot be uploaded by regular users.  Creator: Pascal Manigat Tournament: North America TCG Championships - July 17th 2022 Placement: Top 4  &nbsp;
296259,sky-striker-296259,Sky Striker,86066372,26364,Tournament Meta Decks,"[""26077387"",""26077387"",""26077387"",""37351133"",""37351133"",""27204311"",""27204311"",""14558127"",""14558127"",""14558127"",""59438930"",""59438930"",""59438930"",""97268402"",""97268402"",""97268402"",""84211599"",""84211599"",""19230407"",""19230407"",""32807846"",""73628505"",""52340444"",""63166095"",""24010609"",""99550630"",""51227866"",""98338152"",""98338152"",""98338152"",""50005218"",""76375976"",""76375976"",""76375976"",""24299458"",""24299458"",""89208725"",""10045474"",""10045474"",""10045474""]","[""86066372"",""8264361"",""9839945"",""75147529"",""8491308"",""8491308"",""12421694"",""63288573"",""63288573"",""63288573"",""90673288"",""90673288"",""90673288"",""50588353"",""45819647""]","[""27204311"",""24508238"",""24508238"",""43534808"",""43534808"",""43534808"",""8267140"",""8267140"",""43898403"",""43898403"",""24207889"",""24207889"",""83326048"",""83326048"",""83326048""]",1660415905,7 months ago,,,0,Sky Striker / North America TCG Championships 2nd Place,Category: Tournament Meta Deck  Tournament Meta Decks are current-level Meta Decks that are capable of going up against the best of the best. These are curated lists that cannot be uploaded by regular users.  Creator: Ryan Yu Tournament: North America TCG Championships - July 17th 2022 Placement: 2nd Place  &nbsp;
296255,tenyi-swordsoul-296255,Tenyi Swordsoul,58921041,26364,Tournament Meta Decks,"[""55273560"",""55273560"",""55273560"",""20001443"",""20001443"",""20001443"",""93490856"",""93490856"",""93490856"",""56495147"",""56495147"",""87052196"",""87052196"",""87052196"",""23431858"",""23431858"",""23431858"",""98159737"",""98159737"",""98159737"",""24557335"",""24224830"",""14558127"",""14558127"",""14558127"",""35261759"",""35261759"",""56465981"",""56465981"",""56465981"",""51684157"",""51684157"",""51684157"",""24299458"",""24299458"",""24299458"",""76375976"",""76375976"",""76375976"",""90846359"",""90846359"",""90846359"",""14821890""]","[""84815190"",""69248256"",""69248256"",""47710198"",""96633955"",""83755611"",""83755611"",""83755611"",""19048328"",""43202238"",""5041348"",""32519092"",""32519092"",""32519092"",""78917791""]","[""27204311"",""27204311"",""27204311"",""38814750"",""38814750"",""38814750"",""49036338"",""14532163"",""14532163"",""14532163"",""18144507"",""23002292"",""58921041"",""58921041"",""58921041""]",1660415905,7 months ago,,,1,Tenyi Swordsoul / North America TCG Championships 1st Place,Category: Tournament Meta Deck  Tournament Meta Decks are current-level Meta Decks that are capable of going up against the best of the best. These are curated lists that cannot be uploaded by regular users.  Creator: Hansel Aguero Tournament: North America TCG Championships - July 17th 2022 Placement: 1st Place  &nbsp;
296251,searock-296251,SeaRock,11302671,120235,Fun/Casual Decks,"[""102380"",""28933734"",""77585513"",""74677422"",""70781052"",""26202165"",""545781"",""545781"",""93920745"",""14761450"",""41255165"",""8576764"",""91133740"",""55063751"",""11302671"",""57354389"",""31812496"",""67559101"",""8102334"",""60229110"",""7025445"",""62476815"",""19667590"",""36187051"",""49776811"",""21452275"",""31560081"",""46552140"",""83764719"",""72892473"",""72302403"",""74848038"",""98645731"",""5318639"",""4031928"",""6172122"",""14087893"",""43898403"",""12580477"",""88279736"",""3819470"",""77414722"",""44095762"",""62279055"",""12607053"",""4206964"",""29401950"",""88086137"",""97077563"",""40605147""]","[""91397409"",""42566602"",""73079836"",""82044280"",""63731062"",""9464441"",""63422098"",""89907227"",""45349196""]","[""25247218"",""51987571"",""81823360"",""91740879"",""24068492"",""56294501"",""53582587""]",1660415905,7 months ago,,,0,"This is just a Deck for Fun, super Casual.","It's just a regular defensive made by me. It Has 50% winning and 50% of losing, simple moves and no bricking just straight to the point."
296247,beac-2-fortune-lady-296247,beac 2 fortune lady,70252926,115006,Non-Meta Decks,"[""82971335"",""82971335"",""82971335"",""55586621"",""55586621"",""55586621"",""29088922"",""29088922"",""29088922"",""82693917"",""82693917"",""82693917"",""34471458"",""34471458"",""34471458"",""57869175"",""57869175"",""57869175"",""31683874"",""31683874"",""31683874"",""6311717"",""6311717"",""6311717"",""5298175"",""5298175"",""5298175"",""27895597"",""27895597"",""27895597"",""68663748"",""68663748"",""68663748"",""94068856"",""94068856"",""94068856"",""31461282"",""31461282"",""91407982"",""91407982"",""20057949"",""20057949""]","[""70252926"",""70252926"",""70252926"",""29071332"",""29071332"",""29071332"",""48928529"",""48928529"",""48928529"",""94119480"",""94119480"",""94119480"",""64276752"",""64276752"",""64276752""]",,1660415905,7 months ago,,,0,beac 2 fortune lady,beac 2 fortune lady
296243,new-tier-0-maybe-296243,New Tier 0 Maybe,94977270,84150,Non-Meta Decks,"[""572850"",""572850"",""572850"",""74078255"",""74078255"",""73956664"",""37961969"",""37961969"",""37961969"",""3717252"",""25926710"",""25926710"",""25926710"",""62320425"",""62320425"",""62320425"",""63542003"",""63542003"",""99937011"",""99937011"",""92919429"",""92919429"",""92919429"",""17266660"",""17266660"",""17266660"",""69015963"",""79109599"",""79109599"",""79109599"",""27847700"",""77103950"",""77103950"",""77103950"",""81439174"",""17484499"",""1329620"",""1329620"",""38436986"",""38436986""]","[""84815190"",""90448279"",""90590303"",""28226490"",""92731385"",""84330567"",""84330567"",""94977270"",""94977270"",""99916754"",""44146295"",""70534340"",""87746184"",""41578483""]","[""75286621""]",1660415905,7 months ago,,,1,I saw someone play this so I added my own spin and made it 50x stronger,https://youtu.be/rzjI8nZYkZ8
296238,subterror-n-r-296238,Subterror N/R,74640994,119254,Master Duel Decks,"[""92970404"",""92970404"",""92970404"",""47556396"",""47556396"",""21607304"",""95218695"",""65976795"",""65976795"",""65976795"",""39581190"",""39581190"",""39581190"",""41872150"",""41872150"",""41872150"",""2326738"",""2326738"",""2326738"",""68823957"",""68823957"",""68823957"",""74762582"",""74762582"",""74762582"",""68001309"",""68001309"",""14087893"",""14087893"",""14087893"",""98414735"",""98414735"",""98414735"",""38761908"",""38761908"",""38761908"",""74640994"",""74640994"",""74640994"",""73575650""]","[""52119435"",""49725936"",""66226132"",""62541668"",""26556950"",""50449881"",""29669359"",""16259549"",""85252081"",""85252081"",""1426714"",""54191698"",""12219047"",""47506081"",""91895091""]","[""75286621""]",1660415905,7 months ago,,,0,Using subterrors and old packman card to create flip control within the N/R format,Attempting to recreate a packman deck feel within the N/R format using Subterrors + some packman cards
296234,wyrm-snchro-296234,Wyrm Snchro,84815190,21930,Master Duel Decks,"[""23434538"",""23434538"",""14558127"",""14558127"",""14558127"",""24224830"",""24224830"",""65681983"",""65681983"",""81439173"",""30680659"",""30680659"",""3285551"",""3285551"",""39568067"",""2563463"",""38745520"",""26118970"",""26118970"",""26118970"",""93708824"",""69167267"",""23431858"",""23431858"",""87052196"",""87052196"",""98159737"",""56495147"",""20001443"",""93490856"",""93850690"",""56465981"",""6728559"",""57831349"",""61488417"",""61488417"",""9742784"",""94693857"",""72291078"",""72291078""]","[""32519092"",""73539069"",""60303245"",""50588353"",""44097050"",""65536818"",""43202238"",""83755611"",""83755611"",""5041348"",""69248256"",""19048328"",""96633955"",""84815190"",""10389142""]","[""75286621""]",1660415905,7 months ago,,,0,BASED/Tenyi Synchro/40 card Wyrm pile,"Not gonna cap, I saw Farfa's video and had to build this.  Wyrm Synchro is a variant of Swordsoul Tenyi/Tenyi Synchro/Based. The goal is basically to pile in all of the best Wyrm synchro enablers into a single deck - it is all here, the Adventurers, Rose Dragon, Yang Zing, Tenyi, and Swordsoul, plus all the best generic synchro enablers. The list Farfa was running was really focused on comboing off down a pretty specific line, which I left in, but I also adapted the list to be a little bit more of a free-wheeling combo deck, with a lot of enablers and back-up plans, and many hands featuring multiple lines of play. I like flexible combo decks, and I wanted to further shore up the deck's plan vs handtraps by running more Swordsoul lines.  So, into the card by card. For interruption I wanted to be really greedy on this one, and aim towards going first. With the Adventurer pile and early Baronnes we're shored up against a lot of hand traps, but Maxx ""C"" rules the format still, and is the one interruption that might kill us going first. As a result, we're on 2 Maxx ""C"" so you can Crossout Maxx ""C"" even if you see one copy, 3 Ash, and 2 Called By with 2 Crossout. Crossout is weaker here, but it's almost exclusively for Maxx ""C"" and people run Ash. The deck is also brimming with ways to turn it into value if you don't need it. Needing 7 Maxx ""C"" answers and 2 Maxx ""C"" leaves us with no room for backrow hate, so go first against Backrow. Like I said, greedy.  Pretty standard Adventurer package here. The unusual thing about this deck is it uses the Gryphon Rider for material more often than not, but there are plenty of available lines that leave a Gryphon Rider up the whole time as well. Like I said, flexible. I'm definitely on Foolish Burial, much needed with Blue Girl and Rites semi-limited out the gate.  The whole Rose Dragon package is pretty standard. The goal here is to make Baronne before Needlefibre, but with Striker Dragon in the list your ""brick"" Roxrose goes into Halq by itself, or even helps make Baronne before Needlefibre.  Vishuda is a rad interactive card, but also helps put up the 7 you need for Galaxy Tomahawk and Baronne combos. Ashuna serves the same role, but is also a combo piece, summoning either a 7 or a 1 later into your combo to put up massif boards. Adhara is occasionally a target of this summon, and with Monk helps make Halq without your normal summon.  The big difference between the list I was sniping and my list is a beefed up Swordsoul package. With Mo-Ye and Sacred Summit the ROTA (which is normally reserved for summoning Protos) can also enable easy (and resilient) lines that end on 2 8s and a 10. This is also an option over Protos in some hands. The Sacred Summit can also help summon back monsters to extend plays in normal combo lines, it's strange people find Monster Reborn bricky. There are hands where I'd consider summoning Mo Ye instead of making Halq, especially if it preserves a Gryphon Rider and ends on a similar board.  So, the list has Protos for Darks and Chaofeng for Lights. Seems fair and balanced. Nope, nothing broken in this list.  The list can abuse Denglong, so it runs Nine Pillars. This helps round out the interruptions. The free level 1 tuner that summons itself back out is key to the combos, and well worth the brick, but there are lines that don't even need it, so I'm considering finding a line that lets me cut this. On the other hand, there's no kill like overkill.  In the Extra Deck is an Almiraj, so our Jet Synchron is now full combo (actually, there are multiple lines from just NS Jet). Deskbot helps facilitate this, and can be used as a tuner and a free summon in some hands, enabling stuff. There aren't a lot of bricks that aren't somehow combo pieces."
296226,paleozoic-splight-296226,Paleozoic Splight,98414735,120035,Non-Meta Decks,"[""13533678"",""13533678"",""13533678"",""75922381"",""75922381"",""75922381"",""76145933"",""76145933"",""76145933"",""2311090"",""2311090"",""9126351"",""9126351"",""9126351"",""88686573"",""88686573"",""68353324"",""68353324"",""68353324"",""14558127"",""14558127"",""14558127"",""15443125"",""15443125"",""15443125"",""24299458"",""24299458"",""24299458"",""98414735"",""98414735"",""98414735"",""38761908"",""38761908"",""38761908"",""35035481"",""35035481"",""24903843"",""24903843"",""24903843"",""68250822""]","[""54498517"",""54498517"",""27381364"",""27381364"",""72329844"",""72329844"",""61307542"",""61307542"",""37649320"",""37649320"",""36346532"",""36346532"",""90809975"",""90809975"",""90448279""]","[""75286621""]",1660415905,7 months ago,,,0,Paleo Splight control,Some sorta paleozoic control deck with the splight engine
296222,server-296222,Server,91231901,119417,Non-Meta Decks,"[""95956346"",""95956346"",""402568"",""402568"",""402568"",""81896771"",""88205593"",""88205593"",""88205593"",""12296376"",""12296376"",""5554990"",""5554990"",""97885363"",""97885363"",""97885363"",""45801022"",""46897277"",""46897277"",""18407024"",""43422537"",""56577312"",""56577312"",""72302403"",""97169186"",""99995595"",""99995595"",""5318639"",""65612454"",""58924378"",""12607053"",""29401950"",""36361633"",""44095762"",""56120475"",""98427577"",""27551"",""97077563"",""14315573"",""56993276""]","[""27315304"",""29765339"",""29765339"",""29765339"",""2772236"",""2772236"",""2772236""]","[""37742478"",""81896771"",""24996659"",""32548609"",""32548609"",""61380658"",""53193261"",""53193261"",""53193261"",""1834107"",""84428023"",""58924378"",""58924378"",""32061744"",""32061744""]",1660415905,7 months ago,,,0,Server,Write your deck strategy here...  &nbsp;  My deck testr
296216,fabled-furisgardo-296216,Fabled Furisgardo,9061682,36436,Non-Meta Decks,"[""53199020"",""53199020"",""3717252"",""77723643"",""77723643"",""52350806"",""52350806"",""57630503"",""57630503"",""57630503"",""18282103"",""18282103"",""18282103"",""37961969"",""37961969"",""99745551"",""97439806"",""52101615"",""19439119"",""19439119"",""83039608"",""83039608"",""83039608"",""82888408"",""82888408"",""82888408"",""44394295"",""44394295"",""72892473"",""74117290"",""74117290"",""74117290"",""34822850"",""10045474"",""10045474"",""10045474"",""55766177"",""55766177"",""74923978"",""74923978""]","[""20366274"",""94977270"",""96633955"",""84815190"",""50954680"",""54048462"",""45420955"",""63533837"",""9061682"",""9061682"",""47395382"",""47395382"",""44155002"",""44155002""]","[""24040093"",""97651498"",""29905795"",""39477584"",""89194103"",""50091196"",""90359458"",""24224830"",""22555834"",""22555834"",""22555834"",""55766177""]",1660415905,7 months ago,,,0,Fabled deck,"Trying to reborn the ""Fábulas""!"
296212,branded-heroes-296212,BRANDED HEROES,17132130,22359,Non-Meta Decks,"[""17132130"",""81555617"",""9411399"",""9411399"",""62962630"",""62962630"",""68468459"",""68468459"",""59392529"",""50720316"",""50720316"",""27780618"",""27780618"",""16605586"",""15717011"",""36577931"",""36577931"",""8949584"",""24094653"",""32807846"",""44362883"",""44362883"",""44362883"",""45906428"",""52947044"",""52947044"",""81439173"",""21143940"",""24299458"",""24299458"",""24299458"",""36637374"",""36637374"",""36637374"",""48130397"",""48130397"",""48130397"",""82738008"",""82738008"",""99543666"",""10045474"",""10045474"",""10045474""]","[""18666161"",""11321089"",""37818794"",""44146295"",""69946549"",""70534340"",""72272462"",""60461804"",""6855503"",""6855503"",""40854197"",""87746184"",""22908820"",""58481572"",""90579153""]","[""27204311"",""27204311"",""20292186"",""34267821"",""94145021"",""94145021"",""94145021"",""14532163"",""14532163"",""43898403"",""43898403"",""12444060"",""12444060"",""54757758"",""23002292""]",1660415905,7 months ago,,,0,branded hero,Idea of this deck is to establish board quickly as possible w/ end board consistenting of combo dragoon + masquarade or albion+masquarade+dragoon (maybe a dark law) but this deck can otk and pressure reaction by your opponent.
296208,dinomorhpia-with-p-u-n-k-engine-296208,DINOMORHPIA WITH P.U.N.K ENGINE,60465049,84150,Non-Meta Decks,"[""92133240"",""92133240"",""92133240"",""38628859"",""38628859"",""19535693"",""19535693"",""19535693"",""81914447"",""81914447"",""55920742"",""55920742"",""55920742"",""6609736"",""6609736"",""97268402"",""97268402"",""97268402"",""59438930"",""59438930"",""14558127"",""14558127"",""67723438"",""67723438"",""67723438"",""35261759"",""35261759"",""78420796"",""78420796"",""78420796"",""26631975"",""26631975"",""26631975"",""82732705"",""82732705"",""82732705"",""23002292"",""10045474"",""10045474"",""10045474""]","[""92798873"",""92798873"",""92798873"",""48832775"",""48832775"",""48832775"",""74936480"",""74936480"",""74936480"",""60465049"",""60465049"",""60465049"",""3040496"",""3040496"",""3040496""]","[""27204311"",""27204311"",""20292186"",""34267821"",""94145021"",""94145021"",""94145021"",""14532163"",""14532163"",""43898403"",""43898403"",""12444060"",""12444060"",""54757758"",""23002292""]",1660415905,7 months ago,,,0,life points ewww &#x1f92e;,https://youtu.be/XGVCJw1kLsA
296204,gemini-strike-296204,Gemini Strike,69488544,114594,Non-Meta Decks,"[""69488544"",""69488544"",""57662975"",""53257892"",""53257892"",""96872283"",""96872283"",""15767889"",""16984449"",""16984449"",""16984449"",""72305034"",""72305034"",""54485355"",""54485355"",""54485355"",""14558127"",""14558127"",""14558127"",""27979109"",""95750695"",""95750695"",""95750695"",""56747793"",""56747793"",""65959844"",""65959844"",""65959844"",""4031928"",""90965652"",""90965652"",""18144507"",""64697431"",""32807846"",""80758812"",""80758812"",""18096222"",""18096222"",""10045474"",""10045474""]","[""92798873"",""92798873"",""92798873"",""48832775"",""48832775"",""48832775"",""74936480"",""74936480"",""74936480"",""60465049"",""60465049"",""60465049"",""3040496"",""3040496"",""3040496""]","[""27204311"",""27204311"",""20292186"",""34267821"",""94145021"",""94145021"",""94145021"",""14532163"",""14532163"",""43898403"",""43898403"",""12444060"",""12444060"",""54757758"",""23002292""]",1660415905,7 months ago,,,0,"A remake of the 2009 Structure Deck, “Warrior’s Strike”.","<span>This is a remake of the 2009 Structure Deck, “Warrior’s Strike”. It’s updated with cards that keep the same makeup of monsters, Spells, and Traps, but with better versions of the originals where applicable. It is updated to be legal with the 2022 TCG banlist and can be used competitively (though not recommended).</span>  &nbsp;"
296200,beac-1-windwitch-296200,beac 1 windwitch,14577226,115006,Non-Meta Decks,"[""70117860"",""70117860"",""70117860"",""43722862"",""43722862"",""43722862"",""20246864"",""20246864"",""20246864"",""71007216"",""71007216"",""71007216"",""84851250"",""84851250"",""84851250"",""47459126"",""47459126"",""47459126"",""14778250"",""14778250"",""14778250"",""96156729"",""96156729"",""96156729"",""91819979"",""91819979"",""91819979"",""53610653"",""53610653"",""53610653"",""25123082"",""25123082"",""25123082"",""19362568"",""19362568"",""19362568"",""50755"",""50755"",""50755"",""89448140"",""89448140"",""89448140""]","[""73667937"",""73667937"",""73667937"",""14577226"",""14577226"",""14577226"",""6983839"",""6983839"",""6983839""]","[""27204311"",""27204311"",""20292186"",""34267821"",""94145021"",""94145021"",""94145021"",""14532163"",""14532163"",""43898403"",""43898403"",""12444060"",""12444060"",""54757758"",""23002292""]",1660415905,7 months ago,,,0,beac 1 windwitch,beac 1 windwitch
