deck_num,pretty_url,deck_name,cover_card,userid,format,main_deck,extra_deck,side_deck,ts_submit_date,submit_date,ts_edit_date,edit_date,comments,deck_excerpt,deck_description
490668,hand-control-warriors-490668,Hand control warriors,55773067,201994,Goat Format Decks,"[""72989439"",""88240808"",""88240808"",""71413901"",""76922029"",""23205979"",""31553716"",""31553716"",""2134346"",""39507162"",""39507162"",""39507162"",""70074904"",""7572887"",""74131780"",""79571449"",""55144522"",""44763025"",""47453433"",""47453433"",""32807846"",""32807846"",""95281259"",""19613556"",""5318639"",""70828912"",""45986603"",""71044499"",""14087893"",""88279736"",""88279736"",""55773067"",""55773067"",""55773067"",""35316708"",""35316708"",""93382620"",""53582587"",""97077563"",""44095762"",""83555666"",""41420027""]",,"[""77585513"",""4041838"",""70074904"",""91869203"",""23205979"",""31036355"",""71044499"",""73915051"",""73915051"",""41420027"",""41420027"",""60082869"",""60082869"",""56120475"",""56120475""]",1716152480,14 hours ago,,,0,Hand discard engine with warrior toolbox,"<p>The core is the usual warrior engine, considered x2 don Zaloog but felt too fragile. Kycoo for chaos. Asura priest and spear dragons for Goats and combos with robbin goblin to get huge discards in one turn or when opponent sets/has goats. Triple bladeknight for damage and BLS. Warrior returning alive is an underrated pick that can substitute the second Zaloog. Back to square one is a strong removal that bounces on top of deck, goes together in combo with DROP OFF, which is the focus of the deck together with time seal. Other traps are pretty standard.&nbsp;</p><p>Side dust and sakuretsu for warriors, sasuke for spy, archer for burn. Others are optional, feel free to suggest better cards.</p>"
490669,pendulum-piloted-by-folo-490669,Pendulum Piloted By Folo,96073342,126134,Trinity Format Decks,"[""16306932"",""29432356"",""14105623"",""14513273"",""69351984"",""10024317"",""39000945"",""96227613"",""39853199"",""58990362"",""33256280"",""33256280"",""69512157"",""69610326"",""40318957"",""10239627"",""97024987"",""58092907"",""47075569"",""24019092"",""48461764"",""41908872"",""44179224"",""34242278"",""7868571"",""66104644"",""43502497"",""92559258"",""49131917"",""1980574"",""60473572"",""60473572"",""18716735"",""37478723"",""67616300"",""71817640"",""32354768"",""27813661"",""75952542"",""49568943"",""37469904"",""81439173"",""51412776"",""73594093"",""1033312"",""58549532"",""32807846"",""89558743"",""38943357"",""38943357"",""38943357"",""79816536"",""73628505"",""70368879"",""74580251"",""76751255"",""73468603"",""43898403"",""82190203"",""96073342""]","[""37491810"",""4688231"",""81612598"",""77693536"",""70771599"",""36898537"",""38694052"",""61399402"",""359563"",""23935886"",""24094258"",""98462037"",""22125101"",""77637979"",""23656668""]","[""71692913"",""78661338"",""60242223"",""21250202"",""31987203"",""59438930"",""23434538"",""24508238"",""28016193"",""6983839"",""8264361"",""43711255"",""53129443"",""50323155"",""98069388""]",1716152480,14 hours ago,1716152480,14 hours ago,0,Trinity Format 2024 - April YTC 1st Place (4-0 in Swiss):,"<div id=""deck-msg"" style=""box-sizing: border-box; color: #d4d1d0; font-family: -apple-system, BlinkMacSystemFont, 'segoe ui', Roboto, 'helvetica neue', Arial, 'noto sans', sans-serif, 'apple color emoji', 'segoe ui emoji', 'segoe ui symbol', 'noto color emoji'; font-size: 16px; font-style: normal; font-variant-ligatures: normal; font-variant-caps: normal; font-weight: 400; letter-spacing: normal; orphans: 2; text-align: left; text-indent: 0px; text-transform: none; widows: 2; word-spacing: 0px; -webkit-text-stroke-width: 0px; white-space: normal; background-color: #27292d; text-decoration-thickness: initial; text-decoration-style: initial; text-decoration-color: initial;""></div><div id=""full-deck"" class=""mt-3"" style=""box-sizing: border-box; margin-top: 1rem !important; color: #d4d1d0; font-family: -apple-system, BlinkMacSystemFont, 'segoe ui', Roboto, 'helvetica neue', Arial, 'noto sans', sans-serif, 'apple color emoji', 'segoe ui emoji', 'segoe ui symbol', 'noto color emoji'; font-size: 16px; font-style: normal; font-variant-ligatures: normal; font-variant-caps: normal; font-weight: 400; letter-spacing: normal; orphans: 2; text-align: left; text-indent: 0px; text-transform: none; widows: 2; word-spacing: 0px; -webkit-text-stroke-width: 0px; white-space: normal; background-color: #27292d; text-decoration-thickness: initial; text-decoration-style: initial; text-decoration-color: initial;""><div class=""pl-4"" style=""box-sizing: border-box; padding-left: 1.5rem !important;"">&nbsp;</div></div><div class=""deck-metadata-desc"" style=""box-sizing: border-box; min-width: 100%; min-height: 95.19px; color: #d4d1d0; font-family: -apple-system, BlinkMacSystemFont, 'segoe ui', Roboto, 'helvetica neue', Arial, 'noto sans', sans-serif, 'apple color emoji', 'segoe ui emoji', 'segoe ui symbol', 'noto color emoji'; font-size: 16px; font-style: normal; font-variant-ligatures: normal; font-variant-caps: normal; font-weight: 400; letter-spacing: normal; orphans: 2; text-align: left; text-indent: 0px; text-transform: none; widows: 2; word-spacing: 0px; -webkit-text-stroke-width: 0px; white-space: normal; background-color: #27292d; text-decoration-thickness: initial; text-decoration-style: initial; text-decoration-color: initial;""><div class=""inner-deck-text collapsed"" style=""box-sizing: border-box; color: #404040; background-color: rgba(167, 164, 164, 0.18); position: relative; max-height: 150px; overflow: hidden; padding: 10px; border-radius: 5px; word-break: break-word;""><p style=""box-sizing: border-box; margin-top: 0px; margin-bottom: 0.6rem; color: #d4d1d0 !important;"">To see the full tournament report and top 4 decklists, <a style=""box-sizing: border-box; color: #17a2b8; text-decoration: none; background-color: transparent;"" href=""https://trinityygo.wixsite.com/trinityygo/tournament/"" target=""_blank"" rel=""noopener nofollow"">click here</a>.<br style=""box-sizing: border-box;"" /><br style=""box-sizing: border-box;"" />If you're interested in playing Trinity, go to our&nbsp;<a style=""box-sizing: border-box; color: #17a2b8; text-decoration: none; background-color: transparent;"" href=""https://trinityygo.wixsite.com/trinityygo"" target=""_blank"" rel=""noopener nofollow"">website</a>&nbsp;to learn the format and join our&nbsp;<a style=""box-sizing: border-box; color: #17a2b8 !important; text-decoration: none; background-color: transparent;"">Discord community at&nbsp;</a><a class=""anchor-1X4H4q anchorUnderlineOnHover-wiZFZ_"" style=""box-sizing: border-box; color: #17a2b8 !important; text-decoration: none; background-color: transparent;"" tabindex=""0"" title=""https://discord.gg/HPARF7a"" role=""button"" target=""_blank"" rel=""noreferrer noopener"">https://discord.gg/HPARF7a</a>. We hope to see you there!</p></div></div>"
490670,chimera-illusion-piloted-by-venomblast-490670,Chimera Illusion Piloted By Venomblast,59369430,126134,Trinity Format Decks,"[""59369430"",""74150658"",""85401123"",""87462901"",""34541543"",""92565383"",""23076639"",""49109013"",""69764158"",""43316238"",""55461744"",""61173621"",""61173621"",""61173621"",""23898021"",""81035362"",""30068120"",""10802915"",""26202165"",""84764038"",""48468330"",""88554436"",""12061457"",""46939151"",""72323266"",""60990740"",""19403423"",""27847700"",""53129443"",""74335036"",""8267140"",""43898403"",""63136489"",""22829942"",""67616300"",""5318639"",""35035481"",""5650082"",""52607696"",""10045474"",""78474168"",""26334139"",""6214163"",""59919307"",""29401950"",""84749824"",""38761908"",""53329234"",""60743819"",""63086455"",""83555666"",""94192409"",""70368879"",""23076639"",""23076639"",""92565383"",""58143852"",""34773082"",""26334139"",""26334139""]","[""38264974"",""43227"",""45716579"",""69601012"",""1769875"",""64880894"",""8690387"",""6983839"",""95992081"",""20665527"",""24269961"",""8264361"",""71607202"",""58699500"",""60303245""]","[""25311006"",""35269904"",""24081957"",""14087893"",""24224830"",""93260132"",""89882100"",""5133471"",""94445733"",""72880377"",""28929131"",""91712985"",""27107590"",""30748475"",""44095762""]",1716152480,14 hours ago,,,0,Trinity Format 2024 - April YTC 2nd Place (3-1 in Swiss):,"<div id=""deck-msg"" style=""box-sizing: border-box; color: #d4d1d0; font-family: -apple-system, BlinkMacSystemFont, 'segoe ui', Roboto, 'helvetica neue', Arial, 'noto sans', sans-serif, 'apple color emoji', 'segoe ui emoji', 'segoe ui symbol', 'noto color emoji'; font-size: 16px; font-style: normal; font-variant-ligatures: normal; font-variant-caps: normal; font-weight: 400; letter-spacing: normal; orphans: 2; text-align: left; text-indent: 0px; text-transform: none; widows: 2; word-spacing: 0px; -webkit-text-stroke-width: 0px; white-space: normal; background-color: #27292d; text-decoration-thickness: initial; text-decoration-style: initial; text-decoration-color: initial;""></div><div id=""full-deck"" class=""mt-3"" style=""box-sizing: border-box; margin-top: 1rem !important; color: #d4d1d0; font-family: -apple-system, BlinkMacSystemFont, 'segoe ui', Roboto, 'helvetica neue', Arial, 'noto sans', sans-serif, 'apple color emoji', 'segoe ui emoji', 'segoe ui symbol', 'noto color emoji'; font-size: 16px; font-style: normal; font-variant-ligatures: normal; font-variant-caps: normal; font-weight: 400; letter-spacing: normal; orphans: 2; text-align: left; text-indent: 0px; text-transform: none; widows: 2; word-spacing: 0px; -webkit-text-stroke-width: 0px; white-space: normal; background-color: #27292d; text-decoration-thickness: initial; text-decoration-style: initial; text-decoration-color: initial;""><div class=""pl-4"" style=""box-sizing: border-box; padding-left: 1.5rem !important;"">&nbsp;</div></div><div class=""deck-metadata-desc"" style=""box-sizing: border-box; min-width: 100%; min-height: 95.19px; color: #d4d1d0; font-family: -apple-system, BlinkMacSystemFont, 'segoe ui', Roboto, 'helvetica neue', Arial, 'noto sans', sans-serif, 'apple color emoji', 'segoe ui emoji', 'segoe ui symbol', 'noto color emoji'; font-size: 16px; font-style: normal; font-variant-ligatures: normal; font-variant-caps: normal; font-weight: 400; letter-spacing: normal; orphans: 2; text-align: left; text-indent: 0px; text-transform: none; widows: 2; word-spacing: 0px; -webkit-text-stroke-width: 0px; white-space: normal; background-color: #27292d; text-decoration-thickness: initial; text-decoration-style: initial; text-decoration-color: initial;""><div class=""inner-deck-text collapsed"" style=""box-sizing: border-box; color: #404040; background-color: rgba(167, 164, 164, 0.18); position: relative; max-height: 150px; overflow: hidden; padding: 10px; border-radius: 5px; word-break: break-word;""><p style=""box-sizing: border-box; margin-top: 0px; margin-bottom: 0.6rem; color: #d4d1d0 !important;"">To see the full tournament report and top 4 decklists, <a style=""box-sizing: border-box; color: #17a2b8; text-decoration: none; background-color: transparent;"" href=""https://trinityygo.wixsite.com/trinityygo/tournament/"" target=""_blank"" rel=""noopener nofollow"">click here</a>.<br style=""box-sizing: border-box;"" /><br style=""box-sizing: border-box;"" />If you're interested in playing Trinity, go to our&nbsp;<a style=""box-sizing: border-box; color: #17a2b8; text-decoration: none; background-color: transparent;"" href=""https://trinityygo.wixsite.com/trinityygo"" target=""_blank"" rel=""noopener nofollow"">website</a>&nbsp;to learn the format and join our&nbsp;<a style=""box-sizing: border-box; color: #17a2b8 !important; text-decoration: none; background-color: transparent;"">Discord community at&nbsp;</a><a class=""anchor-1X4H4q anchorUnderlineOnHover-wiZFZ_"" style=""box-sizing: border-box; color: #17a2b8 !important; text-decoration: none; background-color: transparent;"" tabindex=""0"" title=""https://discord.gg/HPARF7a"" role=""button"" target=""_blank"" rel=""noreferrer noopener"">https://discord.gg/HPARF7a</a>. We hope to see you there!</p></div></div>"
490671,centur-ion-490671,Centur-Ion,13076804,154098,Tournament Meta Decks,"[""15005145"",""15005145"",""15005145"",""42493140"",""42493140"",""42493140"",""78888899"",""97698279"",""14558128"",""14558128"",""14558128"",""97268402"",""97268402"",""59438930"",""59438930"",""73642296"",""73642296"",""94145021"",""94145021"",""27204311"",""27204311"",""33854624"",""6637331"",""41371602"",""41371602"",""41371602"",""77765207"",""77765207"",""77765207"",""4160316"",""92907248"",""84211599"",""84211599"",""65681983"",""65681983"",""65681983"",""73628505"",""10045474"",""10045474"",""10045474"",""40155014""]","[""15982593"",""15982593"",""71858682"",""62242678"",""21123811"",""63436931"",""63436931"",""22850702"",""13076804"",""93854893"",""90448279"",""93039339"",""8264361"",""29301450"",""80666118""]","[""8267140"",""8267140"",""54693926"",""54693926"",""54693926"",""25311006"",""25311006"",""24207889"",""41420027"",""41420027"",""83326048"",""83326048"",""15693423"",""15693423"",""15693423""]",1716030080,2 days ago,,,0,Centur-Ion  / Greece National Championship 2024 Top 16,<p>Category: Tournament Meta Decks (TCG)</p><p>Tournament Meta Decks are current-level Meta Decks that are capable of going up against the best of the best. These are curated lists that cannot be uploaded by regular users.</p><p>Creator: Thanos Tigkas</p><p>Tournament: Greece National Championship 2024 &ndash; May 18th 2024</p><p>Placement: Top 16</p>
490672,electrons-piloted-by-psionic-brush-490672,Electrons Piloted By Psionic Brush,31801517,126134,Trinity Format Decks,"[""23434538"",""59438930"",""14558127"",""82489470"",""66699781"",""5133471"",""51589188"",""72044448"",""87890143"",""14602126"",""5318639"",""43898403"",""88851326"",""10045474"",""6278008"",""83555666"",""44487250"",""46261704"",""11066358"",""863795"",""28770951"",""98555327"",""46659709"",""62968263"",""93717133"",""73478096"",""47051709"",""47051709"",""47051709"",""97639441"",""89132148"",""65367484"",""43147039"",""67972302"",""60222582"",""63956833"",""17418744"",""83512285"",""897409"",""8653757"",""42925441"",""81439173"",""32807846"",""63854005"",""98827725"",""93717133"",""1845204"",""19613556"",""897409"",""23924608""]","[""85747929"",""16643334"",""61399402"",""6983839"",""1688285"",""31801517"",""8165596"",""17412721"",""17881964"",""27548199"",""27572350"",""98462037"",""9839945"",""3356494"",""46772449""]","[""73642296"",""60242223"",""49729312"",""63767246"",""40139997"",""19403423"",""69162969"",""53129443"",""24224830"",""24081957"",""8267140"",""31548215"",""11373345"",""89789152"",""23002292""]",1716152480,14 hours ago,,,0,Trinity Format 2024 - April YTC Tied for 3rd Place (4-0 in Swiss):,"<div id=""deck-msg"" style=""box-sizing: border-box; color: #d4d1d0; font-family: -apple-system, BlinkMacSystemFont, 'segoe ui', Roboto, 'helvetica neue', Arial, 'noto sans', sans-serif, 'apple color emoji', 'segoe ui emoji', 'segoe ui symbol', 'noto color emoji'; font-size: 16px; font-style: normal; font-variant-ligatures: normal; font-variant-caps: normal; font-weight: 400; letter-spacing: normal; orphans: 2; text-align: left; text-indent: 0px; text-transform: none; widows: 2; word-spacing: 0px; -webkit-text-stroke-width: 0px; white-space: normal; background-color: #27292d; text-decoration-thickness: initial; text-decoration-style: initial; text-decoration-color: initial;""></div><div id=""full-deck"" class=""mt-3"" style=""box-sizing: border-box; margin-top: 1rem !important; color: #d4d1d0; font-family: -apple-system, BlinkMacSystemFont, 'segoe ui', Roboto, 'helvetica neue', Arial, 'noto sans', sans-serif, 'apple color emoji', 'segoe ui emoji', 'segoe ui symbol', 'noto color emoji'; font-size: 16px; font-style: normal; font-variant-ligatures: normal; font-variant-caps: normal; font-weight: 400; letter-spacing: normal; orphans: 2; text-align: left; text-indent: 0px; text-transform: none; widows: 2; word-spacing: 0px; -webkit-text-stroke-width: 0px; white-space: normal; background-color: #27292d; text-decoration-thickness: initial; text-decoration-style: initial; text-decoration-color: initial;""><div class=""pl-4"" style=""box-sizing: border-box; padding-left: 1.5rem !important;"">&nbsp;</div></div><div class=""deck-metadata-desc"" style=""box-sizing: border-box; min-width: 100%; min-height: 95.19px; color: #d4d1d0; font-family: -apple-system, BlinkMacSystemFont, 'segoe ui', Roboto, 'helvetica neue', Arial, 'noto sans', sans-serif, 'apple color emoji', 'segoe ui emoji', 'segoe ui symbol', 'noto color emoji'; font-size: 16px; font-style: normal; font-variant-ligatures: normal; font-variant-caps: normal; font-weight: 400; letter-spacing: normal; orphans: 2; text-align: left; text-indent: 0px; text-transform: none; widows: 2; word-spacing: 0px; -webkit-text-stroke-width: 0px; white-space: normal; background-color: #27292d; text-decoration-thickness: initial; text-decoration-style: initial; text-decoration-color: initial;""><div class=""inner-deck-text collapsed"" style=""box-sizing: border-box; color: #404040; background-color: rgba(167, 164, 164, 0.18); position: relative; max-height: 150px; overflow: hidden; padding: 10px; border-radius: 5px; word-break: break-word;""><p style=""box-sizing: border-box; margin-top: 0px; margin-bottom: 0.6rem; color: #d4d1d0 !important;"">To see the full tournament report and top 4 decklists, <a style=""box-sizing: border-box; color: #17a2b8; text-decoration: none; background-color: transparent;"" href=""https://trinityygo.wixsite.com/trinityygo/tournament/"" target=""_blank"" rel=""noopener nofollow"">click here</a>.<br style=""box-sizing: border-box;"" /><br style=""box-sizing: border-box;"" />If you're interested in playing Trinity, go to our&nbsp;<a style=""box-sizing: border-box; color: #17a2b8; text-decoration: none; background-color: transparent;"" href=""https://trinityygo.wixsite.com/trinityygo"" target=""_blank"" rel=""noopener nofollow"">website</a>&nbsp;to learn the format and join our&nbsp;<a style=""box-sizing: border-box; color: #17a2b8 !important; text-decoration: none; background-color: transparent;"">Discord community at&nbsp;</a><a class=""anchor-1X4H4q anchorUnderlineOnHover-wiZFZ_"" style=""box-sizing: border-box; color: #17a2b8 !important; text-decoration: none; background-color: transparent;"" tabindex=""0"" title=""https://discord.gg/HPARF7a"" role=""button"" target=""_blank"" rel=""noreferrer noopener"">https://discord.gg/HPARF7a</a>. We hope to see you there!</p></div></div>"
490673,kashtira-490673,Kashtira,96633955,154098,Tournament Meta Decks,"[""68304193"",""68304193"",""68304193"",""32909498"",""32909498"",""32909498"",""31149212"",""31149212"",""31149212"",""78534861"",""91800273"",""91800273"",""91800273"",""14558128"",""14558128"",""14558128"",""52038441"",""52038441"",""52038441"",""59438930"",""59438930"",""97268402"",""97268402"",""97268402"",""69540484"",""69540484"",""69540484"",""34447918"",""34447918"",""73628505"",""71832012"",""71832012"",""71832012"",""84211599"",""84211599"",""84211599"",""90846359"",""10045474"",""10045474"",""10045474""]","[""73542331"",""73542331"",""80117527"",""78144171"",""78144171"",""44405066"",""92015800"",""90590304"",""22110647"",""90448279"",""93039339"",""96633955"",""65741786"",""29301450"",""98978921""]","[""102380"",""102380"",""73642296"",""73642296"",""18144507"",""14532163"",""14532163"",""8267140"",""8267140"",""41420027"",""41420027"",""41420027"",""83326048"",""83326048"",""83326048""]",1716030080,2 days ago,,,0,Kashtira  / Austria National Championship 2024 Top 8,<p>Category: Tournament Meta Decks (TCG)</p><p>Tournament Meta Decks are current-level Meta Decks that are capable of going up against the best of the best. These are curated lists that cannot be uploaded by regular users.</p><p>Creator: Philipp R.</p><p>Tournament: Austria National Championship 2024 &ndash; May 18th 2024</p><p>Placement: Top 8</p>
490722,diabellstar-snake-eye-fire-king-490722,Diabellstar Snake-Eye Fire King,83266092,154098,Tournament Meta Decks,"[""66431519"",""90681088"",""18621798"",""2526224"",""2526224"",""2526224"",""9674034"",""9674034"",""9674034"",""90241276"",""90241276"",""48452496"",""45663742"",""72270339"",""72270339"",""72270339"",""32909498"",""32909498"",""32909498"",""85106525"",""85106525"",""85106525"",""80845034"",""80845034"",""80845034"",""89023486"",""53639887"",""65305978"",""57554544"",""35480699"",""35480699"",""35480699"",""24224830"",""24299458"",""24299458"",""24299458"",""25311006"",""25311006"",""2295440"",""10045474"",""10045474"",""10045474""]","[""94259633"",""87871125"",""57134592"",""2857636"",""2772337"",""48815792"",""8264361"",""65741786"",""29301450"",""37880706"",""20665527"",""45112597"",""4280259"",""2411269"",""27240101""]","[""14558128"",""14558128"",""14558128"",""18144507"",""14532163"",""14532163"",""54693926"",""54693926"",""54693926"",""82732705"",""82732705"",""82732705"",""83266092"",""83266092"",""83266092""]",1716030080,2 days ago,,,0,Diabellstar Snake-Eye Fire King  / Austria National Championship 2024 Top 8,<p>Category: Tournament Meta Decks (TCG)</p><p>Tournament Meta Decks are current-level Meta Decks that are capable of going up against the best of the best. These are curated lists that cannot be uploaded by regular users.</p><p>Creator: Philipp Gastberger</p><p>Tournament: Austria National Championship 2024 &ndash; May 18th 2024</p><p>Placement: Top 8</p>
490723,elemental-masked-hero-fire-water-amp-earth-power-490723,"Elemental Masked HERO: Fire, Water &amp; Earth Power",84327329,180348,Non-Meta Decks,"[""84327329"",""84327329"",""84327329"",""58932615"",""58932615"",""98266377"",""98266377"",""98266377"",""37195861"",""37195861"",""37195861"",""59392529"",""45195443"",""45195443"",""45195443"",""63060238"",""63060238"",""75434695"",""79979666"",""79979666"",""79979666"",""63035430"",""63035430"",""8949584"",""8949584"",""8949584"",""213326"",""213326"",""213326"",""78387742"",""78387742"",""78387742"",""45906428"",""45906428"",""54283059"",""24094653"",""24094653"",""21143940"",""21143940"",""21143940""]","[""95486586"",""62624486"",""1945387"",""1945387"",""29095552"",""29095552"",""40854197"",""40854197"",""22908820"",""22908820"",""16304628"",""58147549"",""58147549"",""36841733"",""36841733""]","[""40044918"",""40044918"",""50720316"",""50720316"",""1945387"",""40854197"",""33574806"",""68745629"",""93347961"",""93347961"",""10920352"",""10920352"",""89870349"",""1948619"",""1948619""]",1716152480,14 hours ago,,,0,"Elemental Masked HERO: Fire, Water & Earth Power","<p>Elemental Masked HERO: Fire, Water &amp; Earth Power&nbsp;</p>"
490727,horus-destiny-tearlaments-490727,Horus Destiny Tearlaments,62219643,154098,Tournament Meta Decks,"[""572850"",""74078255"",""37961969"",""73956664"",""73956664"",""73956664"",""4928565"",""4928565"",""4928565"",""99937011"",""84941194"",""84941194"",""84941194"",""47330808"",""9411399"",""9411399"",""9411399"",""52350806"",""70711847"",""70711847"",""32909498"",""32909498"",""77103950"",""77103950"",""77103950"",""6767771"",""6767771"",""48130397"",""48130397"",""48130397"",""16528181"",""16528181"",""35726888"",""72892473"",""6351147"",""62219643"",""74920585"",""74920585"",""74920585"",""7436169""]","[""28226490"",""30757127"",""54757758"",""11765832"",""69946549"",""27552504"",""55285840"",""440556"",""90809975"",""73082255"",""93039339"",""72329844"",""4280259"",""29301450"",""50277355""]","[""94145021"",""94145021"",""94145021"",""27204311"",""33854624"",""6637331"",""72656408"",""69750546"",""24299458"",""24299458"",""25311006"",""25311006"",""83326048"",""83326048"",""49299410""]",1716030080,2 days ago,,,0,Horus Destiny Tearlaments  / Hilo WCQ Regional Top 8,<p>Category: Tournament Meta Decks (TCG)</p><p>Tournament Meta Decks are current-level Meta Decks that are capable of going up against the best of the best. These are curated lists that cannot be uploaded by regular users.</p><p>Creator: Austin Ah Hee</p><p>Tournament: Hilo WCQ Regional &ndash; May 18th 2024</p><p>Placement: Top 8</p>
490728,fire-king-dogmatika-test-490728,Fire king dogmatika test,27204311,199832,Non-Meta Decks,"[""27204311"",""27204311"",""66431519"",""66431519"",""69680031"",""2526224"",""2526224"",""2526224"",""95679145"",""18621798"",""18621798"",""18621798"",""69000994"",""38910263"",""14558127"",""14558127"",""73642296"",""73642296"",""90681088"",""90681088"",""90681088"",""24508238"",""94145021"",""94145021"",""97268402"",""97268402"",""65305978"",""65305978"",""65305978"",""57554544"",""57554544"",""1984618"",""1984618"",""1984618"",""2295440"",""84211599"",""84211599"",""24224830"",""59388357"",""91703676"",""21011044""]","[""41373230"",""50907446"",""11765832"",""94977270"",""80532587"",""64182380"",""64182380"",""93854893"",""99726621"",""61245672"",""38342335"",""87871125"",""26847978"",""65741786"",""60303245""]","[""27204311"",""18144507"",""14532163"",""14532163"",""82732705"",""83326048"",""83326048"",""83326048"",""15693423"",""15693423"",""15693423""]",1716156080,13 hours ago,,,0,"Fireking, fire king, dogmatika , ygopro , meta decks",<p>Test fire king dogmatika deck</p>
