deck_num,pretty_url,deck_name,cover_card,userid,format,main_deck,extra_deck,side_deck,ts_submit_date,submit_date,ts_edit_date,edit_date,comments,deck_excerpt,deck_description
181015,water-xyz-181015,Water XYZ,43138260,60459,Non-Meta Decks,"[""49036338"",""7150545"",""7150545"",""7150545"",""43138260"",""43138260"",""43138260"",""90303176"",""90303176"",""89617515"",""24557335"",""24557335"",""24557335"",""14558127"",""14558127"",""14558127"",""38814750"",""38814750"",""38814750"",""6625096"",""6625096"",""6625096"",""19885332"",""19885332"",""19885332"",""1845204"",""63854005"",""63854005"",""63854005"",""2295440"",""33907039"",""33907039"",""33907039"",""24224830"",""65681983"",""65681983"",""65681983"",""10045474"",""10045474"",""10045474""]","[""80516007"",""80516007"",""74586817"",""90448279"",""440556"",""440556"",""67557908"",""67557908"",""94942656"",""21044178"",""90809975"",""90809975"",""90809975"",""26973555"",""65305468""]","[""27204311"",""27204311"",""27204311"",""34267821"",""34267821"",""34267821"",""54693926"",""54693926"",""54693926"",""43898403"",""43898403"",""43898403"",""53334471"",""53334471"",""53334471""]",1647023905,1 year ago,,,0,This is a tribute to the tremendous power our planet's seas have (ngl this is cringe),"I will present 2 combos  For the first combo you need to open Buzzsaw Shark and XYZ Remora <ol>  	<li>Normal summon Buzzsaw Shark and use it's effect (by targeting himself) to special summon Lifeless Leafish</li>  	<li>XYZ summon into Number4: Stealth Kragen</li>  	<li>Use XYZ Remora's effect to special summon her by detaching Kragen's materials. Then use her on summon effect to revive Buzzsaw and Leafish</li>  	<li>XYZ summon into Bahamut Shark by using Buzzsaw and Leafish as materials</li>  	<li>Activate Bahamut Shark's effect to special summon (who else?) Toadally Awesome (I recommend to summon him on the extra monster zone in case that the other 3 cards in your hand are extenders)</li> </ol> For the second combo you need to have Lifeless Leafish, XYZ Remora and White Mirror <ol>  	<li>Summon Lifeless Leafish and activate it's effect to send a copy of XYZ Remora from your deck to the GY</li>  	<li>Activate White Mirror to special summon Remora from the GY and then add another Remora from your deck to your hand</li>  	<li>XYZ summon into Number 4: Stealth Kragen</li>  	<li>Special summon your first Remora from the hand by detaching Kragen's materials and use her on summon effect to special summon Leafish and the other Remora from GY</li>  	<li>XYZ summon into another Stealth Kragen (the materials dont matter) into your extra monster zone</li>  	<li>Special Summon the second Remora from your hand by detaching Kragen's materials and use her on summon effect to special summon 2 level 4 fish monsters from your GY (Now your board should have 2 Kragens-one of which is on the extra monster zone-and 4 level 4 fish monsters)</li>  	<li>XYZ summon ino 2 Bahamut Sharks and use their effects to summon 2 Toadallies Awesome</li>  	<li>Use the 2 Bahamut Sharks to XYZ summon Number F0: Utopic Future</li>  	<li>Use your Utopic Future to XYZ summon Number F0: Utopic Future Dragon</li> </ol>"
181019,fluffal-deck-181019,Fluffal deck,58468105,64802,Fun/Casual Decks,"[""24094653"",""24094653"",""24094653"",""1845204"",""30068120"",""3841833"",""3841833"",""3841833"",""39246582"",""39246582"",""39246582"",""65331686"",""2729285"",""70245411"",""70245411"",""70245411"",""98280324"",""61173621"",""61173621"",""61173621"",""43698897"",""6077601"",""6077601"",""72413000"",""72413000"",""35726888"",""35726888"",""35726888"",""87246309"",""13241004"",""13241004"",""13241004"",""34773082"",""34773082"",""34773082"",""28039390"",""14558127"",""14558127"",""81223446"",""81223446"",""82896870"",""29280589"",""29280589"",""99049589"",""99049589"",""18138630""]","[""63519819"",""440556"",""464362"",""464362"",""80889750"",""80889750"",""63767246"",""90809975"",""40636712"",""91034681"",""41999284"",""58468105"",""4280258"",""78778375"",""78778375""]","[""53129443"",""83764718"",""44095762"",""44095762"",""44095762"",""97268402"",""97268402"",""85545073"",""11039171"",""83866861"",""40636712"",""77522571"",""82896870"",""29280589"",""78778375""]",1647023905,1 year ago,,,0,Deck para se divertir ,Detonar no primeiro turno ⁷
181026,time-thief-raidraptors-181026,Time Thief & Raidraptors,19891131,60459,Non-Meta Decks,"[""49036338"",""71278040"",""71278040"",""71278040"",""65367484"",""56308388"",""56308388"",""56308388"",""87321742"",""87321742"",""64730881"",""64730881"",""96345188"",""82496097"",""74578720"",""19891131"",""19891131"",""19891131"",""31314549"",""52159691"",""36426778"",""14558127"",""14558127"",""14558127"",""38814750"",""38814750"",""38814750"",""18144507"",""23581825"",""70368879"",""83764719"",""10877309"",""24224830"",""88504133"",""98827725"",""98827725"",""98827725"",""25542642"",""76587747"",""18678554""]","[""74586817"",""90448279"",""10443958"",""64276752"",""6983839"",""28781003"",""55285840"",""91135480"",""59208943"",""73347079"",""73347079"",""26692769"",""8802510"",""36429703"",""60303245""]","[""27548199"",""46772449"",""21044178"",""359563"",""6511113"",""69073023"",""68464358"",""68464358"",""32476603"",""81670445"",""31443476"",""31443476"",""31443476"",""31548215"",""69599136""]",1647023905,1 year ago,,,0,One of my favourite XYZ decks. Enjoy!,"For my favourite combo you only need Time Thief Regulator <ol>  	<li>Normal summon Regulator</li>  	<li>Tribute Regulator (by it's effect) and special summon Time Thief Winder and Time Thief Adjuster</li>  	<li>Use Winder's and Adjuster's effects, Adjuster sends Time Thief Bezel Ship for the deck to the GY and search Time Thief Retrograde with Winder's effect</li>  	<li>XYZ summon into Raidraptor Force Strix and activate its effect to search Singing Lanius, also detach Force Strix's last material to special summon Bezel Ship from the GY and then special summon Singing Lanius from your hand</li>  	<li>By using Force Strix and Singning Lanius link summon Raidraptor Wise Strix</li>  	<li>Use Wise Strix's on summon effect to special summon Mimicry Lanius from your deck</li>  	<li>XYZ summon into your second Force Strix</li>  	<li>Use Force Strix's effect to search Strangle Lanius. On that moment Wise Strix's effect activates to set Rank-Up-Magic Soul Shave Force from your deck to the field</li>  	<li>Activate Mimicry Laniu's GY effect to search Raider's Wing</li>  	<li>Activate Soul Shave Force and use the Force Strix on your GY to special summon Cyber Dragon Infinity</li>  	<li>Activate Raider's Wing effect (by detaching Force Strix's last material) to special summon it on the field</li>  	<li>Activate Strangle Laniu's effect to special summon him from your hand</li>  	<li>Use Force Strix and Wise Strix to link summon The Phantom Knights of Rusty Bardiche</li>  	<li>Activate Rusty's effect to send The Phantom Knights of Silent Boots to your GY and set The Phantom Knights of Shade Bringandine from your deck to the field</li>  	<li>Activate Strangle Laniu's effect to special summon Singing Lanius from your GY</li>  	<li>XYZ summon into Time Thief Redoer by using Singing Lanius and Raider's Wing as materials</li>  	<li>Activate Shade Bringandine to special summon it as a level 4 monster</li>  	<li>XYZ summon Time Thief Perpetua</li>  	<li>Banish Silent Boots from your GY to search The Phantom Knights of Fog Blade</li>  	<li>Set Fog Blade and Time Thief Retrograde to the field</li> </ol> On your opponent's Standby Phase activate Perpetua's second effect to attach Time Thief Flyback to Redoer"
181032,magicians-181032,Magicians,12289247,40400,Non-Meta Decks,"[""96733134"",""96733134"",""96733134"",""16178681"",""16178681"",""67808837"",""67808837"",""12289247"",""12289247"",""12289247"",""94415058"",""94415058"",""94415058"",""75672051"",""75672051"",""11067666"",""11067666"",""48461764"",""48461764"",""20409757"",""20409757"",""20409757"",""53610653"",""53610653"",""53610653"",""36042825"",""67775894"",""67775894"",""67775894"",""72043279"",""72043279"",""72043279"",""81439173"",""35726888"",""35726888"",""35726888"",""96598015"",""96598015"",""96598015"",""73628505""]","[""13331639"",""70771599"",""70771599"",""70771599"",""42160203"",""42160203"",""42160203""]","[""27204311"",""27204311"",""27204311"",""21772453"",""21772453"",""21772453"",""34267821"",""34267821"",""34267821"",""43898403"",""43898403"",""43898403"",""51452091"",""51452091"",""51452091""]",1647023905,1 year ago,,,0, why astrograph better than chronograph,Write your deck strategy here... Why Astrograph better than chronograph
181044,flower-cardians-june-2021-181044,Flower Cardians June 2021,54135423,40079,Non-Meta Decks,"[""80630522"",""80630522"",""80630522"",""89818984"",""89818984"",""89818984"",""54135423"",""54135423"",""54135423"",""17141718"",""17141718"",""17141718"",""94388754"",""94388754"",""94388754"",""57261568"",""57261568"",""57261568"",""5489987"",""5489987"",""5489987"",""30382214"",""30382214"",""30382214"",""81752019"",""81752019"",""81752019"",""78785392"",""78785392"",""78785392"",""30786387"",""30786387"",""30786387"",""73271204"",""73271204"",""73271204"",""32807846"",""66171432"",""66171432"",""66171432"",""24224830""]","[""87460579"",""87460579"",""87460579"",""42291297"",""42291297"",""42291297"",""3966653"",""3966653"",""3966653"",""33541430"",""33541430"",""33541430"",""62541668"",""26556950"",""90162951""]","[""27204311"",""27204311"",""27204311"",""21772453"",""21772453"",""21772453"",""34267821"",""34267821"",""34267821"",""43898403"",""43898403"",""43898403"",""51452091"",""51452091"",""51452091""]",1647023905,1 year ago,,,0,"Do you want to win but don't have money, just learn to play this deck.","Still a really good and cheap deck, without nibiru it's less than 50 dollars."
181052,savior-deck-181052,Savior Deck,86165817,63827,Fun/Casual Decks,"[""27204311"",""27204311"",""27204311"",""14124483"",""9411399"",""9411399"",""18094166"",""18094166"",""18094166"",""40044918"",""40044918"",""40044918"",""13650422"",""59392529"",""45195443"",""50720316"",""50720316"",""27780618"",""27780618"",""22865492"",""22865492"",""14558127"",""14558127"",""14558127"",""8949584"",""12071500"",""24094653"",""32807846"",""45906428"",""54693926"",""54693926"",""54693926"",""83764719"",""8267140"",""8267140"",""8267140"",""21143940"",""21143940"",""21143940"",""24224830""]","[""95486586"",""22061412"",""40854197"",""40854197"",""22908820"",""58481572"",""58481572"",""29095552"",""10920352"",""62624486"",""22093873"",""46759931"",""86165817"",""58004362"",""1948619""]","[""34267821"",""34267821"",""34267821"",""94145021"",""94145021"",""94145021"",""48130397"",""48130397"",""41209827"",""48130397"",""58921041"",""50608164"",""213326"",""213326"",""213326""]",1647023905,1 year ago,,,0,HERO Deck with Malicious Bane,"HERO Deck based around combos to offer the player a multitude of options to suit different needs and situations. Dark Law can be used to shut down grave yard effects and put a stop to combo decks. Absolute Zero and Masked Acid are a powerful pairing to wipe boards clean and force opponents to carefully deal with them. Sunrise is your ever reliable middle-man. Search for what you need with Cross Crusader, as well as recycle all your fusion cards with Wonder Vision. Our BFG is Malicious Bane, who can win you games outright. Honest Neos saves lives."
181056,cyberdark-deck-zane-truesdale-yu-gi-oh-gx-structure-deck-181056,"Cyberdark deck, Zane Truesdale ,Yu-Gi-Oh! GX ,Structure Deck",37542782,25969,Fun/Casual Decks,"[""5370235"",""3019642"",""3019642"",""41230939"",""41230939"",""77625948"",""77625948"",""79875526"",""45078193"",""82562802"",""82562802"",""82562802"",""56364287"",""1142880"",""70095154"",""70095154"",""23893227"",""23893227"",""23893227"",""76218313"",""44352516"",""64753988"",""64753988"",""64753988"",""63031396"",""60600126"",""60600126"",""60600126"",""55704856"",""80033124"",""3659803"",""37630732"",""18144506"",""25311006"",""32768230"",""82428674"",""24299458"",""24299458"",""1157683"",""1157683""]","[""80532587"",""80532587"",""80532587"",""37542782"",""37542782"",""40418351"",""18967507"",""64599569"",""87116928"",""1546123"",""70369116"",""58069384"",""10443958"",""84058253"",""46724542""]","[""79229522"",""60303245"",""63941210"",""86686671"",""15693423"",""15693423"",""15693423"",""84211599"",""84211599"",""27204311"",""27204311"",""14532163"",""14532163"",""14532163""]",1647023905,1 year ago,,,0,https://youtu.be/I38RFNvD8AQ,https://youtu.be/I38RFNvD8AQ
181062,evolzar-control-2021-181062,EVOLZAR CONTROL 2021,13046291,21784,Non-Meta Decks,"[""69680031"",""80651316"",""80651316"",""17045014"",""17045014"",""60303688"",""60303688"",""54266211"",""54266211"",""54266211"",""14558127"",""14558127"",""14558127"",""13046291"",""13046291"",""13046291"",""1984618"",""1984618"",""1984618"",""2295440"",""18144506"",""88760522"",""88760522"",""88760522"",""33907039"",""33907039"",""33907039"",""24224830"",""24299458"",""24299458"",""24299458"",""10045474"",""10045474"",""10045474"",""74100225"",""74100225"",""74100225"",""80101899"",""82956214"",""82956214""]","[""99267150"",""41373230"",""59531356"",""80532587"",""80532587"",""74294676"",""74294676"",""42752141"",""42752141"",""61399402"",""6983839"",""21044178"",""38342335"",""2857636"",""75452921""]",,1647023905,1 year ago,,,0,Watch how the deck peforms. Tired of activating Misc effect since 2017 or sobbing because Ogdoadic reptile does nothing? Piri Reis Map makes us have 1,"https://youtu.be/dEJgzLqsySg  10 Megachirella needs 10 Evolsaur to pop offs, so we run 3 Vulcano, 2 Cerato, 2 Diplo, and 3 Evo-Diversity (searches both Megachirella or Evolsaur). Dogmatika engine fits the best as the combo uses 2 cards (<strong>Megachirella + any Evolsaur</strong>) and Dogmatika only uses 1 card for interruption/recursion. Evo-Singularity is our Tri-Brigade Revolt but it summons Dolkka/Laggia (pay attention to the material in GY, as it needs exactly 1 each Evoltile and Evolsaur, making Abyss Dweller is the best as it can detach the Evolsaur fast.)  <a><img src=""https://i.imgur.com/9VtzDTi.png"" alt=""image"" /></a>"
181068,phantom-knight-3-181068,phantom knight 3,72332074,61461,Non-Meta Decks,"[""25538345"",""25538345"",""25538345"",""90432163"",""90432163"",""36426778"",""36426778"",""36426778"",""63821877"",""88544390"",""88544390"",""10802915"",""10802915"",""10802915"",""20758643"",""20758643"",""57143342"",""57143342"",""36553319"",""19353570"",""19353570"",""19353570"",""14558127"",""14558127"",""14558127"",""59438930"",""3233859"",""30227494"",""59438930"",""88504133"",""81439173"",""81439173"",""81439173"",""69162969"",""67723438"",""53046408"",""53046408"",""11868825"",""25542642"",""25542642"",""25542642"",""98431356""]","[""62709239"",""62709239"",""16195942"",""16195943"",""1621413"",""64276752"",""28781003"",""83531441"",""95992081"",""26973555"",""65305468"",""43490025""]",,1647023905,1 year ago,,,0,phantom,<span><span>Viết chiến lược bộ bài của bạn ở đây ...</span></span>
181072,phantom-knight-4-181072,phantom knight 4,70875955,61461,Non-Meta Decks,"[""25538345"",""25538345"",""25538345"",""90432163"",""90432163"",""36426778"",""36426778"",""36426778"",""63821877"",""88544390"",""88544390"",""10802915"",""10802915"",""10802915"",""20758643"",""20758643"",""57143342"",""57143342"",""36553319"",""19353570"",""19353570"",""19353570"",""14558127"",""14558127"",""14558127"",""59438930"",""3233859"",""30227494"",""59438930"",""88504133"",""81439173"",""81439173"",""81439173"",""69162969"",""67723438"",""53046408"",""53046408"",""11868825"",""25542642"",""25542642"",""25542642"",""98431356""]","[""62709239"",""62709239"",""16195942"",""16195943"",""1621413"",""64276752"",""28781003"",""83531441"",""16259549"",""95992081"",""26973555"",""77205367"",""65305468"",""43490025"",""81330115""]","[""78661338"",""78661338"",""78661338"",""27204311"",""27204311"",""27204311"",""54693926"",""54693926"",""54693926"",""43898403"",""43898403"",""43898403"",""15693423"",""15693423"",""15693423""]",1647023905,1 year ago,,,0,phantom,<span><span>Viết chiến lược bộ bài của bạn ở đây ...</span></span>
181077,resonators-red-dragon-archfiend-181077,Resonators/Red Dragon Archfiend,99585850,59587,Non-Meta Decks,"[""34761841"",""34761841"",""34761841"",""5780210"",""77360173"",""77360173"",""40975574"",""40975574"",""40975574"",""52589809"",""52589809"",""52589809"",""8372133"",""8372133"",""78010363"",""78010363"",""45313993"",""45313993"",""7409792"",""7409792"",""75366958"",""75366958"",""75366958"",""35261759"",""35261759"",""35261759"",""23008320"",""23008320"",""23008320"",""83764719"",""59593925"",""34959756"",""70368879"",""5376159"",""5376159"",""41420027"",""41420027"",""41420027"",""40605147"",""40605147""]","[""62242678"",""99585850"",""97489701"",""84664085"",""36857073"",""9753964"",""34408491"",""50954680"",""81020646"",""80666118"",""66141736"",""66141736"",""76547525"",""54191698"",""36776089""]","[""78661338"",""78661338"",""78661338"",""27204311"",""27204311"",""27204311"",""54693926"",""54693926"",""54693926"",""43898403"",""43898403"",""43898403"",""15693423"",""15693423"",""15693423""]",1647023905,1 year ago,,,0,Resonators/Red Dragon Archfiend Deck,Resonators/Red Dragon Archfiend  https://www.youtube.com/watch?v=IdOZU2CUOO4&amp;t=2s
181082,cdc-tournament-giant-ball-park-181082,[CdC Tournament] Giant Ball Park,58012707,40292,Non-Meta Decks,"[""4148264"",""4148264"",""4148264"",""35052053"",""35052053"",""35052053"",""76039636"",""36956512"",""55063751"",""71278040"",""71278040"",""71278040"",""82385847"",""29726552"",""29726552"",""78661339"",""75081613"",""75081613"",""75081613"",""52350806"",""52350806"",""96938986"",""96938986"",""96938986"",""17535764"",""17535764"",""17535764"",""12580477"",""73628505"",""75500286"",""81439173"",""83764718"",""99330325"",""99330325"",""94770493"",""97120394"",""58012707"",""58012707"",""58012707"",""23002292""]","[""56832966"",""84013237"",""55285840"",""6983839"",""90590303"",""82633039"",""46772449"",""12014404"",""62517849"",""91140491"",""3987233"",""97273514"",""97273514"",""98978921""]","[""78661338"",""78661338"",""78661338"",""27204311"",""27204311"",""27204311"",""54693926"",""54693926"",""54693926"",""43898403"",""43898403"",""43898403"",""15693423"",""15693423"",""15693423""]",1647023905,1 year ago,,,0,Black C Squadder go BRRRR,"<h2>But du deck</h2> Deck visant à profiter de la synergie insecte pour invoquer de puissant monstre XYZ 4 comme Bagooska ou encore Utopia Double pour OTK. Le deck est plutôt orienté pour OTK en deuxième, mais peut installer l'une ou l'autre carte gênantes en jouant premier. <h2>Cartes clés</h2> <u>Giant Ball Park </u>: Cette carte est très forte dans toutes stratégies insecte ; sortir trois<strong> Shiny Black C </strong>à  2000 ATK du deck n'est pas anecdotique, et ces derniers peuvent non seulement attaquer, mais peuvent aussi servir de matériel Link ou XYZ pour lancer des combos  <u>Gokipole </u>: Autre excellente carte synergisant avec les insectes Normaux, elle permet d'en invoquer un de détruire un monstre dès qu'elle est envoyée au cimetière (défaussée par <strong>Mothman</strong>, envoyée par <strong>Resonance Insect </strong>ou juste invoquée puis utilisée comme matériel Link).  <u>Parallel Exceed : </u> Si vous avez un <strong>parallel exceed </strong>en main, l'invocation de n'importe quel monstre Link permet d'invoquer celui de la main ainsi qu'un autre du deck, tout deux niveaux 4. Les deux peuvent alors être combiné pour n'importe quel XYZ rang 4. <h2>Tips/Limitations</h2> <strong>Gokipole</strong> peut être utilisé comme équipement via <strong>Inzektor Picofalena</strong>, son effet s'activera lorsque le monstre équipé quittera le terrain.  <strong>Utopia Double</strong> est un OTK à lui tout seul. Avec son effet il permet d'invoquer un <strong>Utopia</strong> à 5000Atk et récupérer un <strong>Double or Nothing</strong>. Utopia peut alors attaquer, annuler son attaque avec son propre effet, ce qui permet d'activer  <strong>Double or Nothing</strong>, doublant son attaque à 10,000 et lui donnant une nouvelle attaque."
181086,cdc-tournament-krawler-181086,[CdC Tournament] Krawler,62587693,40292,Non-Meta Decks,"[""62587693"",""62587693"",""83477829"",""83477829"",""46083111"",""46083111"",""46083111"",""10698416"",""10698416"",""83293307"",""83293307"",""83293307"",""51205763"",""51205763"",""51205763"",""15710054"",""15710054"",""54652250"",""54652250"",""88316955"",""88316955"",""31706048"",""31706048"",""31706048"",""43140791"",""43140791"",""73628505"",""99674361"",""67831115"",""67831115"",""67831115"",""27705190"",""27705190"",""27705190"",""89208725"",""55838342"",""55838342"",""89320376"",""89320376"",""89320376""]","[""49202162"",""91140491"",""39752820"",""39752820"",""92781606"",""92781606"",""92781606"",""66393507"",""66393507"",""66393507"",""39998992"",""39998992"",""39998992"",""97273514""]","[""78661338"",""78661338"",""78661338"",""27204311"",""27204311"",""27204311"",""54693926"",""54693926"",""54693926"",""43898403"",""43898403"",""43898403"",""15693423"",""15693423"",""15693423""]",1647023905,1 year ago,,,0,Veuillez ne pas déranger le nid d'insectes au risque de provoquer l'essaim,"<h2>Type de deck</h2> Deck basé sur une série de monstre Flip. Les monstres sont très récursifs, permettant de remplir le terrain rapidement, et le terrain force l'adversaire à dépenser pas mal de ressource. Le deck possède en plus un boss puissant, capable d'annuler tous les effets de monstre sur le terrain quand il est retourné. Le deck joue en premier pour préparer ses monstres flips, puis reprend l'avantage en invoquant une masse d'insecte.  &nbsp; <h2>Cartes clés</h2> &nbsp;  <u>Les petits Krawler</u> : Ils ont chacun leur propre effet flip, de la destruction de carte, de l'invocation spéciale, de la pioche, .... Ils ont en plus de ça un effet commun : s'ils sont face recto et qu'il quitte le terrain par un effet adverse, vous pouvez invoquer 2 Krawler de plus depuis le deck face cachée, avec leurs propres effets flips, cet effet inclut <strong>Deus X-Krawler,</strong> le boss de l'archétype.  <u>World Legacy in Shadows</u> : Le terrain de l'archétype. Il possède de nombreux effets smpathiques, notamment invoquer un insecte de lvl 2 depuis la main, face recto ou verso (cet effet fonctionne aussi sur<strong> Insecte Mangeur d'Homme</strong>). Il est aussi très embêtant pour l'adversaire puisque quand un monstre Flip est détruit au combat, le monstre attaquant est aussi envoyé au cimetière. Ca entraîne une double pénalité pour l'adversaire puisque les attaques activent en plus les effets flips.  <u>Les pièges World Legacy</u>: <strong>Pawns</strong> et <strong>Mind Meld </strong> joue chacun sur un effet des Krawler. Pawns permet simplement d'activer leurs effets flips quand vous voulez, mais Mind Meld lui permet d'activer le deuxième effet des Krawlers, puisque c'est bien une carte de l'adversaire qui fait quitter le terrain au Krawler (les Krawlers ne précisent pas qu'ils doivent aller au cimetière). <h2>Tips/Limitations</h2> &nbsp;  Si vous avez <strong>Mind Meld</strong> en main de départ, il peut être utile de laisser dès le premier tour un un Krawler face visible (le terrain le permet par exemple). Dès que l'adversaire utilise un effet qui semble important, vous le transformez avec  <strong>Mind Meld</strong>, vous récupérez votre Krawler et en rajoutez deux autres sur le terrain (dont un petit <strong>Deus X-Crawler</strong> bien embêtant). Le top du cool est ensuite de pouvoir retourner <strong>Deus X-Crawler</strong>  avec un <strong>Pawns </strong>pour complètement bloqué l'adversaire.  <strong>Combo Lib, World Legacy Key :</strong> 2 monstres sur le terrain, <strong>World Armor</strong> dans le cimetière (Effet <strong>Krawler Dendrite</strong>) En invoquant Lib alors que vous avez World Armor au cimetière, vous pouvez allez chercher dans votre Deck <strong>World Legacy Succession</strong>, l'activer, invoquer World Armor, et par l'effet de World Armor récupérez une autre carte World Legacy."
