deck_num,pretty_url,deck_name,cover_card,userid,format,main_deck,extra_deck,side_deck,ts_submit_date,submit_date,ts_edit_date,edit_date,comments,deck_excerpt,deck_description
181207,starter-deck-bakura-evolution-unofficial-181207,Starter Deck_Bakura Evolution [Unofficial],31829185,63993,Fun/Casual Decks,"[""14531242"",""11321183"",""86569121"",""68049471"",""32541773"",""41949033"",""732302"",""32864"",""53375573"",""33734439"",""15510988"",""17238333"",""31829185"",""53982768"",""57281778"",""57579381"",""33066139"",""45909477"",""93900406"",""17597059"",""77936940"",""63665875"",""38742075"",""86209650"",""52860176"",""28933734"",""40267580"",""87350908"",""79323590"",""97342942"",""78053598"",""5556668"",""45311864"",""24094653"",""40703393"",""43434803"",""5318639"",""97077563"",""84970821"",""77859858"",""85742772"",""77414722"",""41925941"",""1804528"",""58607704"",""98299011""]","[""80071763""]","[""18161786"",""36121917""]",1647023905,1 year ago,,,0,Continuing the theme of Starter Deck evolutions based off of Kaiba and Yugi's Offical evolution starter deck. This is the Starter Deck_Bakura Evolutio,Continuing the theme of Starter Deck evolutions based off of Kaiba and Yugi's Offical evolution starter deck. This is the Starter Deck_Bakura Evolution [Unofficial].  Cards released up until 2008 for evolution starter decks.  A few cards inflict LP dmg directly as well take control of opponents monsters.
181211,monarch-181211,Monarch,23064604,63467,Non-Meta Decks,"[""23064604"",""23064604"",""23064604"",""96570609"",""96570609"",""96570609"",""47084486"",""47084486"",""33746252"",""57666212"",""57666212"",""22404675"",""59463312"",""59463312"",""59463312"",""95457011"",""95457011"",""95457011"",""2295440"",""81439174"",""22842126"",""22842126"",""22842126"",""33609262"",""33609262"",""33609262"",""79844764"",""79844764"",""79844764"",""19870120"",""61466310"",""61466310"",""84171830"",""84171830"",""84171830"",""18235309"",""48716527"",""48716527"",""54241725"",""54241725""]","[""11901678"",""41462083"",""45231177""]","[""86871614"",""56369281""]",1647023905,1 year ago,,,0,Just a simple one :),Just a simple one :)
181215,starter-deck-joey-wheeler-evolution-unofficial-181215,Starter Deck_ Joey Wheeler Evolution [Unofficial],74677427,63993,Fun/Casual Decks,"[""74677422"",""70781052"",""48305365"",""44287299"",""23635815"",""88819587"",""34460851"",""3573512"",""11987744"",""64335805"",""57046845"",""78658564"",""78636495"",""423705"",""35215622"",""73431236"",""39507162"",""93013676"",""90790253"",""50916353"",""84430950"",""26202165"",""25109950"",""71625222"",""26376390"",""55226821"",""34664411"",""99597615"",""47529357"",""66788016"",""83764719"",""24094653"",""75417459"",""52097679"",""74137509"",""73915051"",""16430187"",""39131963"",""4149689"",""27551"",""77538567"",""61705417"",""83968380"",""37390589"",""1224927"",""68540059"",""93382620"",""4206964"",""97077563""]","[""11901678"",""41462083"",""45231177""]","[""86871614"",""56369281""]",1647023905,1 year ago,,,0,Continuing the theme of Starter Deck evolutions based off of Kaiba and Yugi's Offical evolution starter deck. This is the Starter Deck_ Joey Wheeler E,Use equip cards to push through your opponent. use release restraiint on gearfried the iron knight and summon a very powerful monster.  Continuing the theme of Starter Deck evolutions based off of Kaiba and Yugi's Offical evolution starter deck. This is the Starter Deck_ Joey Wheeler Evolution [Unofficial]  Cards released up until 2008 for evolution starter decks (TCG).
181221,cdc-tournament-myutant-thunder-dragon-181221,[CdC Tournament] Myutant Thunder Dragon,34695290,40292,Non-Meta Decks,"[""7574904"",""7574904"",""61089209"",""34695290"",""34695290"",""29596581"",""29596581"",""29596581"",""83107873"",""91800273"",""91800273"",""91800273"",""56713174"",""56713174"",""56713174"",""8200556"",""8200556"",""8200556"",""62201847"",""62201847"",""62201847"",""20318029"",""20318029"",""1475311"",""1475311"",""1475311"",""42577802"",""73628505"",""75500286"",""95238394"",""95238394"",""24224830"",""67723438"",""34572613"",""34572613"",""34572613"",""31855260"",""31855260"",""31855260"",""60967717""]","[""6182103"",""6182103"",""6182103"",""41685633"",""41685633"",""41685633"",""79194594"",""79194594"",""79194594"",""93854893"",""66403530"",""50277355"",""70369116""]",,1647023905,1 year ago,,,0,Thor x Les gardiens de la galaxie,"<h2>Type de deck</h2> Deck combo dont la stratégie tourne autour du bannissement. Les petits Myutant se bannissent avec des cartes de la main pour invoquer les versions énervées, les dragons du tonnerre ont des effets intéressants lorsqu'ils sont bannis. Les deux archétypes jouent aussi des fusions et profitent donc très bien de <em><strong>Prédaplant Verte Anaconda</strong></em><em>.</em> <h2>Cartes clés</h2> &nbsp;  <u>Les petits Myutant</u> : M-05 et ST-46 sont les monstres les plus importants du deck. Ils vont chercher une autre carte de l'archétype quand ils sont invoqués (<span><strong>M</strong></span>-05 cherche un <span><strong>M</strong></span>onstre, <span><strong>ST</strong></span>-46 cherche les <span><strong>S</strong></span>pell <span><strong>T</strong></span>raps)  <u>Thunder Dragon Dark</u> : Le meilleur dragon du tonnerre à avoir en main de départ : bannir Dark -&gt; Ajouter Roar à la main -&gt; bannir Roar -&gt; Invoquer Matrix =&gt; 3 dragons du tonnerre pour fusionner <em><strong>Thunder Dragon Titan</strong></em>, le boss du deck (et matrix permet de récupérer un autre Matrix en main pour activer l'effet de Titan.  <u>Myutant Beast</u>: Le Myutant le plus intéressant à invoquer la majorité du temps, il demande de bannir un monstre, ce qui permet de continuer des combos avec les dragons du tonnerre ou encore <em><strong>Myutant Evolution Lab</strong></em><em>. </em>Son effet de bannir une carte (souvent-lui-même) pour annuler une magie peut embêter de nombreux decks. <h2>Tips/Limitations</h2> Board optimal : Avec une bonne main, on peut espérer finir avec un <em><strong>Myutant Beast</strong></em> pour annuler une magie, un <em><strong>Myutant Cry</strong> </em>pour invoquer un<em><strong> Myutant Synthesis</strong></em> et détruire une carte pendant le tour adverse, un <em><strong>thunder dragon titan</strong> </em>accompagné d'un Matrix en main pour détruire une deuxième carte  N'oubliez pas que<em><strong> Myutant Evolution Lab</strong> </em>peut ramener les myutant bannis, pratique pour combo T1 ou peut-être relancer un début de combo plus tard dans la partie.  Les effets des Dragon du tonnerre Main Deck sont limités à 1 par tour, choisissez bien lequel activer !"
181225,red-eyes-summoned-skull-2-0-181225,red eyes - summoned skull 2.0,14558127,58627,Non-Meta Decks,"[""14558127"",""14558127"",""14558127"",""88264978"",""95825679"",""95825679"",""95825679"",""58257569"",""58257569"",""58257569"",""53485634"",""53485634"",""53485634"",""67300516"",""67300516"",""67300516"",""74677422"",""74677422"",""74677422"",""70781052"",""70781052"",""70781052"",""70368879"",""6172122"",""6172122"",""6172122"",""76647978"",""76647978"",""92353449"",""92353449"",""32566831"",""32566831"",""46052429"",""46052429"",""46052429"",""69035382"",""23002292"",""39387565"",""39387565"",""39387565""]","[""64635042"",""64635042"",""61248471"",""61248471"",""61248471"",""32775808"",""32775808"",""32775808"",""45349196"",""45349196"",""45349196"",""4280258"",""65330383"",""38342335"",""2857636""]",,1647023905,1 year ago,,,0,red eyes (red-eyes) summoned skull deck,redeyes summoned skull.
181229,budget-mekk-knights-181229,Budget Mekk-Knights,21887175,65224,Non-Meta Decks,"[""28692962"",""28692962"",""28692962"",""20537097"",""20537097"",""20537097"",""69811710"",""69811710"",""69811710"",""92204263"",""92204263"",""66022706"",""29415459"",""56809158"",""36956512"",""36956512"",""57288708"",""14558127"",""14558127"",""97268402"",""97268402"",""97268402"",""12580477"",""18144507"",""35261759"",""35261759"",""54693926"",""54693926"",""54693926"",""99674361"",""8267140"",""8267140"",""68191756"",""68191756"",""68191756"",""2930675"",""23002292"",""98935722"",""98935722"",""62530723""]","[""74586817"",""93854893"",""21887175"",""38502358"",""38502358"",""72006609"",""72006609"",""72006609"",""30741503"",""65741786"",""98978921"",""39752820"",""39752820"",""39752820"",""85289965""]",,1647023905,1 year ago,,,0,Just a standard Mekk-Knight deck with some budget options,"So there isn't much too this, I don't really play Mekk-Knights, I made this for a friend. It's a fairly standard deck so the usual combos will probably work."
181233,cdc-tournament-trains-181233,[CdC Tournament] Trains,26096328,40292,Non-Meta Decks,"[""63941210"",""63941210"",""63941210"",""51126152"",""51126152"",""51126152"",""52481437"",""52481437"",""52481437"",""13647631"",""13647631"",""13647631"",""82385847"",""3717252"",""77723643"",""24919805"",""88875132"",""88875132"",""88875132"",""35261759"",""35261759"",""35261759"",""37520316"",""44394295"",""44394295"",""44394295"",""53129443"",""73628505"",""81439173"",""97520701"",""23171610"",""24224830"",""25274141"",""25274141"",""25274141"",""43898403"",""76136345"",""76136345"",""76136345"",""23002292""]","[""74822425"",""74822425"",""20366275"",""26096328"",""26096328"",""3814632"",""49032236"",""49032236"",""56910167"",""56910167"",""2857636"",""22423493"",""22423493"",""72336818""]",,1647023905,1 year ago,,,2,Tchou Tchou Mozeurfouckeur,"<h2>Type de deck</h2> Deck OTK dont le plan de jeu est d'invoquer <em><strong>Superdreadnought Rail Cannon Juggernaut Liebe</strong></em><em>, </em>un monstre capable d'attaquer 2/3 monstres par tour en se boostant à 6000 d'ATK.  &nbsp; <h2>Cartes clés</h2> <u>Flying Pegasus Railroad Stampede :</u> Le starter du deck, elle permet de ramener une machine lvl 10 du cimetière, puis de copier son niveau pour faire son XYZ. Elle peut utiliser aussi son effet de changement de niveau quand elle est invoquée à l'aide d'<em><strong>Urgent Schedule</strong></em><em>. </em>  <u>Heavy Freight Derricrane</u> : La meilleur carte pour faire son premier XYZ rang 10. Il est facile à invoquer et détruit une carte (magie piège incluse) quand il est détaché. Permet de faire le ménage avant le grand finish  <u>Les shaddolls</u> : Un petit coup de boost au deck, ils permettent d'invoquer El Shaddol Shekinagah qui est une machine rang 10. Vous pouvez envoyer un shaddol pour piocher ou détruire une Magie Piège, et un Super Express Bullet Train pour récupérer une machine en fin de tour <h2>Tips/Limitations</h2> &nbsp;  Pour arriver plus facilement au 8000 de dégâts, vous pouvez profiter de<em><strong> Skypalace Gangaridai</strong> </em>ou de <em><strong>Superdreadnought Rail Cannon Gustav Max</strong> </em>pour infliger 1000/2000 dégâts de Burn.  <em><strong>Shaddol fusion</strong> </em>à besoin d'un monstre issu de l'Extra Deck sur le terrain adverse pour envoyer les matériels depuis le deck"
181237,meh-myutants-181237,Meh Myutants,7574904,47552,Fun/Casual Decks,"[""7574904"",""7574904"",""7574904"",""61089209"",""61089209"",""61089209"",""34695290"",""34695290"",""34695290"",""43709490"",""43709490"",""43709490"",""8200556"",""8200556"",""8200556"",""62201847"",""62201847"",""62201847"",""38120068"",""38120068"",""38120068"",""67723438"",""79072916"",""79072916"",""34572613"",""34572613"",""34572613"",""42577802"",""42577802"",""42577802"",""5466615"",""44822037"",""44822037"",""5466615"",""5466615"",""60967717"",""60967717"",""60967717"",""31855260"",""31855260""]","[""6182103"",""6182103"",""79194594"",""79194594"",""62941499"",""88120966""]",,1647023905,1 year ago,,,0,IDK,IDK
181241,cdc-tournament-bird-up-181241,[CdC Tournament] Bird Up,87209160,40292,Non-Meta Decks,"[""29587993"",""87209160"",""87209160"",""87209160"",""73356503"",""50810455"",""50810455"",""50810455"",""56196385"",""56196385"",""56196385"",""45452224"",""45452224"",""45452224"",""24508238"",""24508238"",""24508238"",""97949165"",""97949165"",""97949165"",""60954556"",""60954556"",""60954556"",""14816857"",""14816857"",""14816857"",""34550857"",""2295440"",""81439173"",""24224830"",""51097887"",""51097887"",""51097887"",""57103969"",""57103969"",""57103969"",""40975243"",""84749824"",""84749824"",""84749824""]","[""8491961"",""99726621"",""4280258"",""49105782"",""72330894"",""72330894"",""52331012"",""52331012"",""47163170"",""47163170"",""26847978"",""26847978"",""64514892"",""65711558"",""41999284""]",,1647023905,1 year ago,,,0,Le deuxième pire deck de la méta,"<h2>Type de deck</h2> Deck basé sur l'archétype Tri-Brigade, qui synergise avec les bêtes/Bêtes ailées/Bêtes Guerrier en les bannissant pour invoquer des links du même type. Cette version se spécialise dans les bêtes ailées en se combinant avec les lyrilusc, des petits oiseaux très faibles mais facile à invoquer. <h2>Cartes clés</h2> <u>Tri-Brigade Fraktall</u> : Le meilleur Tri-brigade à avoir en main de départ (et récupérable avec <em><strong>Fire Formation Tenki</strong></em>), il garantit presqu'à lui seul 4 matériels dans le cimetière et un tri brigade sur le terrain : Défausser <em><strong>Fraktall</strong></em> -&gt; Envoyer <em><strong>Kitt</strong></em> au cimetière -&gt; Envoyer <em><strong>Nerval</strong></em> au cimetière -&gt; Récupérer <em><strong>Kerass</strong></em> en main -&gt; défausser une bête&amp;co pour invoquer <em><strong>Kerass</strong></em>, qui peut alors invoquer un premier Link  <u>Turquoise Warbler</u> : le starter Lyrilusc, il garanti 1 à 2 monstres sur le terrain sans utiliser son invocation normale. Avec <em><strong>Foolish Burial,</strong></em> le mieux est d'invoquer du cimetière Cobalt Sparrow pour ensuite ajouter un <em><strong>DD Crow</strong></em> à la main pour perturber le tour adverse  <u>Tri Brigade BearBrumm</u>: Si vous n'avez pas de tour 1 complétement fumé, un plan de jeu peut-être d'invoquer ce monstre, l'envoyer au cimetière et récupérer <em><strong>Tri-Brigade Revolt.</strong></em> Revolt peut embêter le tour adverse en invoquant un <em><strong>Shuraig </strong></em>ou préparer le tour suivant en invoquant un autre <em><strong>BearBrumm</strong> </em>pour aller chercher un <em><strong>Airborn assault.</strong></em>  <span><strong>Tips/Limitations</strong></span>  Board Optimal : <em><strong>Appolousa Bow of the Goddess</strong> </em>avec les matériels accumulés sur le terrain (souvent à 3 negates en utilisant un Link-2), le <em><strong>Simorgh Bird of Sovereignty</strong></em> invoqué à l'aide d'un Tri-Brigade pour ramener une <em><strong>Statue barrière des tempêtes</strong></em> et un <em><strong>Linkuriboh</strong> </em>invoqué avec un Lvl 1 pour protéger la statue d'une attaque  <em><strong>Tri Brigade Ariborne assault</strong></em> empêche d'invoquer <em><strong>Recital Starling</strong> </em>pour le reste du tour, attention à l'ordre !"
181245,black-rose-dragon-181245,Black Rose Dragon,12213463,17793,Non-Meta Decks,"[""12213463"",""12213463"",""12213463"",""93708824"",""93708824"",""93708824"",""29107423"",""29107423"",""29107423"",""48686504"",""48686504"",""48686504"",""17720747"",""17720747"",""26118970"",""26118970"",""90724272"",""90724272"",""44125452"",""29177818"",""44928016"",""11747708"",""13903402"",""88774734"",""8972398"",""67750322"",""67750322"",""14558128"",""14558128"",""54693926"",""54693926"",""69167267"",""69167267"",""69167267"",""53503015"",""71645242"",""83764719"",""24224830"",""81439173"",""2295440""]","[""40139997"",""84664085"",""27548199"",""50954680"",""73580471"",""72924435"",""33158448"",""53325667"",""63767246"",""86066372"",""4280259"",""50588353"",""72218246"",""24361622"",""86148577""]",,1647023905,1 year ago,,,0,Black Rose Dragon,Black Rose Dragon
181249,blood-in-the-water-181249,Blood in the Water,10532969,65263,Fun/Casual Decks,"[""10532969"",""37721209"",""32393580"",""20358953"",""71923655"",""37798171"",""70101178"",""23536866"",""7500772"",""37792478"",""37792478"",""70655556"",""70655556"",""63193879"",""63193879"",""64319467"",""17643265"",""17643265"",""20838380"",""82498947"",""82498947"",""56704140"",""56704140"",""43138260"",""43138260"",""17201174"",""17201174"",""7653207"",""7653207"",""12580477"",""61258740"",""43898403"",""49669730"",""49669730"",""295517"",""295517"",""29401950"",""53582587"",""7092142"",""25642998"",""52140003""]","[""50321796"",""70583986"",""52687916"",""5614808"",""78229193"",""90809975"",""50449881"",""49221191"",""65676461"",""440556"",""37279508"",""31320433"",""5014629"",""14306092"",""440556""]","[""98645731"",""69327790"",""29587993"",""11366199"",""50866755"",""101106014"",""51405049"",""25311006"",""54693926"",""30241314""]",1647023905,1 year ago,,,0,Sharks,"Mass summon low-level sharks in order to bumrush the opponent, then if still alive proceed to get the big bois out."
181253,flundereeze-2021-181253,Flundereeze 2021,53212882,17333,Non-Meta Decks,"[""53212882"",""53212882"",""80611581"",""80611581"",""54334420"",""54334420"",""80433039"",""80433039"",""18940725"",""18940725"",""18940725"",""17827173"",""17827173"",""28126717"",""28126717"",""28126717"",""73628505"",""55521751"",""55521751"",""55521751"",""8843569"",""8843569"",""8843569"",""25311006"",""25311006"",""84211599"",""84211599"",""84211599"",""98645731"",""98645731"",""51405049"",""41215808"",""41215808"",""77610503"",""77610503"",""14558127"",""14558127"",""14558127"",""69327790"",""73356503""]","[""65330383"",""65330383"",""65330383"",""86066372"",""86066372"",""86066372"",""38342335"",""38342335"",""38342335"",""2857636"",""2857636"",""2857636"",""75452921"",""75452921"",""75452921""]","[""98645731"",""69327790"",""29587993"",""11366199"",""50866755"",""101106014"",""51405049"",""25311006"",""54693926"",""30241314""]",1647023905,1 year ago,,,1,Flundereeze 2021,Flundereeze 2021
181257,like-clockwork-181257,Like Clockwork,71095768,58572,Non-Meta Decks,"[""56308388"",""56308388"",""56308388"",""55010259"",""55010259"",""29021114"",""29021114"",""41172955"",""41172955"",""86445415"",""86445415"",""64730881"",""64730881"",""64730881"",""13839120"",""13839120"",""82496097"",""82496097"",""19891131"",""19891131"",""19891131"",""81275020"",""53932291"",""81670445"",""64662453"",""64662453"",""34559295"",""34559295"",""83764719"",""3298689"",""10877309"",""10877309"",""41420027"",""40605147"",""76587747"",""76587747"",""20899496"",""98827725"",""98827725"",""18678554""]","[""84025439"",""1621413"",""39317553"",""16195942"",""16195943"",""55285840"",""55285840"",""28912357"",""28912357"",""91135480"",""8387138"",""6983839"",""59208943"",""40216089"",""71095768"",""32986898""]","[""75162696"",""75162696"",""59438930"",""59438930"",""64276752"",""85289965"",""20665527"",""12580477"",""23171610"",""88504133"",""87567063"",""3298689"",""3298689"",""14602126"",""14602126""]",1647023905,1 year ago,,,0,"Just something I came up with, theory is sound but it needs testing and tweaking. Open to any suggestions. Time Thief Gadget","Just something I came up with, theory is sound but it needs testing and tweaking. Open to any suggestions. Time Thief Gadget"
181262,final-sigma-turbo-181262,Final Sigma Turbo,42632209,58572,Non-Meta Decks,"[""82257671"",""8567955"",""89743495"",""645087"",""645087"",""17946349"",""53577438"",""53577438"",""53577438"",""27182739"",""27182739"",""27182739"",""80965043"",""80965043"",""80965043"",""16360142"",""16360142"",""16360142"",""52354896"",""52354896"",""14505685"",""14505685"",""11801343"",""11801343"",""11801343"",""34010534"",""34010534"",""41410651"",""41410651"",""57160136"",""57160136"",""57160136"",""81439173"",""18144507"",""14025912"",""14025912"",""83764719"",""40605147"",""40605147"",""38960450""]","[""42632209"",""42632209"",""27548199"",""74586817"",""15248594"",""88021907"",""21887175"",""24882256"",""46947713"",""88093706"",""52698008"",""65741786"",""48068378"",""32995276"",""24842059""]","[""88392300"",""88392300"",""14558127"",""14558127"",""73642296"",""73642296"",""94145021"",""94145021"",""5043010"",""14532163"",""24224830"",""23002292"",""10045474"",""78161960"",""78161960""]",1647023905,1 year ago,,,0,Mathmech Cyberse,Summons Final Sigma under 5 summons
181266,when-will-you-see-the-light-181266,When will you see the LIght!!,95956346,62382,Non-Meta Decks,"[""72989439"",""9596126"",""9596126"",""9596126"",""77585513"",""21417692"",""39507162"",""47025270"",""76922029"",""26202165"",""78010363"",""83011277"",""83011277"",""95956346"",""95956346"",""37101832"",""31560081"",""31560081"",""16226786"",""32362575"",""14087893"",""14087893"",""99597615"",""83764718"",""74191942"",""55144522"",""97169186"",""97169186"",""72302403"",""71453557"",""70368879"",""4178474"",""4178474"",""4178474"",""97077563"",""97077563"",""59344077"",""59344077"",""62279055"",""56120475""]","[""27134689"",""21175632"",""66889139"",""13722870"",""86805855"",""90140980"",""28593363"",""51828629"",""56907389"",""89112729"",""17881964"",""70681994"",""1641882"",""54541900"",""21175632""]","[""34206604"",""49217579"",""47507260"",""34853266"",""34853266"",""3078576"",""46411259"",""60682203"",""60082869"",""60082869"",""60082869"",""21598948"",""21598948"",""15800838"",""15800838""]",1647023905,1 year ago,,,0,Aggro is the only way. Resistance is futile.,"If you work, you twerk and you jerk, that's a full day. That's a heck of a day. You do that seven times a week, you're going to have something special."
181271,blood-in-the-water-181271,Blood in the Water,10532969,65263,Fun/Casual Decks,"[""10532969"",""37721209"",""32393580"",""20358953"",""71923655"",""37798171"",""70101178"",""23536866"",""7500772"",""37792478"",""37792478"",""70655556"",""70655556"",""63193879"",""63193879"",""64319467"",""17643265"",""17643265"",""20838380"",""82498947"",""82498947"",""56704140"",""56704140"",""43138260"",""43138260"",""17201174"",""17201174"",""7653207"",""7653207"",""12580477"",""61258740"",""43898403"",""49669730"",""49669730"",""295517"",""295517"",""29401950"",""53582587"",""7092142"",""25642998"",""52140003""]","[""50321796"",""70583986"",""52687916"",""89907227"",""5614808"",""78229193"",""68836428"",""90809975"",""50449881"",""440556"",""37279508"",""31320433"",""5014629"",""14306092"",""440556""]","[""34267821"",""34267821"",""34267821"",""54693926"",""54693926"",""54693926"",""15693423"",""15693423"",""41420027"",""41420027"",""41420027"",""23002292"",""61740673"",""8267140"",""18144507""]",1647023905,1 year ago,,,0,Da Sharks,Summon da Sharks
181275,yugioh-draft-league-v1-181275,Yugioh Draft league V1,47349116,65267,Non-Meta Decks,"[""76794549"",""76794549"",""16178681"",""16178681"",""16178681"",""88757791"",""88757791"",""14920218"",""14920218"",""12289247"",""12289247"",""94415058"",""7127502"",""7127502"",""40318957"",""10239627"",""10239627"",""75672051"",""75672051"",""75672051"",""11067666"",""11067666"",""72714461"",""49684352"",""49684352"",""49684352"",""22200403"",""48461764"",""48461764"",""48461764"",""73941492"",""73941492"",""20409757"",""88935103"",""88935103"",""54941203"",""54941203"",""54941203"",""74850403"",""74850403"",""74850403"",""83461421"",""83461421"",""69982329"",""15582767"",""15582767"",""1344018"",""1344018"",""77826734"",""77826734"",""77826734""]","[""53262004"",""53262004"",""53262004"",""59123194"",""59123194"",""80696379"",""16691074"",""47349116"",""47349116"",""47349116""]","[""34267821"",""34267821"",""34267821"",""54693926"",""54693926"",""54693926"",""15693423"",""15693423"",""41420027"",""41420027"",""41420027"",""23002292"",""61740673"",""8267140"",""18144507""]",1647023905,1 year ago,,,0,Odd-eyes and pendulum magicians,Not much of a strategy yet just trying to figure things out for now
181283,blue-eyes-beaver-butts-181283,Blue Eyes Beaver Butts,89631146,65260,Non-Meta Decks,"[""89631139"",""12580477"",""55144522"",""83764719"",""72842870"",""32452818"",""53375573"",""32452818"",""84686841"",""84686841"",""84686841"",""4614116"",""53375573"",""53375573"",""2863439"",""59197169"",""2863439"",""77827521"",""36304921"",""63308047"",""63308047"",""63308047"",""85639257"",""40374923"",""72842870"",""50913601"",""50913601"",""83887306"",""83887306"",""63102017"",""1784619"",""1784619"",""63102017"",""63102017"",""38199696"",""38199696"",""51482758"",""51482758"",""51482758"",""33064647"",""33064647"",""33064647"",""1435851"",""1435851"",""1435851"",""55444629"",""55444629"",""7089711"",""7089711"",""66788016"",""73134082"",""53129443"",""91152256"",""9076207"",""9076207"",""54652250"",""54652250"",""10202894"",""10202894"",""10202894""]","[""74393852"",""11510448"",""41375811"",""48905153"",""90448279"",""26847978"",""47163170"",""52331012"",""99726621"",""99726621"",""60303245"",""65711558"",""49105782"",""4280258"",""85289965""]","[""34267821"",""34267821"",""34267821"",""54693926"",""54693926"",""54693926"",""15693423"",""15693423"",""41420027"",""41420027"",""41420027"",""23002292"",""61740673"",""8267140"",""18144507""]",1647023905,1 year ago,,,1,with the beaver,in the butt
