deck_num,pretty_url,deck_name,cover_card,userid,format,main_deck,extra_deck,side_deck,ts_submit_date,submit_date,ts_edit_date,edit_date,comments,deck_excerpt,deck_description
230242,triple-sd-challenge-zombie-madness-230242,Triple SD Challenge - Zombie Madness,22056710,41756,Fun/Casual Decks,"[""22056710"",""22056710"",""22056710"",""89111398"",""53839837"",""53839837"",""53839837"",""77044671"",""77044671"",""77044671"",""63012333"",""63012333"",""63012333"",""23205979"",""23205979"",""23205979"",""70645913"",""70645913"",""34250214"",""34250214"",""1475311"",""1475311"",""1475311"",""2204140"",""2204140"",""2204140"",""5318639"",""5318639"",""5318639"",""4861205"",""4861205"",""4861205"",""62188962"",""22900598"",""31189536"",""53582587"",""53582587"",""53582587"",""94192409"",""94192409""]","[""8198620"",""8198620"",""8561192"",""63422098"",""52687916"",""19974580"",""76547525"",""15028680"",""6021033"",""6021033"",""32995007"",""42566602"",""50321796"",""88033975"",""26593852""]","[""79266769""]",1647023905,1 year ago,,,0,Remember that one time Vampires were not an Archetype yet?,"Remember that time I promised I would bring 3 Zombie Structure Decks for the challenge all the way back on Halloween? Well, after finally entering the last weeks of school I finally have some time to bring you said decklists. Also, I mentioned there would be changes in how I would continue this challenge, in the form of 2 new rules:  - Almost all Structure Decks have a portrait monster that indicates the Structure Deck's boss monster(s). So, for every decklist for this challenge from now on most feature said monster at 3 copies. In case that more than 1 monster is featured, to add a bit of difficulty, you can only use a combination of 3 cards among those monsters but all must be featured. Lastly, the entire playstyle of the decklist must play around either that monster(s) playstyle or turbo-ing out ASAP.  - To give more ambience to the Decklists for the time they were printed, depending if they have Extra Deck monsters and the time they dayviewed, the status of the Extra Deck will change. For example: Zombie Madness will not feature an Extra Deck, Zombie World will have one, but made mostly of not-so-recent Synchros and Fusions; and Zombie Horde giving that it is the most recent one has an Extra Deck with any kind of card.  So, with these explanation cleared, I bring to you the <strong>Triple Structure Deck Challenge</strong> for the <strong>Zombie Madness Structure Deck</strong>.  <strong>ANALYSIS</strong> As its name states, Zombie Madness is a Structure Deck based around a Zombie-themed Deck. Giving how old this Deck was printed, it did help to show how even today Zombies' playstyle, being having a lot of GY plays.  This decks' boss monster is <strong>Vampire Genesis</strong>. Is a Level 8 DARK Zombie monster with 3000 ATK/2100 DEF and it cannot be Normal Summoned/Set, must be Special Summoned from the hand by banishing 1 Vampire Lord you control and cannot be summoned by other ways. OPT: You can discard 1 Zombie monster to target another one in your GY with a lower Level than the discarded monster and Special Summon it. <strong>Vampire Lord</strong> is a Level 5 DARK Zombie with 2000 ATK/1500 DEF. If it inflicts battle damage to the opponent: You can declare either Monster/Spell/Trap cards; then your opponent must send to the GY one card of the type declared, at their choice. Also, if this card was destroyed by and opponent's card effect: It Special Summon itself back during your next Standby Phase. There's a high chance you might not recognize either of them if you played/played against current-time Vampire decks giving that both monsters can't help out with their new playstyle even if they have good Levels for their Xyz. However, said Vampire support can help out to search them out and some of the support from this same Structure Deck can cheat out Lord a bit faster.  As for their playstyle, it revolves around Special Summoning Zombie monsters and milling. Yes, milling is also consider to be Zombie's secondary playstyle.  <strong>BREAKDOWN</strong> <strong>***Vampire Genesis</strong>: Main Boss Monster of the Deck. Largest body and can bring Zombies from the GY. <strong>*Dark Dust Spirit</strong>: When Normal Summoned or flipped, it destroys all other face-up monsters on the field. One off as an emergency nuke giving its Spirit monster nature. <strong>***Vampire Lord</strong>: Necessary to summon Genesis, easy to summon and tolerable stats/self-revival. <strong>***Pyramid Turtle</strong>: When destroyed by battle, it can float into any Zombie monster from your Deck with 2000 or less DEF. Except for Genesis, it can float into any Zombie from this Deck, more importantly Lord and Spirit Reaper. <strong>***Soul-Absorbing Bone Tower</strong>: Cannot be targeted for attacks if you control another Zombie monster, including another copy of itself so you can prevent your opponent from attacking them at all. Also, each time you Special Summon a Zombie monster on your field, it mills the top 2 cards from your opponent's Deck. <strong>***Spirit Reaper</strong>: Cannot be destroyed by battle, but it self-destructs if it is targeted by a card effect. Mainly used for stalling out battles. <strong>**Vampire Follower</strong>(Outside Support): Searchs ""Vampire"" backrow when Special Summoned and it can revive itself from the GY. <strong>**Vampire Familiar</strong>(Outside Support): Searchs ""Vampire"" monsters when Special Summoned and it can revive itself from the GY. Main searcher for Genesis and Lord. <strong>***Allure of Darkness</strong>(Outside Support): Giving that this deck runs a lot of DARK monsters, it adds that necessary draw power. <strong>***Book of Life</strong>: It targets a Zombie on your GY and one monster on your opponent's GY, then it Special Summons the first target while banishing the second. A brick on turn 1 but useful later. <strong>***Mystical Space Typhoon</strong>: Quick-play backrow removal. <strong>***Call of the Mummy</strong>: Basically Valhalla for Zombie monsters. <strong>*Vampire Kingdom</strong>(Outside Support): Boosts Zombie monsters and turns Lord's and Bone Tower's mill effect into a potential destruction effect as well. <strong>*Vampire Takeover</strong>(Outside Support): Activates Kingdom from the Deck and revives a ""Vampire"". One of Follower's main searchs. <strong>*Vampire Awakening</strong>(Outside Support): Special Summons a ""Vampire"" monster from the Deck but destroys it during the End Phase. Useful to summon Familiar/Follower to search. <strong>***Torrential Tribute</strong>: Another emergency board wipe. <strong>**Compulsory Evacuation Device</strong>: Targeted bouncing effect."
230236,cinkro-s-reptile-deck-230236,CinKro's Reptile Deck,8062132,86929,Fun/Casual Decks,"[""97565997"",""8062132"",""98787535"",""62383431"",""72677437"",""72677437"",""72677437"",""94656263"",""94656263"",""62405028"",""62405028"",""62405028"",""36010310"",""36010310"",""36010310"",""99745551"",""57647597"",""57647597"",""8131171"",""8131171"",""8131171"",""17189677"",""17189677"",""17189677"",""24050692"",""24050692"",""24050692"",""38120068"",""38120068"",""64973456"",""64973456"",""64973456"",""73628505"",""60448701"",""16067089"",""16067089"",""80101899"",""93217231"",""93217231"",""93217231""]","[""11398059"",""11398059"",""11398059"",""74974229"",""74974229"",""74974229"",""8602351"",""8602351"",""8602351""]","[""79266769""]",1647023905,1 year ago,,,0,Ogdoadics with venominaga,Do the ogdoadic thing and maybe get venominaga out
230232,lod-prog-230232,LoD Prog,37684215,95568,Non-Meta Decks,"[""70781052"",""69140098"",""69140098"",""77585513"",""77585513"",""66362965"",""18036057"",""88472456"",""88472456"",""88472456"",""57617178"",""57617178"",""57617178"",""78010363"",""78010363"",""78010363"",""74131780"",""2460565"",""26202165"",""26202165"",""26202165"",""79575620"",""31560081"",""64631466"",""45986603"",""17375316"",""31036355"",""53129443"",""66788016"",""19613556"",""55144522"",""55144522"",""55144522"",""32807846"",""32807846"",""95281259"",""95281259"",""41426869"",""61740673"",""59344077"",""29401950"",""29401950"",""29401950"",""44095762"",""37684215""]","[""54752875"",""21175632"",""21175632"",""21175632""]","[""44656491"",""44656491"",""56948373"",""56948373"",""17449108"",""17449108"",""17449108"",""19230407"",""93016201"",""93016201"",""93016201"",""59344077"",""59344077""]",1647023905,1 year ago,,,0,LoD Prog,LoD Prog
230228,lod-prog-230228,LoD Prog,2460565,95568,Non-Meta Decks,"[""70781052"",""69140098"",""69140098"",""77585513"",""77585513"",""66362965"",""18036057"",""88472456"",""88472456"",""88472456"",""57617178"",""57617178"",""57617178"",""78010363"",""78010363"",""78010363"",""74131780"",""2460565"",""26202165"",""26202165"",""26202165"",""79575620"",""31560081"",""64631466"",""45986603"",""17375316"",""31036355"",""53129443"",""66788016"",""19613556"",""55144522"",""55144522"",""55144522"",""32807846"",""32807846"",""95281259"",""95281259"",""41426869"",""61740673"",""59344077"",""29401950"",""29401950"",""29401950"",""44095762""]","[""54752875"",""21175632"",""21175632"",""21175632""]","[""44656491"",""44656491"",""56948373"",""56948373"",""17449108"",""17449108"",""17449108"",""19230407"",""93016201"",""93016201"",""93016201"",""59344077"",""59344077""]",1647023905,1 year ago,,,0,LoD Prog,LoD Prog
230224,salamangreat-230224,Salamangreat,26889158,17954,Non-Meta Decks,"[""94620082"",""94620082"",""94620082"",""56003780"",""56003780"",""56003780"",""52277807"",""52277807"",""20618081"",""20618081"",""89662401"",""26889158"",""16188701"",""16188701"",""16188701"",""80794697"",""80794697"",""80794697"",""14558127"",""14558127"",""14558127"",""57160136"",""57160136"",""57160136"",""64178424"",""64178424"",""64178424"",""1295111"",""1295111"",""52155219"",""48130397"",""51339637"",""51339637"",""51339637"",""14934922"",""14934922"",""14934922"",""40605147"",""40605147"",""40605147""]","[""14812471"",""14812471"",""14812471"",""87871125"",""87871125"",""41463181"",""41463181"",""37261776"",""87327776"",""88093706"",""46947713"",""86066372"",""85289965"",""4280258"",""38342335""]","[""27204311"",""27204311"",""27204311"",""34267821"",""34267821"",""34267821"",""67750322"",""67750322"",""14532163"",""14532163"",""14532163"",""53334471"",""53334471"",""15693423"",""15693423""]",1647023905,1 year ago,,,0,A Salamangreat deck,I only uploaded this to add it to EDOPro. Use it if you want.
230220,eldlich-zombies-230220,Eldlich Zombies,4064256,17954,Non-Meta Decks,"[""95440946"",""95440946"",""95440946"",""49959355"",""49959355"",""49959355"",""39185163"",""39185163"",""94801854"",""94801854"",""66570171"",""36016907"",""92964816"",""92826944"",""14558127"",""14558127"",""14558127"",""4064256"",""4064256"",""4064256"",""31434645"",""31434645"",""31434645"",""68829754"",""68829754"",""94224458"",""43898403"",""43898403"",""48130397"",""81439173"",""20612097"",""20612097"",""20612097"",""20590515"",""20590515"",""93191801"",""93191801"",""56984514"",""56984514"",""82732705""]","[""74889525"",""8198620"",""41209827"",""27548199"",""28240337"",""50954680"",""73580471"",""56910167"",""26096328"",""37129797"",""37129797"",""91420202"",""91420202"",""2645637"",""2857636""]","[""27204311"",""27204311"",""27204311"",""34267821"",""34267821"",""34267821"",""73642296"",""73642296"",""73642296"",""14532163"",""14532163"",""14532163"",""82956214"",""82956214"",""82956214""]",1647023905,1 year ago,,,0,Eldlich Zombie World lockdown,I only uploaded this to download it onto EDOPro. Feel free to use it if you want.
230212,machina-230212,Machina,45674286,45863,Fun/Casual Decks,"[""46033517"",""46033517"",""87074380"",""87074380"",""69838761"",""69838761"",""50863093"",""50863093"",""50863093"",""23469398"",""23469398"",""23469398"",""5556499"",""5556499"",""82012319"",""80529459"",""4334811"",""4334811"",""4334811"",""45674286"",""45674286"",""45674286"",""42940404"",""42940404"",""42940404"",""85136114"",""85136114"",""86852702"",""86852702"",""86852702"",""25274141"",""25274141"",""25274141"",""59741415"",""59741415"",""53582587"",""53582587"",""10045474"",""10045474"",""40605147"",""40605147"",""41420027"",""41420027"",""80101899"",""61740673""]","[""90448279"",""26096328"",""26096328"",""49032236"",""56910167"",""28912357"",""49121795"",""65741786"",""146746"",""47363932"",""22423493"",""38342336"",""49202162"",""4280259"",""86066372""]","[""14558127"",""14558127"",""73642296"",""73642296"",""97268402"",""97268402"",""97268402"",""46565218"",""56910167"",""54693926"",""54693926"",""54693926"",""58921041"",""58921041"",""29549364""]",1647023905,1 year ago,,,0,Machina my version,Deck whit great OTK chances but can make control in his plays. Good luck
230208,labyrinth-prog-230208,Labyrinth Prog,53582587,95568,Non-Meta Decks,"[""70781052"",""69140098"",""69140098"",""77585513"",""77585513"",""88472456"",""88472456"",""88472456"",""21417692"",""21417692"",""76305638"",""76305638"",""76305638"",""97017120"",""97017120"",""97017120"",""78010363"",""78010363"",""78010363"",""26202165"",""26202165"",""26202165"",""22567609"",""22567609"",""22567609"",""31560081"",""23615409"",""23615409"",""23615409"",""45986603"",""17375316"",""53129443"",""66788016"",""66788016"",""19613556"",""55144522"",""55144522"",""55144522"",""19230407"",""19230407"",""74701381"",""74701381"",""74701381"",""59344077"",""59344077"",""59344077""]","[""54752875"",""21175632"",""21175632"",""21175632""]","[""44656491"",""44656491"",""17449108"",""17449108"",""17449108"",""48539234"",""48539234"",""48539234"",""56948373"",""31786629"",""56948373"",""31786629"",""31786629"",""33550694"",""33550694""]",1647023905,1 year ago,,,0,Labyrinth Prog,Labyrinth Prog
230203,royal-black-rose-dragon-230203,Royal Black Rose Dragon,73580472,48819,Fun/Casual Decks,"[""75252099"",""75252099"",""98884569"",""98884569"",""87294988"",""87294988"",""49674183"",""49674183"",""48686504"",""48686504"",""48686504"",""40320754"",""40320754"",""40320754"",""78540593"",""78540593"",""96470883"",""96470883"",""26118970"",""26118970"",""31986288"",""31986288"",""12469386"",""12469386"",""81146288"",""81146288"",""51852507"",""51852507"",""89252157"",""89252157"",""96385345"",""96385345"",""41160533"",""41160533"",""23087070"",""23087070"",""80190753"",""80190753"",""2986553"",""2986553"",""11819616"",""11819616"",""12213463"",""53503015"",""53503015"",""45247637"",""45247637"",""67169062"",""80196387"",""80196387"",""65079854"",""65079854"",""99092624"",""99092624"",""2779999"",""2779999"",""71645242"",""71645242"",""71645242""]","[""73580471"",""73580471"",""4290468"",""4290468"",""51735257"",""51735257"",""89516305"",""89516305"",""72218246"",""72218246""]","[""44656491"",""44656491"",""17449108"",""17449108"",""17449108"",""48539234"",""48539234"",""48539234"",""56948373"",""31786629"",""56948373"",""31786629"",""31786629"",""33550694"",""33550694""]",1647023905,1 year ago,,,1,plants are cool,plants are cool
230196,guardian-prog-230196,Guardian Prog,16762927,95568,Non-Meta Decks,"[""70781052"",""67284908"",""77585513"",""77585513"",""97017120"",""97017120"",""97017120"",""78010363"",""78010363"",""78010363"",""13215230"",""26202165"",""26202165"",""26202165"",""34124316"",""34124316"",""34124316"",""79106360"",""79106360"",""22567609"",""22567609"",""22567609"",""28933734"",""28933734"",""28933734"",""58551308"",""58551308"",""58551308"",""31560081"",""16762927"",""16762927"",""16762927"",""23615409"",""23615409"",""23615409"",""44656491"",""44656491"",""45986603"",""17375316"",""53129443"",""66788016"",""66788016"",""19613556"",""55144522"",""55144522"",""55144522"",""43434803"",""43434803"",""43434803"",""74701381"",""74701381"",""74701381"",""85742772"",""85742772"",""61740673"",""18807108"",""59344077"",""59344077"",""59344077"",""44095762""]","[""73580471"",""73580471"",""4290468"",""4290468"",""51735257"",""51735257"",""89516305"",""89516305"",""72218246"",""72218246""]","[""17449108"",""17449108"",""17449108"",""48539234"",""48539234"",""48539234"",""43711255"",""43711255"",""43711255"",""9076207"",""9076207"",""79759861"",""17653779"",""17653779"",""93108433""]",1647023905,1 year ago,,,0,Guardian Prog,Guardian Prog
230192,toon-230192,Toon,28711704,95600,Non-Meta Decks,"[""28711704"",""28711704"",""28711704"",""21296502"",""21296502"",""31733941"",""31733941"",""7171149"",""65458948"",""65458948"",""64116319"",""42386471"",""66574418"",""66574418"",""66574418"",""14558128"",""14558128"",""14558128"",""43175858"",""43175858"",""43175858"",""73628505"",""91500017"",""91500017"",""91500017"",""89997728"",""89997728"",""89997728"",""27699122"",""27699122"",""27699122"",""6958551"",""33453260"",""33453260"",""33453260"",""49238328"",""49238328"",""49238328"",""24224830"",""53094821""]","[""63767246"",""63767246"",""22110647"",""44405066"",""44405066"",""80117527"",""6983839"",""82633039"",""46772449"",""21044178"",""66011101"",""66011101"",""41999284"",""73309655"",""49202162""]","[""17449108"",""17449108"",""17449108"",""48539234"",""48539234"",""48539234"",""43711255"",""43711255"",""43711255"",""9076207"",""9076207"",""79759861"",""17653779"",""17653779"",""93108433""]",1647023905,1 year ago,,,0,Deck toon,&nbsp;  &nbsp;
230180,drytron-dogmatika-deck-2021-230180,Drytron Dogmatika deck 2021.,1984618,75230,Non-Meta Decks,"[""69680031"",""92919429"",""92919429"",""92919429"",""97148796"",""97148796"",""97148796"",""60037599"",""60037599"",""96026108"",""96026108"",""96026108"",""69815951"",""40352445"",""77235086"",""48654323"",""60600126"",""60600126"",""60600126"",""94187078"",""94187078"",""94187078"",""81439174"",""1845204"",""1984618"",""1984618"",""1984618"",""84211599"",""84211599"",""84211599"",""96729612"",""96729612"",""96729612"",""24224830"",""24299458"",""24299458"",""24299458"",""60921537"",""31002402"",""22398665"",""82956214"",""82956214""]","[""41373230"",""80532587"",""80532587"",""80532587"",""41578483"",""79606837"",""79606837"",""79606837"",""90448279"",""72167543"",""1174075"",""1174075"",""48608796"",""10669138"",""2857636""]","[""27204311"",""27204311"",""27204311"",""43534808"",""43534808"",""94145021"",""94145021"",""94145021"",""54693926"",""54693926"",""54693926"",""43898403"",""43898403"",""43898403"",""23002292""]",1647023905,1 year ago,,,0,"No eretic Heralds, only sentient machines and Nadir. ","I tested Dytron Herald deck today but didn't liked the part of ""not let your opponent play"" in it, so i decided to make a new version using Dogmatika.  You can add one more Dogmatika Punishment if you prefer.  &nbsp;  &nbsp;  GLHF"
230176,harpie-deck-for-fun-230176,Harpie Deck for fun,75064463,95429,Non-Meta Decks,"[""75064463"",""75064463"",""91932350"",""91932350"",""39392286"",""39392286"",""39392286"",""90238142"",""90238142"",""90238142"",""56585883"",""56585883"",""56585883"",""66386380"",""68815132"",""12206212"",""6924874"",""52040216"",""86308219"",""18144507"",""39275698"",""92881099"",""77778835"",""87639778"",""87639778"",""87639778"",""75782277"",""75782277"",""90219263"",""90219263"",""90219263"",""19337371"",""19337371"",""19337371"",""94145683"",""71459861"",""71459861"",""8843569"",""8843569"",""8843569""]","[""85909450"",""85909450"",""63261835"",""63261835"",""86848580"",""22653490""]","[""911883"",""76812113"",""94145683"",""77778835"",""12181376"",""12206212"",""75064463"",""66386380"",""4991081""]",1647023905,1 year ago,,,1,Harpie deck not for competitive play,"For fun, including some non-competitive cards that fit aesthetically"
230172,salamangreat-230172,Salamangreat,87871125,84101,Non-Meta Decks,"[""97268402"",""97268402"",""97268402"",""73642296"",""73642296"",""73642296"",""26889158"",""52277807"",""52277807"",""52277807"",""94620082"",""94620082"",""56003780"",""56003780"",""20618081"",""80794697"",""80794697"",""80794697"",""71278040"",""71278040"",""71278040"",""53309998"",""1295111"",""52155219"",""64178424"",""64178424"",""1295111"",""35261759"",""35261759"",""35261759"",""57160136"",""57160136"",""57160136"",""51339637"",""51339637"",""14934922"",""14934922"",""10045474"",""10045474"",""10045474""]","[""87327776"",""90590303"",""31313405"",""31313405"",""87871125"",""87871125"",""87871125"",""14812471"",""14812471"",""14812471"",""88093706"",""46947713"",""59859086"",""66403530"",""21044178""]","[""82385847"",""55063751"",""55063751"",""34267821"",""34267821"",""34267821"",""8267140"",""8267140"",""8267140"",""54693926"",""54693926"",""54693926"",""31849106"",""31849106"",""31849106""]",1647023905,1 year ago,,,0,Decently budget salads,enjoy :)
230168,big-stupid-beaters-the-finale-230168,Big Stupid Beaters: The Finale,89631146,94358,Fun/Casual Decks,"[""89631139"",""89631139"",""6631034"",""6631034"",""14214060"",""14214060"",""18108166"",""18108166"",""43096270"",""43096270"",""69247929"",""69247929"",""74852097"",""74852097"",""81823360"",""81823360"",""14575467"",""14575467"",""84754430"",""84754430"",""47226949"",""47226949"",""4148264"",""4148264"",""24639891"",""24639891"",""11012154"",""11012154"",""30683373"",""30683373"",""81510157"",""81510157"",""22346472"",""22346472"",""56120475"",""56120475"",""36361633"",""36361633"",""25005816"",""25005816""]","[""9053187"",""9053187"",""71594310"",""71594310"",""84013237"",""84013237"",""56840427"",""56840427"",""21521304"",""67598234"",""67598234"",""2857636"",""2857636"",""97204936"",""97204936""]","[""82385847"",""55063751"",""55063751"",""34267821"",""34267821"",""34267821"",""8267140"",""8267140"",""8267140"",""54693926"",""54693926"",""54693926"",""31849106"",""31849106"",""31849106""]",1647023905,1 year ago,,,0,"TLDR; fun deck, fun game.","This was the first deck I made that I thought was actually worth playing. Hell, I still run it from time to time. Of course, It looks like the kind of deck someone from 1996 would put together, but at the time of making the deck, I really enjoyed it. No combos, no confusing or complicated card effects. Just really stupid big beatsticks. This is the First real deck I made, and it's kinda ironic that it's also probably the last deck I publish here.  Thanks to all the people who took the time to look through these decks, and possibly even tried them out. I'm here hoping everyone has fun, 'cause that's what matters when playing yugioh, right?  Thank you, goodnight."
230164,ruler-prog-230164,Ruler Prog,34124316,95568,Non-Meta Decks,"[""70781052"",""67284908"",""97017120"",""97017120"",""13215230"",""13215230"",""13215230"",""97017120"",""78010363"",""78010363"",""78010363"",""34124316"",""34124316"",""34124316"",""31560081"",""16762927"",""16762927"",""16762927"",""44656491"",""44656491"",""45986603"",""17375316"",""53129443"",""66788016"",""19613556"",""55144522"",""55144522"",""55144522"",""18807108"",""77414722"",""44095762"",""58551308"",""58551308"",""58551308"",""79759861"",""66788016"",""95178994"",""95178994"",""95178994"",""22567609"",""22567609"",""22567609"",""62340868"",""98434877""]","[""9053187"",""9053187"",""71594310"",""71594310"",""84013237"",""84013237"",""56840427"",""56840427"",""21521304"",""67598234"",""67598234"",""2857636"",""2857636"",""97204936"",""97204936""]","[""99597615"",""23401839"",""23401839"",""23401839"",""57617178"",""57617178"",""57617178"",""64631466"",""41426869"",""91782219"",""91782219"",""76806714"",""76806714"",""72053645"",""72053645""]",1647023905,1 year ago,,,0,Ruler Prog,Ruler Prog
230158,fishborg-recursion-deck-3-0-hope-this-is-the-last-one-230158,Fishborg Recursion Deck 3.0 (hope this is the last one),10560119,94358,Non-Meta Decks,"[""10560119"",""10560119"",""10560119"",""62023839"",""62023839"",""62023839"",""51282878"",""51282878"",""51282878"",""66853752"",""66853752"",""66853752"",""91133740"",""91133740"",""91133740"",""52571838"",""52571838"",""52571838"",""10963799"",""10963799"",""27655513"",""27655513"",""27655513"",""21507589"",""21507589"",""21507589"",""22123627"",""22123627"",""96947648"",""96947648"",""96947648"",""63509474"",""63509474"",""63509474"",""53129443"",""53129443"",""85742772"",""39765115"",""39765115"",""12580477""]","[""65170459"",""82184400"",""82184400"",""50321796"",""70583986"",""65749035"",""78229193"",""52639377"",""45815891"",""69610924"",""5014629"",""95992081"",""48739166"",""21044178"",""16195942"",""16195943""]","[""99597615"",""23401839"",""23401839"",""23401839"",""57617178"",""57617178"",""57617178"",""64631466"",""41426869"",""91782219"",""91782219"",""76806714"",""76806714"",""72053645"",""72053645""]",1647023905,1 year ago,,,2,TLDR; I need to sleep.,"This should be a crime at this point.  I made a fishborg deck revamp literally the day this is posted. Consider all of these deck profiles ""variants"", if you will.  Standard stuff, just a different mix with some other synchro monsters (that you can actually summon reliably) along with some xyz. Oh, and doom manta is here too.  Don't be surprised if I find more cards that would ""totally work in the deck and I need to make a new version right now!!1!!!1!"".  Cya, dudes."
