deck_num,pretty_url,deck_name,cover_card,userid,format,main_deck,extra_deck,side_deck,ts_submit_date,submit_date,ts_edit_date,edit_date,comments,deck_excerpt,deck_description
181470,otk-blue-eyes-deck-2021-by-destined-rivals-181470,OTK Blue-Eyes Deck 2021 by Destined Rivals,55410871,48164,Fun/Casual Decks,"[""89631139"",""89631139"",""89631139"",""88264978"",""38517737"",""38517737"",""55878039"",""55878039"",""64202399"",""45467446"",""73642296"",""73642296"",""73642296"",""71039903"",""71039903"",""71039903"",""79814787"",""79814787"",""79814787"",""8240199"",""8240199"",""8240199"",""55410871"",""39701395"",""39701395"",""41620959"",""6853254"",""6853254"",""6853254"",""48800175"",""48800175"",""48800175"",""38120068"",""38120068"",""38120068"",""24224830"",""21082832"",""40605147"",""40605147"",""40605147""]","[""2129638"",""40908371"",""59822133"",""2978414"",""28400508"",""88177324"",""63767246"",""57314798"",""74997493"",""50588353"",""36768783"",""86148577"",""13143275"",""41999284"",""24361622""]","[""34267821"",""34267821"",""27204311"",""27204311"",""27204311"",""15693423"",""15693423"",""15693423"",""94145021"",""94145021"",""48130397"",""48130397"",""48130397"",""41209827"",""73642296""]",1647023905,1 year ago,,,0,Really fun and powerful Blue-Eyes deck profile featuring the Blue-Eyes Abyss Dragon and Blue-Eyes Chaos MAX ritual engine without making it an entirel,"Deck Profile, Strategy and Combos  <a>https://www.youtube.com/watch?v=Ukh05aFB9mM</a>  Strategy should focus entirely on XYZ summoning for Draglubion, Number 100, and Harbinger to gain control of the board. Use Solemn Strike and Called by the Grave to ensure your plays go through, and once your board is setup enough with Blue-Eyes on field or in the GY bring out Blue-Eyes Abyss Dragon from the deck to get access to your ritual engine (Chaos MAX and Chaos Form) in one turn.  Win conditions are either Blue-Eyes Chaos MAX, Number 100, or any combination thereof.  Good luck Duelist!"
181477,elemenal-hero-deck-181477,elemenal hero deck,14124483,63699,Non-Meta Decks,"[""14124483"",""50720316"",""50720316"",""9411399"",""9411399"",""18094166"",""18094166"",""18094166"",""59392529"",""40044918"",""40044918"",""40044918"",""45195443"",""27780618"",""27780618"",""22865492"",""22865492"",""63362460"",""13650422"",""14558127"",""14558127"",""14558127"",""8949584"",""213326"",""213326"",""213326"",""32807846"",""52947044"",""52947044"",""52947044"",""21143940"",""21143940"",""21143940"",""45906428"",""12071500"",""24094653"",""18144507"",""24299458"",""24299458"",""24299458""]","[""58004362"",""63813056"",""19324993"",""1948619"",""1948619"",""59642500"",""29095552"",""40854197"",""22908820"",""46759931"",""3642509"",""86165817""]","[""34267821"",""34267821"",""27204311"",""27204311"",""27204311"",""15693423"",""15693423"",""15693423"",""94145021"",""94145021"",""48130397"",""48130397"",""48130397"",""41209827"",""73642296""]",1647023905,1 year ago,,,0,ok,Write your deck strategy here...ok
181483,cyberse-dragon-link-181483,CYBERSE DRAGON LINK,27548199,23221,Meta Decks,"[""36996508"",""74677424"",""11012154"",""88264978"",""55878038"",""67748760"",""70333910"",""15381421"",""15381421"",""15381421"",""99234526"",""68464358"",""68464358"",""645087"",""645087"",""645087"",""5969957"",""5969957"",""98371278"",""14558127"",""14558127"",""14558127"",""73642296"",""73642296"",""76218313"",""8972398"",""48355999"",""6172122"",""41620959"",""41620959"",""41620959"",""57160136"",""57160136"",""57160136"",""99266988"",""99266988"",""99266988"",""31443476"",""31443476"",""31443476"",""87571563"",""87571563"",""36668118"",""62265044""]","[""37818794"",""27548199"",""79606837"",""81846453"",""4280258"",""50588353"",""11969228"",""70369116"",""47158777"",""24361622"",""13143275"",""73539069"",""86148577"",""32995276"",""48068378""]","[""34267821"",""34267821"",""27204311"",""27204311"",""27204311"",""15693423"",""15693423"",""15693423"",""94145021"",""94145021"",""48130397"",""48130397"",""48130397"",""41209827"",""73642296""]",1647023905,1 year ago,,,0,https://youtu.be/YaWh-hJE2ME,https://youtu.be/YaWh-hJE2ME  Hi Duelists  For today's video I want to share with you guys this pretty cool cyberse dragon link combos to summon multiple negates including buster lock or herald of arc light which is also a macrocosmos monster XD.  Hope you like this video!! I would appreciate your support a lot :3 Take care
181487,the-pharaoh-181487,The Pharaoh,10000022,35341,Fun/Casual Decks,"[""10000020"",""10000020"",""46986414"",""46986414"",""46986414"",""71703785"",""30603688"",""30603688"",""30603688"",""38033121"",""42006475"",""7084129"",""7084129"",""7084129"",""97631303"",""97631303"",""97631303"",""47222536"",""47222536"",""47222536"",""23020408"",""23020408"",""23020408"",""59514116"",""59514116"",""1784686"",""1784686"",""39913299"",""39913299"",""39913299"",""5253985"",""5253985"",""5253985"",""70368879"",""81439173"",""48680970"",""48680970"",""48680970"",""7922915"",""22634473""]","[""37818794"",""50237654"",""50237654"",""41721210"",""75380687"",""98502113"",""73452089"",""43892408"",""13735899"",""96471335"",""14152862"",""49202162"",""47158777"",""71384012"",""41999284""]","[""34267821"",""34267821"",""27204311"",""27204311"",""27204311"",""15693423"",""15693423"",""15693423"",""94145021"",""94145021"",""48130397"",""48130397"",""48130397"",""41209827"",""73642296""]",1647023905,1 year ago,,,0,Slifer the Sky Dragon and Dark Magician working together in harmony.,"This is a character deck that lets you work with a Dark Magician deck with a Slifer the Sky Dragon Engine. I realized this could work due to how many draws Soul Servant can give you, how many cards can stack the deck for The True Name to activate, and how good Soul Crossing is.  Magicians' Souls has to be at 3 for this concept to work, sadly. It lets you clean up your hand and send the Palladium Oracles to the grave before they become dead draws. You can run less Secrets of Dark Magic, but it does let you use dead monsters (like Dark Magician Girl, extra Rods, and the Palladium Oracles) as fusion material.  It's expensive and won't beat meta, but it's cool how consistent a deck with a god card and Dark Magician can be."
181491,cyber-dragon-2021-181491,Cyber Dragon 2021,70095154,65251,Non-Meta Decks,"[""70095154"",""70095154"",""70095154"",""23893227"",""23893227"",""23893227"",""56364287"",""56364287"",""56364287"",""1142880"",""1142880"",""63941210"",""63941210"",""46659709"",""46659709"",""82385847"",""73642296"",""73642296"",""14558127"",""14558127"",""60600126"",""60600126"",""60600126"",""14532163"",""14532163"",""14532163"",""25311006"",""25311006"",""54693926"",""54693926"",""63995093"",""63995093"",""63995093"",""3659803"",""3659803"",""86686671"",""81439173"",""37630732"",""83764719"",""82428674"",""23002292"",""24224830"",""8267140"",""1845204"",""2295440""]","[""10443957"",""10443957"",""58069384"",""58069384"",""70369116"",""94259633"",""73964868"",""87116928"",""79229522"",""87116928"",""84058253"",""84058253"",""64599569"",""60303245"",""72959823""]","[""34267821"",""34267821"",""27204311"",""27204311"",""27204311"",""15693423"",""15693423"",""15693423"",""94145021"",""94145021"",""48130397"",""48130397"",""48130397"",""41209827"",""73642296""]",1647023905,1 year ago,,,0,Can you support me with recommendations?,Can you support me with recommendations?
181497,cyberse-mekk-knight-181497,Cyberse Mekk-Knight,21887175,65401,Fun/Casual Decks,"[""71278040"",""71278040"",""50426119"",""56161953"",""67218327"",""16188701"",""16188701"",""16188701"",""8567955"",""8567955"",""75130221"",""80794697"",""80794697"",""30114823"",""30114823"",""63528891"",""53309998"",""14505685"",""9097866"",""65100616"",""2347477"",""2347477"",""2347477"",""18789533"",""2295440"",""57160136"",""57160136"",""57160136"",""75500286"",""34010534"",""34010534"",""60018643"",""60018643"",""60018643"",""5650082"",""5650082"",""5650082"",""7403341"",""7403341"",""7403341""]","[""21887175"",""5043010"",""86066372"",""86066372"",""15844566"",""33897356"",""40669071"",""40669071"",""46947713"",""46947713"",""45462149"",""53413628"",""59859086"",""65741786"",""24842059""]","[""73652465"",""89040386"",""49003716"",""22628574"",""17994645"",""72278479"",""53519297"",""44028461"",""9925982"",""53860621"",""94681654"",""22835145"",""67779172"",""64952266"",""24299458""]",1647023905,1 year ago,,,1,"I'm a fan of Yugioh vrains' playmaker and I always thought about making the deck practically the same, I updated a few things in it to be able to beat","<span class=""Y2IQFc"" lang=""en"">the strategy of the deck is very simple, cynet codec and the engine of the deck that makes it run, and weak against hand traps, but having plenty of options at hand you can still comb until you reach Mekk-knight Crusadia Avramax special summon with the I:P mask to make life very difficult for the opponent, I hope you enjoyed and if you can I would like help to improve if possible, thank you !!!</span>"
181501,blackwing-deck-pure-crow-hogan-yu-gi-oh-5d-s-wing-requital-181501,"Blackwing deck,pure,Crow Hogan,Yu-Gi-Oh! 5D's,Wing Requital,",23338098,25969,Fun/Casual Decks,"[""75498415"",""58820853"",""14785765"",""85215458"",""81470373"",""81470373"",""81470373"",""49003716"",""49003716"",""17465972"",""17465972"",""2009101"",""2009101"",""2009101"",""73652465"",""89258906"",""77152542"",""81105204"",""81105204"",""81105204"",""91351370"",""91351370"",""91351370"",""18144507"",""5133471"",""83764718"",""72930878"",""72930878"",""59839761"",""59839761"",""80254726"",""24299458"",""24299458"",""67169062"",""1475311"",""1475311"",""1475311"",""8843569"",""8843569"",""8843569""]","[""60025883"",""16051717"",""9012916"",""54082269"",""54082269"",""80773359"",""81983656"",""69031175"",""23338098"",""76913983"",""95040215"",""33236860"",""17377751"",""53389254"",""53389254""]","[""73652465"",""89040386"",""49003716"",""22628574"",""17994645"",""72278479"",""53519297"",""44028461"",""9925982"",""53860621"",""94681654"",""22835145"",""67779172"",""64952266"",""24299458""]",1647023905,1 year ago,,,0,https://youtu.be/n_kk_YnW84U,https://youtu.be/n_kk_YnW84U
181505,flunder-monarchs-2021-181505,Flunder Monarchs 2021,23064604,17333,Non-Meta Decks,"[""23064604"",""23064604"",""23064604"",""96570609"",""96570609"",""96570609"",""47084486"",""47084486"",""47084486"",""33746252"",""57666212"",""59463312"",""59463312"",""95457011"",""95457011"",""22404675"",""52296675"",""52296675"",""55521751"",""55521751"",""22842126"",""22842126"",""22842126"",""33609262"",""33609262"",""33609262"",""79844764"",""79844764"",""79844764"",""84171830"",""84171830"",""84171830"",""61466310"",""61466310"",""19870120"",""81439173"",""2295440"",""70368879"",""18235309"",""54241725""]","[""22638495"",""18239909"",""10443957"",""12744567"",""58069384"",""440556"",""440556"",""48739166"",""25853045"",""59479050"",""90809975"",""26973555"",""65305468"",""37972500"",""22423493""]","[""69230391"",""29303524"",""59975920"",""35595518"",""52296675"",""85847157"",""22404675"",""35726888"",""101106059"",""48716527"",""54241725"",""41420027"",""101106075""]",1647023905,1 year ago,,,1,Flunder Monarchs 2021,Flunder Monarchs 2021
181511,dinomist-2021-181511,Dinomist 2021,63251695,46423,Non-Meta Decks,"[""5067884"",""5067884"",""63251695"",""63251695"",""63251695"",""26420373"",""26420373"",""26420373"",""37752990"",""37752990"",""37752990"",""368382"",""368382"",""368382"",""92746535"",""92746535"",""92746535"",""64973287"",""64973287"",""64973287"",""38988538"",""38988538"",""38988538"",""32134638"",""77116346"",""77116346"",""77116346"",""37469904"",""37469904"",""37469904"",""26237713"",""26237713"",""26237713"",""57734012"",""70368879"",""76751255"",""60675348"",""60675348"",""60675348"",""41554273""]","[""22638495"",""18239909"",""10443957"",""12744567"",""58069384"",""440556"",""440556"",""48739166"",""25853045"",""59479050"",""90809975"",""26973555"",""65305468"",""37972500"",""22423493""]","[""82385847"",""91800273"",""91800273"",""91800273"",""34267821"",""34267821"",""34267821"",""14532163"",""18144507"",""15693423"",""15693423"",""15693423"",""41420027"",""41420027"",""41420027""]",1647023905,1 year ago,,,1,Deck 80 with profile,"<p class=""p1""><span class=""s1"">Hey there people! I’m back again with a new profile this time around, dinomists!</span></p> <p class=""p1""><span class=""s1"">Now there are people who don’t know this even exists! Don’t worry, you came to the right place. I originally was going to do amorphage for my 80th deck but then I figured that it would be more suited for my 100th deck</span></p> <p class=""p1""><span class=""s1"">Dinomist are water machine pendulum monsters that appear in the dracoslayer lore.</span></p> <p class=""p1""><span class=""s1"">Dinomist are split into a couple categories. They are very similar overall but let’s explain the verity here. There are 2 levels of dinomist, level 4 and level 5, then there is 2 scales, 3 and 6, only fitting their respective levels when pendulum summoning. </span></p> <p class=""p1""><span class=""s1"">Every dinomist share something in common no matter what category it is in. They can substitute themselves if a dinomist card is in danger, they bail your dinomists out of card effects (some negates a card targeting a dinomist card) and battle (some just prevents destruction in general). This helps you pull your plays through and is really helpful in the grind game as well.</span></p> <p class=""p1""><span class=""s1"">I used the standard dinomist ratios with a couple of my own twists. Here’s the list:</span></p> <p class=""p1""><span class=""s1"">2 spinos, spinos is a way to push for game, its also able to wipe 5000 for the price of two tributes which is really powerful.</span></p> <p class=""p1""><span class=""s1"">3 rex, Rex is the boss of the deck, this thing twin attacks with piercing damage but what’s scarier is it’s second effect, you can shuffle a card from your opponents hand or field back into the deck, this doesn’t target and doesn’t destroy so you can even just out dragoon with this. It’s removal and hand rip made it a 3 of alone.</span></p> <p class=""p1""><span class=""s1"">3 speedroid passenglider, two things, one it’s a level 5 machine self summon, two it’s a scale if necessary</span></p> <p class=""p1""><span class=""s1"">3 ceratops, purely for its self summon as a machine</span></p> <p class=""p1""><span class=""s1"">3 brachion, same as ceratops, self summon machine</span></p> <p class=""p1""><span class=""s1"">3 dracoslayer, as generic pendulum support this card helps grinding and consistency of the deck as well as granting access to new bosses</span></p> <p class=""p1""><span class=""s1"">3 petran, a built in search effect that this deck can use actually! Plesois stacks pretty quickly and it lets petran search stuff</span></p> <p class=""p1""><span class=""s1"">3 plesois, a weakener, normally this effect is bad but it stacks like crazy and helps a lot in securing your position</span></p> <p class=""p1""><span class=""s1"">1 ankylos, this bad boy banishes monsters destroyed by dinomists! It’s also there to provide another level 4 in case it’s needed</span></p> <p class=""p1""><span class=""s1"">3 charge, a search on activation with a built in recycle is really helpful in this deck and makes it worth playing at 3</span></p> <p class=""p1""><span class=""s1"">3 allience, searcher for your dracoslayer and treasure, so why not play it?</span></p> <p class=""p1""><span class=""s1"">3 treasure, a pendulum pitch that’s absolutely worth playing at 3, no less.</span></p> <p class=""p1""><span class=""s1"">1 the seventh one, it’s for a custom combo that I’ll explain later.</span></p> <p class=""p1""><span class=""s1"">1 upstart goblin, draw one because I had the space, so why not?</span></p> <p class=""p1""><span class=""s1"">1 reload, igknight reload helps a lot in unclogging your hand, just be hopeful that they don’t ash it!</span></p> <p class=""p1""><span class=""s1"">3 dinomist roar, this is the best dinomist card in the game without question, it gives you removal, and your both of your scales set</span></p> <p class=""p1""><span class=""s1"">1 dinomist charge, it’s to set up a dinomist into your extra, you can also keep the summoned dinomist with a scale sacrifice</span></p> <p class=""p1""><span class=""s1"">1 fusion dracoslayer, the dinomist dracoslayer, it’s summoned by contact fusion and provides a bulky beater</span></p> <p class=""p1""><span class=""s1"">1 synchro dracoslayer, as an extender and removal I felt like it would be best if I had it.</span></p> <p class=""p1""><span class=""s1"">1 infinity, free negates and remover off of nova</span></p> <p class=""p1""><span class=""s1"">1 silent honor dark, the seventh one summon</span></p> <p class=""p1""><span class=""s1"">1 nova, just to get out infinity</span></p> <p class=""p1""><span class=""s1"">2 bahumat shark, one for toadally and another for f0</span></p> <p class=""p1""><span class=""s1"">1 silent honor ark, seventh one target</span></p> <p class=""p1""><span class=""s1"">1 full armored black ray lancer, combo enabler</span></p> <p class=""p1""><span class=""s1"">1 number 71, place the seventh one on top of your deck with this.</span></p> <p class=""p1""><span class=""s1"">1 toadally awesome, bahamut summon</span></p> <p class=""p1""><span class=""s1"">1 future dragon, free cheese if you summon bahamut shark</span></p> <p class=""p1""><span class=""s1"">1 utopic future, to summon dragon</span></p> <p class=""p1""><span class=""s1"">1 musicia, remember when I said dinomists come in scales of 3 and 6? Odd and even? Here’s a card to abuse that (rip eletrumite though)</span></p> <p class=""p1""><span class=""s1"">1 qliphort genius, the card that searches for you.</span></p> <p class=""p1""><span class=""s1"">So I mentioned repeatedly that you can cheese out utopic future dragon and the seventh one, here’s how</span></p> <p class=""p1""><span class=""s1"">Summon bahamut shark by any means</span></p> <p class=""p1""><span class=""s1"">Bahamut shark summons number 71</span></p> <p class=""p1""><span class=""s1"">Overlay 71 for full armored black ray lancer</span></p> <p class=""p1""><span class=""s1"">Overlay both lancer and bahamut shark for utopic future, the Matthew had are detached</span></p> <p class=""p1""><span class=""s1"">Number 71’s effect stacks the seventh one</span></p> <p class=""p1""><span class=""s1"">Overlay utopic future for utopic future dragon.</span></p> <p class=""p1""><span class=""s1"">And that’s how you set up a negate, other than that the combos in this deck aren’t linear but after it reaches a certain points the deck is really good with resources.</span></p>"
181515,deck-starry-knight-post-liov-x1f31f-181515,Deck Starry Knight Post LIOV &#x1f31f;,90835938,46524,Non-Meta Decks,"[""49036338"",""90835938"",""90835938"",""90835938"",""53318263"",""20292186"",""23220533"",""23220533"",""23220533"",""86613346"",""59228631"",""59228631"",""59228631"",""68258355"",""68258355"",""68258355"",""44656450"",""44656450"",""38814750"",""38814750"",""38814750"",""1845204"",""22007085"",""22007085"",""22007085"",""58577036"",""84211599"",""84211599"",""84211599"",""24224830"",""24299458"",""24299458"",""24299458"",""85590798"",""85590798"",""58406094"",""58374502"",""58374502"",""21985407"",""21985407""]","[""54757758"",""41578483"",""3040496"",""90448279"",""39317553"",""6983839"",""90590304"",""46772449"",""21044178"",""86066372"",""38342335"",""9839945"",""8802510"",""7480763"",""7480763""]","[""82385847"",""91800273"",""91800273"",""91800273"",""34267821"",""34267821"",""34267821"",""14532163"",""18144507"",""15693423"",""15693423"",""15693423"",""41420027"",""41420027"",""41420027""]",1647023905,1 year ago,,,0,Check out this awesome deck in action here: https://youtu.be/qKfI6q-LYtM  Fill free to subscribe and like the video if you’d enjoy’d it   Any doub,Check out this awesome deck in action here: https://youtu.be/qKfI6q-LYtM  Fill free to subscribe and like the video if you’d enjoy’d it  Any doubts or questions let me know
181524,lkjlkjds-181524,lkjlkjds,44874522,29809,Non-Meta Decks,"[""44874522"",""44874522"",""44874522"",""83104731"",""83104731"",""83104731"",""95735217"",""70095154"",""70095154"",""17663375"",""17663375"",""17663375"",""1278431"",""1278431"",""1278431"",""42878636"",""42878636"",""42878636"",""14558127"",""14558127"",""14558127"",""3659803"",""24094653"",""37630732"",""37630732"",""44052074"",""44052074"",""64061284"",""64061284"",""73628505"",""43898403"",""43898403"",""70147689"",""70147689"",""70147689"",""37694547"",""37694547"",""37694547"",""76375976"",""89208725""]","[""51788412"",""51788412"",""12652643"",""12652643"",""87116928"",""37663536"",""37663536"",""64599569"",""87182127"",""87182127"",""10547580"",""10547580"",""3987233"",""70369116"",""70369116""]",,1647023905,1 year ago,,,0,asfasfsafasfasf,afasfasfasfasfsafasfasfasfasfasfasfasfasf
181528,lkjlkjds-181528,lkjlkjds,65741787,29809,Non-Meta Decks,"[""44874522"",""44874522"",""44874522"",""83104731"",""83104731"",""83104731"",""95735217"",""70095154"",""70095154"",""17663375"",""17663375"",""17663375"",""1278431"",""1278431"",""1278431"",""42878636"",""42878636"",""42878636"",""14558127"",""14558127"",""14558127"",""3659803"",""24094653"",""37630732"",""37630732"",""44052074"",""44052074"",""64061284"",""64061284"",""73628505"",""43898403"",""43898403"",""70147689"",""70147689"",""70147689"",""37694547"",""37694547"",""37694547"",""76375976"",""89208725""]","[""51788412"",""51788412"",""12652643"",""12652643"",""87116928"",""37663536"",""37663536"",""64599569"",""87182127"",""87182127"",""10547580"",""10547580"",""3987233"",""70369116"",""70369116""]",,1647023905,1 year ago,,,0,asfasfsafasfasf,afasfasfasfasfsafasfasfasfasfasfasfasfasf
181533,eternal-destruction-181533,Eternal Destruction,61441708,65414,Fun/Casual Decks,"[""24175232"",""24175232"",""24175232"",""23015896"",""23015896"",""23015896"",""61441708"",""61441708"",""61441708"",""96746083"",""94160895"",""8454126"",""8454126"",""8454126"",""88176533"",""88176533"",""88176533"",""98999181"",""98999181"",""98999181"",""51782995"",""51782995"",""51782995"",""98446407"",""52904476"",""25397880"",""18621798"",""18621798"",""18621798"",""33245030"",""33245030"",""33245030"",""50847759"",""50847759"",""50847759"",""23459650"",""23459650"",""23459650"",""59388357"",""59388357"",""59388357"",""94145683"",""22993208"",""22993208"",""19230408"",""53129443"",""53582587"",""63356631"",""82832464"",""82832464"",""82832464""]","[""87054946"",""87054946"",""87054946"",""50669347"",""50669347"",""50669347"",""31801517"",""64332231"",""23085002"",""55727845"",""61307542"",""29208536"",""36776089""]",,1647023905,1 year ago,,,0,Test,Test
181541,noob-deck-181541,noob deck,2863439,65429,Non-Meta Decks,"[""2863439"",""6368038"",""9159938"",""12580477"",""15052462"",""15052462"",""15401633"",""18710707"",""23424603"",""34460851"",""34460851"",""36121917"",""36121917"",""38142739"",""38142739"",""38199696"",""40826495"",""44287299"",""46009906"",""46130346"",""46130346"",""46130346"",""50045299"",""50045299"",""53129443"",""53293545"",""53293545"",""57305373"",""66788016"",""75356564"",""75356564"",""76103675"",""76103675"",""76103675"",""83464209"",""83887306"",""85309439"",""85309439"",""85309439"",""85705804"",""87430998"",""90963488"",""90963488"",""91152256"",""91595718"",""91595718"",""96851799"",""96851799"",""96851799""]","[""1641882""]",,1647023905,1 year ago,,,0,stop reading thisbruh,Write your deck strategy here...bruh nrud
181545,big-pp-181545,Big PP,32864,65425,Non-Meta Decks,"[""32864"",""2863439"",""4206964"",""6368038"",""9159938"",""9159938"",""15401633"",""15401633"",""18710707"",""18710707"",""22910685"",""24094653"",""24094653"",""32274490"",""32274490"",""34460851"",""36121917"",""38142739"",""38142739"",""38142739"",""38199696"",""39004808"",""39004808"",""40374923"",""40374923"",""40826495"",""44287299"",""46009906"",""50045299"",""53129443"",""61854111"",""66788016"",""76103675"",""76184692"",""77827521"",""83887306"",""85309439"",""85705804"",""85705804"",""90357090"",""90963488"",""90963488"",""91595718""]","[""1641882"",""1641882"",""1641882"",""37421579"",""37421579"",""58528964"",""58528964""]",,1647023905,1 year ago,,,0,stuff,NIGGGER
181549,phantom-181549,Phantom,9076207,65425,Non-Meta Decks,"[""9076207"",""10202894"",""10202894"",""10202894"",""13039848"",""13039848"",""15025844"",""16353197"",""16353197"",""16353197"",""19159413"",""20060230"",""33064647"",""33064647"",""33066139"",""33178416"",""33396948"",""36304921"",""43500484"",""55291359"",""56283725"",""56283725"",""56342351"",""63308047"",""63308047"",""71407486"",""71407486"",""72842870"",""72842870"",""73051941"",""73051941"",""73134082"",""73134082"",""76211194"",""80770678"",""82542267"",""85326399"",""85326399"",""92731455"",""93553943"",""93553943"",""94675535"",""94675535"",""98818516"",""98818516""]","[""54541900"",""54541900"",""66889139"",""95952802"",""95952802""]",,1647023905,1 year ago,,,0,Phantom,Phantom
181553,y-181553,y,1557499,65429,Non-Meta Decks,"[""1557499"",""4614116"",""9076207"",""9076207"",""11868825"",""15025844"",""16353197"",""16353197"",""20060230"",""20060230"",""25769732"",""32452818"",""32452818"",""32452818"",""33066139"",""33178416"",""36304921"",""53153481"",""53153481"",""55144522"",""55144522"",""55291359"",""55291359"",""55291359"",""55444629"",""55444629"",""55444629"",""55444629"",""56283725"",""56283725"",""56342351"",""71407486"",""71407486"",""71407486"",""72842870"",""72842870"",""76211194"",""80770678"",""85326399"",""85326399"",""98252586"",""98252586"",""98818516"",""98818516""]","[""9293977"",""9293977"",""54541900"",""70681994"",""70681994"",""95952802""]",,1647023905,1 year ago,,,0,rwg,Write your deck grrrwrwtrategy here...
