deck_num,pretty_url,deck_name,cover_card,userid,format,main_deck,extra_deck,side_deck,ts_submit_date,submit_date,ts_edit_date,edit_date,comments,deck_excerpt,deck_description
83823,inzektor-shaddoll-83823,INZEKTOR SHADDOLL,68184115,25803,Fun/Casual Decks,"[""71278040"",""71278040"",""71278040"",""94573223"",""3717252"",""52601736"",""97518132"",""21790410"",""21790410"",""21790410"",""68184115"",""68184115"",""68184115"",""69207766"",""69207766"",""69207766"",""24635329"",""37445295"",""37445295"",""37445295"",""14457896"",""2461031"",""2461031"",""2461031"",""1475311"",""1475311"",""1475311"",""44394295"",""44394295"",""44394295"",""83764718"",""96965364"",""96965364"",""96965364"",""48130397"",""48130397"",""48130397"",""77840540"",""77840540"",""77840540""]","[""74822425"",""20366274"",""41209827"",""50907446"",""94977269"",""54757758"",""21044178"",""66011101"",""95992081"",""74997493"",""91140491"",""2857636"",""83152482"",""97273514"",""70369116""]","[""99674361"",""99674361"",""99674361"",""8267140"",""8267140"",""8267140"",""40605147"",""40605147"",""40605147"",""41420027"",""41420027"",""41420027"",""84749824"",""84749824"",""84749824""]",1615487905,2 years ago,,,0,its a deck inzektor shaddoll,deck inzektor shaddoll
83816,50-card-ojam-alphabet-soup-83816,50-Card Ojam-Alphabet Soup,75906310,18627,Fun/Casual Decks,"[""46384672"",""73879377"",""30012506"",""30012506"",""77411244"",""77411244"",""3405259"",""3405259"",""79335209"",""79335209"",""64627453"",""64627453"",""64627453"",""12482652"",""12482652"",""37132349"",""37132349"",""42941100"",""42941100"",""99249638"",""51638941"",""96300057"",""62651957"",""65622692"",""64500000"",""25290459"",""25290459"",""25290459"",""24643836"",""24643836"",""24643836"",""2390019"",""2390019"",""2390019"",""38395123"",""38395123"",""38395123"",""73628505"",""43898403"",""43898403"",""43898403"",""12524259"",""12524259"",""66399653"",""66399653"",""66399653"",""14470845"",""75884822"",""75884822"",""75884822""]","[""1561110"",""58859575"",""91998119"",""65172015"",""84243274"",""75906310"",""39972129"",""75452921"",""2857636"",""38342335"",""74997493"",""74997493"",""74997493"",""83152482"",""83152482""]","[""99674361"",""99674361"",""99674361"",""8267140"",""8267140"",""8267140"",""40605147"",""40605147"",""40605147"",""41420027"",""41420027"",""41420027"",""84749824"",""84749824"",""84749824""]",1615487905,2 years ago,,,0,"ABC-Dragon Buster, VW-Tiger Catapult, XYZ-Dragon Cannon, A-to-Z Dragon Buster Cannon, VWXYZ-Dragon Catapult Cannon, and Armed Dragon Catapult Cannon (",The goal of this deck is to use the powerful synergies between the Ojama archetype and the Armed Dragon and ABC/XYZ archetypes to power out one or more of the deck's powerful boss monsters and beat your opponent into submission.
83811,50-card-ojam-alphabet-soup-83811,50-Card Ojam-Alphabet Soup,75906310,18627,Fun/Casual Decks,"[""46384672"",""73879377"",""30012506"",""30012506"",""77411244"",""77411244"",""3405259"",""3405259"",""79335209"",""79335209"",""64627453"",""64627453"",""64627453"",""12482652"",""12482652"",""37132349"",""37132349"",""42941100"",""42941100"",""99249638"",""51638941"",""96300057"",""62651957"",""65622692"",""64500000"",""25290459"",""25290459"",""25290459"",""24643836"",""24643836"",""24643836"",""2390019"",""2390019"",""2390019"",""38395123"",""38395123"",""38395123"",""73628505"",""43898403"",""43898403"",""43898403"",""12524259"",""12524259"",""66399653"",""66399653"",""66399653"",""14470845"",""75884822"",""75884822"",""75884822""]","[""1561110"",""58859575"",""91998119"",""65172015"",""84243274"",""75906310"",""39972129"",""75452921"",""2857636"",""38342335"",""74997493"",""74997493"",""74997493"",""83152482"",""83152482""]","[""99674361"",""99674361"",""99674361"",""8267140"",""8267140"",""8267140"",""40605147"",""40605147"",""40605147"",""41420027"",""41420027"",""41420027"",""84749824"",""84749824"",""84749824""]",1615487905,2 years ago,,,0,"ABC-Dragon Buster, VW-Tiger Catapult, XYZ-Dragon Cannon, A-to-Z Dragon Buster Cannon, VWXYZ-Dragon Catapult Cannon, and Armed Dragon Catapult Cannon (",The goal of this deck is to use the powerful synergies between the Ojama archetype and the Armed Dragon and ABC/XYZ archetypes to power out one or more of the deck's powerful boss monsters and beat your opponent into submission.
83807,machina-synchro-83807,Machina Synchro,87074380,14869,Non-Meta Decks,"[""87074380"",""87074380"",""87074380"",""50863093"",""50863093"",""50863093"",""23469398"",""23469398"",""23469398"",""5556499"",""5556499"",""5556499"",""42940404"",""42940404"",""42940404"",""4334811"",""4334811"",""4334811"",""82012319"",""83295594"",""9742784"",""14558127"",""14558127"",""14558127"",""76218313"",""23171610"",""23171610"",""23171610"",""86852702"",""86852702"",""86852702"",""24224830"",""24224830"",""24224830"",""59741415"",""59741415"",""59741415"",""40605147"",""40605147"",""40605147""]","[""13455674"",""27548199"",""50321796"",""90953320"",""37675907"",""39964797"",""81846453"",""50091196"",""68396121"",""88177324"",""63767246"",""28400508"",""47363932"",""50588353"",""83152482""]","[""63941210"",""63941210"",""63941210"",""35261759"",""35261759"",""35261759"",""24508238"",""24508238"",""24508238"",""15693423"",""15693423"",""15693423"",""8267140"",""8267140"",""8267140""]",1615487905,2 years ago,,,0,see above,...
83804,invoked-mekk-83804,Invoked Mekk,88581108,25800,Meta Decks,"[""84754430"",""84754430"",""35183584"",""49275969"",""28692962"",""28692962"",""28692962"",""92204263"",""92204263"",""56809158"",""56809158"",""29415459"",""29415459"",""20537097"",""20537097"",""20537097"",""86120751"",""86120751"",""86120751"",""14558127"",""14558127"",""14558127"",""24508238"",""24508238"",""24508238"",""2930675"",""47679935"",""47679935"",""47679935"",""74063034"",""74063034"",""39238953"",""39238953"",""39238953"",""83764719"",""73628505"",""911883"",""911883"",""458748"",""14604710"",""98935722"",""10045474"",""10045474"",""10045474""]","[""11270236"",""75286621"",""75286621"",""48791583"",""12307878"",""88581108"",""85289965"",""21887175"",""38502358"",""38342335"",""72006609"",""2857636"",""97973962"",""65741786"",""60303245""]","[""15397015"",""15397015"",""15397015"",""37520316"",""24224830"",""24224830"",""24224830"",""8267140"",""8267140"",""8267140"",""24207889"",""24207889"",""24207889"",""15693423"",""15693423""]",1615487905,2 years ago,,,0,"Mekk-Knights, Invoked, Calamities","Turbo out Calamities first turn, or out resource your opponent with Mekk-Knights"
83801,metalfoes-83801,Metalfoes,77693536,12343,Non-Meta Decks,"[""36996508"",""69351984"",""69351984"",""69351984"",""74677422"",""33256280"",""33256280"",""33256280"",""7868571"",""7868571"",""7868571"",""60473572"",""60473572"",""60473572"",""85138716"",""85138716"",""85138716"",""14558128"",""14558128"",""14558128"",""18716735"",""18716735"",""18716735"",""911883"",""911883"",""911883"",""1033312"",""1033312"",""1033312"",""1845204"",""6172122"",""35726888"",""35726888"",""70368879"",""73594093"",""79816536"",""79816536"",""79816536"",""67723438"",""33327029""]","[""37818794"",""28016193"",""4688231"",""41578483"",""77693536"",""46772449"",""85289965"",""4280258"",""49202162"",""38342335"",""2857636"",""65741786"",""70369116"",""98978921"",""31226177""]","[""94689206"",""94693857"",""10817524"",""21044178"",""44097050"",""50588353"",""83152482"",""24224830"",""39564736"",""48130397"",""52340444"",""17626381"",""10045474"",""69711728""]",1615487905,2 years ago,,,0,Feel free to support the youtube channel with a sub.,https://www.youtube.com/watch?v=O3RjwN5IMjY The video version
83798,corrupted-saviors-83798,Corrupted Saviors,83965311,25800,Meta Decks,"[""27204311"",""27204311"",""27204311"",""83965310"",""14124483"",""9411399"",""9411399"",""18094166"",""18094166"",""18094166"",""37780349"",""13650422"",""40044918"",""40044918"",""40044918"",""63362460"",""59392529"",""45195443"",""50720316"",""50720316"",""27780618"",""27780618"",""22865492"",""22865492"",""8949584"",""94820406"",""54693926"",""54693926"",""54693926"",""213326"",""213326"",""213326"",""52947044"",""52947044"",""52947044"",""45906428"",""83764719"",""24094653"",""32807846"",""21143940"",""21143940"",""21143940""]","[""86165817"",""90579153"",""59642500"",""22061412"",""29095552"",""40854197"",""46759931"",""22908820"",""58481572"",""58481572"",""89870349"",""63813056"",""1948619"",""58004362"",""58004362""]","[""34267821"",""34267821"",""34267821"",""14558127"",""14558127"",""14558127"",""59438930"",""59438930"",""59438930"",""14532163"",""14532163"",""14532163"",""10045474"",""10045474"",""10045474""]",1615487905,2 years ago,,,0,Heroes,Absorb Nibiru token with Plasma then win
83795,machina-raigeki-storm-83795,Machina Raigeki Storm,87074380,25800,Meta Decks,"[""87074380"",""87074380"",""87074380"",""69838761"",""69838761"",""69838761"",""51617185"",""51617185"",""71197066"",""50863093"",""50863093"",""50863093"",""23469398"",""23469398"",""39284521"",""82012319"",""42940404"",""42940404"",""42940404"",""85136114"",""85136114"",""4334811"",""4334811"",""4334811"",""24508238"",""24508238"",""24508238"",""86852702"",""86852702"",""86852702"",""83764719"",""35261759"",""35261759"",""24224830"",""24224830"",""24224830"",""23002292"",""10045474"",""10045474"",""10045474""]","[""26096328"",""56910167"",""97403510"",""28400508"",""88177324"",""63767246"",""6983839"",""57314798"",""85289965"",""38342335"",""2857636"",""47363932"",""75452921"",""65741786"",""4280258""]","[""34267821"",""34267821"",""34267821"",""14558127"",""14558127"",""14558127"",""59438930"",""59438930"",""59438930"",""54693926"",""54693926"",""54693926"",""14532163"",""14532163"",""14532163""]",1615487905,2 years ago,,,0,Machina,Overwhelm your opponents with giant machines. At the critical moment Raigeki their field with Citadel
83792,my-zombie-world-83792,MY ZOMBIE WORLD,39185163,25798,Fun/Casual Decks,"[""6039967"",""52512994"",""39185163"",""39185163"",""39185163"",""36016907"",""36016907"",""36016907"",""66570171"",""66570171"",""66570171"",""92964816"",""92964816"",""92964816"",""49959355"",""49959355"",""49959355"",""92826944"",""92826944"",""92826944"",""94801854"",""94801854"",""52467217"",""52467217"",""14558127"",""14558127"",""4064256"",""4064256"",""4064256"",""24224830"",""24224830"",""24224830"",""83764719"",""81439174"",""73628505"",""43898403"",""74003290"",""74003290"",""74003290"",""89208725""]","[""39475024"",""3486020"",""4103668"",""77092311"",""30607616"",""28240337"",""28240337"",""28240337"",""5821478"",""2645637"",""2645637"",""86926989"",""37129797"",""37129797"",""91420202""]","[""34267821"",""34267821"",""34267821"",""14558127"",""14558127"",""14558127"",""59438930"",""59438930"",""59438930"",""54693926"",""54693926"",""54693926"",""14532163"",""14532163"",""14532163""]",1615487905,2 years ago,,,0,Deck de controle e banimento.,"A principal estratégia do deck é colocar o Balerdorch e a Yuki-onna em campo, tendo-os em campo a idéia é iniciar uma corrente para tanto banir cartas quanto zerar seus ataques e negar seus efeitos."
83789,blackwing-apex-infinity-2020-post-april-banned-list-83789,BLACKWING APEX INFINITY 2020 (POST APRIL BANNED LIST),29587993,25692,Meta Decks,"[""29587993"",""81105204"",""81105204"",""81105204"",""49003716"",""49003716"",""49003716"",""14785765"",""17465972"",""17465972"",""17465972"",""31314549"",""2009101"",""2009101"",""2009101"",""69448290"",""28190303"",""52869807"",""52869807"",""52869807"",""77152542"",""77152542"",""73652465"",""76218313"",""91351370"",""91351370"",""91351370"",""17322533"",""17322533"",""1475311"",""1475311"",""1475311"",""14532163"",""14532163"",""14532163"",""83764719"",""23581825"",""24224830"",""24224830"",""24224830""]","[""54082269"",""27548199"",""16051717"",""81983656"",""95040215"",""10443957"",""81927732"",""55285840"",""86848580"",""46772449"",""73347079"",""72330894"",""36429703"",""83152482"",""83152482""]","[""27204311"",""27204311"",""14558127"",""14558127"",""41209827"",""70369116"",""54693926"",""54693926"",""54693926"",""65681983"",""65681983"",""48130397"",""48130397"",""10045474"",""10045474""]",1615487905,2 years ago,,,0,Infinite negation Blackwing based deck.,"The main strategy is very simple: you swarm the field with dark winged beast monsters in order to being able to summon:  Step 1: Wise strix and the you special summon (usually Zephyros the elite) from you deck  Step 2: then you special summon Raidraptor Force strix using Zephyros the elite, then detach Zephyros to use the effect of Force strix which makes you add to your hand from you deck a level 4 Dark Winged Beast monster (usually Bora the spear). At this point you triggered  the second effect of Wise strix that makes you set a Rank up magic spell from your deck, so you set Rank up magic soul shave force.  Step 3: Now you use the effect of Zephyros from you GY by returning one card on your field to your hand (usually Black whirlwind, Pinpoint landing or Bora the spear) and special summon Union carrier  Step 4: Special summon Simorgh, bird of sovreign using Wise strix and Force strix as materials.  Step 5: Use the effect of union carrier to equip the Simorgh with myst valley Thunderbird from your deck and then use the set Rank up magic soul shave force to summon Cyber Dragon Infinity. Attivate its effect and absorb union carrier.  Step 6: In the end phase use the effect of Simorgh to special summon Myst Valley Apex Avian from you deck in a zone Simorgh points to and entry your opponent becomes Angry while you negate everything he does!  This was the basic guaranteed combo, but you can also end your turn with mother addizionale monsters like Borreload Savage Dragon and Time thief redoer to improve your negation power. I've also put 3x of Lightning storm to prevent disadvantage by starting second and to put out your opponent' spell/traps cards in order to have the conditions to use Simorgh's effect in the End Phase. Obviously, you can substitute it with other cards from you side deck like Crossout designator, ash blossom and/or Nibiru As Wells. The motivativation because I pur 2x of Pinpoint landing is quite simple: draw power on your turn and the opponent's turn when you attivate the effect of Myst Valley Thunderbird and because it's a continuos spell that you can make go black to your hand by the effect of Zephyros."
83761,franksayngo-s-pet-rocks-adamancipator-may-mr5-updated-83761,franksayngo's Pet Rocks|Adamancipator May MR5 UPDATED,9464441,25740,Meta Decks,"[""94689206"",""11302671"",""11302671"",""11302671"",""85914562"",""85914562"",""85914562"",""48519867"",""48519867"",""48519867"",""10286023"",""42143067"",""42143067"",""42143067"",""19667590"",""19667590"",""59724555"",""59724555"",""8512558"",""39695323"",""47606319"",""45041488"",""45041488"",""7409792"",""7409792"",""77848740"",""77848740"",""40975574"",""72291078"",""76218313"",""6595475"",""6595475"",""70368879"",""72957245"",""72957245"",""72957245"",""85119159"",""10045474"",""10045474"",""10045474""]","[""9464441"",""73079836"",""62242678"",""74586817"",""27548199"",""79606837"",""50091196"",""32530043"",""21044178"",""21887175"",""4280258"",""50588353"",""83152482"",""65741786"",""98978921""]","[""27204311"",""27204311"",""14532163"",""14532163"",""54693926"",""54693926"",""43898403"",""43898403"",""43898403"",""58921041"",""58921041"",""43262273"",""43262273"",""23002292"",""15693423""]",1615487905,2 years ago,,,0,"This deck is extremely consistent, can survive multiple disruptions, and can summon 4-5 Negates/Disruptions in 1 turn. Have fun!","I have 2 main boards -  Goal 1: <ol>  	<li>End Turn 1 on Crystron Needlefiber/Halquifibrax, Borreload Savage Dragon, One LV2 Tuner monster, and either Block Dragon or Apoullousa</li>  	<li>During my opponent's main phase, I chain Needlefiber to synchro summon Formula Synchron.</li>  	<li>Wait for opponent to resolve an effect I can chain off of then activate Formula Synchron to synchro summon Red Hot Dragon Archfiend King Calamity.Activate Red Hot Dragon Archfiend King Calamity's effect off the synchro summon to lock them out of all card effects. &lt;-- Resolving this effect is almost guaranteed a free win.(Make sure no other effect is resolving last or else RHDA King Calamity's effect won't trigger on Synchro Summon)</li>  	<li>Opponent has no choice but to to end turn.</li>  	<li>During Turn 3 (My 2nd Turn), I usually use Block Dragon + 1 other monster besides RHDA King Calamity as Link material for any Link Monster (Union Carrier or I:P Masquerena) at the the time and then resolve in the gy to fill my hand with combo pieces.</li>  	<li>I usually get out Union Carrier + Adamancipator Risen - Dragite/Borrelsword Dragon</li>  	<li>Activate Union Carrier to equip RHDA King Calamity with Dragon Buster Destruction Sword</li>  	<li>BP then attack with all monsters</li> </ol> Goal 2: <ol>  	<li>1st Turn end will usually with as many disruption/negation monsters as possible. Usually something like Apollousa + Borreload Savage Dragon and/or Adamancipator Risen - Dragite + Herald of the Arc Light/Koa'ki Meiru Guardian + Abyss Dweller + Block Dragon</li>  	<li>Disruption the hell out of my opponent during their turn.</li>  	<li>Turn 3 I send Block Dragon to resolve the GY effect if needed.</li>  	<li>BP and Attack</li> </ol> &nbsp;  Those 2 are my Main Goals. If I lose the dice roll and go 2nd, <a>here is a video showing off a decent example of how the deck can survive multiple disruptions while still getting a decent board</a>  &nbsp;  I tested this deck a ton of times to make sure its consistent no matter what hand it is. Of course bricks are bound to happen no matter what but very very rarely. Enjoy it while it still has Block Dragon.  &nbsp;  &nbsp;  &nbsp;  5/5/2020 Edit: Decided to add Avramax and test it out. Its definitely an amazing card to tech in as protection.  Here are some videos showing off the board with Apoullousa + Avramax + Borreload Savage Dragon equipped w/ Dragon Buster Destruction Sword  Combo Example: <a>https://www.youtube.com/watch?v=qkt_hXD-qHQ</a>  In a duo match: <a>https://www.youtube.com/watch?v=xdJ7dgfic8g</a>"
83757,yosenju-pendulum-83757,Yosenju Pendulum,21364070,25771,Non-Meta Decks,"[""93368494"",""93368494"",""21364070"",""21364070"",""21364070"",""55063751"",""55063751"",""55063751"",""92246806"",""58981727"",""58981727"",""58981727"",""65247798"",""65247798"",""65247798"",""28630501"",""28630501"",""28630501"",""65025250"",""65025250"",""91420254"",""91420254"",""14558127"",""14558127"",""14558127"",""35261759"",""35261759"",""35261759"",""49238328"",""49238328"",""49238328"",""61884774"",""61884774"",""61884774"",""48130397"",""48130397"",""48130397"",""57103969"",""57103969"",""57103969""]","[""95793022"",""95793022"",""45170821"",""41209828"",""41209828"",""78084378"",""78084378"",""54757758"",""54757758"",""6983839"",""6983839"",""21044178"",""21044178"",""31833038"",""85289965""]","[""53582587"",""53582587"",""53582587"",""23516703"",""23516703"",""23516703"",""53334471"",""53334471"",""53334471"",""41420027"",""41420027"",""41420027"",""54903668"",""54903668"",""54903668""]",1615487905,2 years ago,,,0,Yosenju Pendelum (non Budget Version),This is the expensive and stronger version of the Yosenju Pendulum Deck.
83750,madolche-83750,Madolche,44311445,20789,Non-Meta Decks,"[""74641045"",""52404456"",""52404456"",""52404456"",""77848740"",""77848740"",""77848740"",""11868731"",""11868731"",""11868731"",""34680482"",""34680482"",""34680482"",""423585"",""423585"",""423585"",""91350799"",""91350799"",""14558127"",""14558127"",""14558127"",""83764719"",""24224830"",""24224830"",""24224830"",""60470713"",""60470713"",""71348837"",""71348837"",""71348837"",""14001430"",""14001430"",""10045474"",""10045474"",""10045474"",""68159562"",""68159562"",""68159562"",""40605147"",""40605147""]","[""44311445"",""44311445"",""44311445"",""37164373"",""37164373"",""90590304"",""46772449"",""20343502"",""20343502"",""20343502"",""85289965"",""38342335"",""2857636"",""96150936"",""96150936""]","[""53582587"",""53582587"",""53582587"",""23516703"",""23516703"",""23516703"",""53334471"",""53334471"",""53334471"",""41420027"",""41420027"",""41420027"",""54903668"",""54903668"",""54903668""]",1615487905,2 years ago,,,0,Anime girls and sweets,https://youtu.be/mYTmzqiFbmI
83739,water-magician-83739,Water magician,65749035,25754,Fun/Casual Decks,"[""14462257"",""14462257"",""14462257"",""28348537"",""28348537"",""28348537"",""32750510"",""38528901"",""38528901"",""38528901"",""56704140"",""56704140"",""73061465"",""73061465"",""19041767"",""19041767"",""68881649"",""68881649"",""74364659"",""74364659"",""82099401"",""82099401"",""57839750"",""57839750"",""10352095"",""96947648"",""96947648"",""49669730"",""49669730"",""28553439"",""28553439"",""28553439"",""22123627"",""56769674"",""56769674"",""56769674"",""7935043"",""12607053"",""36361633"",""97077563""]","[""50321796"",""70583986"",""65749035"",""65749035"",""65749035""]","[""53582587"",""53582587"",""53582587"",""23516703"",""23516703"",""23516703"",""53334471"",""53334471"",""53334471"",""41420027"",""41420027"",""41420027"",""54903668"",""54903668"",""54903668""]",1615487905,2 years ago,,,0,Water Magician Deck,.
83736,shaddoll-competitive-83736,Shaddoll Competitive,72989439,25289,Meta Decks,"[""30328508"",""30328508"",""30328508"",""37445295"",""37445295"",""3717252"",""3717252"",""4939890"",""4939890"",""77723643"",""51023024"",""69764158"",""67696066"",""59438930"",""14558127"",""28985331"",""41386308"",""41386308"",""41386308"",""65192027"",""65192027"",""65192027"",""72989439"",""72989439"",""44394295"",""44394295"",""44394295"",""6417578"",""6417578"",""6417578"",""60226558"",""48130397"",""48130397"",""48130397"",""1475311"",""1475311"",""1475311"",""81439173"",""83764719"",""76375976"",""23912837"",""23912837"",""23912837"",""4904633""]","[""20366274"",""20366274"",""20366274"",""94977269"",""94977269"",""94977269"",""50907446"",""50907446"",""48424886"",""48424886"",""74822425"",""74822425"",""19261966"",""86938484"",""1861629""]","[""102380"",""102380"",""102380"",""43898403"",""43898403"",""43898403"",""69452756"",""69452756"",""69452756"",""74003290"",""74003290"",""74003290""]",1615487905,2 years ago,,,1,Shaddoll Competitive,When you summon Decode talker u must watch that the arrows must point to a shaddoll monster (not fusion) beacuse him effect can trigger monsters effects.
83733,best-dragonmaid-deck-vs-all-meta-83733,Best Dragonmaid deck vs all meta,32600024,15124,Meta Decks,"[""15848542"",""42055234"",""76782778"",""76782778"",""76782778"",""49575521"",""16960120"",""16960120"",""16960120"",""13171876"",""88453933"",""88453933"",""88453933"",""32600024"",""32600024"",""32600024"",""40398073"",""40398073"",""78661338"",""78661338"",""14558127"",""14558127"",""14558127"",""49238328"",""49238328"",""49238328"",""78231355"",""78231355"",""78231355"",""83764719"",""40110009"",""40110009"",""24224830"",""24224830"",""24224830"",""10045474"",""10045474"",""10045474"",""47393199"",""47393199""]","[""41232647"",""41232647"",""41232647"",""24799107"",""24799107"",""24799107"",""85289965"",""38342335"",""2857636"",""2857636"",""75452921"",""24361622"",""24361622"",""60303245"",""60303245""]","[""42055234"",""15848542"",""38120068"",""38120068"",""70368879"",""40605147"",""40605147"",""40605147"",""97268402"",""97268402"",""97268402"",""87571563"",""87571563"",""13143275"",""86148577""]",1615487905,2 years ago,,,0,dragonmaid 2020,https://www.sidedeckvs.com/side-deck/dragonmaid/
83730,traptrix-vs-all-meta-2020-83730,Traptrix vs All meta 2020,55428242,15124,Meta Decks,"[""20292186"",""45803070"",""45803070"",""45803070"",""91812341"",""91812341"",""91812341"",""82738277"",""82738277"",""82738277"",""28201945"",""35261759"",""35261759"",""94770493"",""69599136"",""69599136"",""69599136"",""31548215"",""31548215"",""23924608"",""98827725"",""98827725"",""98827725"",""12444060"",""12444060"",""12444060"",""80101899"",""80101899"",""80101899"",""23924608"",""94192409"",""94192409"",""94192409"",""10045474"",""10045474"",""10045474"",""41420027"",""41420027"",""41420027"",""61740673""]","[""6983839"",""21044178"",""55285840"",""59071624"",""6511113"",""62517849"",""84013237"",""56832966"",""85289965"",""38342335"",""2857636"",""7480763"",""73639099"",""73639099"",""73639099""]","[""46502744"",""71278040"",""71278040"",""71278040"",""46247282"",""31833038"",""29401950"",""29401950"",""38761908"",""38761908"",""74003290"",""74003290"",""74003290"",""29616929"",""29616929""]",1615487905,2 years ago,,,0,best traptrix deck,https://www.sidedeckvs.com/side-deck/traptrix/
83727,cyber-dragon-vs-all-meta-83727,Cyber Dragon vs all meta,10443958,15124,Meta Decks,"[""70095154"",""70095154"",""70095154"",""23893227"",""23893227"",""23893227"",""56364287"",""56364287"",""56364287"",""29975188"",""1142880"",""1142880"",""46659709"",""46659709"",""14558127"",""14558127"",""14558127"",""94145021"",""94145021"",""94145021"",""63941210"",""63995093"",""63995093"",""63995093"",""60600126"",""60600126"",""60600126"",""33041277"",""86686671"",""55704856"",""81439173"",""48130397"",""48130397"",""48130397"",""3659803"",""3659803"",""15693423"",""15693423"",""15693423"",""82428674""]","[""41209827"",""62111090"",""87116928"",""79229522"",""84058253"",""84058253"",""10443958"",""10443958"",""58069384"",""58069384"",""69840739"",""70369116"",""46724542"",""2857636"",""60303245""]","[""97268402"",""97268402"",""97268402"",""59438930"",""59438930"",""59438930"",""43898403"",""43898403"",""43898403"",""33041277"",""83764719"",""2295440"",""40216089"",""22423493""]",1615487905,2 years ago,,,0,best cyber deck,https://www.sidedeckvs.com/side-deck/cyber-dragon/
