deck_num,pretty_url,deck_name,cover_card,userid,format,main_deck,extra_deck,side_deck,ts_submit_date,submit_date,ts_edit_date,edit_date,comments,deck_excerpt,deck_description
299604,the-complete-dragon-link-guide-299604,The Complete Dragon Link Guide,26118970,35865,Meta Decks,"[""67748760"",""14558127"",""14558127"",""14558127"",""61901281"",""5560911"",""55623480"",""59438930"",""97631303"",""27204311"",""27204311"",""27204311"",""6609736"",""55920742"",""19535693"",""38814750"",""38814750"",""38814750"",""26118970"",""5969957"",""48355999"",""68464358"",""68464358"",""93708824"",""2563463"",""30680659"",""30680659"",""30680659"",""99234526"",""49036338"",""12266229"",""69167267"",""36668118"",""99266988"",""99266988"",""99266988"",""38745520"",""62265044"",""67723438"",""67723438"",""67723438"",""39568067"",""81439173"",""5133471"",""31443476"",""31443476"",""31443476"",""3285551"",""3285551"",""3285551""]","[""84815190"",""27548199"",""3040496"",""9753964"",""68431965"",""86066372"",""98630720"",""50588353"",""8264361"",""11969228"",""13143275"",""65741786"",""38342335"",""73539069"",""49725936""]","[""94145021"",""94145021"",""94145021"",""43534808"",""24224830"",""24299458"",""24299458"",""24299458"",""18144506"",""43898403"",""43898403"",""58921041"",""58921041"",""58921041"",""23002292""]",1660415905,7 months ago,,,4,Best deck baybeee,"<span>Hi, this is the dragon link build I've been using for the current format. I personally think the deck is pretty good as is, but there are some changes you can make depending on preference. There are some weird ratios in the deck for some things but i’ll go over everything in this deck explanation. If something abt the card ratios/uses doesn't make sense, read the combo and it might help! We dragon players need to keep this format alive, it shouldn’t just be a boring tear and splight meta. Dragons best deck!!</span>  &nbsp;  <span>1 Abs - used to mill off of ravine to search in combo, extender if drawn and can also just be discarded to use effect and ravine can mill destrudo </span>  &nbsp;  <span>1 destrudo - amazing extender, and it’s a tuner for halq plays potentially </span>  &nbsp;  <span>1 white - free 2 bodies w/black and w/o normal summoning, and can be hit off of ruler since it’s light and chaos space can easily search, easily one of the best cards in the deck</span>  &nbsp;  <span>1 black - same as white, just isn't as good when you draw because you need to banish a light from gy, which is very possible but not as easy/flexible as white in some scenarios </span>  &nbsp;  <span>1 illusion - can search souls and can be searched off of chaos space or hit off of ruler </span>  &nbsp;  <span>1 souls - can be searched off of illusion or ruler, no need for any more than 1-1 ratio, it’s only really good if the brave engine is active </span>  &nbsp;  <span>1 snow - mill of of riser, amazing card and great when drawn as well since riser can mill temple for follow up and you have an extra extender + free discard </span>  &nbsp;  <span>1 ze amin - to summon off of e-tele, card’s crazy - even if you draw it it’s good except you can’t use brave that turn</span>  &nbsp;  <span>1 foxy tune - you search off of amin and discard self + blank to summon deer note and go into ruler early, if you draw, it’s a free summon and a discard at worst</span>  &nbsp;  <span>1 deer note - for punk combo, not a good draw, but if you draw with e-tele, you can do the e-tele summon amin, amin search foxy and then deer note discard foxy to summon itself and in this case it’s the same as not opening deer note and using foxy effect normally (same number of cards used in hand)</span>  &nbsp;  <span>1 ghost ogre - extra card to summon off of e-tele (playing this since it’s level 3), it’s a handtrap when draw and not maximizing on it this format because there’s better handtraps to run imo</span>  &nbsp;  <span>1 red rose - main halq target, cards crazy with brave or any level 4 non tuner</span>  &nbsp;  <span>1 rox rose - target for red rose effect, if drawn it’s a “dragon starter” aka way to get to romulus. You can also discard it and summon it off of pisty later to use its effect. </span>  &nbsp;  <span>3 temple - searches brave engine and a free body if you already have access to the brave engine, it’s follow up when in the grave and it’s nice that you can use effect from grave as well since you may mill it using ruler </span>  &nbsp;  <span>1 gryphon - you need this for the brave engine, helps you go nibiru proof and it’s a level 7 that can be used in the combo along with red rose to summon out fleur. Not a brick if you draw it, if you have brave engine already, you can search temple with fateful and you have a free body + follow up, and if you draw without rite, it’s still a free body and it can also be used to summon romulus since it’s a winged beast (a lot of ppl usually forget this, but romulus can take dragons and/or winged beast monsters as materials!!)</span>  &nbsp;  <span>2 tracer - best rokket in the deck, summons from deck and helps you use snow effect twice during opponent's turn. Great draw, since it’s a tuner and helps extend combo if drawn as well since you usually need to search this</span>  &nbsp;  <span>1 synchron - nice in the late game as a normal summon, otherwise it’s there for hot red plays</span>  &nbsp;  <span>1 recharger - best level 4 rokket, pairs nicely with striker dragon, being able to bring back any dark from grave is powerful in the late game, especially when your opponent breaks your board</span>  &nbsp;  <span>3 ash blossom - most generic handtrap that’s always good (and it’s a level 3 tuner, which just works in this deck)</span>  &nbsp;  <span>3 nibiru - it’s a light and a really high impact handtrap that is especially good this format with all the combo decks</span>  &nbsp;  <span>3 gamma - if you resolve this card in your turn, you pretty much win the duel, -1 from opponents hand (the ash they used that’s negated), free ruler, which means free mill 4 and add 1, and ruler can bring itself back from graveyard as well. If you resolve this card, you're at such an advantage you almost always just win, unless your opponent opens crazy. Can protect when you use : chaos space, e-tele, quick launch and temple</span>  &nbsp;  <span>1 driver - best card in the entire deck, what else can I say?</span>  &nbsp;  <span>1 galaxy cyclone - this is kinda weird, but i lose 2-1 to mystic mine decks so much this format, so i feel like it’s worth maining this just so you don't auto lose this matchup if dracoback has already been used. Playing this specifically because it’s nice when you mill it off of ruler and use it rather than having harpie’s in the main deck and praying you draw it. </span>  &nbsp;  <span>3 rite - amazing starter and works wonders with the red rose engine </span>  &nbsp;  <span>1 fateful - not amazing when you draw this, but it’s not half bad. When you open with rite, it’s a -1, not the end of the world, but if you open it normally, you can search temple and get token + dracoback which isn't half bad. </span>  &nbsp;  <span>1 dracoback - this card’s crazy going second and it’s a free discard going first, main deck out to mine as well, not a great draw most of the time</span>  &nbsp;  <span>3 e-tele - it’s a free ruler + halq when you summon ze-amin, and helps dig for the brave engine when you don't open it and extends the combo (since you don't need to use tracer + recharger to go into ruler, you can go straight for savage and potentially end on an extra hot red). When you already used ze-amin or you draw it in the late game, it can summon gamma as a body/tuner or ghost ogre as a level 3 tuner (this is important in this deck)</span>  &nbsp;  <span>3 quick launch - it’s a free dragon, rokket synchron, level 4 body, tuner or tracer: whichever you want it to be at that moment </span>  &nbsp;  <span>3 chaos space - this card’s crazy, gives a ton of card advantage and is just value in general. It gets you 2 free summons, recycles striker, and draws you a card, what more can you ask for? Can also search illusion by discarding a light (:</span>  &nbsp;  <span>1 boot: for combo, not a great draw, you just won't search it </span>  &nbsp;  <span>1 ravine: for combo, again, you will search so not the best draw, but at least it does something when you draw it unlike cough cough boot cough cough</span>  &nbsp;  <span>1 foolish - this card is whatever you want it to be, brave engine, tracer (via abs), tuner (destrudo) or even snow </span>  &nbsp;  <span>1 basal rose shoot: another combo card, not the best draw by interesting thing is, when you search it off of rox, you can set it instead of using it and it helps you play around dark ruler (dark ruler c1, basal c2, hot red c3 on dark ruler)</span>  &nbsp;  <span>Main combo (a way to make halq + brave engine) - </span>  &nbsp;  <span>Note</span><span>: I’ll be using souls + ash blossom + rite but it can literally be anything else here. Having souls is kind of a bonus, it can be any random monster in it’s place </span>  &nbsp; <ol>  	<li aria-level=""1""><span>Use rite, summon token grab fateful</span></li>  	<li aria-level=""1""><span>Normal ash, fateful grab draco</span></li>  	<li aria-level=""1""><span>Fateful eff, search gryphon and then disc draco</span></li>  	<li aria-level=""1""><span>Draco equip onto token</span></li>  	<li aria-level=""1""><span>Gryphon summon itself out (make sure you use the rightmost 2 zones or leftmost 2 zones, just to be safe, don't play the brave stuff in the middle zones so you have guardragon plays if halq gets negated)</span></li>  	<li aria-level=""1""><span>Souls dump illusion, to summon itself</span></li>  	<li aria-level=""1""><span>Souls send fateful and draco to draw 2, free cash money</span></li>  	<li aria-level=""1""><span>Souls + ash into halq, summon red rose </span></li>  	<li aria-level=""1""><span>Red rose + gryphon into fleur (dont summon in the middle, stick to one side)</span></li>  	<li aria-level=""1""><span>Red rose summon rox rose</span></li>  	<li aria-level=""1""><span>Rox rose grab basal</span></li>  	<li aria-level=""1""><span>Rox + token into riser, use eff to dump snow</span></li>  	<li aria-level=""1""><span>Riser into striker (right arrow of halq, also riser is level 3 now so this is legal), grab boot</span></li>  	<li aria-level=""1""><span>Basal summon red rose, red rose into pisty (left halq arrow)</span></li>  	<li aria-level=""1""><span>Pisty bring back something</span></li>  	<li aria-level=""1""><span>Pisty + something into romulus, grab ravine</span></li>  	<li aria-level=""1""><span>Ravine discard mill abs search tracer</span></li>  	<li aria-level=""1""><span>Boot summon tracer</span></li>  	<li aria-level=""1""><span>Tracer pop boot summon recharger</span></li>  	<li aria-level=""1""><span>Tracer + recharger into ruler, mill and add</span></li>  	<li aria-level=""1""><span>Romulus + halq + ruler into borrend (summon into zone striker points to instead of extra monster zone, we do this so when we summon unicorn into extra monster zone in opponents turn, we get an extra draw since it’s co linked to borrelend!)</span></li>  	<li aria-level=""1""><span>Striker destroy itself, add recharger, recharger effect, summon itself back</span></li>  	<li aria-level=""1""><span>Borrelend target recharger and summon back tracer from gy</span></li>  	<li aria-level=""1""><span>Tracer + recharger into savage, eff to equip halq</span></li>  	<li aria-level=""1""><span>Now if you have an extender in hand, you can make I:P (if it’s just any random body this works) or hot red (if you have quick launch) since you have ruler in grave as the second body for these effects</span></li>  	<li aria-level=""1""><span>Opponents turn, we have borrelend (negate and summon back tracer), fleur (omni negate), savage (omni negate), snow set x2 (summon, then tracer eff to pop it and then snow again - can’t use if you already used synchron w/quick launch tho!) and potentially a handtrap you hit off of ruler effect. Make sure to always banish striker from gy (with ruler, snow or the chaos dragons) to recycle with chaos space for follow up! This is the basic gist of it, ending on multiple negates and amazing follow up with flexible combo pieces. </span></li> </ol> &nbsp;  <span>Nibiru</span><span>: In this combo, you are immune to nib the entire time, having gryphon or bleur on board at all times. If your opponent has nib, they will use it to force out the gryphon negate (the ideal time is when there’s halq, red rose, gryphon and token on board, if they let you resolve red rose, there’s no point in dropping nib, because it trades with fluer, which till stays on board and can do stuff next turn and lets red rose resolve which is too much card advantage). If they do this, you still do the same combo, except you don't have gryphon, which means no fleur in the end board (oh no! One negate’s gone!). When you don't have brave engine, you can do the same combo here, except pretend the brave token is a level 4 body (literally anything from chaos dragons to snow to recharger that you summoned with quick launch) and do the combo normally. You just won't have fleur in the end board. Be mindful though! Dont just fullsend your resources in this combo right away and get punished by nib, because you are not protected here. You can do this after you made riser and used red rose effect though, because your opponent would have dropped nib by now if they had it. The nib proof version and this version lose to impem/veiler + nib though so that's something to keep in mind. </span>  &nbsp;  <span>Punk Stuff (most ppl alr know how this engine works but i’ll explain anyways)</span>  &nbsp; <ol>  	<li aria-level=""1""><span>E-tele out ze-amin</span></li>  	<li aria-level=""1""><span>Amin search foxy</span></li>  	<li aria-level=""1""><span>Foxy discard itself and blank to summon deer note</span></li>  	<li aria-level=""1""><span>Synchro into ruler, deer note bring back ze-amin</span></li>  	<li aria-level=""1""><span>Mill 5 add 1</span></li>  	<li aria-level=""1""><span>Ruler + amin into halq</span></li> </ol> &nbsp;  <span>This engine helps extend the regular combo and helps you dig for temple/brave engine. In the main combo, if you opened this instead of the souls + normal summon, you can go directly into savage instead of ruler, then you can summon out I:P as well, so this helps extend the combo. </span>  &nbsp;  <span>Extra dec</span><span>k: Most of the stuff in extra is used in combo, except for dharc, triple burst and accesscode. The only reason I don't play seal is because it doesn't come up as often as dharc or triple burst. Triple burst is amazing when you don't have striker + pisty to make guardragon plays. It comes up a LOT and some people are using it instead of hot red in the extra. I was doing this as well, but I feel like hot red is necessary for this meta with all the mystic mine and spell stuff going around. Dharc also does come up going second and I just found myself using it more than seal. In the end, it’s based on preference, you can pick 3 out of these 4, dharc, seal, triple burst and hot red. If I had a 16 card extra, i’d definitely play all of them, but in the end there is no wrong answer as to what you pick, I’ve seen ppl run all combinations of those cards. </span>  &nbsp;  <span>Changes I’d make</span><span>: if you are a normal human being (couldn't be me haha) you’d play 51 cards with 3 droplet instead of the galaxy and ogre</span>  &nbsp;  <span>Well, thats basically all I have to say, if there are any questions lmk in the comments, I’ll try to answer them asap (been kinda busy lately tho so idk). Send mea friend request on disc with any questions (Ash_001#9275). Anyways thanks for reading if your still here lol this took quite a bit to type out. </span>"
299613,floowandereeze-deck-diamond-1-worthy-299613,Floowandereeze Deck Diamond 1 Worthy,80611581,89293,Master Duel Decks,"[""91800273"",""91800273"",""91800273"",""14558128"",""14558128"",""18940725"",""18940725"",""18940725"",""54334420"",""54334420"",""54334420"",""80433039"",""17827173"",""80611581"",""80611581"",""69327790"",""29587993"",""73356503"",""18144507"",""51697825"",""55521751"",""73628505"",""28126717"",""28126717"",""28126717"",""84211599"",""84211599"",""84211599"",""98645731"",""98645731"",""98645731"",""65681983"",""65681983"",""14087893"",""14087893"",""10045474"",""10045474"",""15693423"",""15693423"",""87639778"",""87639778"",""41215808""]","[""27240101"",""27240101"",""27240101"",""21123811"",""26268488"",""35952884"",""62242678"",""99585850"",""97489701"",""7841112"",""16172067"",""36857073"",""63180841"",""96633955"",""59765225""]",,1660415905,7 months ago,,,0,"Diamond 1 worthy Floowondereeze build with great capacity to go 2nd. For full gameplay, watch: https://youtu.be/7_In0dt3X2U",I made it from Diamond 5 to Diamond 1 in one day with this build. I even went 5 for 5 in Diamond 2 unbroken. Hope you enjoy this one and I'll see you on the next one.  https://youtu.be/7_In0dt3X2U
299617,starry-striker-299617,Starry Striker,90835938,15387,Non-Meta Decks,"[""49036338"",""90835938"",""90835938"",""90835938"",""23220533"",""23220533"",""23220533"",""26077387"",""26077387"",""26077387"",""86613346"",""59228631"",""44818"",""44818"",""38814750"",""38814750"",""38814750"",""24010609"",""85590798"",""85590798"",""76375976"",""50005218"",""50005218"",""50005218"",""54693926"",""54693926"",""54693926"",""63166095"",""22007085"",""22007085"",""22007085"",""73628505"",""40450317"",""40450317"",""40450317"",""52340444"",""51227866"",""98338152"",""98338152"",""21985407"",""21985407"",""58374502"",""58374502""]","[""74586817"",""90448279"",""6983839"",""31437713"",""21044178"",""86066372"",""46947713"",""38342335"",""2857636"",""8491308"",""63288573"",""63288573"",""90673288"",""75147529"",""65741786""]","[""49036338"",""56818977"",""38814750"",""38814750"",""38814750"",""88836438"",""93595154""]",1660415905,7 months ago,,,0,Starry knight with a small sky striker engine. ,The whole basis of the deck is to try to have a way to summon starry knight starry dragon on ypur opponents turn and possibly have an omni negate in the form of starry knight blast or maybe a monster negate with widow anchor. You can also run pot of prosperity if you so desire however that is a very expensive card and it increases the deck size so it'll be harder to open a good hand. P.S this deck is for fun only it is not for really competitive play.
299621,blue-eyes-299621,Blue-Eyes,89631146,121605,Non-Meta Decks,"[""89631139"",""89631139"",""89631139"",""38517737"",""55410871"",""30576089"",""57043986"",""97077563"",""97077563"",""97077563"",""71143015"",""15960641"",""95956346"",""68005187"",""88241506"",""88241506"",""45644898"",""72855441"",""41620959"",""29401950"",""21082832"",""38120068"",""72302403"",""98645731"",""98645731"",""2295440"",""75500286"",""44095762"",""44095762"",""50078509"",""87025064"",""82382815"",""12580477"",""12580477"",""98045062"",""17655904"",""71039903"",""79814787"",""41420027"",""62089826"",""5318639"",""5318639"",""45467446"",""17444133"",""34627841"",""83764718"",""37742478"",""22804410""]","[""59822133"",""40908371"",""43228023"",""2129638"",""2129638"",""23995346"",""56532353"",""99267150"",""1639384""]","[""49036338"",""56818977"",""38814750"",""38814750"",""38814750"",""88836438"",""93595154""]",1660415905,7 months ago,,,0,Blue-eyes white dragon deck and cards that synergize with it. ,The main goal of this deck is to get out Blue-Eyes white dragon as quickly as possible.
299625,springans-2022-299625,Springans 2022,48285768,50441,Fun/Casual Decks,"[""10604644"",""10604644"",""10604644"",""29601381"",""83203672"",""83203672"",""81866673"",""20424878"",""20424878"",""68468459"",""68468459"",""63362460"",""67436768"",""67436768"",""56818977"",""14558128"",""14558128"",""59438931"",""59438931"",""23499963"",""23499963"",""23499963"",""44362883"",""44362883"",""44362883"",""52947044"",""52947044"",""73628505"",""88836438"",""88836438"",""7496001"",""7496001"",""7496001"",""60884672"",""60884672"",""60884672"",""10045474"",""10045474"",""10045474"",""10584050""]","[""44146295"",""44146295"",""70534340"",""60461804"",""1906812"",""1906812"",""34848821"",""87746184"",""93854893"",""62941499"",""39317553"",""21044178"",""48285768"",""48285768"",""2857636""]","[""49036338"",""56818977"",""38814750"",""38814750"",""38814750"",""88836438"",""93595154""]",1660415905,7 months ago,,,0,Springans + Therion,https://youtu.be/0LfkMCjmBOY  
299630,beetrooper-299630,Beetrooper,38229962,67766,Non-Meta Decks,"[""14558127"",""14558127"",""14558127"",""65899613"",""65899613"",""65899613"",""28388927"",""28388927"",""28388927"",""51578214"",""39041550"",""39041550"",""39041550"",""2656842"",""2656842"",""2656842"",""65430555"",""87170768"",""76039636"",""84462118"",""84462118"",""84462118"",""17535764"",""17535764"",""17535764"",""14357527"",""94573223"",""98154550"",""96938986"",""96938986"",""96938986"",""15367030"",""87240371"",""87240371"",""24224830"",""81439173"",""75500286"",""1712616"",""10045474"",""10045474"",""10045474""]","[""63746411"",""4997565"",""86066372"",""4280258"",""2834264"",""2834264"",""2834264"",""38229962"",""65741786"",""97273514"",""97273514"",""38342335"",""98978921"",""91140491"",""91140491""]","[""62015408"",""62015408"",""46502744"",""43534808"",""43534808"",""43534808"",""54498517"",""43898403"",""43898403"",""58921041"",""58921041"",""58921041"",""83326048"",""83326048"",""83326048""]",1660415905,7 months ago,,,3,"!!!GOD OF INSECTS, BEETROOPERS!!!","Combo: Needed: Foolish Burial, Beetrooper Scout Buggy and 1 random insect monster <ul>  	<li>Normal Summon Beetrooper Scout Buggy; activate Buggy's effect summoning another copy of him from the deck</li>  	<li>Link Summon <strong>Beetrooper Armor Horn</strong> using Buggys</li>  	<li>Activate Foolish Burial sending <strong>Gokipole</strong> to the GY; with Gokipole's effect add to your hand <strong>Resonance Insect</strong></li>  	<li>Use Armor Horn's effect Normal Summoning Resonance</li>  	<li>Link Summon Inzektor Picofalena with her first effect beeing chain link 2 and Resonance's effect beeing chain link 1, here equip <strong>Inzektor Giga-Mantis</strong> to Picofalena and add <strong>Doom Dozer</strong> to your hand</li>  	<li>Banish Gokipole and random insect monster you sent to grave for cost of Picofalena to summon Doom Dozer</li>  	<li>Link Summon Seraphim Papillion with it beeing chain link 2 and Giga Mantis chain link 1, place 2 counters on papillion and revive Picofalena</li>  	<li>Banish Doom Dozer, Buggy and Resonance Insect to revive Armor Horn; with Resonance's effect send any Insect monster to GY</li>  	<li>Use Picofalena's effect returning Giga-Mantis, Buggy and insect you sent with Resonance's effect to deck and draw 1 card with her effect</li> </ul> Now there are two possibilitys, either summon Apollousa, Bow of the Goddess using Picofalena and Armor Horn or, if you drew Battlewasp Pin Bullseye or Heavy Beetrooper Mighty Neptune or Beetrooper Assault Roller or Beetrooper Scale bomber do this: <ul>  	<li>Link Summon <strong>Giant Beetrooper Invincible Atlas</strong></li>  	<li>Special Summon drawn <strong>Battlewasp - Pin the Bullseye</strong>/<strong>Beetrooper Scale Bomber</strong>/<strong><span class=""name_txt selectable"">Beetrooper Assault</span></strong><span class=""name_txt selectable""><strong> Roller</strong>/<strong>Heavy Beetrooper Mighty Neptune </strong>from your hand</span></li>  	<li>Use Invincible Atlas's effect to tribute the monster you special summoned from your hand to Special Summon <strong>Beetrooper Sting Lancer</strong>; Use Sting Lancer's effect and add <strong>Beetrooper Descent   </strong></li>  	<li>Activate Descent to summon token</li>  	<li>Use token and Lancer to Link Summon <strong>I:P Masquerena</strong></li> </ul> Best endboard from this combo: Seraphim Papillion, I:P Masquerena, Giant Beetrooper Invincible Atlas and 2 cards in hand.  Of course you are planing on reviving Lancer to add Descent or Fly &amp; Sting. You could've added Fly &amp; Sting with Lancer and go to Apollousa using Lancer and Papillion, but I like this end more, it's more fun. My best end was Cicada King, Apollousa and Atlas which is pretty good for this deck.  Also, it's fine if you draw Mantis which is hillarious since you will mostly  equip it with Picofalena.  Deck is fine and it's best Insect deck out there. It is Rogue and can fight the best decks and come out victorious."
299634,tearalaments-danger-299634,tearalaments DANGER!,92731385,114738,Fun/Casual Decks,"[""73956664"",""73956664"",""73956664"",""572850"",""572850"",""572850"",""37961969"",""37961969"",""37961969"",""74078255"",""74078255"",""74078255"",""30328508"",""3717252"",""79109599"",""79109599"",""79109599"",""70711847"",""70711847"",""70711847"",""52350806"",""52350806"",""14558127"",""14558127"",""14558127"",""77103950"",""77103950"",""77103950"",""73628505"",""81439173"",""24094653"",""24094653"",""1845204"",""24224830"",""10045474"",""10045474"",""10045474"",""74920585"",""74920585"",""1329620""]","[""28226490"",""92731385"",""92731385"",""94977269"",""69946549"",""69946549"",""11321089"",""41578483"",""13529466"",""27381364"",""65741786"",""38342335"",""90590303"",""55285840"",""46772449""]","[""102380"",""102380"",""82385847"",""73642296"",""73642296"",""73642296"",""54693926"",""54693926"",""54693926"",""43898403"",""43898403"",""23002292"",""35027493"",""35027493"",""35027493""]",1660415905,7 months ago,,,0,tearalaments DANGER!,Tearalaments DANGER! post POTE  &nbsp;
