deck_num,pretty_url,deck_name,cover_card,userid,format,main_deck,extra_deck,side_deck,ts_submit_date,submit_date,ts_edit_date,edit_date,comments,deck_excerpt,deck_description
111686,eater-of-banished-cards-111686,Eater of Banished Cards,63845230,30330,Meta Decks,"[""71197066"",""92998610"",""92998610"",""14558127"",""70074904"",""70074904"",""36733451"",""36733451"",""36733451"",""63845230"",""63845230"",""63845230"",""34710660"",""59438930"",""37984162"",""37984162"",""36584821"",""36584821"",""28297833"",""28297833"",""53167658"",""24299458"",""24299458"",""75500286"",""14532163"",""83764718"",""35261759"",""49238328"",""73915051"",""18144506"",""78474168"",""94192409"",""77538567"",""31550470"",""15693423"",""10045474"",""44095762"",""98427577"",""41420027"",""40605147""]","[""86066372"",""4280258"",""63503850"",""1861629"",""85243784"",""85243784"",""15844566"",""49725936"",""49725936"",""68618157"",""68618157"",""38273745"",""80796456"",""49202162"",""80764541""]","[""94145021"",""90642597"",""220414"",""42664989"",""69279219"",""43898403"",""93236220"",""98956134"",""49010598"",""60082869"",""23122036"",""23516703"",""12580477"",""89882100"",""51099515""]",1615487905,2 years ago,,,0,Banish,Banishing
111678,morphtronics-deck-111678,Morphtronics Deck,93542102,30254,Fun/Casual Decks,"[""93542102"",""93542102"",""93542102"",""15521027"",""15521027"",""15521027"",""10591919"",""10591919"",""10591919"",""57108202"",""57108202"",""55119278"",""55119278"",""55119278"",""2250266"",""2250266"",""2250266"",""75775867"",""75775867"",""44424095"",""44424095"",""44424095"",""2295440"",""81439173"",""83764718"",""73628505"",""56074358"",""56074358"",""56074358"",""63995093"",""63995093"",""63995093"",""28284902"",""28284902"",""28284902"",""92890308"",""92890308"",""14613029"",""49833312"",""85101228""]","[""50588353"",""33198837"",""32530043"",""32530043"",""61399402"",""48739166"",""63746411"",""84013237"",""46871387"",""46871387"",""80796456"",""6983839"",""6983839"",""3987233""]","[""8267140"",""8267140"",""8267140"",""24224830"",""23002292"",""14532163"",""14532163"",""14532163""]",1615487905,2 years ago,,,0,I made a morphtronics deck. not meta relevant or anything I just like morphtronics :),I made a morphtronics deck. not meta relevant or anything I just like morphtronics :)
111674,domain-monarchs-september-2020-format-111674,Domain Monarchs - September 2020 Format,22842126,29443,Meta Decks,"[""96570609"",""96570609"",""96570609"",""23064604"",""23064604"",""23064604"",""47084486"",""47084486"",""57666212"",""33746252"",""33746252"",""59463312"",""59463312"",""59463312"",""95457011"",""95457011"",""95457011"",""19870120"",""61466310"",""61466310"",""84171830"",""84171830"",""84171830"",""2295440"",""22842126"",""22842126"",""22842126"",""32807846"",""33609262"",""33609262"",""33609262"",""70368879"",""79844764"",""79844764"",""79844764"",""18235309"",""48716527"",""48716527"",""54241725"",""54241725""]","[""50588353"",""33198837"",""32530043"",""32530043"",""61399402"",""48739166"",""63746411"",""84013237"",""46871387"",""46871387"",""80796456"",""6983839"",""6983839"",""3987233""]","[""8267140"",""8267140"",""8267140"",""24224830"",""23002292"",""14532163"",""14532163"",""14532163""]",1615487905,2 years ago,,,0,New Deck List For The 2020 Format Of Domain Monarchs,"This deck is the new domain monarch decklist, the consistency is mostly fixed but still get some bad hands sometimes. I have been working on this decklist for a couple of months so here it is!"
111670,sea-serpent-deck-111670,Sea Serpent Deck,10485110,33074,Meta Decks,"[""10485110"",""47826112"",""37721209"",""37721209"",""43797906"",""43797906"",""20470500"",""20470500"",""74311226"",""74311226"",""64342551"",""64342551"",""65496056"",""17214465"",""28754338"",""42463414"",""42463414"",""78868119"",""78868119"",""29047353"",""3136426"",""83746708"",""56747793"",""56747793"",""295517"",""295517"",""295517"",""51562916"",""51562916"",""72302403"",""72302403"",""54175023"",""43889633"",""18605135"",""50323155"",""50323155"",""77538567"",""77538567"",""96404912"",""47475363"",""47475363"",""62279055"",""40838625"",""40838625""]","[""76891401"",""76891401""]","[""8267140"",""8267140"",""8267140"",""24224830"",""23002292"",""14532163"",""14532163"",""14532163""]",1615487905,2 years ago,,,0,The Ocean Lords,Wipe out the entire field
111666,new-moon-of-blood-111666,New Moon of Blood,93713837,34160,Fun/Casual Decks,"[""22056710"",""4918855"",""82962242"",""6917479"",""79523365"",""40607210"",""34294855"",""36352429"",""53839837"",""33438666"",""14212201"",""58947797"",""6039967"",""1371589"",""1371589"",""1371589"",""80485722"",""80485722"",""80485722"",""26495087"",""26495087"",""26495087"",""88728507"",""88728507"",""88728507"",""56387350"",""56387350"",""56387350"",""70645913"",""70645913"",""70645913"",""34250214"",""34250214"",""34250214"",""5795882"",""5795882"",""5795882"",""62188962"",""62188962"",""62188962"",""69700783"",""69700783"",""69700783"",""53167658"",""53167658"",""53167658"",""60577362"",""60577362"",""60577362"",""68688135"",""68688135"",""68688135"",""31189536"",""31189536"",""31189536"",""22900598"",""22900598"",""22900598""]","[""93713837"",""32302078"",""38250531"",""37129797"",""37129797"",""37129797""]","[""30494314"",""30494314"",""30494314"",""7953868"",""7953868"",""7953868"",""53090623"",""53090623"",""53090623""]",1615487905,2 years ago,,,0,The main idea behind this strategy is to eliminate key cards in your opponent's Deck and controlling their field.,"<span>The archetype is supported by the Field Spell Card ""Vampire Kingdom"". The card is designed to augment the effects of ""Vampire Lord"", ""Vampire Lady"", ""Vampire Duke"" and ""Vampire Grace"". The Trap Card, ""Vampire Takeover"", is very handy for getting ""Kingdom"" onto the field, and as well as a free Special Summon from your Graveyard.</span>  <span>""Vampires"" make an effective Xyz Monster Deck. Using the effects of ""Shadow Vampire"" and ""Vampire Duke"" to Special Summon Level 5 DARK ""Vampires"" (such as each other or ""Vampire Lord"") and Overlay for the boss of the Deck: ""Crimson Knight Vampire Bram"". You can also use ""Vampire's Curse"" and ""Vampire Grace"" for Rank 6 plays (such as the unorthodox, yet still thematically fitting Number 24: Dragulas the Vampiric Dragon).</span>  <span>""Vampires"" obtained new support revolving around paying Life Points as costs to Special Summon themselves from the Graveyard and search other ""Vampire"" cards and taking control of the opponent's monsters, often by Special Summoning opposing Monsters that were destroyed by battle with a ""Vampire"". This also facilitates the Xyz Summon of ""Damphir Vampire Sheridan"" as it can treat monsters the player controls that are owned by the opponent as Level 6 when used for its Xyz summoning. The Life Point costs can then be recovered with the use of ""Vampire's Domain"".</span>  <span>""Vampire Domain"" allows an additional Normal Summon of a ""Vampire"" monster, this works in tandem with the Link Monster ""Vampire Sucker"", which allows the player to tribute the opponent's Zombie type monsters for the Tribute Summon of a ""Vampire"", it can also special summon a monster from the opponent's Graveyard to their field as a Zombie type so it can be used as tribute.</span>"
111656,ignister-eternity-111656,Ignister Eternity,11738489,34159,Meta Decks,"[""71278040"",""71278040"",""71278040"",""82257671"",""82257671"",""8567955"",""8567955"",""8567955"",""16020923"",""16020923"",""16020923"",""88413677"",""88413677"",""42429678"",""42429678"",""14558128"",""14558128"",""14558128"",""15808381"",""15808381"",""15808381"",""41306080"",""78751195"",""35261759"",""35261759"",""57160136"",""57160136"",""57160136"",""73628505"",""83764719"",""8267140"",""8267140"",""22933016"",""22933016"",""24224830"",""86449372"",""86449372"",""59054773"",""59054773"",""59054773""]","[""63533837"",""98506199"",""61399402"",""61399402"",""11738489"",""68934651"",""21887175"",""86066372"",""97383507"",""97383507"",""59859086"",""52698008"",""65741786"",""24842059"",""24842059""]","[""59438930"",""59438930"",""59438931"",""62111090"",""18144507"",""54693926"",""59332125"",""73468603"",""76375976"",""10045474"",""10045474"",""10045474"",""23002292"",""41420027"",""41420027""]",1615487905,2 years ago,,,1,"Swarm the field and then Link, XYZ Summon, and Synchro Summon into whatever the situation calls for!","@Ignisters! Everyone thinks they can't do anything, and it's true that often they rely on the field spell. However, there are multiple strategies and ways to play through various negates as well as just create different boss monsters depending on the situation!  First of all, the monster 3-ofs. You've got a lot here, Pikari is your spell searcher (usually A.I. Land but also A.I.dle Reborn for graveyard recursion and TA.I. Strike for battle phase shenanigans), Balancer Lord allows synergy with Cyberse Wicckid, Parallel eXceed furthers your Link plays, and Achichi serves as a monster searcher. Along with these, Bururu at 2 is needed for Synchro plays but you don't want to see it in your hand (it's not a Garnet by any means, but is more useful in Wicckid combos from the deck). Doyon is run at 2 in order to recycle your @Ignister monsters and spells (very versatile), while Gatchiri is an extender that protects your Link monsters if used as material or just your Cyberse monsters when on the field. Doshin and Hiyari are also one-of extenders that special summon themselves for free, but they can be cut if need be.  Moving on to spells, I run 3 Cynet Mining (needed for any Cyberse deck) as well as 3 A.I. Land with 1 Terraforming (as I said above, really helps your plays). I also run 2 A.I.dle Reborn and 1 Monster Reborn for GY recursion (you could run 3 A.I.dle Reborn, but I feel safer at 2). I also run 2 TA.I. Strike for Battle Phase shenanigans (always fun to kill a Link God Dragon with a Pikari), and 2 Pot of Desires for draw power (you don't have much).  This leaves room for hand traps and other fun spells, I personally run 2 Cosmic Cyclone, 1 Called by the Grave, and 3 Ash Blossom in my main deck, but these can be exchanged with anything that's relevant for the current format.  Your Extra Deck is extremely tight, not because you're limited to a few options, but because you have so many plays that you can pull off. Starting with relatively common combo starters, I run 1 Cyberse Wicckid and 1 Splash Mage. Cyberse Wicckid is very useful with Balancer Lord to add from the deck and then special summon a Bururu from the hand, while Splash Mage is good to go into if you don't have that Balancer Lord in the GY. I also run 2 Linguriboh, because you need easy special summons from the Extra Deck as well as an easy way to free up the main monster zones if needed. 2 Dark Templars are necessary for this deck, being the main combo extender, but after this you can get extremely creative (as long as you use Cyberse Extra Deck monsters).  If you need to safely break a board and OTK, the 1 Accesscode Talker is a very good option. If you need to destroy opponent's monsters while providing protection for your own, summon one of the 2 Light Dragon @Ignisters. If you need to destroy opponent's spells and traps, summon the 1 Wind Pegasus @Ignister. If you wipe the board with Wind Pegasus and Light Dragon, go into the 1 Firewall Dragon Darkfluid with 2 counters to not only negate monster effects if need be but also just OTK. If you just need a Towers, summon the 1 Arrival Cyberse @Ignister. If you need to protect your Links (usually Accesscode), Synchro into Cyberse Quantum Dragon. And finally, if it's turn one or you really need to out an opponent's monster, go into the 1 I:P Masquerena and then the 1 Mekk-Knight Crusadia Avramax.  The side deck is pretty simple, just fill with whatever hand-traps you have at the time to fight the Meta (my current list is just what I own currently). However, leave 2 spots for Earth Golem @Ignister and A.I. Love Fusion. If your opponent is using a Link-heavy deck like Salamangreats or Sky Striker, simply side this in and watch your opponent's fast as you fusion summon using their own Link monsters. Think Super Polymerization but without the discard.  &nbsp;  And that's @Ignisters! I'll explain the main combo piece that you want to get out with your deck. Normal Summon Balancer Lord, use his effect, and then Normal Summon Pikari. From here, go into Cyberse Wicckid and Special Summon any Ignister or Parallel eXceed from hand, banish Balancer Lord using Wicckid, and then Special Summon the Bururu you add off of Lord. Link into Dark Templar using 3 different named monsters, then special summon any monster to a zone it points to (either turn an eXceed into Linguriboh or special summon another Ignister from hand). From here, you can do pretty much anything you want to go into! This combo runs very similarly if you go into Splash Mage, it really just depends on what cards you're working with. I hope y'all learned something about this new Cyberse powerhouse, good luck Duelists!"
111648,draitron-pure-build-genisis-impact-111648,Draitron Pure Build (Genisis Impact),69815951,34026,Meta Decks,"[""14558128"",""14558128"",""14558128"",""38814750"",""92919429"",""92919429"",""97148796"",""97148796"",""97148796"",""33543890"",""60037599"",""60037599"",""60037599"",""22420202"",""22420202"",""96026108"",""96026108"",""96026108"",""69815951"",""95209656"",""52068432"",""4810828"",""77235086"",""77235086"",""99427357"",""51405049"",""51405049"",""60600126"",""60600126"",""60600126"",""73628505"",""81439174"",""94187078"",""94187078"",""94187078"",""22398665"",""22398665"",""58793369"",""58793369"",""58793369""]","[""79606837"",""79606837"",""81846453"",""90448279"",""48608796"",""85289965"",""4280258"",""38342335"",""50588353"",""65741786"",""2220237"",""41999284"",""60303245"",""94259633""]","[""49036338"",""27204311"",""27204311"",""27204311"",""38814750"",""38814750"",""19025379"",""89463537"",""18144506"",""54693926"",""54693926"",""54693926"",""15693423"",""15693423"",""15693423""]",1615487905,2 years ago,,,0,This should be my last Draitron Deck ,The deck strategy it the same one i put in my Invoked build (without the invoked) so if you want to check that out the link will be here  ===== https://ygoprodeck.com/draitron-invoked-updated-with-a-new-combo/ =====  &nbsp;  This build is pretty much the same but it has a slightly more consistent Draitron engine and is more focused on breaking boards (Nekroz of Unicore is there for going first along with Lord of the Red)
111640,dragon-destruction-111640,Dragon Destruction,55410871,34157,Fun/Casual Decks,"[""55410871"",""55410871"",""55410871"",""21082832"",""21082832"",""46052429"",""46052429"",""34627841"",""34627841"",""79814787"",""79814787"",""79814787"",""24094653"",""24094653"",""24094653"",""89631139"",""89631139"",""89631139"",""14731897"",""55948544"",""81332143"",""37812118"",""37812118"",""79571449"",""79571449"",""66574418"",""66574418"",""74677422"",""74677422"",""30079770"",""30079770"",""94693857"",""94693857"",""94693857"",""59368956"",""59368956"",""75944053"",""75944053"",""59368956"",""75944053""]","[""56532353"",""56532353"",""23995346"",""23995346"",""23995346"",""2129638"",""2129638""]","[""56532353""]",1615487905,2 years ago,,,0,It is just a deck i made for Legacy Of the Duelist Link Evolution So it Does Have A Couple Banned Cards sorry ; )    Here's the the link to the update,It is just a deck i made for Legacy Of the Duelist Link Evolution So it Does Have A Couple Banned Cards sorry ; ) Here's the the link to the updated version https://ygoprodeck.com/dragon-destruction-updated/
111634,meta-nephthys-vanity-dragunity-111634,meta nephthys vanity dragunity,11969228,34156,Meta Decks,"[""72634965"",""80701178"",""80701178"",""80701178"",""18474999"",""18474999"",""18474999"",""61901281"",""99234526"",""53303460"",""53303460"",""53303460"",""82085295"",""82085295"",""82085295"",""29253591"",""29253591"",""52904476"",""52904476"",""8972398"",""77235086"",""77235086"",""77235086"",""8454126"",""8454126"",""8454126"",""88176533"",""88176533"",""88176533"",""13048472"",""13048472"",""13048472"",""57995165"",""57995165"",""57995165"",""96729612"",""96729612"",""96729612"",""23459650"",""23459650"",""23459650"",""60004971""]","[""88234821"",""12496261"",""79606837"",""79606837"",""79606837"",""85289965"",""86066372"",""23935886"",""49725936"",""38342335"",""2857636"",""11969228"",""34989413"",""65741786"",""86148577""]","[""18144507"",""37520316"",""14532163"",""14532163"",""14532163"",""54693926"",""54693926"",""54693926"",""37818794"",""6172122"",""46986414"",""74677422"",""70369116"",""70369116"",""82385847""]",1615487905,2 years ago,,,1,"flood gate 1 negate/banish and 4 no target destructions, very consistent","to do the combo you will need in hand benten, connector and the ritual spell  <img src=""https://cdn.discordapp.com/attachments/657687813793382410/755069993695313920/unknown.png"" alt=""image"" />  step 1 summon 2 random impcantations  <img src=""https://cdn.discordapp.com/attachments/657687813793382410/755070537671376916/unknown.png"" alt=""image"" />  step 2 ritual summon connector using benten, search vanity and summon devote and matriarch  <img src=""https://cdn.discordapp.com/attachments/657687813793382410/755078286450884648/unknown.png"" alt=""image"" />  step 3 tribute 2 impcatation into vanity  step 4 make reprodocus with connector and devote, bring back devote and change tipe to dragon  <img src=""https://cdn.discordapp.com/attachments/657687813793382410/755078996114407465/unknown.png"" alt=""image"" />  step 5 make draco masters and elpy  step 6 use elpy to bring brotaur and search black dragon collapserpent  <img src=""https://cdn.discordapp.com/attachments/657687813793382410/755079728372908072/unknown.png"" alt=""image"" />  step 7 make romulus search lance and couse  step 8 summon black dragon and couse  <img src=""https://cdn.discordapp.com/attachments/657687813793382410/755080308344225872/unknown.png"" alt=""image"" />  step 9 make luin search white dragon and bring back couse  <img src=""https://cdn.discordapp.com/attachments/657687813793382410/755081159775617094/unknown.png"" alt=""image"" />  end board make areadbhair and accesscode  if your opponent always have board breakers like dropplet dark ruler use dragoon engine"
111628,clear-vice-dragon-deck-we-need-support-beast-eyes-pendulum-111628,"Clear vice dragon deck,(WE NEED SUPPORT),Beast-Eyes Pendulum",97811903,25969,Fun/Casual Decks,"[""91697229"",""91697229"",""93018428"",""73304257"",""73304257"",""73304257"",""43316238"",""43316238"",""97811903"",""97811903"",""88264978"",""50383626"",""93969023"",""93969023"",""93969023"",""67748760"",""68464358"",""32476603"",""26655293"",""79109599"",""79109599"",""79109599"",""74677422"",""55343236"",""62265044"",""36668118"",""33900648"",""33900648"",""38120068"",""38120068"",""24094653"",""24094653"",""11827244"",""83764718"",""87571563"",""87571563"",""23924608"",""5133471"",""6853254"",""6853254""]","[""37818794"",""72378329"",""72378329"",""72378329"",""41999284"",""63767246"",""5821478"",""24361622"",""27548199"",""13143275"",""73539069"",""86148577"",""23732205"",""11969228"",""98630720""]","[""74997493"",""24094653"",""43316238""]",1615487905,2 years ago,,,0,https://youtu.be/KG8soiDqSi0,https://youtu.be/KG8soiDqSi0
111624,pure-zombie-2020-111624,Pure Zombie 2020,39185163,15959,Non-Meta Decks,"[""39185163"",""39185163"",""36016907"",""36016907"",""6039967"",""52350806"",""52350806"",""52350806"",""66570171"",""66570171"",""66570171"",""52467217"",""92826944"",""92826944"",""94801854"",""94801854"",""94801854"",""49959355"",""49959355"",""49959355"",""14558127"",""14558127"",""14558127"",""73642296"",""73642296"",""73642296"",""76218313"",""92964816"",""92964816"",""81439173"",""83764718"",""48130397"",""48130397"",""48130397"",""4064256"",""4064256"",""4064256"",""90846359"",""90846359"",""90846359""]","[""8198620"",""41209827"",""83283063"",""74586817"",""28240337"",""90590303"",""85289965"",""2645637"",""2857636"",""37129797"",""37129797"",""91420202"",""50588353"",""83152482"",""41999284""]","[""74997493"",""24094653"",""43316238""]",1615487905,2 years ago,,,2,Pure Zombie deck that prioritises lockdown and control.,"<h2><strong><span>ZOMBIE DECK COMBOS!!!</span></strong></h2> <h3><span>Combo 1: 2 Card Buster Lock + Baladroch</span></h3> <ol>  	<li><span>You need Uni-Zombie and either Mezuki or Necroworld Banshee in hand.</span></li>  	<li><span>Normal summon Uni and discard one of the above cards and send the other from the deck to the graveyard.</span></li>  	<li><span>Revive Banshee with Mezuki effect.</span></li>  	<li><span>Summon Halqifibrax and chain the effect of Banshee to Halqifibrax's effect to get Zombie World on the field.</span></li>  	<li><span>Summon Glow-Up Bloom with Halqifibrax.</span></li>  	<li><span>Link summon Union Carrier with Halqifibrax and Glow-Up Bloom.</span></li>  	<li><span>Banish Glow-Up Bloom to summon Doomking Baladroch.</span></li>  	<li><span>Equip Dragon Buster Destruction Sword to Baladroch with Carrier.</span></li>  	<li><span>You have a 3800 atk baladroch and a buster lock.</span></li> </ol> <span>(If you open Shiranui Solitaire and Mezuki/Banshee the combo works too)</span> <h3><span>Combo 2: Rivalry Lockdown</span></h3> <span>This isn't an extensive combo, but rather a combination of cards that can result in a powerful lockdown.</span> <ol>  	<li>You need to have Rivalry of Warlords in hand along with either Zombie World or at the very least access to Zombe World like Necroworld Banshee.</li>  	<li>With both Zombie World and Rivalry of Warlords on the field, unless your opponent is playing a Zombie deck or Zombie monsters consistently, they will be locked out of more than 1 monster.</li>  	<li>Rulings state that while Rivalry is out you cannot summon a mnster with a different type to what is on the field, and since Zombie World changes the type of all monsters on the field it means your opponent cannot summon anything except zombies.</li>  	<li>This also locks them out of the extra deck since the monster on field is a different type to whats in their extra deck, meaning they can't summon.</li> </ol>"
111620,domain-monarchs-2020-post-sept-banlist-111620,Domain Monarchs 2020 (Post Sept. banlist),96570609,15959,Non-Meta Decks,"[""23064604"",""23064604"",""23064604"",""96570609"",""96570609"",""96570609"",""47084486"",""47084486"",""47084486"",""33746252"",""57666212"",""35595518"",""35595518"",""59463312"",""59463312"",""59463312"",""95457011"",""95457011"",""95457011"",""2295440"",""22842126"",""22842126"",""22842126"",""33609262"",""33609262"",""33609262"",""81439173"",""79844764"",""79844764"",""79844764"",""61466310"",""61466310"",""61466310"",""84171830"",""84171830"",""84171830"",""18235309"",""54241725"",""54241725"",""54241725""]","[""8198620"",""41209827"",""83283063"",""74586817"",""28240337"",""90590303"",""85289965"",""2645637"",""2857636"",""37129797"",""37129797"",""91420202"",""50588353"",""83152482"",""41999284""]","[""74997493"",""24094653"",""43316238""]",1615487905,2 years ago,,,0,"Full power Domain Monarch deck. Welcome back Pantheism, we missed you.",<span>Focuses on locking out your opponents extra deck.</span>
111616,yosenju-hurricane-111616,Yosenju Hurricane,93368494,28367,Anime Decks,"[""10612222"",""10612222"",""10612222"",""54903668"",""54903668"",""54903668"",""54880296"",""54880296"",""54880296"",""25244515"",""25244515"",""25244515"",""91420254"",""91420254"",""91420254"",""65025250"",""65025250"",""65025250"",""58981727"",""58981727"",""58981727"",""69838592"",""69838592"",""69838592"",""61884774"",""61884774"",""61884774"",""39853199"",""39853199"",""39853199"",""49249907"",""49249907"",""49249907"",""23740893"",""23740893"",""23740893"",""28630501"",""28630501"",""28630501"",""92246806"",""92246806"",""92246806"",""65247798"",""65247798"",""65247798"",""85970321"",""85970321"",""85970321"",""79861914"",""79861914"",""79861914"",""27918963"",""27918963"",""27918963"",""21364070"",""21364070"",""21364070"",""93368494"",""93368494"",""93368494""]","[""8198620"",""41209827"",""83283063"",""74586817"",""28240337"",""90590303"",""85289965"",""2645637"",""2857636"",""37129797"",""37129797"",""91420202"",""50588353"",""83152482"",""41999284""]","[""62681049"",""62681049"",""62681049""]",1615487905,2 years ago,,,0,Yosenjus will blow you off your feet. Literally.,"<span>This is a Yosenju deck fro Yu-Gi-Oh! Arc-V</span>  <span>Use sinchus L and R to summon Daibak and Hitot. If your opponent tries to attack, summon oyam to take the hit and get a new oyam.</span>"
