deck_num,pretty_url,deck_name,cover_card,userid,format,main_deck,extra_deck,side_deck,ts_submit_date,submit_date,ts_edit_date,edit_date,comments,deck_excerpt,deck_description
277652,swordsoul-master-duel-277652,Swordsoul (Master Duel),84815190,33962,Master Duel Decks,"[""87052196"",""87052196"",""87052196"",""23431858"",""23431858"",""24557335"",""93490856"",""93490856"",""93490856"",""56495147"",""56495147"",""20001443"",""20001443"",""20001443"",""55273560"",""55273560"",""55273560"",""14558128"",""14558128"",""14558128"",""97268402"",""97268402"",""97268402"",""98159737"",""98159737"",""56465981"",""56465981"",""56465981"",""65124425"",""65124425"",""65124425"",""93850690"",""93850690"",""24224830"",""24224830"",""10045474"",""10045474"",""10045474"",""14821890"",""14821890""]","[""96633955"",""84815190"",""92519087"",""9464441"",""5041348"",""69248256"",""69248256"",""83755611"",""43202238"",""23935886"",""78917791"",""32519092"",""32519092"",""32519092""]","[""94145021"",""94145021"",""94145021"",""54693926"",""54693926"",""54693926"",""8267140"",""8267140"",""8267140"",""83326048"",""83326048"",""83326048"",""7811875"",""7811875"",""7811875""]",1652639905,10 months ago,,,0,Wyrm it up brother ,Write your deck strategy here....
277648,toon-budget-deck-277648,Toon Budget Deck,21296502,110760,Fun/Casual Decks,"[""7171149"",""7171149"",""53183600"",""53183600"",""61190918"",""28112535"",""21296502"",""21296502"",""31733941"",""31733941"",""91842653"",""90960358"",""90960358"",""83629030"",""15270885"",""42386471"",""42386471"",""65458948"",""64116319"",""64116319"",""64631466"",""64631466"",""16392422"",""16392422"",""15259703"",""15259704"",""15259703"",""15259704"",""15259703"",""15259704"",""70560957"",""70560957"",""41426869"",""41426869"",""89997728"",""89997728"",""89997728"",""43509019"",""53094821"",""5832914"",""5832914"",""79447365"",""79447365""]","[""96633955"",""84815190"",""92519087"",""9464441"",""5041348"",""69248256"",""69248256"",""83755611"",""43202238"",""23935886"",""78917791"",""32519092"",""32519092"",""32519092""]","[""94145021"",""94145021"",""94145021"",""54693926"",""54693926"",""54693926"",""8267140"",""8267140"",""8267140"",""83326048"",""83326048"",""83326048"",""7811875"",""7811875"",""7811875""]",1652639905,10 months ago,,,0,Toon,Summon Toon monsters
277641,dragonmaid-branded-despia-event-fusion-festival-277641,Dragonmaid Branded Despia - Event Fusion Festival,24799107,110113,Master Duel Decks,"[""32600024"",""32600024"",""32600024"",""16960120"",""88453933"",""88453933"",""88453933"",""40398073"",""76782778"",""15848542"",""42055234"",""25451383"",""68468459"",""68468459"",""68468459"",""36577931"",""62962630"",""99456344"",""38814750"",""38814750"",""49036338"",""14558127"",""14558127"",""23434538"",""23434538"",""99543666"",""34995106"",""36637374"",""40110009"",""78231355"",""78231355"",""78231355"",""14625090"",""48130397"",""48130397"",""24224830"",""24224830"",""24299458"",""24299458"",""57416183"",""57416183"",""57416183""]","[""24799107"",""24799107"",""24799107"",""41232647"",""41232647"",""41232647"",""87746184"",""72272462"",""18666161"",""41209827"",""41209827"",""41209827"",""1906812"",""34848821"",""41373230""]",,1652639905,10 months ago,,,0,Dragonmaid,
277637,zombie-world-competitive-277637,Zombie World Competitive,39185163,109779,Non-Meta Decks,"[""39185163"",""39185163"",""66570171"",""66570171"",""92964816"",""92964816"",""49959355"",""49959355"",""49959355"",""94801854"",""94801854"",""92826944"",""92826944"",""52467217"",""52467217"",""33420078"",""70711847"",""70711847"",""52350806"",""52350806"",""77428945"",""43694650"",""14558127"",""14558127"",""14558127"",""97268402"",""97268402"",""81439173"",""1845204"",""63854005"",""63854005"",""63854005"",""4064256"",""4064256"",""4064256"",""48130397"",""48130397"",""48130397"",""90846359"",""90846359"",""90846359""]","[""37129797"",""50588353"",""70369116"",""85289965"",""8198620"",""41209827"",""58528964"",""96334243"",""28240337"",""3040496"",""34408491"",""27548199"",""59843383"",""50091196"",""95992081""]","[""43898403"",""43898403"",""23002292"",""23002292"",""78765160"",""78765160"",""74798297"",""4333086"",""15693423"",""10045474"",""10045474"",""73642296"",""73642296"",""59438930"",""59438930""]",1652639905,10 months ago,,,0,Zombie World Danger Control,Normal Zombie machine with Dangers to support it and crazy boss monsters and control
277633,gx-format-277633,GX Format,98045062,106473,Fun/Casual Decks,"[""77585513"",""77585513"",""32619583"",""32619583"",""32619583"",""6214884"",""6214884"",""71218746"",""71218746"",""33731070"",""33731070"",""33731070"",""78010363"",""78010363"",""79126789"",""23205979"",""23205979"",""40640057"",""57953380"",""12923641"",""70828912"",""18161786"",""18161786"",""72892473"",""72892473"",""53129443"",""53129443"",""93554166"",""93554166"",""42703248"",""69162969"",""69162969"",""83764719"",""67169062"",""98045062"",""93431518"",""93431518"",""5318639"",""77414722"",""4178474"",""4178474"",""4178474"",""53582587""]","[""37129797"",""50588353"",""70369116"",""85289965"",""8198620"",""41209827"",""58528964"",""96334243"",""28240337"",""3040496"",""34408491"",""27548199"",""59843383"",""50091196"",""95992081""]","[""16956455"",""16956455""]",1652639905,10 months ago,,,0,lok at my crads,Look at New cards
277629,zombie-world-competitive-277629,Zombie World Competitive,39185163,109779,Non-Meta Decks,"[""39185163"",""39185163"",""66570171"",""66570171"",""92964816"",""92964816"",""49959355"",""49959355"",""49959355"",""94801854"",""94801854"",""92826944"",""92826944"",""52467217"",""52467217"",""33420078"",""70711847"",""70711847"",""52350806"",""52350806"",""77428945"",""43694650"",""14558127"",""14558127"",""14558127"",""97268402"",""97268402"",""81439173"",""1845204"",""63854005"",""63854005"",""63854005"",""4064256"",""4064256"",""4064256"",""48130397"",""48130397"",""48130397"",""90846359"",""90846359"",""90846359""]","[""37129797"",""50588353"",""70369116"",""85289965"",""8198620"",""41209827"",""58528964"",""96334243"",""28240337"",""3040496"",""34408491"",""27548199"",""59843383"",""50091196"",""95992081""]","[""43898403"",""43898403"",""23002292"",""23002292"",""78765160"",""78765160"",""74798297"",""4333086"",""10045474"",""15693423"",""10045474"",""73642296"",""73642296"",""59438930"",""59438930""]",1652639905,10 months ago,,,0,Zombie World Control ,Normal zombie world play with amazing control potential and boss monsters
277617,exodia-ntr-277617,Exodia (NTR),33396948,111714,Fun/Casual Decks,"[""7902349"",""44519536"",""70903634"",""8124921"",""33396948"",""31560081"",""31560081"",""31560081"",""34124316"",""59383041"",""70791313"",""70791313"",""70791313"",""31786629"",""31786629"",""31786629"",""72892473"",""79571449"",""55144522"",""96677818"",""96677818"",""90928333"",""90928333"",""90928333"",""98494543"",""98494543"",""98494543"",""74848038"",""74848038"",""74848038"",""22589918"",""22589918"",""22589918"",""89997728"",""89997728"",""89997728"",""70368879"",""70368879"",""3280747"",""37576645""]","[""37129797"",""50588353"",""70369116"",""85289965"",""8198620"",""41209827"",""58528964"",""96334243"",""28240337"",""3040496"",""34408491"",""27548199"",""59843383"",""50091196"",""95992081""]","[""43898403"",""43898403"",""23002292"",""23002292"",""78765160"",""78765160"",""74798297"",""4333086"",""10045474"",""15693423"",""10045474"",""73642296"",""73642296"",""59438930"",""59438930""]",1652639905,10 months ago,,,0,An Exodia deck for Nightmare Troubadour (2005).,"Note that Magical Stone Excavation is localized as Excavation of Mage Stones and Spellbook Organization is localized as Pigeonholing Books of Spell.  This deck is intended for the 2005 DS game, Nightmare Troubadour. It's mostly for me to plan out what cards I want before I get them, so be advised that this is largely untested. The hope is that RML has enough spell fodder to get plusses. Thunder dragon is there to thin out the deck, although it might be prudent to replace him with Foolish Burial to get the Exodia pieces out of the way (you can get them back to the hand using Dark Factory and Monster Reincarnation). On the other hand, he's a great target for Card Destruction, so maybe not? Toon Alligator is there so that you can use all three Contents instead of awkwardly having one left over but he might end up being a brick in the hand. The rest should be pretty self-explanatory."
277599,malefic-adventure-277599,Malefic Adventure,48829461,107694,Fun/Casual Decks,"[""16958382"",""16958382"",""16958382"",""1710476"",""1710476"",""1710476"",""36521459"",""36521459"",""36521459"",""2563463"",""14558127"",""14558127"",""14558127"",""30680659"",""30680659"",""30680659"",""96399967"",""96399967"",""96399967"",""74509280"",""74509280"",""48829461"",""48829461"",""48829461"",""39568067"",""73628505"",""269012"",""269012"",""3285551"",""3285551"",""27564031"",""27564031"",""27564031"",""75223115"",""75223115"",""75223115"",""18378992"",""18378992"",""18378992"",""82732705"",""82732705"",""82732705""]","[""8310162"",""8310162"",""8310162"",""1546123"",""1546123"",""1546123"",""44508094"",""44508094"",""44508094"",""56910167"",""42632209"",""42632209"",""21435914"",""84815190"",""84815190""]","[""73642296"",""73642296"",""94145021"",""94145021"",""73468603"",""76375976"",""76375976"",""68462976"",""68462976"",""59160188"",""59160188"",""4064256"",""4064256""]",1652639905,10 months ago,,,0,Malefic that actually work for once.(can be low meta tier with some fine tuning),"Malefic alone aren't the best because while they can spam buff monsters in the blink of an eye, they don't do anything else. so, I added adventure engine as just a quick way to get a negate, added ash blossom, skill drain becaus it lets you spam Malefics and hurts your opponent. This is the most efficient Malefic deck Ive played, able to generally end up with up to three negates and a buff 4000/4000 or two out on your field turn one. But it still needs some fine tuning.  &nbsp;  Tip:  Gizmek Naganaki can tribute itself to summon Paradox gear from the deck, Paradox gear can then tribute itself to summon paralell gear and add Malefic stardust dragon to your hand, then, use both those Malefics for Baronne De Fleur for a negate, or Dragocytos for another buff attacker. Or add Raradigm dragon/Malefic cyber end dragon to go into Geomathmech final sigma."
277594,albaz-strike-budget-deck-for-locals-277594,Albaz Strike Budget Deck For Locals,68468459,112864,Fun/Casual Decks,"[""97268402"",""97268402"",""97268402"",""59438930"",""59438930"",""59438930"",""48048590"",""48048590"",""48048590"",""45484331"",""45484331"",""45484331"",""423585"",""423585"",""423585"",""68468459"",""68468459"",""25451383"",""19096726"",""44362883"",""44362883"",""44362883"",""49238328"",""49238328"",""49238328"",""18973184"",""18973184"",""54693926"",""54693926"",""34995106"",""24224830"",""75500286"",""18144507"",""50078509"",""50078509"",""50078509"",""23924608"",""23924608"",""17751597"",""81767888""]","[""87746184"",""87746184"",""87746184"",""44146295"",""44146295"",""44146295"",""70534340"",""70534340"",""70534340"",""34848821"",""34848821"",""1906812"",""1906812"",""41373230"",""41373230""]","[""28674152"",""28674152"",""48770333"",""48770333"",""20292186"",""54693926"",""59919307"",""59919307"",""59919307"",""83326048"",""83326048"",""83326048"",""24207889"",""24207889"",""24207889""]",1652639905,10 months ago,,,0,Built with x3 Albaz Strike Structure Decks and some additional cards.,Springans Kitt and Keeper of Dragon Magic searches for Branded Fusion to start your fusion plays. Summoner Monk and Tri-Brigade Mercourier (when banished) searches for Springans Kitt. If Albion the Shrouded Dragon is in your hand then you can activate its effect to send 1 Branded Lost from your deck to the GY to draw 1 card. Fiendish Chain stops attacks and prevents monster effects. Harpie's Feather Duster and Heavy Storm Duster destroy spells and traps.
277589,elemental-hero-neo-bubbleman-deck-my-favorite-hero-and-yours-277589,"Elemental Hero Neo Bubbleman deck,my favorite hero and yours",5285665,25969,Fun/Casual Decks,"[""13256226"",""13256226"",""13256226"",""59392529"",""59392529"",""59392529"",""5285665"",""79979666"",""79979666"",""79979666"",""40740224"",""40740224"",""40740224"",""213326"",""213326"",""213326"",""16169772"",""16169772"",""16169772"",""18144506"",""23587624"",""23587624"",""23587624"",""45906428"",""45906428"",""45906428"",""98804359"",""98804359"",""98804359"",""21143940"",""21143940"",""21143940"",""61968753"",""80075749"",""53586134"",""53582587"",""53582587"",""75047173"",""75047173"",""75047173""]","[""32828466"",""5128859"",""29095552"",""29095552"",""29095552"",""40854197"",""40854197"",""40854197"",""55171412"",""10920352"",""52031567"",""81197327"",""14225239"",""90590303"",""46772449""]","[""89943723"",""5285665"",""5285665"",""17955766"",""8949584"",""8949584"",""89058026"",""53582587""]",1652639905,10 months ago,,,2,https://youtu.be/1mi_azIRmQA,https://youtu.be/1mi_azIRmQA
277585,the-ruins-are-falling-277585,the ruins are falling,21466326,113659,Fun/Casual Decks,"[""89631139"",""89631139"",""53183600"",""423585"",""70791313"",""70791313"",""70791313"",""79814787"",""79814787"",""79814787"",""35726888"",""38120068"",""38943357"",""41620959"",""43422537"",""48800175"",""70368879"",""72892473"",""73628505"",""74029853"",""74029853"",""74029853"",""74117290"",""89997728"",""89997728"",""89997728"",""93946239"",""74519184"",""74519184"",""15259703"",""15259704"",""41587307"",""41587307"",""42199039"",""42199039"",""42199039"",""39910367"",""39910367"",""21466326"",""21466326"",""21466326""]","[""32828466"",""5128859"",""29095552"",""29095552"",""29095552"",""40854197"",""40854197"",""40854197"",""55171412"",""10920352"",""52031567"",""81197327"",""14225239"",""90590303"",""46772449""]","[""89943723"",""5285665"",""5285665"",""17955766"",""8949584"",""8949584"",""89058026"",""53582587""]",1652639905,10 months ago,,,0,asdfasdfa,dont run from fate
277581,shadoll-277581,Shadoll,74822425,42174,Non-Meta Decks,"[""92079625"",""3717252"",""3717252"",""3717252"",""77723643"",""77723643"",""66675911"",""66675911"",""30328508"",""52551211"",""97518132"",""51023024"",""51023024"",""4939890"",""24635329"",""24635329"",""24635329"",""37445295"",""37445295"",""37445295"",""60226558"",""60226558"",""60226558"",""81788994"",""81788994"",""81788994"",""44394295"",""44394295"",""44394295"",""6417578"",""4904633"",""4904633"",""21011044"",""21011044"",""78942513"",""78942513"",""23912837"",""23912837"",""77505534"",""77505534""]","[""74822425"",""19261966"",""20366274"",""48424886"",""50907446"",""74009824"",""94977269"",""86938484"",""86938484"",""86938484""]","[""89943723"",""5285665"",""5285665"",""17955766"",""8949584"",""8949584"",""89058026"",""53582587""]",1652639905,10 months ago,,,0,Not competitive deck,Not competitive deck
277567,aromage-deck-ft-starving-venom-277567,Aromage Deck ft Starving venom,41209828,102596,Non-Meta Decks,"[""85967160"",""40663548"",""22174866"",""35272499"",""61677004"",""29177818"",""29177818"",""14558127"",""14558127"",""96789758"",""96789758"",""96789758"",""14169843"",""14169843"",""11747708"",""85431040"",""85431040"",""85431040"",""16759958"",""16759958"",""1845204"",""2295440"",""18144507"",""76647978"",""83764718"",""99674361"",""99674361"",""24224830"",""48130397"",""29189613"",""29189613"",""5050644"",""5050644"",""5050644"",""10045474"",""10045474"",""15177750"",""15177750"",""28265983"",""92266279""]","[""41209828"",""25586143"",""66309175"",""27548199"",""25958491"",""72924435"",""79656239"",""79656239"",""50091196"",""95992081"",""38342335"",""21200905"",""21200905"",""50588353"",""50277355""]","[""49964567"",""48686504"",""48686504"",""60643554"",""60643554"",""96334243"",""95239444"",""2779999"",""2779999""]",1652639905,10 months ago,,,0,Aromage monsters and some predaplants,"seguro se preguntan ""¿que le pasa a este tarado por no llevar a florecimiento de fuego solitario?"" bueno esto es porque no me alcanzó espacio y decidí meter algún método de resurrección para algunos monstruos Boss del deck, este deck de arobruja es bastante técnico y más directo para tener varios negadores en deck y mayormente es para confundir al rival sobre que estamos haciendo y use sus recursos para negar lo ""innecesario"" pero mayormente el deck es funcional. Surely they wonder ""what's wrong with this moron for not leading to Lonefire Blossom?"" well this is because I didn't have enough space and I decided to put some resurrection method for some Boss monsters of the deck, this aromage deck is quite technical and more direct to have several deniers in the deck and mostly it is to confuse the rival about what we are doing and use his resources to negate the ""unnecessary"" but mostly the deck is functional"
277563,d-d-d-277563,D/D/D,9024198,89517,Non-Meta Decks,"[""14558127"",""14558127"",""14558127"",""28406301"",""28406301"",""28406301"",""19580308"",""72291412"",""72181263"",""72181263"",""46796664"",""46796664"",""46796664"",""11609969"",""11609969"",""11609969"",""41546"",""45206713"",""45206713"",""45206713"",""59123937"",""74069667"",""97268402"",""97268402"",""97268402"",""27204311"",""27204311"",""24224830"",""33814281"",""46372010"",""46372010"",""46372010"",""73360025"",""2295440"",""33907039"",""33907039"",""33907039"",""91781484"",""10045474"",""10045474"",""10045474""]","[""16006416"",""74583607"",""74583607"",""82956492"",""84815190"",""44852429"",""46593546"",""46593546"",""71612253"",""79559912"",""3758046"",""90448279"",""9024198"",""9024198"",""9024198""]","[""87170768"",""87170768"",""94145021"",""94145021"",""94145021"",""73642296"",""73642296"",""73642296"",""43534808"",""43534808"",""8267140"",""8267140"",""8267140"",""25311006"",""25311006""]",1652639905,10 months ago,,,0,Solid Tier 2 deck that most players would be able to afford (expensive cards can be swapped out) that can compete with the top decks of the format.,"This is the deck I topped and earned my first National Invitation with (48th/48th place) at the Philadelphia regional this past weekend. On the play, the deck aims to set up a board with varied forms of interaction and sticky monsters to use to beat your opponent down on the crack back. On the draw, it can pivot with different forms of removal to push through boards and either swing over your opponents' monsters or easily access Zeus to wipe the board and combo in MP2. D/D/D is a high ceiling combo deck that can pivot between an aggressive playstyle and a control gameplan depending on what the situation calls for.  Overall a really fun deck that, with enough practice, any player can master and do well with. Any questions, comments or concerns you can msg me on discord @ drop_the_mike04#3517 :)."
277559,dragon-link-albaz-dragunity-60-cards-budget-277559,Dragon Link + Albaz + Dragunity (60 Cards Budget),87746184,13786,Non-Meta Decks,"[""88264978"",""72989439"",""55878038"",""88774734"",""67748760"",""67748760"",""5560911"",""70333910"",""70333910"",""99365553"",""32476603"",""55623480"",""61901281"",""89172051"",""15381421"",""15381421"",""15381421"",""68468459"",""68468459"",""99234526"",""67127799"",""68464358"",""68464358"",""32600024"",""5969957"",""14558127"",""14558127"",""14558127"",""59438930"",""59438930"",""59438930"",""73642296"",""73642296"",""26577155"",""26577155"",""26577155"",""14983497"",""8972398"",""48355999"",""48355999"",""97268402"",""97268402"",""97268402"",""44362883"",""44362883"",""44362883"",""81439174"",""83764718"",""99266988"",""99266988"",""99266988"",""24224830"",""31443476"",""31443476"",""31443476"",""87571563"",""87571563"",""36668118"",""62265044"",""57416183""]","[""44146295"",""70534340"",""87746184"",""9753964"",""3040496"",""27548199"",""50954680"",""34116027"",""63767246"",""85289965"",""8264361"",""11969228"",""29296344"",""24361622"",""73539069""]","[""70534340"",""80666118"",""23732205""]",1652639905,10 months ago,,,0,Dragon Link + Albaz + Dragunity (60 Cards Budget),Dragon Link + Albaz + Dragunity (60 Cards Budget)
277555,dragon-link-handtrap-277555,Dragon Link + Handtrap,9753964,13786,Meta Decks,"[""27204311"",""27204311"",""27204311"",""88264978"",""55878038"",""88774734"",""67748760"",""67748760"",""70333910"",""70333910"",""61901281"",""15381421"",""15381421"",""15381421"",""99234526"",""68464358"",""68464358"",""5969957"",""14558127"",""14558127"",""14558127"",""59438930"",""59438930"",""59438930"",""93969023"",""48355999"",""48355999"",""97268402"",""97268402"",""97268402"",""99266988"",""99266988"",""99266988"",""31443476"",""31443476"",""31443476"",""87571563"",""87571563"",""36668118"",""62265044""]","[""9753964"",""3040496"",""27548199"",""63767246"",""85289965"",""49725936"",""38342335"",""8264361"",""50588353"",""11969228"",""29296344"",""65741786"",""24361622"",""13143275"",""73539069""]","[""34267821"",""34267821"",""34267821"",""43534808"",""43534808"",""43534808"",""36857073"",""80666118"",""73082255"",""12580477"",""12580477"",""18144507"",""43898403"",""43898403"",""43898403""]",1652639905,10 months ago,,,0,Dragon Link + Handtrap,Dragon Link + Handtrap
277551,t3-casual-fossil-triamid-277551,T3 Casual Fossil Triamid,68406755,113633,Fun/Casual Decks,"[""68406755"",""68406755"",""68406755"",""32912040"",""32912040"",""32912040"",""95923441"",""95923441"",""95923441"",""69529337"",""69529337"",""69529337"",""11302671"",""11302671"",""11302671"",""45041488"",""45041488"",""57354389"",""42009836"",""64576557"",""64576557"",""64576557"",""45383307"",""45383307"",""45383307"",""9989792"",""9989792"",""9989792"",""72772445"",""72772445"",""72772445"",""73628505"",""59419719"",""40450317"",""40450317"",""83764719"",""96100333"",""96100333"",""96100333"",""89208725""]","[""86520461"",""12015000"",""96897184"",""57157964"",""21225115"",""59531356"",""84401683"",""84401683"",""73580471""]","[""34267821"",""34267821"",""34267821"",""43534808"",""43534808"",""43534808"",""36857073"",""80666118"",""73082255"",""12580477"",""12580477"",""18144507"",""43898403"",""43898403"",""43898403""]",1652639905,10 months ago,,,0,Casual Triamid/Fossil hybrid,Triamid/Fossil hybrid
277547,water-277547,Water,3643300,80830,Non-Meta Decks,"[""96546575"",""23931679"",""69436288"",""95824983"",""3643300"",""19801646"",""44968687"",""46290741"",""88409165"",""4754691"",""73979030"",""61802346"",""37798171"",""67964209"",""24137081"",""43175027"",""79169622"",""99581584"",""40160226"",""30276969"",""58203736"",""82685480"",""98804359"",""295517"",""34103656"",""26534688"",""62437430"",""22123627"",""96947648"",""7653207"",""95602345"",""19089195"",""53582587"",""53582587"",""7092142"",""7092142"",""78910579"",""98643358"",""34293667"",""97697447""]","[""67557908"",""65676461"",""37279508"",""31320433"",""94942656"",""94942656"",""94942656"",""42566602"",""6568731"",""52687916"",""70980824"",""5614808"",""82184400"",""65170459"",""65170459""]","[""34267821"",""34267821"",""34267821"",""43534808"",""43534808"",""43534808"",""36857073"",""80666118"",""73082255"",""12580477"",""12580477"",""18144507"",""43898403"",""43898403"",""43898403""]",1652639905,10 months ago,,,0,A Legendary Ocean,Using A Legendary Ocean and Water monsters
277543,striker-277543,striker,26077387,113730,Non-Meta Decks,"[""26077387"",""26077387"",""26077387"",""37351133"",""37351133"",""81866673"",""63362460"",""97268402"",""97268402"",""97268402"",""14558127"",""14558127"",""14558127"",""59438930"",""59438930"",""27204311"",""25733157"",""51227866"",""51227866"",""63166095"",""52340444"",""24010609"",""50005218"",""99550630"",""98338152"",""98338152"",""98338152"",""25955749"",""12580477"",""12580477"",""18144507"",""52947044"",""52947044"",""10045474"",""10045474"",""10045474"",""35261759"",""35261759"",""35261759"",""32807846""]","[""8491308"",""8491308"",""63288573"",""63288573"",""63288573"",""12421694"",""90673288"",""90673288"",""90673288"",""75147529"",""50588353"",""45819647"",""60461804"",""86066372"",""70369116""]","[""8491308""]",1652639905,10 months ago,,,0,jeff pickle rick stuff,"Lorem ipsum dolor sit amet, consectetur adipiscing elit, sed do eiusmod tempor incididunt ut labore et dolore magna aliqua. Ut enim ad minim veniam, quis nostrud exercitation ullamco laboris nisi ut aliquip ex ea commodo consequat. Duis aute irure dolor in reprehenderit in voluptate velit esse cillum dolore eu fugiat nulla pariatur. Excepteur sint occaecat cupidatat non proident, sunt in culpa qui officia deserunt mollit anim id est laborum."
