deck_num,pretty_url,deck_name,cover_card,userid,format,main_deck,extra_deck,side_deck,ts_submit_date,submit_date,ts_edit_date,edit_date,comments,deck_excerpt,deck_description
39306,millenium-legend-atem-deck-39306,Millenium Legend [Atem Deck],46986421,17042,Anime Decks,"[""46986414"",""70781052"",""10000020"",""72989439"",""78193831"",""38033121"",""73752131"",""73752131"",""73752131"",""80304126"",""80304126"",""80304126"",""34710660"",""40640057"",""40640057"",""6390406"",""6390406"",""24094653"",""24094653"",""55144522"",""72302403"",""72302403"",""72302403"",""72892473"",""75500286"",""79571449"",""83764718"",""87910978"",""87910978"",""5318639"",""5318639"",""5318639"",""70828912"",""9287078"",""9287078"",""44095762"",""44095762"",""44095762"",""62279055"",""62279055""]","[""98502114"",""98502114""]","[""8463720"",""72402069"",""6766208"",""92536468"",""47198668"",""51405049"",""48210156"",""9030160"",""47198668"",""9765723"",""46035545"",""92536468"",""21686473"",""72181263"",""18897163""]",1583951905,3 years ago,,,0,A Traditional Format Atem deck with a cohesive strategy. ,"I have a lot of character decks so I'm just gonna start uploading them here. To start off it only makes sense to post Yami Yugi's first.  This deck plays an abundance of spell cards to get counters for Skilled Dark Magician. It doesn't entire matter though if you draw into Dark Renewal since it nets you a DM anyways. Double Valk can lock your opponent from attacking and give you time to summon a more powerful monster as well. In fact, stall is the name of the game with this deck. Keep yourself alive until you draw the card you need, whether it be to make a comeback or to summon a powerful monster. As true to the character as you can get."
39309,d-d-d-raknarok-2019-39309,D/D/D RAKNAROK 2019,74069667,10628,Non-Meta Decks,"[""33334269"",""33334269"",""72291412"",""72291412"",""45206713"",""45206713"",""45206713"",""44186624"",""44186624"",""74069667"",""74069667"",""74069667"",""83303851"",""41546"",""41546"",""59123937"",""46796664"",""46796664"",""46796664"",""19580308"",""19580308"",""19580308"",""11609969"",""11609969"",""11609969"",""35261759"",""35261759"",""46372010"",""46372010"",""46372010"",""73360025"",""2295440"",""1475311"",""1475311"",""1475311"",""51405049"",""51405049"",""58577036"",""83764718"",""99674361"",""99674361"",""72648577""]","[""16006416"",""16006416"",""82956492"",""74583607"",""44852429"",""44852429"",""987311"",""15939229"",""9024198"",""9024198"",""27548199"",""50954680"",""61665245"",""53413628"",""50588353""]","[""8463720"",""72402069"",""6766208"",""92536468"",""47198668"",""51405049"",""48210156"",""9030160"",""47198668"",""9765723"",""46035545"",""92536468"",""21686473"",""72181263"",""18897163""]",1583951905,3 years ago,,,0,D/D/D deck by YGO Lite,<a>https://www.youtube.com/watch?v=lbCJd6qYshQ&amp;feature=youtu.be</a>
39312,abc-infinity-deck-2019-39312,ABC INFINITY DECK 2019,1561110,10628,Meta Decks,"[""66399653"",""66399653"",""66399653"",""73628505"",""73628505"",""57288708"",""57288708"",""30012506"",""30012506"",""30012506"",""3405259"",""3405259"",""3405259"",""55010259"",""55010259"",""55010259"",""29021114"",""29021114"",""29021114"",""77411244"",""77411244"",""77411244"",""46659709"",""46659709"",""46659709"",""99674361"",""99674361"",""99674361"",""83764719"",""81439173"",""5288597"",""5288597"",""5288597"",""43040603"",""98159737"",""98159737"",""98159737"",""89208725"",""89208725"",""27918365""]","[""1561110"",""1561110"",""1561110"",""6983839"",""75452921"",""61665245"",""22423493"",""85289965"",""74997493"",""10443957"",""58069384"",""40216089"",""2857636"",""38342335"",""94677445""]","[""61740673"",""73580471"",""90590303"",""74997493"",""50588353"",""73915051"",""98558751"",""82732705"",""41420027"",""53582587"",""35261759"",""40605147"",""1861629"",""72883039"",""72291078""]",1583951905,3 years ago,,,0,ABC deck by YGO Lite,<a>https://www.youtube.com/watch?v=GfopTNYxW2s</a>
39315,metalfoes-f-a-2019-39315,METALFOES F.A 2019,24094258,10628,Non-Meta Decks,"[""6764709"",""69351984"",""69351984"",""69351984"",""33256280"",""33256280"",""33256280"",""7868571"",""7868571"",""7868571"",""60473572"",""60473572"",""60473572"",""73594093"",""39564736"",""69711728"",""33327029"",""73628505"",""73628505"",""1061200"",""1061200"",""1061200"",""2144946"",""2144946"",""2144946"",""39838559"",""39838559"",""85138716"",""85138716"",""50485594"",""50485594"",""911883"",""911883"",""911883"",""38459905"",""38459905"",""39271553"",""93449450"",""93449450"",""93449450""]","[""24094258"",""54401832"",""28016193"",""28016193"",""4688231"",""4688231"",""85216896"",""85289965"",""74997493"",""81612598"",""81612598"",""33158448"",""77693536"",""77693536"",""74586817""]","[""68987122"",""77693536"",""50485594"",""38459905"",""33158448"",""33158448"",""49655592"",""67045745"",""1033312"",""79816536"",""4688231"",""79816536"",""18716735"",""73594093"",""18716735""]",1583951905,3 years ago,,,0,Metalfoes F.A deck by YGO Lite,<a>https://www.youtube.com/watch?v=QHAC-cEa41M&amp;t=336s</a>
39318,kc-victory-kaiba-deck-39318,KC Victory [Kaiba Deck],89631146,17042,Anime Decks,"[""89631139"",""89631139"",""89631139"",""10000000"",""82301904"",""52824910"",""31786629"",""31786629"",""31786629"",""50259460"",""54912977"",""54912977"",""34124316"",""52624755"",""52624755"",""52624755"",""95178994"",""95178994"",""95178994"",""19613556"",""24094653"",""24094653"",""24094653"",""48800175"",""48800175"",""48800175"",""55144522"",""79571449"",""83764718"",""55713623"",""55713623"",""98045062"",""98045062"",""98045062"",""70828912"",""83555666"",""83555666"",""14315573"",""14315573"",""14315573""]","[""23995346"",""54752875""]","[""82385847"",""82385847"",""82385847"",""94145021"",""94145021"",""94145021"",""55063751"",""55063751"",""10000080"",""10000080"",""49238328"",""49238328"",""23002292"",""23002292"",""23002292""]",1583951905,3 years ago,,,0,A Traditional Kaiba deck made with the og beatdown style of dueling.,"Get out tributes for powerful monsters and attempt to overwhelm your opponent through brute force tactics. Not much else to say other than that. Twin-Headed Thunder Dragon is a nice and easy 2800 to hold off your opponent until you get access to more powerful monsters. Try to make sure Cyber Jar goes off on your turn, not only do you not run many monsters for it to summon and act as a shield, but you also allow your opponent to get access to their 5 cards before you. (Which is bad)"
39321,underdog-s-luck-joey-deck-39321,Underdog's Luck [Joey Deck],74677427,17042,Anime Decks,"[""74677422"",""36354007"",""36354008"",""77585513"",""57902462"",""30707994"",""42035044"",""42035044"",""50903514"",""50903514"",""50903514"",""90790253"",""90790253"",""78706415"",""71625222"",""71625222"",""71625222"",""26376390"",""26376390"",""1845204"",""1845204"",""1845204"",""18144507"",""52097679"",""52097679"",""55144522"",""79571449"",""83764718"",""73915051"",""74137509"",""74137509"",""76895648"",""76895648"",""126218"",""126218"",""29401950"",""29401950"",""37390589"",""37390589"",""21598948"",""21598948""]","[""45231177"",""45231177"",""45231177""]","[""82385847"",""82385847"",""82385847"",""94145021"",""94145021"",""94145021"",""55063751"",""55063751"",""10000080"",""10000080"",""49238328"",""49238328"",""23002292"",""23002292"",""23002292""]",1583951905,3 years ago,,,0,A Traditional Joey Deck that plays it a little loose.,"This one is played a little loose because I REALLY wanted to include Flame Swordsman so I decided to play Instant Fusion. Blue Flame is the heart and soul of the deck. Boost other Warrior's by 800 each Battle Phase and create a behemoth. When Blue Flame dies he can bring back am og Flame Swordsman that you used as tribute material for a monster.  This deck might not have the most powerful strategy, but with a few good gambles, it can pull through. Kinda like another guy I know..."
39334,gearfried-warrior-39334,Gearfried Warrior,69488544,14155,Fun/Casual Decks,"[""39389320"",""69933858"",""36354007"",""36354008"",""69488544"",""69488544"",""57046845"",""57046845"",""59975920"",""50903514"",""50903514"",""36569343"",""10375182"",""10375182"",""89529919"",""89529919"",""423705"",""423705"",""423705"",""2460565"",""2460565"",""21088856"",""83764718"",""55144522"",""12580477"",""32807846"",""32807846"",""75417459"",""75417459"",""95281259"",""95281259"",""31423101"",""37684215"",""37684215"",""61854111"",""92346415"",""32268901"",""32268901"",""93377803"",""29401950"",""47475363"",""44095762"",""43898403"",""43898403"",""60082869"",""60082869""]","[""56832966"",""84013237"",""46772449"",""21044178"",""21044178"",""85289965"",""85289965"",""74997493"",""61665245"",""32617464"",""38342335"",""2857636"",""75452921"",""75452921"",""77058170""]","[""82385847"",""82385847"",""82385847"",""94145021"",""94145021"",""94145021"",""55063751"",""55063751"",""10000080"",""10000080"",""49238328"",""49238328"",""23002292"",""23002292"",""23002292""]",1583951905,3 years ago,,,0,Basic warrior with awesome cards!,Awesome warrior deck!
39337,silent-magician-spellbook-39337,Silent Magician Spellbook,41175645,16339,Fun/Casual Decks,"[""72443568"",""30603688"",""30603688"",""41175645"",""41175645"",""41175645"",""14824019"",""14824019"",""14824019"",""34318086"",""34318086"",""14558127"",""14558127"",""14558127"",""97268402"",""97268402"",""97268402"",""23314220"",""23314220"",""23314220"",""35726888"",""35726888"",""35726888"",""56981417"",""56981417"",""70368879"",""73594093"",""73628505"",""73628505"",""89739383"",""89739383"",""89739383"",""44968459"",""44968459"",""44968459"",""96677818"",""97997309"",""97997309"",""33981008"",""33981008""]","[""56832966"",""84013237"",""46772449"",""21044178"",""21044178"",""85289965"",""85289965"",""74997493"",""61665245"",""32617464"",""38342335"",""2857636"",""75452921"",""75452921"",""77058170""]","[""82385847"",""82385847"",""82385847"",""94145021"",""94145021"",""94145021"",""55063751"",""55063751"",""10000080"",""10000080"",""49238328"",""49238328"",""23002292"",""23002292"",""23002292""]",1583951905,3 years ago,,,0,Silent Magician Spellbook,<p>A deck based on special summon Silent Magician more faster than you can.</p> <p>Use the Spelbooks engine to draw cards.</p>
39340,tomb-princess-ishizu-deck-39340,Tomb Princess [Ishizu Deck],82108372,17042,Anime Decks,"[""16268841"",""16268841"",""16268841"",""17393207"",""17393207"",""54878498"",""54878498"",""54878498"",""82108372"",""82108372"",""82108372"",""16135253"",""16135253"",""16135253"",""80441106"",""80441106"",""19406822"",""19406822"",""19406822"",""16435215"",""16435215"",""16435215"",""55144522"",""72302403"",""72302403"",""72302403"",""72405967"",""79571449"",""5318639"",""5318639"",""5318639"",""28106077"",""28106077"",""28106077"",""47355498"",""47355498"",""47355498"",""53334471"",""53334471"",""53334471""]","[""21200905"",""21200905"",""21200905"",""38148100"",""38148100"",""38148100""]","[""34267821"",""34267821"",""34267821"",""5318639"",""5318639"",""5318639"",""10045474"",""10045474"",""10045474"",""51452091"",""51452091"",""51452091"",""90846359"",""90846359"",""90846359""]",1583951905,3 years ago,,,1,A Traditional Ishizu deck with a LOT of creative liberties.,"A LOT OF CREATIVE LIBERTIES TAKEN HERE.  To break it down, the key strat of Ishizu is decking her opponent out using Exchange of the Spirit. However, for some ungodly reason, Konami errata'd it and made it completely unplayable. So in order to make her deck, I had to improvise. I felt just making Gravekeepers was lame and uninspired. I didn't completely take them out of the equation though...  This is basically Mudora beat down with some anti meta tech tossed in. Necrovalley stops your opponent from messing with their GY and Kotodama, while keeping with the EARTH Fairy theme, prevents monsters with the same name from being face-up on the field. Also, since all your monsters are EARTH, doesn't hurt to run a Gozen Match, ya? Overall just a cute little gimmick deck that kept to character as much as possible, given that her intended win con is forever lost."
39343,dragonplants-deck-39343,DragonPlants deck,69072185,16407,Anime Decks,"[""33300669"",""33300669"",""33300669"",""34522216"",""34522216"",""34522216"",""69072185"",""69072185"",""7305060"",""7305060"",""7305060"",""70917315"",""70917315"",""70917315"",""6283472"",""6283472"",""6283472"",""32687071"",""32687071"",""79794767"",""79794767"",""79794767"",""21452275"",""21452275"",""85967160"",""85967160"",""22174866"",""22174866"",""22174866"",""96789758"",""96789758"",""96789758"",""58569561"",""58569561"",""58569561"",""16759958"",""16759958"",""16759958"",""5050644"",""5050644"",""28265983"",""28265983"",""92266279"",""92266279"",""50554729"",""50554729"",""47598941"",""47598941"",""23160024"",""23160024"",""50913601"",""50913601""]","[""21200905"",""21200905"",""21200905"",""38148100"",""38148100"",""38148100""]","[""34267821"",""34267821"",""34267821"",""5318639"",""5318639"",""5318639"",""10045474"",""10045474"",""10045474"",""51452091"",""51452091"",""51452091"",""90846359"",""90846359"",""90846359""]",1583951905,3 years ago,,,0,DragonPlants deck,"<h4 class=""page-header__title"">Aroma</h4> <p><a class=""image image-thumbnail"" title=""""> <img class=""pi-image-thumbnail"" src=""https://vignette.wikia.nocookie.net/yugioh/images/3/33/Mat-OTSChampionship-Aromage-KR.png/revision/latest/scale-to-width-down/350?cb=20160422122130"" srcset=""https://vignette.wikia.nocookie.net/yugioh/images/3/33/Mat-OTSChampionship-Aromage-KR.png/revision/latest/scale-to-width-down/350?cb=20160422122130 1x, https://vignette.wikia.nocookie.net/yugioh/images/3/33/Mat-OTSChampionship-Aromage-KR.png/revision/latest/scale-to-width-down/700?cb=20160422122130 2x"" alt="""" width=""270"" height=""157"" data-image-key=""Mat-OTSChampionship-Aromage-KR.png"" data-image-name=""Mat-OTSChampionship-Aromage-KR.png"" /> </a></p> ""<b>Aroma</b>"" (<i>Aroma</i>) is an <a title=""Archetype"" rel=""nofollow"" href=""https://yugioh.fandom.com/wiki/Archetype"">archetype</a> largely consisting of <a title=""Plant"" rel=""nofollow"" href=""https://yugioh.fandom.com/wiki/Plant"">Plant</a> <a title=""Monster Card"" rel=""nofollow"" href=""https://yugioh.fandom.com/wiki/Monster_Card"">monsters</a> that were introduced in <i><a title=""Clash of Rebellions"" rel=""nofollow"" href=""https://yugioh.fandom.com/wiki/Clash_of_Rebellions"">Clash of Rebellions</a></i>. The archetype's monsters all derive their names from tools and various species of flowers, all of which are used to produce and utilize <a class=""extiw"" title=""wikipedia:Essential oil"">essential oils</a>.  &nbsp; <h4 class=""page-header__title"">Amorphage</h4> &nbsp; <p><a class=""image image-thumbnail"" title=""""> <img class=""pi-image-thumbnail"" src=""https://vignette.wikia.nocookie.net/yugioh/images/6/66/AmorphageArchetype.png/revision/latest/scale-to-width-down/350?cb=20160219013150"" srcset=""https://vignette.wikia.nocookie.net/yugioh/images/6/66/AmorphageArchetype.png/revision/latest/scale-to-width-down/350?cb=20160219013150 1x, https://vignette.wikia.nocookie.net/yugioh/images/6/66/AmorphageArchetype.png/revision/latest?cb=20160219013150 2x"" alt="""" width=""270"" height=""270"" data-image-key=""AmorphageArchetype.png"" data-image-name=""AmorphageArchetype.png"" /> </a></p> ""<b>Amorphage</b>"" (<i>Amorufāji</i>) is an <a title=""Archetype"" rel=""nofollow"" href=""https://yugioh.fandom.com/wiki/Archetype"">archetype</a> of <a title=""EARTH"" rel=""nofollow"" href=""https://yugioh.fandom.com/wiki/EARTH"">EARTH</a> <a title=""Dragon"" rel=""nofollow"" href=""https://yugioh.fandom.com/wiki/Dragon"">Dragon</a> <a title=""Pendulum Monster"" rel=""nofollow"" href=""https://yugioh.fandom.com/wiki/Pendulum_Monster"">Pendulum Monsters</a> that debuted in <i><a title=""Shining Victories"" rel=""nofollow"" href=""https://yugioh.fandom.com/wiki/Shining_Victories"">Shining Victories</a></i>. Like the ""<a title=""Igknight"" rel=""nofollow"" href=""https://yugioh.fandom.com/wiki/Igknight"">Igknight</a>"", ""<a title=""Majespecter"" rel=""nofollow"" href=""https://yugioh.fandom.com/wiki/Majespecter"">Majespecter</a>"", and ""<a title=""Dinomist"" rel=""nofollow"" href=""https://yugioh.fandom.com/wiki/Dinomist"">Dinomist</a>"" archetypes from the sets before them, they have a connection to the ""<a title=""Dracoslayer"" rel=""nofollow"" href=""https://yugioh.fandom.com/wiki/Dracoslayer"">Dracoslayer</a>"" archetype in terms of lore. Additionally, this archetype is strongly connected to the ""<a title=""Dracoverlord"" rel=""nofollow"" href=""https://yugioh.fandom.com/wiki/Dracoverlord"">Dracoverlord</a>"" archetype in both lore and gameplay."
39346,wild-harem-mai-deck-39346,Wild Harem [Mai Deck],52040216,17042,Anime Decks,"[""52040216"",""52040216"",""52040216"",""12493482"",""12493482"",""12493482"",""45547649"",""45547649"",""45547649"",""29654737"",""29654737"",""29654737"",""55821894"",""55821894"",""55821894"",""91932350"",""91932350"",""91932350"",""18144506"",""55144522"",""73628505"",""73628505"",""79571449"",""81439173"",""83764718"",""90219263"",""70828912"",""79965360"",""79965360"",""48179391"",""58621589"",""58621589"",""67987611"",""67987611"",""67987611"",""80193355"",""80193355"",""22359980"",""22359980"",""22359980""]","[""41578483"",""41578483"",""41578483"",""63519819"",""63519819"",""63519819"",""72529749"",""38342335"",""2857636"",""41999284"",""41999284"",""41999284"",""94259633"",""94259633"",""94259633""]","[""34267821"",""34267821"",""34267821"",""5318639"",""5318639"",""5318639"",""10045474"",""10045474"",""10045474"",""51452091"",""51452091"",""51452091"",""90846359"",""90846359"",""90846359""]",1583951905,3 years ago,,,0,A Traditional Mai deck that does the character some justice.,"A deck that can be pretty dang annoying for battle heavy decks. This deck loves to bait you into attacking, making quick works of Mirror Wall and Amazonness Archers. This deck tries to build a board od sizeable monsters to trample the opponent and eventually overwhelm them. Foolish your Pet Dragon to revive later as it can very easily become a giant wall of ATK."
39351,witchcrafter-39351,Witchcrafter,21522601,17042,Non-Meta Decks,"[""21522601"",""84523092"",""84523092"",""21744288"",""21744288"",""21744288"",""95245544"",""95245544"",""95245544"",""59851535"",""59851535"",""59851535"",""1845204"",""1845204"",""1845204"",""10805153"",""49238328"",""49238328"",""49238328"",""57916305"",""57916305"",""57916305"",""58577036"",""73594093"",""83301414"",""83301414"",""83301414"",""24224830"",""24224830"",""24224830"",""56894757"",""19673561"",""40252269"",""40252269"",""40252269"",""83289866"",""87769556"",""23516703"",""23516703"",""23516703""]","[""41578483"",""41578483"",""41578483"",""63519819"",""63519819"",""63519819"",""72529749"",""38342335"",""2857636"",""41999284"",""41999284"",""41999284"",""94259633"",""94259633"",""94259633""]","[""34267821"",""34267821"",""34267821"",""5318639"",""5318639"",""5318639"",""10045474"",""10045474"",""10045474"",""51452091"",""51452091"",""51452091"",""90846359"",""90846359"",""90846359""]",1583951905,3 years ago,,,0,A solid build for anyone wanting to try out Witchcrafters.,"You really don't want to have Haine or Verre in your hand tbh. It isn't game over if you do get them because Pittore exists, just make sure you ditch them asap. Haine is typically a better starter monster to end on then Verre, but if you can get both then that's perfect. Make sure you get Schmietta in the GY early on to banish so you can have Bystreet ready to go at all times, the deck simply wouldn't work without it.  Before doing ANYTHING, if you have Instant Fusion, summon Millennium-Eyes. This will save you from any stray hand traps the opponent may use. Beware of Called by the Graves. Them hitting you when you pop off Schmietta is borderline game ending. If you play correctly, you can typically out grind most if not all your opponent's moves, thanks to Witchcrafter's amazing recovery.  Reasoning is the nuts. Activate it only when you know you aren't going to get ashed because you don't want that to be wasted.  Side could use some work but I think I got the Main Deck down."
39365,pendulum-magician-post-savage-strike-2019-39365,Pendulum Magician POST SAVAGE STRIKE 2019,72714461,9589,Meta Decks,"[""96227613"",""69610326"",""69610326"",""69610326"",""29587993"",""29587993"",""53842431"",""53842431"",""53842431"",""27354732"",""80959027"",""12289247"",""12289247"",""12289247"",""20409757"",""75672051"",""75672051"",""75672051"",""72714461"",""72714461"",""72714461"",""14920218"",""14920218"",""48461764"",""48461764"",""48461764"",""73941492"",""73941492"",""73941492"",""1344018"",""1344018"",""1475311"",""1475311"",""1475311"",""24224830"",""37469904"",""37469904"",""81439173"",""53208660"",""74850403"",""74850403""]","[""27548199"",""70771599"",""18239909"",""55285840"",""90590303"",""6983839"",""47349116"",""46772449"",""21044178"",""42160203"",""359563"",""14152862"",""24094258"",""85216896"",""85289965""]","[""13974207"",""13974207"",""13974207"",""64697431"",""64697431"",""102380"",""102380"",""102380"",""23002292"",""23002292"",""23002292"",""82385847"",""82385847"",""34267821"",""34267821""]",1583951905,3 years ago,,,0,balblalsal https://www.youtube.com/watch?v=VtssOSq-q6k,top zera ve meu video <a>https://www.youtube.com/watch?v=VtssOSq-q6k</a>
39368,odd-eyes-pendulum-39368,Odd-Eyes Pendulum,14105623,17018,Non-Meta Decks,"[""14105623"",""14105623"",""14105623"",""83347294"",""96733134"",""46136942"",""29587993"",""29587993"",""16178681"",""16178681"",""16178681"",""93149655"",""71692913"",""71692913"",""96227613"",""21250202"",""21250202"",""69610326"",""69610326"",""69610326"",""20409757"",""67754901"",""82224646"",""6853254"",""6853254"",""37469904"",""37469904"",""37469904"",""41620959"",""41620959"",""41620959"",""48144509"",""48144509"",""48144509"",""82768499"",""82768499"",""82768499"",""27813661"",""27813661"",""27813661""]","[""41209827"",""53262004"",""53262004"",""52687916"",""50954680"",""58074177"",""18239909"",""80696379"",""36898537"",""45627618"",""86238081"",""16691074"",""80117527"",""24094258"",""28776350""]","[""88264978"",""88264978"",""59438930"",""59438930"",""59438930"",""52687916"",""27548199"",""95474755"",""31833038"",""83764719"",""74519184"",""74519184"",""15693423"",""15693423"",""15693423""]",1583951905,3 years ago,,,0,Odd-Eyes fcking glasscannon,Fucking glasscannon
39371,full-power-dragon-rulers-39371,FULL POWER DRAGON RULERS,53804307,17018,Fun/Casual Decks,"[""53804307"",""53804307"",""53804307"",""26400609"",""26400609"",""26400609"",""89399912"",""89399912"",""89399912"",""90411554"",""90411554"",""90411554"",""5560911"",""91020571"",""91020571"",""91020571"",""27415516"",""27415516"",""27415516"",""53797637"",""53797637"",""53797637"",""89185742"",""89185742"",""89185742"",""14558127"",""14558127"",""14558127"",""67441435"",""67441435"",""41620959"",""41620959"",""41620959"",""55144522"",""55144522"",""55144522"",""79571449"",""79571449"",""79571449"",""81439174""]","[""50954680"",""73580471"",""78144171"",""22110647"",""80117527"",""10389142"",""10389142"",""85289965"",""74997493"",""5043010"",""1861629"",""32617464"",""38342335"",""2857636"",""75452921""]","[""88264978"",""88264978"",""59438930"",""59438930"",""59438930"",""52687916"",""27548199"",""95474755"",""31833038"",""83764719"",""74519184"",""74519184"",""15693423"",""15693423"",""15693423""]",1583951905,3 years ago,,,0,Special summon y popear efectos,Dragon ruler bois
39374,krawler-deck-39374,Krawler deck,62587693,15082,Non-Meta Decks,"[""62587693"",""46083111"",""10698416"",""10698416"",""83293307"",""51205763"",""51205763"",""51205763"",""15710054"",""15710054"",""88316955"",""88316955"",""67441435"",""31706048"",""31706048"",""59750328"",""72892473"",""73628505"",""98645731"",""98645731"",""73915051"",""67831115"",""67831115"",""67831115"",""27705190"",""27705190"",""27705190"",""73575650"",""74003290"",""74003290"",""74003290"",""19590644"",""19590644"",""19590644"",""55838342"",""55838342"",""89320376"",""89320376"",""40605147"",""84749824""]","[""31833038"",""68987122"",""38342335"",""74937659"",""92781606"",""2857636"",""66393507"",""39998992"",""28776350"",""75452921"",""3987233"",""66226132"",""99111753"",""98978921"",""98978921""]","[""58400390"",""83477829"",""14558127"",""83293307"",""67441435"",""92781606"",""31706048"",""59750328"",""59750328"",""73628505"",""83764719"",""24224830"",""73575650"",""41420027""]",1583951905,3 years ago,,,0,Krawler deck 2019,"<a rel=""nofollow"" href=""https://youtu.be/h_5kdEgYEa8"">https://youtu.be/h_5kdEgYEa8</a>"
39381,cubic-deck-39381,Cubic Deck,30270176,14684,Non-Meta Decks,"[""30270176"",""30270176"",""30270176"",""65192027"",""4998619"",""20137754"",""20137754"",""20137754"",""3775068"",""423585"",""423585"",""423585"",""14558127"",""14558127"",""40392714"",""97268402"",""97268402"",""67441435"",""15610297"",""15610297"",""15610297"",""35058588"",""35058588"",""35058588"",""35726888"",""35726888"",""35726888"",""75500286"",""37520316"",""37520316"",""9659580"",""9659580"",""9659580"",""24224830"",""24224830"",""43898403"",""43898403"",""34325937"",""34325937"",""34325937"",""84749824""]","[""72664875"",""57707471"",""56832966"",""16195942"",""16195943"",""30100551"",""48739166"",""94380860"",""65676461"",""84013237"",""86532744"",""6511113"",""31833038"",""1861629"",""74997493"",""77058170""]","[""10000080"",""10000080"",""82385847"",""82385847"",""82385847"",""77558536"",""40164421"",""63519819"",""94886282"",""1845204"",""1845204"",""2295440"",""14816688"",""25789292"",""53582587""]",1583951905,3 years ago,,,0,....,....
