deck_num,pretty_url,deck_name,cover_card,userid,format,main_deck,extra_deck,side_deck,ts_submit_date,submit_date,ts_edit_date,edit_date,comments,deck_excerpt,deck_description
40213,crusadia-guardragon-casual-2019-40213,crusadia guardragon casual 2019,21123811,17317,Fun/Casual Decks,"[""81524756"",""81524756"",""81524756"",""54525057"",""54525057"",""54525057"",""28031913"",""28031913"",""28031913"",""91646304"",""91646304"",""91646304"",""55241609"",""55241609"",""55241609"",""14878871"",""14878871"",""14878871"",""24096499"",""5560911"",""67441435"",""99234526"",""99234526"",""61901281"",""61901281"",""83764718"",""2295440"",""81439173"",""99674361"",""99674361"",""99674361"",""87571563"",""24224830"",""24224830"",""24224830"",""32807846"",""27918365"",""27918365"",""88264978"",""59919307""]","[""39528955"",""72228247"",""86148577"",""74997493"",""13143275"",""59537380"",""18963306"",""58820923"",""74997493"",""33198837"",""27548199"",""33158448"",""50588353"",""50091196"",""21123811""]","[""56343672"",""61049315"",""69072185"",""33282498"",""9753964"",""2956282"",""82385847"",""82044279"",""63533837"",""50954680"",""43422537"",""59919307"",""90953320"",""14558127"",""63767246""]",1583951905,3 years ago,,,1,"less negate, but able to summon 15 card from extra in 2 turn","as the title said, this is not usual crusadia guardragon deck which can negate countless time in one turn  this is a deck that utilize its card to summon all extra deck in 2 turn if lucky enough. in other word, this is more like show off deck  to summon all extra in 2 turn, your opponent must activate a spell/trap in either turn while you have f.a. dragster on field. at the end of turn, you also need naturia beast  although i said not usual crusadia guardragon deck, 80% of the card is from original crusadia guardragon, i just change a bit and find one way to summon all 15 extra deck in 2 turn.  the initial strategy same like crusadia guardragon low combo, but you summon galaxy eyes with agarpain instead of hot dragon archfiend. then, xyz again to galaxy eyes dark matter and use its skill to discard destrudo and other dragon card you have to increase your chance on getting card you want using skull dread skill later on. card you need in graveyard is destrudo since it will help you synchro borreload savage/crystal wing or your lvl 7 synchro. save one extender to resummon naturia beast or f.a. dragster after you use it to synchro lvl 8 synchro monster.  the only different between this and the usual crusadia guardragon combo, is that you need to link away 1 tuner and your skull dread before ending turn, after you manage to synchro all monster from extra deck (except cosmic and formula).  link away to needlefiber. if you missing one lvl 8 or lvl 7 synchro, use needlefiber skill to summon arboria from deck, and use it to synchro the missing monster.  by the end of your turn, you're expected to have 2 card left in extra deck. the rest will depend on opponent turn. if he/she manage to activate spell/trap, then the plan success, go negate it with f.a. dragster. and immediately after the effect resolve, use needlefiber skill to synchro formula synchron from extra and immediately use its skill to synchro summon cosmic blazar dragon using naturia beast and f.a. dragster.  in case you dont want to wait for opponent to activate spell/trap, you can synchro t.g. hyper librarian instead galaxy eyes using agarpain. but this is riskier because no destrudo (unless you manage to use foolish burial) which mean no additional tuner.  if you want to retain a bit crusadia guardragon function, you can replace from side deck, arkbrave and goliath, but this will prevent you from using needlefiber skill. replace if you want to play negate and in case you play this, just replace needlefiber, cosmic and formula since you dont need them anymore  cyberse quantum is a good card to defend your monster, replace your lvl 8 synchro monster if you need it. dont replace f.a. dragster (unless you play with hyper librarian) because its essential for summoning cosmic.  you can add pankratops or kaiju if you want prevent opponent from negating you if you play second"
40207,cyberse-deck-40207,Cyberse deck,60018643,15082,Non-Meta Decks,"[""17469113"",""50426119"",""67218327"",""21830679"",""16188701"",""16188701"",""16188701"",""8567955"",""8567955"",""8567955"",""75130221"",""75130221"",""645087"",""10705656"",""30114823"",""30114823"",""30114823"",""63528891"",""14505685"",""65100616"",""2347477"",""2347477"",""2347477"",""18789533"",""57160136"",""57160136"",""57160136"",""75500286"",""83764719"",""99674361"",""99674361"",""99674361"",""24224830"",""24224830"",""77449773"",""77449773"",""60018643"",""60018643"",""60018643"",""7403341""]","[""21887175"",""6622715"",""33897356"",""40669071"",""46947713"",""32617464"",""88093706"",""45462149"",""53413628"",""52698008"",""52698008"",""96380700"",""2220237"",""32995276"",""32995276""]","[""9190563"",""645087"",""86605184"",""53309998"",""86784733"",""42717221"",""63533837"",""21065189"",""21887175"",""40669071"",""46947713"",""4478086"",""65801012"",""24224830""]",1583951905,3 years ago,,,0,Cyberse deck 2019,"<a rel=""nofollow"" href=""https://youtu.be/pv43eo5M848"">https://youtu.be/pv43eo5M848</a>"
40196,in2-the-void-remastered-40196,In2 The Void Remastered,36584821,16638,Non-Meta Decks,"[""102380"",""43316238"",""43316238"",""90807199"",""90807199"",""28297833"",""28297833"",""94853057"",""94853057"",""94853057"",""36584821"",""36584821"",""36584821"",""63845230"",""63845230"",""63845230"",""1475311"",""1475311"",""1475311"",""11830996"",""11830996"",""35261759"",""35261759"",""35261759"",""38120068"",""38120068"",""38120068"",""49238328"",""49238328"",""75500286"",""14391920"",""93600443"",""93600443"",""16762927"",""16762927"",""16762927"",""68073522"",""68073522"",""68073522"",""81674782"",""10813327"",""30241314"",""44716890"",""44716890"",""56256517"",""56256517"",""56256517"",""47355498"",""19665973"",""67443336"",""9622164"",""8628798"",""46294982"",""46294982"",""46294982"",""72283691"",""72283691"",""72283691"",""89208725"",""89208725""]","[""59642500"",""58481572"",""58481572"",""58481572"",""62541668"",""86221741"",""86221741"",""85289965"",""38342335"",""38342335"",""2857636"",""2857636"",""75452921"",""75452921"",""41999284""]","[""82385847"",""82385847"",""82385847"",""14558127""]",1583951905,3 years ago,,,1,"The augmented version of ""In2 the void"". This now has more popping, healing and attacking power with the addition of Hexe Trude and Stromberg. Show yo","The point of this deck is to do three main things:  Cut off your opponent's graveyard  Heal for massive amounts of life points  Feed ""Da Eiza""  &nbsp;  If you have been playing on ygo pro lately, you have probably seen a variation of this deck. However, my deck has several built in win conditions. This done through a few simple combos. Lets go over a few:  Toll Hike or Extra Toll / Gravekeeper's Servant + Banisher of the Radiance / Macro Cosmos / Dimensional Fissure / Dark Law  This combo does not allow your opponent to even declare an attack. However, Toll hike doesn't allow you to make one either. Therefore, only use that as a last resort. This can stall for a while until you get Gren Maju Da Eiza. You also can use Lava Golem to put your opponent on an 8 turn clock. Lastly, you can use Battle fader (or Gren Maju Da Eiza if you do not have any banished cards; you can perhaps use necroface then have your Gren Maju Da Eiza have zero attack for this) and attack Lava Golem in order to activate Inferno Tempest (I on run one at this time. Even in a 60 card deck, I couldn't find any space for a second one. But two is not bad).  Ledger of the Legerdemain or Seer's Passbook / Inferno Tempest / Eater Of Millions / Pot of Desires + Soul Absorption  What makes this combo so op to me is that you're actually benefitting from the cost requirement of these cards. In most decks, the cost of Pot of Desires or even Pot of Indulgence is devestating. However, in this deck it's a huge plus. It allows for you to use the powerful draw engine card Ancient Leaf.  Trade-In + Danger! monsters (With or without banish cards)  Trade-In triggers the effects of Danger! monsters even when they're banished. This is just another bonus in this deck as everything fits well with each other.  Soul Absorption + Golden Castle of Stormberg + Necroface  This combo takes a bit of set-up to do. I put metaverse instead of terraforming because Stormberg's banish effect only works the turn after.  Funky one ofs:  Balance of Judgment: This card is incredibly op to me and no one is using it. It has no draw back to it  Gold Sarcophagus: I'm more surprised that Necroface didn't get limited rather than this card. In any case, I primarily use this card to activate necroface's effect while also adding it to my hand.  Please try the deck and leave me any feedback on what cards you took out and maybe would put in. Would be greatly appreciated.  &nbsp;"
40192,old-school-burn-40192,Old School Burn,102380,17310,Fun/Casual Decks,"[""27125110"",""27125110"",""27125110"",""102380"",""102380"",""102380"",""31305911"",""31305911"",""31305911"",""52101615"",""52101615"",""52101615"",""2830693"",""2830693"",""2830693"",""57116033"",""57116034"",""57116033"",""57116034"",""57116033"",""57116034"",""85562745"",""66865880"",""20065322"",""20065322"",""20065322"",""29401950"",""29401950"",""94192409"",""94192409"",""70342110"",""70342110"",""24068492"",""24068492"",""62279055"",""62279055"",""98427577"",""98427577"",""27053506"",""27053506"",""4206964"",""4206964"",""26905245"",""26905245"",""29549364"",""29549364"",""54704216"",""54704216"",""77538567"",""77538567""]","[""63519819"",""63519819"",""63519819""]","[""82385847"",""82385847"",""82385847"",""14558127""]",1583951905,3 years ago,,,0,A Burn Deck utilizing Lava Golem and Marshmallons and Thousand-Eyes Restrict.,"I started playing Yu-Gi-Oh when I was in junior high around 2007, but lost touch with the meta in high school.  Recently my friends have picked up the game again and we've been exploring the new cards and rules the game has now.  I still find the old school decks fascinating, though.  I loved playing my burn/stun decks all throughout high school and now that there's more cards for me to use I can't wait to experiment.  This deck, however, exploring new territories, It's creating a burn deck with old school cards.  The object of this deck is to get Lava Golem onto the field, adding a mask of restrict on him, and having 2 nightmare wheels out all while building a wall of marshmallons and using kuriboh to mitigate damage.  There are other cards to help burn down the life points of your opponent throughout the deck.  This is my first ""serious"" deck that evolved from a deck i used to annoy people where the object was to return all the opponents cards to their hand before they could use them.  Made a few edits, I figured that Thousand-Eyes Restrict was a good card to put in this deck as another safeguard from your opponent attacking with Lava Golem, and Kuribohs have been changed out with their Rainbow and Winged Counterparts.  The Deck has been made larger, but there are more monsters and less traps and I think that's good for the overall scheme."
40187,lunalight-40187,Lunalight,51777272,15517,Non-Meta Decks,"[""11317977"",""11317977"",""11317977"",""11439455"",""11439455"",""11439455"",""94919024"",""94919024"",""48427163"",""48427163"",""84812868"",""84812868"",""84812868"",""83190280"",""83190280"",""83190280"",""47705572"",""47705572"",""47705572"",""26920296"",""26920296"",""57103969"",""57103969"",""57103969"",""59432181"",""18144506"",""83764718"",""5318639"",""5318639"",""27847700"",""27847700"",""27847700"",""73628505"",""94192409"",""94192409"",""11193246"",""11193246"",""41420027"",""84749824""]","[""51777272"",""51777272"",""51777272"",""24550676"",""24550676"",""97165977"",""97165977"",""31833039"",""85289965"",""61665245"",""77058170"",""64514892"",""26692769""]","[""82385847"",""82385847"",""82385847"",""14558127""]",1583951905,3 years ago,,,0,Lunalight a deck to play at night ,"In the dead of the night, you find a dog? Cat? TIGER! Yes, it is the Lunalights and they're here to bring down the moon on those who face them. Special thank to my friend <span class=""username u-dir"" dir=""ltr""><a class=""ProfileHeaderCard-screennameLink u-linkComplex js-nav"" rel=""nofollow"" href=""https://twitter.com/soulgoddess12"">@<b class=""u-linkComplex-target"">soulgoddess12</b></a> with making this deck</span>"
40181,lair-of-critias-casual-40181,Lair of Critias (Casual),50383626,17304,Fun/Casual Decks,"[""50383626"",""50383626"",""5560911"",""28674152"",""28674152"",""86377375"",""86377375"",""86377375"",""12766474"",""14558127"",""14558127"",""23898021"",""23898021"",""23898021"",""84764038"",""84764038"",""10802915"",""1475311"",""1475311"",""1475311"",""74117290"",""74117290"",""41620959"",""41620959"",""56830749"",""56830749"",""73628505"",""73628505"",""11082056"",""11082056"",""11082056"",""59160188"",""59160188"",""59160188"",""57728570"",""57728571"",""38167722"",""38167722"",""54974237"",""54974237"",""44095762"",""83555667"",""70368879""]","[""44373896"",""84687358"",""22804644""]","[""82385847"",""82385847"",""82385847"",""14558127""]",1583951905,3 years ago,,,1,Fang of Critias Engine,Use Lair of Darkness and Tributes to disrupt your opponent. Fang of Critias can be used to get out monsters with effects to break your opponent's board. Diabolos can't be tributed and is hard to get off the board.
40166,trickstar-the-loli-agenda-40166,Trickstar (The Loli Agenda),61283655,17291,Meta Decks,"[""61283655"",""61283655"",""61283655"",""37742478"",""37742478"",""37742478"",""35199656"",""35199656"",""35199656"",""98700941"",""98700941"",""94145021"",""94145021"",""94145021"",""49238328"",""49238328"",""49238328"",""98645731"",""98645731"",""98645731"",""73628505"",""73628505"",""24224830"",""24224830"",""24224830"",""85562745"",""85562745"",""35371948"",""35371948"",""35371948"",""21076084"",""21076084"",""21076084"",""10045474"",""10045474"",""40605147"",""40605147"",""40605147"",""41420027"",""84749824""]","[""56832966"",""86532744"",""84013237"",""90590304"",""51960178"",""41302052"",""3792766"",""86750474"",""38342335"",""32448766"",""32448766"",""94626871"",""51011872"",""2857636"",""14365823""]","[""10000080"",""10000080"",""10000080"",""78661338"",""78661338"",""14558127"",""14558127"",""14558127"",""12580477"",""43898403"",""43898403"",""43898403"",""15693423"",""15693423"",""15693423""]",1583951905,3 years ago,,,3,Loli Loli Burn Damage Damage Step? Honest for game.,"People are playing this deck wrong.  &nbsp;  You need to win by turn 2-2.5. Dark room of nightmare and your pots easily and consistently burn your opponent for about 4k or more if they feel the need to search. Honest (unironically the best card in the deck) and your simple swarming ability can get you the win.  &nbsp;  Yes. You play pot of duality. You can summon Lycoris on your opponents draw phase. Yes, you play pot of extravagance. Your extra deck couldn't be more irrelevant.  &nbsp;  Feel free to replace any handtraps (except droll to nuke your opponents hand and turn) and traps and side deck with cards you like more, but I found the ones I added to work pretty well.  &nbsp;  Let me know what you think and comment below if you want me to take a crack at another deck."
40160,simorgh-40160,Simorgh,95192919,12343,Non-Meta Decks,"[""86489182"",""95192919"",""95192919"",""95192919"",""22586618"",""22586618"",""22586618"",""23619206"",""23619206"",""23619206"",""14558127"",""14558127"",""14558127"",""96214561"",""96214561"",""96214561"",""50820852"",""50820852"",""50820852"",""97268402"",""97268402"",""97268402"",""49238328"",""49238328"",""49238328"",""73628505"",""73628505"",""28617139"",""28617139"",""28617139"",""64002884"",""24224830"",""24224830"",""24224830"",""92223430"",""92223430"",""92223430"",""10045474"",""10045474"",""10045474""]","[""93854893"",""93854893"",""93854893"",""49202162"",""49202162"",""49202162"",""38342335"",""38342335"",""38342335"",""2857636"",""2857636"",""2857636"",""75452921"",""75452921"",""75452921""]","[""11366199"",""64332231"",""88120966"",""85696777"",""101009046"",""77058170"",""35261759"",""38120068"",""70368879"",""81439173"",""83764719"",""79844764"",""53567095"",""87639778"",""101009073""]",1583951905,3 years ago,,,0, Feel free to support the youtube channel with a sub.,https://www.youtube.com/watch?v=-a-_9KnqK2I
40157,lp-40157,+LP,18108166,15037,Meta Decks,"[""18108166"",""10000090"",""10000010"",""10000011"",""10000020"",""10000080"",""2134346"",""7572887"",""31709826"",""31709826"",""94853057"",""61528025"",""90810762"",""36584821"",""36584821"",""36584821"",""67284107"",""67284107"",""63845230"",""63845230"",""11961740"",""42364257"",""35261759"",""35261759"",""35261759"",""49238328"",""49238328"",""50427388"",""51790181"",""72302403"",""72302403"",""73628505"",""73628505"",""81439174"",""83764719"",""95308449"",""5318639"",""5318639"",""48976825"",""48976825"",""12021072"",""12021072"",""12021072"",""13758665"",""51481927"",""68073522"",""68073522"",""68073522"",""81674782"",""40619825"",""40619825"",""16625614"",""34822850"",""44095762"",""62279055"",""62279055"",""71587526"",""81172176"",""21558682"",""21558682""]","[""62873545"",""62873545"",""51788412"",""51788412"",""66523544"",""66523544""]","[""11366199"",""64332231"",""88120966"",""85696777"",""101009046"",""77058170"",""35261759"",""38120068"",""70368879"",""81439173"",""83764719"",""79844764"",""53567095"",""87639778"",""101009073""]",1583951905,3 years ago,,,2,.,.
40154,magician-40154,Magician,36045450,17299,Fun/Casual Decks,"[""36045450"",""46986416"",""25774450"",""50755"",""11961740"",""88757791"",""17787975"",""72630549"",""46986415"",""72302403"",""35191415"",""82627406"",""87880531"",""12923641"",""20747792"",""7198399"",""2314238"",""62279055"",""94415058"",""99789342"",""95286165"",""20409757"",""38033121"",""38033125"",""71696014"",""22923081"",""88619463"",""20747792"",""41735184"",""71703785"",""83764719"",""28553439"",""62279055"",""37383714"",""89448140"",""88757791"",""44095762"",""69982329"",""34318086"",""3606728"",""48461764"",""51531505"",""80304126"",""46986418"",""15146890"",""26082117""]","[""72167543"",""65301952""]","[""11366199"",""64332231"",""88120966"",""85696777"",""101009046"",""77058170"",""35261759"",""38120068"",""70368879"",""81439173"",""83764719"",""79844764"",""53567095"",""87639778"",""101009073""]",1583951905,3 years ago,,,1,Magic op,Yes
40151,morphtronic-synchro-deck-40151,Morphtronic Synchro deck,93542102,15082,Non-Meta Decks,"[""55326322"",""92720564"",""92720564"",""92720564"",""10591919"",""10591919"",""57108202"",""57108202"",""57108202"",""72291078"",""9742784"",""15521027"",""15521027"",""15521027"",""67441435"",""93542102"",""93542102"",""93542102"",""48868994"",""2295440"",""32441317"",""32441317"",""32441317"",""37745919"",""37745919"",""37745919"",""51405049"",""63995093"",""63995093"",""63995093"",""58577036"",""83764718"",""99674361"",""99674361"",""99674361"",""9622164"",""9622164"",""90239723"",""90239723"",""90239723""]","[""21123811"",""13455674"",""27548199"",""44508095"",""2403771"",""33158448"",""90953320"",""90953320"",""33198837"",""50091196"",""85289965"",""74997493"",""61665245"",""50588353"",""41999284""]","[""2250266"",""55119278"",""50091196"",""37520316"",""44424095"",""72892473"",""81439173"",""24224830"",""9622164""]",1583951905,3 years ago,,,0,Morphtronic deck 2019,"<a rel=""nofollow"" href=""https://youtu.be/J7HXKpeOCYo"">https://youtu.be/J7HXKpeOCYo</a>"
40148,spyral-4-40148,Spyral 4,35699,16983,Non-Meta Decks,"[""35699"",""35699"",""91258852"",""91258852"",""4055337"",""20584712"",""20584712"",""20584712"",""41091257"",""41091257"",""41091257"",""37433748"",""37433748"",""14558127"",""14558127"",""14558127"",""59438930"",""10158145"",""78080961"",""4474060"",""97268402"",""2295440"",""12580477"",""32807846"",""73628505"",""73628505"",""81439173"",""83764718"",""24224830"",""24224830"",""27642961"",""30979619"",""30979619"",""54631665"",""10045474"",""10045474"",""10045474"",""92450185"",""9212051"",""9212051""]","[""31833038"",""85289965"",""65330383"",""72529749"",""32617464"",""38342335"",""1322368"",""1322368"",""2857636"",""2857636"",""75452921"",""75452921"",""3679218"",""3679218"",""41999284""]","[""62015408"",""62015408"",""62015408"",""94145021"",""94145021"",""94145021"",""64697431"",""64697431"",""64697431"",""15693423"",""15693423"",""15693423"",""23002292"",""23002292"",""23002292""]",1583951905,3 years ago,,,0,spyral deck,<span><span>Escreva sua estratégia de baralho aqui ...</span></span>
40145,deck-1-40145,Deck 1,26077387,17293,Fun/Casual Decks,"[""26077387"",""26077387"",""26077387"",""14558127"",""14558127"",""14558127"",""94145021"",""94145021"",""94145021"",""25955749"",""32807846"",""35726888"",""35726888"",""35726888"",""63166095"",""63166095"",""63166095"",""70368879"",""73594093"",""73628505"",""73628505"",""99550630"",""25733157"",""25733157"",""51227866"",""52340444"",""98338152"",""98338152"",""98338152"",""24010609"",""24010609"",""24010609"",""97616504"",""50005218"",""50005218"",""10045474"",""10045474"",""40605147"",""40605147"",""84749824""]","[""41685633"",""85289965"",""61665245"",""38342335"",""2857636"",""59934749"",""75452921"",""8491308"",""8491308"",""63288573"",""63288573"",""63288573"",""90673288"",""90673288"",""90673288""]","[""62015408"",""62015408"",""62015408"",""73642296"",""73642296"",""1372887"",""1372887"",""1372887"",""43898403"",""43898403"",""43898403"",""48130397"",""51227866"",""23924608"",""23924608""]",1583951905,3 years ago,,,0,asdsadasds,I dont know
40139,six-samurai-40139,six samurai,74752631,17264,Fun/Casual Decks,"[""63176202"",""38280762"",""83039729"",""15327215"",""15327215"",""15327215"",""49721904"",""49721904"",""49721904"",""6579928"",""6579928"",""6579928"",""2511717"",""2511717"",""2511717"",""74094021"",""74094021"",""74094021"",""48505422"",""48505422"",""48505422"",""44686185"",""7291576"",""71207871"",""71207871"",""74029853"",""74029853"",""74029853"",""32807846"",""54031490"",""54031490"",""54031490"",""53819808"",""41587307"",""41587307"",""42199039"",""42199039"",""42199039"",""9622164"",""31423101"",""19508728"",""27970830"",""47436247"",""47436247"",""47436247"",""72345736"",""72345736"",""72345736""]","[""55285840"",""29981921"",""74752631"",""85289965"",""74997493"",""61665245"",""46947713"",""32617464"",""38342335"",""2857636"",""75452921"",""79016563"",""59934749"",""77058170"",""41999284""]","[""62015408"",""62015408"",""62015408"",""73642296"",""73642296"",""1372887"",""1372887"",""1372887"",""43898403"",""43898403"",""43898403"",""48130397"",""51227866"",""23924608"",""23924608""]",1583951905,3 years ago,,,0,ggg,six samurai ggg
40128,evil-eye-metalfoes-40128,Evil Eye Metalfoes,82466274,17291,Non-Meta Decks,"[""82466274"",""82466274"",""82466274"",""18551923"",""14558127"",""14558127"",""14558127"",""59438930"",""59438930"",""59438930"",""69351984"",""69351984"",""69351984"",""33256280"",""33256280"",""33256280"",""7868571"",""7868571"",""7868571"",""18716735"",""18716735"",""18716735"",""49238328"",""49238328"",""49238328"",""73594093"",""73594093"",""73628505"",""73628505"",""79816536"",""48130397"",""44133040"",""44133040"",""70122149"",""70122149"",""70122149"",""33327029"",""33327029"",""69711728"",""69711728""]","[""54401832"",""54401832"",""81612598"",""81612598"",""28016193"",""28016193"",""4688231"",""4688231"",""77693536"",""77693536"",""31833038"",""85289965"",""38342335"",""2857636"",""24094258""]","[""55063751"",""55063751"",""55063751"",""34267821"",""34267821"",""34267821"",""94145021"",""94145021"",""94145021"",""15693423"",""15693423"",""15693423"",""24207889"",""24207889"",""24207889""]",1583951905,3 years ago,,,1,A deck that utilizes the protection of the Evil Eye cards to survive your opponents turn and to gain massive advantage on your next one. ,"I've been messing around with Evil Eye lately and have noticed the deck can really struggle on it's own. I've played around with an Artifact engine, but that can be super bricky and it's a ""Lets hope my opponent can't do anything without their extra-deck"" Strategy. While this can be successful in this format, it isn't consistent enough to be considered viable.  &nbsp;  What I took away from it is that the only elements of Evil Eye that are good enough are the field spell, the equip (obviously), and the Stratos. You can then use Serziels gimmick of destroying your own cards to gain advantage. Like I said previously, Artifacts work ok with this strategy, but I found it's better to supplement an entire engine that can benefit from the Evil Eye's being splashed in then rely on Evil Eye's as the core play makers.  &nbsp;  So the deck's idea and play style should be somewhat obvious from the list. Turn One: You get Serziel and equip it with Evil Eye (Which serves as solid protection and interruption/removal).  You then use any Metalfoes you drew into to set up your board for next turn (for when you'll be popping with Serziel(hopefully)). If you survive to turn 2, you should have accumulated plenty of advantage to be able to steamroll over your opponent, even if a lot of your board was dealt with.  &nbsp;  A notable combo is Using 2 Metalfoes to pop your field spell and your Evil Eye equip, then using the equips grave effect to return it to the field.  &nbsp;  This is by no means a finished product, but in testing, it did pretty well, especially after a few tweaks. Feel free to make and suggest changes and add in the hand-traps/interruption you feel is the best."
