deck_num,pretty_url,deck_name,cover_card,userid,format,main_deck,extra_deck,side_deck,ts_submit_date,submit_date,ts_edit_date,edit_date,comments,deck_excerpt,deck_description
306000,black-luster-solider-insane-deck-13-game-win-streak-306000,Black Luster Solider - Insane Deck 13 game win streak,54484652,109936,Master Duel Decks,"[""72989439"",""90488465"",""61901281"",""53871273"",""99234526"",""50354944"",""38695361"",""85840608"",""85840608"",""85840608"",""6628343"",""6628343"",""32013448"",""32013448"",""17955766"",""14558127"",""14558127"",""23434538"",""23434538"",""79234734"",""5405694"",""54484652"",""54484652"",""34959756"",""40089744"",""40089744"",""40089744"",""99266988"",""99266988"",""99266988"",""81439173"",""18144507"",""32807846"",""73628505"",""24224830"",""24224830"",""14094090"",""45948430"",""45948430"",""41420027"",""10045474""]","[""90448279"",""90590303"",""63746411"",""66011101"",""49202162"",""86066372"",""38342335"",""2857636"",""59934749"",""75452921"",""73539069"",""65741786"",""50277355"",""4280258"",""60303245""]","[""27204311"",""97268402"",""31833038"",""85289965"",""54693926"",""83764719"",""24224830"",""6417578"",""15693423"",""11429811""]",1665599905,5 months ago,,,0,If you want to break away from being a meta slave.. Play this deck,"<p></p><p>&nbsp;</p><p><strong>Watch video for games and commentary</strong></p><p>&nbsp;</p><p><span class=""style-scope yt-formatted-string"" dir=""auto"">For Tournament Info Join Our Discord! Submit Replays to our discord community so they have a chance to be featured in a video! Discord for the Community - </span><a class=""yt-simple-endpoint style-scope yt-formatted-string"" dir=""auto"" spellcheck=""false"" target=""_blank"" rel=""nofollow noopener"">https://discord.gg/qEZuabxskQ</a><span class=""style-scope yt-formatted-string"" dir=""auto""> Twitch - </span><a class=""yt-simple-endpoint style-scope yt-formatted-string"" dir=""auto"" spellcheck=""false"" target=""_blank"" rel=""nofollow noopener"">https://www.twitch.tv/fatzoidd</a><span class=""style-scope yt-formatted-string"" dir=""auto""> </span><a class=""yt-simple-endpoint style-scope yt-formatted-string"" dir=""auto"" spellcheck=""false"" target=""_blank"" rel=""nofollow noopener"">https://www.instagram.com/fatzoidd/</a><span class=""style-scope yt-formatted-string"" dir=""auto""> </span><a class=""yt-simple-endpoint style-scope yt-formatted-string"" dir=""auto"" spellcheck=""false"" target=""_blank"" rel=""nofollow noopener"">https://twitter.com/fatzoiddtv</a></p>"
306003,shaddoll-invoked-dogmatika-mash-up-deck-306003,Shaddoll Invoked Dogmatika Mash-up Deck,69680031,130552,Master Duel Decks,"[""69680031"",""55063751"",""95679145"",""28674152"",""3717252"",""77723643"",""77723643"",""77723643"",""30328508"",""30328508"",""60303688"",""60303688"",""60303688"",""86120751"",""86120751"",""97518132"",""97518132"",""97518132"",""51023024"",""4939890"",""4939890"",""4939890"",""14558127"",""37445295"",""37445295"",""47679935"",""47679935"",""18144507"",""74063034"",""74063034"",""1984618"",""12580477"",""44394295"",""44394295"",""48130397"",""48130397"",""21011044"",""21011044"",""21011044"",""10045474""]","[""11270236"",""74822425"",""19261966"",""75286621"",""20366274"",""20366274"",""41209827"",""97300502"",""50907446"",""85908279"",""74009824"",""94977269"",""94977269"",""13529466"",""86938484""]","[""27204311"",""97268402"",""31833038"",""85289965"",""54693926"",""83764719"",""24224830"",""6417578"",""15693423"",""11429811""]",1665599905,5 months ago,,,0,Shaddoll Invoked Dogmatika,<p>An experimental hybrid deck with several engines mashed together in what becomes a very coherent and consistent deck so long as you summon in the right order and never forget about the Dogmatika cards extra deck block once you've used their effects. Always keep in mind to use everything beforehand if you have the option.<br /><br />With these cards you'll also be able to often have the option to summon either one or several Invoked or El Shaddolls every turn provided you use the Shaddolls graveyard effects. Also Invocation's ability to steal your opponents graveyard is also super-useful against more meta-threatening decks.&nbsp;</p>
306004,cursed-lands-306004,Cursed Lands,31434645,130564,Master Duel Decks,"[""95440946"",""95440946"",""95440946"",""10000080"",""86120751"",""86120751"",""86120751"",""31434645"",""31434645"",""31434645"",""47679935"",""47679935"",""47679935"",""68829754"",""68829754"",""68829754"",""74063034"",""74063034"",""74063034"",""94224458"",""94224458"",""94224458"",""458748"",""458748"",""458748"",""20590515"",""20590515"",""20590515"",""67007102"",""67007102"",""67007102"",""93191801"",""93191801"",""93191801"",""56984514"",""56984514"",""56984514"",""92379223"",""92379223"",""92379223"",""20612097"",""20612097"",""20612097"",""47457347"",""47457347"",""47457347"",""42671151"",""42671151"",""42671151""]","[""74889525"",""11270236"",""75286621"",""48791583"",""97300502"",""13529466"",""97973962""]","[""27204311"",""27204311"",""62098216"",""93672138"",""54693926"",""54693926"",""18144507"",""14532163"",""2263869"",""8267140"",""8267140"",""43262273"",""15693423"",""15693423"",""15693423""]",1665599905,5 months ago,,,0,"When they faild to make the stone, he failed to control it. When he invoked the ritual, His power grew. The light touches all....",<p>This set brings eldlich and invoked together to complete the story of the eldlands. How does it end? you decide</p>
306005,dogmatika-post-phhy-306005,Dogmatika post CYAC,51522296,109530,Non-Meta Decks,"[""69680031"",""69680031"",""13694209"",""95679145"",""60303688"",""60303688"",""60303688"",""51522296"",""40352445"",""40352445"",""48654323"",""48654323"",""35569555"",""35569555"",""35569555"",""68462976"",""68462976"",""68462976"",""1984618"",""1984618"",""1984618"",""13048472"",""13048472"",""13048472"",""2263869"",""2263869"",""24224830"",""31002402"",""31002402"",""31002402"",""60921537"",""60921537"",""21011044"",""82956214"",""82956214"",""82956214"",""42158279"",""10045474"",""10045474"",""10045474""]","[""24915933"",""41373230"",""50907446"",""11765832"",""94977270"",""80532587"",""80532587"",""101112042"",""101112042"",""74586817"",""98506199"",""79606837"",""9940036"",""10669138"",""26847978""]","[""27204311"",""27204311"",""62098216"",""93672138"",""54693926"",""54693926"",""18144507"",""14532163"",""2263869"",""8267140"",""8267140"",""43262273"",""15693423"",""15693423"",""15693423""]",1665599905,5 months ago,1673375905,2 months ago,2,DOGMATIKA SUPPORT LETS FUCKING GOOOOOOOOOOOOOOOO,"<p>If you want a more detailed guide on the deck check my older deck profile, in this one i will only talk about the newer cards.</p><p>Dogmatikatrix is pretty much a replacement for Preparations of rites and now with Nadir at 3 the searching is just insane + it replaces Branded in Central Dogmatika in the sending a card from your opponent's ED department.</p><p>The new ritual is just incredibly baller, tied with the Drytron rituals in the category of highest defense for ritual monsters you will rarely be run over by battle.</p><p>The ways to get to it are even simpler now, Nadir sends Herald from your Ed, Herald adds Dogmatikalamity, Nadir adds Ecclesia, Ecclesia searches Maximus, Maximus Special summons and sends 1 Arc Light add Zoa and then you can send Omega to Shuffle back a card or Wind pegasus to bounce one of your opponent's monster, Dogmatikalamity sends First darklord as the requirement. If it does get destroyed you can just Re-ritual summon it from grave with Dogmatikamacabre by banishing Lucifer from Gy.</p><p>If your opponent does control monsters search Dogmatrix and use your send from Ed to send N'tss and Aggregator to bait negates or remove monsters from their board, Dogmatrix then adds the ritual and Ecclesia, Ecclesia adds zoa.</p>"
306007,floowandereeze-ots-1st-place-10-3-22-list-306007,Floowandereeze OTS 1st place 10/3/22 list,80611581,102508,Meta Decks,"[""80611581"",""80611581"",""69327790"",""29587993"",""91800273"",""91800273"",""91800273"",""52843699"",""52843699"",""52843699"",""73356503"",""54334420"",""54334420"",""54334420"",""80433039"",""18940725"",""18940725"",""18940725"",""17827173"",""24508238"",""81674782"",""55521751"",""92223430"",""28126717"",""28126717"",""28126717"",""54693926"",""54693926"",""54693926"",""98645731"",""98645731"",""98645731"",""49238328"",""49238328"",""49238328"",""73628505"",""24224830"",""69087397"",""69087397"",""69087397"",""41215808""]","[""75286621"",""92731385"",""90448279"",""58069384"",""55285840"",""27240101"",""48608796"",""99726621"",""86066372"",""52331012"",""2857636"",""26847978"",""27381364"",""65741786"",""14812471""]","[""62015408"",""62015408"",""62015408"",""24508238"",""24508238"",""55521751"",""18144507"",""64002884"",""8267140"",""8267140"",""69452756"",""69452756"",""87639778"",""87639778"",""87639778""]",1665599905,5 months ago,1665599905,5 months ago,0,Without ultimate slayer and/or prosperity for budget.,"<p>ED can be quite literally anything.<br />I'd recommend playing Superdreadnought Rail Cannon Gustav Max for time.</p><p>If you have the cards/money Swap Extrav for prosperity and ghost reaper + repulsion for ultimate slayer and Evil☆Twins Ki-sikil &amp; Lil-la then put Evil★Twin's Trouble Sunny, Wing pegasus @ignister, Psy-framelord Omega, Garura wings of resonant life, and Elder Entity N'tss in the extra deck for targets to send off Ultimate slayer.</p>"
306009,ultimate-fusion-deck-2022-306009,Ultimate Fusion Deck 2022,6205579,73212,Non-Meta Decks,"[""5560911"",""81866673"",""14536035"",""14785765"",""28985331"",""423585"",""37799519"",""56343672"",""41431329"",""41431329"",""39829561"",""39829561"",""6205579"",""68543408"",""37750912"",""9622164"",""9622164"",""9622164"",""31423101"",""34959756"",""48447192"",""49306994"",""65993085"",""70786111"",""1041278"",""9411399"",""9411399"",""27780618"",""27780618"",""27780618"",""54485355"",""54485355"",""54485355"",""88544390"",""88544390"",""88544390"",""2460565"",""2460565"",""2460565"",""63821877"",""90432163"",""25538345"",""25538345"",""25538345"",""36426778"",""36426778"",""36426778"",""19353570"",""19353570"",""19353570"",""38783169"",""32807846"",""70368879"",""81439173"",""83764718"",""98827725"",""98827725"",""98827725"",""25542642""]","[""37818794"",""73452089"",""86240887"",""70534340"",""60461804"",""87746184"",""80532587"",""11790356"",""44508094"",""2403771"",""601193"",""66011101"",""45819647"",""59934749"",""50277355""]","[""97300502"",""41578483"",""11443677"",""26273196"",""92731385"",""71015787"",""37818794"",""27548199""]",1665599905,5 months ago,,,0,"Fusions, Fusion Parasite, Dragoon, Buster Blader","<p>Its a Ultimate fusion parasite deck using an insect engine.</p><p>Check out our YouTube Channel for more. <a title=""Jollie Scarecrows"">Jollie Scarecrows</a></p>"
306010,ninja-306010,Ninja,11825276,27251,Non-Meta Decks,"[""76930964"",""76930964"",""56562619"",""79441381"",""79441381"",""79441381"",""95027497"",""95027497"",""95027497"",""20065259"",""58911105"",""58911105"",""58911105"",""94670654"",""67282505"",""67282505"",""42052439"",""42052439"",""42052439"",""6830480"",""31887806"",""79324191"",""37478723"",""9622164"",""31423101"",""34959756"",""32939238"",""32807846"",""24224830"",""68038375"",""13629812"",""15693423"",""15693423"",""15693423"",""10045474"",""10045474"",""10045474"",""98827725"",""98827725"",""98827725""]","[""11825276"",""11825276"",""82944432"",""21044178"",""98127546"",""74997493"",""45112597"",""86066372"",""38342335"",""37354507"",""37354507"",""59934749"",""65741786"",""50277355"",""4280258""]","[""29587993"",""73356503"",""90448279"",""90590303"",""66011101"",""16272453"",""84211599"",""95545183"",""50766506"",""70861343"",""83326048""]",1665599905,5 months ago,,,0,Ninja Post Darkwing Blast October 2022 Banlist,<p>Ninja Post Darkwing Blast October 2022 Banlist</p>
306011,ignister-mathmech-october-2022-306011,Ignister Mathmech October 2022,15808381,18732,Non-Meta Decks,"[""27204311"",""27204311"",""82257671"",""66192538"",""36521307"",""36521307"",""36521307"",""16020923"",""16020923"",""16020923"",""17946349"",""27182739"",""53577438"",""88413677"",""42429678"",""14558127"",""14558127"",""14558127"",""15808381"",""15808381"",""15808381"",""41306080"",""97268402"",""97268402"",""6552971"",""6552971"",""6552971"",""14025912"",""28270534"",""57160136"",""57160136"",""57160136"",""22933016"",""24224830"",""59054773"",""59054773"",""10045474"",""10045474"",""10045474"",""87804365""]","[""98506199"",""85692042"",""88021907"",""11738489"",""86066372"",""46947713"",""61245672"",""97383507"",""88093706"",""59859086"",""59859086"",""52698008"",""98978921"",""74567889"",""74567889""]","[""75083197"",""27552504"",""15561463"",""27337596"",""99666430"",""45742626"",""8387138"",""6983839"",""46772449"",""62517849"",""11969228"",""73539069"",""691925"",""41620959"",""99266988""]",1665599905,5 months ago,,,0,lots of combos,<p>https://youtu.be/9oQ3xJwkdnI</p>
306012,byssted-baldrake-306012,BYSSTED BALDRAKE,33854624,8997,Non-Meta Decks,"[""69120785"",""69120785"",""69120785"",""32731036"",""32731036"",""32731036"",""6637331"",""6637331"",""6637331"",""33854624"",""33854624"",""33854624"",""60242223"",""60242223"",""60242223"",""101111004"",""101111004"",""101111004"",""25926710"",""25926710"",""25926710"",""99937011"",""99937011"",""62320425"",""62320425"",""62320425"",""63542003"",""63542003"",""63542003"",""92919429"",""92919429"",""92919429"",""17266660"",""17266660"",""17266660"",""81439174"",""84211599"",""84211599"",""84211599"",""34090915"",""17484499"",""32756828"",""98715423""]","[""8264361"",""90590304"",""27069566"",""21521304"",""38495396"",""92661479"",""91949988"",""84815190"",""90448279"",""21044178"",""66011101"",""86066372"",""38342335"",""2857636"",""27381364""]","[""75083197"",""27552504"",""15561463"",""27337596"",""99666430"",""45742626"",""8387138"",""6983839"",""46772449"",""62517849"",""11969228"",""73539069"",""691925"",""41620959"",""99266988""]",1665599905,5 months ago,,,0,BYSSTED BALDRAKE,<p><span>BYSSTED BALDRAKE</span></p>
306013,lob-306013,LoB,39111158,128631,Fun/Casual Decks,"[""39111158"",""36996508"",""55291359"",""10202894"",""10202894"",""10202894"",""36304921"",""77827521"",""77827521"",""85639257"",""85639257"",""85639257"",""45042329"",""45042329"",""55444629"",""55444629"",""55444629"",""13039848"",""53375573"",""33066139"",""54652250"",""7089711"",""7089711"",""91595718"",""4614116"",""50913601"",""59197169"",""53129443"",""73134081"",""73134081"",""73134081"",""66788016"",""66788016"",""83764718"",""83764718"",""55144522"",""55144522"",""55144522"",""12580477"",""83887306""]","[""37440988"",""10034401""]","[""32491822"",""79407975"",""9391354"",""72903645"",""37742478"",""37742478"",""57753602"",""79205581"",""11136371"",""63806265""]",1665599905,5 months ago,,,0,Best pulls yet,<p>Just another LoB deck</p>
306014,deck-profile-from-over-the-rainbow-306014,Deck Profile from Over the Rainbow,79856792,122715,Anime Decks,"[""79856792"",""79856792"",""36795102"",""36795102"",""71620241"",""7093411"",""18847598"",""69937550"",""72843899"",""95600067"",""14469229"",""45236142"",""21698716"",""87475570"",""19963185"",""32933942"",""46358784"",""68215963"",""83575471"",""32710364"",""47408488"",""17052477"",""10938846"",""12644061"",""34487429"",""58371671"",""95326659"",""35486099"",""9334391"",""63945693"",""60876124"",""12877076"",""40854824"",""47149093"",""87259933"",""11155484"",""85766789"",""5611760"",""7617253"",""36328300""]","[""37440988"",""10034401""]","[""32491822"",""79407975"",""9391354"",""72903645"",""37742478"",""37742478"",""57753602"",""79205581"",""11136371"",""63806265""]",1665599905,5 months ago,1675967905,1 month ago,0,Somewhere over the Rainbow... there's a Dragon that is the bridge to other dimensions.,"<p>Thanks to the new Structure Deck, known as&nbsp;<em>Legend of the Crystal Beasts</em>, there are many ways to bring forth the seven... wait a minute, there are eight now.&nbsp; OK, if you want to bring out all the Crystal Beasts to summon an ""Ultimate Crystal"" monster, this Deck has many new cards to do so.<br /><br />The fastest way to summon an ""Ultimate Crystal"" monster (namely, ""Rainbow Overdragon"") is ""Ultimate Crystal Magic"", which can activate immediately if you ram one of your monsters into a stronger one and deliberately destroy it.&nbsp; After that, you can Tribute the Fusion Summoned ""Rainbow Overdragon"" and summon ""Ultimate Crystal Rainbow Dragon Overdrive"".&nbsp; If your opponent has no counter, this will most likely end as a <em>One Turn Kill</em>.<br /><br />If you want to watch your opponent squirm and stall for time, ""Ancient City - Rainbow Ruins"" provides a plethora of effects, depending on the number of Crystal Beasts in your Spell &amp; Trap Zones, while ""Advanced Dark"" allows you to prevent Battle Damage as long as you can send a Crystal Beast from your Deck to the Graveyard.&nbsp; For those who wish to use ""Rainbow Ruins"", ""Crystal Tree"" will help immensely, but try to limit your Crystal Counters to 2 or less.<br /><br />""Awakening of the Crystal Ultimates"" will definitely aid you in bringing out your key cards, be it a ""Rainbow Bridge"" card or ""Rainbow Refraction"", or a ""Crystal Beast"" monster.&nbsp; ""Ruby Carbuncle"" and ""Sapphire Pegasus"" will benefit the most from these.&nbsp; Also, ""Rainbow Bridge of the Heart"" and ""Rainbow Bridge of Salvation"" are the best ""Rainbow Bridge"" candidates to draw with that Quick-Play Spell's effect.</p><p>Now that you know the basics, give this Deck a workout and see where it gets you.&nbsp; And as always, keep smiling, and keep dreaming.</p>"
306015,kitchen-sink-dinos-306015,Kitchen Sink Dinos,18940556,104937,Master Duel Decks,"[""49036338"",""18940556"",""18940556"",""82385847"",""81866673"",""20292186"",""80280944"",""38572779"",""38572779"",""38572779"",""44335251"",""44335251"",""56746202"",""80529459"",""80529459"",""73356503"",""16605586"",""38814750"",""38814750"",""36042004"",""36042004"",""36042004"",""82946847"",""23434538"",""23434538"",""23434538"",""44440058"",""98022050"",""98022050"",""17228908"",""17228908"",""17228908"",""38179121"",""38179121"",""47325505"",""47325505"",""47325505"",""52947044"",""24224830"",""24224830""]","[""60461804"",""27548199"",""33198837"",""74294676"",""42752141"",""21044178"",""72330894"",""86066372"",""8802510"",""47363932"",""72336818"",""7480763"",""34989413"",""70369116"",""41999284""]","[""13039848"",""6285791"",""13945283"",""13945283"",""13945283"",""72892473"",""72892473"",""63102017"",""63102017"",""63102017"",""72302403"",""72302403"",""17814387"",""17814387"",""17814387""]",1665599905,5 months ago,,,0,"Scrap Scythe Simorgh DPE PSY-Frame Dinos. Trust me, it works; just don't ask how.","<p>Scrap dinos with more BS. As for simorgh, use reprodocus to turn a monster into a winged beast, then link into Simorgh for barrier statue. Scythe is just dagda. DPE is verte search fusion destiny. PSY-Frame you can link into lambda to search a PSY-Frame monster from deck when one gets banished (happens at end of turn). Other than that, the deck functions as usual.</p>"
306016,last-will-reaper-yugi-kaiba-deck-306016,Last Will Reaper Yugi/Kaiba Deck,33066139,104530,Fun/Casual Decks,"[""33066139"",""33066139"",""33066139"",""54652250"",""54652250"",""54652250"",""7089711"",""7089711"",""7089711"",""13039848"",""97590747"",""97590747"",""97590747"",""5053103"",""5053103"",""5053103"",""50930991"",""50930991"",""50930991"",""13039848"",""55144522"",""83764718"",""12580477"",""53129443"",""4031928"",""85602018"",""85602018"",""85602018"",""68005187"",""68005187"",""68005187"",""66788016"",""66788016"",""66788016"",""4206964"",""4206964"",""4206964"",""12607053"",""12607053"",""12607053""]","[""11321089"",""44146295"",""44146295"",""69946549"",""70534340"",""70534340"",""72272462"",""41373230"",""87746184"",""87746184"",""87746184"",""6855503"",""11765832"",""92731385"",""27381364""]","[""13039848"",""6285791"",""13945283"",""13945283"",""13945283"",""72892473"",""72892473"",""63102017"",""63102017"",""63102017"",""72302403"",""72302403"",""17814387"",""17814387"",""17814387""]",1665599905,5 months ago,1665599905,5 months ago,0,A 'Last Will Reaper' Deck for Yugi/Kaiba format (May 2002). Hane-Hane equals Book of Moon.,"<p>A 'Last Will Reaper' Deck for Yugi/Kaiba format (May 2002). Hane-Hane equals Book of Moon.</p><p>This deck came to me in a fever dream, but it's fun. I expect to edit it a bit as there are so many things I need to test out with it. I might even remove Hane-Hane. But the Idea for now is to summon Reaper of the Cards off of Last Will then possibly bounce it to your hand with Hane-Hane (or your opponent's Wall of Illusion) then Soul Exchange for the Reaper.</p>"
306017,ddddd-306017,ddddd,25451383,130235,Non-Meta Decks,"[""99456344"",""25451383"",""81555617"",""62962630"",""62962630"",""62962630"",""68468459"",""68468459"",""55273560"",""61173621"",""61173621"",""61173621"",""14558127"",""14558127"",""14558127"",""36577931"",""36577931"",""36577931"",""24508238"",""24508238"",""24508238"",""18973184"",""99543666"",""44362883"",""44362883"",""44362883"",""34773082"",""34773082"",""75500286"",""24094653"",""24094653"",""82738008"",""82738008"",""36637374"",""36637374"",""36637374"",""24224830"",""48130397"",""48130397"",""48130397"",""6763530"",""10045474"",""10045474"",""10045474""]","[""11321089"",""44146295"",""44146295"",""69946549"",""70534340"",""70534340"",""72272462"",""41373230"",""87746184"",""87746184"",""87746184"",""6855503"",""11765832"",""92731385"",""27381364""]","[""74875003"",""62015408"",""62015408"",""62015408"",""18144507"",""14532163"",""14532163"",""14532163"",""24299458"",""24299458"",""24299458"",""1041278"",""15693423"",""15693423"",""15693423""]",1665599905,5 months ago,,,0,dd,<p>d</p>
306018,locals-dinos-306018,Locals Dinos,18940556,66473,Non-Meta Decks,"[""18940556"",""18940556"",""69680031"",""82385847"",""80280944"",""38572779"",""44335251"",""44335251"",""44335251"",""56746202"",""60303688"",""80529459"",""80529459"",""80529459"",""14558127"",""14558127"",""14558127"",""36042004"",""36042004"",""36042004"",""82946847"",""98022050"",""98022050"",""17228908"",""17228908"",""17228908"",""53129443"",""53129443"",""53129443"",""38179121"",""38179121"",""47325505"",""47325505"",""47325505"",""18144507"",""14532163"",""1984618"",""1984618"",""1984618"",""73628505"",""24224830"",""82956214""]","[""80532587"",""74586817"",""50793215"",""74294676"",""42752141"",""42752141"",""90590303"",""21044178"",""66011101"",""86066372"",""38342335"",""2857636"",""47363932"",""72336818"",""41999284""]","[""49036338"",""20292186"",""38814750"",""38814750"",""38814750"",""41373230"",""7480763"",""54693926"",""54693926"",""54693926"",""8267140"",""8267140"",""8267140"",""82956214"",""82956214""]",1665599905,5 months ago,1668191905,4 months ago,0,Scrap Dino goodness with a little Dogma weirdness to throw my opponents off and maybe get a Scythe lock off games 2 and/or 3.,"<p>This is the first deck I've built and I think it's a little wonky but I love dinos and this feels really good. Has the usual dino issue of dying to 1 piece of interaction and the bricks seem GLUED&nbsp; to my hand (driver, scythe, chimera).</p><p>We aim to go 2nd. And I'm still experimenting with the side deck. I mained DRNM but it didn't really help that much since it has anti sinergy with UCT and our goal of blowout otk turn 2 but it's still important enough to keep in.</p><p>&nbsp;</p><p>Update: Added a few more cards that synergize with the strategy. Prima Dona is some spice to recycle Miscellaneousaurus and Nadir got freed :)</p>"
306019,tri-brigade-spright-306019,Tri-brigade Spright,88686573,104897,Non-Meta Decks,"[""49036338"",""6637331"",""6637331"",""87209160"",""87209160"",""87209160"",""14878871"",""14878871"",""14878871"",""14558127"",""14558127"",""14558127"",""13533678"",""13533678"",""75922381"",""50810455"",""50810455"",""50810455"",""76145933"",""38814750"",""38814750"",""38814750"",""56196385"",""56196385"",""56196385"",""88686573"",""68353324"",""68353324"",""24508238"",""24508238"",""14816857"",""14816857"",""81439173"",""88836438"",""15443125"",""15443125"",""15443125"",""48130397"",""48130397"",""48130397"",""10045474"",""10045474"",""68250822"",""40975243""]","[""11765832"",""54498517"",""99726621"",""99726621"",""86066372"",""47163170"",""26847978"",""47759571"",""27381364"",""27381364"",""72329844"",""65711558"",""65741786"",""4280258"",""60303245""]","[""82385847"",""40975574"",""94145021"",""94145021"",""54693926"",""54693926"",""18144507"",""8267140"",""83326048"",""83326048"",""54974237"",""54974237"",""15693423"",""15693423"",""80101899""]",1665599905,5 months ago,,,0,tri deez nuts,<p>tri-brigade post DWBL</p>
306021,despia-branded-with-clown-306021,Despia Branded with Clown,19096726,9631,Non-Meta Decks,"[""19096726"",""19096726"",""45484331"",""68468459"",""68468459"",""68468459"",""25451383"",""44362883"",""44362883"",""44362883"",""18973184"",""90179822"",""36577931"",""36577931"",""36577931"",""62962630"",""62962630"",""62962630"",""81555617"",""99456344"",""99543666"",""82738008"",""82738008"",""36637374"",""36637374"",""36637374"",""67696066"",""67696066"",""67696066"",""81439173"",""1475311"",""1475311"",""1475311"",""24224830"",""43898403"",""43898403"",""43898403"",""48130397"",""48130397"",""48130397""]","[""34848821"",""41373230"",""87746184"",""87746184"",""87746184"",""70534340"",""70534340"",""44146295"",""44146295"",""72272462"",""18666161"",""54757758"",""41209827"",""69946549"",""4167084""]",,1665599905,5 months ago,1665599905,5 months ago,0,You can use the clown's power,<p>You can use the clown's power</p>
