deck_num,pretty_url,deck_name,cover_card,userid,format,main_deck,extra_deck,side_deck,ts_submit_date,submit_date,ts_edit_date,edit_date,comments,deck_excerpt,deck_description
277992,branded-despia-277992,Branded Despia,62962630,113866,Non-Meta Decks,"[""99456344"",""81555617"",""62962630"",""62962630"",""62962630"",""68468459"",""68468459"",""61173621"",""61173621"",""15717011"",""14558127"",""14558127"",""73642297"",""73642297"",""36577931"",""36577931"",""36577931"",""90179822"",""27847700"",""27847700"",""34773082"",""34773082"",""34773082"",""44362883"",""44362883"",""44362883"",""81439174"",""24224830"",""36637374"",""36637374"",""36637374"",""65681983"",""65681983"",""65681983"",""82738008"",""82738008"",""18973184"",""99543666"",""10045474"",""10045474""]","[""18666161"",""11321089"",""11321089"",""37818794"",""44146295"",""44146295"",""41209827"",""69946549"",""70534340"",""70534340"",""72272462"",""6855503"",""6855503"",""87746184"",""87746184""]","[""66570171"",""94145021"",""94145021"",""94145021"",""8198620"",""14532163"",""14532163"",""14532163"",""24299458"",""24299458"",""24299458"",""48130397"",""48130397"",""48130397"",""4064256""]",1652639905,10 months ago,,,0,Branded despia turbo chimera control,The main idea going first is to end with mirrorjade and branded in red face down so that you can go into guardian chimera on your opponents turn as a form of disruption.  You accomplish this by getting to mirror jade with 1 extra body on the board as a target for mirrorjade to banish by sending an extra deck monster to the graveyard. You will send albion the branded dragon so that you will be able to set your branded in red at the end phase and have it live on your opponents turn. When you use branded fusion going first you're always going to want to send despian tragedy to search the ad libitum of despia because using him as material from your hand when making the chimera allows you to Immediately special summon the mirrorjade back to your side of the field with its banish effect live again.  The frighfur package helps you get materials in your hand for guardian chimera as well as possibly being bait for an ash blossom.  The light hex sealed fusion allows access to dragoon and can also be used as a third copy of Fallen of albaz in a pinch.  The hand traps that hurt the deck the most are played as crossout designator targets at 2x.  The side deck mostly consists of blowout cards for going second with the inclusion of a small zombie world package. You can send Necroworld banshee off of branded fusion to access your zombie world and you can then use super polymerization to make dragonecro nethersoul dragon using your opponents monsters as material.
277975,to-catch-a-predaplant-277975,To Catch A Predaplant,66309175,10777,Non-Meta Decks,"[""17825378"",""17825378"",""17825378"",""62962630"",""62962630"",""68468459"",""68468459"",""61677004"",""61677004"",""35272499"",""35272499"",""35272499"",""89181134"",""89181134"",""44932065"",""44932065"",""70427670"",""70427670"",""70427670"",""14558127"",""14558127"",""59438930"",""97268402"",""44362883"",""44362883"",""44362883"",""36637374"",""36637374"",""36637374"",""65681983"",""65681983"",""31643613"",""8148322"",""48130397"",""48130397"",""76647978"",""24224830"",""1845204"",""10045474"",""10045474""]","[""41578483"",""66309175"",""66309175"",""25586143"",""3410461"",""87746184"",""44146295"",""44146295"",""70534340"",""70534340"",""69946549"",""41209827"",""41373230"",""79864860"",""39915560""]","[""27204311"",""27204311"",""62962630"",""73642296"",""73642296"",""59438930"",""54693926"",""54693926"",""54693926"",""88069597"",""14463695"",""14463695"",""14532163"",""14532163"",""18144507""]",1652639905,10 months ago,,,0,Predaplant Albaz deck profile May 2022,"  Now that Dimension Force is coming to the TCG, Predaplants are finally getting their new support. And thanks to the Alba Strike structure decks, Predaplants are better than they have been in a long time! And the name for this deck is pretty obvious, especially if you watched Dateline back in the early 2000s. Chris Hansen was the GOAT!  &nbsp;  Anyway, this deck is good going first or second, put personally, I prefer going first to set up as many disruptions as I can.  &nbsp;  &nbsp;"
