deck_num,pretty_url,deck_name,cover_card,userid,format,main_deck,extra_deck,side_deck,ts_submit_date,submit_date,ts_edit_date,edit_date,comments,deck_excerpt,deck_description
39515,mayosenju-deck-39515,Mayosenju deck,93368494,15082,Non-Meta Decks,"[""93368494"",""93368494"",""93368494"",""21364070"",""21364070"",""21364070"",""28929131"",""28929131"",""39853199"",""49249907"",""58981727"",""58981727"",""58981727"",""91420254"",""91420254"",""91420254"",""35261759"",""35261759"",""49238328"",""49238328"",""51630558"",""51630558"",""58577036"",""61884774"",""61884774"",""61884774"",""79861914"",""23924608"",""23924608"",""47475363"",""47475363"",""47475363"",""53582587"",""53582587"",""53582587"",""10612222"",""10612222"",""62681049"",""54903668"",""54903668""]","[""26096328"",""26096328"",""49032236"",""56910167"",""90162951"",""6983839"",""22653490"",""46772449"",""85289965"",""72529749"",""38342335"",""2857636"",""24094258"",""75452921"",""90512490""]","[""74530899"",""61391302"",""29587993"",""96227613"",""27354732"",""69838592"",""71614230"",""77511331"",""27107590"",""35261759"",""37469904"",""83764719"",""96598015"",""76751255"",""62681049""]",1583951905,3 years ago,,,0,Mayosenju deck 2019,"<a href=""https://youtu.be/7jp9ek4LB-0"" target=""_blank"" rel=""noopener nofollow"">https://youtu.be/7jp9ek4LB-0</a>"
39518,bluc-39518,bluc,33453260,17086,Non-Meta Decks,"[""36996508"",""46986414"",""71703785"",""38033121"",""30603688"",""30603688"",""26082117"",""7084129"",""7084129"",""7084129"",""71696014"",""14824019"",""9156135"",""14558127"",""14558127"",""59438930"",""59438930"",""31560081"",""31560081"",""2314238"",""81439173"",""23314220"",""23314220"",""23314220"",""89739383"",""89739383"",""1784686"",""1784686"",""82404868"",""83764718"",""11827244"",""43898403"",""73616671"",""73616671"",""28553439"",""28553439"",""47222536"",""47222536"",""47222536"",""7922915"",""7922915"",""7922915"",""48680970"",""48680970"",""48680970""]","[""84433295"",""41721210"",""75380687"",""41721210"",""74586817"",""44508094"",""98558751"",""80117527"",""96471335"",""96471335"",""85551711"",""10000030"",""61665245"",""50588353"",""50756327""]","[""50321796"",""43892408""]",1583951905,3 years ago,,,0,salut cava,Write your deck strategy here...pasmal
39521,cyber-dragon-nachster-vs-all-meta-april-2019-39521,CYBER DRAGON NACHSTER VS ALL META april 2019,1142880,8997,Non-Meta Decks,"[""1142880"",""29975188"",""56364287"",""60600126"",""14558127"",""14558127"",""14558127"",""70095154"",""70095154"",""70095154"",""46659709"",""46659709"",""46659709"",""23893227"",""23893227"",""23893227"",""1142880"",""1142880"",""56364287"",""56364287"",""60600126"",""60600126"",""63995093"",""63995093"",""63995093"",""86686671"",""86686671"",""55704856"",""3659803"",""33041277"",""2295440"",""83764719"",""81439173"",""15693423"",""15693423"",""15693423"",""10045474"",""10045474"",""10045474"",""82428674""]","[""87116928"",""87116928"",""79229522"",""84058253"",""84058253"",""10443957"",""10443957"",""73964868"",""58069384"",""58069384"",""65330383"",""61665245"",""46724542"",""22423493"",""41999284""]","[""33093439"",""82385847"",""82385847"",""15397015"",""15397015"",""15397015"",""94145021"",""94145021"",""94145021"",""23002292"",""23002292"",""23002292"",""53334471"",""53334471"",""53334471""]",1583951905,3 years ago,,,0,CYBER DRAGON NACHSTER VS ALL META april 2019,<a>https://www.youtube.com/watch?v=bcYDmXcN-Gs</a>
39524,cubic-deck-39524,Cubic Deck,20137754,14684,Non-Meta Decks,"[""30270176"",""30270176"",""30270176"",""65192027"",""4998619"",""20137754"",""20137754"",""20137754"",""3775068"",""423585"",""423585"",""423585"",""14558127"",""14558127"",""40392714"",""97268402"",""97268402"",""15610297"",""15610297"",""15610297"",""35058588"",""35058588"",""35058588"",""35726888"",""35726888"",""35726888"",""75500286"",""37520316"",""37520316"",""9659580"",""9659580"",""9659580"",""24224830"",""24224830"",""43898403"",""43898403"",""34325937"",""34325937"",""34325937"",""84749824""]","[""72664875"",""57707471"",""56832966"",""16195942"",""16195943"",""12014404"",""30100551"",""48739166"",""84013237"",""86532744"",""11646785"",""39987164"",""31833038"",""1861629"",""74997493"",""77058170""]","[""10000080"",""10000080"",""82385847"",""82385847"",""82385847"",""33420078"",""63519819"",""81439174"",""1845204"",""1845204"",""83764719"",""2295440"",""14816688"",""25789292"",""53582587""]",1583951905,3 years ago,,,0,....,....
39529,mermail-atlantean-trinity-april-2019-39529,"Mermail Atlantean (Trinity, April 2019)",21954587,6091,Trinity Format Decks,"[""21565445"",""78868119"",""20050865"",""66938505"",""4904812"",""23899727"",""58471134"",""22076135"",""68505803"",""68505803"",""29838323"",""55326322"",""8131171"",""37104630"",""706925"",""74311226"",""3111207"",""26400609"",""22446869"",""21954587"",""13959634"",""82321037"",""2295440"",""96947648"",""98672567"",""67169062"",""1845204"",""70828912"",""9622164"",""19596712"",""37520316"",""43898403"",""44330098"",""71133680"",""59438930"",""14558127"",""60202749"",""92512625"",""74311226"",""4904812""]","[""17412721"",""26593852"",""97007933"",""73580471"",""43202238"",""40509732"",""5614808"",""8561192"",""31320433"",""48739166"",""80117527"",""22110647"",""77637979"",""65170459"",""2857636""]","[""6983839"",""39238953"",""24224830"",""87910978"",""6540606"",""64697431"",""49306994"",""52105192"",""81439173""]",1583951905,3 years ago,,,0,"OTK your opponent with a 1-card combo, or grind them out with Tidal, Dragon Ruler of Waterfalls! ","OTK your opponent with a 1-card combo, or grind them out with Tidal, <a data-name=""Dragon Ruler of Waterfalls"">Dragon Ruler of Waterfalls</a>!  Deck is explained in this video:  <a>https://www.youtube.com/watch?v=JiBoyF6dGSc</a>"
39532,red-eyes-rhapsody-deck-39532,Red Eyes Rhapsody deck,61665245,15082,Non-Meta Decks,"[""46986421"",""74677422"",""74677422"",""74677422"",""88264978"",""30079770"",""5560911"",""8978197"",""34244455"",""15981690"",""93969023"",""93969023"",""93969023"",""9742784"",""84899094"",""8972398"",""66574418"",""1475311"",""1475311"",""1475311"",""2295440"",""32566831"",""32566831"",""41620959"",""41620959"",""41620959"",""71867500"",""71867500"",""71867500"",""81439173"",""83764719"",""92353449"",""92353449"",""24224830"",""24224830"",""62265044"",""62265044"",""57135971"",""57135971"",""39387565""]","[""9753964"",""27548199"",""80666118"",""74586817"",""95685352"",""44405066"",""78144171"",""80117527"",""96471335"",""79266769"",""61665245"",""50588353"",""84271823"",""24361622"",""41999284""]","[""33282498"",""91482773"",""28985331"",""34244455"",""79905468"",""21140872"",""36857073"",""44405066"",""31833038"",""59537380"",""6172122"",""39387565"",""74003290""]",1583951905,3 years ago,,,0,Red Eyes deck 2019,"<a rel=""nofollow"" href=""https://youtu.be/68cZZ_34xvI"">https://youtu.be/68cZZ_34xvI</a>"
39538,super-quantal-mech-king-great-magnus-turbo-39538,Super Quantal Mech King Great Magnus Turbo,84025439,16365,Non-Meta Decks,"[""5560911"",""5560911"",""41091257"",""52350806"",""52350806"",""52350806"",""99234526"",""16209941"",""16209941"",""16209941"",""25259669"",""25259669"",""54582424"",""54582424"",""99745551"",""99745551"",""99745551"",""2460565"",""2460565"",""56410040"",""56410040"",""56410040"",""90432163"",""90432163"",""93187568"",""93187568"",""3233859"",""43694650"",""43694650"",""43694650"",""36426778"",""36426778"",""32807846"",""83764718"",""99674361"",""9622164"",""34959756"",""65993085"",""71453557"",""98827725""]","[""63533837"",""73580471"",""84025439"",""56832966"",""84013237"",""8387138"",""62709239"",""71166481"",""31833038"",""68987122"",""85289965"",""2857636"",""59934749"",""75452921"",""77637979""]","[""82385847"",""62015408"",""62015408"",""24508238"",""24508238"",""94145021"",""94145021"",""43898403"",""48130397"",""53334471"",""53334471"",""58921041"",""58921041"",""58921041"",""61740673""]",1583951905,3 years ago,,,0,Its a turbo deck for bringing out Great Magnus,"Deck Created By: Big Crunch (Deck Inspiration: Rhongomyniad Lock)  Main Goal: During your turn (must be 2nd turn, if not do the side goal) (you also need to be sure that the monster is beatable by Number 27, if not do the side goal), to summon the 2 Number monsters, overlay Number 75 to Number 27, then attack over a monster that is beatable by Number 27. After that, summon Magnus to the field  How to Accomplish:  Use the monsters to swarm the field. (Info Below)  &nbsp;  Monsters <ul>  	<li>Danger! Cards - Use to swarm the field and fill your field with level 4s and 3s.</li>  	<li>Destrudo the Lost Dragon's Frisson - Use it to have a level 3 or level 4 on the field from the hand or graveyard. It is also a Tuner for summoning Level 7 Synchros.</li>  	<li>SPYRAL Super Agent - Its a free Level 4 on the field if you can guess the card on the top of the deck.</li>  	<li>White Dragon Wyverbuster - If you have a Dark monster that you don't mind banishing, this card is a free Level 4 on the field.</li>  	<li>Goblindbergh - A level 4 that can summon another level 4 or 3 monster from your hand if you Normal Summoned it.</li>  	<li>Blue Mountain Butterspy - If you Normal Summon a Warrior-type Monster, you can Special Summon this monster from your hand for free.</li>  	<li>Marauding Captain - A level 3 that can summon another level 4 or 3 monster from your hand if you Normal Summoned it.</li>  	<li>Junk Forward - if you have no monsters on the field, its a free Level 3 Special summon.</li>  	<li>The Phantom Knights of Ancient Cloak - A good follow-up monster to summon alongside Goblindbergh or Marauding Captain. You can banish this card to search the Trap card or Boots.</li>  	<li>Spell Striker - A free monster to summon if you have Spells to banish.</li>  	<li>Psychic Wheelder - If a level 3 monster is on your field, you can Special summon this card. Also a tuner for Summoning Level 7 Synchros</li>  	<li>The Phantom Knights of Silent Boots - Also a good follow-up moster to summon alongside Goblindbergh or Marauding Captain. You can also Special Summon it if you have the Trap card or Cloak on the field. You can banish this card to search for the Trap Card</li> </ul> Spells <ul>  	<li>Reinforcement of the Army - A Warrior Monster searcher. It helps you depends on the situation.</li>  	<li>Monster Reborn - Revive a monster that you need for the combo or a top-deck card.</li>  	<li>World Legacy Succession - If you have a Link monster, you can do a Monster Reborn like effect.</li>  	<li>D.D.R. - Different Dimension Reincarnation - If your needed piece is banished, if you have a discard card, you can use this card to grab that card. It is also an Equip card that Isolde can send to GY.</li>  	<li>Living Fossil - Grab a Level 4 or 3 monster from the Graveyard for combo continuation. It is also an Equip card that Isolde can send to GY.</li> </ul> <ul>  	<li>Overdone Burial - If you discard a level 4 card, you can grab a level 3 card from the GY. If you discarded Destrudo, you can grab a level 4 or 3 card from the GY. It is also an Equip card that Isolde can send to GY.</li>  	<li>Autonomous Action Unit - You can use this card if your opponent has a monster in the GY you can use, or you can steal a monster that can help you win the game. It is also an Equip card that Isolde can send to GY.</li> </ul> &nbsp;  Trap Card <ul>  	<li>The Phantom Knights of Shade Brigandine - You can summon this card as a Warrior monster. Its a free Level 4 monster.</li> </ul> &nbsp;  Extra Deck Cards (Main Goal) <ul>  	<li>Isolde, Two Tales of the Noble Knights - Its a Link card that can grab you a free discard card and it can send Equips to the Graveyard to summon a Level 3 Warrior-Monster.</li>  	<li>Number 27: Dreadnought Dreadnoid - Its the XYZ that will summon Magnus. It can also be used as a wall.</li>  	<li>Number 75: Bamboozling Gossip Shadow - Its the XYZ that will give you extra materials to Number 27.</li>  	<li>Super Quantal Mech King Great Magnus - Its the XYZ that Number 27 will summon. Its unaffected by any effects at 4 or more materials with different names. It also locks your opponent from drawing and searching by card effects (6 or more materials with different names). It can also send a card to the deck without targeting (this can help is something will beat it over or to prevent from abuse of other monsters you control).</li> </ul> &nbsp;  Side Goal:  If you go first, or if you can't summon Number 27, or if you need to do something imporant, you can go to these Extra Monsters for backup  &nbsp;  Extra Deck Cards (Side Goal) <ul>  	<li>Cyberse Quantum Dragon - a Level 7 Synchro you can summon. This card will return an attacking monster that can beat it over. It also prevents attacking other monsters you control.</li>  	<li>Black Rose Dragon - a Level 7 Synchro you can summon. This card can clear out the entire field if there is a board setup.</li>  	<li>Number 39: Utopia/Number S39: Utopia the Lightning - It helps you beat out almost any monster in battle, but only once.</li>  	<li>The Phantom Knights of Break Sword - Helps you destroy a card on your opponents field. You can target Magnus to prevent destroying one of your cards, provided that Magnus has 4 materials.</li>  	<li>Borreload Dragon - A boss monster that you can summon if needed. It can steal monsters and it is immuned to monster targeting effects. It can also lower an attack and defense of a monster.</li>  	<li>Borrelguard Dragon - A boss monster that you can summon if needed. It prevents one attack and it is immuned to effect destruction. It can also revive a monster that was destroyed in your turn.</li>  	<li>Borrelsword Dragon - A boss monster that you can sumon if needed. It prevents also one attack and it is immuned to battle destruction. It can attack twice if you use the postion changing effect.</li>  	<li>Troymare Pheonix - Destroys a Spell/Trap card.</li>  	<li>Troymare Cereberus - Destroys a Monser card.</li>  	<li>LANPhorhynchus - A substitution for Isolde just in case.</li> </ul> The main problem of this is that it is reliant to your opponent on what monster it will summon, but you have backups, so you won't be dead on arrival.It can also be disrupted by your opponent by non-destruction removal or negation. I believe that this deck is almost consistent on bringing out Magnus, but you can adjust the deck if you wish.  Replay Example: https://www.mediafire.com/file/g860gxyer55asgg/Super_Quantal_Mech_King_Great_Magnus_Turbo_-_Sample.yrp/file  Download it and watch it on Percy. I used this deck on a test subject. This will give you a bit of an idea of how the deck works."
39541,some-deck-i-downloaded-39541,some Deck I Downloaded,82385847,16230,Non-Meta Decks,"[""82385847"",""82385847"",""56003780"",""89662401"",""16188701"",""16188701"",""20618081"",""26889158"",""26889158"",""26889158"",""52277807"",""52277807"",""52277807"",""94620082"",""94620082"",""94620082"",""14558127"",""14558127"",""14558127"",""59438930"",""59438930"",""97268402"",""97268402"",""97268402"",""25800447"",""24224830"",""24224830"",""24224830"",""43898403"",""43898403"",""52155219"",""52155219"",""52155219"",""64178424"",""1295111"",""14934922"",""40605147"",""40605147"",""40605147"",""51339637""]","[""37261776"",""21044178"",""87327776"",""87327776"",""41463182"",""41463182"",""46947713"",""88093706"",""2857636"",""87871125"",""87871125"",""87871125"",""14812471"",""14812471"",""14812471""]","[""82385847"",""62015408"",""62015408"",""24508238"",""24508238"",""94145021"",""94145021"",""43898403"",""48130397"",""53334471"",""53334471"",""58921041"",""58921041"",""58921041"",""61740673""]",1583951905,3 years ago,,,0,.....,Was trying a red eyes dangers deck but completely screwed up now kind just to deleted but can't. but hey here is a compete copy of a deck i downloaded
39548,pendulum-deck-39548,pendulum deck,44179224,17093,Meta Decks,"[""51531505"",""53842431"",""53842431"",""53842431"",""29587993"",""29587993"",""29587993"",""71692913"",""96227613"",""96227613"",""27354732"",""27354732"",""14920218"",""14920218"",""12289247"",""12289247"",""12289247"",""69610326"",""69610326"",""69610326"",""75672051"",""75672051"",""72714461"",""72714461"",""72714461"",""48461764"",""48461764"",""73941492"",""73941492"",""73941492"",""20409757"",""35261759"",""35261759"",""35261759"",""41620959"",""41620959"",""53208660"",""53208660"",""53208660"",""81439173""]","[""53262004"",""74586817"",""70771599"",""80696379"",""16691074"",""14152862"",""42160203"",""47349116"",""48739166"",""46772449"",""21044178"",""85216896"",""24094258"",""71384012"",""77637979""]","[""28151978"",""75676192"",""39838559"",""1061200"",""2144946"",""69553552"",""66322203"",""38532954"",""38459905"",""32036866"",""5641251"",""23171610""]",1583951905,3 years ago,,,0,good,good
39559,six-samurai-39559,Six Samurai,61737116,16510,Fun/Casual Decks,"[""61737116"",""61737116"",""61737116"",""71207871"",""71207871"",""71207871"",""2511717"",""2511717"",""1498130"",""1498130"",""7291576"",""7291576"",""15327215"",""15327215"",""83039729"",""83039729"",""6579928"",""6579928"",""31292357"",""67696066"",""91731841"",""63176202"",""63176202"",""54031490"",""54031490"",""27821104"",""27821104"",""27821104"",""27178262"",""27178262"",""27178262"",""7452945"",""7452945"",""47436247"",""47436247"",""47436247"",""7394770"",""83764719"",""24224830"",""97077563""]","[""1828513"",""29981921"",""29981921"",""27548199"",""31833039"",""31833039"",""85289965"",""85289965"",""59934749"",""59934749"",""61665245"",""61665245"",""74752631"",""74752631"",""3113836""]","[""28151978"",""75676192"",""39838559"",""1061200"",""2144946"",""69553552"",""66322203"",""38532954"",""38459905"",""32036866"",""5641251"",""23171610""]",1583951905,3 years ago,,,0,Swarm Deck,The Strategery is to swarm there field with Six Samurai monsters then link summon.
39563,f-a-racer-39563,F.A. Racer,75676192,17078,Fun/Casual Decks,"[""45103815"",""45103815"",""6764709"",""75059201"",""75059201"",""75059201"",""93449450"",""93449450"",""93449450"",""67045745"",""67045745"",""67045745"",""49655592"",""49655592"",""49655592"",""57568840"",""28151978"",""39271553"",""39271553"",""39271553"",""79538761"",""40450317"",""39838559"",""39838559"",""1061200"",""1061200"",""2144946"",""2144946"",""69553552"",""69553552"",""66322203"",""66322203"",""38532954"",""38532954"",""38459905"",""38459905"",""32036866"",""32036866"",""5641251"",""5641251"",""79538761""]","[""75676192"",""75676192"",""33158448"",""33158448"",""33158448"",""37414347"",""37414347"",""37414347"",""5772618"",""97007933"",""21516908"",""72813401"",""74997493"",""20665527"",""22110647""]","[""28151978"",""75676192"",""39838559"",""1061200"",""2144946"",""69553552"",""66322203"",""38532954"",""38459905"",""32036866"",""5641251"",""23171610""]",1583951905,3 years ago,,,0,Increase stare lvl,Main: Risebell the Summoner x2 F.A. Dark Dragster x1 F.A. Turbo Charger x3 F.A. Hang On Mach x3 F.A. Sonic Meister x3 F.A. Whip Crosser x3 Delta Flyer x1 Speedroid Dominobutterfly x1 F.A. Auto Navigator x3 Torque Tune Gear x1 Ties of the Brethren x1 F.A. Circuit Grand Prix x2 F.A. City Grand Prix x2 F.A. Off-Road Grand Prix x2 F.A. Winners x2 F.A. Downforce x2 F.A. Pit Stop x2 F.A. Test Run x2 F.A. Overheat x2 F.A. Dead Heat x2  Extra: F.A. Motorhome Transport x2 F.A. Dawn Dragster x3 F.A. Shining Star GT x3 Hi-Speedroid Kitedrake x1 Hi-Speedroid Kendama x1 Hi-Speedroid Hagoita x1 Hi-Speedroid GOM Gun x1 Saryuja Skull Dread x1 Amphibious Swarmship Amblowhale x1 Mecha Phantom Beast Dracossack x1  Side: Speedroid Dominobutterfly x1 F.A. Motorhome Transport x1 F.A. Circuit Grand Prix x1 F.A. City Grand Prix x1 F.A. Off-Road Grand Prix x1 F.A. Winners x1 F.A. Downforce x1 F.A. Pit Stop x1 F.A. Test Run x1 F.A. Overheat x1 F.A. Dead Heat x1 Limiter Removal x1&lt;!--more--&gt;
39566,evil-blue-eyes-deck-2019-39566,EVIL BLUE-EYES DECK 2019,38517737,8997,Non-Meta Decks,"[""82466274"",""89631139"",""38517737"",""43316238"",""69072185"",""33282498"",""55878038"",""55878038"",""89631139"",""89631139"",""38517737"",""38517737"",""43316238"",""43316238"",""90807199"",""90807199"",""90807199"",""83518674"",""83518674"",""83518674"",""43694650"",""43694650"",""82466274"",""82466274"",""38120068"",""38120068"",""38120068"",""93437091"",""93437091"",""93437091"",""48800175"",""48800175"",""48800175"",""73628505"",""73628505"",""70122149"",""70122149"",""70122149"",""44133040"",""44133040""]","[""58820923"",""2530830"",""39030163"",""28400508"",""18963306"",""63767246"",""63767246"",""8165596"",""57314798"",""85289965"",""38342335"",""2857636"",""75452921"",""8802510"",""77058170""]","[""72989439"",""55063751"",""70711847"",""99745551"",""93854893"",""21887175"",""31833038"",""32617464"",""99111753"",""6853254"",""35261759"",""39701395"",""81439173"",""83764719"",""6494106""]",1583951905,3 years ago,,,0,EVIL BLUE-EYES DECK 2019,<a>https://www.youtube.com/watch?v=QtBvpjyACGg</a>
39571,zombie-world-deck-39571,Zombie World Deck,39185163,17101,Non-Meta Decks,"[""39185163"",""39185163"",""39185163"",""66570171"",""66570171"",""17259470"",""52467217"",""52467217"",""92826944"",""92826944"",""92826944"",""99423156"",""94801854"",""94801854"",""94801854"",""49959355"",""49959355"",""49959355"",""36630403"",""36630403"",""92964816"",""92964816"",""2204140"",""2204140"",""71344451"",""81439174"",""83764718"",""13965201"",""13965201"",""43898403"",""43898403"",""43898403"",""48130397"",""73915051"",""4861205"",""4064256"",""4064256"",""4064256"",""40605147"",""40605147"",""77538567"",""77538567""]","[""8198620"",""27548199"",""50954680"",""83283063"",""74586817"",""28240337"",""57288064"",""57288064"",""63767246"",""31833038"",""85289965"",""37129797"",""37129797"",""91420202"",""41999284""]","[""27198001"",""6039967"",""6039967"",""52467217"",""99423156"",""59843383"",""6021033"",""50588353"",""65357623"",""65357623"",""4861205"",""10045474"",""10045474"",""76045757"",""76045757""]",1583951905,3 years ago,,,0,Shiranui's Zombie World Deck,"With this deck you should be able to do faster combo to get the field spell ""Zombie World"" and the the main boss monster ""Balerdroch"", also introduced little combos with Shiranui"
39574,witchcraft-39574,Witchcraft,21522601,16953,Non-Meta Decks,"[""21522601"",""84523092"",""58139997"",""21744288"",""21744288"",""21744288"",""14558127"",""14558127"",""14558127"",""95245544"",""95245544"",""59851535"",""59851535"",""73594093"",""73594093"",""73594093"",""58577036"",""57916305"",""57916305"",""57916305"",""83301414"",""83301414"",""83301414"",""68462976"",""68462976"",""68462976"",""13758665"",""40252269"",""40252269"",""40252269"",""87769556"",""83289866"",""83289866"",""19673561"",""24224830"",""24224830"",""24224830"",""56894757"",""56894757"",""70368879""]","[""37261776"",""37261776"",""41209827"",""41209827"",""87116928"",""73580471"",""80666118"",""31833038"",""75452921"",""2857636"",""38342335"",""98978921"",""41999284"",""41999284"",""98978921""]",,1583951905,3 years ago,,,0,Witchcraft,Witchcraft deck
39577,evil-eye-39577,Evil Eye,82466274,16953,Non-Meta Decks,"[""78661338"",""78661338"",""85103922"",""20292186"",""20292186"",""18551923"",""82466274"",""82466274"",""82466274"",""14558127"",""14558127"",""59438930"",""59438930"",""97268402"",""97268402"",""98645731"",""98645731"",""49238328"",""49238328"",""49238328"",""73628505"",""73628505"",""70122149"",""70122149"",""70122149"",""44133040"",""44133040"",""79400597"",""29223325"",""29223325"",""43011492"",""73915051"",""48130397"",""12444060"",""12444060"",""12444060"",""24207889"",""24207889"",""24207889"",""79383919"",""79383919""]","[""37261776"",""37261776"",""41209827"",""41209827"",""87116928"",""73580471"",""80666118"",""31833038"",""75452921"",""2857636"",""38342335"",""98978921"",""41999284"",""41999284"",""98978921""]",,1583951905,3 years ago,,,2,Evileye,Evileyes
39580,trickstar-39580,Trickstar,61283655,16953,Meta Decks,"[""35261759"",""35261759"",""35261759"",""24224830"",""24224830"",""24224830"",""73642296"",""73642296"",""98169343"",""98169343"",""98169343"",""59438930"",""59438930"",""73915051"",""21076084"",""21076084"",""21076084"",""35199656"",""35199656"",""35199656"",""61283655"",""61283655"",""61283655"",""37520316"",""37520316"",""37520316"",""98700941"",""35371948"",""35371948"",""35371948"",""94145021"",""94145021"",""94145021"",""73628505"",""73628505"",""14558127"",""14558127"",""14558127"",""40605147"",""40605147""]","[""5821478"",""98978921"",""28776350"",""75452921"",""41999284"",""4914353"",""72529749"",""48815792"",""32448765"",""74586817"",""14365823"",""3987233"",""85289965"",""2857636"",""7778726""]","[""53334471"",""53334471"",""53334471"",""40605147"",""82385847"",""82385847"",""82385847"",""43898403"",""43898403"",""43898403"",""73599290"",""23924608"",""23924608""]",1583951905,3 years ago,,,0,Trickstars,Trickstars
39583,salamangreat-39583,Salamangreat,26889158,16953,Meta Decks,"[""56003780"",""16188701"",""16188701"",""16188701"",""20618081"",""26889158"",""26889158"",""26889158"",""80794697"",""52277807"",""52277807"",""52277807"",""94620082"",""94620082"",""14558127"",""14558127"",""14558127"",""59438930"",""59438930"",""59438930"",""24508238"",""24508238"",""97268402"",""97268402"",""97268402"",""25800447"",""24224830"",""24224830"",""24224830"",""52155219"",""52155219"",""52155219"",""64178424"",""1295111"",""14934922"",""40605147"",""40605147"",""41420027"",""51339637"",""48130397""]","[""37261776"",""21044178"",""87327776"",""31833038"",""41463181"",""41463181"",""88093706"",""2857636"",""48815792"",""87871125"",""87871125"",""87871125"",""14812471"",""14812471"",""14812471""]","[""82385847"",""82385847"",""82385847"",""86962245"",""73642296"",""1372887"",""1372887"",""1372887"",""43898403"",""43898403"",""43898403"",""48130397"",""53334471"",""53334471""]",1583951905,3 years ago,,,0,Salamangreat,Salamangreats
