deck_num,pretty_url,deck_name,cover_card,userid,format,main_deck,extra_deck,side_deck,ts_submit_date,submit_date,ts_edit_date,edit_date,comments,deck_excerpt,deck_description
75455,gaia-deck-new-master-rule-2020-75455,Gaia Deck - New Master Rule 2020,15989522,23928,Non-Meta Decks,"[""72989439"",""33318980"",""34130561"",""34130561"",""34130561"",""7241272"",""61525276"",""61525276"",""61525276"",""7913375"",""7913375"",""7913375"",""14558127"",""14558127"",""14558127"",""1845204"",""1845204"",""1845204"",""14532163"",""14532163"",""14532163"",""73628505"",""81439174"",""83764719"",""38590361"",""38590361"",""38590361"",""48130397"",""48130397"",""48130397"",""73468603"",""49328340"",""40089744"",""40089744"",""2106266"",""2106266"",""2106266"",""10045474"",""10045474"",""10045474""]","[""95793022"",""37818794"",""41209827"",""69946549"",""2519690"",""2519690"",""15989522"",""15989522"",""78084378"",""3366982"",""54757758"",""41578483"",""63519819"",""70369116"",""41999284""]","[""46986421"",""74677425"",""94145021"",""94145021"",""94145021"",""6172122"",""24224830"",""24224830"",""24224830"",""43898403"",""43898403"",""83326048"",""83326048"",""83326048"",""23002292""]",1583951905,3 years ago,,,0,A Gaia deck built using the new support from Rise of the Duelist,"The new Gaia deck is best suited for going second. A very liner deck that aims for the OTK with its boss monsters, Gaia The Magical Dragon Champion and Sky Galloping Gaia The Dragon Champion. Both these monsters are treated as Gaia the Dragon Champion when on the field which synergieses well with both new and old support. They both each also have unique effects which are optimal for different situations. The new Gaia The Magical Dragon Champion has the ability to destroy a card as a quick effect during the main phase at the cost of 2600 attack and gains 2600 attack after destroying an opponents monster by battle. On the other hand Sky Galloping Gaia the Dragon Champion searches Spiral Spear Strike upon summon and can change the battle position of opponents monsters it battles. The new fusion spell Spiral Fusion doubles the attack of both of these monsters and allows them to make up to two attacks on monsters per battle phase. Cursed Dragon - Curse of Dragon searches a spell or trap card that specifically lists Gaia The Dragon Champion in its text and when its used as fusion material can negate the effects of all your opponents monster with less attack than a Gaia The Dragon champion you control. It be special summoned from the hand or graveyard with Gaia the Magical Knight, who can be normal summoned without tribute if you control no monsters or your opponent controls a monster with 2300 or more attack. Bombarding Catapult Turtle acts as a Lonefire Blossom for the deck, tributing a monster in order to special summon a Gaia The Fierce Knight Monster or a level 5 dragon monster from the hand or deck. The field spell Charging Gaia serves as the main searcher of the deck, searching either a Gaia The Fierce Knight monster or level 5 dragon by revealing the corresponding card in your hand. Charging Gaia also has an additional effect that prevents your opponent from activating cards of effects during the battle phase, ensuring an OTK. The final piece of new support used in this deck comes in the form of Soldier Gaia the Fierce Knight. It can be brought out by tributing a dragon fusion you control and can change an attack position monster to defence when summoned. These effects are good for pushing for the OTK or dodging effects and attacks. It also has the additional effect to tribute itself to search out a level 7 or higher warrior type monster, making it a good utility one of. There were also traps released that supported Gaia, but I felt that they were unnecessary in a dedicated OTK strategy.  The other cards included in the deck were to clear the field for an easy OTK. Hand traps such as Ash Blossom and Joyous Spring and Infinite Impermanence as well as generic go second cards such as Lightning Storm, Instant Fusion and Super Polymerization. Some older support such as Curse of Dragonfire, Black Luster Soldier - Envoy of Beginning and Gateway to Chaos were also utilized to increase consistency.  The biggest weakness of the deck is being forced to go first, which is why I included a Dragun of Red-Eyes package in the side deck for when that happens."
75452,x1f525-x1f44a-fire-fist-luna-master-rule-5-tiger-king-x1f42f-x1f451-loops-75452,&#x1f525;&#x1f44a;Fire Fist Luna Master rule 5 (TIGER KING &#x1f42f;&#x1f451; LOOPS),96381979,17983,Meta Decks,"[""43748308"",""43748308"",""43748308"",""98093548"",""6353603"",""6353603"",""92572371"",""30929786"",""30929786"",""44860890"",""3534077"",""26302107"",""35618217"",""35618217"",""35618217"",""14152693"",""50546208"",""83190280"",""83190280"",""83190280"",""40975574"",""40975574"",""40975574"",""93927067"",""77150143"",""10719350"",""10719350"",""10719350"",""57103969"",""57103969"",""57103969"",""93754402"",""66750703"",""23008320"",""23008320"",""23008320"",""46060017"",""46060017"",""46060017"",""35726888"",""35726888"",""35726888"",""48444114"",""13935001"",""55538156""]","[""27346636"",""74168099"",""96381979"",""96381979"",""96381979"",""6983839"",""95169481"",""58504745"",""21044178"",""85289965"",""4280258"",""46241344"",""63503850"",""65711558"",""20265095""]","[""46772449"",""54693926"",""54693926"",""27204311"",""27204311"",""76416959"",""76416959"",""22993208"",""22993208"",""14558128"",""14558128"",""5133471"",""19059929"",""14532163"",""14532163""]",1583951905,3 years ago,,,0,"Fire Fist &#x1f525;&#x1f44a; Master rule 5 (MR5), Tiger King &#x1f42f;&#x1f451; loops, Breaking LiangPeak so many counters. Beast warrior familiy deck","Card notes below deck in action here &gt; <a rel=""nofollow"" href=""https://youtu.be/-GQi6moxyHM"">https://youtu.be/-GQi6moxyHM</a>  (30 minutes of perfection)  <span>Monsters</span>  <strong><span>Fire Fist Core</span></strong> - I dont run cards at higher count then they need to be run <ul>  	<li>1x <a data-name=""Brotherhood of the Fire Fist - Elephant"">Brotherhood of the Fire Fist - Elephant</a> - Searchable Fire Fist hand unloader. If you draw 2 combo Fire fists this is what you search. Only 1 because Red resonator and Kaleido Chick are your primary normal summons, but the deck would take a massive hit without atleast running the one Elephant</li>  	<li>2x <a data-name=""Brotherhood of the Fire Fist - Bear"">Brotherhood of the Fire Fist - Bear </a>- You Never ever mind drawing this because its a combo piece of a hyper common combo, you want to draw this infact. I enter Tiger King loops 90% of games</li>  	<li>2x <a data-name=""Brotherhood of the Fire Fist - Rooster"">Brotherhood of the Fire Fist - Rooster</a> - Another reason you need Elephant is to make Drawing Rooster amazing. You always need Rooster in a deck for Horse Prince, You also kinda need 2 in a deck for Tiger King. 3 would be bricky tho but my deck justifies running 2 better then any other incosistent Fire fist list you saw</li>  	<li>1x <a data-name=""Brotherhood of the Fire Fist - Buffalo"">Brotherhood of the Fire Fist - Buffalo</a> - Commonly dumped of Eagle tho sometimes you dump bear to revive it off Eagle, just a free lvl 4 summon off Eagle. This is not a bad draw he is a combo piece, No lvl 4 fire fist is a bad draw, and tbh each fire fist monster in this deck is a fine draw. You really just dont wanna draw 2 rooster or 2+ Dragons.</li>  	<li>1x <a data-name=""Brotherhood of the Fire Fist - Raven"">Brotherhood of the Fire Fist - Raven</a> - Required combo piece for some combos. Sometimes you need Raven for Rooster, the card is good combo piece overall</li>  	<li>3x <a data-name=""Brotherhood of the Fire Fist - Dragon"">Brotherhood of the Fire Fist - Dragon</a> - Because you literally summon this card sometimes 7 times a turn.. Yep 7, combo piece and an extender, Drawing 2 is horrid but it shouldnt happen in a 45 card deck.</li>  	<li>1x <a data-name=""Coach Soldier Wolfbark"">Coach Soldier Wolfbark</a> - Adopted by Fire fist familiy, he is needed for Tiger King loops, he is the first card you summon along with second bear. I showcased this 6 months ago everyone has cought up to it. You typically summon Bear + Wolfbark, Then 2x Dragon, then 2x rooster, then 2x Lunalight cards.</li> </ul> <strong>Fire Formation core 8 - Spells, 1 trap</strong>.  - You might think this is a little but keep in mind Resonator and Luna engine turbo out the fire formation spells via Either Horse prince or Tiger King, thats just smarter then running the bad formations or more of the Ok ones. <ul>  	<li>3x <a data-name=""Fire Fist Tenki"">Fire Fist Tenki</a> - better then in standard Fire Fist deck (In pure FF deck tensu is the most important FF spell) because it searchers Lunalight engine to which means this card became a better extender Tiger King summons Kaleido Chicks and sets tensu to net you Tiger (Certain loops)</li>  	<li>3x <a data-name=""Fire Fist Tensu"">Fire Fist - Tensu</a> - just amazing, the activation is not OPT which matters, without this card the deck would suck at tiger king loops.</li>  	<li>1x <a data-name=""Fire Formation Domei"">Fire Formation - Domei</a> - searchable extender, Usually rooster sends it to the graveyard so that you can revive a Dragon so that Dragon can revive again.</li>  	<li>1x <a data-name=""Fire Fortress Atop Liang Peak"">Fire Fortress Atop Liang Peak</a> - 10 counters Turn 1, in some rare combos you cant do that but then you put 6 counters search Tiger and end on impressive board anyway, He summons Ancient warrior link Shuanglong or Gladiator beast Heraklinos if you arent Horse Prince restriction locked.</li>  	<li>1x <a data-name=""Ultimate Fire Formation - Sinto"">Ultimate Fire Formation - Sinto</a> - Hi dark ruler no more, bye. Its hopt, you can access 2 every game but I value consistency over power, you dont need more power</li> </ul> <strong><span>Lunalight Engine <span>-</span></span></strong><span><span><strong> You cant play just 7 monsters</strong>, you need a second lvl 4 sendable of Kaleido chick for some combos, because else you cant Revive anything since every lunalight is under xyz material, and it has to be lvl 4 because thats what makes Diamond Dire Wolf</span></span> <ul>  	<li>3x <a data-name=""Lunalight Kaleido Chick"">Lunalight Kaleido Chick</a> - this + tiger or red resonator is a long Tiger King loop which does like 7 negates + tornado + dweller.</li>  	<li>3x <a data-name=""Lunalight Tiger"">Lunalight Tiger</a> - Searchable of LiangPeak, Resonator combos, Just a great card tbh</li>  	<li>1x <a data-name=""Lunalight Yellow Marten"">Lunalight Yellow Marten</a> - You either run 2 Marten, or 1 Marten + 1 any other lvl 4 Luna (Emerald being one of the better ones)</li>  	<li>1x <a data-name=""Lunalight Emerald Bird"">Lunalight Emerald Bird</a> - This card adds mini consistency while Marten adds mini resiliency to d.d crow.. I ended up preffering consistency</li>  	<li>1x <a data-name=""Luna light - Perfume"">Luna light - Perfume</a> - Just one keep in mind this deck is 60% Fire fist and it turbos out Fire fists, obviously a very good one off specially because of goods</li>  	<li>1x <a data-name=""Lunalight Serenade dance"">Lunalight Serenade dance</a> - Main foolish burial goods target</li> </ul> <span><strong>Resonator engine</strong></span> <ul>  	<li>3x <a data-name=""Resonator call"">Resonator call</a> (Red resonator)</li>  	<li>3x <a data-name=""Red resonator"">Red resonator</a> - Horse prince is the way, yes the restriction is stupid but this is Fire Fist 3.5 Lunalight axis deck, Shuanglong exists..</li> </ul> Often times I side 1 or 2 cards of this engine because they are so fragile going second. Also  <strong>Additional engines</strong> <ul>  	<li><a data-name=""Danger! Dogman"">Danger! Dogman</a> - Free beast warrior drop upstart goblin.... Easy side out. What is there not to like tbh...</li>  	<li><a data-name=""Kaiser Worse Raider"">Kaiser Worse Raider</a> - Free best warrior drop, Red Layer of beast warriors, this deck is Eagle turbo, think of Eagle as Isolde</li>  	<li><a data-name=""3x Zoodiac Barrage"">Zoodiac Barrage</a> (3) - half an eagle, half a Tiger king, superb extender</li>  	<li><a data-name=""1x Zoodiac thoroughblade"">Zoodiac thoroughblade</a> - makes it so that drawing multiple barrages is fine... unless you draw into another one past his effect</li> </ul> Extra deck <ul>  	<li>3x <a data-name=""Brotherhood of the Fire Fist - Tiger King"">Brotherhood of the Fire Fist - Tiger King</a> - My video proves 3 is mandatory, the best legal R4 in entire game</li>  	<li><a data-name=""Brotherhood of the Fire Fist - Cardinal"">Brotherhood of the Fire Fist - Cardinal</a> - Castel on crack, not only does he put Dragons back so that they can be summoned again, he shuffles cards op controls not only from the field but from graveyard to</li>  	<li><a data-name=""Brotherhood of the Fire Fist - Eagle"">Brotherhood of the Fire Fist - Eagle</a> - I wish I had space for second, this card is literally a restriction bypasser and a pluser</li>  	<li><a data-name=""Brotherhood of the Fire Fist - Horse Prince"">Brotherhood of the Fire Fist - Horse Prince</a> - Duh resonator engines, nice to have an extra deck monster which summons from deck</li>  	<li><a data-name=""Brotherhood of the Fire Fist - Peacock"">Brotherhood of the Fire Fist - Peacock</a> - Link 2 which Dragon can keep reviving, out opponent monsters via BP just link into brute enforcer after</li>  	<li><a data-name=""Diamond Dire Wolf"">Diamond Dire Wolf</a> - there is not a single deck in entire game which abuses Dire Wolf more, Tiger King trigger, Lunalight tiger trigger, Domei trigger, removal</li>  	<li><a data-name=""Abyss Dweller"">Abyss Dweller</a> - standard r4</li>  	<li><a data-name=""Tornado Dragon"">Tornado Dragon</a> - extra standard r4 because it can pop lunalight tiger, domei and net you revives.. usually another R4</li>  	<li><a data-name=""Gladiator Beast Heraklinos"">Gladiator Beast Heraklinos</a> - Beast warrior Naturia exterio</li>  	<li><a data-name=""Borrelsword Dragon"">Borrelsword Dragon</a> - standard otk card, big uneffected monster out, also protects appolousa, you actually summon this card turn 1 because well you can...</li>  	<li><a data-name=""Appolousa, Bow of the Goddess"">Appolousa, Bow of the Goddess</a> - 3 monster negates typically protected by shuanglong</li>  	<li><a data-name=""Brute Enforcer"">Brute Enforcer</a> - link 2 for Peacock, generic card to declog a board, not bad removal</li>  	<li><a data-name=""Ancient warriors allied generals - Shuanglong"">Ancient warriors allied generals - Shuanglong</a> - The quickplay bouncer</li> </ul> <span>Side deck</span>  only gonna mention interesting stuff: <ul>  	<li><a data-name=""Evilswarm Exciton knight"">Evilswarm Exciton knight</a> for going second (siding out the Heraklinos)</li>  	<li>2x <a data-name=""Ancient Warriors - Loyal Guan Yun"">Ancient Warriors - Loyal Guan Yun</a> - beast warrior pankratops which stays on field so that you can enter Eland, great at dealing with Appolousa boards</li>  	<li>1x <a data-name=""Galaxy Cyclone"">Galaxy Cyclone</a> - to handle mystic mine decks (Hi foolish burial goods)</li>  	<li>1x <a data-name=""Fire formation Gyokkou"">Fire formation Gyokkou</a> - Locks opponent st from activating, super accessible card for stun matchups</li>  	<li>2x <a data-name=""Onslaught of the fire king"">Onslaught of the fire king</a> - summon raven.. raven is half an Eagle + you ll get fire formation spell. You can also summon buffalo then you always send bear.</li> </ul> &nbsp;  &nbsp;"
75449,trishula-hand-loop-deck-2020-post-mr5-75449,TRISHULA HAND LOOP DECK 2020 - POST MR5,52687916,8997,Non-Meta Decks,"[""4810828"",""4810828"",""4810828"",""96729612"",""96729612"",""96729612"",""24224830"",""24224830"",""24224830"",""71650854"",""5560911"",""9411399"",""9411399"",""9411399"",""59975920"",""59975920"",""59975920"",""25259669"",""25259669"",""25259669"",""2460565"",""2460565"",""2460565"",""54582424"",""54582424"",""54582424"",""27780618"",""27780618"",""27780618"",""85840608"",""85840608"",""85840608"",""17955766"",""17955766"",""17955766"",""56410040"",""56410040"",""56410040"",""65367484"",""65367484"",""14536035"",""28985331"",""14785765"",""423585"",""56343672"",""83903521"",""53855409"",""67441435"",""72291078"",""9742784"",""81439173"",""32807846"",""9622164"",""9622164"",""9622164"",""31423101"",""34959756"",""65993085"",""71453557"",""83438826""]","[""52687916"",""52687916"",""74586817"",""2403771"",""33158448"",""98558751"",""37675907"",""39964797"",""81846453"",""88581108"",""66011101"",""74997493"",""4280258"",""59934749"",""50588353""]","[""27204311"",""27204311"",""27204311"",""82385847"",""12580477"",""14532163"",""14532163"",""14532163"",""54693926"",""54693926"",""54693926"",""43898403"",""43898403"",""43898403"",""23002292""]",1583951905,3 years ago,,,0,TRISHULA HAND LOOP DECK 2020 - POST MR5,"youtube video - <a rel=""nofollow"" href=""https://youtu.be/y3SfzJAJb2Y"">https://youtu.be/y3SfzJAJb2Y</a> <div> <div class=""gtx-trans-icon""></div> </div>"
75446,dragon-lord-75446,Dragon Lord,1639384,21165,Meta Decks,"[""60681103"",""60681103"",""60681103"",""3954901"",""3954901"",""51786039"",""51786039"",""51786039"",""32872833"",""32872833"",""32872833"",""33282498"",""33282498"",""33282498"",""78661338"",""78661338"",""33460840"",""33460840"",""33460840"",""66752837"",""66752837"",""66752837"",""6075801"",""6075801"",""6075801"",""41620959"",""41620959"",""41620959"",""6853254"",""6853254"",""6853254"",""73628505"",""38120068"",""38120068"",""38120068"",""62265044"",""62265044"",""69868555"",""69868555"",""69868555""]","[""2530830"",""1639384"",""18963306"",""39030163"",""88177324"",""63767246"",""2978414"",""80117527"",""2411269"",""68987122"",""31833038"",""85289965"",""1861629"",""24361622"",""24361622""]","[""27204311"",""27204311"",""27204311"",""82385847"",""12580477"",""14532163"",""14532163"",""14532163"",""54693926"",""54693926"",""54693926"",""43898403"",""43898403"",""43898403"",""23002292""]",1583951905,3 years ago,,,0,No Blue-Eyes or Red-Eyes,Summon as many big dragons as possible for beatsticks  Send Arbrave and Divine Felgand to the GY
75417,expensive-af-mathmech-75417,Expensive AF Mathmech,42632209,20415,Non-Meta Decks,"[""43316238"",""43316238"",""43316238"",""90807199"",""90807199"",""90807199"",""71197066"",""55063751"",""55063751"",""55063751"",""27182739"",""27182739"",""27182739"",""53577438"",""53577438"",""53577438"",""16360142"",""16360142"",""16360142"",""80965043"",""80965043"",""80965043"",""52354896"",""52354896"",""52354896"",""14532163"",""14532163"",""14532163"",""38120068"",""38120068"",""38120068"",""49238328"",""49238328"",""49238328"",""57160136"",""57160136"",""57160136"",""24224830"",""24224830"",""24224830""]","[""42632209"",""42632209"",""42632209"",""63767246"",""93854893"",""23085002"",""66403530"",""66403530"",""85289965"",""85289965"",""38342335"",""2857636"",""65741786"",""65741786"",""24842059""]","[""102380"",""102380"",""102380"",""94145021"",""94145021"",""94145021"",""43898403"",""43898403"",""43898403"",""36361633"",""36361633"",""36361633"",""40605147"",""40605147"",""40605147""]",1583951905,3 years ago,,,0,"OTK, justify buying these expensive cards by OTK'ing as much as possible",If you have a lot of money to blow on a table 500 deck then this deck list is for you :) Its really expensive and you could use these cards in much better decks but when you do OTK with this its very nice
75414,gouki-extra-power-2020-75414,Gouki Extra Power 2020,59934749,21880,Meta Decks,"[""60461077"",""24073068"",""24073068"",""24073068"",""97688360"",""97688360"",""97688360"",""54088068"",""54088068"",""54088068"",""7540107"",""85008676"",""69015963"",""25148255"",""54582424"",""54582424"",""56410040"",""56410040"",""56410040"",""14558127"",""14558127"",""14558127"",""32807846"",""54693926"",""54693926"",""54693926"",""58577036"",""62376646"",""62376646"",""83764719"",""43898403"",""43898403"",""31423101"",""34959756"",""65993085"",""27204311"",""27204311"",""15693423"",""15693423"",""31175914""]","[""99916754"",""86099788"",""2322421"",""33198837"",""59934749"",""21887175"",""68987122"",""85289965"",""4280258"",""38342335"",""2857636"",""59934749"",""75452921"",""59934749"",""41999284""]","[""10045474"",""10045474"",""72529749"",""2956282"",""15693423"",""43898403"",""8267140"",""24224830"",""24224830"",""24224830"",""94145021"",""94145021"",""94145021"",""23002292"",""10045474""]",1583951905,3 years ago,,,0,Well tested and checked Gouki deck with access to the most powerful monsters from extra deck.  Going first  or  going second  balanced deck.,"Possibility of making many combos, depending on the cards you have in your hand. From the weakest hand we can create (except with dead hand - much about 20%): <div class=""ZUo4Ze""> <div class=""fwCBrd""> <div class=""dJcyOc"">1  ""Apollousa, Bow of the Goddess"" (3 negatives) + ""Linkuriboh""</div> <div class=""dJcyOc"">2  ""Apollousa, Bow of the Goddess""(3 negatives) + ""Knightmare Phoenix""</div> <div class=""dJcyOc"">3 ""The Last Warrior from Another Planet"" +""Borrelguard Dragon""</div> <div>4 ""Naturia Beast"" +  ""Mekk-Knight Crusadia Avramax""</div> <div>5 ""Naturia Exterio"" + ""Road Warrior"" + Borreload Dragon  (in your turn)</div> <div class=""dJcyOc"">6 ""Apollousa, Bow of the Goddess"" (3 negatives) + ""Naturia Exterio"" + ""Road Warrior""</div> <div class=""dJcyOc"">7 ""Apollousa, Bow of the Goddess""(3 negatives) + ""Knightmare Phoenix""  + ""Naturia Exterio""                       and similar ...</div> </div> </div> <div></div> <div>TACTICS -  Only small advice here : if you use the effect ""Divine Sword - Phoenix Blade""  remove from cemetery ""Isolde, Two Tales of the Noble Knights"" . It's an important card and we don't want anyone to negate her using ""called by the grave""  which can be set in the next round. You can see the rest on YT.</div> <div></div> <div class=""ZUo4Ze""> <div></div> <div>All mine decks are well tested and optimized in terms of draw power, dead hand, synergy. balance &amp; combo.  All this to give you the best possible version of selected deck.</div> </div> Please check my other decks. You will not regret. Something nice for everyone will be found.  Very good Megalith deck with Cyber Angel Benten engine. Reinforced with a small “crystron needlefiber” – “glow up bulb” combo giving us extra Link 4.  <a rel=""nofollow"" href=""https://ygoprodeck.com/very-good-megalith-deck-2020/"">https://ygoprodeck.com/very-good-megalith-deck-2020/</a>  Trickstars great archetype, of course shows its full class with 3 x ""trickstar light stage"" and with 3 x ""terraforming"". But you can still kick some butts quickly ;) but nowe you must have good hand. It could be easier to win  with Utopia Double OTK mechanic (instant fusion and double or nothing), but I wanted to keep something from original  charm of this archetype.  <a rel=""nofollow"" href=""https://ygoprodeck.com/pure-trickstars-2020/"">https://ygoprodeck.com/pure-trickstars-2020/</a>  My old idea adapted to current ban list and with application new cards. You haven't seen Gouki in this form.  <a rel=""nofollow"" href=""https://ygoprodeck.com/gouki-world-lockdown-2020/"">https://ygoprodeck.com/gouki-world-lockdown-2020/</a>  This deck prevents from using enemy monsters effects and blocks his extra deck.  Much better deck than other decks with this archetype.  <a rel=""nofollow"" href=""https://ygoprodeck.com/smashing-buster-blader-mr-2020/"">https://ygoprodeck.com/smashing-buster-blader-mr-2020/</a>  Masked Hero return more effective and stronger than ever. You don’t believe check it out.  <a rel=""nofollow"" href=""https://ygoprodeck.com/top-tier-hero-deck-master-rule-2020/"">https://ygoprodeck.com/top-tier-hero-deck-master-rule-2020/</a>  Pure perfection and synergy.  <a rel=""nofollow"" href=""https://ygoprodeck.com/herald-of-perfection-heraldgeddon-2020/"">https://ygoprodeck.com/herald-of-perfection-heraldgeddon-2020/</a>  Interesting thing in this deck is that we cen use very rare phenomenon in YGO which is “infinite loop”.  <a rel=""nofollow"" href=""https://ygoprodeck.com/six-samurai-ftk-2020/"">https://ygoprodeck.com/six-samurai-ftk-2020/</a>  Pure and deadly Fluffal OTK deck.  <a rel=""nofollow"" href=""https://ygoprodeck.com/best-fluffal-deck-master-rule-2020/"">https://ygoprodeck.com/best-fluffal-deck-master-rule-2020/</a>  Simple and fun deck for fans of Red Dragon Archfiend. Master Rule 4 &amp; 5 [  better on 5 ;)  ].  <a rel=""nofollow"" href=""https://ygoprodeck.com/red-dragon-archfiend-deck-2019-3/"">https://ygoprodeck.com/red-dragon-archfiend-deck-2019-3/</a>  A really good D/D/D deck (not only IMO). Includes all new combos and 1 round lockdown.  <a rel=""nofollow"" href=""https://ygoprodeck.com/d-d-d-deck-master-rule-2020/"">https://ygoprodeck.com/d-d-d-deck-master-rule-2020/</a>  Fun and simple deck, with a little bit of LOCK, not everything in life must be complicated.  <a rel=""nofollow"" href=""https://ygoprodeck.com/krawler-prediction-princess-2020/"">https://ygoprodeck.com/krawler-prediction-princess-2020/</a>  Do you like Gren Maju, banish cards gain a lot LP and ATK. But you think in these times with this deck I won't win with anyone. Nothing more wrong, with a good idea you can do a lot. And this is the most beautiful in YGO new life old cards.  <a rel=""nofollow"" href=""https://ygoprodeck.com/gren-maju-banish-deck-2019/"">https://ygoprodeck.com/gren-maju-banish-deck-2019/</a>  &nbsp;"
