deck_num,pretty_url,deck_name,cover_card,userid,format,main_deck,extra_deck,side_deck,ts_submit_date,submit_date,ts_edit_date,edit_date,comments,deck_excerpt,deck_description
254385,numeron-otk-254385,Numeron OTK,42352091,105808,Non-Meta Decks,"[""42352091"",""42352091"",""42352091"",""97526666"",""97526666"",""97526666"",""102380"",""102380"",""102380"",""36956512"",""36956512"",""36956512"",""49036338"",""38814750"",""38814750"",""38814750"",""14558127"",""14558127"",""14558127"",""41418852"",""41418852"",""41418852"",""77402960"",""77402960"",""77402960"",""43898403"",""43898403"",""43898403"",""18144507"",""23171610"",""23171610"",""23171610"",""84731222"",""84731222"",""84731222"",""73628505"",""12580477"",""10045474"",""10045474"",""10045474""]","[""74586817"",""79747096"",""15232745"",""15232745"",""42230449"",""42230449"",""78625448"",""78625448"",""4019153"",""4019153"",""72529749"",""74997493"",""85289965"",""21887175"",""4280258""]","[""10000020"",""10000020"",""10000020"",""10000080"",""10000080"",""10000080"",""73468603"",""76375976"",""23002292"",""23516703"",""23516703"",""23516703"",""53582587"",""53582587"",""53582587""]",1647023905,1 year ago,,,0,"Blind second, stop your opponent's combo with handtraps, kaiju their monsters, blow up their backrow, get your field spell, win the game (ideally anyw","Backrow removal is high priority here, if you can afford Lightning Storms and play them instead of Twin Twisters you will almost exclusively be using the duster effect to clear the way to lethal.

Most of the time you need your opponent to have at least 1 monster with 2000+ atk on board to OTK, which your kaijus can help you with. It is possible to OTK on an empty board, just a little tougher, you have to hard draw Limiter Removal, which Memories of Hope can help with. If not you can attack for 4k with your gates, then MP2 make Sunya to burn for 3k in next standby then either attack for game or style on them with a Lava Golem for the last 1000.

Handtrap line-up is a little tricky. Ash is an auto-include in basically any deck these days. Imperm's versatility of being able to slow down an opponent's combo or be set as a line of defense when forced to go first or in instances where you can't OTK is invaluable. The Gammas should ideally be used defensively to protect a search with Planet Pathfinder or Terraforming, getting to make Omega and rip a card is just a cheeky bonus. Nibiru is crazy but the fact that it summons itself conflicts with the Numeron combo since you need an empty field for it to resolve so it can't be recommended here. If you're on Master Duel I don't have to tell you to jam 3 Maxx C in here.

The deck has some niche interactions that can be game winning or game losing if you don't play around them. Lava Golem (and Sphere Mode) both take your normal summon, this can sometimes leave you having to choose whether to tribute off your opponent's board or get your field spell with Planet Pathfinder, sad times.

Numeron Wall is the MVP of this deck. It flat-out ignores Ash Blossom by activating Network from deck. It also has a <a data-name=""Battle Fader"">Battle Fader</a> style effect, which does require you to take at least 1 attack, so it can't save you from one-shot situations but it can punish people sequencing attacks in the traditional ""lowest attack first"" way (thank you Gorz). If it's your only monster on the field you can also tribute it from the field to activate a Network from deck. If your opponent pops your Network on their turn to avoid getting burned by Sunya, you can also use Wall to get it back before your turn so that Sunya can resolve properly.

Extra deck is pretty self-explanatory. You got yer gates and a tool box of big generic links to make in MP2 if you haven't won the game already.

Sidedeck is where things get spicy. This board aims to do what the Gren Maju decks tried to do when forced to go first, just a little bit better. You have your 1-for-1 swaps of solid generic going 2nd cards in things like Red Reboot, and Sphere Mode. The rest of the sidedeck are floodgates that are purely 1-sided. Summon Limit seems bad considering the main combo requires summoning 4 monsters, but the effect of Numeron Calling is treated as only 1 summon. You can even use your second summon for Sunya or one of your big link monsters. Slifer seems like an insane include, but it had previously seen some success mained in earlier versions of this deck. It's a walking floodgate that gets huge courtesy of Memories of Hope and it can be summoned by tributing off 3 of your gates provided you haven't normal summoned yet. Torrential Tribute is Torrential Tribute. If you go on the Sunya line, you're ending on an empty board already, otherwise you're most likely sitting on 1 monster, having this up your sleeve for when your opponent over-extends is more often than not worth losing that 1 monster. Don't literally put Torrential Tribute up your sleeve, that's cheating.

The deck is really straightforward and a ton of fun to play. I've been laddering on Master Duel with a slightly different version and the only match-ups I've had any trouble with are Drytron and some of the Tri-Brigade variants, but that's to be expected when facing tier-1 decks."
254381,mayakashi-shiranui-254381,Mayakashi Shiranui,42542842,104129,Master Duel Decks,"[""41729254"",""41729254"",""41729254"",""72700231"",""72700231"",""72700231"",""42542842"",""42542842"",""5325155"",""5325155"",""79783880"",""79783880"",""36630403"",""36630403"",""41562624"",""41562624"",""99423156"",""99423156"",""94801854"",""94801854"",""92826944"",""92826944"",""68989981"",""12580477"",""83764719"",""2364438"",""2364438"",""2364438"",""51225407"",""51225407"",""83266006"",""83266006"",""44095762"",""4333086"",""4333086"",""39753577"",""39753577"",""74798297"",""97077563"",""41867019""]","[""30607616"",""77092311"",""4103668"",""3486020"",""39475024"",""26326541"",""57288064"",""57288064"",""52711246"",""83283063"",""59843383"",""28240337"",""66870733"",""2645637"",""86926989""]","[""10000020"",""10000020"",""10000020"",""10000080"",""10000080"",""10000080"",""73468603"",""76375976"",""23002292"",""23516703"",""23516703"",""23516703"",""53582587"",""53582587"",""53582587""]",1647023905,1 year ago,,,0,Mayakashi Shiranui. Full video: https://youtu.be/oA4HJwIBO6Q,Mayakashi Shiranui. Full video: https://youtu.be/oA4HJwIBO6Q
254377,psy-frame-feb-2022-254377,PSY-Frame Feb 2022,74586817,72650,Non-Meta Decks,"[""49036338"",""49036338"",""49036338"",""43266605"",""43266605"",""21830679"",""21830679"",""645087"",""1697104"",""74203495"",""74203495"",""74203495"",""38814750"",""38814750"",""38814750"",""2810642"",""2810642"",""75425043"",""75425043"",""75425043"",""18789533"",""21862633"",""21862633"",""575512"",""575512"",""575512"",""35261759"",""11047543"",""11047543"",""73628505"",""70368879"",""67723438"",""67723438"",""67723438"",""36970611"",""36970611"",""89208725"",""53582587"",""53582587"",""53582587""]","[""96633955"",""92519087"",""5041348"",""74586817"",""37192109"",""37192109"",""73580471"",""73580471"",""99115354"",""8802510"",""8802510"",""98978921"",""48068378"",""32995276"",""41999284""]","[""1697104"",""1697104"",""81674782"",""25401880"",""24224830"",""30241314"",""36970611"",""23002292"",""47475363"",""47475363""]",1647023905,1 year ago,,,0,Pure PSY-Frame as of Feb 2022.,Pure PSY-Frame as of Feb 2022.
254370,crooked-cook-254370,Crooked Cook,82697249,74194,Non-Meta Decks,"[""64591429"",""64591429"",""64591429"",""11845050"",""11845050"",""11845050"",""6625096"",""6625096"",""6625096"",""7150545"",""7150545"",""7150545"",""62015408"",""62015408"",""62015408"",""12213463"",""93708824"",""70903634"",""8124921"",""33396948"",""7902349"",""44519536"",""49238328"",""49238328"",""49238328"",""76375976"",""76375976"",""76375976"",""33907039"",""33907039"",""33907039"",""33782437"",""70368879"",""2295440"",""95308449"",""81439173"",""73628505"",""24224830"",""18144507"",""7153114""]","[""82697249"",""82697249"",""82697249"",""73580471"",""98506199"",""48608796"",""72167543"",""90448279"",""94977269"",""75286621"",""7480763"",""26847978"",""17382973"",""99726621"",""26692769""]","[""27204311"",""27204311"",""27204311"",""91800273"",""91800273"",""91800273"",""82385847"",""20292186"",""43898403"",""43898403"",""43898403"",""98495314"",""15693423"",""15693423"",""15693423""]",1647023905,1 year ago,,,0,Now we're cooking with gas.,"You can lock with cook or mystic mine, but not usually both.  You will need to decide how you want to use your deck thinning before committing to one path over the other.  After you have determined what your opponent is playing, and what you will want to use your ghost-reaper package for, you can safely banish most of your extra deck with pot of extravagance."
254366,lunalight-bird-of-sovereignty-254366,Lunalight Bird of Sovereignty,24550676,83096,Master Duel Decks,"[""87209160"",""47705572"",""35618217"",""35618217"",""35618217"",""14152693"",""50546208"",""50546208"",""83190280"",""83190280"",""83190280"",""11317977"",""57103969"",""57103969"",""57103969"",""1475311"",""1475311"",""1475311"",""87931906"",""35726888"",""35726888"",""35726888"",""48444114"",""48444114"",""48444114"",""13935001"",""14785765"",""31314549"",""69448290"",""29587993"",""23434538"",""23434538"",""23434538"",""14558127"",""14558127"",""24224830"",""24224830"",""65681983"",""65681983"",""65681983""]","[""24550676"",""24550676"",""88753594"",""97165977"",""90448279"",""96381979"",""88021907"",""66011101"",""73347079"",""85289965"",""4280258"",""72330894"",""36429703"",""83152482"",""26847978""]","[""27204311"",""27204311"",""27204311"",""91800273"",""91800273"",""91800273"",""82385847"",""20292186"",""43898403"",""43898403"",""43898403"",""98495314"",""15693423"",""15693423"",""15693423""]",1647023905,1 year ago,,,0,Infinite negates and (nearly) infinite damage,"<span>So as a quick introduction, my name is Leo and I've been playing this deck since 2018- yes, before Sisters of the Rose came out and they actually got good. While I can't claim anything too impressive, I regularly placed well with them at my locals until tiger got yeeted out of existence. I've seen a few Lunalight lists on here and they are regularly pretty disappointing. Probably the best way to play the deck is Lunalight Tri-Brigade, but I haven't done all too much experimenting with that. </span>
<h2><span>Overview</span></h2>
<span>Lunalights (if you're not familiar) are a powerful fusion OTK deck released during the pendulum era. This deck uses an infinite negate combo with Mist Valley Apex Avian to go first and hopefully completely lock your opponent out of playing the game, with your incredible OTK power ensuring a kill on the clapback.</span>
<h2><span>Card by Card</span></h2>
<span><strong>Main Deck</strong></span>

<span>1x <a data-name=""Tri-Brigade Fraktall"">Tri-Brigade Fraktall</a> - Honestly just filler. You could definitely replace this with something else if you wanted. A <a data-name=""Foolish Burial"">Foolish Burial</a>, third <a data-name=""Ash Blossom &amp; Joyous Spring"">Ash Blossom &amp; Joyous Spring</a>, a <a data-name=""Nibiru, the Primal Being"">Nibiru, the Primal Being</a>, or a backup copy of <a data-name=""Lunalight Wolf"">Lunalight Wolf</a> would be my suggestions.</span>

<span>1x <a data-name=""Lunalight Wolf"">Lunalight Wolf</a> - Miracle Fusion! Who doesn't love miracle fusion? I know I do, especially in a deck that can dump materials as easy as this one</span>

<span>3x <a data-name=""Lunalight Kaleido Chick"">Lunalight Kaleido Chick</a> - One of the two biggest cards in this deck. On the field, can send ANY Lunalight monster from your deck OR extra deck to the GY as COST. The actual effect of being able to use that monster's name if used for a fusion summon honestly rarely comes up, so just laugh at your opponent whenever they use a negate on this effect. It also turns off your opponent's ability to interact in the BP of the turn that it's banished in. She really just does everything.</span>

<span>1x <a data-name=""Lunalight Emerald Bird"">Lunalight Emerald Bird</a> - One of the more eh cards in the deck, but I still think it's worth having at one, especially if you play Foolish Burial. At worst, she's another monster you can send off of Kaleido Chick to use for a fusion summon. </span>

<span>2x <a data-name=""Lunalight Yellow Martin"">Lunalight Yellow Martin</a> - Another fantastic card. Bounces a Lunalight card you control to special summon itself from hand or GY. It banishes itself when it leaves the field then, but you can avoid this by using it as XYZ material.</span>

<span>3x my literal actual child <a data-name=""Lunalight Tiger"">Lunalight Tiger</a> - Along with Kaleido Chick, one of the best 2 cards in the deck. Her pendulum effect special summons a Lunalight monster from your gy but negates their effects. Reminder that Kaleido Chick foolishes a monster for cost, and not as an effect. Lunalight Tiger's pendulum effect also isn't a hard OPT, so if you bounce her, (<em>cough cough martin cough cough)</em> you can use the effect again.</span>

<span>1x <a data-name=""Lunalight Black Sheep"">Lunalight Black Sheep</a> - Not a very good card, but useful for a combo to get Lunalight Wolf into your hand</span>

<span>3x <a data-name=""Fire Formation – Tenki"">Fire Formation – Tenki</a> - Beast-warrior ROTA. 'nough said</span>

<span>3x <a data-name=""Allure of Darkness"">Allure of Darkness</a> - Draw Power. 'nough said.</span>

<span>1x <a data-name=""Lunalight Fusion"">Lunalight Fusion</a> - a fusion spell that lets you use one material from your deck or extra deck if your opponent has a monster special summoned from the extra deck. comes up sometimes, but it's mainly just searchable off of Yellow Martin</span>

<span>3x <a data-name=""Foolish Burial Goods"">Foolish Burial Goods</a> - used to send the next 2 cards to the gy</span>

<span>3x <a data-name=""Luna Light Perfume"">Luna Light Perfume</a> - Monster reborn in the streets hand, archetypal search in the sheets gy. (note Luna (SPACE) Light)</span>

<span>1x <a data-name=""Lunalight Serenade Dance"">Lunalight Serenade Dance</a> - Perfume gy eff, but the card in hand is sent as an effect and it special summons a monster instead of adding it to hand</span>

<span>1x <a data-name=""Blackwing – Zephyros the Elite"">Blackwing – Zephyros the Elite</a> - martin, but once per duel, and you get to it differently</span>

<span>1x <a data-name=""Raidraptor – Singing Lanius"">Raidraptor – Singing Lanius</a> - special summons itself from hand if you have an xyz monster</span>

<span>1x <a data-name=""Mist Valley Thunderbird"">Mist Valley Thunderbird</a> - the ""infinite"" in ""infinite negates""</span>

<span>1x <a data-name=""Mist Valley Apex Avian"">Mist Valley Apex Avian</a> - the ""negates"" in ""infinite negates""</span>

<span>3x <a data-name=""Maxx &quot;C&quot;"">Maxx ""C""</a> -</span>

<span>2x <a data-name=""Ash Blossom &amp; Joyous Spring"">Ash Blossom &amp; Joyous Spring</a> -</span>

<span>2x <a data-name=""Called by the Grave"">Called by the Grave</a> -</span>

<span>3x <a data-name=""Crossout Designator"">Crossout Designator</a> - You could probably lean into this harder by playing a larger variety of staples to negate or cut it entirely. Player preference</span>

<span><strong>Extra Deck</strong></span>

<span>2x <a data-name=""Lunalight Leo Dancer"">Lunalight Leo Dancer</a> - It's ya girl, the big cat, the dommy mommy, thunder thighs the thunder cat, kill your opponent real good. Untargetable, indestructible, 3500 double attacker that nukes your opponent's special summoned monsters after her first attack</span>

<span>1x <a data-name=""Lunalight Sabre Dancer"">Lunalight Sabre Dancer</a> - Untargetable big number, but doesn't matter all that much for that. the REAL reason you play this is because you can send it off of chick turn one and then banish it from your gy turn 3 to give Lunalight Leo Dancer a huge 3k boost to make sure they die</span>

<span>1x <a data-name=""Lunalight Panther Dancer"">Lunalight Panther Dancer</a> - the material for Lunalight Leo Dancer. send it off of kaleido chick and then use wolf to miracle fusion. you can also use kaleido's effect to take its name or just use the effect of Lunalight Fusion to send it, but most frequently you will just be sending it with kaleido and then using wolf to miracle.</span>

<span>1x <a data-name=""Divine Arsenal AA-ZEUS – Sky Thunder"">Divine Arsenal AA-ZEUS – Sky Thunder</a> - Zeus is good, but I haven't summoned it much in this deck, so you could take it out if you wanted and replace it with something like <a data-name=""Tornado Dragon"">Tornado Dragon</a> or a second Panther Dancer. <a data-name=""Number 41: Bagooska the Terribly Tired Tapir"">Number 41: Bagooska the Terribly Tired Tapir</a> is also not that bad of a choice. <a data-name=""Fire Fighting Daruma Doll"">Fire Fighting Daruma Doll</a> is another good card.</span>

<span>1x <a data-name=""Brotherhood of the Fire Fist – Tiger King"">Brotherhood of the Fire Fist – Tiger King</a> - mainly useful because it searches tenki if you didn't start with it. also useful because it negates the effects of all monsters on the field except beast warriors</span>

<span>1x <a data-name=""Primathmech Laplacian"">Primathmech Laplacian</a> - This card is filler. I think I've summoned it once? It was cool when I did, but should probably be replaced.</span>

<span>1x <a data-name=""Number 60: Dugares the Timeless"">Number 60: Dugares the Timeless</a> - Amazing utility card. Useful as a generic xyz monster and all of the effects are great in this deck. I've used all of them at some point. Just probably don't want to use the the special summon effect on turn one.</span>

<span>1x <a data-name=""Raidraptor – Force Strix"">Raidraptor – Force Strix</a> - generic xyz monster that searches singing lanius or zephyros (usually singing). used in the deck's main combo</span>

<span>1x <a data-name=""Borrelsword Dragon"">Borrelsword Dragon</a> - Big dragon big number big beatstick go brrrr. you could probably play <a data-name=""Accesscode Talker"">Accesscode Talker</a> instead if you wanted, but I play Borrelsword in all of my decks almost because I'm salty about buying it when it was $90.</span>

<span>1x <a data-name=""Apollousa, Bow of the Goddess"">Apollousa, Bow of the Goddess</a> - It's a pretty common and Clear sight to see her bow on your opponent's board with 24-32k attack. It's just a good card and if you're worried about your opponent disrupting you with monster effects, it's great to make, though you usually can't afford to on turn one. It's a card that you could cut, but it's far from bad.</span>

<span>1x <a data-name=""Simorgh, Bird of Sovereignty"">Simorgh, Bird of Sovereignty</a> - The deck's namesake. For 3 points of link material, only one of which has to be a winged beast, this powerful boss monster will let you special summon Apex Avian from your deck while giving both of them targeting protection. Just make sure that you don't have more than 3 spell/trap zones in use or you won't be able to summon Apex Avian.</span>

<span>1x <a data-name=""Raidraptor – Wise Strix"">Raidraptor – Wise Strix</a> - Great for link climbing and used in the deck's main combo. special summons zephyros from deck to extend combos</span>

<span>1x <a data-name=""Union Carrier"">Union Carrier</a> - equips Mist Valley Thunderbird from your deck for the infinite negates</span>

<span>1x <a data-name=""Tri-Brigade Ferrijit the Barren Blossom"">Tri-Brigade Ferrijit the Barren Blossom</a> - good for link climbing, but could be replaced if you wanted to. </span>

<span><strong>Notes</strong></span>

<span><a data-name=""Brotherhood of the Firefist - Eagle"">Brotherhood of the Fire Fist – Eagle</a> and <a data-name=""Brotherhood of the Firefist - Boar"">Brotherhood of the Fire Fist – Buffalo</a> are a strong and quick link climbing package. I don't think that this deck needs them, and it does take up space in the main deck, but if you want a more pure build of Lunalights, they're fantastic for climbing into Apollusa or other link 4s</span>

<span><a data-name=""Ghost Belle &amp; Haunted Mansion"">Ghost Belle &amp; Haunted Mansion</a> is a personal favorite for this deck because of its weakness to called by. I just didn't think I had the room with the other hand staples I wanted to run (aka Maxx ""C"" and ways to turn off Maxx ""C"").</span>
<h2><span>Main Combo + Synergies</span></h2>
<span>The main combo starts with Lunalight Tiger and Lunalight Kaleido Chick in hand. Normal summon Kaleido Chick and use its effect to send Lunalight Yellow Martin from your deck to the GY. Activate Lunalight Tiger in your pendulum zone and use its effect to bring back Yellow Martin. Overlay Yellow Martin and Kaleido Chick into Raidraptor - Force Strix and detach Yellow Martin to activate the effect of Force Strix, searching Raidraptor - Singing Lanius. Special summon Singing Lanius from your hand and link Force Strix and Singing Lanius into Raidraptor - Wise Strix. Wise Strix's effect should special summon Blackwing - Zephyros the Elite from your deck. It can't be used as link material, so we have to use it for an xyz first. Activate the effect of Yellow Martin in grave, bouncing Lunalight Tiger to special summon itself. Overlay Zephyros and Martin into Number 60: Dugares the Timeless (although any xyz monster with an effect you can activate to detach a material should work). Activate the effect of your xyz monster, detaching Zephyros. Activate the Lunalight Tiger you bounced with Martin and use it to special summon Kaleido chick. Use Kaleido Chick to dump Lunalight Sabre Dancer for next turn. Then use the effect of Zephyros to once again bounce Tiger, special summoning Zephyros. Use Wise Strix and Dugares (or whatever xyz monster you made) to go link into Simorgh, Bird of Sovereignty and use Kaleido Chick and Zephyros to link into Union Carrier. Use Union Carrier's effect targeting Simorgh to equip Mist Valley Thunderbird from deck. During your end phase, special summon Mist Valley Apex Avian with Simorgh's effect. Make sure to summon it to a zone Simorgh points to so that it gains targeting protection. Now whenever your opponent activates a card effect, activate Apex Avian, targeting your Thunderbird, which will special summon itself whenever it returns to your hand.</span>

<span>This is far from failproof. Apex Avian is only once per chain, so if your opponent has any quick effects, they can chain them after Apex Avian without you being able to stop them. There's also the ever-present <a data-name=""Dark Ruler No More"">Dark Ruler No More</a> and <a data-name=""Forbidden Droplet"">Forbidden Droplet</a>, which you won't be able to respond to.</span>

<span>If you need to get Lunalight Wolf into your hand, send it off of Kaleido Chick, then make Tiger King to search tenki, tenki to search black sheep, and use black sheep's effect to return wolf to your hand.</span>

<span>Other synergies in the deck are that you can chain your Serenade Dance/Luna Light Perfumes if you have several in your hand. Simply activate one graveyard effect and discard/send the next card you want to use. You can also use this to put Martin or Zephyros in your GY if you have them. You can also search Zephyros off of Force Strix if you need to. Dugares is of course another way you can get things from your hand to your gy, and Dugares actually discards as part of the effect, rather than the cost, so if you send yellow martin or emerald bird, you will be sending them to the gy by a card effect.</span>
<h2><span>Closing Thoughts</span></h2>
<span>In closing, I love this deck a lot, and while it definitely has its weaknesses, being able to full combo off of two very searchable cards is incredibly fun and the deck has a lot more tools to extend than that. It's also an incredibly strong deck when it comes to playing through negates, and on the ranked latter it feels like no one actually knows where you're supposed to hit this deck.</span>"
254362,lyrilusc-tri-brigade-254362,Lyrilusc Tri-Brigade,26973555,70960,Non-Meta Decks,"[""97949165"",""97949165"",""97949165"",""34550857"",""34550857"",""34550857"",""60954556"",""60954556"",""10182251"",""10182251"",""46576366"",""46576366"",""14558127"",""14558127"",""14558127"",""87209160"",""87209160"",""87209160"",""14816857"",""14816857"",""14816857"",""56196385"",""56196385"",""50810455"",""50810455"",""27204311"",""27204311"",""27204311"",""24224830"",""57103969"",""81439173"",""2295440"",""45354718"",""45354718"",""45354718"",""40975243"",""40975243"",""10045474"",""10045474"",""10045474""]","[""8491961"",""48608796"",""72971064"",""72167543"",""65305468"",""26973555"",""90448279"",""60303245"",""65711558"",""26847978"",""47163170"",""49105782"",""52331012"",""4280258"",""99726621""]","[""27204311"",""27204311"",""27204311"",""91800273"",""91800273"",""91800273"",""82385847"",""20292186"",""43898403"",""43898403"",""43898403"",""98495314"",""15693423"",""15693423"",""15693423""]",1647023905,1 year ago,,,0,Spam your opponent with birds ruin their plays then crack back with leathal when able,"Go into Number F0: Utopic Draco Future and Apollousa, Bow of the Goddess and set Tri-Brigade revolt turn 1. turn 2 if able make zues with as many materials as possible and clean up house."
