deck_num,pretty_url,deck_name,cover_card,userid,format,main_deck,extra_deck,side_deck,ts_submit_date,submit_date,ts_edit_date,edit_date,comments,deck_excerpt,deck_description
296707,evil-hero-296707,Evil HERO,86165817,120284,Anime Decks,"[""91501248"",""91501248"",""91501248"",""58554959"",""58554959"",""58554959"",""46565218"",""46565218"",""45659520"",""45659520"",""45659520"",""13650422"",""13650422"",""13650422"",""95943058"",""95943058"",""95943058"",""50304345"",""50304345"",""50304345"",""12071500"",""12071500"",""12071500"",""18438874"",""18438874"",""18438874"",""73628505"",""94820406"",""94820406"",""94820406"",""27967615"",""72043279"",""72043279"",""72043279"",""16598965"",""16598965"",""81223446"",""81223446"",""57355219"",""57355219""]","[""86676862"",""86676862"",""86676862"",""86165817"",""86165817"",""58332301"",""58332301"",""58332301""]","[""90432163"",""62709239""]",1660415905,7 months ago,,,0,Deck para um RPG – Não é Competitivo,Consiste em invocar as fusões e disferir ATK de auto valor.  Deck para um RPG – Não é Competitivo
296703,shiranui-deck-master-duel-296703,Shiranui Deck Master duel,57288064,109601,Non-Meta Decks,"[""49959355"",""66570171"",""92964816"",""90020780"",""14558127"",""14558127"",""92826944"",""92826944"",""36630403"",""36630403"",""79783880"",""79783880"",""62038047"",""99423156"",""99423156"",""99423156"",""35818851"",""35818851"",""68989981"",""68989981"",""41562624"",""41562624"",""41562624"",""94801854"",""94801854"",""94801854"",""39185163"",""4333086"",""4333086"",""4333086"",""78765160"",""10045474"",""4064256"",""4064256"",""13965201"",""13965201"",""81439173"",""38363525"",""12580477"",""18144507"",""83764719"",""48130397"",""48130397"",""14532163"",""24299458""]","[""54757758"",""8198620"",""50091196"",""59969392"",""57288064"",""68431965"",""28240337"",""52711246"",""83283063"",""83283063"",""59843383"",""41999284"",""91420202"",""50588353"",""86926989""]","[""90432163"",""62709239""]",1660415905,7 months ago,,,0,Competitive Shiranui deck,This deck is designed to hang in the fight by clearing the board to make way for bid attacks. I've taken into consideration most of the meta in some of my card choices. The goal is to get the zombie world out ASAp to control the game if not get the boss monster out to contend. Please let me know if you think there should be any improvements
296699,evil-eye-296699,Evil Eye,17739335,120284,Anime Decks,"[""82466274"",""82466274"",""82466274"",""18551923"",""18551923"",""18551923"",""45955628"",""45955628"",""45955628"",""81344637"",""81344637"",""81344637"",""7610394"",""7610394"",""7610394"",""17616743"",""17616743"",""17616743"",""43011492"",""43011492"",""79400597"",""79400597"",""28957126"",""28957126"",""28957126"",""44133040"",""44133040"",""44133040"",""70122149"",""70122149"",""70122149"",""6494106"",""6494106"",""6494106"",""42899204"",""42899204"",""42899204"",""79383919"",""79383919"",""79383919""]","[""17739335"",""17739335"",""17739335"",""29357687"",""29357687"",""29357687""]","[""90432163"",""62709239""]",1660415905,7 months ago,,,0,Deck para um RPG – Não é Competitivo,Consiste em invocar o link 3 e equipar com a magia de equipamento.  Deck para um RPG – Não é Competitivo
296695,dark-angels-296695,Dark Angels,4167084,120284,Anime Decks,"[""25451652"",""25451652"",""55690251"",""52840267"",""52840267"",""52840267"",""88234365"",""85771019"",""11260714"",""11260714"",""40921744"",""18168997"",""25339070"",""25339070"",""25339070"",""51728779"",""82773292"",""82773292"",""82773292"",""55289183"",""55289183"",""55289183"",""92807548"",""92807548"",""1475311"",""14517422"",""14517422"",""14517422"",""87112784"",""87112784"",""87112784"",""48152161"",""48152161"",""48152161"",""50501121"",""50501121"",""54527349"",""54527349"",""87990236"",""87990236""]","[""4167084"",""4167084"",""35306215"",""35306215""]","[""90432163"",""62709239""]",1660415905,7 months ago,,,0,Deck para um RPG – Não é Competitivo,Consiste em invocar diversos monstros no campo e controlar o campo do oponente com as armadilhas.  Deck para um RPG – Não é Competitivo
296691,red-eyes-fusion-296691,Red-Eyes Fusion,21140872,120284,Anime Decks,"[""46986414"",""74677422"",""74677422"",""74677422"",""70781052"",""88264978"",""18491580"",""18491580"",""39357122"",""17871506"",""17871506"",""67300516"",""67300516"",""67300516"",""85651167"",""85651167"",""53485634"",""53485634"",""58257569"",""58257569"",""66574418"",""66574418"",""6172122"",""6172122"",""6172122"",""24094653"",""24094653"",""32566831"",""46232525"",""52684508"",""92353449"",""92353449"",""92353449"",""44397496"",""44397496"",""57135971"",""57135971"",""71782404"",""39387565"",""39387565""]","[""45349196"",""45349196"",""30086349"",""30086349"",""37818794"",""21140872"",""21140872"",""19747827"",""83743222"",""46354113"",""44405066"",""44405066""]","[""32566831""]",1660415905,7 months ago,,,0,Deck para um RPG – Não é Competitivo,Consiste em invocar as fusões e causar dano de efeito e reviver os monstros com as armadilhas.  Deck para um RPG – Não é Competitivo
296687,star-warriors-n-r-296687,Star warriors N/R,96220350,119254,Master Duel Decks,"[""90876561"",""33837653"",""33837653"",""33837653"",""7443908"",""7443908"",""7443908"",""29284413"",""29284413"",""29284413"",""75214390"",""75214390"",""22812068"",""60822251"",""60822251"",""3431737"",""39015"",""39015"",""39015"",""11317977"",""11317977"",""11317977"",""74644400"",""74644400"",""55416843"",""55416843"",""55416843"",""24094653"",""24094653"",""24094653"",""25789292"",""25789292"",""25789292"",""5318639"",""5318639"",""5318639"",""80280737"",""4178474"",""4178474"",""4178474""]","[""32615065"",""32615065"",""96220350"",""96220350"",""37192109"",""80108118"",""44035031"",""64880894"",""45298492"",""29669359"",""50449881"",""50449881"",""90126061"",""80796456"",""50277355""]","[""32566831""]",1660415905,7 months ago,1663007905,6 months ago,0,A N/R format deck using star warriors to OTK,<p>Using lvl 5 warriors to OTK within the N/R format</p>
296683,starry-knight-296683,Starry Knight,90835938,120284,Anime Decks,"[""90835938"",""90835938"",""90835938"",""33282498"",""33282498"",""53318263"",""23220533"",""23220533"",""23220533"",""27036706"",""27036706"",""27036706"",""86613346"",""86613346"",""86613346"",""59228631"",""59228631"",""59228631"",""44818"",""44818"",""44818"",""22007085"",""22007085"",""22007085"",""54977057"",""54977057"",""57734012"",""28890974"",""85590798"",""85590798"",""85590798"",""58406094"",""58406094"",""58406094"",""58374502"",""58374502"",""58374502"",""21985407"",""21985407"",""21985407""]","[""67173574"",""49678559"",""49678559"",""5916510"",""5916510""]","[""32566831""]",1660415905,7 months ago,,,0,Deck para um RPG – Não é Competitivo,Consiste em invocar o dragão de nível 7 e usar as armadilhas para dar suporte.  Deck para um RPG – Não é Competitivo  &nbsp;
296678,asdasda-296678,asdasda,97268402,120401,Non-Meta Decks,"[""97268402"",""14558127"",""14558127"",""12980373"",""12980373"",""49374988"",""74641045"",""74641045"",""52404456"",""52404456"",""48252330"",""48252330"",""26016357"",""26016357"",""91350799"",""91350799"",""91350799"",""11868731"",""11868731"",""11868731"",""77848740"",""77848740"",""77848740"",""34680482"",""34680482"",""12580477"",""83764719"",""85852291"",""85852291"",""18144507"",""71348837"",""71348837"",""71348837"",""60470713"",""60470713"",""60470713"",""75833426"",""48439321"",""48439321"",""48439321"",""79759367"",""79759367"",""12940613"",""12940613"",""68159562"",""68159562"",""62279055"",""62279055"",""78474168""]","[""44311445"",""44311445"",""37164373"",""37164373"",""20343502"",""20343502"",""96150936"",""96150936"",""96150936"",""28290705"",""28290705""]","[""14001430"",""14001430"",""14001430""]",1660415905,7 months ago,,,0,dsadd,Write your deck strategdasy here.dasdad..
296670,madolche-9-296670,Madolche 9,97268402,120401,Fun/Casual Decks,"[""97268402"",""14558127"",""14558127"",""12980373"",""12980373"",""49374988"",""74641045"",""74641045"",""52404456"",""52404456"",""48252330"",""48252330"",""26016357"",""26016357"",""91350799"",""91350799"",""91350799"",""11868731"",""11868731"",""11868731"",""77848740"",""77848740"",""77848740"",""34680482"",""34680482"",""12580477"",""83764719"",""85852291"",""85852291"",""18144507"",""71348837"",""71348837"",""71348837"",""60470713"",""60470713"",""60470713"",""75833426"",""48439321"",""48439321"",""48439321"",""79759367"",""79759367"",""12940613"",""12940613"",""68159562"",""68159562"",""62279055"",""62279055"",""78474168""]","[""44311445"",""44311445"",""37164373"",""37164373"",""20343502"",""20343502"",""96150936"",""96150936"",""96150936"",""28290705"",""28290705""]","[""14001430"",""14001430"",""14001430""]",1660415905,7 months ago,,,0,Madolche,Madolche B
296666,amorphactor-drytron-july-2022-296666,Amorphactor Drytron (July 2022),72634965,50577,Non-Meta Decks,"[""72634965"",""95492061"",""95492061"",""95492061"",""22420202"",""22420202"",""22420202"",""60037599"",""60037599"",""60037599"",""96026108"",""96026108"",""96026108"",""97148796"",""97148796"",""97148796"",""69815951"",""95209656"",""59913418"",""55410871"",""52900000"",""98287529"",""77235086"",""77235086"",""60600126"",""60600126"",""60600126"",""94187078"",""94187078"",""94187078"",""22398665"",""22398665"",""54631834"",""54631834"",""54631834"",""58793369"",""58793369"",""29185231"",""29185231"",""29185231""]","[""90448279"",""1174075"",""1174075"",""1174075"",""48608796"",""11738489"",""85289965"",""74997493"",""86066372"",""4280258"",""2857636"",""52119435"",""65741786"",""41999284"",""94259633""]","[""78661338"",""78316184"",""8836329"",""52068432"",""34093683"",""99628747"",""23851033"",""56350972"",""45222299"",""3629090"",""89463537"",""34072799"",""78990927"",""91781589"",""1637760""]",1660415905,7 months ago,,,0,Amorphactor Drytron (July 2022),Amorphactor Drytron (July 2022)
296660,i-may-had-won-with-this-deck-296660,I May had won with this Deck!,6133894,53091,Non-Meta Decks,"[""1184620"",""66927994"",""77827521"",""78423643"",""84696266"",""13039848"",""32269855"",""71068263"",""53375573"",""58932616"",""90357090"",""58696829"",""85309439"",""84686841"",""89904598"",""41218256"",""27324313"",""40826495"",""34442949"",""38142739"",""3549275"",""40640057"",""7165085"",""12580477"",""18144507"",""24094653"",""38199696"",""53129443"",""66788016"",""76103675"",""97169186"",""5318639"",""40619825"",""44095762"",""53582587"",""62279055"",""94192409"",""18807109"",""85742772"",""41420027""]","[""11321089"",""10817524"",""3544583"",""109401"",""15240238"",""10669138"",""2857636"",""2857636"",""75452921"",""75452921"",""31897444"",""31897444"",""98978921"",""98978921"",""98978921""]","[""31447217"",""49888191"",""86281779"",""31477025"",""4035199"",""23635815"",""97240270"",""65623423"",""20129614"",""24508238"",""2903036"",""43422537"",""28486799"",""21237481"",""6909330""]",1660415905,7 months ago,,,0,It okay to cry!,But it okay  What the worst of losing?  Everything?  Maybe?  Enjoy The Day Know you have lost.  It may have cost you your soul...  HAHHAHAHAH  MadDemon
296656,slifer-the-sky-dragon-destroying-floowandereeze-king-tiger-296656,"Slifer the sky dragon destroying FLOOWANDEREEZE ,King Tiger",83986578,25969,Fun/Casual Decks,"[""10000020"",""10000020"",""10000020"",""83986578"",""83986578"",""93708824"",""26118970"",""64487132"",""64487132"",""64487132"",""53154400"",""53154400"",""15521027"",""15521027"",""15521027"",""38082437"",""38082437"",""38082437"",""2295440"",""47292920"",""47292920"",""63995093"",""63995093"",""63995093"",""73628505"",""5253985"",""5253985"",""5253985"",""67723438"",""67723438"",""67723438"",""69167267"",""8025950"",""8025950"",""8025950"",""56747793"",""19162134"",""19162134"",""71645242"",""44413654""]","[""70980824"",""52687916"",""63265554"",""5041348"",""33158448"",""64880894"",""53325667"",""37260946"",""46057733"",""81846453"",""50091196"",""74997493"",""50588353"",""65741786"",""41999284""]","[""27204311"",""27204311"",""27204311"",""83986578"",""53154400"",""79606837"",""14532163"",""14532163"",""14532163"",""18144506"",""47292920"",""42469671"",""94423983"",""94423983"",""94423983""]",1660415905,7 months ago,,,0,https://youtu.be/SJT3hRGOMM0,https://youtu.be/SJT3hRGOMM0
296650,extra-zero-pure-u-a-s-296650,Extra Zero Pure U.A.s,47021196,120390,Master Duel Decks,"[""98229575"",""47021196"",""47021196"",""47021196"",""71279983"",""71279983"",""34614289"",""17264592"",""17264592"",""9485511"",""56421754"",""56421754"",""82419869"",""82419869"",""82419869"",""11637481"",""11637481"",""11637481"",""72491806"",""72491806"",""72491806"",""97526666"",""12931061"",""12931061"",""19814508"",""19814508"",""19814508"",""32807846"",""73628505"",""95281259"",""95281259"",""43658697"",""43658697"",""43658697"",""70043345"",""70043345"",""70043345"",""36458063"",""36458063"",""36458063""]","[""70980824"",""52687916"",""63265554"",""5041348"",""33158448"",""64880894"",""53325667"",""37260946"",""46057733"",""81846453"",""50091196"",""74997493"",""50588353"",""65741786"",""41999284""]","[""27204311"",""27204311"",""27204311"",""83986578"",""53154400"",""79606837"",""14532163"",""14532163"",""14532163"",""18144506"",""47292920"",""42469671"",""94423983"",""94423983"",""94423983""]",1660415905,7 months ago,,,0,"Super fun, fairly consistent, and cheap deck for the Extra Zero event, we have my favorite archetype on full display.","<p>Super fun, fairly consistent, and cheap deck for the Extra Zero event, we have my favorite archetype on full display. The U.A. playstyle of constantly switching out monsters with offensive capabilities with monsters with defensive capabilities after the battle phase allows for multiple plays depending on your starting hand. Some cards, like <a data-name=""The Warrior Returning Alive"">The Warrior Returning Alive</a>, ROTA, <a data-name=""Planet Pathfinder"">Planet Pathfinder</a>, and <a data-name=""Terraforming"">Terraforming</a> are added to allow you to more consistently get your level 4 monsters in your hands and the field spells which allow you to get a decent amount of card advantage for normal summoning those level 4s. <a data-name=""Witch's Strike"">Witch's Strike</a> has also been added to disrupt your opponent should any of your defense line monster's effects get negated, but you could also swap this out with backrow removal as I've found most decks don't run nearly as many negates as other formats. The best way to learn this deck is to play around with combos on your own, though if you need some tips to get started, you want to have as at least 2 of your level 4s in your hand as soon as possible, but if you have the option to create your starting offensive line (Mighty Slugger and Dreadnought Dunker are fantastic options for this), your starting defensive line (Block Backer and Perfect Ace are good choices for this), and your ""waiting bench"" line (These are cards whose effects activate/are most effective when summoned during your opponents turn, namely Player Manager for easy board control or Rival Rebounder for swarming), then you should get that set first and do everything to make sure you have at least 1 of your level 4s in hand by the end of your turn, or some way to protect it on the field or return it to the hand during your opponents turn. If you're having trouble getting over tricky monsters like Machina Ruinforce and the level 10 Floowandereeze, we run 3 U.A. Penalty Boxes for that exact reason. My current win/loss ratio with this current version during this event is 11/8, though the addition of Adventure or backrow destruction may help if you find yourself stuck often. Enjoy fantasy football as you've never played it before!</p>"
296644,my-generaider-deck-july-2022-296644,My Generaider deck July 2022,90448279,40161,Non-Meta Decks,"[""2881864"",""68199168"",""68199168"",""13903402"",""744887"",""744887"",""75660578"",""94183877"",""94183877"",""94183877"",""52038441"",""52038441"",""52038441"",""97268402"",""97268402"",""97268402"",""1942635"",""1942635"",""38053381"",""38053381"",""38053381"",""75448086"",""49238328"",""49238328"",""49238328"",""14087893"",""14087893"",""14087893"",""25789292"",""25789292"",""25789292"",""14604710"",""14604710"",""14604710"",""64325438"",""23516703"",""23516703"",""37931734"",""37931734"",""37931734""]","[""90448279"",""97584719"",""95113856"",""95113856"",""9349094"",""9349094"",""28981598"",""28981598"",""2665273"",""2665273"",""2665273"",""69073023"",""57282724"",""57282724"",""28776350""]","[""27204311"",""27204311"",""27204311"",""83986578"",""53154400"",""79606837"",""14532163"",""14532163"",""14532163"",""18144506"",""47292920"",""42469671"",""94423983"",""94423983"",""94423983""]",1660415905,7 months ago,,,0,God among us,Finally I had the time and money to build this deck. Thaks ghost from the past.
296638,spellcaster-gravekeeper-296638,Spellcaster-Gravekeeper,79206925,120383,Master Duel Decks,"[""25524823"",""3825890"",""58657303"",""58657303"",""58657303"",""17393207"",""17393207"",""17393207"",""21663205"",""21663205"",""21663205"",""24317029"",""24317029"",""24317029"",""73752131"",""46986414"",""46986414"",""46986414"",""38033121"",""38033121"",""38033121"",""30603688"",""30603688"",""24094653"",""24094653"",""24094653"",""7614732"",""7614732"",""11827244"",""11827244"",""11827244"",""47355498"",""47355498"",""47355498"",""30450531"",""30450531"",""30450531"",""73616671"",""73616671"",""73616671""]","[""79206925"",""79206925"",""79206925"",""50237654"",""84433295"",""84433295"",""65301952"",""2061963"",""72167543""]",,1660415905,7 months ago,,,0,A clash between Necrovalley and the Dark Magicians.,A clash of Necrovalley and the Dark Magician.
296634,yugi-season-2-battle-city-296634,Yugi season 2 - battle city,46986421,16455,Anime Decks,"[""46986414"",""70781052"",""39256679"",""11549357"",""5818798"",""99785935"",""91152256"",""41392891"",""32452818"",""13039848"",""90357090"",""10000020"",""75347539"",""78193831"",""50287060"",""38033121"",""77207191"",""65240384"",""40640057"",""5556668"",""19159413"",""24094653"",""25774450"",""26725158"",""55144522"",""72892473"",""83764718"",""87910978"",""40703222"",""95286165"",""36607978"",""67227834"",""1248895"",""7565547"",""35316708"",""35563539"",""49587034"",""59560625"",""60082869"",""62279055"",""81210420"",""18807109"",""62867251""]","[""11901678"",""4796100""]","[""74677422""]",1660415905,7 months ago,,,0,"If ""Slifer"" is destroyed, Yugi falls back on destructive OTK strategies, either by using his more powerful monsters like ""Dark Magician"" and ""Buster B","<h3><span id=""Battle_City"" class=""mw-headline"">Battle City</span></h3> During the <i><a title=""Battle City"" rel=""nofollow"" href=""https://yugioh.fandom.com/wiki/Battle_City"">Battle City</a></i> preliminaries and quarter-finals, Yugi runs a <b><a title=""Magnet Warrior"" rel=""nofollow"" href=""https://yugioh.fandom.com/wiki/Magnet_Warrior"">Magnet Warrior</a>/<a title=""Spellcaster"" rel=""nofollow"" href=""https://yugioh.fandom.com/wiki/Spellcaster"">Spellcaster</a></b> Deck that focuses on ""<a title=""Dark Magician"" rel=""nofollow"" href=""https://yugioh.fandom.com/wiki/Dark_Magician"">Dark Magician</a>"" and ""<a title=""Dark Magician Girl"" rel=""nofollow"" href=""https://yugioh.fandom.com/wiki/Dark_Magician_Girl"">Dark Magician Girl</a>"" and supports both Spellcasters through ""<a title=""Magic Cylinder (anime)"" rel=""nofollow"" href=""https://yugioh.fandom.com/wiki/Magic_Cylinder_(anime)"">Magic Cylinder</a>"" and ""<a title=""Magic Formula (anime)"" rel=""nofollow"" href=""https://yugioh.fandom.com/wiki/Magic_Formula_(anime)"">Magic Formula</a>"". His Deck also includes more control cards that allow him to manipulate an opponent's cards, such as ""<a title=""Brain Control (anime)"" rel=""nofollow"" href=""https://yugioh.fandom.com/wiki/Brain_Control_(anime)"">Brain Control</a>"", ""<a title=""Lightforce Sword (anime)"" rel=""nofollow"" href=""https://yugioh.fandom.com/wiki/Lightforce_Sword_(anime)"">Lightforce Sword</a>"" and ""<a title=""Mystical Refpanel (anime)"" rel=""nofollow"" href=""https://yugioh.fandom.com/wiki/Mystical_Refpanel_(anime)"">Mystical Refpanel</a>""."
296614,dice-deck-296614,Dice Deck,35772782,20789,Fun/Casual Decks,"[""25652259"",""15744417"",""15744417"",""70095154"",""70095154"",""70095154"",""19636995"",""19636995"",""29284413"",""29284413"",""29284413"",""14778250"",""14778250"",""35595518"",""35595518"",""35595518"",""46659709"",""46659709"",""46659709"",""75214390"",""75214390"",""75214390"",""14558127"",""14558127"",""47292920"",""47292920"",""49238328"",""49238328"",""49238328"",""73628505"",""83764719"",""11808215"",""11808215"",""11808215"",""10045474"",""10045474"",""31863912"",""39454112"",""39454112"",""39454112""]","[""87116928"",""87116928"",""87116928"",""79229522"",""79229522"",""10443957"",""10443957"",""29669359"",""29669359"",""35772782"",""35772782"",""35772782"",""58069384"",""58069384"",""2857636""]","[""74677422""]",1660415905,7 months ago,,,0,We were sick in the hospital and had exams,https://youtu.be/ebKWxzYwXdE
296610,vampire-new-support-2022-296610,VAMPIRE New support 2022,38250531,10628,Non-Meta Decks,"[""27204311"",""4918855"",""79523365"",""79523365"",""40607210"",""6039967"",""6039967"",""92826944"",""92826944"",""92826944"",""67750322"",""67750322"",""90299015"",""90299015"",""90299015"",""49959355"",""49959355"",""49959355"",""14558127"",""14558127"",""73642297"",""73642297"",""73642297"",""70645913"",""70645913"",""70645913"",""34250214"",""34250214"",""34250214"",""2295440"",""69700783"",""69700783"",""69700783"",""81439173"",""83764718"",""5795882"",""5795882"",""5795882"",""10045474"",""10045474""]","[""84815190"",""38192988"",""28240337"",""73082255"",""73082255"",""32302078"",""45935145"",""72860663"",""72860663"",""2857636"",""37129797"",""37129797"",""75452921"",""91420202"",""41999284""]","[""82962242"",""6917479"",""40607210"",""58947797"",""92964816"",""38250531"",""2204140"",""2204140"",""38363525"",""38363525"",""68833958"",""62188962"",""22900598"",""31189536"",""68688135""]",1660415905,7 months ago,,,0,Vampire deck by YGO Lite,https://youtu.be/h_N3buazUAI
296606,zombie-296606,Zombie,39185163,98441,Fun/Casual Decks,"[""95440946"",""95440946"",""95440946"",""39185163"",""39185163"",""66570171"",""52467217"",""49959355"",""49959355"",""49959355"",""14558127"",""14558127"",""14558127"",""92964816"",""92964816"",""68829754"",""68829754"",""81439173"",""48130397"",""48130397"",""48130397"",""94224458"",""31434645"",""31434645"",""31434645"",""95034141"",""4064256"",""4064256"",""4064256"",""20612097"",""20612097"",""20612097"",""20590515"",""20590515"",""20590515"",""90846359"",""90846359"",""90846359"",""93191801"",""93191801""]","[""74889525"",""8198620"",""41209827"",""54757758"",""38192988"",""50091196"",""26096328"",""56910167"",""49202162"",""38342335"",""37129797"",""91420202"",""50588353"",""65741787"",""41999284""]","[""82962242"",""6917479"",""40607210"",""58947797"",""92964816"",""38250531"",""2204140"",""2204140"",""38363525"",""38363525"",""68833958"",""62188962"",""22900598"",""31189536"",""68688135""]",1660415905,7 months ago,,,0,Casual Zombie deck,Non-competitive Zombie deck
296602,wicked-joke-knight-296602,Wicked Joke Knight,21208154,118533,Non-Meta Decks,"[""93880808"",""93880808"",""21208154"",""21208154"",""62180201"",""90876561"",""90876561"",""90876561"",""25652259"",""25652259"",""25652259"",""64788463"",""64788463"",""64788463"",""29284413"",""29284413"",""29284413"",""56673112"",""56673112"",""56673112"",""2460565"",""2460565"",""38814750"",""38814750"",""38814750"",""49036338"",""56824871"",""29062925"",""92067220"",""92067220"",""92067220"",""55557574"",""55557574"",""55557574"",""911883"",""911883"",""32807846"",""67169062"",""67169062"",""67169062"",""269012"",""34959756"",""94770493"",""81945678"",""81945678"",""81945678""]","[""6150044"",""6150045"",""85289965"",""59934749"",""65741786"",""2857636"",""64454614"",""38342335"",""74586817"",""62517849"",""84013237"",""95134948"",""26973555"",""65305468"",""73964868"",""6983839""]","[""82962242"",""6917479"",""40607210"",""58947797"",""92964816"",""38250531"",""2204140"",""2204140"",""38363525"",""38363525"",""68833958"",""62188962"",""22900598"",""31189536"",""68688135""]",1660415905,7 months ago,,,0,King's Court Inspired Deck,King's Court Inspired Deck
296594,dark-magician-deck-jul-2022-296594,Dark Magician Deck Jul.2022,46986421,15081,Non-Meta Decks,"[""36996508"",""46986415"",""46986416"",""3078380"",""3078380"",""38033126"",""42006475"",""7084129"",""7084129"",""7084129"",""14558127"",""59438930"",""73642296"",""94145021"",""97268402"",""97631303"",""97631303"",""97631303"",""12266229"",""12266229"",""12266229"",""1784686"",""18144507"",""23020408"",""23020408"",""23020408"",""24224830"",""65681983"",""65681983"",""47222536"",""47222536"",""47222536"",""95477924"",""95477924"",""95477924"",""10045474"",""10045474"",""20899496"",""48680970"",""48680970""]","[""37818794"",""41721210"",""85059922"",""50237654"",""96633955"",""84815190"",""90448279"",""44405066"",""80117527"",""96471335"",""86066372"",""38342335"",""2857636"",""65741786"",""94259633""]","[""82962242"",""6917479"",""40607210"",""58947797"",""92964816"",""38250531"",""2204140"",""2204140"",""38363525"",""38363525"",""68833958"",""62188962"",""22900598"",""31189536"",""68688135""]",1660415905,7 months ago,,,0,https://youtu.be/JxCjqCjKKkI,https://youtu.be/JxCjqCjKKkI
