deck_num,pretty_url,deck_name,cover_card,userid,format,main_deck,extra_deck,side_deck,ts_submit_date,submit_date,ts_edit_date,edit_date,comments,deck_excerpt,deck_description
75307,scorpions-delta-75307,Scorpions Delta,82482194,23870,Fun/Casual Decks,"[""41403766"",""41403766"",""41403766"",""88643173"",""88643173"",""88643173"",""26566878"",""26566878"",""26566878"",""82482194"",""82482194"",""12580477"",""39719977"",""39719977"",""49238328"",""49238328"",""49238328"",""53129443"",""73628505"",""98645731"",""98645731"",""98645731"",""86780027"",""86780027"",""86780027"",""56747793"",""56747793"",""56747793"",""58012707"",""58012707"",""58012707"",""89208725"",""94192409"",""82732705"",""40605147"",""40605147"",""40605147"",""41420027"",""41420027"",""41420027""]","[""69610924"",""69610924"",""69610924"",""47805931"",""47805931"",""47805931"",""83531441"",""83531441"",""83531441"",""61307543"",""61307543"",""61307543"",""37649320"",""37649320"",""37649320""]","[""89194033"",""29762407"",""80921533"",""14261867"",""13599884"",""39719977"",""48934760"",""35762283"",""40465719"",""94192409"",""94192409"",""5318639"",""5318639"",""50078509"",""50078509""]",1583951905,3 years ago,,,0,Escorpiões esquecidos agora entram para o duelo,"<span><span>Uma estratégia chave é obter um mapa de terreno GIANT BALLPARK e aumentar seus ESCORPIÕES com UNITED WE STAND e SOLIDARITY.</span></span>  <span><span>GIGANTE BALLPARK facilmente você pode colocar 5 ESCOPIÕES no campo, e se 3 desses nomes iguais, você pode atacar diretamente os PONTOS DE VIDA do seu oponente ativando DELTA ATTACKER.</span></span>  <span><span>SUPORTE PARA BUSCA: POTÊNCIA DE EXTRAVAGÂNCIA, POTÊNCIA DE DUALIDADE, TERRAFORME E METAVERSA.</span></span>  <span><span>SUPORTE PARA NEGAÇÃO: DRENO DE HABILIDADE, GREVE SOLEMN E JULGAMENTO SOLEMN.</span></span>  <span><span>SUPORTE PARA CONTROLE: FURO ESCURO, RAIGEKI E DISPOSITIVO OBRIGATÓRIO DE EVACUAÇÃO</span></span>"
75302,shaddangle-75302,Shaddangle,94977270,23886,Non-Meta Decks,"[""63941210"",""63941210"",""31759689"",""94142993"",""94142993"",""3717252"",""94365540"",""12678601"",""12678601"",""97518132"",""77723643"",""30328508"",""30328508"",""68860936"",""51023024"",""51023024"",""4939890"",""24158464"",""24158464"",""24158464"",""37445295"",""1475311"",""1475311"",""1475311"",""44394295"",""44394295"",""44394295"",""63053267"",""63053267"",""19671102"",""19671102"",""19671102"",""6417578"",""6417578"",""6417578"",""48130397"",""23912837"",""23912837"",""99157310"",""21011044""]","[""74822425"",""20366274"",""20366274"",""48424886"",""50907446"",""94977269"",""94977269"",""94977269"",""68987122"",""85289965"",""74997493"",""86938484"",""74937659"",""75119040"",""71384012""]","[""14558128"",""14558128"",""14558128"",""59438931"",""59438931"",""59438931"",""24508238"",""24508238"",""24508238"",""94145021"",""94145021"",""94145021"",""15693423"",""15693423"",""15693423""]",1583951905,3 years ago,,,0,The Tindangles support the already good strategy of Shaddoll. Lots of Flip synergy.,"Fuse the shadds and dangles. Get lots of board monsters thanks to dangles. Flip up, ect."
75299,unstoppable-gaia-the-fierce-knight-deck-75299,Unstoppable Gaia the Fierce Knight Deck,15989522,23914,Fun/Casual Decks,"[""33318980"",""33318980"",""33318980"",""34130561"",""34130561"",""34130561"",""7241272"",""7241272"",""61525276"",""61525276"",""61525276"",""7913375"",""7913375"",""7913375"",""59438931"",""59438931"",""59438931"",""59575539"",""59575539"",""19665973"",""19665973"",""19665973"",""12580477"",""14532163"",""14532163"",""14532163"",""83764718"",""38590361"",""38590361"",""38590361"",""43225434"",""43225434"",""49328340"",""2106266"",""2106266"",""2106266"",""56461575"",""56461575"",""29477860"",""29477860""]","[""40101111"",""79864860"",""2519690"",""2519690"",""15989522"",""15989522"",""70780151"",""33698022"",""40529384"",""76547525"",""35252119"",""95474755"",""78144171"",""85289965"",""67598234""]","[""43225434""]",1583951905,3 years ago,,,0,Very offensive deck aimed to win in 1 turn.,"This deck is all offense. Go second!!  Use lightning storm to destroy any monsters, spells, or traps.  Use cursed dragon, and magical knight to fusion summon either sky galloping or magical dragon( Main).  Use soldier gaia for a extra attack.  &nbsp;  &nbsp;"
75293,aurum-aquam-75293,Aurum Aquam,95440946,23912,Fun/Casual Decks,"[""95440946"",""95440946"",""95440946"",""39185163"",""39185163"",""28297833"",""28297833"",""9126351"",""9126351"",""56840658"",""56840658"",""1357146"",""1357146"",""14558127"",""14558127"",""90311614"",""90311614"",""68829754"",""68829754"",""12580477"",""81439173"",""83764718"",""70368879"",""94224458"",""94224458"",""48130397"",""31434645"",""31434645"",""38761908"",""38761908"",""38761908"",""64765016"",""24903843"",""24903843"",""1154611"",""1154611"",""98414735"",""98414735"",""20612097"",""20612097"",""92379223"",""93332803"",""39033131"",""67007102"",""67007102"",""93191801"",""93191801"",""20590515"",""20590515"",""98273947"",""56984514"",""56984514"",""93332803"",""55063751"",""71197066"",""71197066"",""55063751"",""62850093"",""62850093"",""56984514""]","[""8198620"",""54757758"",""61307543"",""61307542"",""29208536"",""90809975"",""37649320"",""37649320"",""70913714"",""90809975"",""90809975"",""63767246"",""65170459"",""90126061"",""74997493""]","[""43225434""]",1583951905,3 years ago,,,0,"Frogs, Paleozoics and........ Zombies???","I decided to combine Eldlich with Paleozoic/frogs. It actually kind of works.  You guys know how frogs work so I don't think I need to explain how to use them. Send Paleozoics to the GY to summon eldlich, I guess. I really made this deck because i noticed Eldlich uses a bunch of traps and spells, so just put them there.  I would probably increase the amount of El Dorodo Aledeltando, since I find my self not getting it very often. Hastor is just in case you get the level 2 ice barrier tuner in there. Doomking is there as a target for elixir spells/traps, and you can chain it off summoning Eldlich (there's no zombie world because it interfears with summoning Toad). Necro face is there because I like having a way to shuffle my banished cards.  Feel free to change the ratios of cards and let me know your experience"
75280,zombie-shaddoll-75280,Zombie Shaddoll,39185163,23703,Meta Decks,"[""49036338"",""39185163"",""3717252"",""77723643"",""30328508"",""30328508"",""66570171"",""66570171"",""92826944"",""92826944"",""67696066"",""68819554"",""31292357"",""97518132"",""94801854"",""94801854"",""94801854"",""51023024"",""51023024"",""49959355"",""49959355"",""49959355"",""4939890"",""38814750"",""38814750"",""38814750"",""92964816"",""44394295"",""44394295"",""44394295"",""81439173"",""6417578"",""6417578"",""6417578"",""48130397"",""48130397"",""48130397"",""4064256"",""4064256"",""23912837""]","[""74822425"",""95793022"",""8198620"",""8198620"",""20366274"",""20366274"",""50907446"",""94977269"",""83283063"",""74586817"",""21044178"",""66011101"",""37129797"",""37129797"",""50277355""]","[""14532163"",""14532163"",""14532163"",""54693926"",""54693926"",""54693926"",""24224830"",""24224830"",""24224830"",""15693423"",""15693423"",""15693423"",""54974237"",""54974237"",""54974237""]",1583951905,3 years ago,,,0,Zombie world Shaddoll,Shaddoll+ Zombie world
75270,mathmech-feb-2020-75270,Mathmech  Feb 2020,42632209,23910,Non-Meta Decks,"[""8567955"",""8567955"",""8567955"",""89743495"",""89743495"",""27182739"",""27182739"",""27182739"",""53577438"",""53577438"",""53577438"",""16360142"",""16360142"",""16360142"",""80965043"",""80965043"",""80965043"",""52354896"",""52354896"",""80794697"",""80794697"",""14558127"",""14558127"",""14558127"",""14025912"",""35261759"",""35261759"",""57160136"",""57160136"",""57160136"",""24224830"",""24224830"",""43898403"",""43898403"",""41410651"",""41410651"",""87804365"",""87804365"",""51452091"",""51452091""]","[""42632209"",""42632209"",""15248594"",""15248594"",""63533837"",""85692042"",""88021907"",""88021907"",""31833038"",""38342335"",""2857636"",""52698008"",""32995276"",""48068378"",""41999284""]","[""27204311"",""27204311"",""55063751"",""55063751"",""24508238"",""24508238"",""94145021"",""54693926"",""54693926"",""54693926"",""25789292"",""25789292"",""15693423"",""15693423"",""61740673""]",1583951905,3 years ago,,,0,"This deck is battle tested, and very consistent! Going first is no problem, going second can be OTK!","""Mathmech"" is a very underrated archetype that can explode on your opponent very quickly and end games and matches fast. The deck is tricky to beat around with constant increase and decrease of attack (which can also take place during the damage step), the deck can create pretty good hand advantage and has a pretty solid grave recovery from extra deck monsters/spells/and main deck monster effects. This version of the deck can go first and actually it has been better in my opinion to go first against meta decks because there are ways you can stop deck searching, and clear the field without destroying monsters/spells-traps all on your opponent's turn.  Going First,  The opening play is to get two monsters on the board. Usually you want to start with <strong>Balancer Lord</strong> and ANY other monster is fine but its better if you have one that can be S<em>S</em> just in case his effect gets negated for the extra normal summon, you'd then <em>SS</em> <strong>Mathmech Addition</strong>, <strong>Subtraction</strong> or <strong>Sigma</strong> (<strong>Note</strong>: When u <em>SS</em> S<strong>igma</strong> try to <em>XYZ</em> summon using him so he goes to grave and his effect can be activated from the grave otherwise he'll be banished). Next you go into your extra deck for links, <em>link</em> summon <strong>Link Disciple</strong> and then <em>Link</em> summon <strong>Link Devotee</strong>. Use effect of<strong> Disciple</strong> to tribute D<strong>evotee</strong> and then use D<strong>evotee's</strong> effect to summon 2 tokens. Next, you summon <strong>Cyberse Wickkid</strong> by <em>linking</em> one token and D<strong>isciple</strong>, and then use the other token to summon L<strong>inkuriboh</strong>. <strong>Wickkid's</strong> effect will then activate allowing u to add a ""Cyberse"" tuner from deck to hand by banishing a monster from grave BANISH TARGET WILL BE <strong>BALANCER LORD</strong> (<strong>Note</strong>: NEVER banish ""Mathmech"" monsters, with this effect only <em>link</em> monsters or <strong>B</strong><strong>alancer lord</strong>). If you already have <strong>Mathmech Nabla</strong> in hand add <strong>Mathmech Sigma</strong>. Then <strong>B</strong><strong>alancer lord</strong> effect will activate from being banished allowing you to <em>SS</em> one from the hand to which you <em>SS</em> <strong>Nabla</strong>. Use <strong>Nabla</strong> effect to tribute <strong>Linkuriboh</strong> to <em>SS</em> a ""Mathmech"" monster from deck. (Note: Selection is important, DO not <em>SS</em> <strong>Addition</strong> or <strong>Subtraction </strong>these are the monsters you want to draw into) (Note: Try and pick Mathmech monsters of different names, you want to have atleast 3 different named targets in the graveyard.) Next step is to <em>XZY</em> summon <strong>Primathmech Alembertian</strong> and use his effect to search the deck for <strong>Mathmech Superfactorial</strong>. Set it and any other cards and pass turn.  <strong>Mathmech Superfactorial</strong> is a game changer. This card is essentially your key to stopping plays because it allows you to <em>Synchro</em> or <em>XYZ</em> Summon on your opponents turn. Your main target for this card is going to be<strong> Primathmech Laplacian</strong> to send one monster/spell-trap/and card in hand to the grave.  Going Second OTK  Very Simple... Do what you can to make <strong>Geomathmech Final Sigma</strong> and beef him up! <strong>Final Sigma</strong> is a low-key broken AF card! cannot be effected by anything while in the extramonster zone, also he does DOUBLE battle damage. <strong>Geomathmech Final Sigma</strong> + <strong>Mathmech Billionblade Nayuta</strong> = GG  <strong>Mathemch Billionblade Nayuta</strong>  This card can be equiped to any ""Cyberse"" monster, and during the damage step you can send one ""Mathmech"" monster from your deck to the grave to increase your monsters attack by the attack of the sent monster. (<strong>NOTE</strong>: if you send <strong>Division</strong> to the grave you can halve your opponents monsters attack as well, if you send<strong> Multiplication</strong> to grave you can double your monster's attack *only if its in extra monster zone) This all happens during the damage step so its very hard to stop/counter."
75267,neo-carly-carmine-75267,Neo Carly Carmine,70252926,23649,Anime Decks,"[""82971335"",""82971335"",""55586621"",""55586621"",""55586621"",""28966434"",""29088922"",""29088922"",""29088922"",""82693917"",""82693917"",""82693917"",""71870152"",""71870152"",""71870152"",""34471458"",""34471458"",""34471458"",""57869175"",""57869175"",""57869175"",""91407982"",""91407982"",""87902575"",""87902575"",""27895597"",""27895597"",""68663748"",""68663748"",""83764719"",""55144522"",""73628505"",""5318639"",""94068856"",""94068856"",""94068856"",""97077563"",""94662235"",""84218527"",""20057949""]","[""70252926"",""70252926"",""70252926""]","[""27204311"",""27204311"",""55063751"",""55063751"",""24508238"",""24508238"",""94145021"",""54693926"",""54693926"",""54693926"",""25789292"",""25789292"",""15693423"",""15693423"",""61740673""]",1583951905,3 years ago,1665599905,5 months ago,1,Carly Carmine's deck updated. Trying to bring the best out of her character deck whilst keeping it in the 5D's era.,"<p><img class=""aligncenter"" src=""https://vignette.wikia.nocookie.net/yugioh/images/9/98/CarlyCarmine-DULI.png/revision/latest?cb=20200116090819"" alt="""" width=""255"" loading=""lazy"" /></p><p>Fortunes Visions, Carly Carmine's deck updated. Trying to bring the best out of her character deck whilst keeping it in the 5D's era so no Xyz, Pendulum or Link monsters.</p><p>let me know if you've got any ideas to improve it.</p>"
75250,sky-striker-1st-place-2020-75250,SKY STRIKER 1st place 2020,8491308,10628,Meta Decks,"[""26077387"",""26077387"",""26077387"",""37351133"",""14558127"",""14558127"",""14558127"",""59438930"",""59438930"",""97268402"",""97268402"",""25955749"",""25955749"",""32807846"",""35261759"",""35261759"",""67169062"",""70368879"",""73628505"",""99550630"",""99550630"",""5318639"",""5318639"",""5318639"",""51227866"",""51227866"",""52340444"",""73468603"",""98338152"",""24010609"",""97616504"",""50005218"",""50005218"",""50005218"",""76375976"",""76375976"",""76375976"",""24207889"",""24207889"",""24207889""]","[""66403530"",""30194529"",""2857636"",""30674956"",""48815792"",""8491308"",""8491308"",""8491308"",""12421694"",""63288574"",""63288574"",""63288574"",""90673288"",""90673288"",""90673288""]","[""37351133"",""85289965"",""75147529"",""21623008"",""25955749"",""46271408"",""58577036"",""59750328"",""73594093"",""24224830"",""520200401"",""25733157"",""43898403"",""48130397"",""75539614""]",1583951905,3 years ago,,,0,Sky Striker deck by YGO Lite,<a>https://www.youtube.com/watch?v=A5CMtyU6mGY</a>
75240,neo-antinomy-75240,Neo Antinomy,97836203,23649,Anime Decks,"[""36687247"",""36687247"",""36687247"",""11234702"",""11234702"",""37300735"",""37300735"",""293542"",""293542"",""293542"",""66733743"",""64898834"",""1315120"",""1315120"",""94350039"",""48633301"",""48633301"",""48633301"",""30348744"",""64910482"",""64910482"",""74627016"",""74627016"",""58258899"",""58258899"",""83764719"",""2295440"",""55144522"",""5318639"",""11264180"",""97077563"",""7811875"",""44095762"",""93138457"",""93138457"",""14507213"",""40253382"",""76641981"",""3868277"",""94634433""]","[""97836203"",""51447164"",""90953320"",""90953320"",""24943456"",""24943456"",""98558751"",""98558751"",""98558751"",""99937842"",""99937842"",""99937842"",""62560742"",""62560742"",""62560742""]","[""47027714"",""3431737"",""77036039"",""39015"",""49826746"",""29863101"",""88332693"",""93469007"",""56252810"",""76407432"",""80280737"",""74431740"",""40012727""]",1583951905,3 years ago,1665599905,5 months ago,2,"Antinomy's deck updated. Trying to bring the best out of his character deck whilst keeping it in the 5D's era so no Xyz, Pendulum or Link monsters.","<p><img class=""aligncenter"" src=""https://vignette.wikia.nocookie.net/yugioh/images/3/3d/Antinomy.png/revision/latest/scale-to-width-down/350?cb=20190608145513"" alt="""" width=""262"" loading=""lazy"" /></p><p>Hi-Tech Genius, Antinomy's deck updated. Trying to bring the best out of his character deck whilst keeping it in the 5D's era so no Xyz, Pendulum or Link monsters.</p><p>let me know if you've got any ideas to improve it.</p>"
75233,crusadia-dragon-of-mist-valley-negro-75233,Crusadia Dragon of Mist Valley (Negro),56343672,23907,Meta Decks,"[""88264978"",""63633694"",""63633694"",""29587993"",""89399912"",""81524756"",""81524756"",""81524756"",""54525057"",""54525057"",""54525057"",""56343672"",""56343672"",""28031913"",""28031913"",""28031913"",""69448290"",""91646304"",""91646304"",""91646304"",""9047460"",""55241609"",""55241609"",""55241609"",""23571046"",""76218313"",""67441435"",""81439173"",""83764719"",""99674361"",""99674361"",""99674361"",""24224830"",""24224830"",""24224830"",""87571563"",""62265044"",""29549364"",""29549364"",""29549364""]","[""27548199"",""63533837"",""21887175"",""74997493"",""72330894"",""50588353"",""11969228"",""83152482"",""65741786"",""39528955"",""13143275"",""86148577"",""98978921"",""72228247"",""60303245""]","[""15381421"",""15381421"",""54455664"",""9753964"",""50954680"",""80666118"",""98506199"",""88581108"",""86066372"",""1781310"",""55838342""]",1583951905,3 years ago,,,1,"Share this broken deck, so it can be ban in the future.","Combo Deck, Going 1st deck, Crusadia engine watch the video.  Saryuja + Ferret + guardragon combo, +  mist valley = Infinite negates + 1, no tribute summon (with trap), no battle phase.  &nbsp;  "
75230,generaider-traptrix-post-igas-75230,Generaider Traptrix (post IGAS),73639099,23569,Meta Decks,"[""14558127"",""24508238"",""76382116"",""97268402"",""50366775"",""40998517"",""17535764"",""75660578"",""23898021"",""48686504"",""13903402"",""41386308"",""97526666"",""26202165"",""84764038"",""10802915"",""55428242"",""45803070"",""82738277"",""91812341"",""91812341"",""91812341"",""28201945"",""57160136"",""81439173"",""38053381"",""88851326"",""73628505"",""43898403"",""46253216"",""22802010"",""29401950"",""78474168"",""48216773"",""94192409"",""76045757"",""70342110"",""60743819"",""50078509"",""69599136"",""37931734"",""37931734"",""10045474"",""41440817"",""89208725"",""89208725"",""44095762"",""84640866"",""98414735"",""38761908"",""35035481"",""83555666"",""56120475"",""8608979"",""8608979"",""8608979"",""2055403"",""53582587"",""80101899"",""29616929""]","[""82633039"",""16195942"",""16195943"",""34086406"",""48739166"",""95113856"",""6983839"",""31833038"",""58699500"",""75452921"",""2857636"",""38342335"",""60303245"",""73639099"",""67680512"",""71384012""]","[""73642296"",""59438930"",""91712985"",""46502744"",""27107590"",""28929131"",""24224830"",""8267140"",""95286165"",""37520316"",""93260132"",""31849106"",""83326048"",""58392024"",""68477598""]",1583951905,3 years ago,,,0,"A great control deck this meta, able to rival a lot of the current meta contenders.",-Traptrix Sera gives a lot of advantage if she stays on the board -Generaiders still give pressure because of their high attack -Mardel gives access to either Sera if she isn't out on the field yet or Dionaea if she is -Frodi gives the necessary protection to Sera and popping your own monsters comes up a surprising amount of time to dodge negations or effects that take my monsters.
75226,best-megalith-deck-2020-75226,Best Megalith Deck 2020,78990927,21880,Meta Decks,"[""63233638"",""63233638"",""63233638"",""25726386"",""25726386"",""25726386"",""99628747"",""99628747"",""99628747"",""63056220"",""63056220"",""63056220"",""90444325"",""90444325"",""78990927"",""78990927"",""78990927"",""77235086"",""77235086"",""77235086"",""92919429"",""92919429"",""92919429"",""76103404"",""67441435"",""14558127"",""14558127"",""14558127"",""96729612"",""96729612"",""96729612"",""84504242"",""76209339"",""10045474"",""10045474"",""10045474"",""15693423"",""15693423"",""24224830"",""24224830""]","[""80532587"",""42566602"",""33198837"",""79606837"",""79606837"",""93854893"",""66403530"",""86066372"",""21887175"",""85289965"",""4280258"",""2857636"",""50588353"",""41999284"",""50588353""]","[""73642296"",""59438930"",""91712985"",""46502744"",""27107590"",""28929131"",""24224830"",""8267140"",""95286165"",""37520316"",""93260132"",""31849106"",""83326048"",""58392024"",""68477598""]",1583951905,3 years ago,,,0,"Very good  Megalith deck with Cyber Angel Benten engine. Reinforced with a small ""crystron needlefiber"" - ""glow up bulb"" combo giving us extra Link 4.","All mine decks are well tested and optimized in terms of draw power, dead hand, synergy. balance &amp; combo.  All this to give you the best possible version of selected deck.  Please check my other decks. You will not regret. Something nice for everyone will be found.  Trickstars great archetype, of course shows its full class with 3 x ""trickstar light stage"" and with 3 x ""terraforming"". But you can still kick some butts quickly ;) but nowe you must have good hand. It could be easier to win  with Utopia Double OTK mechanic (instant fusion and double or nothing), but I wanted to keep something from original  charm of this archetype.  <a rel=""nofollow"" href=""https://ygoprodeck.com/pure-trickstars-2020/"">https://ygoprodeck.com/pure-trickstars-2020/</a>  My old idea adapted to current ban list and with application new cards. You haven't seen Gouki in this form.  <a rel=""nofollow"" href=""https://ygoprodeck.com/gouki-world-lockdown-2020/"">https://ygoprodeck.com/gouki-world-lockdown-2020/</a>  This deck prevents from using enemy monsters effects and blocks his extra deck.  Much better deck than other decks with this archetype.  <a rel=""nofollow"" href=""https://ygoprodeck.com/smashing-buster-blader-mr-2020/"">https://ygoprodeck.com/smashing-buster-blader-mr-2020/</a>  Masked Hero return more effective and stronger than ever. You don’t believe check it out.  <a rel=""nofollow"" href=""https://ygoprodeck.com/top-tier-hero-deck-master-rule-2020/"">https://ygoprodeck.com/top-tier-hero-deck-master-rule-2020/</a>  Pure perfection and synergy.  <a rel=""nofollow"" href=""https://ygoprodeck.com/herald-of-perfection-heraldgeddon-2020/"">https://ygoprodeck.com/herald-of-perfection-heraldgeddon-2020/</a>  Interesting thing in this deck is that we cen use very rare phenomenon in YGO which is “infinite loop”.  <a rel=""nofollow"" href=""https://ygoprodeck.com/six-samurai-ftk-2020/"">https://ygoprodeck.com/six-samurai-ftk-2020/</a>  Pure and deadly Fluffal OTK deck.  <a rel=""nofollow"" href=""https://ygoprodeck.com/best-fluffal-deck-master-rule-2020/"">https://ygoprodeck.com/best-fluffal-deck-master-rule-2020/</a>  Simple and fun deck for fans of Red Dragon Archfiend. Master Rule 4 &amp; 5 [  better on 5 ;)  ].  <a rel=""nofollow"" href=""https://ygoprodeck.com/red-dragon-archfiend-deck-2019-3/"">https://ygoprodeck.com/red-dragon-archfiend-deck-2019-3/</a>  A really good D/D/D deck (not only IMO). Includes all new combos and 1 round lockdown.  <a rel=""nofollow"" href=""https://ygoprodeck.com/d-d-d-deck-master-rule-2020/"">https://ygoprodeck.com/d-d-d-deck-master-rule-2020/</a>  Fun and simple deck, with a little bit of LOCK, not everything in life must be complicated.  <a rel=""nofollow"" href=""https://ygoprodeck.com/krawler-prediction-princess-2020/"">https://ygoprodeck.com/krawler-prediction-princess-2020/</a>  Do you like Gren Maju, banish cards gain a lot LP and ATK. But you think in these times with this deck I won't win with anyone. Nothing more wrong, with a good idea you can do a lot. And this is the most beautiful in YGO new life old cards.  <a rel=""nofollow"" href=""https://ygoprodeck.com/gren-maju-banish-deck-2019/"">https://ygoprodeck.com/gren-maju-banish-deck-2019/</a>  Troll, consistent, draw power,control.  <a rel=""nofollow"" href=""https://ygoprodeck.com/lair-of-darkness-2020/"">https://ygoprodeck.com/lair-of-darkness-2020/</a>  You miss a simple game. Tons oponent effects and 5 minutes round bother you. Here you have the answer.  <a rel=""nofollow"" href=""https://ygoprodeck.com/anti-meta-2020/"">https://ygoprodeck.com/anti-meta-2020/</a>"
