deck_num,pretty_url,deck_name,cover_card,userid,format,main_deck,extra_deck,side_deck,ts_submit_date,submit_date,ts_edit_date,edit_date,comments,deck_excerpt,deck_description
75998,ygopro-generaider-deck-2020-unlimited-summon-elite-75998,【YGOPRO】GENERAIDER DECK 2020 | Unlimited Summon | Elite,94183877,23956,Meta Decks,"[""94183877"",""94183877"",""94183877"",""68199168"",""68199168"",""13903402"",""13903402"",""49275969"",""49275969"",""40998517"",""40998517"",""744887"",""744887"",""76382116"",""75660578"",""2881864"",""48686504"",""48686504"",""48686504"",""73628505"",""38053381"",""38053381"",""38053381"",""75448086"",""75448086"",""75448086"",""14604710"",""14604710"",""14604710"",""89208725"",""37931734"",""37931734"",""37931734"",""64325438"",""24207889"",""24207889"",""84749824"",""84749824"",""1637760"",""1637760""]","[""2665273"",""2665273"",""2665273"",""95113856"",""95113856"",""88581108"",""88581108"",""88581108"",""77058170"",""38342335"",""2857636"",""75452921"",""13117073"",""49725936"",""65741786""]","[""28201945"",""14558127"",""14558127"",""97268402"",""83764719"",""1005587"",""2055403"",""4206964"",""4206964"",""10045474"",""28654932"",""29401950"",""56526564"",""69599136"",""41420027""]",1583951905,3 years ago,,,0,【YGOPRO】GENERAIDER DECK 2020 | Unlimited Summon | Elite,Write your deck strategy here...【YGOPRO】GENERAIDER DECK 2020 | Unlimited Summon | Elite
75995,invoked-generaider-75995,Invoked Generaider,86120752,24040,Non-Meta Decks,"[""76382116"",""40998517"",""40998517"",""75660578"",""75660578"",""9794980"",""13903402"",""2881864"",""49275969"",""49275969"",""29913783"",""744887"",""744887"",""35183584"",""86120751"",""86120751"",""86120751"",""23898021"",""23898021"",""23898021"",""48686504"",""48686504"",""48686504"",""75448086"",""75448086"",""75448086"",""74063034"",""74063034"",""78543464"",""78543464"",""78543464"",""83764719"",""73628505"",""40089744"",""38053381"",""38053381"",""47679935"",""47679935"",""73468603"",""48130397"",""458748"",""14604710"",""14604710"",""14604710"",""37931734"",""37931734"",""37931734"",""74003290"",""74003290"",""89208725"",""64325438"",""64325438"",""24207889""]","[""11270236"",""75286621"",""48791583"",""12307878"",""85908279"",""49513164"",""13529466"",""2665273"",""88581108"",""97973962"",""75452921"",""2857636"",""38342335"",""57282724""]","[""28201945"",""14558127"",""14558127"",""97268402"",""83764719"",""1005587"",""2055403"",""4206964"",""4206964"",""10045474"",""28654932"",""29401950"",""56526564"",""69599136"",""41420027""]",1583951905,3 years ago,,,0,"I'm very, very sorry for your loss",I'm the boss
75992,subterror-invoked-75992,subterror invoked,75286621,24049,Meta Decks,"[""86120751"",""86120751"",""86120751"",""74063034"",""74063034"",""47679935"",""42713844"",""42713844"",""42713844"",""16428514"",""16428514"",""16428514"",""39581190"",""39581190"",""39581190"",""74762582"",""74762582"",""74762582"",""5697558"",""5697558"",""5697558"",""73628505"",""23924608"",""23924608"",""10813327"",""10813327"",""14558128"",""14558128"",""10045474"",""10045474"",""10045474"",""27204311"",""97268402"",""97268402"",""43422537"",""68001309"",""68001309"",""68001309"",""74640994"",""74640994""]","[""75286621"",""12307878"",""85908279"",""49513164"",""13529466"",""74937659"",""74937659"",""74937659"",""50277355"",""4280258"",""86221741"",""60303245"",""2220237"",""74997493"",""74997493""]","[""28201945"",""14558127"",""14558127"",""97268402"",""83764719"",""1005587"",""2055403"",""4206964"",""4206964"",""10045474"",""28654932"",""29401950"",""56526564"",""69599136"",""41420027""]",1583951905,3 years ago,,,1,subterror fun ,this is my first deck upload  i dont care what yall think i love subterror its one of my fav decks  so i decided to try mix it with invoked its hard cause alister is a normal summon and so is most of sub terror  but it can work  out ive tested it a few times  i did quiet well i beat altergiest with ez  2 and 0 in a match so
75983,testing-traptrix-genlisea-75983,Testing Traptrix Genlisea,91812341,24048,Non-Meta Decks,"[""91812341"",""91812341"",""91812341"",""82738277"",""82738277"",""82738277"",""45803070"",""45803070"",""45803070"",""55428242"",""28201945"",""88078306"",""20292186"",""34267821"",""94770493"",""35261759"",""24224830"",""12444060"",""12444060"",""12444060"",""98827725"",""98827725"",""98827725"",""80101899"",""80101899"",""80101899"",""29616929"",""29616929"",""74003290"",""74003290"",""40605147"",""40605147"",""69599136"",""69599136"",""29401950"",""29401950"",""2055403"",""2055403"",""31548215"",""31548215""]","[""73639099"",""73639099"",""73639099"",""75452921"",""2857636"",""38342335"",""65741786"",""85289965"",""6511113"",""59071624"",""21044178"",""6983839"",""84013237"",""62517849"",""56832966""]","[""27204311"",""27204311"",""78661338"",""78661338"",""14558127"",""14558128"",""20292186"",""55285840"",""15693423"",""15693423"",""23924608"",""23924608"",""58921041"",""18895832"",""35261759""]",1583951905,3 years ago,,,0,Testing Traptrix Genlisea,Testing Traptrix Genlisea
75977,dragonmaid-guardragon-75977,Dragonmaid Guardragon,41232647,24040,Non-Meta Decks,"[""11012154"",""88264978"",""15848542"",""15848542"",""15848542"",""42055234"",""42055234"",""42055234"",""5560911"",""76782778"",""76782778"",""49575521"",""89399912"",""62706865"",""62706865"",""62706865"",""16960120"",""88453933"",""88453933"",""88453933"",""13171876"",""13171876"",""40398073"",""84899094"",""40110009"",""40110009"",""40110009"",""78231355"",""78231355"",""78231355"",""81439173"",""6853254"",""6853254"",""99674361"",""62265044"",""62265044"",""14625090"",""87571563"",""87571563"",""87571563"",""15754711"",""47393199"",""47393199"",""77515704""]","[""41232647"",""41232647"",""9753964"",""80666118"",""76547525"",""94677445"",""11969228"",""59537380"",""86148577"",""13143275"",""77637979"",""74997493"",""13756293""]","[""27204311"",""27204311"",""78661338"",""78661338"",""14558127"",""14558128"",""20292186"",""55285840"",""15693423"",""15693423"",""23924608"",""23924608"",""58921041"",""18895832"",""35261759""]",1583951905,3 years ago,,,1,And I'm a big boy,Dragonmaids for big boys
75974,blueeyes-og-deck-75974,BlueEyes OG Deck,55969226,24045,Meta Decks,"[""89631145"",""89631145"",""89631145"",""38517737"",""38517737"",""38517737"",""69072185"",""45467446"",""45467446"",""33282498"",""14558127"",""14558127"",""71039903"",""71039903"",""71039903"",""79814787"",""67441435"",""8240199"",""8240199"",""8240199"",""97268402"",""2295440"",""6853254"",""6853254"",""6853254"",""38120068"",""38120068"",""38120068"",""41620959"",""48800175"",""48800175"",""48800175"",""81439173"",""83764719"",""24224830"",""24224830"",""43898403"",""43898403"",""87025064"",""82732705""]","[""2129638"",""40908371"",""59822133"",""59822133"",""50954680"",""83994433"",""33698022"",""58820923"",""39030163"",""18963306"",""63767246"",""8165596"",""1861629"",""7778726"",""41999284""]","[""55063751"",""55063751"",""55063751"",""59438930"",""59438930"",""45644898"",""88241506"",""94145021"",""94145021"",""94145021"",""12580477"",""35261759"",""71867500"",""87025064"",""56920308""]",1583951905,3 years ago,,,1,Just og blue eyes ,Blue eyes :)
75965,magallanica-daedalus-75965,MAGALLANICA DAEDALUS,10485110,21784,Non-Meta Decks,"[""10485110"",""37721209"",""21954587"",""22446869"",""22446869"",""22446869"",""3111207"",""43797906"",""43797906"",""43797906"",""74311226"",""74311226"",""74311226"",""69293721"",""71978434"",""78868119"",""78868119"",""37104630"",""37104630"",""21565445"",""21565445"",""21565445"",""93169863"",""2295440"",""22123627"",""70368879"",""72060415"",""72060415"",""72060415"",""73628505"",""85852291"",""93946239"",""24224830"",""24224830"",""24224830"",""52340444"",""73468603"",""295517"",""26534688"",""26534688""]","[""440556"",""440556"",""90809975"",""90809975"",""31833038"",""74997493"",""49202162"",""38342335"",""2857636"",""73309655"",""50588353"",""65170459"",""8491308"",""63288574"",""90673288""]","[""55063751"",""55063751"",""55063751"",""59438930"",""59438930"",""45644898"",""88241506"",""94145021"",""94145021"",""94145021"",""12580477"",""35261759"",""71867500"",""87025064"",""56920308""]",1583951905,3 years ago,,,0,"One of my favourite boss monster, Daedalus made viable with the new support of Deep Sea archetype: Magallanica, The Deep Sea City. Capable to rip ALL ","<img src=""https://i.imgur.com/9wzjXdo.png"" alt=""image"" />  This Daedalus strategy is running a Mermail/Atlantean engine, basically making Deep Sea Diva, Neptabyss, and Mermail+Atlantean Dragoon your best starter. Our aim is to make Saryuja with 4 material, but before that we have to search both the Daedalus with Dragoon or Magallanica (place on top, then draw with Saryuja), then ss Daedalus with Saryuja, ss Neo-Daedalus and tribute Umi on the field to rip every card on hand or field except Neo-Daedalus.  The 3 cards missing is 3 <a data-name=""Deep Sea Aria"">Deep Sea Aria</a>.  Expected end board:  <img src=""https://i.imgur.com/pVOR3ZC.png"" alt=""image"" />  Replay download: <a>http://bit.ly/2vESXqr</a>"
75958,cubic-75958,Cubic,30270176,10471,Meta Decks,"[""63941210"",""63941210"",""30270176"",""30270176"",""30270176"",""55063751"",""55063751"",""20137754"",""20137754"",""20137754"",""3775068"",""4998619"",""77387463"",""78509901"",""40392714"",""41114306"",""15610297"",""15610297"",""15610297"",""35058588"",""35058588"",""35058588"",""35726888"",""35726888"",""35726888"",""49238328"",""49238328"",""49238328"",""73594093"",""99330325"",""99330325"",""99330325"",""1218214"",""1218214"",""1218214"",""9659580"",""9659580"",""9659580"",""2434862"",""2434862"",""34325937"",""34325937"",""38606913"",""38606913"",""38606913""]","[""72664875"",""62541668"",""26096328"",""26556950"",""3814632"",""49032236"",""56910167"",""90162951"",""85289965"",""4280258"",""1861629"",""38342335"",""2857636"",""72336818"",""75452921""]","[""10000080"",""10000080"",""102380"",""102380"",""102380"",""5133471"",""5133471"",""64697431"",""64697431"",""43898403"",""43898403"",""43898403"",""61740673"",""69452756"",""69452756""]",1583951905,3 years ago,,,0,crimson nova and crimson nova accessories ,Crimson_Nova_Deck.YgoPro
75952,blackwing-mr5-75952,Blackwing MR5,10443958,24041,Meta Decks,"[""81470373"",""81470373"",""81470373"",""17465972"",""17465972"",""49003716"",""49003716"",""49003716"",""81105204"",""81105204"",""81105204"",""14785765"",""14558128"",""14558128"",""14558128"",""2009101"",""2009101"",""2009101"",""28190303"",""9047460"",""77152542"",""77152542"",""73652465"",""97268402"",""97268402"",""97268402"",""1475311"",""1475311"",""83764719"",""67169062"",""12580477"",""23581825"",""91351370"",""91351370"",""91351370"",""24224830"",""24224830"",""24224830"",""80254726"",""80254726""]","[""54082269"",""9012916"",""27548199"",""23338098"",""16051717"",""81983656"",""33158448"",""95040215"",""90953320"",""10443957"",""21044178"",""73347079"",""50588353"",""36429703"",""72330894""]","[""65192027"",""9047460"",""22835145"",""54082269"",""81983656"",""1475311"",""43898403"",""43898403"",""43898403"",""54974237"",""54974237"",""54974237"",""41420027"",""41420027"",""41420027""]",1583951905,3 years ago,,,0,Post Duel Overload MR5 Blackwing Deck,<span>Post Duel Overload MR5 Blackwing Deck</span>  &nbsp;  Any suggestions?
75949,owaidjskhgueios-75949,owaidjskhgueios,25451652,24042,Fun/Casual Decks,"[""25451652"",""25451652"",""55690251"",""55690251"",""55690251"",""52840267"",""52840267"",""52840267"",""88234365"",""88234365"",""88234365"",""85771019"",""11260714"",""11260714"",""40921744"",""40921744"",""25339070"",""25339070"",""51728779"",""51728779"",""47664723"",""67316075"",""92807548"",""92807548"",""92807548"",""14558128"",""21502796"",""21502796"",""1475311"",""14517422"",""14517422"",""14517422"",""81439173"",""83764719"",""87112784"",""87112784"",""87112784"",""43898403"",""43898403"",""1005587"",""44095762"",""48152161"",""48152161"",""50501121"",""53582587"",""58787301"",""87990236""]","[""35306215"",""35306215"",""35306215"",""74997493"",""74997493""]","[""65192027"",""9047460"",""22835145"",""54082269"",""81983656"",""1475311"",""43898403"",""43898403"",""43898403"",""54974237"",""54974237"",""54974237"",""41420027"",""41420027"",""41420027""]",1583951905,3 years ago,,,0,owaidjskhgueios,Darklords
75946,heros-aren-t-just-a-rouge-deck-cimooo-75946,HEROs Aren't Just a Rouge Deck Cimooo,63813056,19979,Meta Decks,"[""83965310"",""14124483"",""9411399"",""9411399"",""9411399"",""18094166"",""18094166"",""18094166"",""37780349"",""13650422"",""40044918"",""40044918"",""40044918"",""64184058"",""59392529"",""45195443"",""50720316"",""50720316"",""27780618"",""27780618"",""22865492"",""22865492"",""213326"",""213326"",""8949584"",""12071500"",""24094653"",""32807846"",""45906428"",""52947044"",""52947044"",""52947044"",""67169062"",""21143940"",""21143940"",""21143940"",""43898403"",""43898403"",""43898403"",""64014615""]","[""86165817"",""62624486"",""90579153"",""22061412"",""29095552"",""40854197"",""46759931"",""22908820"",""58481572"",""58481572"",""30757127"",""63813056"",""1948619"",""58004362"",""58004362""]","[""14558127"",""14558127"",""14558127"",""62111090"",""41209827"",""54757758"",""54693926"",""54693926"",""54693926"",""48130397"",""48130397"",""48130397"",""51452091"",""51452091"",""23002292""]",1583951905,3 years ago,,,3,Crazy Consistent and fun as all heck. Leave your comments please,"Hello, one and all once again to the land of Yu-Gi-Oh. Today I have prepared for your a Yu-Gi-Oh deck the likes of which have been seen before many times before. I have made a few choices that aren't necessarily spicy but they do divulge from the traditional HERO build. I ask for you to leave questions below because I have been playing this deck for a long time and I would love to answer your questions about the deck. Also, if you have any comments that can make the deck stronger do that as well.  &nbsp;  Here I will explain my main deck tech choices -  3x Twin Twisters -- I refuse to lose to mine and it can be helpful against other super important back row cards like Salamangreat Sanctuary, Lost World, Altergeist, and so on. It can also be a great way to bait out interruptions early.  Pot of Avarice - If you get the standard combo of Faris and any other HERO then you will have five monsters in the grave that don't necessarily need to be there. Extra deck monsters and one or two of's that you would rather draw can go back without hurting the deck at all. Just make sure that you don't get rid of miracle fusion material if thats a potential play for you. I usually do this when I cant search mask change in a turn and I really want to try to draw it.  Pot of acquisitiveness - More Malicious no problem. The same thing with the dynatag, or the cards you banish off vyon. I see it as a way to restart your play if your opponent draws one of their outs to your board. I will say that this and Avarice usually get sided out game two and three. What is important is that the first game has the most randomness to it, and it is always better to reload your resources just in case.  Destiny Hero Decider - I hear one guy say, ""If you need to use celestial then you're losing."" I though long and hard about this and decided to play this instead. You can add back plasma or honest neos which would otherwise be stuck in the graveyard. You can also slow down mystic mine if you can activate monster effects.  Elemental HERO Shining - I won't play Miracle fusion without more than one target. I chose this because you can miracle fusion a nibiru token for its summon. You can also banish Honest Neos from grave, and then when shining is sent to grave (ie linked off) you can add that Neos back. The only time i've wished I had something else was blast. I wouldn't play Anki but that is just me.  &nbsp;  This is where I discuss my side deck options -  Super Poly and its targets - It's Super poly I wont explain more. I play earth golem for spyral and salamangreat. I play Starving venom because it is a good card and many decks use two darks. The third I have is mudragon and it's iffy. I play him mostly for the madolche matchup I think, but there are other situations where you can hit spiral boards, or shadoll boards. It is the least often used choice but I like playing three to cover all the bases.  Red Reboot/Royal Decree - You don't play any traps and altergeist and paleo suck to play against. I side out the pots and reinforcement for these three and keep the twin twisters in.  Dark ruler no more I think I use mostly for Dino and the HERO matchup. Most HERO decks don't play well against other HERO decks. Dino is also this decks worst matchup and I will not debate that with anyone. Dropping a dark ruler on a dino board gives you free rein to destroy their board. I prefer to plasma the UTC off the board instead of just giving it back, and then the monster effects stay off. I try to make dark laws as fast as I can after using Dark Ruler so that their entire field gets banished. I have considered playing evenly matched over this, but it's too expensive.  Ash Blossom - Over all else Ash can kill every deck. Do not jump at the first search, unless it is like turn three. I held an ash against prank kids until mid combo to ash the summon and it stopped him outright. Unless its a normal summoned stratos, or something else that the opponent has to get off and is only once per turn wait to ash.  Thats all guys I hope you like it I have spent a long time making the deck my own and it feels so kickass. Thank you for reading, and please please please leave some comments for me to check out."
75943,mr5-raidraptor-deck-profile-post-duel-overload-march-2020-75943,MR5 Raidraptor Deck Profile (Post - Duel Overload March 2020,36429703,11589,Meta Decks,"[""83236601"",""83236601"",""83236601"",""53251824"",""53251824"",""53251824"",""96345188"",""96345188"",""96345188"",""46589034"",""46589034"",""31314549"",""97219708"",""97219708"",""97219708"",""52350806"",""52350806"",""52350806"",""24508238"",""24508238"",""14785765"",""96227613"",""69610326"",""69610326"",""69610326"",""44179224"",""44179224"",""44179224"",""29587993"",""8559793"",""23581825"",""23581825"",""23581825"",""58988903"",""58988903"",""58988903"",""43898403"",""43898403"",""1475311"",""1475311"",""1475311"",""24224830"",""24224830"",""24224830"",""81439174""]","[""86221741"",""23603403"",""81927732"",""73347079"",""73347079"",""21044178"",""10443957"",""46772449"",""84013237"",""86532744"",""52653092"",""72330894"",""36429703"",""36429703"",""36429703""]","[""82385847"",""27204311"",""27204311"",""27204311"",""43898403"",""8267140"",""8267140"",""8267140"",""54693926"",""54693926"",""54693926"",""15693423"",""15693423"",""15693423"",""23002292""]",1583951905,3 years ago,,,0,"Summon Utopic Zexal, Cyber Dragon Infinity, and Ultimate Falcon by utilizing the new Raidraptor Link and Simorgh Link.  YT: TCGRaidraptors ","<ol>  	<li>Using the pendulum mechanism to help summon 3 monsters (2 being Dark Winged beast)</li>  	<li>Special summon <a data-name=""Raidraptor - Wise Strix"">Raidraptor - Wise Strix</a> and bring out <a data-name=""Blackwing - Zephyros the Elite"">Blackwing - Zephyros the Elite</a></li>  	<li>XYZ summon <a data-name=""Raidraptor - Force Strix"">Raidraptor - Force Strix</a></li>  	<li>Detach to search and summon <a data-name=""Raidraptor - Singing Lanius"">Raidraptor - Singing Lanius </a>while setting <a data-name=""Rank-Up-Magic Shave Force"">Rank-Up-Magic Shave Force</a></li>  	<li>Special summon <a data-name=""Blackwing - Zephyros the Elite"">Blackwing - Zephyros the Elite</a> from GY</li>  	<li>Link summon <a data-name=""Simorgh, Bird of Kings"">Simorgh, Bird of Kings</a> using <a data-name=""Raidraptor - Force Strix"">Raidraptor - Force Strix </a>and <a data-name=""Raidraptor - Wise Strix"">Raidraptor - Wise Strix</a></li>  	<li>XYZ summon <a data-name=""Abyss Dweller"">Abyss Dweller</a></li>  	<li>Use <a data-name=""Rank-Up-Magic Shave Force"">Rank-Up-Magic Shave Force</a> to special summon <a data-name=""Cyber Dragon Infinity"">Cyber Dragon Infinity</a></li>  	<li>At the end phase, special summon <a data-name=""Mist Valley Apex Avian"">Mist Valley Apex Avian</a></li> </ol> All combos can be viewed on the YT channel:  https://youtu.be/aXINjcMCoqU"
75937,mystic-mine-monarch-2020-75937,Mystic Mine Monarch 2020,84171830,23985,Meta Decks,"[""23064604"",""23064604"",""23064604"",""96570609"",""96570609"",""96570609"",""95457011"",""95457011"",""95457011"",""59463312"",""59463312"",""59463312"",""57666212"",""33746252"",""33746252"",""47084486"",""2295440"",""12580477"",""22842126"",""32807846"",""33609262"",""33609262"",""33609262"",""70368879"",""81439174"",""79844764"",""79844764"",""79844764"",""61466310"",""76375976"",""76375976"",""84171830"",""84171830"",""84171830"",""89208725"",""24207889"",""36975314"",""36975314"",""54241725"",""54241725""]","[""86221741"",""23603403"",""81927732"",""73347079"",""73347079"",""21044178"",""10443957"",""46772449"",""84013237"",""86532744"",""52653092"",""72330894"",""36429703"",""36429703"",""36429703""]","[""82385847"",""27204311"",""27204311"",""27204311"",""43898403"",""8267140"",""8267140"",""8267140"",""54693926"",""54693926"",""54693926"",""15693423"",""15693423"",""15693423"",""23002292""]",1583951905,3 years ago,,,1,Mystic Mine Stalls for bricky hands ,Mystic Mine Stalls for bricky hands
75934,valkyrie-pure-deck-75934,Valkyrie Pure Deck,97854941,18865,Non-Meta Decks,"[""97854941"",""97854941"",""83705073"",""83705073"",""66809920"",""30411385"",""30411385"",""30411385"",""37742478"",""37742478"",""3026686"",""3026686"",""3026686"",""81558967"",""81558967"",""14558128"",""14558128"",""44163252"",""44163252"",""44163252"",""2295440"",""17956906"",""17956906"",""17956906"",""35261759"",""35261759"",""58577036"",""24224830"",""24224830"",""1353770"",""1353770"",""1353770"",""38576155"",""38576155"",""38576155"",""64961254"",""91969909"",""10045474"",""10045474"",""10045474""]","[""21887175"",""66403530"",""85289965"",""74997493"",""4280258"",""1861629"",""1322368"",""2857636"",""30741503"",""87871125"",""75452921"",""7778726"",""7778726"",""90673288"",""41999284""]","[""37742478"",""59438931"",""59438931"",""62015409"",""62015409"",""62015409"",""8267140"",""8267140"",""43898403"",""43898403"",""51452091"",""51452091"",""51452091"",""23002292"",""23002292""]",1583951905,3 years ago,,,0,Valkyrie Pure Deck,It's just waifu deck :v  &nbsp;
75931,aroma-waifu-deck-2020-75931,Aroma Waifu Deck 2020,79656239,18865,Non-Meta Decks,"[""85967160"",""40663548"",""58569561"",""58569561"",""14558128"",""14558128"",""60643554"",""60643554"",""96789758"",""96789758"",""96789758"",""14169843"",""14169843"",""16759958"",""11830996"",""11830996"",""12580477"",""73628505"",""24224830"",""24224830"",""12021072"",""12021072"",""12021072"",""29189613"",""29189613"",""5050644"",""5050644"",""5050644"",""10045474"",""10045474"",""10045474"",""15177750"",""28265983"",""28265983"",""92266279"",""92266279"",""92266279"",""41420027"",""41420027"",""41420027""]","[""27548199"",""63533837"",""73580471"",""33158448"",""79656239"",""79656239"",""45500495"",""45500495"",""38148100"",""38148100"",""2857636"",""21200905"",""21200905"",""75452921"",""41999284""]","[""60643554"",""25958491"",""11830996"",""8267140"",""8267140"",""24224830"",""43898403"",""43898403"",""91740879"",""91740879"",""91740879"",""75249652"",""75249652"",""83555667"",""83555667""]",1583951905,3 years ago,,,0,Aromage waifu,"No waifu, no life..!  &nbsp;"
75925,true-heros-75925,True HEROs,29343734,21610,Fun/Casual Decks,"[""84327329"",""20721928"",""21844576"",""58932615"",""59793705"",""51085303"",""89252153"",""63060238"",""79979666"",""80908502"",""69572169"",""98266377"",""95362816"",""59392529"",""5285665"",""89312388"",""45195443"",""40044918"",""9327502"",""75434695"",""62107981"",""8949584"",""213326"",""78387742"",""74825788"",""191749"",""67951831"",""75141056"",""76442616"",""25614410"",""45906428"",""45906428"",""45906428"",""63703130"",""24094653"",""24094653"",""24094653"",""37318031"",""25090294"",""33550694"",""63035430"",""47596607"",""53586134"",""11881272"",""80075749"",""61968753"",""21597117"",""22479888"",""84361420""]","[""29343734"",""68745629"",""60493189"",""25366484"",""88820235"",""83121692"",""10526791"",""41517968"",""35809262"",""81003500"",""41436536"",""47737087"",""61204971"",""14225239"",""81197327""]","[""60643554"",""25958491"",""11830996"",""8267140"",""8267140"",""24224830"",""43898403"",""43898403"",""91740879"",""91740879"",""91740879"",""75249652"",""75249652"",""83555667"",""83555667""]",1583951905,3 years ago,,,0,Fun little Elemental HERO deck,"An Elemental HERO deck without any card for <a data-name=""Elemental HERO Neos"">Elemental HERO Neos</a>."
75922,gb-tier-1-budget-deck-competitive-75922,GB ( TIER 1)# budget deck competitive,90582719,24034,Meta Decks,"[""90582719"",""90582719"",""90582719"",""7573135"",""7573135"",""41470137"",""41470137"",""57731460"",""67385964"",""88996322"",""88996322"",""25924653"",""25924653"",""92373006"",""92373006"",""92373006"",""85138716"",""85138716"",""85138716"",""52502677"",""93684009"",""93684009"",""93684009"",""35224440"",""35224440"",""35224440"",""20201255"",""20201255"",""20201255"",""911883"",""911883"",""911883"",""1845204"",""1845204"",""1845204"",""96216229"",""16990348"",""24224830"",""24224830"",""24224830""]","[""33652635"",""33652635"",""27346636"",""29357956"",""30864377"",""30864377"",""48156348"",""66863374"",""66863374"",""62000467"",""1861630"",""98978921"",""41999284"",""63519819"",""63519819""]",,1583951905,3 years ago,,,0,.,.
