deck_num,pretty_url,deck_name,cover_card,userid,format,main_deck,extra_deck,side_deck,ts_submit_date,submit_date,ts_edit_date,edit_date,comments,deck_excerpt,deck_description
83997,rokket-dragons-semi-budget-83997,Rokket Dragons Semi Budget,27548199,25080,Meta Decks,"[""68464358"",""68464358"",""68464358"",""32476603"",""32476603"",""26655293"",""26655293"",""32472237"",""32472237"",""53266486"",""67748760"",""67748760"",""67748760"",""88774734"",""88774734"",""88774734"",""88264978"",""99234526"",""61901281"",""58582979"",""54525057"",""89185742"",""89399912"",""55878038"",""69072185"",""70711847"",""99745551"",""14558127"",""14558127"",""83764718"",""67169062"",""1475311"",""36668118"",""36668118"",""31443476"",""31443476"",""31443476"",""41620959"",""41620959"",""41620959"",""81439173""]","[""73539069"",""24361622"",""13143275"",""86148577"",""29296344"",""23732205"",""29479265"",""85289965"",""31833038"",""49725936"",""2857636"",""63767246"",""6247535"",""27548199"",""80666118""]","[""55063751"",""55063751"",""82385847"",""24224830"",""24224830"",""8267140"",""8267140"",""43898403"",""43898403"",""43898403"",""37520316"",""23002292"",""40605147"",""40605147"",""41420027""]",1615487905,2 years ago,,,1,A Semi Budget Rokket Build with a great end board going First or Second,"<em><strong>Going First Strategy with directions in chat and follow ups</strong></em> <ul>  	<li><a>https://www.duelingbook.com/replay?id=489400-17655486</a></li> </ul> <em><strong>Going Second OTK with directions in chat(If you go uninterrupted and if you're opponent somehow doesn't lose you have the going first end board as well) </strong></em> <ul>  	<li><a>https://www.duelingbook.com/replay?id=489400-17655934</a></li> </ul> My two other builds have Starliege Seyfert and World Legacy Guardragon, those we're the two major cuts in this deck that made it <strong>""</strong><em>Semi-Budget</em><strong>""</strong>. Borreload Savage Dragon is in the deck list as well, it's almost 100% needed but its expensive so you could replace a few Rokkets with Rokket Synchron and replace Savage with Hot Red Dragon Archfiend Abyss which can simulate the Negate situation although slightly harder to pull off. Hopefully both combo replays reflect how strong this deck is with its end boards going first or second.  This obviously isn't my first Rokket list as i'm always adjusting and adapting it to what i feel is good or is needed against the meta. Like all combo heavy decks you can very easily be interrupted by Nibiru or have all you work come to naught by Dark Ruler No More which is sadly something you can't really work around. Knightmare Phoenix is your closest out to Mystic Mine without the Side Deck, hoping you can use enough materials to have the same amount of monsters as the opponent to get the Phoenix effect.  Expect a few more Rokket Deck Lists in the future as Eternity Code brings a new card in Noctovision Dragon which is a great extender for this deck and its only a Common."
83994,dark-magic-83994,Dark magic,30603688,25836,Fun/Casual Decks,"[""46986414"",""46986414"",""46986414"",""38033121"",""47222536"",""47222536"",""47222536"",""82404868"",""70168345"",""41735184"",""111280"",""99789342"",""99789342"",""2314238"",""2314238"",""63391643"",""63391643"",""30603688"",""30603688"",""30603688"",""48680970"",""48680970"",""48680970"",""88619463"",""7084129"",""7084129"",""7084129"",""7922915"",""7922915"",""7922915"",""13758665"",""87769556"",""35191415"",""35191415"",""35191415"",""16964437"",""16964437"",""16964437"",""40737112"",""47963370"",""29436665"",""32754886"",""71703785"",""42006475"",""67227834"",""67227834"",""67227834"",""21082832"",""21082832"",""74335036"",""74335036"",""74335036"",""30208479"",""79613121"",""55761792""]","[""50237654"",""86240887""]","[""55063751"",""55063751"",""82385847"",""24224830"",""24224830"",""8267140"",""8267140"",""43898403"",""43898403"",""43898403"",""37520316"",""23002292"",""40605147"",""40605147"",""41420027""]",1615487905,2 years ago,,,0,"Dark magician girl, Dark magician, Dark eradicator warlock and all there spells.",There are three dark magicians as the heart of the deck and a few spells and traps to help his pals out.
83991,neo-masumi-momono-83991,Neo Masumi Momono,27769400,23649,Anime Decks,"[""26866984"",""27769400"",""27769400"",""27769400"",""18036057"",""18036057"",""48783998"",""48783998"",""48783998"",""95956346"",""95956346"",""95956346"",""19280589"",""19280589"",""19280589"",""12398280"",""12398280"",""12398280"",""69865139"",""69865139"",""1353770"",""70828912"",""56433456"",""56433456"",""56433456"",""54977057"",""79571449"",""83764719"",""55144522"",""73628505"",""5318639"",""97077563"",""56769674"",""56769674"",""53334471"",""53334471"",""62867251"",""27551"",""38296564"",""41420027""]","[""50237654"",""86240887""]","[""55063751"",""55063751"",""82385847"",""24224830"",""24224830"",""8267140"",""8267140"",""43898403"",""43898403"",""43898403"",""37520316"",""23002292"",""40605147"",""40605147"",""41420027""]",1615487905,2 years ago,1676745505,3 weeks ago,0,One of Masumi Momono's 100 decks updated. Trying to bring the best out of his character deck whilst keeping it in the DM era.,"<p><img class=""aligncenter"" src=""https://sites.google.com/site/postpandemic/_/rsrc/1303218694798/home/the-cast/masumi-momono/Masumi%20Momono.jpg?height=320&amp;width=151"" alt="""" width=""211"" loading=""lazy"" /><img class=""article-img-floatnone"" src=""https://ms.yugipedia.com//f/f2/Momono.png"" alt="""" loading=""lazy"" /></p><p>Angels judgement, one of Masumi Momono's 100 decks updated. Trying to bring the best out of his character deck whilst keeping it in the DM era so no Synchro, Xyz, Pendulum or Link monsters.</p><p>let me know if you've got any ideas to improve it.</p>"
83988,dragunity-synchro-83988,Dragunity Synchro,27548199,15576,Fun/Casual Decks,"[""88264978"",""69072185"",""89399912"",""876330"",""876330"",""876330"",""92868896"",""92868896"",""92868896"",""12800777"",""12800777"",""12800777"",""14785765"",""7409792"",""7409792"",""7409792"",""14558127"",""14558127"",""14558127"",""70917315"",""29253591"",""29253591"",""59755122"",""59755122"",""59755122"",""14983497"",""14983497"",""1845204"",""70368879"",""73628505"",""75500286"",""83764719"",""93946239"",""24224830"",""24224830"",""24224830"",""60004971"",""62265044"",""62265044"",""62265044""]","[""59036972"",""48891960"",""25682811"",""34116027"",""11969228"",""12496261"",""27548199"",""50954680"",""27337596"",""68987122"",""79266769"",""49725936"",""50588353"",""13143275"",""86148577""]","[""63487632"",""59438930"",""59438930"",""59438930"",""97268402"",""97268402"",""97268402"",""63767246"",""33782437"",""5318639"",""5318639"",""5318639"",""14883228"",""14883228"",""14883228""]",1615487905,2 years ago,,,0,"gae derg, atum, gae derg, romulus, barcha, pisty, triple burst, gae derg, darkness metal, crystal wing, gae derg, borreload savage, elpy, goliath, lec","synchro out crystal wing and borreload savage, use Goliath to control the field."
83983,valkyrie-mischief-deck-2020-83983,VALKYRIE MISCHIEF deck 2020,97854941,10628,Non-Meta Decks,"[""27204311"",""27204311"",""97854941"",""97854941"",""97854941"",""26866984"",""83705073"",""83705073"",""2204038"",""66809920"",""30411385"",""30411385"",""3026686"",""3026686"",""3026686"",""81558967"",""81558967"",""81558967"",""14558127"",""14558127"",""14558127"",""92919429"",""92919429"",""92919429"",""44163252"",""44163252"",""44163252"",""2295440"",""17956906"",""17956906"",""17956906"",""49238328"",""49238328"",""58577036"",""65687442"",""65687442"",""65687442"",""92182447"",""92182447"",""92182447""]","[""97584719"",""88581108"",""29479265"",""85289965"",""38342335"",""2857636"",""2857636"",""8802510"",""75452921"",""75452921"",""46935289"",""46935289"",""67073561"",""67073561"",""67073561""]","[""26866984"",""26866984"",""45584727"",""45584727"",""38576155"",""38576155"",""64961254"",""64961254"",""91969909"",""91969909"",""43341600"",""43341600"",""43341600"",""18478530"",""18478530""]",1615487905,2 years ago,,,0,Valkyrie deck by YGO Lite,<a>https://www.youtube.com/watch?v=bLaTdbpqSgk</a>
83980,red-eyes-ftk-83980,Red Eyes (FTK),49398568,25823,Fun/Casual Decks,"[""49398568"",""52684508"",""92353449"",""10802916"",""8487449"",""74677424"",""74677424"",""74677424"",""88264978"",""17871506"",""17871506"",""10802915"",""26202165"",""23434538"",""23434538"",""93969023"",""93969023"",""93969023"",""8487449"",""8487449"",""1475311"",""1475311"",""6172122"",""33782437"",""49238328"",""49238328"",""49238328"",""52684508"",""52684508"",""74117290"",""74117290"",""74117290"",""92353449"",""92353449"",""24224830"",""24224830"",""48130397"",""49398568"",""49398568"",""39387565""]","[""45349196"",""30086349"",""30086349"",""30086349"",""37818794"",""41209827"",""41209827"",""41209828"",""2857636"",""70369116"",""41999284"",""41999284"",""94259633"",""94259633"",""44405066""]","[""61901281"",""15381421"",""99234526"",""59755122"",""911883"",""32566831"",""81439173"",""83764719"",""98494543"",""60004971"",""57135971""]",1615487905,2 years ago,,,2,https://youtu.be/h1HyaADb1EQ,https://youtu.be/h1HyaADb1EQ
83975,buster-blader-83975,Buster Blader,86240887,25823,Fun/Casual Decks,"[""46986414"",""74677422"",""3428069"",""78193831"",""78193832"",""14558127"",""14558128"",""23434538"",""23434538"",""49823708"",""49823708"",""49823708"",""76218313"",""18789533"",""8487449"",""8487449"",""98159737"",""98159737"",""1845204"",""2295440"",""6172122"",""51405049"",""51405049"",""51405049"",""58577036"",""58577036"",""58577036"",""83764719"",""24224830"",""24224830"",""48130397"",""15155568"",""32104431"",""32104431"",""32104431"",""33280639"",""33280639"",""33280639"",""80101899"",""80101899""]","[""37818794"",""86240887"",""86240887"",""86240887"",""41209827"",""63519819"",""11790356"",""11790356"",""11790356"",""85289965"",""70369116"",""47158777"",""47158777"",""47158777"",""41999284""]","[""76218313"",""98502114"",""41999284"",""2295440"",""43040603"",""81439173"",""41940225""]",1615487905,2 years ago,,,0,https://www.youtube.com/watch?v=_iAOLkorZ7s&feature=youtu.be,https://youtu.be/_iAOLkorZ7s
83972,fur-hire-april-2020-83972,Fur Hire │April 2020,38916526,24409,Fun/Casual Decks,"[""43316238"",""43316238"",""38916526"",""38916526"",""82385847"",""1527418"",""66740005"",""66740005"",""66740005"",""52350806"",""52350806"",""20345391"",""20345391"",""20345391"",""99745551"",""93850652"",""93850652"",""93850652"",""67466547"",""31467949"",""94073244"",""94073244"",""36205132"",""36205132"",""4810828"",""4810828"",""4810828"",""1845204"",""32807846"",""35261759"",""35261759"",""24224830"",""24224830"",""24224830"",""43898403"",""43898403"",""52340444"",""91405870"",""91405870"",""94770493"",""10045474"",""10045474""]","[""63519819"",""63767246"",""93854893"",""84013238"",""6983839"",""21044178"",""62517849"",""31833038"",""85289965"",""74997493"",""66023650"",""66023650"",""63288574"",""41999284"",""94259633""]","[""27204311"",""27204311"",""27204311"",""78661338"",""78661338"",""34267821"",""34267821"",""34267821"",""54693926"",""54693926"",""54693926"",""43898403"",""24207889"",""24207889"",""24207889""]",1615487905,2 years ago,,,0,Love Special Summon A lot You'd love this one,
83963,neo-gurimo-83963,Neo Gurimo,49681811,23649,Anime Decks,"[""11321183"",""11321183"",""11321183"",""75953262"",""75953262"",""75953262"",""49681811"",""84814897"",""84814897"",""89529919"",""10375182"",""67957315"",""67957315"",""67957315"",""38742075"",""2460565"",""2460565"",""2460565"",""86028783"",""47415292"",""47415292"",""47415292"",""37620434"",""79109599"",""46181000"",""403847"",""403847"",""81439173"",""6498706"",""79571449"",""83764719"",""27847700"",""27847700"",""27847700"",""55144522"",""32807846"",""911883"",""5318639"",""91597389"",""91597389""]","[""86805855"",""86805855"",""86805855"",""49868263"",""49868263"",""49868263""]","[""27204311"",""27204311"",""27204311"",""78661338"",""78661338"",""34267821"",""34267821"",""34267821"",""54693926"",""54693926"",""54693926"",""43898403"",""24207889"",""24207889"",""24207889""]",1615487905,2 years ago,1665599905,5 months ago,1,Gurimo's deck updated. Trying to bring the best out of his character deck whilst keeping it in the DM era.,"<p><img class=""aligncenter"" src=""https://ami.animecharactersdatabase.com/uploads/chars/8267-1998268786.jpg"" alt="""" width=""440"" loading=""lazy"" /></p><p>Commanding Army, Gurimo's deck updated. Trying to bring the best out of his character deck whilst keeping it in the DM era so no Synchro, Xyz, Pendulum or Link monsters.</p><p>let me know if you've got any ideas to improve it.</p>"
83957,cyberdark-deck-2020-ft-shaddoll-truly-trash-83957,CYBERDARK DECK 2020 (ft. Shaddoll) - TRULY TRASH?,82562802,25390,Non-Meta Decks,"[""28674152"",""28674152"",""3717252"",""77723643"",""77723643"",""30328508"",""3019642"",""41230939"",""41230939"",""77625948"",""77625948"",""45078193"",""45078193"",""45078193"",""82562802"",""82562802"",""4939890"",""4939890"",""3659803"",""59750328"",""59750328"",""80033124"",""81439174"",""98645731"",""98645731"",""6417578"",""6417578"",""48130397"",""48130397"",""77565204"",""77565204"",""77565204"",""44352516"",""44352516"",""76375976"",""89208725"",""23516703"",""23516703"",""23516703"",""40605147"",""40605147"",""41420027"",""41420027""]","[""99267150"",""18967507"",""18967507"",""41209828"",""40418351"",""25586143"",""62111090"",""94977269"",""94977269"",""80532587"",""80532587"",""80532587"",""54757758"",""71384012"",""70369116""]","[""63941210"",""63941210"",""3019642"",""51023024"",""37445295"",""74822425"",""95793022"",""20366274"",""20366274"",""12580477"",""18144507"",""44394295"",""44394295"",""59750328"",""6417578""]",1615487905,2 years ago,,,0,"A control setup deck that aims to limit your opponent's options through the use of disruptions and floodgates, granting enough time to get out the pow","  A control setup deck that aims to limit your opponent's options through the use of disruptions and floodgates, granting enough time to get out the powerful Cyberdarkness dragon! Yes, yes, I know. Cyberdarks are infamous for being real bad for many reasons. Upon further inspection, however, one would notice that its speed and overall playstyle are the main offenders to its bad reputation. This build aims to patch up these problems by incorporating play stoppers and disruptions to slow the game down a bit, as making the archetype faster would just hinder its consistency and performance. The use of a small Shaddoll engine does synergise well with the deck, and offers a lot of value for resources. If you are interested in knowing why these specific tech cards were chosen or how the strategy works in practice, feel free to watch the video posted!  This deck is part of a YouTube series called <em>TRULY TRASH? -</em> videos based around trash tier Yu-Gi-Oh! archetypes. Each video contains replays, analyses, and deck techs as well as the reasoning behind choosing such! If you want to know more, here is the link to the playlist: <a>https://www.youtube.com/playlist?list=PLxNK1GOQn2ED0CyDr1M_l6zUSyt4XpTKe</a>"
83952,perfect-altergeist-83952,Perfect Altergeist,42790071,24867,Meta Decks,"[""10045474"",""10045474"",""10045474"",""11827244"",""14558127"",""14558127"",""14558127"",""25533642"",""25533642"",""25533642"",""27541563"",""35146019"",""35146019"",""36975314"",""36975314"",""36975314"",""40605147"",""40605147"",""41420027"",""41420027"",""41420027"",""42790071"",""43262273"",""43262273"",""49238328"",""49238328"",""49238328"",""52927340"",""53143898"",""53143898"",""53143898"",""53936268"",""53936268"",""68462976"",""76375976"",""89208725"",""89538537"",""89538537"",""98645731"",""98645731""]","[""1508649"",""1508649"",""2857636"",""31833038"",""41999284"",""41999284"",""48815792"",""70369116"",""73309655"",""73309655"",""76685519"",""84433295"",""84433295"",""85289965"",""94259633""]","[""23516703"",""23516703"",""23516703"",""54693926"",""54693926"",""54693926"",""55063751"",""55063751"",""61740673"",""63941210"",""84749824"",""84749824"",""94145021"",""94145021"",""94145021""]",1615487905,2 years ago,,,0,Perfect control ,Control and damage
83947,nekroz-83947,Nekroz,89463537,25824,Non-Meta Decks,"[""72634965"",""80701178"",""80701178"",""18474999"",""53303460"",""53303460"",""90307777"",""90307777"",""82085295"",""82085295"",""88240999"",""52068432"",""52068432"",""25857246"",""25857246"",""25857246"",""65877963"",""65877963"",""65877963"",""74122412"",""26674724"",""26674724"",""26674724"",""77235086"",""77235086"",""89463537"",""99185129"",""99185129"",""99185129"",""49238328"",""49238328"",""96729612"",""96729612"",""96729612"",""86758915"",""97211663"",""97211663"",""51124303"",""51124303"",""14735698""]","[""80532587"",""80532587"",""80532587"",""79606837"",""79606837"",""79606837"",""15240238"",""15240238"",""50321796"",""50321796"",""23995346"",""23995346"",""52687916"",""85289965"",""65749035""]","[""14532163"",""14532163"",""14532163"",""12444060"",""12444060"",""20292186"",""34267821"",""34267821"",""34267821"",""82385847"",""68462976"",""68462976"",""14558127"",""14558127"",""14558127""]",1615487905,2 years ago,,,0,"I enjoy playing this deck, it is anti meta, and it beats decks of course.","Easy special summon Nekroz monsters and Vanity's ruler to negate special summons and negate extra deck effects, win the duel with style."
83942,tenyi-83942,Tenyi,38030232,22030,Fun/Casual Decks,"[""56649609"",""43096270"",""43096270"",""43096270"",""4148264"",""4148264"",""4148264"",""87052196"",""87052196"",""87052196"",""23431858"",""23431858"",""23431858"",""85679527"",""97036149"",""97036149"",""97036149"",""60942444"",""60942444"",""60942444"",""24557335"",""24557335"",""24557335"",""98159737"",""98159737"",""98159737"",""48308134"",""75702749"",""39730727"",""39730727"",""39730727"",""73628505"",""65124425"",""65124425"",""65124425"",""21834870"",""21834870"",""21834870"",""23068051"",""23068051""]","[""23995346"",""5041348"",""5402805"",""5402805"",""5402805"",""38030232"",""38030232"",""38030232"",""23935886"",""23935886"",""78917791"",""78917791"",""32519092"",""32519092"",""32519092""]","[""14532163"",""14532163"",""14532163"",""12444060"",""12444060"",""20292186"",""34267821"",""34267821"",""34267821"",""82385847"",""68462976"",""68462976"",""14558127"",""14558127"",""14558127""]",1615487905,2 years ago,,,0,Tenyi,Tenyi
83939,god-phoenix-gearfried-flame-noble-knight-83939,God phoenix gearfried + Flame noble knight,22091647,25823,Meta Decks,"[""22091647"",""59975920"",""21351206"",""94730900"",""58346901"",""58346901"",""58346901"",""54485355"",""54485355"",""54485355"",""14558127"",""14558127"",""72291078"",""38783169"",""81570454"",""56824871"",""56824871"",""56824871"",""95953557"",""95953557"",""95953557"",""2295440"",""18144506"",""32807846"",""45950291"",""45950291"",""51412776"",""51412776"",""51412776"",""24224830"",""24224830"",""24224830"",""24845628"",""34959756"",""37478723"",""37478723"",""37478723"",""10045474"",""10045474"",""98827725""]","[""77656797"",""27548199"",""64880894"",""40251688"",""81846453"",""84124261"",""52653092"",""65741786"",""21887175"",""44097050"",""59934749"",""59934749"",""50588353"",""85243784""]","[""63633694"",""23434538"",""45950291"",""2295440"",""68431965"",""33158448"",""1845204"",""49513164""]",1615487905,2 years ago,,,0,https://www.youtube.com/watch?v=hJkQaMUgz7k,<a>https://www.youtube.com/watch?v=hJkQaMUgz7k</a>
83936,eldlich-deck-2020-83936,Eldlich Deck 2020,95440947,24446,Meta Decks,"[""95440946"",""95440946"",""97631303"",""97631303"",""30603688"",""39185163"",""39185163"",""36016907"",""36016907"",""6039967"",""6039967"",""49959355"",""49959355"",""92964816"",""66570171"",""92826944"",""14558127"",""14558127"",""81439173"",""4064256"",""4064256"",""49238328"",""49238328"",""94224458"",""68829754"",""68829754"",""68829754"",""31434645"",""31434645"",""31434645"",""20612097"",""20612097"",""20612097"",""20590515"",""20590515"",""20590515"",""93191801"",""93191801"",""56984514"",""56984514""]","[""50449881"",""77334267"",""73964868"",""73964868"",""56910167"",""56910167"",""60303245"",""94259633"",""2857636"",""37129797"",""37129797"",""37129797"",""91420202"",""91420202"",""91420202""]","[""38814750"",""94801854"",""3096468"",""52467217"",""8198620"",""83283063"",""26096328"",""3814632"",""35726888"",""48130397"",""2204140"",""10045474"",""23516703"",""82732705"",""61740673""]",1615487905,2 years ago,,,0,Eldlich Deck 2020 (Post Duel Overload),<a>https://www.youtube.com/watch?v=TQYrdMJN_io</a>  &nbsp;  https://www.youtube.com/watch?v=TQYrdMJN_io
83933,blackwing-apex-infinity-reviewed-83933,Blackwing apex infinity reviewed,29587993,25692,Meta Decks,"[""29587993"",""81105204"",""81105204"",""81105204"",""49003716"",""49003716"",""49003716"",""48596760"",""48596760"",""14785765"",""17465972"",""17465972"",""17465972"",""2009101"",""2009101"",""2009101"",""69448290"",""28190303"",""52869807"",""52869807"",""67692580"",""77152542"",""77152542"",""73652465"",""76218313"",""91351370"",""91351370"",""91351370"",""17322533"",""17322533"",""1475311"",""1475311"",""1475311"",""14532163"",""14532163"",""83764719"",""23581825"",""24224830"",""24224830"",""24224830""]","[""54082269"",""27548199"",""16051717"",""81983656"",""95040215"",""10443957"",""81927732"",""55285840"",""86848580"",""46772449"",""73347079"",""72330894"",""36429703"",""83152482"",""83152482""]","[""27204311"",""27204311"",""14558127"",""14558127"",""41209827"",""70369116"",""54693926"",""54693926"",""54693926"",""65681983"",""65681983"",""48130397"",""48130397"",""10045474"",""10045474""]",1615487905,2 years ago,,,0,Infinite negation Blackwing based deck.,An updated version of my last blackwing apex infinity. Enjoy!
83924,new-meta-plunder-patrol-mr5-gogogo-83924,New Meta Plunder Patrol MR5 gogogo,81344070,15124,Meta Decks,"[""52350806"",""52350806"",""31374201"",""31374201"",""31374201"",""68769900"",""68769900"",""68769900"",""55349375"",""55349375"",""55349375"",""24557335"",""81344070"",""81344070"",""81344070"",""99745551"",""43694650"",""14558127"",""97268402"",""97268402"",""14532163"",""14532163"",""73628505"",""74117290"",""74117290"",""96947648"",""96947648"",""44227727"",""44227727"",""44227727"",""80621422"",""80621422"",""93031067"",""93031067"",""93031067"",""10045474"",""10045474"",""10045474"",""43004235"",""17016131""]","[""18832779"",""18832779"",""18832779"",""9464441"",""5614808"",""94253655"",""94253655"",""440556"",""20248754"",""20248754"",""20248754"",""90809975"",""67647362"",""67647362"",""67647362""]","[""70711847"",""52350806"",""24557335"",""24557335"",""80666118"",""5041348"",""21044178"",""66011101"",""38342335"",""74117290"",""96947648""]",1615487905,2 years ago,,,0,Eternity code support,https://www.sidedeckvs.com/side-deck/plunder-patroll/
83921,adamancipator-magent-version-op-mr5-83921,Adamancipator Magent Version OP MR5,85914562,15124,Meta Decks,"[""55063751"",""55063751"",""12262393"",""12262393"",""12262393"",""10286023"",""10286023"",""42023223"",""42023223"",""79418928"",""79418928"",""79418928"",""15502037"",""15502037"",""11302671"",""11302671"",""11302671"",""14558127"",""48519867"",""48519867"",""85914562"",""85914562"",""85914562"",""42901635"",""42901635"",""72957245"",""72957245"",""72957245"",""25311006"",""25311006"",""14532163"",""73628505"",""83764719"",""5318639"",""4740489"",""4740489"",""4740489"",""10045474"",""10045474"",""74003290""]","[""52687916"",""9464441"",""50954680"",""5041348"",""73580471"",""73580471"",""50321796"",""73079836"",""33198837"",""33198837"",""32530043"",""85289965"",""49202162"",""2857636"",""75452921""]","[""70711847"",""52350806"",""24557335"",""24557335"",""80666118"",""5041348"",""21044178"",""66011101"",""38342335"",""74117290"",""96947648""]",1615487905,2 years ago,,,0,best adamancipator deck,https://www.sidedeckvs.com/side-deck/adamancipator/
83918,new-generaier-orcust-ftw-control-mr5-83918,New Generaier Orcust FTW Control MR5,69811710,15124,Meta Decks,"[""68199168"",""68199168"",""40998517"",""13903402"",""744887"",""49275969"",""26866984"",""76382116"",""75660578"",""75660578"",""83477829"",""69811710"",""69811710"",""69811710"",""94183877"",""94183877"",""94183877"",""14558127"",""14558127"",""73628505"",""75448086"",""78543464"",""78543464"",""99674361"",""14604710"",""14604710"",""14604710"",""24224830"",""24224830"",""24224830"",""48130397"",""48130397"",""38053381"",""38053381"",""38053381"",""37931734"",""37931734"",""37931734"",""64325438"",""40605147"",""40605147"",""41420027"",""41420027""]","[""15661378"",""41209828"",""54757758"",""97584719"",""88581108"",""88581108"",""95113856"",""97403510"",""2665273"",""57282724"",""39752820"",""2857636"",""65741786"",""85243784"",""41999284""]","[""68199168"",""13903402"",""744887"",""2665273"",""40605147"",""41420027""]",1615487905,2 years ago,,,0,best deck generaider,https://www.sidedeckvs.com/side-deck/generaider/
