deck_num,pretty_url,deck_name,cover_card,userid,format,main_deck,extra_deck,side_deck,ts_submit_date,submit_date,ts_edit_date,edit_date,comments,deck_excerpt,deck_description
97992,deck-dragunity-3-new-support-dragunity-legatus-dragunity-97992,"deck Dragunity 3 ,  new support,Dragunity Legatus,Dragunity",26577155,25969,Meta Decks,"[""53184342"",""876330"",""876330"",""876330"",""89172051"",""89172051"",""89172051"",""92868896"",""28183605"",""28183605"",""26577155"",""26577155"",""26577155"",""29253591"",""29253591"",""29253591"",""59755122"",""59755122"",""88264978"",""89399912"",""14558127"",""14558127"",""14558127"",""73642297"",""73642297"",""25845518"",""25845518"",""25845518"",""60004971"",""60004971"",""60004971"",""39701395"",""39701395"",""39701395"",""62265044"",""23924608"",""69452756"",""10045474"",""10045474"",""10045474""]","[""31833038"",""25682811"",""27548199"",""34116027"",""84040113"",""24361622"",""11969228"",""88234821"",""88234821"",""27337596"",""48891960"",""48891960"",""37818794"",""13143275"",""86148577""]","[""62265044"",""25682811"",""59755122"",""12496261""]",1615487905,2 years ago,,,0,https://youtu.be/QIw6OJqLVfw,https://youtu.be/QIw6OJqLVfw
97986,dragunity-deck-2020-97986,Dragunity deck 2020,28183605,17333,Meta Decks,"[""876330"",""876330"",""876330"",""63487632"",""89172051"",""89172051"",""89172051"",""14785765"",""12800777"",""12800777"",""28183605"",""28183605"",""28183605"",""92868896"",""26577155"",""26577155"",""26577155"",""29253591"",""29253591"",""59755122"",""59755122"",""59755122"",""14983497"",""14983497"",""62265044"",""62265044"",""62265044"",""73628505"",""60004971"",""60004971"",""25845518"",""25845518"",""25845518"",""24224830"",""24224830"",""24224830"",""81439173"",""41620959"",""69072185"",""70917315""]","[""48891960"",""88234821"",""27548199"",""50954680"",""25682811"",""34116027"",""21249921"",""27337596"",""79266769"",""49725936"",""50588353"",""11969228"",""24361622"",""13143275"",""86148577""]","[""54693926"",""54693926"",""54693926"",""100311001"",""88264979"",""29587993"",""89399912"",""96227613"",""69610326"",""92868896"",""69448290"",""4280258"",""72330894"",""75500286"",""83764719""]",1615487905,2 years ago,,,0,Dragunity deck 2020,Dragunity deck 2020
97979,gaia-the-magical-knight-97979,Gaia the Magical Knight,15989522,18836,Fun/Casual Decks,"[""33318980"",""33318980"",""8910971"",""8910971"",""34130561"",""34130561"",""34130561"",""61525276"",""61525276"",""61525276"",""48048590"",""48048590"",""48048590"",""50354944"",""50354944"",""50354944"",""7913375"",""7913375"",""7913375"",""12580477"",""32807846"",""38590361"",""38590361"",""38590361"",""71490127"",""73628505"",""83764719"",""24224830"",""24224830"",""24224830"",""48130397"",""48130397"",""2106266"",""2106266"",""2106266"",""40089744"",""40089744"",""40089744"",""56461575"",""56461575""]","[""79864860"",""41209827"",""69946549"",""2519690"",""2519690"",""15989522"",""15989522"",""44405066"",""91949988"",""31833038"",""49202162"",""67598234"",""2857636"",""75452921"",""70369116""]","[""54693926"",""54693926"",""54693926"",""100311001"",""88264979"",""29587993"",""89399912"",""96227613"",""69610326"",""92868896"",""69448290"",""4280258"",""72330894"",""75500286"",""83764719""]",1615487905,2 years ago,,,0,Gaia the Magical OTK Champion,"<span><span lang=""en"">This deck gains support in the Rise of the Duelist. Also</span><span lang=""en"">, with the new fusion magic (giving extra ATK), there is a good chance of giving an OTK. I have a YouTube channel with a video with replays, where you can get a sense of how to play with the deck. </span><span lang=""en"">The beginning of the video about this Deck is in Portuguese. But, replays can be seen without language problems.</span><span lang=""en"">If you can support, visit: </span></span><span lang=""en""><a>https://www.youtube.com/channel/UCe5VsP4ORBEYfTUQ0ZVOrDg</a> </span> <span lang=""en"">If you want new decks that you want me to post and make new videos, you can comment.</span> <span lang=""en""> </span> &nbsp;"
97964,fur-hire-tribrigade-97964,Fur Hire Tribrigade,93850652,22476,Meta Decks,"[""38916526"",""38916526"",""1527418"",""1527418"",""25123713"",""87209160"",""66740005"",""66740005"",""20345391"",""20345391"",""93850652"",""93850652"",""93850652"",""14558127"",""14558127"",""50810455"",""50810455"",""31467949"",""31467949"",""94073244"",""94073244"",""14816857"",""14816857"",""36205132"",""36205132"",""2295440"",""32807846"",""35261759"",""35261759"",""81439173"",""83764719"",""24224830"",""24224830"",""24224830"",""48130397"",""48130397"",""73915051"",""51097887"",""51097887"",""57103969"",""57103969"",""44095762"",""40975243"",""86379342"",""86379342"",""41420027""]","[""41209827"",""69946549"",""62111090"",""72959823"",""55285840"",""82633039"",""5014629"",""16259549"",""39972129"",""8491961"",""99726621"",""66023650"",""52331012"",""26847978"",""41999284""]","[""73642297"",""73642297"",""24508238"",""24508238"",""97300502"",""54757758"",""14532163"",""8267140"",""43898403"",""15693423"",""15693423"",""3819470"",""3819470"",""58851034"",""58851034""]",1615487905,2 years ago,,,1,Combo Fur Hire Tribrigade Deck,"Main Deck :  <a data-name=""Rafaleo, Champion Fur Hire"">Rafaleo, Champion Fur Hire x2</a>  Wiz, Sage Fur Hire x2  Dyne, Champion Fur Hire x1  Tribrigade Fractur x1  Bravo, Fighter Fur Hire x2  Seal, Strategist Fur Hire x2  Beat, Bladesman Fur Hire x3  Ash Blossom &amp; Joyous Spring x2  Tribrigade Ceras x2  Recon, Scout Fur Hire x2  Donpa, Marksman Fur Hire x2  Tribrigade Navel x2  Filo, Messenger Fur Hire x3  One for One x1  Reinforcement of the Army x1  Pot of Desires x2  Follish Burial x1  Monster Reborn x1  Called By The Grave x3  Super Polymerization x2  Scapegoat x1  Tribrigade Ariborne x2  Fire Formation - Tenki x2  Mirror Force x1  Tribrigade Revolt x1  Tribrigade Oath x2  Solemn Judgment x1  Extra Deck :  Starving Venom Fusion Dragon x1  Predaplant Dragostapelia x1  Earth Golem @Ignister x1  Panzer Dragon x1  Time Thief Redoer x1  Castel, the Skyblaster Musketeer x1  Submersible Carrier Aero Shark x1  <a data-name=""Number 49 : Fortune Tune"">Number 49 : Fortune Tune x1</a>  Number 64 : Ronin Raccoon Sandayu x1  Lirylusc - Recital Stearling x1  Tribrigade Shrike the Wicked Wings x1  Folgo Justice Fur Hire x1  Tribrigade Lugal the Silver Bullet x1  Tribrigade Felidgette the Fruitless Flower x1  Linkuriboh x1  &nbsp;"
97960,yeet-deck-97960,Yeet Deck,10000022,28594,Meta Decks,"[""46986414"",""46986414"",""46986414"",""90876561"",""39256679"",""39256679"",""25652259"",""5818798"",""15025844"",""15025844"",""13039848"",""13039848"",""10000000"",""10000020"",""10000010"",""40737112"",""37267041"",""78193831"",""38033121"",""74388798"",""64788463"",""65240384"",""65240384"",""65240384"",""1995985"",""40640057"",""64047146"",""2314238"",""2314238"",""83764719"",""83764719"",""24094653"",""55144522"",""55144522"",""12580477"",""12580477"",""12580477"",""13604200"",""13604200"",""72302403"",""72302403"",""72302403"",""63391643"",""63391643"",""48130397"",""18807109"",""18807109"",""18807109"",""20522190"",""98299011"",""62279055"",""62279055"",""62279055"",""44095762"",""44095762"",""31305911"",""31305911"",""93749093"",""93749093"",""93749093""]","[""98502113""]","[""73642297"",""73642297"",""24508238"",""24508238"",""97300502"",""54757758"",""14532163"",""8267140"",""43898403"",""15693423"",""15693423"",""3819470"",""3819470"",""58851034"",""58851034""]",1615487905,2 years ago,,,0,Gods and Magic,"Its a good Deck :) <div> <div class=""gtx-trans-icon""></div> </div>"
97934,gren-maju-97934,gren maju,36584821,26532,Meta Decks,"[""36584821"",""36584821"",""36584821"",""63845230"",""63845230"",""63845230"",""19665973"",""19665973"",""19665973"",""24508238"",""24508238"",""24508238"",""91800273"",""91800273"",""91800273"",""81674782"",""30241314"",""8267140"",""8267140"",""8267140"",""48130397"",""48130397"",""48130397"",""75500286"",""37520316"",""83764719"",""12580477"",""28297833"",""28297833"",""28297833"",""35261759"",""35261759"",""35261759"",""70368879"",""1475311"",""1475311"",""1475311"",""15397015"",""15397015"",""15397015""]","[""62111090"",""62111090"",""62111090"",""41209827"",""41209827"",""41209827"",""54757758"",""54757758"",""69946549"",""69946549"",""37261776"",""37261776"",""37261776"",""72336818"",""66403530""]","[""73642297"",""73642297"",""24508238"",""24508238"",""97300502"",""54757758"",""14532163"",""8267140"",""43898403"",""15693423"",""15693423"",""3819470"",""3819470"",""58851034"",""58851034""]",1615487905,2 years ago,,,0,O T K ,O T K
97928,gren-danger-castle-97928,gren danger castle,36584821,26532,Meta Decks,"[""43316238"",""43316238"",""43316238"",""90807199"",""90807199"",""90807199"",""46294982"",""46294982"",""71197066"",""71197066"",""71197066"",""899287"",""899287"",""899287"",""36584821"",""36584821"",""36584821"",""63845230"",""63845230"",""63845230"",""1475311"",""1475311"",""1475311"",""35261759"",""35261759"",""35261759"",""38120068"",""38120068"",""38120068"",""73628505"",""81439173"",""24224830"",""24224830"",""24224830"",""48130397"",""48130397"",""48130397"",""72283691"",""72283691"",""72283691""]","[""37261776"",""41209827"",""54757758"",""12632096"",""2530830"",""39030163"",""63767246"",""93854893"",""23085002"",""38342335"",""2857636"",""13117073"",""28400508"",""97403510"",""57314798""]","[""73642297"",""73642297"",""24508238"",""24508238"",""97300502"",""54757758"",""14532163"",""8267140"",""43898403"",""15693423"",""15693423"",""3819470"",""3819470"",""58851034"",""58851034""]",1615487905,2 years ago,,,0,O T K,O T K
97918,the-next-abc-battle-butler-recursive-loop-97918,"THE NEXT ABC, BATTLE BUTLER RECURSIVE LOOP",25725326,21784,Meta Decks,"[""49036338"",""27204311"",""56713174"",""56713174"",""31440046"",""31440046"",""31440046"",""18236002"",""18236002"",""18236002"",""14558127"",""14558127"",""55725117"",""55725117"",""55725117"",""38814750"",""38814750"",""38814750"",""81119816"",""81119816"",""81119816"",""97268402"",""1845204"",""73628505"",""95238394"",""95238394"",""95238394"",""8267140"",""8267140"",""24224830"",""65681983"",""65681983"",""65681983"",""79059098"",""16269385"",""16269385"",""16269385"",""10045474"",""10045474"",""10045474""]","[""81997228"",""81997228"",""81997228"",""18514525"",""31833038"",""86066372"",""38342335"",""17382973"",""17382973"",""17382973"",""2857636"",""70369116"",""25725326"",""25725326"",""25725326""]","[""27204311"",""27204311"",""70875686"",""14532163"",""14532163"",""18144506"",""54693926"",""54693926"",""54693926"",""24299458"",""24299458"",""15693423"",""15693423"",""15693423"",""15447747""]",1615487905,2 years ago,,,0,"Post Phantom Rage. All thanks to Thunder Dragondark and Fusion. You know what 1 card combo, multiple disruptions (Battle Butler 2 Raigeki), super recu","Konami hates ABC, it means this will get hit sooner or later. It's even more consistent (just need 1 Prank-Kids monster), more powerful (non-target, wipes board, TWICE), and with the same recursion as ABC/Salamangreat. Heck it even fits with just only 1 Verte (more broken with 3 Verte tho, but Verte limits your ceiling at the same time).  Combo is standard, normal summon/ss random Prank-Kids (non-token tho), make Meow-Meow, use Prank-Kids gy effect ss another Prank-Kids (we need every Battle Butler material in gy/banished tho, Fansies sends other to gy, Rocksies banishes hand and draw), make Doodle-Doo, use Doodle-Doo chain Prank-Kids gy eff ss another Prank-Kids, add field spell for recursion or fusion spell to make link 4 (if we face backrow deck). If we face non-backrow-heavy deck, we can proceed to Verte, use field add Rocksies/Fansies (both are important), use Verte send Thunder Dragon Fusion by returning Battle Buttler material from banished/gy to deck, use field increasing 500 atk.  The recursion line needs Dragondark if with limited Verte, use Thunder Dragon Fusion gy eff add Dragondark, Rocksies banishes Dragondark for another Thunder Dragon Fusion, but you gotta trigger Fansies to meet Battle Butler material requirement in gy, proceed the same Prank-Kids way again and again lol.  Pros: ABC/Salamangreat level, but with tag-out ability.  Cons: Endboard is bad with only 1 meaningful monster.  PS: Thanks to Project Ignis discord"
97905,zombie-world-97905,Zombie World,28240337,28581,Non-Meta Decks,"[""35818851"",""35818851"",""35818851"",""62038047"",""94801854"",""94801854"",""36630403"",""36630403"",""79783880"",""79783880"",""99423156"",""99423156"",""78765160"",""40364916"",""78765160"",""40364916"",""4333086"",""4333086"",""5177985"",""5177985"",""41562624"",""41562624"",""5186893"",""52512994"",""92826944"",""92826944"",""92826944"",""52467217"",""52467217"",""33420078"",""2204140"",""2204140"",""2204140"",""44095762"",""44095762"",""44095762"",""83764719"",""4064256"",""4064256"",""66570171""]","[""26326541"",""26326541"",""59843383"",""59843383"",""57288064"",""57288064"",""83283063"",""83283063"",""28240337"",""28240337"",""59969392"",""59969392""]","[""27204311"",""27204311"",""70875686"",""14532163"",""14532163"",""18144506"",""54693926"",""54693926"",""54693926"",""24299458"",""24299458"",""15693423"",""15693423"",""15693423"",""15447747""]",1615487905,2 years ago,,,0,The zombies bruh,Write your deck strategy here...Zombies man!
97901,blackwing-97901,Blackwing,69031175,28579,Fun/Casual Decks,"[""70456282"",""22835145"",""22835145"",""49003716"",""49003716"",""49003716"",""89258906"",""89258906"",""11613567"",""9109991"",""2009101"",""2009101"",""2009101"",""28190303"",""85215458"",""85215458"",""85215458"",""81105204"",""81105204"",""81105204"",""58820853"",""58820853"",""58820853"",""75498415"",""75498415"",""75498415"",""47475363"",""47475363"",""47475363"",""62279055"",""62279055"",""62279055"",""91351370"",""91351370"",""91351370"",""83746708"",""83746708"",""83746708"",""5318639"",""5318639"",""5318639""]","[""23338098"",""80773359"",""16051717"",""53389254"",""33236860"",""76913983"",""69031175"",""54082269"",""81983656"",""76913983"",""81983656"",""54082269"",""16051717"",""23338098"",""95040215""]","[""27204311"",""27204311"",""70875686"",""14532163"",""14532163"",""18144506"",""54693926"",""54693926"",""54693926"",""24299458"",""24299458"",""15693423"",""15693423"",""15693423"",""15447747""]",1615487905,2 years ago,,,0,blackwing assault,Write your deck strategy here... blow away opposition with blackwings
97897,meklord-orcust-97897,Meklord Orcust,4837861,28479,Non-Meta Decks,"[""69811710"",""69811710"",""69811710"",""3715284"",""3715284"",""3715284"",""75733063"",""75733063"",""39648965"",""39648965"",""4837861"",""4837861"",""63468625"",""31930787"",""68140974"",""68140974"",""77710579"",""77710579"",""4055337"",""27918365"",""27918365"",""93920420"",""1475311"",""1475311"",""1475311"",""72892473"",""81439173"",""39109382"",""39109382"",""39109382"",""2295440"",""26845680"",""26845680"",""99674361"",""99674361"",""31706048"",""31706048"",""2992036"",""703897"",""703897""]","[""93854893"",""28912357"",""28912357"",""49121795"",""8491961"",""56910167"",""26096328"",""13117073"",""30741503"",""30741503"",""41999284"",""3134857"",""40216089"",""94259633"",""60303245""]","[""24224830"",""24224830"",""24224830"",""54693926"",""54693926"",""54693926"",""14532163"",""14532163"",""14532163"",""66594927"",""66594927"",""66594927"",""10813327"",""10813327"",""10813327""]",1615487905,2 years ago,,,0,Meklords are actually playable now,"Girsu, Obbligato, and anyway to search Triskelia is full combo. Obbligato into any 2 Meklord Armys. Link into Platinum Gadget. Summon Girsu. Send Orcust Knightmare. Banish send Wand. Banish Wand to summon Knightmare. Make Galatea. Recycle Wand. Set Crescendo. Banish 3 Meklord Army from gy to summon Triskelia. You can do more if you survive the next turn."
97890,counter-fairy-july-2020-97890,Counter Fairy July 2020,46145256,27518,Non-Meta Decks,"[""98301564"",""98301564"",""98301564"",""32296881"",""32296881"",""32296881"",""37742478"",""37742478"",""46145256"",""46145256"",""53666449"",""24857466"",""16261341"",""15449853"",""15449853"",""15449853"",""40450317"",""40450317"",""40450317"",""56433456"",""35261759"",""35261759"",""35261759"",""98645731"",""98645731"",""70368879"",""48130397"",""48130397"",""42444868"",""42444868"",""81066751"",""81066751"",""40605147"",""40605147"",""41420027"",""41420027"",""84749824"",""84749824"",""1637760"",""1637760""]","[""87116928"",""79229522"",""78084378"",""54757758"",""69946549"",""41209827"",""7778726"",""2857636"",""48589580"",""86066372"",""69514125"",""21044178"",""46772449"",""12014404"",""90590304""]","[""77538567"",""77538567"",""77538567"",""23002292"",""27204311"",""27204311"",""27204311"",""15397015"",""15397015"",""14558127"",""14558127"",""8267140"",""8267140"",""8267140"",""48130397""]",1615487905,2 years ago,,,0,"The usual stuff. Special summon your floodgate, negate your opponents cards, and counter play your way to victory. If you just love watching your oppo","The usual stuff. Special summon your floodgate, negate your opponents cards, and counter play your way to victory. If you just love watching your opponets face while you negate their stuff then this is the deck for you.  Listen to my beautiful voice: <a>https://www.youtube.com/watch?v=UcOCMBR9up8</a>  General turn 1 goes like this:  1- Normal summon a fairy.  2- Special summon 2 more with breath.  3- Set Counter traps.  4- Win?  Now with Accescode &amp; Super Polymerization for your meta necessities."
97882,northwemko-garlandolf-tenyi-97882,Northwemko Garlandolf Tenyi,61757117,28479,Fun/Casual Decks,"[""53303460"",""53303460"",""80701178"",""80701178"",""87052196"",""87052196"",""87052196"",""23431858"",""23431858"",""23431858"",""61757117"",""61757117"",""61757117"",""30646525"",""30646525"",""30646525"",""65877963"",""65877963"",""65877963"",""4810828"",""4810828"",""4810828"",""99266988"",""99266988"",""99266988"",""54693926"",""54693926"",""54693926"",""57995165"",""13048472"",""13048472"",""13048472"",""52913738"",""52913738"",""60234913"",""60234913"",""60234913"",""45725480"",""45725480"",""45725480""]","[""80532587"",""80532587"",""80532587"",""79606837"",""79606837"",""79606837"",""23935886"",""23935886"",""23935886"",""32519092"",""32519092"",""32519092"",""78917791"",""78917791"",""38030232""]","[""34267821"",""34267821"",""34267821"",""59438930"",""59438930"",""59438930"",""24224830"",""24224830"",""24224830"",""96729612"",""96729612"",""96729612"",""43898403"",""43898403"",""43898403""]",1615487905,2 years ago,,,0,A deck with bad ritual monster with somewhat of a small Tenyi engine,"Chaos Space can search Light or Dark Monsters that cannot be Normal Summoned or Set. Ritual Monsters cannot be Normal Summoned or Set. Look there are better targets for Chaos Space than Northwemko and Garlandolf, but this deck is just for fun if you want to ""challenge"" yourself. You won't always see the starters for the Tenyi engine, but you can possibly blow up your opponent's board going second with Garlandolf. Extravagance isn't in this deck since it defeats the purpose of the large amount of level 7's for Sacred Sword of Seven Stars.  TLDR- This Deck is rubbish"
97872,tribrigade-zoodiac-dragma-deck-profile-97872,Tribrigade Zoodiac Dragma Deck-Profile,69680031,27253,Meta Decks,"[""69680031"",""95679145"",""95679145"",""29587993"",""87209160"",""87209160"",""87209160"",""77150143"",""77150143"",""77150143"",""60303688"",""60303688"",""60303688"",""31755044"",""4145852"",""4145852"",""4145852"",""78872731"",""14558127"",""14558127"",""14558127"",""50810455"",""50810455"",""50810455"",""14816857"",""14816857"",""14816857"",""1984618"",""1984618"",""1984618"",""2295440"",""67169062"",""67169062"",""67169062"",""51097887"",""51097887"",""51097887"",""46060017"",""57103969"",""57103969"",""57103969"",""25908748"",""10045474"",""10045474"",""10045474""]","[""41373230"",""80532587"",""74586817"",""11510448"",""41375811"",""41375811"",""48905153"",""74393852"",""26973555"",""65305468"",""99726621"",""69073023"",""72330894"",""52331012"",""26847978""]","[""34267821"",""34267821"",""34267821"",""59438930"",""59438930"",""59438930"",""24224830"",""24224830"",""24224830"",""96729612"",""96729612"",""96729612"",""43898403"",""43898403"",""43898403""]",1615487905,2 years ago,,,0,Tribrigade Dragma Zoodiac Deck-Profile,
97868,sacred-beast-armityle-otk-spam-july-2020-97868,Sacred Beast Armityle Otk Spam July 2020,43378048,27524,Meta Decks,"[""32491822"",""32491822"",""69890967"",""6007213"",""28651380"",""55063751"",""55063751"",""55063751"",""87917187"",""87917187"",""87917187"",""54040484"",""81034083"",""81034083"",""81034083"",""27439792"",""27439792"",""27439792"",""89190953"",""13301895"",""13301895"",""54828837"",""80312545"",""80312545"",""80312545"",""24224830"",""24224830"",""24224830"",""1475311"",""1475311"",""81439174"",""2295440"",""53701259"",""53701259"",""10045474"",""10045474"",""10045474"",""24207889"",""24207889"",""36975314"",""36975314""]","[""43378048"",""43378048"",""26096328"",""56910167"",""85289965"",""86066372"",""38342335"",""2857636"",""70369116"",""70369116"",""41999284"",""60303245"",""60303245"",""60303245"",""94259633""]","[""27204311"",""27204311"",""27204311"",""14558127"",""14558127"",""14558127"",""24508238"",""24508238"",""24508238"",""8267140"",""8267140"",""8267140"",""43711255"",""43711255"",""43711255""]",1615487905,2 years ago,,,0,https://youtu.be/mZBOveKQ9tU,https://youtu.be/mZBOveKQ9tU
97864,sacred-beast-armityle-the-chaos-phantasm-phantom-of-fury-97864,"SACRED BEAST,Armityle the Chaos Phantasm – Phantom of Fury",81034083,25969,Fun/Casual Decks,"[""81034083"",""81034083"",""81034083"",""6007213"",""6007213"",""32491822"",""32491822"",""69890967"",""69890967"",""54040484"",""54040484"",""27439792"",""27439792"",""27439792"",""87917187"",""87917187"",""19665973"",""19665973"",""2295440"",""81439174"",""80312545"",""80312545"",""80312545"",""74029853"",""74029853"",""74029853"",""42199039"",""42199039"",""42199039"",""89190953"",""89190953"",""89190953"",""13301895"",""13301895"",""41587307"",""54828837"",""53701259"",""53701259"",""53701259"",""11481610""]","[""60110982"",""60110982"",""43378048"",""43378048"",""95463814"",""35606858"",""56910167"",""41999284"",""60303245"",""38342335"",""2857636"",""75452921"",""29479265"",""70369116"",""86066372""]","[""11481610"",""54040484"",""81223446"",""28651380"",""83195035"",""13301895"",""31036355"",""4280258"",""41999284"",""6007213"",""32491822"",""69890967"",""16317140""]",1615487905,2 years ago,,,0,https://youtu.be/MW70BzyrJYE,https://youtu.be/MW70BzyrJYE
97860,hero-the-return-of-avian-and-burstinatrix-97860,HERO! The return of Avian and Burstinatrix!,22160245,28566,Fun/Casual Decks,"[""58932616"",""21844577"",""83965310"",""14124483"",""9411399"",""9411399"",""18094166"",""18094166"",""18094166"",""13650422"",""40044918"",""40044918"",""40044918"",""59392529"",""45195443"",""50720316"",""50720316"",""27780618"",""27780618"",""22865492"",""22865492"",""213326"",""213326"",""213326"",""8949584"",""12071500"",""14532163"",""14532163"",""24094653"",""24094653"",""32807846"",""45906428"",""8267140"",""8267140"",""8267140"",""21143940"",""21143940"",""21143940"",""24224830"",""24224830""]","[""23204029"",""86165817"",""29095552"",""40854197"",""46759931"",""22908820"",""58481572"",""89870349"",""22160245"",""36841733"",""63813056"",""1948619"",""19324993"",""58004362"",""58004362""]","[""20721929"",""84327329"",""86188410"",""79979666"",""29343734"",""40080312"",""25366484"",""13293158"",""21947653"",""35809262"",""50282757"",""6498706"",""94820406"",""11881272"",""63035430""]",1615487905,2 years ago,,,0,"Avian and Burstinatrix are back, and they want to smack monsters!","Just a simple HERO deck, this one focusing on fusion summoning Elemental HERO Grandmerge and Evil HERO Inferno Wing!  The main deck consist of the usual HERO goodstuff plus Avian and Burstinatrix. I use two Polys since the ideal stuff is to summon both Sunriser and Grandmerge. I also included a limited Plasma and Dark Law package for when you're required to go first, but make no mistake, this is a going-second beatdown strategy. There's only one of Adusted and Dark Calling each, but I feel that's enough given how easily searchable is.  It lacks in hand traps but makes up for it with plenty of S/T removal for floodgates and Called by the Grave for opposing hand traps since what you want is to get your combo through and not necessarily stop the opponent's.  The Extra Deck is where the real meat is. Our most important card is Xtra HERO Infernal Devicer, who will fetch our vanillas. Grandmerge and Inferno Wing will be our main beatsticks, usually paired with Sunriser. Once Grandmerge destroys a monster, you will tag out to Chaos (be wary of the level restriction!!). I chose Chaos as my prefered tag-out target given his useful negate, but you could make an argument fot not really needing it at that point. To be completely honest with you, I just like Chaos. You could also summon him with Poly or Miracle (yes, you can) given the right situation.  The rest is just more HERO goodstuff: Dark Law because Dark Law, Blast for S/T, Bane for an alternative Dark Calling summon, Absolute Zero/Acid combo for board wipe, Trinity for even more damage, and the rest of the Xtras for more combo and damage.  Lastly, the Side Deck is just ""other things you can use"" rather than an actually functional Side. Special attention to Nebula Neos who can also be summoned with Grandmerge and possibly give you some really sweet draw power.  If what you want is an actual Side Deck, just think of the usual: hand traps, Kaijus, etc."
