deck_num,pretty_url,deck_name,cover_card,userid,format,main_deck,extra_deck,side_deck,ts_submit_date,submit_date,ts_edit_date,edit_date,comments,deck_excerpt,deck_description
299005,dragonmaid-casual-299005,Dragonmaid Casual,24799107,120586,Non-Meta Decks,"[""93969023"",""93969023"",""23434538"",""40398073"",""40398073"",""14558127"",""14558127"",""14558127"",""16960120"",""16960120"",""16960120"",""88453933"",""88453933"",""88453933"",""32600024"",""32600024"",""32600024"",""76782778"",""76782778"",""42055234"",""42055234"",""15848542"",""15848542"",""88264978"",""18144507"",""78231355"",""78231355"",""78231355"",""40110009"",""40110009"",""40110009"",""62265044"",""87571563"",""87571563"",""87571563"",""24224830"",""24299458"",""57416183"",""57416183"",""57416183""]","[""41232647"",""41232647"",""41232647"",""24799107"",""24799107"",""24799107""]","[""28651380"",""9765723"",""37209439"",""10833828"",""60168186"",""21686473""]",1660415905,7 months ago,,,0,Dragonmaid casual version,Casual version of Dragonmaid archetype
299009,dolly-doll-time-3-299009,Dolly doll time 3,75574498,120586,Non-Meta Decks,"[""18106132"",""18106132"",""18106132"",""72717433"",""72717433"",""72717433"",""14575467"",""84754430"",""84754430"",""24639891"",""15734813"",""27126980"",""27126980"",""98827725"",""98827725"",""44190146"",""44190146"",""44190146"",""81587028"",""81587028"",""81587028"",""6311717"",""6311717"",""14558127"",""14558127"",""14558127"",""71595845"",""71595845"",""71595845"",""33907039"",""21862633"",""21862633"",""21862633"",""2295440"",""33782437"",""83764719"",""67331360"",""1033312"",""1033312"",""1033312"",""81439173"",""81439173""]","[""75574498"",""75574498"",""75574498"",""73445448"",""73445448"",""73445448"",""63767246"",""88177324"",""93854893"",""16195942"",""16195943"",""6983839"",""55285840"",""16195942"",""16195943""]","[""28651380"",""9765723"",""37209439"",""10833828"",""60168186"",""21686473""]",1660415905,7 months ago,,,0,Dolly doll time the 3rd,A couple changes
299013,iron-chain-299013,Iron chain,19974580,121285,Fun/Casual Decks,"[""53274132"",""53274132"",""53274132"",""53152590"",""53152590"",""53152590"",""80769747"",""80769747"",""80769747"",""26157485"",""26157485"",""26157485"",""97017120"",""97017120"",""97017120"",""2460565"",""2460565"",""2460565"",""28637168"",""28637168"",""81843628"",""81843628"",""81843628"",""74519184"",""74519184"",""74519184"",""16762927"",""16762927"",""16762927"",""72892473"",""33302407"",""33302407"",""33302407"",""79707116"",""79707116"",""79707116"",""1248895"",""1248895"",""1248895"",""37390589"",""37390589"",""37390589"",""98427577"",""98427577"",""98427577"",""50078509"",""50078509"",""50078509""]","[""19974580"",""19974580"",""19974580""]","[""28651380"",""9765723"",""37209439"",""10833828"",""60168186"",""21686473""]",1660415905,7 months ago,,,0,Cool deck,Any recommendation cards to add in?
299017,magical-musket-s-299017,Magical musket's,30907810,121285,Fun/Casual Decks,"[""30907810"",""30907810"",""30907810"",""94418111"",""94418111"",""94418111"",""68024506"",""68024506"",""68024506"",""31629407"",""31629407"",""31629407"",""5230799"",""5230799"",""5230799"",""68246154"",""68246154"",""68246154"",""32841045"",""32841045"",""67169062"",""67169062"",""67169062"",""24299458"",""24299458"",""67901914"",""67901914"",""67901914"",""93356623"",""93356623"",""93356623"",""96864811"",""20745268"",""20745268"",""20745268"",""47810543"",""47810543"",""29628180"",""29628180"",""29628180""]","[""52145422"",""52145422"",""52145422"",""5614808"",""5614808"",""5614808"",""63731062"",""63731062"",""63731062"",""50793215"",""50793215"",""50793215"",""78229193"",""78229193"",""78229193""]","[""28651380"",""9765723"",""37209439"",""10833828"",""60168186"",""21686473""]",1660415905,7 months ago,,,0,Reccomendation's,Reccomendation's
299021,graydle-water-299021,Graydle/Water,52145422,121285,Fun/Casual Decks,"[""20056760"",""20056760"",""20056760"",""29834183"",""29834183"",""29834183"",""93445074"",""93445074"",""93445074"",""66451379"",""66451379"",""66451379"",""80250319"",""80250319"",""80250319"",""99328137"",""99328137"",""99328137"",""33420078"",""33420078"",""33420078"",""73628505"",""5318639"",""5318639"",""5318639"",""2759860"",""2759860"",""2759860"",""26534688"",""26534688"",""26534688"",""49966595"",""49966595"",""49966595"",""84442536"",""84442536"",""84442536"",""75361204"",""75361204"",""75361204""]","[""52145422"",""52145422"",""52145422"",""5614808"",""5614808"",""5614808"",""63731062"",""63731062"",""63731062"",""50793215"",""50793215"",""50793215"",""78229193"",""78229193"",""78229193""]","[""28651380"",""9765723"",""37209439"",""10833828"",""60168186"",""21686473""]",1660415905,7 months ago,,,0,.,.
299025,time-thief-sky-striker-m-d-299025,Time thief - Sky Striker [M.D.],55285840,121359,Master Duel Decks,"[""94145021"",""94145021"",""23434538"",""36426778"",""14558127"",""14558127"",""63362460"",""26077387"",""26077387"",""26077387"",""43534808"",""43534808"",""56308388"",""56308388"",""82496097"",""19891131"",""74578720"",""37351133"",""37351133"",""64730881"",""81866673"",""12580477"",""18144507"",""32807846"",""73628505"",""63166095"",""63166095"",""99550630"",""25955749"",""52947044"",""52947044"",""50005218"",""22589918"",""24224830"",""24224830"",""52340444"",""98338152"",""98338152"",""25733157"",""51227866"",""10877309"",""98827725"",""18678554"",""18678554"",""76587747""]","[""60461804"",""55285840"",""59208943"",""90448279"",""1482001"",""63288573"",""90673288"",""90673288"",""8491308"",""8491308"",""12421694"",""50588353"",""70369116"",""75147529"",""26692769""]","[""28651380"",""9765723"",""37209439"",""10833828"",""60168186"",""21686473""]",1660415905,7 months ago,,,0,"Sky Striker and Time Thief? Why not, we are going to annoy the meta decks","This deck, for the June/2022 Master Duel format, is designed to take advantage of the control offered by the Sky Striker archetype, combined with the powerful control and versatility of the Time Thief cards [my favorite archetype], which with the extra of the D.P.E combo being the icing on the cake, it ends up achieving great control and versatility to surpass many decks in the current meta. And although it seems that the sky striker does not get along with other archetypes, but the ability of Time Thief Redoer and D.P.E to leave the field and provide advantages with said effect, in the end it gives him a power to say the least ""funny"" (so least for us) to the classic Sky Striker deck."
299031,sacredbeast-d-d-299031,sacredbeast/D/D,81034083,121365,Fun/Casual Decks,"[""81034083"",""81034083"",""81034083"",""27439792"",""87917187"",""87917187"",""32491822"",""32491822"",""32491822"",""69890967"",""6007213"",""16317140"",""16317140"",""53701259"",""53701259"",""80312545"",""80312545"",""80312545"",""54828837"",""13301895"",""13301895"",""269012"",""15771991"",""15771991"",""15771991"",""26905245"",""26905245"",""26905245"",""11609969"",""11609969"",""11609969"",""45206713"",""45206713"",""45206713"",""74069667"",""74069667"",""74069667"",""46372010"",""46372010"",""73360025"",""2295440"",""12021072"",""12021072"",""79922118"",""83764719"",""1475311"",""1475311"",""1475311"",""9064354"",""59919307"",""59919307""]","[""84569886"",""82956492"",""82956492"",""82956492"",""62541668"",""62541668"",""26556950"",""26556950"",""90162951"",""42166000"",""42166000"",""42166000"",""21858819"",""69073023"",""43378048""]","[""28651380"",""9765723"",""37209439"",""10833828"",""60168186"",""21686473""]",1660415905,7 months ago,,,0,"summon spiders with sacred beasts and heal off D/D for damage, god slime is for summoning spiders and for protection","summon spiders with sacred beasts and heal off D/D for damage, god slime is for summoning spiders and for protection"
299035,melffy-299035,Melffy,53054164,33962,Non-Meta Decks,"[""20003027"",""20003027"",""20003027"",""34800281"",""34800281"",""93018428"",""93018428"",""98416533"",""98416533"",""98416533"",""14878872"",""14878872"",""14878872"",""14558128"",""14558128"",""14558128"",""49036338"",""38814750"",""38814750"",""38814750"",""1980574"",""68353324"",""68353324"",""68353324"",""97317530"",""97317530"",""72537897"",""72537897"",""72537897"",""67723438"",""67723438"",""67723438"",""37256135"",""1845204"",""24224830"",""10045474"",""10045474"",""10045474"",""82134632"",""82134632""]","[""3544583"",""81019803"",""79606837"",""90448279"",""53054164"",""53054164"",""36776089"",""54498517"",""12219047"",""30439101"",""30439101"",""86066372"",""38342335"",""27381364"",""27381364""]",,1660415905,7 months ago,,,0,when you give your pet cat a can of sprite ,Write your deck strategy here....
299044,ice-barrier-ultra-budget-299044,Ice Barrier Ultra Budget,70980824,119394,Non-Meta Decks,"[""18319762"",""18319762"",""18319762"",""4904812"",""4904812"",""4904812"",""68505803"",""44308317"",""44308317"",""44308317"",""70703416"",""70703416"",""50088247"",""50088247"",""81825063"",""81825063"",""82498947"",""23950192"",""90303176"",""90303176"",""84206435"",""84206435"",""84206435"",""17197110"",""17197110"",""17197110"",""43582229"",""43582229"",""43582229"",""33057951"",""33057951"",""96947648"",""96947648"",""6075533"",""50078509"",""50078509"",""50078509"",""36975314"",""5318639"",""44095762""]","[""70980824"",""70980824"",""70980824"",""52687916"",""65749035"",""65749035"",""65749035"",""50321796"",""50321796"",""50321796"",""70583986"",""70583986"",""70583986""]",,1660415905,7 months ago,,,0,Synchro madness,Synchro madness
299055,agents-299055,Agents,55794644,18732,Non-Meta Decks,"[""55794644"",""91188343"",""91188343"",""91188343"",""64734921"",""64734921"",""64734921"",""39552864"",""39552864"",""39552864"",""91434602"",""38529357"",""38529357"",""38529357"",""99054885"",""97750534"",""92919429"",""92919429"",""92919429"",""84339249"",""59509952"",""26866984"",""83991690"",""56433456"",""26684111"",""26684111"",""26684111"",""67169062"",""84211599"",""90312154"",""17266660"",""17266660"",""97268402"",""14558127"",""14558127"",""27204311"",""10045474"",""65681983"",""65681983"",""65681983""]","[""63101468"",""37706769"",""84815190"",""52687916"",""90448279"",""66547759"",""93854893"",""36776089"",""86066372"",""4280258"",""48589580"",""90290572"",""50588353"",""60303245"",""98978921""]","[""17266660"",""21074344"",""21074344"",""21074344"",""94689635"",""94689635"",""94689635"",""18144507"",""54693926"",""54693926"",""54693926"",""8267140"",""8267140"",""43898403"",""43898403""]",1660415905,7 months ago,,,0,https://youtu.be/U7sCk-Ij8Bw,https://youtu.be/U7sCk-Ij8Bw
299060,appliancer-299060,Appliancer,77102944,33962,Non-Meta Decks,"[""78447174"",""78447174"",""78447174"",""5846183"",""5846183"",""5846183"",""41830887"",""41830887"",""41830887"",""71278040"",""71278040"",""71278040"",""14558128"",""14558128"",""14558128"",""97268402"",""97268402"",""97268402"",""25789292"",""25789292"",""25789292"",""30996652"",""30996652"",""30996652"",""51405049"",""51405049"",""51405049"",""63995093"",""63995093"",""63995093"",""3875465"",""3875465"",""3875465"",""27157996"",""1845204"",""73628505"",""24224830"",""10045474"",""10045474"",""10045474""]","[""41578483"",""90590303"",""86066372"",""65330383"",""4280259"",""38342335"",""78225596"",""78225596"",""77102944"",""77102944"",""81769387"",""81769387"",""30118200"",""3507053"",""4729591""]","[""99585850"",""101110042"",""54082269"",""14532163"",""14532163"",""14532163"",""25311006"",""25311006"",""25311006"",""54693926"",""54693926"",""54693926"",""43898403"",""43898403"",""43898403""]",1660415905,7 months ago,,,0,appli(ancer) for a job application ,Write your deck strategy here....
299064,ocg-2022-blackwing-299064,[OCG] 2022 Blackwing,73218989,106306,Non-Meta Decks,"[""7459919"",""81470373"",""81470373"",""81470373"",""81105204"",""81105204"",""81105204"",""49003716"",""49003716"",""49003716"",""14785765"",""8571567"",""8571567"",""8571567"",""70465810"",""70465810"",""70465810"",""17465972"",""17465972"",""2009101"",""2009101"",""2009101"",""89258906"",""22835145"",""52869807"",""77152542"",""77152542"",""71187462"",""71187462"",""71187462"",""34976176"",""34976176"",""34976176"",""72714392"",""73652465"",""1475311"",""1475311"",""1475311"",""18144507"",""24224830"",""91351370"",""91351370"",""91351370"",""7602800"",""7602800"",""7602800"",""69973414"",""69973414""]","[""62242678"",""80773359"",""73218989"",""73218989"",""54082269"",""9753964"",""9012916"",""9012916"",""16051717"",""23338098"",""81983656"",""95040215"",""10602628"",""10602628"",""50588353""]","[""99585850"",""101110042"",""54082269"",""14532163"",""14532163"",""14532163"",""25311006"",""25311006"",""25311006"",""54693926"",""54693926"",""54693926"",""43898403"",""43898403"",""43898403""]",1660415905,7 months ago,,,0,birds,"<div class=""ujudUb u7wWjf"" data-mh=""-1"">Yo, Pi'erre, you wanna come out here?</div> <div class=""ujudUb xpdxpnd"" data-mh=""-1"">In New York I Milly Rock (rock) Hide it in my sock (sock) Running from the opp (opp) And I shoot at opp (opp) uh, uh (what?) And I'm on the block (what?) Uh, uh (what? What?) And I'm on the block (what?)</div> <div class=""ujudUb xpdxpnd"" data-mh=""-1"">In New York I Milly Rock (hello?) Hide it in my sock (what?) Hide it in my sock (what?) Selling that rerock (what? Woah, what? What? Uh, what? What?) In New York I Milly Rock (ooh) Hide it in my sock (woah) Used to sell rerock (what?) Runnin' from the cops (woah) Shootin' at these opps (woah)</div> <div class=""ujudUb xpdxpnd"" data-mh=""-1"">Yo, Pi'erre, you wanna come out here? (Woah) Shooting at these opps (what?) 'Cause I run they block (what?) Uh Give me top (top) uh, in my drop-top All these hoes gon' flock (flock, flock) When I drop, yeah (drop, drop) All these hoes gon' flock (flock, flock) When I drop, yeah (drop, drop) All these hoes gon' flock (flock, flock) When I drop, uh (drop, drop) Woo, woo, woo, woo (bih) Woo, woo (bih) woo, woo (bih)</div> <div class=""ujudUb xpdxpnd"" data-mh=""-1"">All these hoes want cash (cash) All these hoes want bags, uh Fucking on your bitch (bih) uh I'm her dad (yeah) uh All these niggas sound like cats, sound like cats (blah) I'm a soldier, ooh (what?) Damn, I thought I told you, ooh (what?) Shootin' like a soldier, ooh (bih) Like I'm from Magnolia, ooh (what?) All these niggas (what? What?) always fold (what? What?)</div> <div class=""ujudUb xpdxpnd"" data-mh=""-1"">Big bank (what? What?) never fold (What?) I'm sippin' Act' (what?) fill that shit slowly (hello?) Bitches on me (what? Bih) say she like my clothing (yeah) I'm in London (what?) Yung Carti global (what?) Designer is on me (phew) call it dirty laundry (phew)</div> <div class=""ujudUb xpdxpnd"" data-mh=""-1"">All these bitches want Yung Carti (what?) Yung Carti (yeah) Ayy, Yung Carti, Yung Carti, what? (Hop in the bit', hop in the bit') Yung Carti, Yung Carti (what? What? Hold on) yeah All of your bitches, they loose, hold on All of your bitches, they loose, hold on (yeah) All of my bitches, they rich, hold on And they stay rockin' that Rick, hold on</div> <div class=""ujudUb xpdxpnd"" data-mh=""-1"">Uh, what? What? Hold on, what? What? Uh (yeah) Rich, rich (rich) Cash Carti, bitch (bitch) Rich, bitch (hold on) Got a rich clique (hold on) I'm suckin' on the clit (hold on) She suckin' on the dick (yeah) Give that hoe a tip (yeah) Told her, ""Buy some kicks"" (kicks)</div> <div class=""ujudUb xpdxpnd"" data-mh=""-1"">Ooh, then I brush my teeth (what?) Hop up in the whip Glocky in the whip (skrrt) Glocky in the whip (yeah) And I'm cocky, fuckin' on a thotty She just wanna plot me, bitch can't stop me (stop me) I'm ridin' in a Masi (what? Masi) This ain't even my Masi (nah)</div> <div class=""ujudUb xpdxpnd"" data-mh=""-1"">Hope that's not your thotty (what?) Your bitch look like a auntie (what?) Walked in with Ashanti (what?) Damn, that look like 'Shanti (what?) Damn, that look like Carti (yeah-yeah) I think that be Yung Carti Heard he spent a hundred on a fucking watch piece, that's filthy (phew, what? Woah, woah)</div> <div class=""ujudUb xpdxpnd"" data-mh=""-1"">In New York I Milly Rock (what?) Hide it in my sock (what? What?) Running from an opp (what? What?) And I shoot at opp (what? What?) uh, uh (phew) And I'm on the block (phew) uh, uh (hello?) And I'm on the block (what?)</div> <div class=""ujudUb xpdxpnd"" data-mh=""-1"">In New York I Milly Rock (what?) Hide it in my sock (what?) Hide it in my sock (sock) Selling that rerock (rerock) What? What? (What?) What? Uh, what? In New York I Milly Rock (what?) Hide it in my sock (what?) Use to sell rerock, uh Runnin' from the cops, uh Shootin' at these opps</div> <div class=""ujudUb WRZytc xpdxpnd"" data-mh=""-1"">You know what I'm sayin'? Yo (yeah) Pi'erre, you wanna come out here? Bitch ass nigga, fuck that nigga, man</div>"
299069,darklord-despia-masterduel-299069,Darklord/Despia Masterduel,4167084,88324,Master Duel Decks,"[""99456344"",""81555617"",""62962630"",""62962630"",""62962630"",""36577931"",""99543666"",""99543666"",""99543666"",""36637374"",""36637374"",""36637374"",""82738008"",""92807548"",""82773292"",""82773292"",""82773292"",""52840267"",""52840267"",""52840267"",""11260714"",""88234365"",""51728779"",""25451652"",""87112784"",""87112784"",""87112784"",""14517422"",""14517422"",""14517422"",""50501121"",""1475311"",""1475311"",""1475311"",""48130397"",""24094653"",""24094653"",""81866673"",""63362460"",""52947044""]","[""6855503"",""72272462"",""4167084"",""4167084"",""41209827"",""60461804"",""69946549"",""54757758"",""35306215"",""70369116"",""75452921"",""2857636"",""38342335"",""4280258"",""98127546""]","[""36577931"",""36577931"",""3717252"",""3717252"",""3717252"",""94977269"",""94977269"",""6855503"",""72272462"",""63767246"",""86066372"",""48130397"",""58577036"",""58577036"",""58577036""]",1660415905,7 months ago,,,0,"Darklord, Despia, Master duel",Due to the types of those two archetypes [Fairy] they combo surprisingly well.  There are alot of combos between these two archetypes. More than I could represent here.  &nbsp;  <strong><span>[Darklord combo]</span></strong>  The best way and the main way for the deck to get big beatsticks on the Board. The main way to get Darklords on the Board is to find a way to get them to the grave. This is extremly simple due to there effects. Everything you need for one combo is Ixchel and one Darklord card. (preferebly Superbia) By discarding Ixchel and another Darklord card you'll be able to draw 2 cards. With Darklord Contact or Banishment of the Darklords you will be able to summon those two Cards back on the Field to either use them for a link summon or a fusion summon. Nearly every Darklord has a second effect you can pay 1000 lp to activate a darklord card from your graveyard. Nearly every Darklord card works like Ixchel and therefor its extremly easy to have 4 or more monsters on the Field at once.  <strong><span>[Despia combo]</span></strong>  The Despia Cards work as a support for the Darlord cards. With Aluber you will be able to get the Despia Fusion spell with which you will be able to summon the Darklord or despia Fusion monsters.  <span><strong>[Fusion Monsters]</strong></span>  The First Darklord has a special effect that triggers when you summon him with darlord Morningstar as Material. You will be able to destroy every card your oponnent controls. And your opponnent can't really counter this effect because The First Darlord makes it so that Fairy monsters can't be targeted for effects.  &nbsp;  &nbsp;
299073,upgrade-better-than-zak-s-shitty-hero-deck-299073,Upgrade Better Than Zak's Shitty Hero Deck,93483212,121315,Non-Meta Decks,"[""65626958"",""65626958"",""65626958"",""91011603"",""91011603"",""91011603"",""13455953"",""27024795"",""27024795"",""27024795"",""61777313"",""40844552"",""14677495"",""14677495"",""14677495"",""15394083"",""15394083"",""15394083"",""40666140"",""41788781"",""14558127"",""14558127"",""14558127"",""97268402"",""97268402"",""97268402"",""32807846"",""12580477"",""18144507"",""7320132"",""7320132"",""18027138"",""18027138"",""18027138"",""4031928"",""24224830"",""41420027"",""41420027"",""41420027"",""40605147"",""40605147"",""40605147"",""10045474"",""10045474"",""10045474"",""15286412"",""15286412"",""15286412"",""64797746"",""64797746"",""64797746"",""88069166""]","[""93483212"",""93483212"",""30604579"",""30604579"",""67098114"",""67098114"",""90207654"",""90207654"",""90207654"",""86066372"",""45819647"",""50588353"",""65741786"",""38342335"",""2857636""]","[""58921041"",""58921041""]",1660415905,7 months ago,,,1,Nordic init,Nordic God Tier
299078,splight-frog-299078,Splight - Frog,54498517,17793,Non-Meta Decks,"[""76145933"",""76145933"",""76145933"",""13533678"",""13533678"",""13533678"",""75922381"",""75922381"",""2311090"",""2311090"",""9126351"",""9126351"",""9126351"",""46239604"",""46239604"",""1357146"",""78868119"",""78868119"",""78868119"",""14558127"",""14558127"",""14558127"",""59438930"",""59438930"",""59438930"",""97268402"",""97268402"",""97268402"",""15443125"",""15443125"",""15443125"",""65681983"",""65681983"",""88836438"",""1845204"",""18144507"",""24224830"",""10045474"",""10045474"",""10045474""]","[""3544583"",""90448279"",""72167543"",""90809975"",""36776089"",""9486959"",""54498517"",""54498517"",""84224627"",""86066372"",""45819647"",""50588353"",""27381364"",""27381364"",""65741786""]","[""58921041"",""58921041""]",1660415905,7 months ago,,,0,Splight - Frog,Splight - Frog
299083,swordsoul-ultimate-wyrm-synchro-299083,Swordsoul Ultimate Wyrm Synchro,96633955,111056,Master Duel Decks,"[""94693857"",""98159737"",""98159737"",""98159737"",""23431858"",""23431858"",""87052196"",""87052196"",""87052196"",""55273560"",""55273560"",""20001443"",""20001443"",""20001443"",""56495147"",""56495147"",""93490856"",""93490856"",""93490856"",""6728559"",""65124425"",""65124425"",""56465981"",""56465981"",""56465981"",""35261759"",""35261759"",""18144507"",""65681983"",""65681983"",""24224830"",""24224830"",""14821890"",""90846359"",""90846359"",""61740673"",""10045474"",""10045474"",""24508238"",""97268402"",""97268402"",""14558127"",""14558127"",""14558127"",""23434538"",""23434538"",""27204311""]","[""43202238"",""83755611"",""83755611"",""5041348"",""69248256"",""69248256"",""19048328"",""96633955"",""84815190"",""32519092"",""32519092"",""32519092"",""78917791"",""50588353"",""44097050""]","[""58921041"",""58921041""]",1660415905,7 months ago,,,0,"What the scarrier than combo deck ? Its combo deck with Floodgates, Enjoy.","<strong><span>This my updated Diamond 1 deck Swordsoul</span></strong>  Im named it ""Brick Swordsoul"" contain 47 Card  &nbsp;  This deck hard counter to adventure the most card use now, cause <strong>Rivalry of Warlord</strong> &amp; <strong>Imperial Order</strong>  &nbsp;  <strong>Best combo</strong> with starting hand ashuna + vessel + tai a  Make monk of tenyi &gt; dump longyuan &amp; add adhara with vessel &gt; ss adhara &amp; link halq auroradon combo &gt; baronne with token &amp; deskbot &gt; tai a banish longyuan &amp; add longyuan with adhara &gt; make baxia &amp; tai a send moye &gt; baxia pop auroradon ss moye &gt; banish ashuna ss adhara as u want make chaofeng with baxia then make chi xiao &amp; add emergence/blackout(u either want pop or protos as your choice)  &gt; if there more wyrm in hand can make chengying with longyuan  &nbsp;  Cause there <strong>Rivalry of Warlord </strong>most likely i make Chengying than Baronne, if u insist to baronne another floodgate option <strong>Anti-spell Fragance</strong>  I likely go to halqdon combo with ecclesia than summon swordsoul  Thats from me hope u enjoy"
