deck_num,pretty_url,deck_name,cover_card,userid,format,main_deck,extra_deck,side_deck,ts_submit_date,submit_date,ts_edit_date,edit_date,comments,deck_excerpt,deck_description
218743,toying-with-speed-218743,Toying with Speed,82044279,64812,Fun/Casual Decks,"[""35494087"",""26420373"",""26420373"",""8284390"",""80559548"",""85034450"",""85034450"",""85034450"",""53054833"",""53054833"",""53054833"",""17328157"",""69550259"",""50482813"",""16947147"",""23792058"",""81275020"",""59640711"",""59640711"",""59640711"",""89326990"",""89326990"",""89326990"",""96945958"",""96945958"",""96945958"",""53932291"",""53932291"",""53932291"",""27660735"",""96708940"",""96708940"",""96708940"",""16725505"",""16725505"",""16725505"",""70939418"",""62899696"",""62899696"",""15555120"",""15555120"",""15609017"",""15609017"",""15609017"",""88204302"",""88204302"",""88204302"",""36730805"",""36730805"",""36730805"",""85704698"",""85704698"",""58543073""]","[""5772618"",""5772618"",""97007933"",""42110604"",""42110604"",""21516908"",""21516908"",""72813401"",""90036274"",""82044280""]","[""2857636"",""48048590"",""90179822"",""18666161"",""97403510"",""11317977"",""70369116"",""1475311"",""12071500"",""14386013"",""44394295"",""24299458"",""48130397"",""12444060"",""93595154""]",1647023905,1 year ago,,,0,A deck using the Speedroid archetype,"This was one of my favorite decks to make, all because of  the fact that when I started playing Yugioh, I had a deck with just a small amount of different archetypes because I only bought booster packs. And within that deck, the Speedroid cards I had were my go-to cards to help me win in the end. And so, I decided to finally get around to making this deck. There's only two ways I can see this deck going wrong. 1, You don't get any tuners in your starting hand (which shouldn't be very likely), and 2, Having your opponent OTK you. I'm mostly worried about being OTKed, mainly because of the fact that a decent amount of the Speedroid's effects revolve around summoning from the graveyard, but that's only some of them. Anyway, onto the strategy I planned.  <span>STEP ONE</span> - The first thing you need to do is get out a decent Synchro monster so you at least have a little bit of protection. I recommend Chanbara, to help get it's ATK boosted before your opponent can get some high-levels on the field.  <span>STEP TWO</span> - Next, you need to get out Kitedrake, but ONLY ONE!!! You need to keep the other one in the Extra Deck, so you have some board wipe abilities for late game.  <span>STEP THREE</span> - Finally, you need to get out your Clear Wings to help you keep up some high ATK. With this, you should be secured the win.  I took a lot of pride making this deck, and I think it'll work very well. Best of luck on your next duel!"
218735,cxyz-comics-hero-legend-arthur-deck-art-stanley-chitaro-a-218735,"CXyz Comics Hero Legend Arthur deck ,Art Stanley, (Chitaro A",13030280,25969,Fun/Casual Decks,"[""54582424"",""54582424"",""54582424"",""1003028"",""1003028"",""1003028"",""87321742"",""87321742"",""87321742"",""59965151"",""50916353"",""1833916"",""40225398"",""65367484"",""65367484"",""65367484"",""25259669"",""25259669"",""25259669"",""59438930"",""59438930"",""8267140"",""8267140"",""43898403"",""43898403"",""47660516"",""47660516"",""47660516"",""67037924"",""74003290"",""74003290"",""10045474"",""10045474"",""10045474"",""14602126"",""14602126"",""14602126"",""32807846"",""35261759"",""35261759""]","[""64276752"",""64276752"",""26973555"",""28781003"",""28781003"",""48009503"",""77631175"",""77631175"",""82697249"",""65305468"",""86331741"",""359563"",""46772449"",""13030280"",""13030280""]","[""2857636"",""48048590"",""90179822"",""18666161"",""97403510"",""11317977"",""70369116"",""1475311"",""12071500"",""14386013"",""44394295"",""24299458"",""48130397"",""12444060"",""93595154""]",1647023905,1 year ago,,,0,https://youtu.be/aPXL6gdH9uo,https://youtu.be/aPXL6gdH9uo
218725,eldlich-invoked-ecclesia-and-winda-super-hyper-meta-deck-218725,"Eldlich, Invoked,Ecclesia And Winda!! SUPER HYPER META DECK!",95440947,77334,Meta Decks,"[""46986414"",""74677422"",""27204311"",""27204311"",""27204311"",""95440946"",""95440946"",""69680031"",""95679145"",""60303688"",""86120751"",""86120751"",""86120751"",""1984618"",""1984618"",""1984618"",""6172122"",""18144507"",""54693926"",""54693926"",""54693926"",""73628505"",""74063034"",""74063034"",""24299458"",""24299458"",""24299458"",""31434645"",""31434645"",""47679935"",""47679935"",""47679935"",""20612097"",""20612097"",""20612097"",""53582587"",""53582587"",""82956214"",""82956214"",""82956214"",""20590515"",""20590515"",""21011044"",""93191801"",""93191801""]","[""75286621"",""75286621"",""37818794"",""12307878"",""12307878"",""50907446"",""94977269"",""80532587"",""80532587"",""80532587"",""54082269"",""86221741"",""70369116"",""2220237"",""60303245""]","[""20899496"",""20899496"",""20899496""]",1647023905,1 year ago,,,0,"Eldlich, Invoker,Ecclesia And Winda vs Melodious And Aleister WHO WILL WIN?  https://youtu.be/0BWOZPjhlJI 6:56 - 8:53","The super meta between metas, a brilliant idea to mix the most broken of these times in a single deck! If everything were so easy, any deck would be a Meta, no matter how level this deck has, it has the problem that all the monsters will collide with each other, if it is not used properly it will not go anywhere and the strategies will go away to the floor and it will only be a block, but if it is used properly there will be no turning back and your victory will be assured, I learned how to use it and it seemed to me to be an extremely toxic deck, because basically I did not let my rival do anything lol, if you like to win this is your deck, it is strong .. very strong.<span class=""Y2IQFc"" lang=""en"">What video guy did not know how to use it and lost it is no longer my problem I tell the truth and a great deck.</span><span class=""Y2IQFc"" lang=""en"">If it sounds weird what I'm saying is that I use google translator</span>    &nbsp;  &nbsp;  &nbsp;  &nbsp;"
218721,true-rulers-218721,True Rulers,88581108,87245,Non-Meta Decks,"[""53804307"",""53804307"",""26400609"",""26400609"",""89399912"",""89399912"",""90411554"",""90411554"",""91020571"",""91020571"",""27415516"",""27415516"",""53797637"",""53797637"",""53797637"",""89185742"",""89185742"",""89185742"",""88264978"",""61901281"",""99234526"",""59438930"",""59438930"",""59438930"",""41620959"",""41620959"",""41620959"",""81439173"",""89399912"",""62265044"",""62265044"",""62265044"",""96746083"",""30539496"",""82321037"",""81223446"",""81223446"",""14943837"",""14943837"",""14943837""]","[""3040496"",""88581108"",""88581108"",""52687916"",""10669138"",""92892239"",""92892239"",""86148577"",""13143275"",""11969228"",""9753964"",""87188910"",""62242678"",""80117527"",""73580471""]","[""20899496"",""20899496"",""20899496""]",1647023905,1 year ago,,,0,VFD dragon rulers,Write your deck strategy here... VFD
218715,the-phantom-knights-yuto-yugioh-arc-v-in-vrains-218715,The phantom knights Yuto- Yugioh arc V in Vrains,26692769,77334,Non-Meta Decks,"[""27204311"",""27204311"",""78661338"",""78661338"",""57143342"",""30227494"",""99745551"",""88544390"",""20758643"",""10802915"",""10802915"",""10802915"",""63821877"",""90432163"",""90432163"",""25538345"",""25538345"",""25538345"",""3233859"",""43694650"",""36426778"",""36426778"",""36426778"",""14558127"",""14558127"",""32807846"",""54693926"",""54693926"",""54693926"",""24224830"",""24299458"",""24299458"",""24299458"",""65681983"",""65681983"",""65681983"",""67723438"",""67723438"",""10045474"",""98431356"",""25542642"",""25542642"",""25542642"",""61740673""]","[""90448279"",""16195942"",""16195943"",""72167543"",""359563"",""62709239"",""62709239"",""95992081"",""12219047"",""26973555"",""65305468"",""98127546"",""86066372"",""38342335"",""26692769"",""58699500""]","[""98452268"",""64276752"",""64276752"",""28781003"",""3298689"",""3298689""]",1647023905,1 year ago,,,0,"The phantom knights vs melodious and aleister knights vs fairies and sorcerers, who will win? https://youtu.be/0BWOZPjhlJI 5:03 - 6:55","The phantom knights have always seemed like a beast of a deck with multiple invocations and a variety of negations, the truth is interesting, the only problem that I see in this deck is that it is basically extremely repetitive and almost all of them are the same, change one or another card and that's it.    &nbsp;"
218711,red-eyes-casual-concept-v2-218711,Red-eyes casual concept V2,46986414,89662,Non-Meta Decks,"[""46986414"",""74677422"",""74677422"",""74677422"",""88264978"",""18491580"",""18491580"",""99365553"",""48048590"",""48048590"",""48048590"",""62962630"",""62962630"",""68468459"",""68468459"",""15717011"",""93969023"",""93969023"",""93969023"",""66574418"",""66574418"",""79323590"",""79323590"",""79323590"",""1475311"",""1475311"",""1475311"",""44362883"",""44362883"",""44362883"",""83764718"",""6172122"",""6172122"",""92353449"",""92353449"",""82738008"",""36637374"",""36637374"",""36637374"",""24224830"",""39387565""]","[""11321089"",""30086349"",""44146295"",""37818794"",""37818794"",""70534340"",""3410461"",""72272462"",""87746184"",""87746184"",""6855503"",""44405066"",""44405066"",""73539069"",""24361622""]","[""98452268"",""64276752"",""64276752"",""28781003"",""3298689"",""3298689""]",1647023905,1 year ago,1668191905,4 months ago,0,Red-eyes casual concept V2,<p>Red-eyes casual concept V2</p>
218705,speedroid-post-synchro-storm-218705,Speedroid Post Synchro Storm,59765225,59587,Non-Meta Decks,"[""53054833"",""53054833"",""59640711"",""59640711"",""59640711"",""96945958"",""96945958"",""96945958"",""86976918"",""86976918"",""96708940"",""96708940"",""96708940"",""53932291"",""53932291"",""53932291"",""16725505"",""16725505"",""81275020"",""8284390"",""50482813"",""69550259"",""14558127"",""97268402"",""27204311"",""29114773"",""29114773"",""29114773"",""12148078"",""12148078"",""12148078"",""88204302"",""88204302"",""88204302"",""83764719"",""65681983"",""65681983"",""65681983"",""58543073"",""10045474""]","[""21123811"",""84815190"",""92519087"",""59765225"",""5772618"",""50954680"",""50954680"",""82044280"",""82044280"",""64880894"",""42110604"",""21516908"",""23361526"",""4280258"",""72813401""]","[""98452268"",""64276752"",""64276752"",""28781003"",""3298689"",""3298689""]",1647023905,1 year ago,,,1,Speedroid Post Synchro Storm,https://youtu.be/CWVwhww3Ud4
218701,traptrix-paleo-frog-218701,Traptrix Paleo Frog,90809975,70270,Non-Meta Decks,"[""81823360"",""81823360"",""81823360"",""45803070"",""45803070"",""91812341"",""91812341"",""91812341"",""82738277"",""82738277"",""82738277"",""28868394"",""28868394"",""28868394"",""85138716"",""85138716"",""85138716"",""9126351"",""9126351"",""9126351"",""1357146"",""1357146"",""46239604"",""46239604"",""46239604"",""2055403"",""9581215"",""29401950"",""29616929"",""31548215"",""35035481"",""35035481"",""35035481"",""38761908"",""38761908"",""38761908"",""69599136"",""98414735"",""98414735"",""98414735""]","[""56832966"",""440556"",""86532744"",""84013237"",""59071624"",""6511113"",""6511113"",""90809975"",""90809975"",""90809975"",""952523"",""65170459"",""98978921"",""73639099"",""73639099""]","[""102380"",""102380"",""102380"",""55063751"",""55063751"",""55063751"",""5650082"",""5650082"",""5650082"",""84640866"",""84640866"",""84640866"",""58921041"",""58921041"",""58921041""]",1647023905,1 year ago,,,0,This deck is cursed,"This deck is one of the worst things I've ever made, and I think you need to play it. Go into frog or traptrix, or both."
218696,traditional-lovecraft-218696,Traditional Lovecraft,34945480,11636,Non-Meta Decks,"[""71413901"",""71413901"",""34966096"",""34966096"",""26873574"",""26873574"",""55878038"",""55878038"",""46609443"",""46609443"",""46609443"",""29116732"",""29116732"",""29116732"",""33420078"",""33420078"",""82693042"",""82693042"",""90488465"",""92676637"",""92676637"",""92676637"",""26920296"",""26920296"",""49033797"",""49033797"",""49033797"",""74335036"",""74335036"",""74335036"",""36484016"",""36484016"",""73628505"",""32999573"",""32999573"",""10045474"",""10045474"",""35329581"",""35329581"",""35329581""]","[""31385077"",""88643579"",""88643579"",""80532587"",""80532587"",""17412721"",""25132288"",""25132288"",""70913714"",""12948099"",""12948099"",""34945480"",""8809344"",""8809344"",""58720904""]","[""21044178"",""33420078"",""3040496"",""70913714"",""70913714"",""12948099"",""26920296"",""32999573""]",1647023905,1 year ago,,,1,A traditional format deck utilizing the Chaos End Dragons and Entities,Built to make use of personal favorites in the Chaos End Dragons and Entity monsters to control the board.
218692,evil-hero-puro-218692,Evil Hero Puro,19324993,89818,Fun/Casual Decks,"[""58554959"",""58554959"",""45659520"",""50304345"",""50304345"",""45195443"",""40044918"",""63060238"",""86188410"",""50720316"",""20721928"",""20721928"",""84327329"",""84327329"",""58932615"",""58932615"",""21844576"",""21844576"",""52101615"",""27780618"",""1033312"",""1033312"",""94820406"",""94820406"",""94820406"",""12071500"",""12071500"",""24094653"",""24094653"",""48130397"",""21143940"",""32807846"",""18144507"",""12580477"",""8949584"",""25789292"",""81439173"",""72043279"",""72043279"",""43422537""]","[""86676862"",""86676862"",""86676862"",""19324993"",""19324993"",""13293158"",""58332301"",""21947653"",""22160245"",""50282757"",""58481572"",""59642500"",""46759931"",""45170821"",""54757758""]","[""13650422"",""95943058"",""86165817"",""18438874"",""85138716"",""50259460""]",1647023905,1 year ago,,,0,Evil Hero,En Proceso
218688,historic-may-27-1999-218688,Historic May 27 1999,66889139,58272,Non-Meta Decks,"[""6368038"",""28279543"",""28279543"",""28279543"",""91939608"",""91939608"",""91939608"",""10202894"",""10202894"",""10202894"",""41762634"",""41762634"",""41762634"",""1784619"",""1784619"",""1784619"",""13039848"",""13039848"",""54652250"",""54652250"",""7089711"",""7089711"",""12580477"",""12580477"",""12580477"",""24094653"",""53129443"",""53129443"",""55144522"",""55144522"",""55144522"",""63102017"",""72302403"",""72302403"",""83764718"",""83764718"",""83764718"",""4206964"",""4206964"",""4206964""]","[""66889139"",""66889139"",""66889139"",""9293977"",""9293977"",""9293977"",""45231177"",""45231177"",""45231178"",""95952802"",""95952802"",""95952802"",""17881964"",""17881964"",""17881964""]","[""89631139"",""89631139"",""6368038"",""33066139"",""60694662"",""7089711"",""54652250"",""9076207"",""19159413"",""24094653"",""51482758"",""53129443"",""66788016"",""72302403"",""83887306""]",1647023905,1 year ago,,,0,Historic deck format upgraded with Vol.3,"The Vol .3 added not only more beaters like skull red bird, it also added Gaia the Dragon Champion as the biggest fusion deck target for the moment, the first flip effect monsters, Giant Soldier of Stone for the biggest defender and Pot of Greed, the first Drawing effect spell."
218684,budget-monarchs-218684,Budget Monarchs,84171830,90263,Non-Meta Decks,"[""96570609"",""96570609"",""96570609"",""23064604"",""23064604"",""23064604"",""69230391"",""57666212"",""33746252"",""47084486"",""47084486"",""47084486"",""85847157"",""59463312"",""59463312"",""22404675"",""95457011"",""95457011"",""52296675"",""52296675"",""81439174"",""2295440"",""22842126"",""22842126"",""22842126"",""33609262"",""33609262"",""33609262"",""70368879"",""79844764"",""79844764"",""79844764"",""19870120"",""61466310"",""61466310"",""84171830"",""84171830"",""84171830"",""54241725"",""54241725""]","[""66889139"",""66889139"",""66889139"",""9293977"",""9293977"",""9293977"",""45231177"",""45231177"",""45231178"",""95952802"",""95952802"",""95952802"",""17881964"",""17881964"",""17881964""]","[""82385847"",""77585513"",""77585513"",""97268402"",""97268402"",""97268402"",""18144507"",""43898403"",""43898403"",""43898403"",""5650082"",""5650082"",""41420027"",""41420027"",""41420027""]",1647023905,1 year ago,,,0,Classic domain strategy of shutting off your opponents extra deck and special summons while beating in with tribute summoned monsters ,Domain Monarchs for less than 100 dollars  https://youtu.be/VTGEGcyloT0
218680,myutent-psychics-218680,Myutent Psychics,79072916,74150,Fun/Casual Decks,"[""7574904"",""7574904"",""7574904"",""61089209"",""61089209"",""61089209"",""34695290"",""34695290"",""34695290"",""43709490"",""43709490"",""43709490"",""8200556"",""8200556"",""8200556"",""62201847"",""62201847"",""62201847"",""26561172"",""26561172"",""26561172"",""64107820"",""79072916"",""79072916"",""79072916"",""75539614"",""75539614"",""34572613"",""34572613"",""34572613"",""42577802"",""42577802"",""42577802"",""51790181"",""51790181"",""81332143"",""81332143"",""64014615"",""64014615"",""14731897"",""14731897"",""5466615"",""5466615"",""60967717"",""60967717"",""98535702"",""98535702"",""98954106"",""98954106"",""55948544"",""31855260"",""31855260"",""31855260"",""2130625"",""2130625"",""2130625"",""23323812"",""23323812"",""21488686"",""21488686""]","[""6182103"",""6182103"",""6182103"",""79194594"",""79194594"",""79194594""]","[""51790181"",""81332143"",""64014615"",""14731897"",""5466615"",""60967717"",""98535702"",""55948544"",""23323812"",""49980185"",""49980185""]",1647023905,1 year ago,,,0,Myutent Psychics,Myutent Psychics
218664,dragoon-and-drytron-218664,DRAGOON AND DRYTRON!!,37818794,77334,Meta Decks,"[""46986414"",""74677422"",""27204311"",""27204311"",""27204311"",""92919429"",""92919429"",""92919429"",""17266660"",""17266660"",""22420202"",""22420202"",""22420202"",""33543890"",""60037599"",""60037599"",""60037599"",""96026108"",""96026108"",""96026108"",""97148796"",""97148796"",""97148796"",""40177746"",""69815951"",""48546368"",""77235086"",""3629090"",""99427357"",""1845204"",""6172122"",""25311006"",""25311006"",""60600126"",""60600126"",""60600126"",""81439174"",""94187078"",""94187078"",""94187078"",""22398665"",""24224830"",""24299458"",""24299458"",""24299458"",""58793369""]","[""37818794"",""80532587"",""41578483"",""79606837"",""90448279"",""27552504"",""72167543"",""1174075"",""1174075"",""48608796"",""85289965"",""38342335"",""65741786"",""70369116"",""41999284""]","[""51790181"",""81332143"",""64014615"",""14731897"",""5466615"",""60967717"",""98535702"",""55948544"",""23323812"",""49980185"",""49980185""]",1647023905,1 year ago,,,0,"DRAGOON AND DRYTRON VS MELODIOUS and aleister !! META DECK VS CASUAL FUN, WHO WILL WIN? https://youtu.be/0BWOZPjhlJI 3:28 - 5:02","Drytron I've never used them, but I know friends who do, and I'll be honest they're all the same, if they're pure they include A stream of deniers I don't understand why they put dragoon on this deck, it doesn't need it, the drytron's are strong alone and dragoon is filling, but hey, I'm not saying anything, I also use dragoon a lot and I know what POWER is !! MUAJAJAJ    &nbsp;  &nbsp;"
218655,supreme-king-z-arc-odd-eyes-deck-218655,SUPREME KING Z-ARC ODD-EYES DECK!!,14105623,77334,Non-Meta Decks,"[""14105623"",""14105623"",""14105623"",""16306932"",""21770839"",""46136942"",""46136942"",""85497611"",""16178681"",""16178681"",""16178681"",""93149655"",""71692913"",""14920218"",""21250202"",""40318957"",""40318957"",""75672051"",""58092907"",""47075569"",""48461764"",""48461764"",""73941492"",""67754901"",""14558127"",""14558127"",""82224646"",""82224646"",""69181753"",""69181753"",""37469904"",""37803970"",""48144509"",""53208660"",""72490637"",""82768499"",""82768499"",""27813661"",""27813661"",""10045474""]","[""13331639"",""45014450"",""49820233"",""53262004"",""53262004"",""80896940"",""59123194"",""70771599"",""80696379"",""82044280"",""86238081"",""16691074"",""16691074"",""42160203"",""4280258""]",,1647023905,1 year ago,,,0,in this duel we will see odd-eyess vs melodious and aleister. yuya vs yuzu 2.0 !! Who will win https://youtu.be/0BWOZPjhlJI 1:57 - 3:27.,"I personally love the pendulum, especially the odd-eyes decks, they don't seem great to me even though they are a block on many occasions, when you make those anime plays and you feel great xd. . .    &nbsp;"
218649,cyber-dragon-and-cyberdark-brutal-high-atack-deck-218649,CYBER DRAGON AND CYBERDARK!! BRUTAL HIGH ATACK!! DECK,70095155,77334,Non-Meta Decks,"[""33093439"",""70095154"",""70095154"",""5370235"",""5370235"",""5370235"",""3019642"",""41230939"",""77625948"",""45078193"",""45078193"",""45078193"",""82562802"",""82562802"",""82562802"",""23893227"",""23893227"",""23893227"",""3659803"",""37630732"",""37630732"",""60600126"",""60600126"",""60600126"",""63031396"",""63031396"",""63031396"",""63995093"",""63995093"",""63995093"",""86686671"",""86686671"",""86686671"",""32768230"",""32768230"",""32768230"",""55704856"",""64753988"",""64753988"",""64753988"",""81223446"",""81223446"",""81223446""]","[""37542782"",""1546123"",""18967507"",""87116928"",""64599569"",""40418351"",""79229522"",""84058253"",""10443957"",""10443958"",""58069384"",""46724542"",""70369116"",""2220237"",""60303245""]",,1647023905,1 year ago,,,1,cyber dragon and dark vs the melodious and aleister! High Attacks vs Low Attacks !! Who will win? https://youtu.be/0BWOZPjhlJI 0:17 - 1:56 ,"With the new supports the cyberdragon is being widely used, in this duel we will see all the high power of these mechanical dragons !! that my God how they got broken! They go up a lot of attack And you fuse them super easy.    &nbsp;"
