deck_num,pretty_url,deck_name,cover_card,userid,format,main_deck,extra_deck,side_deck,ts_submit_date,submit_date,ts_edit_date,edit_date,comments,deck_excerpt,deck_description
83576,yu-gi-oh-2-cards-infinite-negate-2020-83576,Yu-Gi-Oh 2 Cards Infinite Negate 2020,29587993,21292,Meta Decks,"[""11066358"",""11066358"",""27204311"",""29587993"",""44335251"",""44335251"",""44335251"",""98884569"",""41386308"",""41386308"",""41386308"",""62706865"",""62706865"",""62706865"",""35272499"",""35272499"",""69448290"",""26118970"",""61677004"",""61677004"",""15981690"",""15981690"",""15981690"",""44125452"",""44125452"",""9742784"",""1845204"",""47325505"",""47325505"",""47325505"",""57160136"",""57160136"",""57160136"",""24224830"",""24224830"",""24224830"",""53503015"",""71645242"",""10045474"",""10045474""]","[""76815942"",""53325667"",""21887175"",""85289965"",""4280258"",""72330894"",""21200905"",""50588353"",""50588353"",""50588353"",""83152482"",""65741786"",""85243784"",""41999284"",""60303245""]","[""55063751"",""55063751"",""55063751"",""82385847"",""78661338"",""14558128"",""14558128"",""24508238"",""24508238"",""54693926"",""54693926"",""43711255"",""43711255"",""43711255"",""23002292""]",1615487905,2 years ago,,,0,Infinite Negate using 2 monster,"https://m.youtube.com/watch?v=hU4QuJBhmbQ <p dir=""ltr"">Requirement In this Combo : 1. 1 Monster Tuner/Non-Tuner + 1 Monster Tuner 2. 1 Monster for cost discard</p>"
83573,krawler-deck-2020-83573,KRAWLER deck 2020,66393507,10628,Non-Meta Decks,"[""62587693"",""62587693"",""83477829"",""83477829"",""94142993"",""94142993"",""24158464"",""24158464"",""46083111"",""46083111"",""46083111"",""10698416"",""10698416"",""83293307"",""83293307"",""51205763"",""51205763"",""51205763"",""15710054"",""15710054"",""88316955"",""88316955"",""31706048"",""31706048"",""31706048"",""67831115"",""67831115"",""67831115"",""27705190"",""27705190"",""27705190"",""56294501"",""56294501"",""56294501"",""89320376"",""89320376"",""89320376"",""38699854"",""38699854"",""38699854""]","[""21887175"",""29479265"",""86066372"",""39752820"",""39752820"",""74937659"",""74937659"",""74937659"",""92781606"",""92781606"",""92781606"",""66393507"",""66393507"",""39998992"",""39998992""]","[""55787576"",""55787576"",""55787576"",""57288708"",""57288708"",""57288708"",""14558127"",""14558127"",""14558127"",""26845680"",""26845680"",""26845680"",""83764718"",""99674361"",""99674361""]",1615487905,2 years ago,,,0,Krawler deck by YGO Lite,<a>https://www.youtube.com/watch?v=9MQ8ZYr__og</a>
83566,plunder-patroll-83566,Plunder Patroll,94253655,25309,Meta Decks,"[""63941210"",""93332803"",""28674152"",""31374201"",""31374201"",""31374201"",""68769900"",""68769900"",""68769900"",""55349375"",""55349375"",""55349375"",""81344070"",""81344070"",""81344070"",""14558127"",""14558127"",""35726888"",""35726888"",""49238328"",""49238328"",""73594093"",""73628505"",""44227727"",""44227727"",""44227727"",""24224830"",""24224830"",""80621422"",""80621422"",""93031067"",""93031067"",""93031067"",""10045474"",""10045474"",""10045474"",""43004235"",""20426176"",""20426176"",""20426176""]","[""18832779"",""18832779"",""18832779"",""9464441"",""94253655"",""94253655"",""94253655"",""20248754"",""20248754"",""20248754"",""38342335"",""2857636"",""67647362"",""67647362"",""67647362""]","[""55787576"",""55787576"",""55787576"",""57288708"",""57288708"",""57288708"",""14558127"",""14558127"",""14558127"",""26845680"",""26845680"",""26845680"",""83764718"",""99674361"",""99674361""]",1615487905,2 years ago,,,0,plunder patroll deck,yarrrr!!!!!
83563,ojama-board-lockdown-83563,Ojama Board Lockdown,90502999,25742,Non-Meta Decks,"[""64627453"",""64627453"",""64627453"",""37132349"",""37132349"",""37132349"",""79335209"",""79335209"",""79335209"",""12482652"",""12482652"",""12482652"",""42941100"",""42941100"",""42941100"",""90928333"",""90928333"",""90928333"",""22829942"",""22829942"",""22829942"",""90502999"",""90502999"",""90011152"",""90011152"",""24643836"",""24643836"",""24643836"",""24094653"",""24094653"",""73628505"",""66127916"",""66127916"",""75884822"",""75884822"",""29843091"",""29843091"",""90846359"",""90846359"",""90846359""]","[""90140980"",""90140980"",""40391316"",""40391316"",""39972129"",""55727845"",""12219047"",""4280258"",""85289965"",""2857636"",""38342335"",""34031284"",""34031284"",""66403530"",""49725936""]","[""14558127"",""14558127"",""14558127"",""73642296"",""73642296"",""73642296"",""59438930"",""59438930"",""59438930"",""911883"",""911883"",""911883"",""53334471"",""53334471"",""53334471""]",1615487905,2 years ago,,,1,CHAZZ IT UP!!!!!!!!!!,CHAZZ IT UP!!!!!!!
83558,devil-hero-83558,Devil Hero,19324993,25754,Fun/Casual Decks,"[""21844576"",""58932615"",""84327329"",""20721928"",""86188410"",""14124483"",""40044918"",""40044918"",""50720316"",""27780618"",""27780618"",""27780618"",""58554959"",""58554959"",""45659520"",""45659520"",""95943058"",""95943058"",""13650422"",""13650422"",""13650422"",""50304345"",""50304345"",""27204311"",""12071500"",""12071500"",""12071500"",""94820406"",""94820406"",""72043279"",""18438874"",""8949584"",""64014615"",""64014615"",""48130397"",""24094653"",""81439174"",""32807846"",""81223446"",""81223446""]","[""86165817"",""86165817"",""86676862"",""86676862"",""58332301"",""13293158"",""22160245"",""21947653"",""50282757"",""45170821"",""41209827"",""19324993"",""19324993"",""19324993"",""63813056""]","[""14558127"",""14558127"",""14558127"",""73642296"",""73642296"",""73642296"",""59438930"",""59438930"",""59438930"",""911883"",""911883"",""911883"",""53334471"",""53334471"",""53334471""]",1615487905,2 years ago,,,0,"Since it was easier to align the materials with a hell device, I tried building an E-HERO deck. All types are used.","<span lang=""en"">Since it was easier to align the materials with a hell device, I tried building an E-HERO deck. All types are used.  Super fusion etc. can be used even when Hao Castle is not activated Adration and Starve Venom are used.  Since it can be dropped from EX due to the effect of Haojo, I have adopted a lot of level 8 fusions.  Nibiru tokens will be processed by Super Fusion or Lightning Golem. (If the attack power is low, it can be destroyed by the effect of Bain, but it is not very realistic.)</span>"
83549,gladiator-beast-deck-2020-83549,Gladiator Beast Deck 2020,33652635,24446,Meta Decks,"[""8662794"",""23431858"",""29587993"",""69448290"",""85138716"",""85138716"",""90582719"",""90582719"",""90582719"",""52502677"",""41470137"",""57731460"",""67385964"",""88996322"",""25924653"",""25924653"",""7573135"",""7573135"",""7573135"",""16003979"",""92373006"",""92373006"",""70368879"",""52340444"",""83764719"",""99674361"",""93104632"",""67169062"",""67169062"",""35224440"",""35224440"",""911883"",""911883"",""911883"",""20201255"",""20201255"",""20201255"",""93684009"",""93684009"",""16990348""]","[""30864377"",""48156348"",""33652635"",""27346636"",""63288574"",""60303245"",""98978921"",""83152482"",""50277355"",""66863374"",""66863374"",""72330894"",""84121193"",""48736598"",""4280258""]","[""84899094"",""98159737"",""73356503"",""57288708"",""28400508"",""31226177"",""62000467"",""59934749"",""39752820"",""57103969"",""66290900"",""37520316"",""1845204"",""82732705""]",1615487905,2 years ago,,,0,Gladiator Beast Deck 2020,<a>https://www.youtube.com/watch?v=W4w5PG8oAYc</a>  &nbsp;  https://www.youtube.com/watch?v=W4w5PG8oAYc
83546,ancient-gear-mr5-2020-otk-83546,Ancient Gear MR5 2020 OTK,51788412,18389,Fun/Casual Decks,"[""52481437"",""44874522"",""44874522"",""83104731"",""83104731"",""95735217"",""1953925"",""61912252"",""62034800"",""17663375"",""17663375"",""1278431"",""1278431"",""60953949"",""60953949"",""18486927"",""42878636"",""51916853"",""23002292"",""10045474"",""24224830"",""3659803"",""37630732"",""27847700"",""64061284"",""64061284"",""44052074"",""44052074"",""44052074"",""70147689"",""70147689"",""25274141"",""25274141"",""25274141"",""37694547"",""37694547"",""37694547"",""14532163"",""1845204"",""73628505""]","[""51788412"",""51788412"",""12652643"",""37663536"",""87182127"",""87182127"",""89112729"",""88581108"",""97584719"",""66011101"",""10547580"",""10547580"",""70369116"",""40216089"",""22423493""]","[""82732705"",""15693423"",""10045474"",""53129443"",""54693926"",""54693926"",""14532163"",""24224830"",""35726888"",""90590303"",""55063751"",""27204311"",""14558127"",""94145021"",""70147689""]",1615487905,2 years ago,,,0,Ancient gear MR5 2020 otk nice combos deck,"This a competitive version of AG's deck which is also very fun, with many combos"
83543,six-samurai-83543,Six Samurai,27970830,25108,Meta Decks,"[""83039729"",""15327215"",""2511717"",""2511717"",""49721904"",""49721904"",""49721904"",""74094021"",""74094021"",""48505422"",""48505422"",""71207871"",""6579928"",""6579928"",""72345736"",""72345736"",""72345736"",""27970830"",""47436247"",""47436247"",""47436247"",""54031490"",""54031490"",""54031490"",""33883834"",""53819808"",""53819808"",""32807846"",""33782437"",""45950291"",""67169062"",""67169062"",""70368879"",""73628505"",""83764719"",""99674361"",""9622164"",""31423101"",""34959756"",""65993085""]","[""74752631"",""29981921"",""50954680"",""82044280"",""33198837"",""2956282"",""84013237"",""581014"",""52653092"",""74997493"",""74997493"",""74997493"",""4280258"",""59934749"",""98642179""]","[""74752631"",""44686185"",""33396948"",""7902349"",""44519536"",""70903634"",""8124921"",""29587993"",""69448290"",""79606837"",""48009503"",""64454614"",""83152482"",""71650854"",""98827725""]",1615487905,2 years ago,,,2,The ultimate consistant samurai deck to build awesome boards or FTK. ,"As you can see in the extra deck, i chose to not just use standart extradeck cards like Nibiru, Ash-Blossom, etc. Instead i used the extradeck to give u some variations of the Deck. I built all three options for the TCG, but if u play Online or TCG/OCG, there is a fourth option which includes the Predaplant-Dragun-Engine. Just include DM, RE and R.E.F in the Main-, and Predaplant and Dragun in the Extradeck. (Kick out 3 of the equipspells)  The other two options obviously are Exodia FTK, and Apex Avian Lockdown. Exodia is of course the most inconsistent but still works very well. Apex avian is pretty consistent but i like Zexal best for beeing the most consistent.  Strategy is simple: Summon two samurai, isolde, battle shogun, gateway, skulldeat, generate plus, build a board of naturias, cristalwing, apollousa and zexal."
83540,invoked-kaiju-april-2020-banlist-83540,Invoked Kaiju April 2020 banlist,86120752,24840,Meta Decks,"[""63941210"",""48770333"",""93332803"",""55063751"",""55063751"",""86120751"",""86120751"",""86120751"",""14558127"",""14558127"",""14558127"",""59438930"",""59438930"",""14824019"",""56111151"",""47679935"",""47679935"",""47679935"",""76375976"",""99330325"",""99330325"",""74063034"",""74063034"",""74063034"",""23314220"",""23314220"",""23314220"",""89739383"",""89739383"",""73628505"",""8267140"",""8267140"",""8267140"",""73468603"",""48130397"",""24207889"",""24207889"",""10045474"",""10045474"",""10045474""]","[""75286621"",""75286621"",""41209827"",""12307878"",""12307878"",""49513164"",""54757758"",""13529466"",""31833038"",""85289965"",""97973962"",""2220237"",""50277355"",""60303245"",""12307878""]","[""63941210"",""36956512"",""36956512"",""29726552"",""67750322"",""67750322"",""20366274"",""85908279"",""94977269"",""63519819"",""1845204"",""24224830"",""24224830"",""15693423"",""15693423""]",1615487905,2 years ago,,,0,This is an invoked kaiju deck that is based on fusion summoning. The spellbook engine improves the consistency of the deck and the kaijus can eliminat,"This is an invoked kaiju deck that is based on fusion summoning. The spellbook engine improves the consistency of the deck and the kaijus can eliminate big threats on the board. Mystic mine is used here to stall when you don't have a good play and handtraps to control the board. There can only be one is a useful trap against many matchups like pure Blue Eyes or Dark magician.  My rating:  Attack: 3/5  Defense: 5/5  Consistency: 4/5  Strong Against: Decks with only 1 or 2 types, Gren Maju, Dark Magician  Weak Against: Virus Control, Nekroz  Small combos:  Normal summon Aleister (or use Magical Meltdown to search him)  Activate his effect, get an invocation into the hand  Link Aleister into Almiraj  Link Almiraj into Gardna  Fusion summon Purgatrio with Aleister and Almiraj in the GY, banishing them  Add Aleister from the banished zone to hand by shuffling invocation into deck  Spellbook combo:  Activate Spellbook of secrets, bring blue boy into hand  Normal summon blue boy, bring Spellbook of knowledge into hand  Send blue boy to the GY with Spellbook of knowledge's effect and draw 2 cards  &nbsp;  This is a really fun deck if you play it correctly. Have fun!"
83537,kingdg-blue-danger-83537,kingdg blue danger,89631146,25749,Non-Meta Decks,"[""89631139"",""89631139"",""89631139"",""38517737"",""38517737"",""38517737"",""45467446"",""88774734"",""88774734"",""51786039"",""55878039"",""82301904"",""79814787"",""79814787"",""79814787"",""71039903"",""71039903"",""43316238"",""43316238"",""43316238"",""90807199"",""90807199"",""90807199"",""43694650"",""83518674"",""70711847"",""52350806"",""14558127"",""14558127"",""44935634"",""60071928"",""9742784"",""76218313"",""38120068"",""38120068"",""38120068"",""39701395"",""48800175"",""48800175"",""48800175"",""41620959"",""6853254"",""6853254"",""6853254"",""83764719""]","[""57314798"",""97403510"",""2978414"",""8165596"",""63767246"",""28400508"",""33698022"",""40908371"",""85289965"",""83152482"",""94259633"",""60303245""]","[""63941210"",""36956512"",""36956512"",""29726552"",""67750322"",""67750322"",""20366274"",""85908279"",""94977269"",""63519819"",""1845204"",""24224830"",""24224830"",""15693423"",""15693423""]",1615487905,2 years ago,,,0,blue  eyes danger dack,summon blueyes
83532,neo-kaibaman-83532,Neo Kaibaman,34627841,23649,Anime Decks,"[""89631139"",""89631139"",""89631139"",""64202399"",""57043986"",""45467446"",""17444133"",""95492061"",""8978197"",""8978197"",""8978197"",""15717011"",""79109599"",""34627841"",""34627841"",""34627841"",""73398797"",""73398797"",""70828912"",""17655904"",""71867500"",""71867500"",""79571449"",""83764719"",""43845801"",""24094653"",""24094653"",""55144522"",""43973174"",""43973174"",""48800175"",""95286165"",""2783661"",""5318639"",""71143015"",""9786492"",""9786492"",""35539880"",""97077563"",""56920308""]","[""23995346"",""23995346"",""23995346""]","[""63941210"",""36956512"",""36956512"",""29726552"",""67750322"",""67750322"",""20366274"",""85908279"",""94977269"",""63519819"",""1845204"",""24224830"",""24224830"",""15693423"",""15693423""]",1615487905,2 years ago,1665599905,5 months ago,0,Kaibaman's deck updated. Trying to bring the best out of his character deck whilst keeping it in the GX era.,"<p><img class=""aligncenter"" src=""https://pbs.twimg.com/media/Cw7c7vcXEAA2GlX.jpg"" alt="""" width=""397"" loading=""lazy"" /></p><p>The Legend of Kaibaman, Kaibaman's deck updated. Trying to bring the best out of his character deck whilst keeping it in the GX era so no Synchro, Xyz, Pendulum or Link monsters.</p><p>let me know if you've got any ideas to improve it.</p>"
83529,neo-osamu-83529,Neo Osamu,36021814,23649,Anime Decks,"[""32274490"",""32274490"",""32274490"",""90243945"",""90243945"",""90243945"",""40991587"",""40991587"",""40991587"",""6128460"",""6128460"",""6128460"",""22339232"",""22339232"",""22339232"",""36021814"",""36021814"",""36021814"",""57473560"",""57473560"",""57473560"",""90434926"",""90434926"",""44762290"",""44762290"",""70828912"",""2204140"",""31036355"",""81439173"",""79571449"",""83764719"",""2295440"",""55144522"",""51405049"",""48976825"",""5318639"",""64014615"",""31550470"",""85742772"",""85742772""]","[""23995346"",""23995346"",""23995346""]","[""63941210"",""36956512"",""36956512"",""29726552"",""67750322"",""67750322"",""20366274"",""85908279"",""94977269"",""63519819"",""1845204"",""24224830"",""24224830"",""15693423"",""15693423""]",1615487905,2 years ago,1675967905,1 month ago,0,Osamu's deck updated. Trying to bring the best out of his character deck whilst keeping it in the GX era.,"<p><img class=""aligncenter"" src=""https://vignette.wikia.nocookie.net/yugioh/images/7/71/Osamu.jpg/revision/latest/top-crop/width/360/height/450?cb=20070618165835"" alt="""" width=""230"" loading=""lazy"" /></p><p>Undead Servants, Osamu's deck updated. Trying to bring the best out of his character deck whilst keeping it in the GX era so no Synchro, Xyz, Pendulum or Link monsters.</p><p>let me know if you've got any ideas to improve it.</p>"
83520,salamangreat-83520,Salamangreat,31313405,25747,Meta Decks,"[""20618081"",""89662401"",""94620082"",""94620082"",""26889158"",""56003780"",""56003780"",""52277807"",""52277807"",""52277807"",""14558127"",""14558127"",""97268402"",""97268402"",""24508238"",""94145021"",""39732186"",""39732186"",""80794697"",""80794697"",""80794697"",""16188701"",""16188701"",""52155219"",""1295111"",""64178424"",""64178424"",""57160136"",""57160136"",""57160136"",""81439173"",""83764719"",""24224830"",""24224830"",""14934922"",""14934922"",""51339637"",""51339637"",""35261759"",""35261759"",""10045474"",""40605147""]","[""14812471"",""14812471"",""14812471"",""87871125"",""87871125"",""87871125"",""41463181"",""41463181"",""31313405"",""31313405"",""46947713"",""85289965"",""88093706"",""21044178"",""90590303""]","[""15693423"",""15693423"",""15693423"",""83326048"",""83326048"",""83326048"",""54693926"",""54693926"",""54693926"",""43898403"",""43898403"",""43898403"",""27204311"",""27204311"",""8267140""]",1615487905,2 years ago,,,0,Tier - 1 Deck. It is Consistent and Durable against the Meta.,"This is a version of Salads (Salamangreats) that doesn’t have Apollousa for those that can’t afford to buy a card(s) that expensive. This deck is very consistent and it’s durability is crazy good.  The main strategy is to set up a defensive board first turn to help with disrupting or going for the OTK on your next turn. If you’re going Second, You can play still play defensive, still go for the OTK, or remove their board and have some offense but not an OTK.  &nbsp;  Depending on who you are facing and/or what you have in your hand determines what 1 of 3 ways that you can will set up your board. Regardless of either, always try to get the Rage or Roar if You did not draw into them.  1) Get Bagooska our in defense mode. Yes this will effect you as well, but you can easily work around it because most of your Salad monsters effects activate in grave and once you have your Links, you don’t have to worry  2) Bring our Abyss Dweller to disrupt your opponent from activating effects from grave.  3) Bring our Transcode Talker and co-link with Wolf. If you send Roar or Rage to grave, don’t Reincarnate Wolf until you bring him back out with Transcode Talker. If you are getting Roar, use Wolfs effect not Roar’s so that it doesn’t get banished yet. I would only use Roar’s effect if I reincarnate a different Salad Link or if I have both Rage and Roar in grave. Which in that case, get Rage with Wolf’s effect and then Roar via reincarnation.  I have Knightmare Unicorn for those monsters that can’t be destroyed by battle/card effects.  As for the side deck, use what you have that is good against the meta. I’m gonna place what I am able to use.  I don’t use Knightmare Phoenix or Hiita because I found myself barely going into them. Sometimes it wasn’t helpful or it would’ve disruptive to me to bring them out, so I took them out and don’t regret it."
83496,upcoming-competitive-fish-spam-deck-83496,UPCOMING COMPETITIVE FISH SPAM DECK,88307361,21784,Non-Meta Decks,"[""27204311"",""88307361"",""88307361"",""7150545"",""89617515"",""89617515"",""89617515"",""11845050"",""49930315"",""49930315"",""423585"",""423585"",""423585"",""24557335"",""24557335"",""24557335"",""14558127"",""14558127"",""59438930"",""85914562"",""6625096"",""6625096"",""6625096"",""97268402"",""97268402"",""97268402"",""1845204"",""2295440"",""18144506"",""19885332"",""22123627"",""70368879"",""81439174"",""83764719"",""8267140"",""24224830"",""65681983"",""65681983"",""10045474"",""10045474""]","[""54757758"",""9464441"",""63410069"",""440556"",""32530043"",""61399402"",""66011101"",""90809975"",""26973555"",""65305468"",""86066372"",""38342335"",""45819647"",""2857636"",""50588353""]","[""27204311"",""27204311"",""55063751"",""55063751"",""21044178"",""14532163"",""14532163"",""54693926"",""54693926"",""54693926"",""15693423"",""15693423"",""15693423"",""43262273"",""43262273""]",1615487905,2 years ago,,,0,"One of the reason why Toadally Awesome got limited, Deadreef the Ephemeral Fish can easily dump Superancient Deepsea King Coelacanth and reviving it w","Fish will be viable once Rise of the Duelists card hits the market (TCG is still missing Number F0: Utopic Future Dragon tho). Combo is kinda consistent, because its only <strong>Deadreef+any lv4</strong>. So we play 3 Deadreef (dumps ""big fish""), 3 Beautunaful Princess + 1 One for One, 2-3 Summoner Monk (searches Deadreef and fulfilling the combo but needs spell in hand), therefore we play roughly 9 Deadreef and the rest is just lv4 water extender.  The combo is we summon Dugares (on extra zone) with Deadreef (after sending big fish) + any lv4, use Dugares revive big fish, use big fish discard 1, ss 4 fishes from deck (preferably every copy of Deadreef in our deck as it provides us draw from GY), make Bahamut Shark ss Toadally, make Gallant Granite search Adaman Researcher (or Nibiru if we draw Researcher), ss Researcher, make F0 with Gallant + Bahamut, make Halqifibrax with Researcher + Dugares, ss O-Lion, make Crocodragon with O-Lion + big fish, use Crocodragon draw and chain O-Lion ss lv3 wind machine token. Now you can use Deadreef draw from GY, making us draw 2 in total from our combo.  On opponent's main phase, we can banish Halqifibrax for any synchro tuner (can be anything, depends on you) while having the lv3 wind machine token as the non-tuner for synchro summoning during your opponent's turn. Some synchro tuner can be used during your opponent's battle phase (like Crystron Quandax).  <img src=""https://ms.yugipedia.com//thumb/9/94/Shark-MDDG.png/257px-Shark-MDDG.png"" alt=""image"" />  Expected board:  <img src=""https://i.imgur.com/IDnCQOG.png"" alt=""image"" />  Replay:<a> https://bit.ly/3bwIc9o</a> (you can replace Dragite with any synchro tuner play)  Pros: Good consistency, multiple negations and disruptions, able to run Deepsea Minstrel to see and snipe opponent's hand, can run bunch of handtraps.  Cons: 2 cards combo, follow up play aint too good, Dugares effect skips your next main phase 1, Beautunaful Princess misses timing if summoned with White Mirror.  Cards to think of: Silent Angler (good lv4 water extender but conflicts with Researcher), other sharks (most of it aint too good), other synchro plays (I put the example on side deck)."
83492,infinite-negate-blackwings-april-mr5-83492,Infinite Negate Blackwings April MR5,54082269,25740,Fun/Casual Decks,"[""81470373"",""81470373"",""81105204"",""81105204"",""81105204"",""49003716"",""49003716"",""49003716"",""14785765"",""17465972"",""17465972"",""17465972"",""2009101"",""2009101"",""2009101"",""89258906"",""89258906"",""77152542"",""77152542"",""67692580"",""52869807"",""73652465"",""22835145"",""69448290"",""29587993"",""1475311"",""1475311"",""1475311"",""67169062"",""23581825"",""24224830"",""24224830"",""24224830"",""91351370"",""91351370"",""91351370"",""10045474"",""10045474"",""40605147"",""40605147""]","[""54082269"",""54082269"",""27548199"",""95040215"",""16051717"",""81983656"",""73580471"",""10443957"",""21044178"",""55285840"",""73347079"",""85289965"",""72330894"",""83152482"",""36429703""]","[""76218313"",""27204311"",""14558127"",""14558127"",""54693926"",""14532163"",""12580477"",""54974237"",""54974237"",""83326048"",""83326048"",""15693423"",""23516703"",""58921041"",""23002292""]",1615487905,2 years ago,,,0,Tested the hell out of this deck to make it conisistent.,The Infinite Imperms &amp; Solemn Strikes can be exchanged for Forbidden Chalice if preferred.  Deck is fairly consistent in building the Infinite Negate Loop + Cyber Dragon Infinity.  Was able to build the board 43 out of 50 times from my test hands. Deck is also built for 2 different routes just in case the Infinite Negate route isnt possible. Infinite Negate route or Simoon route.  Here are some videos for the Simoon Routes: <a>https://www.youtube.com/watch?v=wCjLor4xL0o</a> <a>https://www.youtube.com/watch?v=PjllUwGrFdQ</a>
