deck_num,pretty_url,deck_name,cover_card,userid,format,main_deck,extra_deck,side_deck,ts_submit_date,submit_date,ts_edit_date,edit_date,comments,deck_excerpt,deck_description
230997,ninjas-but-they-are-semi-viable-230997,Ninjas - But They Are Semi-Viable,95027497,29443,Non-Meta Decks,"[""69072185"",""69072185"",""32687071"",""14558127"",""14558127"",""14558127"",""97268402"",""97268402"",""97268402"",""95027497"",""95027497"",""95027497"",""79441381"",""79441381"",""79441381"",""58911105"",""58911105"",""58911105"",""64749612"",""64749612"",""64749612"",""26232916"",""26232916"",""26232916"",""32807846"",""36975314"",""36975314"",""36975314"",""10045474"",""10045474"",""10045474"",""74003290"",""74003290"",""74003290"",""13629812"",""13629812"",""13629812"",""90200789"",""90200789"",""90200789""]","[""21044178"",""82944432"",""82633039"",""84013237"",""86532744"",""56832966"",""85289965"",""98642179"",""11516241"",""75452921"",""2857636"",""38342335"",""37354507"",""37354507"",""30163008""]","[""34267821"",""34267821"",""34267821"",""11366199"",""94145021"",""94145021"",""94145021"",""90247311"",""90247311"",""43898403"",""43898403"",""43898403"",""70861343"",""70861343"",""70861343""]",1647023905,1 year ago,,,0,I- I made ninjas kinda playable. . .,"So basically you are making Goliath with super transformation. In the side deck, there is a way to get into Dark Simorgh against back row decks. You can put ani-spell to synergize with the Dark Simorgh if you would like, but I found it not necessary. The overall goal is to get to Goliath or Sloth.  <strong>Pros: </strong>The deck actually has a surprisingly good win rate! The field spell can allow for your Saizo to become similar to a towers as long as you have a monster onboard and a ninja in the grave witch can be very useful. I've won games because my opponent cannot out Saizo and then I just drop a Goliath and win. This deck is NOT an aggressive deck and you win by staying up in resources. I find the deck very fun, and it does amazing in the grind game.  <strong>Cons: </strong>It is very meta-dependent. It is good against certain decks in our format, but that changes depending on the match-up. It does not have a great match-up against drytron and against flundereeze, the idea is to stop extra deck decks from going into the extra deck, but any level one decks also are not great because you have to improvise to get into Goliath/Sloth (I once pen summoned tribute fodder for my sloth using two monsters in my deck that just happened to be scales). Lastly, it struggles with monster removal.  <strong>Conclusion: </strong>The deck actually puts up a decent fight against most decks but is very meta-dependent. I hope you have fun with the deck! Feedback is greatly appreciated!"
230990,budget-machina-230990,budget machina,87074380,16574,Non-Meta Decks,"[""46033517"",""87074380"",""87074380"",""87074380"",""52481437"",""52481437"",""13647631"",""13647631"",""13647631"",""69838761"",""69838761"",""51617185"",""50863093"",""50863093"",""50863093"",""23469398"",""23469398"",""23469398"",""5556499"",""5556499"",""5556499"",""88875132"",""88875132"",""45674286"",""45674286"",""42940404"",""42940404"",""42940404"",""85136114"",""85136114"",""83764719"",""86852702"",""86852702"",""86852702"",""25274141"",""25274141"",""25274141"",""13247801"",""59741415"",""59741415""]","[""84025439"",""26096328"",""66523544"",""21858819"",""49032236"",""56910167"",""90162951"",""93854893"",""10678778"",""28912357"",""28912357"",""8387138"",""38342335"",""2857636"",""146746""]","[""34267821"",""34267821"",""34267821"",""11366199"",""94145021"",""94145021"",""94145021"",""90247311"",""90247311"",""43898403"",""43898403"",""43898403"",""70861343"",""70861343"",""70861343""]",1647023905,1 year ago,,,0,"machina budget deck no zeus no forbidden droplet,... ","machina budget deck no zeus no forbidden droplet,..."
230986,abc-albaz-broken-230986,ABC ALBAZ BROKEN,1561110,8997,Non-Meta Decks,"[""68468459"",""68468459"",""30012506"",""30012506"",""30012506"",""77411244"",""77411244"",""77411244"",""3405259"",""3405259"",""3405259"",""62962630"",""62962630"",""99249638"",""70095154"",""14558127"",""14558127"",""56364287"",""97268402"",""97268402"",""44362883"",""44362883"",""44362883"",""73628505"",""81439173"",""84211599"",""84211599"",""84211599"",""12524259"",""12524259"",""12524259"",""24224830"",""36637374"",""36637374"",""36637374"",""65681983"",""65681983"",""65681983"",""66399653"",""66399653"",""66399653"",""10045474"",""10045474""]","[""1561110"",""1561110"",""1561110"",""44146295"",""44146295"",""87746184"",""87746184"",""84058253"",""86066372"",""4280258"",""38342335"",""2857636"",""40216089"",""65741786"",""70369116""]","[""46659709"",""87116928"",""37818794"",""70534340"",""68431965"",""10443957"",""73289035"",""66011101"",""50588353"",""71095768"",""5288597"",""25311006"",""52947044"",""73468603""]",1647023905,1 year ago,,,0,ABC ALBAZ BROKEN,https://youtu.be/chCYWIuUGgE
230981,blue-eyes-choas-competitive-deck-230981,Blue-Eyes Choas Competitive deck,20654247,90739,Non-Meta Decks,"[""89631139"",""89631139"",""64202399"",""38517737"",""20654247"",""88241506"",""88241506"",""88241506"",""8240199"",""8240199"",""8240199"",""45644898"",""71039903"",""71039903"",""71039903"",""97268402"",""97268402"",""97268402"",""4538826"",""73468603"",""73628505"",""62265044"",""62265044"",""62265044"",""24382602"",""24382602"",""24382602"",""2295440"",""83764719"",""48130397"",""48130397"",""48130397"",""21082832"",""84211599"",""84211599"",""56920308"",""56920308"",""56920308"",""62089826"",""62089826"",""62089826""]","[""94259633"",""41999284"",""50588353"",""50091196"",""63410069"",""33698022"",""87188910"",""59822133"",""40908371"",""84815190"",""41578483"",""49161188"",""69946549"",""41209827"",""54757758""]","[""46659709"",""87116928"",""37818794"",""70534340"",""68431965"",""10443957"",""73289035"",""66011101"",""50588353"",""71095768"",""5288597"",""25311006"",""52947044"",""73468603""]",1647023905,1 year ago,,,0,Blue eyes meta breaker,"Me and my friends got murdered in a tournament a few days ago, so I stayed up for 3 days building this.  The goal of this deck is to get out the Blue-Eyes Chaos dragon, most people will say it is the boss monster of this deck. The best way to get this monster out is by using the effect of the Blue-Eyes Abyss Dragon. I use the White Stone of Ancients to special summon it during the end phase which adds chaos form to my hand, then since it is the end phase I also add the Blue-Eyes Chaos Dragon to my hand. Next turn use a Blue-Eyes White Dragon to tribute with chaos form (alternative's name becomes blue eyes white dragon so that's a good choice). Once it is one the field it is usually game over, this deck has a dozen ways protect it so no need to worry. If you build this good luck."
230977,ogdoadic-dark-reptile-2021-230977,OGDOADIC Dark Reptile 2021,98787535,10628,Non-Meta Decks,"[""97565997"",""61160289"",""34172284"",""98787535"",""62383431"",""62383431"",""47077697"",""58066722"",""35998832"",""35998832"",""84900597"",""62405028"",""62405028"",""62405028"",""36010310"",""36010310"",""36010310"",""86469231"",""86469231"",""86469231"",""99745551"",""14558127"",""14558127"",""73642297"",""73642297"",""17189677"",""17189677"",""17189677"",""24050692"",""24050692"",""24050692"",""81439173"",""83764718"",""24299458"",""24299458"",""91231901"",""96203584"",""96203584"",""10045474"",""10045474""]","[""90448279"",""73082255"",""63767246"",""93854893"",""11398059"",""11398059"",""86066372"",""4280258"",""1487805"",""38342336"",""2857636"",""74974229"",""75452921"",""8602351"",""8602351""]","[""97565997"",""97565997"",""61160289"",""34172284"",""98787535"",""98787535"",""62383431"",""59160188"",""59160188"",""60448701"",""60448701"",""17490535"",""100286008"",""100286008"",""100286008""]",1647023905,1 year ago,,,0,Ogdoadic deck by YGO Lite,https://youtu.be/TG-tNAfvRS4
230973,witchcrafter-dec-2021-230973,witchcrafter (Dec 2021),21522601,50577,Non-Meta Decks,"[""21522601"",""21522601"",""84523092"",""71074418"",""58139997"",""21744288"",""21744288"",""21744288"",""95245544"",""95245544"",""64756282"",""64756282"",""64756282"",""59851535"",""14558127"",""14558127"",""14558127"",""68462976"",""68462976"",""68462976"",""57916305"",""57916305"",""57916305"",""83301414"",""83301414"",""70226289"",""70226289"",""10805153"",""10805153"",""10805153"",""83289866"",""19673561"",""88616795"",""88616795"",""88616795"",""35098357"",""35098357"",""35098357"",""73594093"",""24224830"",""81439173"",""73628505"",""58577036"",""74402414"",""74402414"",""74402414"",""55072170"",""94553671"",""94553671"",""94553671""]","[""9603252"",""9603252"",""9603252"",""28776350"",""28776350"",""86066372"",""4280258"",""34755994"",""91336701"",""94259633"",""94259633"",""45819647"",""48815792"",""9839945"",""30674956""]","[""8487449"",""58139997"",""71074418"",""21522601"",""97631303"",""97631303"",""97631303"",""49941059"",""43898403"",""56894757"",""70226289"",""27243130"",""58851034"",""23516703""]",1647023905,1 year ago,,,0,witchcrafter (Dec 2021),witchcrafter (Dec 2021)
230969,furry-warrior-230969,Furry -Warrior,63972571,18247,Non-Meta Decks,"[""69247929"",""69247929"",""69247929"",""78651105"",""78651105"",""78651105"",""77121851"",""77121851"",""16956455"",""16956455"",""16956455"",""76909279"",""76909279"",""76909279"",""63749102"",""63749102"",""63749102"",""88975532"",""88975532"",""88975532"",""90582719"",""90582719"",""87910978"",""87910978"",""83764719"",""72302403"",""73628505"",""61166988"",""61166988"",""56594520"",""56594520"",""98045062"",""98045062"",""5318639"",""5318639"",""43898403"",""19578592"",""19578592"",""44095762"",""44095762"",""53582587"",""88279736"",""88279736"",""41420027"",""41420027""]","[""9603252"",""9603252"",""9603252"",""28776350"",""28776350"",""86066372"",""4280258"",""34755994"",""91336701"",""94259633"",""94259633"",""45819647"",""48815792"",""9839945"",""30674956""]","[""8487449"",""58139997"",""71074418"",""21522601"",""97631303"",""97631303"",""97631303"",""49941059"",""43898403"",""56894757"",""70226289"",""27243130"",""58851034"",""23516703""]",1647023905,1 year ago,,,0,Test warrior beast,Test deck Beast warrior v1*
230964,machina-ruinforce-otk-antimeta-230964,MACHINA RUINFORCE OTK / ANTIMETA,46033517,56479,Non-Meta Decks,"[""46033517"",""46033517"",""46033517"",""63941210"",""63941210"",""87074380"",""52481437"",""52481437"",""69838761"",""69838761"",""50863093"",""50863093"",""50863093"",""23469398"",""23469398"",""23469398"",""5556499"",""5556499"",""45674286"",""45674286"",""62034800"",""62034800"",""85136114"",""85136114"",""35645105"",""35645105"",""72892473"",""81439173"",""18144507"",""86852702"",""86852702"",""86852702"",""25274141"",""25274141"",""41420027"",""40605147"",""40605147"",""10045474"",""10045474"",""53582587"",""53582587""]","[""90448279"",""90448279"",""49032236"",""56910167"",""56910167"",""85289965"",""86066372"",""38342335"",""38342335"",""2857636"",""2857636"",""22423493"",""22423493"",""4280258""]","[""77585513"",""77585513"",""77585513"",""84636823"",""84636823"",""84636823"",""14532163"",""43898403"",""43898403"",""61740673"",""77538567"",""77538567"",""77538567"",""41420027"",""41420027""]",1647023905,1 year ago,,,0,Machina ruinforce OTK deck with antimeta side deck. We have a YOUTUBE channel where you can see Yugioh decks! https://www.youtube.com/watch?v=A3Brwj2W,"Hi! We explain our deck on our Youtube channel TRYNDAWARRIOR93.  This deck is focused on summon ruinforce to OTK. We have different ways to send it to GY like foolish burial, LV8 summoned discarding from hand, machina unclaspare, etc.  In addition, we mix with infinitrack because make too easy summon Zeus making 8 + 4 (with anchor drill) or 10 + 2 (with citadel or ruinforce).  On this deck is too easy summon with links like Apollousa, Acesscode talker or Borrelsword.  Finally the side deck is thought to stop enemies limiting their spell cards or trap cards and negating summons with Jinzo and Spell Canceller both monsters are machina and make well combo with our ruinforce.  We hope you like it!!!  Write your deck strategy here..."
230955,machina-ruinforce-otk-antimeta-230955,MACHINA RUINFORCE OTK / ANTIMETA,46033517,56479,Non-Meta Decks,"[""46033517"",""46033517"",""46033517"",""63941210"",""63941210"",""87074380"",""52481437"",""52481437"",""69838761"",""69838761"",""50863093"",""50863093"",""50863093"",""23469398"",""23469398"",""23469398"",""5556499"",""5556499"",""45674286"",""45674286"",""62034800"",""62034800"",""85136114"",""85136114"",""35645105"",""35645105"",""72892473"",""81439173"",""18144507"",""86852702"",""86852702"",""86852702"",""25274141"",""25274141"",""41420027"",""40605147"",""40605147"",""10045474"",""10045474"",""53582587"",""53582587""]","[""90448279"",""90448279"",""49032236"",""56910167"",""56910167"",""85289965"",""86066372"",""38342335"",""38342335"",""2857636"",""2857636"",""22423493"",""22423493"",""4280258""]","[""77585513"",""77585513"",""77585513"",""84636823"",""84636823"",""84636823"",""14532163"",""43898403"",""43898403"",""61740673"",""77538567"",""77538567"",""77538567"",""41420027"",""41420027""]",1647023905,1 year ago,,,0,Machina Ruinforce OTK with antimeta side deck. Watch our youtube channel TRYNDAWARRIOR93!!!,"Hi! We explain our deck on our Youtube channel TRYNDAWARRIOR93.  This deck is focused on summon ruinforce to OTK. We have different ways to send it to GY like foolish burial, LV8 summoned discarding from hand, machina unclaspare, etc.  In addition, we mix with infinitrack because make too easy summon Zeus making 8 + 4 (with anchor drill) or 10 + 2 (with citadel or ruinforce).  On this deck is too easy summon with links like Apollousa, Acesscode talker or Borrelsword.  Finally the side deck is thought to stop enemies limiting their spell cards or trap cards and negating summons with Jinzo and Spell Canceller both monsters are machina and make well combo with our ruinforce.  We hope you like it!!!"
230951,kuriboh-230951,Kuriboh,40640059,95836,Non-Meta Decks,"[""40640057"",""40640057"",""78355370"",""78355370"",""78355370"",""33245030"",""33245030"",""33245030"",""57116033"",""57116034"",""57116033"",""57116034"",""57116033"",""57116034"",""2830693"",""2830693"",""2830693"",""67284107"",""67284107"",""67284107"",""19665973"",""19665973"",""19665973"",""45452224"",""45452224"",""45452224"",""102380"",""102380"",""102380"",""73915051"",""20065322"",""20065322"",""20065322"",""89086566"",""40703222"",""72302403"",""51405049"",""51405049"",""70342110"",""93895605"",""93895605"",""62279055"",""62279055"",""62279055"",""44095762"",""98427577"",""36361633""]","[""41999284"",""10669138"",""48608796"",""48608796"",""48608796"",""8491961"",""54366836""]","[""77585513"",""77585513"",""77585513"",""84636823"",""84636823"",""84636823"",""14532163"",""43898403"",""43898403"",""61740673"",""77538567"",""77538567"",""77538567"",""41420027"",""41420027""]",1647023905,1 year ago,,,0,Kuriboh,"This deck was made a few years ago and was meant to be cheap so it doesn't have any of the new monsters.  The point of the deck is to stall while dealing effect damage, direct attacks, and generally frustrating your opponents. When I first made the deck, it won pretty frequently both online and in real life (still does).  You can experiment with your own traps since I just threw in what I had, and they work well.  The extra deck can also be expanded on, I just never really felt the need.  There are no boss monsters to this deck"
230945,witchcrafter-2021-december-support-test-230945,Witchcrafter 2021 December - Support test,9603252,47227,Non-Meta Decks,"[""49036338"",""71074418"",""21522601"",""84523092"",""84523092"",""21744288"",""21744288"",""21744288"",""95245544"",""59851535"",""38814750"",""38814750"",""38814750"",""64756282"",""64756282"",""64756282"",""35098357"",""57916305"",""57916305"",""57916305"",""70226289"",""70226289"",""70226289"",""83301414"",""83301414"",""83301414"",""83289866"",""40252269"",""40252269"",""40252269"",""87769556"",""13758665"",""48130397"",""48130397"",""48130397"",""1845204"",""73594093"",""58577036"",""24224830"",""94553671""]","[""63519819"",""41578483"",""54757758"",""41209827"",""9603252"",""9603252"",""3040496"",""41999284"",""34755994"",""48815792"",""97661969"",""8802510"",""70369116"",""45819647"",""86066372""]","[""97631303"",""97631303"",""97631303"",""84211599"",""84211599"",""84211599"",""56894757"",""95793022"",""74889525"",""18514525"",""94977270"",""9839945"",""8264361"",""30674956"",""73309655""]",1647023905,1 year ago,,,1,"The deck plays the standard original playstyle of Witchcrafters, removing the janky spell chronicle portion and playing a slower control/board-breakin","<span>The deck plays the standard original playstyle of Witchcrafters, removing the janky spell chronicle portion and playing a slower control/board-breaking build that plays well both going first and second. For those who don't know, the deck consists of spellcasters of various levels and attributes that activate their effects by discarding spell cards from your hand, this makes them seem resource intensive but all the archetype spells can add themselves back to the hand during your end phase. With the inclusion of the new fusion, the deck became much stronger even though the fusion spell is sort of mediocre. I found the deck suitable as a control deck that uses the extra deck as a toolbox, hence I chose not to run neither extravagance nor prosperity in the main deck as of the current moment.   </span>  <span><b>Deck starters going first</b><strong>:</strong></span>  <span><strong> Witchcrafters</strong> <strong>(level4 &amp; under):</strong> they tribute themselves and discard any spell to special summon another Witchcrafter of any level from deck; due to this they are very fragile to handtraps and negation, hence playing gamma and driver is necessary in this deck, and going into <a data-name=""Chaos ruler"">Chaos ruler</a> can help fill your GY with cards.</span>  <span><strong>- Witchcrafter Unveiling : </strong>Special summon any Witchcrafter monster in hand and can give your monsters immunity when activating their effects, the Witchcraft monsters already dodge <em><strong><a data-name=""Infinite Impermanence"">Infinite Impermanence</a></strong></em> and <strong><em><a data-name=""Skill drain"">Skill drain</a></em></strong> well, they have a problem with handtraps, this can help play around them. </span>  <span><strong>-Reasoning: </strong>Automatic inclusion in the deck as they are diverse in levels and the smaller Witchcrafters have effects in the GY, you also don't mind having the in-theme spells and monsters in GY, as you can banish a spell along with <em><strong><a data-name=""Witchcrafter &lt;a data-name=&quot;Genni&quot;&gt;Genni&lt;/a&gt;"">Witchcrafter </a><a data-name=""Genni"">Genni</a> </strong></em>to extend play; recovery of card with <em><strong><a data-name=""Witchcrafter Potterie"">Witchcrafter Potterie</a> </strong></em>with an empty hand; <em><strong><a data-name=""Magician's Restage"">Magician's Restage</a></strong></em> can activate adding the floodgate hands; worst case scenario the spells add themselves to hand at the End-phase when you at least placed a boss card on the field.</span>  <span><strong>-Gamma and Driver : </strong>mentioned a couple of times already, together they can help you go into chaos ruler and fill your GY, and they can also go into a link 2 like <a data-name=""Lyna the light charmer"">Lyna the light charmer </a>or <a data-name=""lambda"">lambda</a> and build up into a <a data-name=""Selene, Queen of the master magicians"">Selene, Queen of the master magicians</a> for an OTK.</span>  <span><b>-Magicians' Soul : </b>Sends <strong><em>Witchcrafter</em> <em>Hanie</em></strong> or <strong><em>Madame Verre</em></strong> from deck to GY as cost, but also a free special summon with <a data-name=""Anima"">Anima</a> and <a data-name=""Linkuriboh"">Linkuriboh</a> as a tech option, being a (Dark) [Spellcaster] makes it a wonderful inclusion in the deck with the <em><strong><a data-name=""Witchcrafter Confusion"">Witchcrafter Confusion</a> spell</strong> </em>and a <em><strong><a data-name=""Super polymerization"">Super polymerization</a></strong></em> target. It can also be re-summoned by restage, and last but not least it helps you draw cards by discarding and/or sending spells from field or hands. All around good card that could be a staple in the main deck.</span>  <span><b>Deck starters going Second</b><strong>:</strong></span>  <span><strong>-Super Polymerization: </strong>it is an absolute beast of a card this meta, with a diverse set of targets that can hit most of the meta decks, best thing is there is little your opponent can do against you, they can't even play <em><strong><a data-name=""secret village of spellcasters"">secret village of spellcasters</a></strong></em> against you, this is especially useful because people are not ending on large boards with many negates this format, so super poly can hit <strong>invoked-Dogmatika</strong><em>(<a data-name=""Shaddoll Winda"">Shaddoll Winda</a> - <a data-name=""Mudragon"">Mudragon</a> - <a data-name=""Witchcrafter vice-master"">Witchcrafter vice-master</a>)</em> <a data-name=""&lt;strong&gt;Eldlich&lt;/strong&gt;&lt;em&gt;(the mad golden lord&lt;/em&gt;""><strong>Eldlich</strong><em>(the mad golden lord</em></a><em>) </em><strong>Prank-kids </strong><em>(<a data-name=""Rocket ride"">Rocket ride</a>) </em><strong>Tribrigade/birds</strong><em>(<a data-name=""Guardragon Almarduk"">Guardragon Almarduk</a>) </em><strong>Common Dark types can be beat with starving venom/<a data-name=""Predaplant Triphyoveretum"">Predaplant Triphyoveretum</a>/<a data-name=""Predaplant Dracostapelia"">Predaplant Dracostapelia</a>(live-twins,DPE, etc........ </strong><em><strong>Swordsoul</strong> is probably the most difficult deck to out.</em></span>  <span><strong>-<a data-name=""Instant Fusion"">Instant Fusion</a>: </strong>Thousand-eyes/Millennium-eyes into Restrict Anima, but that is probably a long stretch, both targets can be summoned w/ <strong>Magician's Restage</strong></span>  <hr />  <span><strong>Extra-deck explained:</strong></span>  <span>[5-6]cards of the deck is a fusion toolbox consisting of <strong>2 Witchcrafter Vice-master</strong>, Super-poly targets and/or instant fusion targets. Since the inclusion of the a Witchcrafter fusion monster, I've found success and synergy in using instant fusion, super polymerization. This can be reduced to 3 slots if you side/remove super-poly </span>  <span>[1 slot for a level 8 synchro], I've found most success with <strong>Chaos ruler </strong>since it can set up the graveyard for you and it can revive itself once very easily to go into access-code talker finisher, but the options are limitless depending on what you feel you need for the deck</span>  <span>[1 slot for a Rank8] <strong>Witchcrafter</strong> <b>Aruru, Madame Verre, and Vice-master are all level 8</b>: some viable options can include <strong>Dingirsu/Sanaphond the Skyprison/Number 38: Hope Harbinger/ Lancelot, </strong>the option to run a Rank8 is optional and running more than 1 is unnecessary since it rarely comes up</span>  <span>[Rest of the ExtraDeck is Links]</span>  <span><strong>Charmers</strong> compliment the deck very well, not only because they are cute girls as well, but because you run a diverse attribute of spellcasters. The most viable ones are probably Hiita, Aussa, and Lyna: most because they can summon handtraps from your opponents deck Ash Blossom/Ghost belle/Effect Veiler respectively, this sets up a guaranteed Link 3 into Selene.</span>  <span><strong>Selene + AccessCode</strong> Talker are an expensive duo to run, but it is a game closer, Access code's 5300 atk + Vice-master's 2700 atk = a clean 8000 damage, together you are guaranteed  from minimum 3 to 4 pops on the field at least, this will win you games on its own not much to say</span>  <span><strong>Artemis/Anima/Linkuriboh </strong>can place your Witchcrafters in deck, all 3 are good in certain situations but above all Artemis has the most versatility since it can be made by any of the small Witchcrafters and is a spellcaster, anima is also a spellcaster and it can catch your opponent offguard, but is a side option since they are less likely to fall for the same trick twice. Linkuriboh can be useful to blink Genni, souls and the restricts but sadly it isn't a spellcaster, so I don't blame you if you don't run it, but on field it can save you from an attack.</span>  <span><strong>Verte Anaconda/Psyframelord Lambda </strong>verte has 3 targets in deck superpoly/instant fusion/Witchcrafter confusion and if you are really bold magicalized fusion is a tech option, but try to banish souls/restrict/anima/any charmer instead of 2 Witchcrafters, since you can make use of the Witchcrafters effect or revive them with holiday. Psyframelord is a generic Link-2 that is light that can turn a dead gamma in your hand live in worst case scenario. </span>  <span>The healthy amount of Dark and light in the extradeck makes reborning Chaos Lord very easy, but it is banished when it leaves the field...unless you make a rank 8 and  detach it then you can do it again.</span>"
